id,conversation_id,created_at,date,time,timezone,user_id,username,name,place,tweet,language,mentions,urls,photos,replies_count,retweets_count,likes_count,hashtags,cashtags,link,retweet,quote_url,video,thumbnail,near,geo,source,user_rt_id,user_rt,retweet_id,reply_to,retweet_date,translate,trans_src,trans_dest
1362557952515710978,1362352951537246219,2021-02-19 08:21:45 +08,2021-02-19,08:21:45,+0800,38830109,hovsjovs,Jovi Ho,,@whyzeewhy with WhatsApp's privacy settings they're basically exhibitionists,en,[],[],[],0,0,3,[],[],https://twitter.com/hovsjovs/status/1362557952515710978,False,,0,,Singapore,,,,,,"[{'screen_name': 'whyzeewhy', 'name': 'Zhong Ying', 'id': '464254721'}]",,,,
1362499763027935232,1362499763027935232,2021-02-19 04:30:32 +08,2021-02-19,04:30:32,+0800,113614082,eurekamag,EurekaMag,,"Health Information Systems in the Digital Health Ecosystem-Problems and Solutions for Ethics, Trust and Privacy  https://t.co/XFGhjnaFZL",en,[],['http://dlvr.it/Rt0XgV'],[],0,2,0,[],[],https://twitter.com/EurekaMag/status/1362499763027935232,False,,0,,Singapore,,,,,,[],,,,
1362446100020428801,1362436399455158277,2021-02-19 00:57:17 +08,2021-02-19,00:57:17,+0800,1227439745468424193,vressentials1,VRESSENTIALS,,@NathieVR Did u see the news about Facebook banning access to viewing or sharing news in Australia today? @NathieVR  big blow to freedom of speech and the future of privacy on the Facebook oculus platform,en,"[{'screen_name': 'nathievr', 'name': 'nathie', 'id': '148424079'}]",[],[],2,0,2,[],[],https://twitter.com/VRESSENTIALS1/status/1362446100020428801,False,,0,,Singapore,,,,,,"[{'screen_name': 'NathieVR', 'name': 'Nathie', 'id': '148424079'}]",,,,
1362445087989374980,1362445087989374980,2021-02-19 00:53:16 +08,2021-02-19,00:53:16,+0800,2257436000,fiirhmdhn,kweekytwist,,Cobaaa ajaa whatsapp kek Telegram Ada fitur privacy utk gbisa ditelfon oleh siapapun :) Kan seru juga tuh,in,[],[],[],0,0,0,[],[],https://twitter.com/fiirhmdhn/status/1362445087989374980,False,,0,,Singapore,,,,,,[],,,,
1362441287224283136,1362441287224283136,2021-02-19 00:38:10 +08,2021-02-19,00:38:10,+0800,1161358830401282048,azrl4mri,amrii,,"tak semua benda nak expose kat media sosial dol,masalah privacy kau simpan jela ni kalau bole nak satu dunia tau malu la dol orang tengok",in,[],[],[],0,0,0,[],[],https://twitter.com/azrl4mri/status/1362441287224283136,False,,0,,Singapore,,,,,,[],,,,
1362432300403679235,1362432300403679235,2021-02-19 00:02:27 +08,2021-02-19,00:02:27,+0800,2345469938,adathorium,-=|| ΔDΔΤΗΘΓ ||=-,,"I always wondered why Linux distros are shipping with Firefox by default, but using Google as the default search engine... DDG is pretty darn awesome and not only from a privacy point of view.",en,[],[],[],0,0,0,[],[],https://twitter.com/adathorium/status/1362432300403679235,False,https://twitter.com/DuckDuckGo/status/1360238991577128960,0,,Singapore,,,,,,[],,,,
1362432018756214787,1362432018756214787,2021-02-19 00:01:20 +08,2021-02-19,00:01:20,+0800,1306396477367877634,eddlovesdebates,𝙰𝙸𝙳 ✪,,If ever u had a partner.  Give Space! Give Privacy! Give Respect!  You don't own His/Her Life. And Having those Values in a relationship makes it Healthy 😉,en,[],[],[],0,0,7,[],[],https://twitter.com/EddlovesDebates/status/1362432018756214787,False,,0,,Singapore,,,,,,[],,,,
1362411506416156672,1362411506416156672,2021-02-18 22:39:50 +08,2021-02-18,22:39:50,+0800,81995443,mdrustam4,mohammad Rustam,,"#Fractalfreeweb  How will $FCL ensure the user awareness ,about what data should be shared and its short to Long term impact on user data privacy. Are you #GDPR compliant ?",en,[],[],[],0,0,1,"['fractalfreeweb', 'gdpr']",['fcl'],https://twitter.com/mdrustam4/status/1362411506416156672,False,https://twitter.com/fractalprtcl/status/1362407841500389381,0,,Singapore,,,,,,[],,,,
1362393902976655367,1362378084222074880,2021-02-18 21:29:53 +08,2021-02-18,21:29:53,+0800,1235073414445985793,kxoxosb19,K xoxo SB19 💋,,@ShineBright19x Awww. Bakit naman ganon?😞 Respect other’s privacy.,tl,[],[],[],0,0,1,[],[],https://twitter.com/kxoxosb19/status/1362393902976655367,False,,0,,Singapore,,,,,,"[{'screen_name': 'ShineBright19x', 'name': 'Shine | para sa #SB19 ✨', 'id': '1028527831372853248'}]",,,,
1362373857487646721,1362373857487646721,2021-02-18 20:10:13 +08,2021-02-18,20:10:13,+0800,1357150497644285953,hetty_hp,yamohnnn,,"GIVE BACK HUMAN RIGHTS.                      China loves to invade people’s privacy for sure. And China also have no sense of guilt and shame when saying ‘it’s internal affair of Myanmar’ and yet covering Military Junta, Min Aung Hlaing’s ass. #WhatsHappeninglnMyanmar #Feb18Coup",en,[],[],[],0,0,0,"['whatshappeninglnmyanmar', 'feb18coup']",[],https://twitter.com/hetty_hp/status/1362373857487646721,False,https://twitter.com/KenRoth/status/1362360221297950724,0,,Singapore,,,,,,[],,,,
1362346498630029312,1362320953099829253,2021-02-18 18:21:31 +08,2021-02-18,18:21:31,+0800,811087,ehn,Andreas Ehn,,"@Wildreamz @culturestate @benedictevans Apple's privacy focus I find conveniently self-serving. Of the big tech companies, it is the worst at using data or even building online services. Might as well turn a weakness into a strength by publicly focusing on privacy.",en,[],[],[],0,0,3,[],[],https://twitter.com/ehn/status/1362346498630029312,False,,0,,Singapore,,,,,,"[{'screen_name': 'Wildreamz', 'name': 'Wildreamz', 'id': '47566343'}, {'screen_name': 'culturestate', 'name': 'Shane Cole', 'id': '6878522'}, {'screen_name': 'benedictevans', 'name': 'Benedict Evans', 'id': '1236101'}]",,,,
1362346416815960064,1362320953099829253,2021-02-18 18:21:11 +08,2021-02-18,18:21:11,+0800,811087,ehn,Andreas Ehn,,"@Wildreamz @culturestate @benedictevans Fair enough. I obviously respect your choice of products/suppliers.  Revealed preferences have repeatedly shown that privacy ranks very low for most users, regardless of stated preferences.  Perhaps that is changing. Remains to be seen.",en,[],[],[],2,0,1,[],[],https://twitter.com/ehn/status/1362346416815960064,False,,0,,Singapore,,,,,,"[{'screen_name': 'Wildreamz', 'name': 'Wildreamz', 'id': '47566343'}, {'screen_name': 'culturestate', 'name': 'Shane Cole', 'id': '6878522'}, {'screen_name': 'benedictevans', 'name': 'Benedict Evans', 'id': '1236101'}]",,,,
1362344751974936576,1362320953099829253,2021-02-18 18:14:34 +08,2021-02-18,18:14:34,+0800,47566343,wildreamz,Wildreamz,,"@ehn @culturestate @benedictevans I'm giving you my POV as a user. I want my privacy, security, and rights to be respected. I want my best interests to be considered in excruciating detail; even when I didn't ask for it.  FB doesn't do that. Other companies do.   https://t.co/J5iBFBVl2I   https://t.co/8OoVLFeocT",en,[],"['https://blog.cloudflare.com/announcing-the-results-of-the-1-1-1-1-public-dns-resolver-privacy-examination/', 'https://www.youtube.com/watch?v=39iKLwlUqBo']",[],1,0,1,[],[],https://twitter.com/Wildreamz/status/1362344751974936576,False,,0,,Singapore,,,,,,"[{'screen_name': 'ehn', 'name': 'Andreas Ehn', 'id': '811087'}, {'screen_name': 'culturestate', 'name': 'Shane Cole', 'id': '6878522'}, {'screen_name': 'benedictevans', 'name': 'Benedict Evans', 'id': '1236101'}]",,,,
1362334992395771906,1362320953099829253,2021-02-18 17:35:47 +08,2021-02-18,17:35:47,+0800,47566343,wildreamz,Wildreamz,,"@ehn @culturestate @benedictevans I'll list two:   (1) Good faith: minimizing data-collection for the best interest (safety, privacy, security) of users. Bad-faith: maximizing data-collection for most business leverage.   https://t.co/16K3AdRe2k",en,[],['https://www.forbes.com/sites/zakdoffman/2021/01/16/stop-using-facebook-messenger-after-whatsapp-vs-apple-imessage-and-signal-privacy-backlash/?sh=561a9abb4650'],[],2,0,1,[],[],https://twitter.com/Wildreamz/status/1362334992395771906,False,,0,,Singapore,,,,,,"[{'screen_name': 'ehn', 'name': 'Andreas Ehn', 'id': '811087'}, {'screen_name': 'culturestate', 'name': 'Shane Cole', 'id': '6878522'}, {'screen_name': 'benedictevans', 'name': 'Benedict Evans', 'id': '1236101'}]",,,,
1362320954458742784,1362320954458742784,2021-02-18 16:40:00 +08,2021-02-18,16:40:00,+0800,1324258969,azmanisrak,AzmanIsrak,,"Setiap orang ada masalahnya yang tersendiri, setiap individu perlukan privacy mereka sendiri.",in,[],[],[],0,0,0,[],[],https://twitter.com/AzmanIsrak/status/1362320954458742784,False,,0,,Singapore,,,,,,[],,,,
1362314115633475587,1362314115633475587,2021-02-18 16:12:50 +08,2021-02-18,16:12:50,+0800,10240622,chrisloeffen,Chris Loeffen,,$FCL changing the way your privacy is valued,en,[],[],[],0,0,0,[],['fcl'],https://twitter.com/ChrisLoeffen/status/1362314115633475587,False,https://twitter.com/fractalprtcl/status/1361312410792001536,0,,Singapore,,,,,,[],,,,
1362311949804003329,1362311949804003329,2021-02-18 16:04:14 +08,2021-02-18,16:04:14,+0800,1037366296122413063,sebastianpetr12,Sebastian petrosi,,Venmo is more revealing than social media via /r/privacy  https://t.co/ibSxElEREO,en,[],['https://ift.tt/3jZc82X'],[],0,0,0,[],[],https://twitter.com/Sebastianpetr12/status/1362311949804003329,False,,0,,Singapore,,,,,,[],,,,
1362311947945967616,1362311947945967616,2021-02-18 16:04:13 +08,2021-02-18,16:04:13,+0800,1037366296122413063,sebastianpetr12,Sebastian petrosi,,Trying to degoogle via /r/privacy  https://t.co/nHF6gn2kLx,en,[],['https://ift.tt/2OJFV41'],[],0,0,0,[],[],https://twitter.com/Sebastianpetr12/status/1362311947945967616,False,,0,,Singapore,,,,,,[],,,,
1362311945928515586,1362311945928515586,2021-02-18 16:04:13 +08,2021-02-18,16:04:13,+0800,1037366296122413063,sebastianpetr12,Sebastian petrosi,,"My digital privacy journey (aka DeGoogle and others), if you are curious to see the steps I took then look within. via /r/privacy  https://t.co/nH7pGTkmdu",en,[],['https://ift.tt/3ub7aVB'],[],0,0,0,[],[],https://twitter.com/Sebastianpetr12/status/1362311945928515586,False,,0,,Singapore,,,,,,[],,,,
1362311944426946561,1362311944426946561,2021-02-18 16:04:12 +08,2021-02-18,16:04:12,+0800,1037366296122413063,sebastianpetr12,Sebastian petrosi,,Quad9 moves to Switzerland! via /r/privacy  https://t.co/mee3hGqrCw,en,[],['https://ift.tt/2OH5EtT'],[],0,0,1,[],[],https://twitter.com/Sebastianpetr12/status/1362311944426946561,False,,0,,Singapore,,,,,,[],,,,
1362311943076347905,1362311943076347905,2021-02-18 16:04:12 +08,2021-02-18,16:04:12,+0800,1037366296122413063,sebastianpetr12,Sebastian petrosi,,Signal Needs to do Better For its Response to the Anti-Censorship Community via /r/privacy  https://t.co/DbjP0jKSDb,en,[],['https://ift.tt/3k9GNuF'],[],0,0,0,[],[],https://twitter.com/Sebastianpetr12/status/1362311943076347905,False,,0,,Singapore,,,,,,[],,,,
1362311941562236935,1362311941562236935,2021-02-18 16:04:12 +08,2021-02-18,16:04:12,+0800,1037366296122413063,sebastianpetr12,Sebastian petrosi,,Youtube asked me to prove my age identify with a credit card wtf? via /r/privacy  https://t.co/lMbvBECbuB,en,[],['https://ift.tt/3u8qLpj'],[],0,0,0,[],[],https://twitter.com/Sebastianpetr12/status/1362311941562236935,False,,0,,Singapore,,,,,,[],,,,
1362311939255394305,1362311939255394305,2021-02-18 16:04:11 +08,2021-02-18,16:04:11,+0800,1037366296122413063,sebastianpetr12,Sebastian petrosi,,EU Partition to ban on biometric mass surveillance practices - Facial recognition can and will be used against each of us by governments and corporations - based on who we are and what we look like via /r/privacy  https://t.co/GFDoJLooZH,en,[],['https://ift.tt/3bfowrx'],[],0,0,0,[],[],https://twitter.com/Sebastianpetr12/status/1362311939255394305,False,,0,,Singapore,,,,,,[],,,,
1362311937728643073,1362311937728643073,2021-02-18 16:04:11 +08,2021-02-18,16:04:11,+0800,1037366296122413063,sebastianpetr12,Sebastian petrosi,,Italy fines Facebook €7M for repeated data violations via /r/privacy  https://t.co/SJUsypMleo,en,[],['https://ift.tt/3u6XLy7'],[],0,0,0,[],[],https://twitter.com/Sebastianpetr12/status/1362311937728643073,False,,0,,Singapore,,,,,,[],,,,
1362311935333715972,1362311935333715972,2021-02-18 16:04:10 +08,2021-02-18,16:04:10,+0800,1037366296122413063,sebastianpetr12,Sebastian petrosi,,Facebook cuts Australia off from the world via /r/privacy  https://t.co/8MXvNGZqBM,en,[],['https://ift.tt/3qzKH2i'],[],0,0,0,[],[],https://twitter.com/Sebastianpetr12/status/1362311935333715972,False,,0,,Singapore,,,,,,[],,,,
1362287264441634817,1362256919898030080,2021-02-18 14:26:08 +08,2021-02-18,14:26:08,+0800,852923461567631360,solololojen,jennie rapper,,"@jnkim @YouTube @TeamYouTube .@YouTube  .@TeamYouTube  .@ygent_official   https://t.co/9bjajzFBs1 Please delete this video from youtube user 가로세로연구소. This is spreading false information about Jennie's, at the same time releasing unverified, personal details about her . Protect and respect her privacy.",en,"[{'screen_name': 'youtube', 'name': 'youtube', 'id': '10228272'}, {'screen_name': 'teamyoutube', 'name': 'teamyoutube', 'id': '3031071234'}, {'screen_name': 'ygent_official', 'name': 'yg family', 'id': '408177579'}]",['http://youtu.be/RX94FaKPj4A'],[],0,0,0,[],[],https://twitter.com/solololojen/status/1362287264441634817,False,,0,,Singapore,,,,,,"[{'screen_name': 'jnkim', 'name': 'lana ✯', 'id': '1151209181791293440'}, {'screen_name': 'YouTube', 'name': 'YouTube', 'id': '10228272'}, {'screen_name': 'TeamYouTube', 'name': 'TeamYouTube', 'id': '3031071234'}]",,,,
1362287168245297157,1362265481248313344,2021-02-18 14:25:45 +08,2021-02-18,14:25:45,+0800,852923461567631360,solololojen,jennie rapper,,"@protectJ116 @YouTube @TeamYouTube @ygent_official .@YouTube  .@TeamYouTube  .@ygent_official   https://t.co/9bjajzFBs1 Please delete this video from youtube user 가로세로연구소. This is spreading false information about Jennie's, at the same time releasing unverified, personal details about her . Protect and respect her privacy.",en,"[{'screen_name': 'youtube', 'name': 'youtube', 'id': '10228272'}, {'screen_name': 'teamyoutube', 'name': 'teamyoutube', 'id': '3031071234'}, {'screen_name': 'ygent_official', 'name': 'yg family', 'id': '408177579'}]",['http://youtu.be/RX94FaKPj4A'],[],0,0,0,[],[],https://twitter.com/solololojen/status/1362287168245297157,False,,0,,Singapore,,,,,,"[{'screen_name': 'protectJ116', 'name': 'PROTECT JENNIE', 'id': '1204647156679753728'}, {'screen_name': 'YouTube', 'name': 'YouTube', 'id': '10228272'}, {'screen_name': 'TeamYouTube', 'name': 'TeamYouTube', 'id': '3031071234'}, {'screen_name': 'ygent_official', 'name': 'YG FAMILY', 'id': '408177579'}]",,,,
1362281745874231297,1362070382379868163,2021-02-18 14:04:12 +08,2021-02-18,14:04:12,+0800,852923461567631360,solololojen,jennie rapper,,"@NEWSJENNIE_ @YouTube @TeamYouTube @ygent_official .@YouTube  .@TeamYouTube  .@ygent_official   https://t.co/9bjajzFBs1 Please delete this video from youtube user 가로세로연구소. This is spreading false information about Jennie's, at the same time releasing unverified, personal details about her . Protect and respect her privacy.",en,"[{'screen_name': 'youtube', 'name': 'youtube', 'id': '10228272'}, {'screen_name': 'teamyoutube', 'name': 'teamyoutube', 'id': '3031071234'}, {'screen_name': 'ygent_official', 'name': 'yg family', 'id': '408177579'}]",['http://youtu.be/RX94FaKPj4A'],[],0,0,0,[],[],https://twitter.com/solololojen/status/1362281745874231297,False,,0,,Singapore,,,,,,"[{'screen_name': 'NEWSJENNIE_', 'name': 'NEWSJENNIE', 'id': '1227789094987522048'}, {'screen_name': 'YouTube', 'name': 'YouTube', 'id': '10228272'}, {'screen_name': 'TeamYouTube', 'name': 'TeamYouTube', 'id': '3031071234'}, {'screen_name': 'ygent_official', 'name': 'YG FAMILY', 'id': '408177579'}]",,,,
1362281673031786499,1362261401306292224,2021-02-18 14:03:55 +08,2021-02-18,14:03:55,+0800,852923461567631360,solololojen,jennie rapper,,"@jnkloops @YouTube @TeamYouTube @ygent_official .@YouTube  .@TeamYouTube  .@ygent_official   https://t.co/9bjajzFBs1 Please delete this video from youtube user 가로세로연구소. This is spreading false information about Jennie's, at the same time releasing unverified, personal details about her . Protect and respect her privacy.",en,"[{'screen_name': 'youtube', 'name': 'youtube', 'id': '10228272'}, {'screen_name': 'teamyoutube', 'name': 'teamyoutube', 'id': '3031071234'}, {'screen_name': 'ygent_official', 'name': 'yg family', 'id': '408177579'}]",['http://youtu.be/RX94FaKPj4A'],[],0,0,0,[],[],https://twitter.com/solololojen/status/1362281673031786499,False,,0,,Singapore,,,,,,"[{'screen_name': 'jnkloops', 'name': 'jennie loops', 'id': '909510606516039680'}, {'screen_name': 'YouTube', 'name': 'YouTube', 'id': '10228272'}, {'screen_name': 'TeamYouTube', 'name': 'TeamYouTube', 'id': '3031071234'}, {'screen_name': 'ygent_official', 'name': 'YG FAMILY', 'id': '408177579'}]",,,,
1362280755578167302,1362280755578167302,2021-02-18 14:00:16 +08,2021-02-18,14:00:16,+0800,895929206013480960,krasiaofficial,KrASIA,,"Following the military coup, the new imposed cybersecurity bill will strip the Myanmese of their privacy to their own data. Gain insights on how this bill would affect Myanmar.   https://t.co/LEEkaqDHvU",en,[],['https://kr-asia.com/myanmars-cybersecurity-bill-will-take-us-back-to-the-stone-age-expert-warns'],[],0,0,0,[],[],https://twitter.com/KrASIAofficial/status/1362280755578167302,False,,0,,Singapore,,,,,,[],,,,
1362277029886889985,1362070382379868163,2021-02-18 13:45:28 +08,2021-02-18,13:45:28,+0800,1126482212994502657,pinkrosiepoop,°,,"@NEWSJENNIE_ @YouTube @TeamYouTube @ygent_official .@YouTube .@TeamYouTube .@ygent_official    https://t.co/5t1MqdF9Lm Please delete this video from youtube user 가로세로연구소. This is spreading false information about Jennie's, at the same time releasing unverified, personal details about her . Protect and respect her privacy.",en,"[{'screen_name': 'youtube', 'name': 'youtube', 'id': '10228272'}, {'screen_name': 'teamyoutube', 'name': 'teamyoutube', 'id': '3031071234'}, {'screen_name': 'ygent_official', 'name': 'yg family', 'id': '408177579'}]",['http://youtu.be/RX94FaKPj4A'],[],0,0,0,[],[],https://twitter.com/pinkrosiepoop/status/1362277029886889985,False,,0,,Singapore,,,,,,"[{'screen_name': 'NEWSJENNIE_', 'name': 'NEWSJENNIE', 'id': '1227789094987522048'}, {'screen_name': 'YouTube', 'name': 'YouTube', 'id': '10228272'}, {'screen_name': 'TeamYouTube', 'name': 'TeamYouTube', 'id': '3031071234'}, {'screen_name': 'ygent_official', 'name': 'YG FAMILY', 'id': '408177579'}]",,,,
1362265414672080897,1362265344446926849,2021-02-18 12:59:19 +08,2021-02-18,12:59:19,+0800,1325330535850283010,qaetest,QAE,,#qae #riskmanagement #internalrisk #internalcontrol #duediligence #cybersecurity #security #infosecurity #FinTech #data #privacy #internalprocess,und,[],[],[],0,1,1,"['qae', 'riskmanagement', 'internalrisk', 'internalcontrol', 'duediligence', 'cybersecurity', 'security', 'infosecurity', 'fintech', 'data', 'privacy', 'internalprocess']",[],https://twitter.com/qaetest/status/1362265414672080897,False,,0,,Singapore,,,,,,[],,,,
1362242173194760192,1362242170552344576,2021-02-18 11:26:57 +08,2021-02-18,11:26:57,+0800,781136369343016960,feliccine,𝐅𝐄𝐋𝐈𝐂𝐂𝐈𝐍𝐄,,While on @WhatsApp the sticker from outside party apps not moving at all. Less option for fun side. I think the app focusing on fun part - strict other apps to transfer sticker instead focusing on privacy. The WhatsApp stories part is the lousy features ever.,en,"[{'screen_name': 'whatsapp', 'name': 'whatsapp', 'id': '40148479'}]",[],[],1,0,0,[],[],https://twitter.com/feliccine/status/1362242173194760192,False,,0,,Singapore,,,,,,[],,,,
1362235394176221188,1362235394176221188,2021-02-18 11:00:01 +08,2021-02-18,11:00:01,+0800,2888702530,fossasiasg,FOSSASIA Summit,,"Pulkit Kashyap @kpulkit29 software engineer @wingify and winner @codeheat_ will speak about “Increasing Concern over #Privacy”@FOSSASIA #virtual #OpenSource #OpenTech Summit 2021, March 13-21. Register for free  https://t.co/Rg5SfjGDGd  https://t.co/5K9NLsj4Vj",en,"[{'screen_name': 'kpulkit29', 'name': 'pulkit kashyap', 'id': '1150306827873087489'}, {'screen_name': 'wingify', 'name': 'wingify', 'id': '29658046'}, {'screen_name': 'codeheat_', 'name': '#codeheat', 'id': '2888682557'}, {'screen_name': 'fossasia', 'name': 'fossasia', 'id': '157702526'}]",['https://eventyay.com/e/fa96ae2c'],['https://pbs.twimg.com/media/EuU1qJ9XUAIhZCx.png'],0,4,4,"['privacy', 'virtual', 'opensource', 'opentech']",[],https://twitter.com/fossasiasg/status/1362235394176221188,False,,1,https://pbs.twimg.com/media/EuU1qJ9XUAIhZCx.png,Singapore,,,,,,[],,,,
1362223150885269504,1362223150885269504,2021-02-18 10:11:22 +08,2021-02-18,10:11:22,+0800,1270545588816187392,sillyduckvpn,Silly Duck VPN,,"With encryption, ads can't target your web history or past searches. This means that businesses and the government are not able to spy on you.  #VPN #CyberSecurity #DataPrivacy #Privacy #IoT #DataProtection #Security #DataSecurity #DigitalEconomy #Proxy #Firewall #WiFi  https://t.co/BNNWWLQW0J",en,[],[],['https://pbs.twimg.com/tweet_video_thumb/EueWueyVEAIND0l.jpg'],0,5,2,"['vpn', 'cybersecurity', 'dataprivacy', 'privacy', 'iot', 'dataprotection', 'security', 'datasecurity', 'digitaleconomy', 'proxy', 'firewall', 'wifi']",[],https://twitter.com/SillyDuckVpn/status/1362223150885269504,False,,1,https://pbs.twimg.com/tweet_video_thumb/EueWueyVEAIND0l.jpg,Singapore,,,,,,[],,,,
1362205199784312834,1362205199784312834,2021-02-18 09:00:02 +08,2021-02-18,09:00:02,+0800,1274234569445609472,m_lahierre,"Mathieu LAHIERRE | CISM,CISA,CRISC,CDPSE, CBSP",,Which states are getting into the data privacy game? #cybersecurity #cyber #databreach #insiderthreat #infosec #dataprotection #datasecurity #dataprivacy #cyberwarfare  https://t.co/11RuVXNgPG,en,[],['https://lnkd.in/gfYc9YV'],[],0,4,3,"['cybersecurity', 'cyber', 'databreach', 'insiderthreat', 'infosec', 'dataprotection', 'datasecurity', 'dataprivacy', 'cyberwarfare']",[],https://twitter.com/m_lahierre/status/1362205199784312834,False,,0,,Singapore,,,,,,[],,,,
1362196599934361600,1362196594423001089,2021-02-18 08:25:52 +08,2021-02-18,08:25:52,+0800,776107104180600832,rzshokri,Reza Shokri,,For comparison: Composition-based analysis significantly overestimates the privacy loss of the released model by accounting for the privacy loss throughout training (as if all the intermediate model parameters are observable to adversary).,en,[],[],[],1,0,1,[],[],https://twitter.com/rzshokri/status/1362196599934361600,False,,0,,Singapore,,,,,,[],,,,
1362196596893474816,1362196594423001089,2021-02-18 08:25:51 +08,2021-02-18,08:25:51,+0800,776107104180600832,rzshokri,Reza Shokri,,"We compute a bound on the contribution of each training epoch to the final privacy loss, and show how this contribution diminishes as the accumulated privacy loss increases over training.  We prove the convergence of the DP bound, and show it is tight.",en,[],[],[],1,0,0,[],[],https://twitter.com/rzshokri/status/1362196596893474816,False,,0,,Singapore,,,,,,[],,,,
1362196594423001089,1362196594423001089,2021-02-18 08:25:51 +08,2021-02-18,08:25:51,+0800,776107104180600832,rzshokri,Reza Shokri,,"We analyze the dynamics of privacy loss to address a major challenge in differential privacy for iterative ML algorithms: quantifying the privacy loss of the “released” model, when internal state of the algorithm (i.e., intermediate params) is private.  https://t.co/R66Dh1cnuI  https://t.co/hpJOVaY6gC",en,[],['https://arxiv.org/pdf/2102.05855'],['https://pbs.twimg.com/media/Eud-lHmVEAQutNC.jpg'],5,8,49,[],[],https://twitter.com/rzshokri/status/1362196594423001089,False,,1,https://pbs.twimg.com/media/Eud-lHmVEAQutNC.jpg,Singapore,,,,,,[],,,,
1362187790373425152,1361928305314721794,2021-02-18 07:50:52 +08,2021-02-18,07:50:52,+0800,2940283850,mithila_palkat,Mithila Palkat,,"@CryptoNationIN @shuttle_one What do you think of a public chain with privacy features? Many public chains are considering adding privacy features, such as adding zero-knowledge proofs, will ShuttleOne develop in this field?",en,[],[],[],0,0,0,[],[],https://twitter.com/Mithila_Palkat/status/1362187790373425152,False,,0,,Singapore,,,,,,"[{'screen_name': 'CryptoNationIN', 'name': 'Crypto^^Nation - Global Community', 'id': '1160292723502411777'}, {'screen_name': 'shuttle_one', 'name': 'ShuttleOne🚀', 'id': '1168082805940613120'}]",,,,
1362179164338495488,1362179164338495488,2021-02-18 07:16:35 +08,2021-02-18,07:16:35,+0800,1187510434884210688,lharramae1228,Lharra❤️💯💯,,Here is the over view about @ethbox_official 💪👀  ✨ Provides an escrow service more on security privacy and OTC effectiveness ✨ Fair and mutually beneficial for both parties ✨ Farmcubation @dao_duck  @KVESTOR11 @Bullrun_Gravano @elonmusk   #EBOX $EBOX $BTC $BNB,en,"[{'screen_name': 'ethbox_official', 'name': 'ethbox', 'id': '1325567419268599808'}, {'screen_name': 'dao_duck', 'name': 'duckdao incubator 🐣', 'id': '1293614926582427650'}, {'screen_name': 'kvestor11', 'name': 'kvestor', 'id': '904229287154221056'}, {'screen_name': 'bullrun_gravano', 'name': '𝐁𝐮𝐥𝐥𝐫𝐮𝐧 𝐆𝐫𝐚𝐯𝐚𝐧𝐨', 'id': '999367950841806849'}, {'screen_name': 'elonmusk', 'name': 'elon musk', 'id': '44196397'}]",[],[],0,0,0,['ebox'],"['ebox', 'btc', 'bnb']",https://twitter.com/Lharramae1228/status/1362179164338495488,False,https://twitter.com/top7ico/status/1362043611769167872,0,,Singapore,,,,,,[],,,,
1362159894086840324,1362159894086840324,2021-02-18 06:00:01 +08,2021-02-18,06:00:01,+0800,28079668,acele,Alvin Lee,,Location privacy in the age of the internet of everything  https://t.co/1R6PclEUl8,en,[],['https://lnkd.in/gD6dSSx'],[],0,0,0,[],[],https://twitter.com/acele/status/1362159894086840324,False,,0,,Singapore,,,,,,[],,,,
