id,conversation_id,created_at,date,time,timezone,user_id,username,name,place,tweet,language,mentions,urls,photos,replies_count,retweets_count,likes_count,hashtags,cashtags,link,retweet,quote_url,video,thumbnail,near,geo,source,user_rt_id,user_rt,retweet_id,reply_to,retweet_date,translate,trans_src,trans_dest
1363694482118430726,1363629054021271558,2021-02-22 11:37:55 +08,2021-02-22,11:37:55,+0800,958012484736106496,galatianbensolo,.,,"@amoreusous2 Actually its true, Because to their friends &amp; Family members, its like the beloved ones had his own privacy invaded, if he's a family man with wife/kid, or she's married, it's hard for their family.",en,[],[],[],0,0,2,[],[],https://twitter.com/galatianBenSolo/status/1363694482118430726,False,,0,,Singapore,,,,,,"[{'screen_name': 'amoreusous2', 'name': 'feminist of Naboo 🦋', 'id': '993172117272367106'}]",,,,
1363686415729520641,1363686415729520641,2021-02-22 11:05:52 +08,2021-02-22,11:05:52,+0800,21636110,gdbala,Balasubramaniam GD,,Lawmakers from the U.K. and Canada criticized Facebook’s ban on Australian users sharing news articles #Privacy #Facebook   https://t.co/fvnUb4zbZ6,en,[],['https://www.wsj.com/articles/lawmakers-in-u-k-canada-slam-facebook-after-australia-news-blackout-11613735931'],[],0,0,0,"['privacy', 'facebook']",[],https://twitter.com/GDBALA/status/1363686415729520641,False,,0,,Singapore,,,,,,[],,,,
1363670649026191360,1363666022222336002,2021-02-22 10:03:13 +08,2021-02-22,10:03:13,+0800,1728700628,raihan_azali,Rayhan Adam,,@CryptoFinally $Dero Homomorphic encryption  Privacy smart contracts,en,[],[],[],0,0,1,[],['dero'],https://twitter.com/raihan_azali/status/1363670649026191360,False,,0,,Singapore,,,,,,"[{'screen_name': 'CryptoFinally', 'name': 'CryptoFinally 💫', 'id': '1042176455088726016'}]",,,,
1363668807655432194,1363668807655432194,2021-02-22 09:55:54 +08,2021-02-22,09:55:54,+0800,1270545588816187392,sillyduckvpn,Silly Duck VPN,,"For most VPNs, there is a list of available servers upon logging in. Select one that you prefer and connect to it.  Learn more -  https://t.co/IaOxUDPAE9  #VPN #CyberSecurity #DataPrivacy #Privacy #IoT #DataProtection #Security #DataSecurity #DigitalEconomy #Proxy #Firewall #WiFi  https://t.co/NLsQ1ixgkd",en,[],['https://sillyducknet.com/newsDetail.html?id=22'],['https://pbs.twimg.com/media/Euy5hxQVIAIMQc4.jpg'],0,0,0,"['vpn', 'cybersecurity', 'dataprivacy', 'privacy', 'iot', 'dataprotection', 'security', 'datasecurity', 'digitaleconomy', 'proxy', 'firewall', 'wifi']",[],https://twitter.com/SillyDuckVpn/status/1363668807655432194,False,,1,https://pbs.twimg.com/media/Euy5hxQVIAIMQc4.jpg,Singapore,,,,,,[],,,,
1363661275432067079,1363657154100559874,2021-02-22 09:25:58 +08,2021-02-22,09:25:58,+0800,2355872630,greatgrandbear,lastbattle,,"@aantonop Yup, I get that. It does not matter much for my use case.  Building a business off someone’s platform that isn’t open is never a good idea after reaching a certain size.  Case in point: Facebook vs. Apple with regards to privacy lately.",en,[],[],[],0,0,2,[],[],https://twitter.com/GreatGrandBear/status/1363661275432067079,False,,0,,Singapore,,,,,,"[{'screen_name': 'aantonop', 'name': 'Andreas (BEWARE of giveaway scams!)', 'id': '1469101279'}]",,,,
1363639644600950784,1363639644600950784,2021-02-22 08:00:01 +08,2021-02-22,08:00:01,+0800,2888702530,fossasiasg,FOSSASIA Summit,,Roland Turner @rolandturner Chief #Privacy Officer @TrustSphere founding member @hackerspaceSG &amp; organizer @FOSSASIA will host a panel discussion on “Saviour or downfall? What happens when a #FOSS project abandons #FOSS” at #FOSSASIA #Virtual #OpenSource Summit. Register now!,en,"[{'screen_name': 'rolandturner', 'name': 'roland turner', 'id': '47227143'}, {'screen_name': 'trustsphere', 'name': 'trustsphere', 'id': '362243400'}, {'screen_name': 'hackerspacesg', 'name': 'hackerspacesg', 'id': '71136691'}, {'screen_name': 'fossasia', 'name': 'fossasia', 'id': '157702526'}]",[],[],0,9,10,"['privacy', 'foss', 'foss', 'fossasia', 'virtual', 'opensource']",[],https://twitter.com/fossasiasg/status/1363639644600950784,False,,0,,Singapore,,,,,,[],,,,
1363635622431256577,1363635622431256577,2021-02-22 07:44:02 +08,2021-02-22,07:44:02,+0800,113614082,eurekamag,EurekaMag,,Privacy and Security Issues with Mobile Health Research Applications  https://t.co/B9jrN5g4jl,en,[],['http://dlvr.it/RtBbJc'],[],0,2,0,[],[],https://twitter.com/EurekaMag/status/1363635622431256577,False,,0,,Singapore,,,,,,[],,,,
1363627699474849797,1363627699474849797,2021-02-22 07:12:33 +08,2021-02-22,07:12:33,+0800,216441755,ratmedia,Kelvin Tan,,WhatsApp will basically stop working if you don't accept the new privacy policy  https://t.co/mBdkXY9umh  https://t.co/LbtmF42BsK,en,[],['http://feeds.mashable.com/~r/Mashable/~3/Vq2byLjNL0o/?utm_source=dlvr.it&utm_medium=twitter'],['https://pbs.twimg.com/media/EuyUKpoVgAA8yGJ.jpg'],0,0,0,[],[],https://twitter.com/ratmedia/status/1363627699474849797,False,,1,https://pbs.twimg.com/media/EuyUKpoVgAA8yGJ.jpg,Singapore,,,,,,[],,,,
1363557770532970502,1363526363366502403,2021-02-22 02:34:40 +08,2021-02-22,02:34:40,+0800,2682825017,xenpi,xeno,,"@appleinsider in my company nobody but me cares a fuck about privacy, they will continue to use spyware",en,[],[],[],0,0,0,[],[],https://twitter.com/xenpi/status/1363557770532970502,False,,0,,Singapore,,,,,,"[{'screen_name': 'appleinsider', 'name': 'AppleInsider', 'id': '20542450'}]",,,,
1363540553581752320,1363540553581752320,2021-02-22 01:26:15 +08,2021-02-22,01:26:15,+0800,1134494894708289537,lowkeybhabie,OnlyFans:,,"It feels so deteriorating to live with my family, I feel so unmotivated and forced to live. There’s no privacy, no personal space. Everything I do is wrong. I’ve been a neglected middle child for so long, I’ve been moulded to be independent.",en,[],[],[],1,8,19,[],[],https://twitter.com/lowkeybhabie/status/1363540553581752320,False,,0,,Singapore,,,,,,[],,,,
1363537881608843265,1363537881608843265,2021-02-22 01:15:38 +08,2021-02-22,01:15:38,+0800,1363528216556695556,gombak__boy,Leo,,"$FB is soooo cheap but the negative news just keeps coming (WhatsApp privacy, FTC regulations, and now Australian govt saga..). Are you worried as an investor? Or is it a chance to add shares? Company has such strong fundamentals but hated by the public/govts.",en,[],[],[],1,0,0,[],['fb'],https://twitter.com/Gombak__Boy/status/1363537881608843265,False,,0,,Singapore,,,,,,[],,,,
1363530647382282240,1363530647382282240,2021-02-22 00:46:54 +08,2021-02-22,00:46:54,+0800,1315926117967036416,woaimewgulf03,Mewgulf Love💕💕(rest)pero sisilip din sometimes😊,,@jiggaban_news just be like them who knows the word privacy.,en,[],[],[],0,0,0,[],[],https://twitter.com/woaimewgulf03/status/1363530647382282240,False,https://twitter.com/whippedMG/status/1363516900949434374,0,,Singapore,,,,,,[],,,,
1363503674148802561,1363503674148802561,2021-02-21 22:59:43 +08,2021-02-21,22:59:43,+0800,716171416786210816,nam1ra_,Namira ♡,,"FUCKING HATE IT WHEN U DONT ASK FOR MY PERMISSION BEFORE ENTERING INTO MY ROOM. FUCKING PRIVACY BRO, THINK!",en,[],[],[],0,0,0,[],[],https://twitter.com/nam1ra_/status/1363503674148802561,False,,0,,Singapore,,,,,,[],,,,
1363491994069262342,1363491994069262342,2021-02-21 22:13:18 +08,2021-02-21,22:13:18,+0800,26488522,isarans,🐳,,"To me being social with your friends and families, and choosing privacy should not be mutually exclusive.   But unfortunately that's the way it ks.  The most popular people are unfortunately the people who will find the least privacy",en,[],[],[],0,0,0,[],[],https://twitter.com/isarans/status/1363491994069262342,False,,0,,Singapore,,,,,,[],,,,
1363489188469948417,1363489188469948417,2021-02-21 22:02:09 +08,2021-02-21,22:02:09,+0800,2171481661,niaradean36,⇜☀️րլձરձ⁷ ʆօvعร ℳعฟ³ցնʆբ⁶🌻🌈,,What??? Why so rude? Why need to open.. can you pls give them a privacy that letter only belong in Mew's eye to read... show some respect!,en,[],[],[],0,0,2,[],[],https://twitter.com/Niaradean36/status/1363489188469948417,False,,0,,Singapore,,,,,,[],,,,
1363462524532850689,1363462524532850689,2021-02-21 20:16:12 +08,2021-02-21,20:16:12,+0800,25924647,billm9,no justice - just us.,,What happens if you don’t consent: WhatsApp won’t allow users to READ or SEND messages if they reject new privacy rules  https://t.co/JEqc7Ao6lh #,en,[],['https://www.rt.com/news/516180-whatsapp-users-privacy-block-messages/'],[],0,0,0,[],[],https://twitter.com/billm9/status/1363462524532850689,False,,0,,Singapore,,,,,,[],,,,
1363459044040708099,1363459044040708099,2021-02-21 20:02:22 +08,2021-02-21,20:02:22,+0800,1235077554475847680,pamurizalalif,Pamu Alif Rizal,,"#qwertycoin #QWC  #cryptocurrency #anonymous #privacy This project is first and foremost interesting for its concept, because saving and directing it into a prerogative of is a very valuable lesson! @Qwertycoin_QWC",en,"[{'screen_name': 'qwertycoin_qwc', 'name': 'qwertycoin', 'id': '958441966689243136'}]",[],[],0,0,0,"['qwertycoin', 'qwc', 'cryptocurrency', 'anonymous', 'privacy']",[],https://twitter.com/pamurizalalif/status/1363459044040708099,False,,0,,Singapore,,,,,,[],,,,
1363433211024539648,1363433211024539648,2021-02-21 18:19:43 +08,2021-02-21,18:19:43,+0800,295785716,kvronquillo,Kaye,,Don't  confuse secrecy with privacy.,en,[],[],[],0,1,0,[],[],https://twitter.com/kvronquillo/status/1363433211024539648,False,,0,,Singapore,,,,,,[],,,,
1363428259887677441,1363428259887677441,2021-02-21 18:00:03 +08,2021-02-21,18:00:03,+0800,1274234569445609472,m_lahierre,"Mathieu LAHIERRE | CISM,CISA,CRISC,CDPSE, CBSP",,Data Privacy + Cybersecurity Insider - February 2021 #3 #CyberRisk #cybersecurity #infosec #insiderthreat #databreach #dataprotection #datasecurity #datatheft #cyberwarfare  https://t.co/pkdSYffQWb,en,[],['https://lnkd.in/gHNAEC5'],[],0,4,2,"['cyberrisk', 'cybersecurity', 'infosec', 'insiderthreat', 'databreach', 'dataprotection', 'datasecurity', 'datatheft', 'cyberwarfare']",[],https://twitter.com/m_lahierre/status/1363428259887677441,False,,0,,Singapore,,,,,,[],,,,
1363424033686003717,1363270966697103361,2021-02-21 17:43:15 +08,2021-02-21,17:43:15,+0800,1728700628,raihan_azali,Rayhan Adam,,@CryptoFinally $Dero Homomorphic encryption  Privacy smart contract,en,[],[],[],0,0,6,[],['dero'],https://twitter.com/raihan_azali/status/1363424033686003717,False,,0,,Singapore,,,,,,"[{'screen_name': 'CryptoFinally', 'name': 'CryptoFinally 💫', 'id': '1042176455088726016'}]",,,,
1363407669072027649,1363407669072027649,2021-02-21 16:38:13 +08,2021-02-21,16:38:13,+0800,14487340,hellosigit,Sigit Adinugroho,,"So sad that Indonesian gov’t relies on Google Forms to collect data. Where’s the privacy in this? In Singapore, we use gov’t-run form platform.  https://t.co/EuDLYjMIkE",en,[],['https://form.gov.sg/'],[],0,2,3,[],[],https://twitter.com/hellosigit/status/1363407669072027649,False,,0,,Singapore,,,,,,[],,,,
1363404079964164098,1363404077967634432,2021-02-21 16:23:58 +08,2021-02-21,16:23:58,+0800,156625692,jakubtomasek,Jakub Tomášek,,I learned about @brave for the first time. Brave might be easily the third revolution in browsers! Privacy. Finally a model that can support the web ecosystem without relying on mining people for their data. I am giving it a try right now!,en,"[{'screen_name': 'brave', 'name': 'brave software', 'id': '257245904'}]",[],[],0,0,1,[],[],https://twitter.com/JakubTomasek/status/1363404079964164098,False,,0,,Singapore,,,,,,[],,,,
1363399225246105603,1363399225246105603,2021-02-21 16:04:40 +08,2021-02-21,16:04:40,+0800,1037366296122413063,sebastianpetr12,Sebastian petrosi,,How to blur house on Apple maps? via /r/privacy  https://t.co/lun2E9XEcq,en,[],['https://ift.tt/3ufzaHr'],[],0,0,0,[],[],https://twitter.com/Sebastianpetr12/status/1363399225246105603,False,,0,,Singapore,,,,,,[],,,,
1363399223182508033,1363399223182508033,2021-02-21 16:04:40 +08,2021-02-21,16:04:40,+0800,1037366296122413063,sebastianpetr12,Sebastian petrosi,,"Aside from removing exif data, what else should I do to a picture before posting it? via /r/privacy  https://t.co/dpmlp8g7DE",en,[],['https://ift.tt/2OYhAHZ'],[],0,0,0,[],[],https://twitter.com/Sebastianpetr12/status/1363399223182508033,False,,0,,Singapore,,,,,,[],,,,
1363399221332869121,1363399221332869121,2021-02-21 16:04:39 +08,2021-02-21,16:04:39,+0800,1037366296122413063,sebastianpetr12,Sebastian petrosi,,Call recorder Cube ACR privacy concerns? via /r/privacy  https://t.co/HRpsnOdnZi,en,[],['https://ift.tt/3qFoCix'],[],0,0,0,[],[],https://twitter.com/Sebastianpetr12/status/1363399221332869121,False,,0,,Singapore,,,,,,[],,,,
1363399219562881025,1363399219562881025,2021-02-21 16:04:39 +08,2021-02-21,16:04:39,+0800,1037366296122413063,sebastianpetr12,Sebastian petrosi,,"Ignoring the propaganda in the headline, why would Facebook start encryption on messenger? They have never focused on privacy, it just seems like an odd move to me. via /r/privacy  https://t.co/cZe06UXmUr",en,[],['https://ift.tt/3ukqQ9i'],[],0,0,0,[],[],https://twitter.com/Sebastianpetr12/status/1363399219562881025,False,,0,,Singapore,,,,,,[],,,,
1363399218241671169,1363399218241671169,2021-02-21 16:04:39 +08,2021-02-21,16:04:39,+0800,1037366296122413063,sebastianpetr12,Sebastian petrosi,,WhatsApp to move ahead with privacy update despite backlash via /r/privacy  https://t.co/Q1I3epNY8I,en,[],['https://ift.tt/3dzOl8v'],[],0,0,1,[],[],https://twitter.com/Sebastianpetr12/status/1363399218241671169,False,,0,,Singapore,,,,,,[],,,,
1363399216354234371,1363399216354234371,2021-02-21 16:04:38 +08,2021-02-21,16:04:38,+0800,1037366296122413063,sebastianpetr12,Sebastian petrosi,,How to stop your emails from being tracked. Pixel trackers can hide in your email images via /r/privacy  https://t.co/30sTEeL8hM,en,[],['https://ift.tt/3ka2VVB'],[],0,0,0,[],[],https://twitter.com/Sebastianpetr12/status/1363399216354234371,False,,0,,Singapore,,,,,,[],,,,
1363399215058157568,1363399215058157568,2021-02-21 16:04:38 +08,2021-02-21,16:04:38,+0800,1037366296122413063,sebastianpetr12,Sebastian petrosi,,How to be whistleblower proof with Signal ? via /r/privacy  https://t.co/So0gPyDnaz,en,[],['https://ift.tt/3pEXhvy'],[],0,0,0,[],[],https://twitter.com/Sebastianpetr12/status/1363399215058157568,False,,0,,Singapore,,,,,,[],,,,
1363399213158121472,1363399213158121472,2021-02-21 16:04:37 +08,2021-02-21,16:04:37,+0800,1037366296122413063,sebastianpetr12,Sebastian petrosi,,Walmart's terrifying shopping cart design measures your speed and heart rate (This is 2 years old but a family member sent it to me.) via /r/privacy  https://t.co/Kyav3vRaHq,en,[],['https://ift.tt/3sffvG2'],[],0,0,0,[],[],https://twitter.com/Sebastianpetr12/status/1363399213158121472,False,,0,,Singapore,,,,,,[],,,,
1363399211010715648,1363399211010715648,2021-02-21 16:04:37 +08,2021-02-21,16:04:37,+0800,1037366296122413063,sebastianpetr12,Sebastian petrosi,,"Why hot new social app Clubhouse spells nothing but trouble. The startup’s invitation-only model gives it a sheen of exclusivity, but privacy horrors lurk behind the buzz. via /r/privacy  https://t.co/3hk2PpnNz5",en,[],['https://ift.tt/3pyyUQk'],[],0,0,0,[],[],https://twitter.com/Sebastianpetr12/status/1363399211010715648,False,,0,,Singapore,,,,,,[],,,,
1363359343521918984,1363359343521918984,2021-02-21 13:26:12 +08,2021-02-21,13:26:12,+0800,21636110,gdbala,Balasubramaniam GD,,DuckDuckGo search engine - The privacy browser is growing rapidly #Privacy   https://t.co/fszDgDlgNs,en,[],['https://www.getbasicidea.com/duckduckgo-search-engine-privacy-browser/'],[],0,0,1,['privacy'],[],https://twitter.com/GDBALA/status/1363359343521918984,False,,0,,Singapore,,,,,,[],,,,
1363342950508335108,1363329426075754496,2021-02-21 12:21:03 +08,2021-02-21,12:21:03,+0800,1113761715487789058,yuenck3,yuenck3,,"@charlie_mccann @kixes aha, nanny state strikes again, invasion of old people's privacy; kixes must complain to her HK friends at Foreign Correspondents Club  (I am 74, &amp; jaywalk now and then; one day ST reporter might show my pic)  https://t.co/k7Bl6XDz8V",en,[],[],"['https://pbs.twimg.com/media/EuuQ-D6VEBIOK1j.jpg', 'https://pbs.twimg.com/media/EuuRD0RUcAIZmJ3.jpg']",0,0,1,[],[],https://twitter.com/yuenck3/status/1363342950508335108,False,,1,https://pbs.twimg.com/media/EuuQ-D6VEBIOK1j.jpg,Singapore,,,,,,"[{'screen_name': 'charlie_mccann', 'name': 'Charlie McCann', 'id': '1095165608'}, {'screen_name': 'kixes', 'name': 'Kirsten Han 韩俐颖', 'id': '27182288'}]",,,,
1363293935926276097,1362963390008713217,2021-02-21 09:06:17 +08,2021-02-21,09:06:17,+0800,11747492,bourne_2_learn,Murray Bourne,,"@QandAinPublic @_sara_jade_ @Kapow64055083 OK, so I know who it is now. Interesting discussion about the imbalance between his right to a fair trial (totally agree) and her right to privacy (she has none now).  I expect his lawyers are already at work finding dirt on her.  No wonder only 3% of complaints end in conviction",en,[],[],[],0,0,0,[],[],https://twitter.com/bourne_2_learn/status/1363293935926276097,False,,0,,Singapore,,,,,,"[{'screen_name': 'QandAinPublic', 'name': 'Jeremy Thompson', 'id': '3183961986'}, {'screen_name': '_sara_jade_', 'name': '💧Sara', 'id': '703308253'}, {'screen_name': 'Kapow64055083', 'name': 'Kate Power', 'id': '1248351871242133504'}]",,,,
1363191285922816000,1362896063988969478,2021-02-21 02:18:24 +08,2021-02-21,02:18:24,+0800,463026580,globaldrum_info,GlobalDrum™,,"@jason_kint Social is evolving? Escalating regulation, privacy, and trust will see the most progressive trusted bands own the conversation and operate diversified business models for themselves.",en,[],[],[],0,0,0,[],[],https://twitter.com/globaldrum_info/status/1363191285922816000,False,,0,,Singapore,,,,,,"[{'screen_name': 'jason_kint', 'name': 'Jason Kint', 'id': '75209239'}]",,,,
1363190650364178437,1362708777829617664,2021-02-21 02:15:52 +08,2021-02-21,02:15:52,+0800,463026580,globaldrum_info,GlobalDrum™,,"@Digbylj Social is evolving. Escalating regulation, privacy, and trust will see the most progressive brands own the conversation, and operate diversified business models for themselves.",en,[],[],[],0,0,0,[],[],https://twitter.com/globaldrum_info/status/1363190650364178437,False,,0,,Singapore,,,,,,"[{'screen_name': 'Digbylj', 'name': 'Lord Digby Jones', 'id': '2286483986'}]",,,,
1363163138141523977,1363163138141523977,2021-02-21 00:26:33 +08,2021-02-21,00:26:33,+0800,170910973,indexer_pro,Yuki 💀👹😺🙈🙉🙊,,"Monero, Ethereum Classic, VeChain Price Analysis: 20 February: Monero, the crypto-market's leading privacy coin, has had a topsy-turvy 2021. While the month of January saw XMR register brief hikes followed by ...  https://t.co/XvrhT4oVZr #bitcoin #bnb",en,[],['http://dlvr.it/Rt6x4Z'],[],0,0,0,"['bitcoin', 'bnb']",[],https://twitter.com/indexer_pro/status/1363163138141523977,False,,0,,Singapore,,,,,,[],,,,
1363163096945164288,1363163096945164288,2021-02-21 00:26:23 +08,2021-02-21,00:26:23,+0800,2888702530,fossasiasg,FOSSASIA Summit,,"Augustine Correa @TalkOrTweets from @hackmum #India will give a talk on ""Who are you? Identity on the #Web” @FOSSASIA #Virtual #OpenTech Summit 2021, March 13-21 #OpenSource #Security #Privacy #OpenID Connect. Register for free  https://t.co/Rg5SfjGDGd  https://t.co/Qcb20IOjAP",en,"[{'screen_name': 'talkortweets', 'name': 'augustine correa', 'id': '89355271'}, {'screen_name': 'hackmum', 'name': 'hackerspace mumbai', 'id': '891266209'}, {'screen_name': 'fossasia', 'name': 'fossasia', 'id': '157702526'}]",['https://eventyay.com/e/fa96ae2c'],['https://pbs.twimg.com/media/EurtbGhXEAYwoam.png'],0,1,5,"['india', 'web', 'virtual', 'opentech', 'opensource', 'security', 'privacy', 'openid']",[],https://twitter.com/fossasiasg/status/1363163096945164288,False,,1,https://pbs.twimg.com/media/EurtbGhXEAYwoam.png,Singapore,,,,,,[],,,,
1363133840735170563,1363133840735170563,2021-02-20 22:30:08 +08,2021-02-20,22:30:08,+0800,984806087726632960,manojmeghwal_,Manoj Meghwal,,"I'm worring about my bank account in BOB. BOB Breaches Privacy of its clients by letting out their financial details to @nishant_india. I am hoping it is not true, because if it's true, then it needs to be investigated.",en,"[{'screen_name': 'nishant_india', 'name': 'nishant', 'id': '140838371'}]",[],[],0,4,6,[],[],https://twitter.com/manojmeghwal_/status/1363133840735170563,False,,0,,Singapore,,,,,,[],,,,
1363125796546613255,1363125796546613255,2021-02-20 21:58:10 +08,2021-02-20,21:58:10,+0800,176882863,mohdamiruul,Amiruul Jamal,,Nak ikutkan hidup sekarang dah mmg privacy but I need more privacy....,in,[],[],[],1,0,0,[],[],https://twitter.com/MohdAmiruul/status/1363125796546613255,False,,0,,Singapore,,,,,,[],,,,
1363123466753503235,1363123466753503235,2021-02-20 21:48:54 +08,2021-02-20,21:48:54,+0800,140040035,manojthacker,Manoj Thacker,,How does facial recognition work and is it really safe?  https://t.co/ptrHTPzSDU  #Privacy #ethical #SafetyFirst,en,[],['https://www.wired.co.uk/video/how-does-facial-recognition-work-and-is-it-really-safe'],[],0,0,0,"['privacy', 'ethical', 'safetyfirst']",[],https://twitter.com/manojthacker/status/1363123466753503235,False,,0,,Singapore,,,,,,[],,,,
1363117672112693249,1363117672112693249,2021-02-20 21:25:53 +08,2021-02-20,21:25:53,+0800,105368764,khayusaki,K,,The dead are allowed privacy too. Please at least blur the face before posting those on social media. #WhatsHappeningInMyanmar,en,[],[],[],0,0,1,['whatshappeninginmyanmar'],[],https://twitter.com/khayusaki/status/1363117672112693249,False,https://twitter.com/SoupNotCoup/status/1363105321657511938,0,,Singapore,,,,,,[],,,,
1363099261580156934,1363099261580156934,2021-02-20 20:12:43 +08,2021-02-20,20:12:43,+0800,1149621150512586752,alyaanabilah_,｡ 🎀 𝓎𝒶𝓎𝒶 🎀 ｡,,just keep it privacy☺️,en,[],[],[],0,1,0,[],[],https://twitter.com/alyaanabilah_/status/1363099261580156934,False,,0,,Singapore,,,,,,[],,,,
1363097326890479616,1363097326890479616,2021-02-20 20:05:02 +08,2021-02-20,20:05:02,+0800,366244540,michaelzimmel,Michael Zimmel,,"Why some like Apple’s new privacy labels, despite their flaws  https://t.co/XFdMmElWtj",en,[],['http://dlvr.it/Rt6Gtx'],[],0,0,1,[],[],https://twitter.com/MichaelZimmel/status/1363097326890479616,False,,0,,Singapore,,,,,,[],,,,
1363065871946575872,1363065871946575872,2021-02-20 18:00:03 +08,2021-02-20,18:00:03,+0800,1274234569445609472,m_lahierre,"Mathieu LAHIERRE | CISM,CISA,CRISC,CDPSE, CBSP",,Metadata privacy solution from HOPR is the next big thing #CyberRisk #cybersecurity #infosec #insiderthreat #databreach #dataprotection #datasecurity #datatheft #cyberwarfare  https://t.co/LuQbcnDMOK,en,[],['https://lnkd.in/gtbdMCm'],[],0,0,0,"['cyberrisk', 'cybersecurity', 'infosec', 'insiderthreat', 'databreach', 'dataprotection', 'datasecurity', 'datatheft', 'cyberwarfare']",[],https://twitter.com/m_lahierre/status/1363065871946575872,False,,0,,Singapore,,,,,,[],,,,
1363036769088864257,1363036769088864257,2021-02-20 16:04:24 +08,2021-02-20,16:04:24,+0800,1037366296122413063,sebastianpetr12,Sebastian petrosi,,Safer alternatives to keep notes? via /r/privacy  https://t.co/kgX7uhYeqw,en,[],['https://ift.tt/3ufVJvJ'],[],0,0,0,[],[],https://twitter.com/Sebastianpetr12/status/1363036769088864257,False,,0,,Singapore,,,,,,[],,,,
1363036767155331072,1363036767155331072,2021-02-20 16:04:23 +08,2021-02-20,16:04:23,+0800,1037366296122413063,sebastianpetr12,Sebastian petrosi,,Someone knows a good altenative to Duolingo in iOS? via /r/privacy  https://t.co/6R4DwU3d46,en,[],['https://ift.tt/3ueKhAs'],[],0,0,0,[],[],https://twitter.com/Sebastianpetr12/status/1363036767155331072,False,,0,,Singapore,,,,,,[],,,,
1363036765704097792,1363036765704097792,2021-02-20 16:04:23 +08,2021-02-20,16:04:23,+0800,1037366296122413063,sebastianpetr12,Sebastian petrosi,,EFF to First Circuit: Schools Should Not Be Policing Students’ Weekend Snapchat Posts via /r/privacy  https://t.co/zJM14238pM,en,[],['https://ift.tt/3k6hRDW'],[],0,0,0,[],[],https://twitter.com/Sebastianpetr12/status/1363036765704097792,False,,0,,Singapore,,,,,,[],,,,
1363036763783053315,1363036763783053315,2021-02-20 16:04:23 +08,2021-02-20,16:04:23,+0800,1037366296122413063,sebastianpetr12,Sebastian petrosi,,"Exclusive: How Oracle Sells Repression in China (“In its bid for TikTok, Oracle was supposed to prevent data from being passed to Chinese police. Instead, it’s been marketing its own software for their surveillance work.”) via /r/privacy  https://t.co/7MLhygKSql",en,[],['https://ift.tt/2ZvX2Z9'],[],0,0,0,[],[],https://twitter.com/Sebastianpetr12/status/1363036763783053315,False,,0,,Singapore,,,,,,[],,,,
1363036761799225344,1363036761799225344,2021-02-20 16:04:22 +08,2021-02-20,16:04:22,+0800,1037366296122413063,sebastianpetr12,Sebastian petrosi,,Confusion/Ignorance among general non technical people via /r/privacy  https://t.co/bZttQf7aC9,en,[],['https://ift.tt/3sgzAM5'],[],0,0,0,[],[],https://twitter.com/Sebastianpetr12/status/1363036761799225344,False,,0,,Singapore,,,,,,[],,,,
1363036760360509440,1363036760360509440,2021-02-20 16:04:22 +08,2021-02-20,16:04:22,+0800,1037366296122413063,sebastianpetr12,Sebastian petrosi,,Cleaning up my online presence via /r/privacy  https://t.co/mnmJsIbLvC,en,[],['https://ift.tt/2Ng5RUM'],[],0,0,0,[],[],https://twitter.com/Sebastianpetr12/status/1363036760360509440,False,,0,,Singapore,,,,,,[],,,,
