,id,date,time,tweet,hashtags,num_words
275,1320525683202740224,2020-10-26,08:40:31,🌱Keep calm and consume one tablet of Anti Stress Herbs every morning to prevent you from stress caused by the hustle and bustle of everyday life.🧘🏻  🛒Shop  https://t.co/hR7ZeCp5We or visit Intenz Healthcare Store   #21stcenturysg #herbal #antistress #keepcalm #remedies  https://t.co/N6sDKzvf11,"['21stcenturysg', 'herbal', 'antistress', 'keepcalm', 'remedies']",32
276,1319524964882546690,2020-10-23,14:24:01,"🐶All dogs can benefit from probiotics which aid digestion, modulate the immune system and increase the absorption of nutrients. 🐕  🛒Shop  https://t.co/hR7ZeCp5We or visit Intenz Healthcare Store   #21stcenturysg #dogs #doglover #probioticsfordogs #probiotics #pets #animals  https://t.co/NY0klCGexx","['21stcenturysg', 'dogs', 'doglover', 'probioticsfordogs', 'probiotics', 'pets', 'animals']",25
277,1319442600990928897,2020-10-23,08:56:44,🌞One-a-Day is specially formulated to help meet your body's daily requirement of essential vitamins and minerals.  🛒Shop  https://t.co/hR7ZeCp5We or visit Intenz Healthcare Store   #21stcenturysg #vitamins #health #healthylifestyle #supplements #wellness #lifestyle #adults  https://t.co/EZrgEf7DRH,"['21stcenturysg', 'vitamins', 'health', 'healthylifestyle', 'supplements', 'wellness', 'lifestyle', 'adults']",20
278,1319149238844993536,2020-10-22,13:31:01,🍇Chewy C is a fun way for kids to get their daily Vitamin C dose. Have your little ones taken their daily boost of Vitamin C today?🍊   🛒Shop  https://t.co/hR7ZeCp5We or visit Intenz Healthcare Store   #21stcenturysg #vitaminc #immunesupport #kidssupplement #kids #health  https://t.co/rNqXKQ2Gd6,"['21stcenturysg', 'vitaminc', 'immunesupport', 'kidssupplement', 'kids', 'health']",33
279,1318801212943130624,2020-10-21,14:28:05,😴The chewy and flavorful 21st Century Melatonin Gummies work in harmony with your natural sleep cycle to promote relaxation and sleep.🍓  🛒Shop  https://t.co/hR7ZeCp5We or visit Intenz Healthcare Store    #21stcenturysg #melatonin #melatoningummies #supplements #wellness  https://t.co/obNkdV8pOF,"['21stcenturysg', 'melatonin', 'melatoningummies', 'supplements', 'wellness']",26
280,1318715425383870464,2020-10-21,08:47:12,"🗣If swallowing supplements and vitamins are tough for you, the chewable #Turmeric Gummies are perfect for you! It is 100% #vegetarian, made from pectin and gluten free! ✨  🛒Shop  https://t.co/hR7ZeCp5We or visit Intenz Healthcare Store   #21stcenturysg #health #supplements  https://t.co/xPFKw1RTn7","['turmeric', 'vegetarian', '21stcenturysg', 'health', 'supplements']",30
281,1318377372903759872,2020-10-20,10:23:54,"Hi everyone, we are rebranding! 🤩 @ Medlink Healthcare Group  https://t.co/zIcLvbnd9r",[],8
282,1317350256451842049,2020-10-17,14:22:30,"The future of #healthcare, the trends and technologies reshaping the industry. #MedTech #HealthTech #DigitalHealth #healthsystems   https://t.co/AmRGEitOh5 via @UBS","['healthcare', 'medtech', 'healthtech', 'digitalhealth', 'healthsystems']",11
283,1315157180039880704,2020-10-11,13:08:00,"@UN declared 11 October as #InternationalDayoftheGirl with the aim of recognizing the right of girls to a safe life with access to education &amp; healthcare – not just during their critical formative years, but also as they grow into women @SRE_mx @SIPINNA_MX @agarcialopezl  https://t.co/cAYfkbPAjW",['internationaldayofthegirl'],35
285,1311492290406354945,2020-10-01,10:25:03,EverSystem node &amp; IOST partner Pracs will be speaking about Pracs project at IT &amp; Digital Health Conference- one of the largest online conferences in Japan to introduce technologies &amp; know-how for creating the future of healthcare. Check the details here👇🏻  https://t.co/qfIy8tRIyi  https://t.co/r90NgBW45y,[],37
286,1309688029703938048,2020-09-26,10:55:33,@allicovington + I also think that there is a lot of grey area between healthcare costs incurred by an individual and govt’s spending on healthcare.,[],24
287,1309659624795119616,2020-09-26,09:02:41,@allicovington But don’t you think it’s above than that as sometimes the fittest person of all times also needs extreme healthcare.,[],22
288,1309640133419786240,2020-09-26,07:45:14,"If this was a triathlon, we've finished the swim and are now in the bike portion. We need to continue to play our part - wear masks, keep our distance, be mindful our actions are not putting other at risk, be responsible. The healthcare workers depend on us doing the right thing.",[],50
289,1309637303309008896,2020-09-26,07:33:59,"What she said...  ""Please do what you can now to mitigate the spread of this virus. These are small sacrifices compared to the challenges healthcare workers navigate every day.""  #Heroes",['heroes'],29
290,1309499454257426432,2020-09-25,22:26:13,"I’m not a gamer, just like Korean drama - I just don’t want to ‘waste’ my time for playing game or watch dramas. But since I knew VR is used in medical Healthcare Etc, I should pay more attention to it&gt;&gt; #virtualreality ' Use of VR  https://t.co/CLRO97r8w5",['virtualreality'],45
292,1307101479644393474,2020-09-19,07:37:32,#Indonesia's overstretched #health #care system has been under pressure since the beginning of the #COVID19 outbreak. #healthcare #healthcaresystem   https://t.co/KEI76801AL,"['indonesia', 'health', 'care', 'covid19', 'healthcare', 'healthcaresystem']",12
294,1306598937403355136,2020-09-17,22:20:36,"Working in the healthcare, be it hospitals or Eldercare centres, you must be sincere in the work. Imagine if those elders are our loved ones? Have some common sense. As a human.",[],32
295,1304974396373848064,2020-09-13,10:45:16,Just posted a photo @ KPJ Healthcare P.Gudang  https://t.co/MocpZV1F92,[],6
296,1304778531868532736,2020-09-12,21:46:58,The great acceleration in #healthcare: Six trends to heed  https://t.co/IarCVHETFP,['healthcare'],8
297,1304387112041504770,2020-09-11,19:51:36,"On my way back home &amp;we had to stop, saw an ambulance and healthcare worker escorting a Covid Patient. The patient was on the way to the ward, funny thing, he’s like on holiday dragging two luggage. Singapore 😋. Get well soon Covid-19 guy who just walked like on a red carpet  https://t.co/yTcCioa1Vb",[],52
298,1304114634924855297,2020-09-11,01:48:52,"If you think you're more competent in the nursing procedures. And you lack of trust in healthcare professionals. Then, you don't come to the hospital to tell us what to do and what not. We know what we're doing.",[],36
299,1302936406352777217,2020-09-07,19:47:01,Blogged about child healthcare options in Singapore  https://t.co/yVOmlnKVjn,[],7
300,1302876491223429120,2020-09-07,15:48:56,We're excited to be receiving you at our upcoming APACMed Virtual Forum 2020. This would not have been possible without the unwavering support of our sponsors.  Join us as we bring together stakeholders from the region to discuss the future of healthcare.  https://t.co/cSrd1xnzR3  https://t.co/DGZXP6sjzI,[],40
301,1302615994901258240,2020-09-06,22:33:49,The Urgent Care Center at Kampung Admiralty is a good initiative. This healthcare model may not be sustainable due to high fees charge. Residents would prefer a GP unless it is really urgent 😅,[],33
302,1301924611446075392,2020-09-05,00:46:30,"Philippines, for better healthcare statistics, the use of ""cardiac arrest"" as cause of death should stop. It's the antecedent cause of death from pneumonia, coronary heart disease, cancer, hemorrhagic stroke, end stage renal failure, septicaemia.",[],34
303,1301343716632862721,2020-09-03,10:18:14,Please no more COVID19 deaths amongst healthcare workers (and in the Philippines)😢🙏🏻,[],12
304,1300954989590847488,2020-09-02,08:33:34,@BudimanJayaS I’m referring to example of effective shutdown measures to pandemic peak when healthcare capacity is challenged not pandemic prevention.,[],20
305,1300131402151653376,2020-08-31,02:00:56,@wesbury You are contradicting yourself when you say lack of checkups and surgery and healthcare system was never stressed.,[],18
306,1300129851681071104,2020-08-31,01:54:46,"@wesbury If your healthcare system is overwhelmed and under duress,  capabilities to deal with the pandemic will head down exponentially. That’s not rocket science.",[],24
307,1300003736970883072,2020-08-30,17:33:38,"Israeli #healthcare #startups are no longer relying solely on technology, clinical data, or IP to generate value. They are reinventing business models and, as a result, are elevating the industry. #DigitalHealth #medicaldevice  https://t.co/HXcxQEgZEK","['healthcare', 'startups', 'digitalhealth', 'medicaldevice']",28
308,1299894484042428416,2020-08-30,10:19:30,"“Be a Hero. Be Boring. Staying in isn’t exciting but it saves lives.”  Absolutely fantastic campaign from Mucinex with Creative execution by McCann Healthcare, USA @ Singapore  https://t.co/vQtvFtKldO",[],27
309,1299559826087845888,2020-08-29,12:09:41,"#kidsampsonreads I still don't understand the psychology behind the choices, but interesting to note the results of the microfinancing and healthcare initiatives.. (i.e. what works and what doesn't)  https://t.co/fZmcxAbydz",['kidsampsonreads'],26
310,1298791237164634115,2020-08-27,09:15:35,"Rumour has it that alcohol-based disinfectants are enough to kill viruses, but how true is it?  𝐖𝐨𝐧𝐝𝐞𝐫𝐊𝐥𝐞𝐚𝐧 debunks the myth with healthcare tips that we think you should know. Our disinfectant solution contains 𝟎%…  https://t.co/fB6N0g5qWp",[],31
311,1298246118308892675,2020-08-25,21:09:29,"More jobs in Healthcare and communitycare, 7500 jobs in total. For fresh grads and mid career switch. Let me look at CECA's agreement again. #hiring #singaporetogethermovement","['hiring', 'singaporetogethermovement']",22
312,1297701936431599626,2020-08-24,09:07:06,"Everyone thinks that a strong disinfectant must come with a noticeable odour, but does strong odour equal to safety? Know this truth for serious healthcare tips. Swipe visual for…  https://t.co/fou91AVbk5",[],29
314,1297119147243888641,2020-08-22,18:31:18,"How can a country be “developed” when not every citizen has affordable access to basic necessities - food, shelter, education, healthcare, transportation. #irony #1stworld","['irony', '1stworld']",21
315,1296712678971342851,2020-08-21,15:36:09,"The survey made the following findings: Boys find careers in IT-related fields appealing, while girls are more interested in the healthcare and medical fields.",[],23
316,1296707091197882368,2020-08-21,15:13:56,Amazing! Wearables can and are going to become the norm for healthcare and wellness.,[],14
318,1295585500959395841,2020-08-18,12:57:08,"Yeah except the moronic behaviour by the very exemplary covidiots will still encumber the efficiency and efficacy of any good healthcare system, THAT IS assuming that such level of quality exists to begin with in certain countries  https://t.co/kMg6FIv7vY",[],37
320,1293511412573184000,2020-08-12,19:35:27,"A short adventure on the foldie on a sunny Wednesday evening. Didnt see any drenched healthcare givers though.   Explored the Alexandra Canal. Halfway smelt fried hokkien mee at Zion Road FC, almost wanted to give…  https://t.co/ucsjWM0zRy",[],35
321,1293140021155729410,2020-08-11,18:59:41,“Majority of these cases are manufactured ...” Am I the only one who finds this totally absurd and especially disrespectful to those who lost their lives to COVID19!?! And also to the healthcare workers who are risking their lives trying to save those with COVID19!?!,[],44
322,1293035763160899584,2020-08-11,12:05:24,"@BaldingsWorld @OutOutrider79 Been to Vietnam only once, travel seemed free enough. But can a local just decide to move from a village to the city and get a job, apartment, schooling for kids and healthcare without permits from government?",[],37
325,1292014253231058944,2020-08-08,16:26:17,@davealevine Legitimate question why do you even want government running your healthcare with all the glaringly obvious short comings of the government?,[],21
326,1291545275798978560,2020-08-07,09:22:44,It’s no coincidence that world class #healthcare is another common denominator of those countries listed as preferred destinations  #investmentmigration #citizenshipbyinvestment #hnwi #residencebyinvestment  https://t.co/i0HlCMZMgZ,"['healthcare', 'investmentmigration', 'citizenshipbyinvestment', 'hnwi', 'residencebyinvestment']",18
327,1291316707068272640,2020-08-06,18:14:29,"@APACMed is delighted to be a supporting partner of @nikkei's upcoming webinar, where we will discuss how #healthcare #innovation can build a resilient society capable of withstanding communicable disease risks such as COVID-19.   https://t.co/7Uktns64Hl  https://t.co/w7wYBo4sal","['healthcare', 'innovation']",29
328,1291261494936518656,2020-08-06,14:35:05,This is similar to flying planes over hospitals during National Day to show support for healthcare workers. Lel @ singapore,[],19
329,1290284798657695749,2020-08-03,21:54:02,Look at my shocked face! Feel horrible for people who have to put up with this under sanctions( actually affecting healthcare system badly)  which are supposedly meant not to target people !,[],31
330,1289279869520457728,2020-08-01,03:20:49,"🎥 @wenDdd 👩‍⚕ We can't thank you &amp; the healthcare workers enough for all your hardwork, dedication &amp; perseverance you have put forth to see us through this unprecedented time. Happy #Nurses' Day! #Tiktok #Singapore  https://t.co/fKpB8ONZZf","['nurses', 'tiktok', 'singapore']",26
331,1289066152337924096,2020-07-31,13:11:35,Join us on 24th September 2020 for the first ever @APACMed Virtual Forum and get inspired by some of the most influential leaders in the #healthcare Industry! #medtech #medicaldevice #digitalhealth #healthtech  Register here:  https://t.co/cSrd1xnzR3  https://t.co/yv31jO6Qku,"['healthcare', 'medtech', 'medicaldevice', 'digitalhealth', 'healthtech']",25
332,1288786119945936896,2020-07-30,18:38:50,"@massacred yeah tbh I was interested in knowing more about some of ur modules like global health / healthcare tech n innovation / policy cuz I think it's all very relevant but due to academic constraints, we can't have it hehe 🐈🐈",[],36
333,1288385502471569408,2020-07-29,16:06:55,@hellosigit But the difference is the rate of testing and access to healthcare.,[],12
334,1287762340625018880,2020-07-27,22:50:42,"Working all these back breaking jobs without affordable healthcare, transport subsidy etc",[],12
335,1287361059678904320,2020-07-26,20:16:09,This is what Trump's best healthcare promise looks like.   https://t.co/8giVn38CEx,[],8
336,1286474982709633025,2020-07-24,09:35:12,Recent Project - Founders Day Gift for healthcare workers n staff at TTSH   #healthcareworkers #medallion #staffgifts #memorabilia #covid19 #employeeappreciation #employeegifts #giftideas  https://t.co/mHw8WgGQQR,"['healthcareworkers', 'medallion', 'staffgifts', 'memorabilia', 'covid19', 'employeeappreciation', 'employeegifts', 'giftideas']",12
337,1285771589745696770,2020-07-22,11:00:10,"@_maroo I think Indians have given up on primary education, healthcare and food security delivery from the government. You can add law and order to this list in rural India. Incompetence of successive govt's has led us to this state. Even the poorest of the poor have given up.",[],47
338,1285420749537214464,2020-07-21,11:46:03,"Good to hear at this day and age that medical/healthcare students can appreciate heart sounds realistically. 😊  Back in the day in @UERMOfficial you're just at the mercy of your imagination how the Cardio professor will describe it, in writing. 🙄",[],38
339,1285036050369282050,2020-07-20,10:17:23,"The World is at the breaking point with a vast inequality, let's not ignore what's coming down the pike with automated human jobs. A new generation of social protection is needed - including universal healthcare and universal basic income. #UniversalBasicIncome 👇🏻",['universalbasicincome'],36
340,1284403171079491585,2020-07-18,16:22:33,"@suzannashantini Not everyonde has it in them to be in this line. If you feel so, i would say its a blessing in disguise. Healthcare workers are basically angels on earth ❤️",[],30
341,1283652801537531905,2020-07-16,14:40:51,Healthcare &amp; Wellness Corporate gift idea - UV Sterilizer Disinfection Bag   #wellnessgifts #healthcaregift #corporategifts #covid19 #covid19prevention #workfromhomegift #wfh #wfhgifts  https://t.co/E7IRGCBzCk,"['wellnessgifts', 'healthcaregift', 'corporategifts', 'covid19', 'covid19prevention', 'workfromhomegift', 'wfh', 'wfhgifts']",9
342,1283572032546865152,2020-07-16,09:19:54,Healthcare &amp; Wellness Corporate Gift idea - portable neck massager   #wellnessgift #corporategift #brandedmerchandise #massager #neckmassager #branding #healthcare #marketing #incentivegifts #advertising  https://t.co/VF4fauL3yx,"['wellnessgift', 'corporategift', 'brandedmerchandise', 'massager', 'neckmassager', 'branding', 'healthcare', 'marketing', 'incentivegifts', 'advertising']",8
343,1283390924173660160,2020-07-15,21:20:15,"@bridgettebtweet In singapore, it’s under control and retail is open, still mask on. Being a healthcare worker for me life is same at work... hope the vaccine comes soon.",[],29
344,1283332909709942785,2020-07-15,17:29:43,Not how you spend money to take care of your healthcare staff.,[],12
345,1282586482931150848,2020-07-13,16:03:41,Gift with purchase idea for healthcare industry- Multiple compartments poll box   #pillbox #giftideas #giftwithpurchase #gwp #promotionalgifts #marketing #brandedmerchandise #branding #healthcare #wellnessgifts  https://t.co/T1i69GFLtz,"['pillbox', 'giftideas', 'giftwithpurchase', 'gwp', 'promotionalgifts', 'marketing', 'brandedmerchandise', 'branding', 'healthcare', 'wellnessgifts']",11
346,1282221969677541377,2020-07-12,15:55:14,"They dont have universal healthcare system. And if they dont subscribe to insurance, they are fucked up. Who wants to pay the hospital bills?",[],24
347,1281675710214496256,2020-07-11,03:44:36,"with family members on the frontline, and having spent a year in chemo myself, I find that it would make more sense for someone familiar with the processes and experience on the ground to be passing policy on healthcare infrastructure",[],40
348,1279643291059802113,2020-07-05,13:08:29,How good is Singapore’s healthcare? Amongst the best in the world. Here’s why.   Healthcare in Singapore  https://t.co/eGSV1EykFe,[],18
349,1278248449490604032,2020-07-01,16:45:53,"@PlanetElle @migiziwigwan @Reuters Source that Covid-19 is spread through droplet is here  https://t.co/YJL9BB6iFk  Since the virus is spreading in the USA,I am happy and I hope the country falls apart If you choose not to wear the mask, please dont be a burden for an healthcare workers  From a nursing student👌🏻",[],48
350,1277685782032068608,2020-06-30,03:30:03,How do you show #gratitude to #healthcare workers @TTSH in #Singapore?  U.S. rice is a good start.   https://t.co/a3SqOMuUhW  https://t.co/abyJTGrMnC,"['gratitude', 'healthcare', 'singapore']",14
351,1276869257972703232,2020-06-27,21:25:28,"Looking  for A Blood Group plasma donors in Delhi for my uncle #COVID19  Urgent Plasma Requirement  from Covid-19 recovered patient. Blood group:  A + Hospital: Aakash Healthcare, Dwarka Attendant Name:  Sauravjit Singh Contact Number : 9899767633, 9873652227 Super grateful 🙏",['covid19'],34
352,1276489288960692224,2020-06-26,20:15:37,I'm at Neptune Healthcare Medical and Surgery in Singapore  https://t.co/mgzhVtQSdM,[],8
353,1276434650735374336,2020-06-26,16:38:30,Oi cb stay at home la phase 2 doesn’t mean can go out all. Please think of our migrant and healthcare workers.,[],22
354,1274676057640075265,2020-06-21,20:10:29,"HC @JawedAshraf5 addressed Webinar by Mission &amp; Arth, Singapore on “Preventive healthcare and Building of Immunity thru Ayurveda”. All eminent Panelists- Dr Krishna Kumar, Dr P Rammanohar, Dr Yamini Tripathi and Dr Geetha Krishnan #IDYSG2020 #SpiritOfYoga #अंतर्राष्ट्रीययोगदिवस  https://t.co/mQKiNtaHAJ","['idysg2020', 'spiritofyoga', 'अंतर्राष्ट्रीययोगदिवस']",32
355,1274137090867908609,2020-06-20,08:28:49,Can this person waive off her rights to taking up healthcare resources if she contracted COvID19 by willfully subjecting herself to exposure and be liable for subjecting others to being infected by being a vector?,[],35
356,1273769307126632449,2020-06-19,08:07:22,"not just school debt: healthcare debt, historical debt, parental debt, anything that restricts social/creative mobility. Systemic injustice is not just about the moral concept of fairness, but that it hugely limits our collective human potential.",[],36
357,1273225423204147200,2020-06-17,20:06:10,"iGene Laboratory has successfully launched Rhene, a non-invasive prenatal test (NIPT) which assesses fetal RhD status from a maternal blood sample.  #igene #igenelaboratory #Rhene #healthcare #prenatal #nipt #singapore  https://t.co/UUAUCSwj97","['igene', 'igenelaboratory', 'rhene', 'healthcare', 'prenatal', 'nipt', 'singapore']",20
359,1270024147427405824,2020-06-09,00:05:27,PSA: I was given an opportunity to join this remarkable team of SG volunteers - an eclectic group of data scientists/healthcare researcher/anthropologist+filmmaker/tech engineer - called One Of Us during this very strange &amp; interesting COVID season,[],37
360,1269719410257715200,2020-06-08,03:54:32,Spain to Allocate Up to 9 Billion Euros to Regional Healthcare  https://t.co/qomIbvzF2Y,[],10
361,1269428219221905409,2020-06-07,08:37:26,"#Covid19 is helping to accelerate the #healthcare sector's transition out of its age-old model of #care, which could spell structural shifts in how hospitals operate. #HealthTech #DigitalHealth #telehealth  https://t.co/CqDZVSz37D","['covid19', 'healthcare', 'care', 'healthtech', 'digitalhealth', 'telehealth']",20
362,1268842951297216512,2020-06-05,17:51:48,"#China #robotics #startup Fourier has acquired rehab provider Zhuhai RHK #Healthcare, tapping the needs of China's massive -- and rapidly aging population. #medtech    https://t.co/TLyIvBcY90","['china', 'robotics', 'startup', 'healthcare', 'medtech']",16
363,1268676258755301376,2020-06-05,06:49:25,"#Singapore is a leading hub for #HealthTech in #Asia. For the #digitalhealth #startups to contribute to thrive and transform into so-called scaleups, we need a collaborative #digital #healthcare ecosystem! #healthtechnology #digitalhealthcare   https://t.co/xxysIhQ7p2","['singapore', 'healthtech', 'asia', 'digitalhealth', 'startups', 'digital', 'healthcare', 'healthtechnology', 'digitalhealthcare']",21
364,1268551430295687168,2020-06-04,22:33:24,"Enjoyed the wide-ranging discussion with Jim about how COVID-19 will impact healthcare, economy, Singapore and ASEAN. #COVIDー19 #singapore #asean","['covidー19', 'singapore', 'asean']",15
365,1268421015559786496,2020-06-04,13:55:10,@Innov8Medicaid @kellidepriest Child and Adolescent Healthcare is an  important area for policymakers. Healthy Living should be taught from childhood.,[],17
366,1267871001016066049,2020-06-03,01:29:37,I find it disturbing that he is willing to provide law enforcement with the necessary funds and equipment to tackle “rioters” from the #GeorgeFloydprotest. But struggled to provide healthcare professionals with essential PPE and medical equipment to tackle #COVID19 .,"['georgefloydprotest', 'covid19']",37
367,1267836745988534272,2020-06-02,23:13:30,"I’m old enough to remember @TheDemocrats losing the house because President @BarackObama pushed through healthcare for millions of Americans. If the @GOP hold on to the Senate after all these (deaths, unemployment, injustice, tear gas etc), I don’t know what to make of the #USA",['usa'],43
368,1267306889953468419,2020-06-01,12:08:02,"And now we know what all the apocalyptic movies surround the US. It’s the international chaos center. From racism to healthcare, chaos surrounds 🥺🥺",[],24
369,1267006214132527104,2020-05-31,16:13:15,"#India can develop its #health #innovation ecosystem into a dominant, post-Covid economic sector by streamlining development and #regulatory processes, and lending more support so that #innovators can compete on a global platform. #healthcare   https://t.co/7OHxVoYahO","['india', 'health', 'innovation', 'regulatory', 'innovators', 'healthcare']",26
370,1267004770675380226,2020-05-31,16:07:31,Lessons from a #pandemic: How #India can reform its private #healthcare sector  https://t.co/4UDBhaWH5o,"['pandemic', 'india', 'healthcare']",9
371,1267003454259474433,2020-05-31,16:02:17,China's Health Silk Road has the potential to address some of the weaknesses of #healthcare infrastructure in many developing countries.   https://t.co/dH0lkhdk6t,['healthcare'],18
372,1266896153850699777,2020-05-31,08:55:55,I’ll put it out there: there is a global pandemic happening right now just think of the frontline healthcare workers who are already exhausted from fighting the disease and will now need to treat the people hurt from the protests.,[],41
373,1266877156912533504,2020-05-31,07:40:26,"With the acceleration of consumer &amp; provider adoption of #telehealth and extension of telehealth beyond virtual urgent #care, up to US$250 billion of current US #healthcare spend could potentially be virtualized. #telemedicine #virtualcare #DigitalHealth   https://t.co/tVeSGkrvkx","['telehealth', 'care', 'healthcare', 'telemedicine', 'virtualcare', 'digitalhealth']",27
