,id,date,time,tweet,hashtags,num_words
351,1243410109054595078,2020-03-27,13:30:46,"People need to get their mental health checked, beating Doctors is Super Low blow",[],14
352,1243339086061907968,2020-03-27,08:48:32,"honestly i do not know how much longer i can hold on.. it feels like everyday i'm in a losing uphill battle against my mental health.  temporary things comes in and makes me happy for awhile, then it's back to square one.  sometimes it's ever worser  than it was before.",[],47
353,1243059887308861440,2020-03-26,14:19:06,"""Anti-stigma efforts play an important role in encouraging persons in distress to seek help early"" - Senior Minister of State for Health Amy Khor  Continuing to play our part thru Belle, the NCSS helpbot for info &amp; resources on mental health:  https://t.co/e7EuM1OPzF #chatbot  https://t.co/nOtg8VlEWD",['chatbot'],38
354,1242756187252068352,2020-03-25,18:12:18,"@cesapo Absolutely! Good sleep habit is closely tied to good mental health, people feel more optimistic in life. #phdlife",['phdlife'],17
355,1242668062618329088,2020-03-25,12:22:08,Getting out while we still can! #hiking #treetopwalk #Singapore #nature #wellness #mentalhealth #outdooreducation #natureschool #socialdistancing @ HSBC TreeTop Walk  https://t.co/5OS9qu8oz5,"['hiking', 'treetopwalk', 'singapore', 'nature', 'wellness', 'mentalhealth', 'outdooreducation', 'natureschool', 'socialdistancing']",9
356,1242332327969198081,2020-03-24,14:08:03,Take a run through the jungle - CCR #exercise #wellness #nature #mentalhealth #bewell #socialdistancing @ Singapore Quarry  https://t.co/LSxru3b5vR,"['exercise', 'wellness', 'nature', 'mentalhealth', 'bewell', 'socialdistancing']",9
357,1241334716831162368,2020-03-21,20:03:54,@benjoeee It’s the ideal escapist game to protect your mental health.,[],11
358,1240675213584371712,2020-03-20,00:23:16,My mental health is a bit wack recently HELP LA,[],10
359,1240651828036943873,2020-03-19,22:50:20,Tbh I’m really tired. Physical and mental health capacity it’s at its limit. I’m just done.,[],19
360,1240409096773386240,2020-03-19,06:45:49,I'm at Institute Of Mental Health (IMH) in Singapore  https://t.co/Sukb3QRRQN  https://t.co/xQU3IZTcG0,[],8
361,1237843497907937283,2020-03-12,04:51:02,Something I thought my friends with Disability and spoonie friends may relate to - feel free to add to the list in the comments 👌🏽   #disability #chronicillness #spoonies #covid2019 #selfcare #mentalhealth  #ableism…  https://t.co/Gq1kXQEGI8,"['disability', 'chronicillness', 'spoonies', 'covid2019', 'selfcare', 'mentalhealth', 'ableism']",23
362,1237797390347677696,2020-03-12,01:47:49,@oolongmiIk Yeah man hahaha will let you know!! Jiayou and rmb mental health breaks!!,[],13
363,1237739274302177280,2020-03-11,21:56:53,"The first rule of mental health: Learn to distinguish who deserves an explanation, who deserves only one answer and who deserves absolutely nothing.",[],23
364,1237455855877885952,2020-03-11,03:10:41,"I've been reading all replies and quotes from this tweet and it made me realize that our Social institutions need a lot more awareness about mental health. Though we've come a long way of fighting for the acknowledgement, we must strive more for awareness and sensitivity.",[],44
365,1237184360366796800,2020-03-10,09:11:51,The fact that Zara has to lose her shit shows how much her mother and husband had pushed her over the limits and drove her crazy.  She is not mentally unsound. But these two perpetrators are the cause of her mental health deteriorating.,[],43
366,1235537666218680320,2020-03-05,20:08:29,"Singapore's MOH will expand its infrastructure to include a new #hospital in the east, new #polyclinics and launch a #mentalhealth service for youths. #health #healthcare  https://t.co/3K39zI31mA","['hospital', 'polyclinics', 'mentalhealth', 'health', 'healthcare']",19
367,1234262126048378880,2020-03-02,07:39:56,"A great article about the #mentalhealth burden of dealing with a #RareDisease alone:  https://t.co/XfaltyhCa7 - research among members of my ‘Living with iSGS’ group suggests joining provides: support 24/7, education about treatment, up to date research &amp; a sense of empowerment","['mentalhealth', 'raredisease']",35
368,1233929604555034625,2020-03-01,09:38:37,I'm at Institute Of Mental Health (IMH) in Singapore  https://t.co/eCZphw0kmJ  https://t.co/dbNDzMYfY6,[],8
369,1233792132122431488,2020-03-01,00:32:21,"shoutout to everyone juggling your social life, work, health/mental health, fitness and studies. It is no easy feat man salute to all of you :’)",[],25
370,1232521857737293824,2020-02-26,12:24:44,"Mode: Me Time - In the past, I often worked so hard to meet datelines that I forgot about my own well-being especially my mental health which ended up leading me down a rabbit hole of extreme anxiety. That’s when I…  https://t.co/CFBRiuakMN",[],40
371,1232337375071633411,2020-02-26,00:11:40,"Go watch The Son by Pangdemonium, with the father and son roles played by actual father-son duo Adrian and Zachary Pang. We don’t talk about mental health enough, especially in Asia, and at many points this play hit a bit too close to home.  https://t.co/DTkuNGWNun",[],44
372,1232326679101681664,2020-02-25,23:29:10,"It seems like #Pangdemonium puts out a lot of depressing stuff lately ;(  Caught ""The Son"", a depressing but important look at mental health issues of today and how it is okay to seek help. As always, amazing…  https://t.co/uuhv10L9ok",['pangdemonium'],36
373,1231525803495755777,2020-02-23,18:26:46,I'm at Institute Of Mental Health (IMH) in Singapore  https://t.co/GB7FVubTmx  https://t.co/CzpbgTkXYL,[],8
374,1231038226065805312,2020-02-22,10:09:19,#Snapchat is adding support for kids loooking for info on #anxiety #depression #suicide #mentalhealth #EdTech #SAISrocks #scchat,"['snapchat', 'anxiety', 'depression', 'suicide', 'mentalhealth', 'edtech', 'saisrocks', 'scchat']",9
375,1230879443196899328,2020-02-21,23:38:22,#MentalHealth is not a #joke . People think if you seek help you are weak. It’s actually the brave that do that. 🙏🏼,"['mentalhealth', 'joke']",20
379,1229062433106468864,2020-02-16,23:18:13,I'm at Institute Of Mental Health (IMH) in Singapore  https://t.co/PZt3ZXbjnp  https://t.co/1gQ0j8dsLx,[],8
380,1227586356563472384,2020-02-12,21:32:49,"‘According to Harvard’s Center on the Developing Child, the impacts of experiencing repeated incidents of toxic stress as a child “…persist far into adulthood, and lead to lifelong impairments in both physical and mental health.”’  https://t.co/meGO4MB72j",[],36
381,1227511599662895104,2020-02-12,16:35:46,"I’ve been a advocate for mental health publicly for more than a decade. It can be exhausting, but it is so awesome to witness younger generations take the baton. They are inspiring, spirited, and hopefully the baton will keep on passing until it is no longer weird.",[],48
382,1227493937981448194,2020-02-12,15:25:35,NEED A STRONG MOTIVATION TO STUDY FOR MENTAL HEALTH,[],9
383,1227060297229164545,2020-02-11,10:42:27,"To me, bullying or constant harassment or disrespect is toxic and i would leave because i know those shit gonna affect my mental health which is not worth the thousands of dollars i'll earn from the job.",[],36
385,1226895876867555328,2020-02-10,23:49:06,well sorry your salty ass can’t understand simple shit such as mental health😷😷,[],14
386,1226731978373750784,2020-02-10,12:57:49,I hate it cause watching cobain’s documentary can’t be any better for his mental health. that shit heavy.,[],20
387,1226488965034721280,2020-02-09,20:52:10,@TreatYoBrain If u want to mention it also mention the things that keeps u positive. E.g. “ my mental health can sometimes give me challenges but I overcome them by *fill in the blank*”.,[],33
388,1226301882001391617,2020-02-09,08:28:46,I'm at Institute Of Mental Health (IMH) in Singapore  https://t.co/rfxwFS8tWi  https://t.co/bba8FqHOLO,[],8
389,1226276644471488513,2020-02-09,06:48:29,@tweetsbyelliot However in terms of help: there are great resources Accessible to everyone.  But it's just the stigma that is associated with mental health that still needs to be removed in most parts of the country.   3/n,[],35
390,1226275924401721344,2020-02-09,06:45:38,@tweetsbyelliot Lack of awareness.   Mental health is not acknowledged as a real thing. Usually you just stop feeling depressed or anxiety is attributed to lack of preparation for example.  1/n,[],29
391,1225703303775830017,2020-02-07,16:50:14,@zellwk I guess anything you do intentionally and primarily to take care of your well-being — both mental and physical.  Is there anything in particular that you do to maintain good mental health? 😊,[],30
392,1225700914511482881,2020-02-07,16:40:45,"@rosschapman @jennyshen Hey Ross, thanks for answering! Do you find that it makes a big difference to your mental health? 😊",[],18
393,1225700709393285121,2020-02-07,16:39:56,"@jaetopz Thanks for sharing!! It seems that mental health self-care for men seem to include a lot of physical activity, that’s really interesting.",[],22
394,1225447931261489152,2020-02-06,23:55:29,"Me parenting myself the past few days:  Gotta admit, being able to process difficult feelings in a safe way is very good for my mental health.  https://t.co/DQ3xPRvfy4",[],26
395,1225424006758551552,2020-02-06,22:20:25,"@cliener Good one, work life balance makes a big big diff 🙌🏻 Do you do anything active to keep your mental health healthy?",[],21
396,1224139759825514496,2020-02-03,09:17:16,Wah @Kiss92fm 9am DJs discussing Amber Heard/Johnny Depp as if they know them. “Johnny says we can’t be violent anymore; I dunno whether I can be perfect” “She obviously is very emotional and has mental health issues” 🙄🙄🙄 STOP. NOW. Pls.,[],40
397,1223628322413789184,2020-02-01,23:25:00,My mental health really aint doing well today huh,[],9
398,1222544231631208449,2020-01-29,23:37:13,Today Bell will donate 5¢ towards #mentalhealth initiatives for each use of #BellLetsTalk.,"['mentalhealth', 'bellletstalk']",10
399,1222525243660500993,2020-01-29,22:21:46,'Nature Connection and Mental Health of Communities' research program to be initiated with today’s talk by dr Diana from #neurolandscape at the National University of Colombia in Manizales. Here's to healthy communities of the future!  #healthycommunities #mentalhealth  https://t.co/u8Fy1GR5F3,"['neurolandscape', 'healthycommunities', 'mentalhealth']",34
400,1222484533812973568,2020-01-29,19:40:00,Today Bell will donate 5¢ towards #mentalhealth initiatives for each use of #BellLetsTalk.,"['mentalhealth', 'bellletstalk']",10
401,1221864179205718016,2020-01-28,02:34:56,"These films/shows goes heavily into mental health , addiction, trauma etc.  https://t.co/yhd27AZSsa",[],11
402,1221248924372963328,2020-01-26,09:50:07,Mental health is a new ecosystem service. And already incorporated into practice of urban planning like for example in the works of the Stanford Natural Capital Project.    https://t.co/1A9exNFsyH,[],27
403,1220979560159703040,2020-01-25,15:59:46,I work in the mental health field so I know for a fact that if you can afford to go to a few festivals a year you can afford to get help instead of going to those,[],37
404,1220977646764318721,2020-01-25,15:52:10,"If you know you have mental health issues like depression, why do you keep full sending festivals and popping pills instead of seeking professional help?",[],25
405,1220532930553888768,2020-01-24,10:25:01,"And people who doesnt care about mental health. And making me feel people that my feelings are invalid that I am just overt thinking things.U know guys, I really hope i really really hope, Its just over thinking, my life would be easier.",[],44
407,1218141789091090433,2020-01-17,20:03:29,Thank you to #baseconf2020 organized by startcompanymy and powered by @Chasecomm1 summit for allowing me to give the opening keynote and talking on mental health and corporate innovation and ecosystem building. The…  https://t.co/AsgRKU9Kqo,['baseconf2020'],30
408,1218045531689144320,2020-01-17,13:40:59,Please choose to prioritise your mental health by getting friendship contracts done for rabzkebabz friends like @Retroballz. My lawyer only charges 1 can of strong zero per contract. But feel free to buy 1 more for me. 🙌🏾,[],34
409,1217785608564662273,2020-01-16,20:28:09,"Toxic parents, toxic siblings, toxic friends, toxic partner should NOT be dealt with patience but SHOULD be dealt with leaving. What's constantly affecting your emotional and mental health will not do you good.",[],32
410,1216622091740467200,2020-01-13,15:24:45,"Presented my abstract on our Mental Health Project, @CUHKMedicine first student-faculty collaboration on mental health at APMEC2020. The project still takes place annually, achieving our goal to be sustainable, approachable &amp; student centred #MentalHealthMatters #MedEd  https://t.co/W3So0BPOyD","['mentalhealthmatters', 'meded']",30
411,1214331494132400128,2020-01-07,07:42:44,@Azuraysf Same. It gets very depressing. Doing this for my mental health.,[],11
412,1213486964730736640,2020-01-04,23:46:52,I'm at Institute Of Mental Health (IMH) in Singapore  https://t.co/uC2yGHLPkC  https://t.co/TNuuqykAEM,[],8
413,1212859898574196736,2020-01-03,06:15:08,"My friend @angelabethcan made this beautiful post on my birthday and it’s perfect as my first proper post of the new year! Check out her work loves!  Here is what you can expect from my account in 2020: more fat positivity, eating disorder awareness, mental health awareness,  https://t.co/e2wQjOGten",[],46
414,1212633359249133568,2020-01-02,15:14:57,Sick means sick. You still want to give me consultation on how to improve my lifestyle cause my mc count is high. 🤷🏽‍♀️ and you start relating to mental health being so important. You’re not helping 🤦🏽‍♀️,[],36
