,id,date,time,tweet,hashtags,num_words
247,1317003074863390725,2020-10-16,15:22:56,"and yes trust me, counselling is really good for your mental health.",[],12
249,1316348115159457792,2020-10-14,20:00:21,"100 truth ‼️ ite effect your skills, credibility and mental health.",[],9
250,1316302317637914625,2020-10-14,16:58:22,It may not be easy but remember; there is no shame in seeking and asking for help when you need it!   Tag a friend to remind them! 💌☀️  #ReMind #mentalhealth #mentalhealthawareness #covid19 #workfromhome #safemanagement #mentalhealthtips #mentalillness  https://t.co/IGrTGf14Rb,"['remind', 'mentalhealth', 'mentalhealthawareness', 'covid19', 'workfromhome', 'safemanagement', 'mentalhealthtips', 'mentalillness']",27
251,1316302164369711107,2020-10-14,16:57:46,"☀️#𝗪𝗲𝗹𝗹𝗻𝗲𝘀𝘀𝗪𝗲𝗱𝗲𝘀𝗱𝗮𝘆𝘀☀️  While telecommuting remains the default for most companies, more and more people are gradually returning to their offices. 🏢  For today's post, here are some tips for managing your mental health while at the workplace. 📊📈  #ReMind  https://t.co/oGyQRB1xbH","['𝗪𝗲𝗹𝗹𝗻𝗲𝘀𝘀𝗪𝗲𝗱𝗲𝘀𝗱𝗮𝘆𝘀', 'remind']",33
252,1316196319094923264,2020-10-14,09:57:10,tried to claim a mental health day with my leave but it got rejected cos tmr have 2 shoot gun :'-),[],19
253,1314857367343828992,2020-10-10,17:16:39,We at #ReMind would like to wish everyone a Happy World Mental Health Day 2020! 💚  What are you doing this World Mental Health Day? Let us know! 🤩  #ReMind #WellnessWednesdays #singapore #mentalhealth #worldmentalhealthday #worldmentalhealthday2020  https://t.co/QwBSm0oHZb,"['remind', 'remind', 'wellnesswednesdays', 'singapore', 'mentalhealth', 'worldmentalhealthday', 'worldmentalhealthday2020']",25
254,1314746561880965122,2020-10-10,09:56:21,"Today is World Mental Health Day, I want to remind that if any of you guys out there don’t feel in place and it’s getting too much to handle , I’ll be a dm away to be there for you❤️ literally anyone at all🥰",[],46
255,1314074670048534528,2020-10-08,13:26:30,@runaway_lights My wife's place is giving 2 days of Mental Health Off &amp; no meetings allowed on Friday. There's always another option 🤓,[],17
256,1313880709417725952,2020-10-08,00:35:46,not to simp for l**** n* but I can’t see myself making fun of how tired he looks if I’m out here stanning raeesah for speaking out about mental health and being open about her seeing a therapist. the two aren’t the same ofc but sth about it strikes me as *chefs kiss* hypocritical,[],57
257,1313798410768580608,2020-10-07,19:08:44,Orang busy fyp i busy workout build mental health . Bye,[],10
258,1313709984471900160,2020-10-07,13:17:22,✨ 3️⃣ 𝗱𝗮𝘆𝘀 𝘁𝗼 𝗪𝗼𝗿𝗹𝗱 𝗠𝗲𝗻𝘁𝗮𝗹 𝗛𝗲𝗮𝗹𝘁𝗵 𝗗𝗮𝘆! ✨  World Mental Health Day reminds us that personal health would not be complete without mental health 💚  Swipe to learn more about it! ➡️  #ReMind #WellnessWednesdays #mentalhealth #worldmentalhealthday  https://t.co/gIOnrYM5aB,"['remind', 'wellnesswednesdays', 'mentalhealth', 'worldmentalhealthday']",22
259,1313665480419229696,2020-10-07,10:20:31,"I was not prepared enough when I read the description of Mental Health Conference ""the content might be triggering"". 😣",[],19
260,1313663924512985088,2020-10-07,10:14:20,Tune in this evening for a chat with @limxjoel and friends on what we all can do to help create greater awareness of mental health concerns and creating an inclusive society. Tune in at my Instagram page @chuanjin1  https://t.co/WamIPJBwaq,[],36
261,1313098471000305664,2020-10-05,20:47:26,Choose people who are good for your #Mentalhealth,['mentalhealth'],7
262,1313085167951466496,2020-10-05,19:54:34,@nanahmzh My mental health was better ever since my original IG got reported and disappeared. Starting fresh was good for me personally lel,[],22
263,1312563040093495296,2020-10-04,09:19:49,I feel like I have been prioritising and care for others way too much. I forgot that my feelings matters. I have forgotten to prioritise my mental health first.,[],29
264,1311907623256682496,2020-10-02,13:55:26,"Proud to be featured with a full page today in the Entrepreneurs Digest.  To combat executive loneliness, lead together.  #thoughtleader #executives #executiveloneliness #Anxiety #mentalhealth #mentalwellbeing #stigma  https://t.co/T9JoWFQor5","['thoughtleader', 'executives', 'executiveloneliness', 'anxiety', 'mentalhealth', 'mentalwellbeing', 'stigma']",19
265,1311223987045765123,2020-09-30,16:38:54,"It’s #WellnessWednesday! 🎉🎉🎉   Always remember that its not just your physical health 💪 you need to take care of. Your mental health is just as important! After all, there is no health without mental health.   Tag your friends to #ReMind them!  #mentalhealth #mentalwellbeing  https://t.co/BtYkHm6wYb","['wellnesswednesday', 'remind', 'mentalhealth', 'mentalwellbeing']",38
267,1310090977462362112,2020-09-27,13:36:43,At this point ms hegerty’s comment is so out of touch that she’s just basically trying to cover up her initial mistake of microagressive comments and now moving it towards mental health discussions &amp; comparisons which she didn’t bother to really know and understand. 😞 turn off,[],48
268,1309499428437405698,2020-09-25,22:26:07,"My organic chilli, good for lunch tomorrow. Mindfulness gardening is a great way to get away and feeling more focus-relax. #mindfulness #gardening #mentalhealth #orgnanic #Chilli #focus #relax #adrewangsg @ Singapore  https://t.co/mhVEOgq7fj","['mindfulness', 'gardening', 'mentalhealth', 'orgnanic', 'chilli', 'focus', 'relax', 'adrewangsg']",20
269,1309077698560614400,2020-09-24,18:30:19,"@ChrisK__83 Fuck off, no room here for mental health stigma. My queen lives with bpd and she’s such a strong woman for it. You have twenty four hours to unfollow before I block you.",[],34
270,1308219181892952064,2020-09-22,09:38:53,Mental health is so so so important.,[],7
271,1307921428415537152,2020-09-21,13:55:43,"social media managers advising their government clients to take part in the push up challenge to raise awareness for mental health, please do them a favour and don’t lmaoooo not only is it peak cringe, they literally have the power to idk do more than raise awareness",[],48
272,1307323623460413446,2020-09-19,22:20:15,what have you done for yourself? what have you done for your mental health?,[],14
273,1307183090251386882,2020-09-19,13:01:49,"My mental health has been the most important thing to me and I’ll never be afraid to cut off anyone , literally anyone who makes me feel threatened about my emotions. The day I see myself going back to who I was , I’m cutting whoever off.",[],47
274,1306078495794233344,2020-09-16,11:52:33,☀️ #𝙒𝙚𝙡𝙡𝙣𝙚𝙨𝙨𝙒𝙚𝙙𝙣𝙚𝙨𝙙𝙖𝙮𝙨 ☀️  Here are some examples of things you should avoid saying to people who suffer from anxiety disorders ☺️  It's always good to be more mindful of our words!   Tag a friend to remind them! 💌☀️  #ReMind #singapore #mentalhealth  https://t.co/FSQV9CiC0f,"['𝙒𝙚𝙡𝙡𝙣𝙚𝙨𝙨𝙒𝙚𝙙𝙣𝙚𝙨𝙙𝙖𝙮𝙨', 'remind', 'singapore', 'mentalhealth']",32
275,1305471725178482689,2020-09-14,19:41:28,💚𝙑𝙤𝙡𝙪𝙣𝙩𝙚𝙚𝙧 𝙬𝙞𝙩𝙝 𝙍𝙚:𝙈𝙞𝙣𝙙 💚  Applications for volunteers are open once again!  Check out this link to find out how:  https://t.co/97OlREEQpN  #ReMind #singapore #volunteer #recruitment #joinus #mentalhealth #mentalhealthawareness #mentalillness #selfcare  https://t.co/kGp41XHMjd,"['remind', 'singapore', 'volunteer', 'recruitment', 'joinus', 'mentalhealth', 'mentalhealthawareness', 'mentalillness', 'selfcare']",15
276,1304135208187305987,2020-09-11,03:10:37,TW: Mention of Suicide  10 Ways to ‘Reach Out’ When You’re Struggling With Your Mental Health  https://t.co/usujJi0yXY  #HopeThroughTheNight #SuicidePrevention,"['hopethroughthenight', 'suicideprevention']",16
277,1302995135983243266,2020-09-07,23:40:23,🧸My bed represents my mental health right. 🛌 #iwokeuplikedis @ On My Sexy Bed  https://t.co/PvWmZ2Ld3I,['iwokeuplikedis'],11
278,1302984600528932865,2020-09-07,22:58:31,"We invited Dr Ang Yong Guan, A Psychiatrist of 23 years and recently a PSP candidate in the recent GE202 and someone whom is diagnosed and suffers from mental illness to have a conversation on our podcast about mental health. Hope this piece of content helps whoever that needs it",[],48
279,1302467805099569153,2020-09-06,12:44:58,"*4PM's Santai Series* is back for its 6th installation, focusing on Mental Health! We are thankful to have Dr Radiah Salim, President of Club Heal to navigate some of the challenges that those recovering from Mental…  https://t.co/ABvoAuDhJr",[],35
280,1301561782251655168,2020-09-04,00:44:45,A week without Grindr?  My skin cleared My mental health improved My Tenga is utilized,[],15
281,1301025102713090048,2020-09-02,13:12:11,Felt so tired this morning but feel amazing after a workout. Don’t understand how people can not exercise regularly. It’s basic self-care - good looks and mental health wellbeing rolled into one.,[],32
282,1299517130069536768,2020-08-29,09:20:02,"Super happy that had our first Dr on our podcast as a guest. Dr Ang Yong Guan, whom is a Psychiatrist of 34 years and PSP Candidate that contested in Marymount during GE2020. We talked about Mental Health and Youths. 🙏🏾🙏🏾  https://t.co/fPejWPadg2",[],38
283,1299311544724058115,2020-08-28,19:43:06,Dessert and Tea #food #dessert #mentalhealth #sweettooth @ TWG Tea on the Bay at Marina Bay Sands  https://t.co/MhxaNOTmL4,"['food', 'dessert', 'mentalhealth', 'sweettooth']",12
284,1298477942155046912,2020-08-26,12:30:40,@tim_sandsquid63 I hear ya. Many of us can be considered “failures” by any given societal measure. It was when I recalibrated my personal measures of worth v-a-v society’s that my mental health started to fall into place.,[],36
286,1296223630263635969,2020-08-20,07:12:50,"@ChiKittieGamer Well chi i know that feeling. But something i realised, i started streaming to help with my stress and social awkwardness. So if streaming actually harms ur mental health then go ahead. In the end u have to put yourself first. We are here for u no matter what 💖",[],49
287,1296105466070593537,2020-08-19,23:23:18,i can’t help breaking down :( my mental health is really bad,[],12
288,1295031261258375168,2020-08-17,00:14:47,I feel like if i keep going on my mental health will just go downhill. If i do let go am i a quitter....,[],24
289,1294869878612963328,2020-08-16,13:33:31,"Three years ago, at the last lecture for our #counselling diploma. What a journey we’ve been on since then! #Mentalhealth #wellbeing  https://t.co/j4FeBxjM94","['counselling', 'mentalhealth', 'wellbeing']",19
290,1293576548633608192,2020-08-12,23:54:17,It's mid week only and this week has already been pretty bad for me in terms of mental health,[],18
291,1293557798618333184,2020-08-12,22:39:46,Mental health out of hand,[],5
293,1293434921252343809,2020-08-12,14:31:30,That’s one step away from negativity. I really wish her well on her mental health! Hope she’s on her way to recovery! Fighting #MINA! 💪🏼💪🏼💪🏼,['mina'],25
294,1290558054937710592,2020-08-04,15:59:52,And yet the mental health sector was deemed “non-essential”  👀,[],8
295,1285397626112761856,2020-07-21,10:14:10,"The media must now wrestle with itself over whether to report similar episodes. Freedom of speech, mental health, one group’s word against another, make this a near impossible situation to navigate.",[],32
296,1284876752817467398,2020-07-19,23:44:24,Saw this from heyymakarina story and had to share it. Mental health is wealth too. Swipe left for practical advice on achieving better self-care.   Credits: selfcareisapriority   #financeandtoast #marketingstrategy…  https://t.co/d3ZeMgSTEu,"['financeandtoast', 'marketingstrategy']",25
297,1276305913658265600,2020-06-26,08:06:57,We can learn a lot investigating these communities! New project of #NeuroLandscape on 🌳Nature Connection and Mental Health of Communities🌳with volunteers from #Dhaka #Bangladesh and #Medellin #Colombia  https://t.co/FbVBsJBs3X,"['neurolandscape', 'dhaka', 'bangladesh', 'medellin', 'colombia']",23
298,1272897584730865664,2020-06-16,22:23:28,🍃Designing School Grounds to Support Children’s Mental Health: Examples from Around the World🍃 webinar by @ISchoolGroundsA and @ChildrenNature coming soon! Register now  https://t.co/ewfRErzj6h,[],21
299,1272637522879737856,2020-06-16,05:10:04,@Being_SSS @GabbbarSingh Precisely my point. Nepotism exists everywhere. Let’s move on and focus on what’s important. Issues related to mental health are real. People need to acknowledge that and stop trivialising it. Thanks my friend!,[],35
300,1272630634737856512,2020-06-16,04:42:42,@GabbbarSingh What appalls me even more is Kangana being hailed as some sort of Messiah. Her speech on how if you are intelligent you can’t be suffering from mental health issues is cringeworthy.,[],33
301,1272628231154176000,2020-06-16,04:33:09,@GabbbarSingh I have gone blue in my face trying to explain to some that nepotism exists everywhere but the key takeaway from this tragic loss should be a positive discourse on the importance of mental health. But the track runs right back to nepotism no matter what.,[],46
302,1272540836178169856,2020-06-15,22:45:52,"@adityasutrale @ManpreetMuskaan @STUPIDREACTIONS It’s better if we don’t fall for sensationalism and actually focus on what’s important, which would be promotion and visibility of the importance of mental health.",[],29
303,1272382101984165888,2020-06-15,12:15:07,"As a teenager, I was the queen of fretting over ""fear of missing out"" even before #FOMO was a thing. But adulting has got to the other side of the spectrum. Joy of Missing Out. #JOMO  #Mentalhealth #Peace #MentalHealthMatters #DoWhatYoyHaveTo","['fomo', 'jomo', 'mentalhealth', 'peace', 'mentalhealthmatters', 'dowhatyoyhaveto']",34
305,1272337178798944257,2020-06-15,09:16:36,A man dies tragically and everyone is eager to do his postmortem.We somehow are able to produce the highest number of mental illness experts within 24 hrs . How shallow and pathetic people are to use someone's death as a reminder to discuss mental wellness? #sushant #Mentalhealth,"['sushant', 'mentalhealth']",41
306,1272326958265716737,2020-06-15,08:36:00,@YRDeshmukh Don’t show your ignorance about mental health issues in public.   Please do read up.,[],15
307,1272221966691266560,2020-06-15,01:38:48,"Mental health awareness is very important as research has it said, suicidal case has been topping the world death case over the deadly cancer itself!",[],25
308,1272195857547317248,2020-06-14,23:55:03,"As much as we need to fight the demons of mental health and depression,  why is it being concluded in #SushantSinghRajput case that that’s the case ? Looking at events of last few days can’t this conclusion be made on facts?  #ripsushant","['sushantsinghrajput', 'ripsushant']",41
310,1272156302072967168,2020-06-14,21:17:52,"@niiravmodi you need support or know someone who does, please reach out to your nearest mental health specialist.) Helplines: AASRA: 91-22-27546669 (24 hours) Sneha Foundation: 91-44-24640050 (24 hours) Vandrevala Foundation for Mental Health: 1860-2662-345 and 1800-2333-330 (24 hours)",[],30
311,1272152445267791872,2020-06-14,21:02:33,"A shocking loss. Mental health needs to be taken seriously, especially in these times. Rest easy Sushant Singh Rajput 🖤  https://t.co/dLPVXujRlL",[],19
312,1271990402594324480,2020-06-14,10:18:39,I'm at Institute Of Mental Health (IMH) in Singapore  https://t.co/RYAKNZkQva  https://t.co/YPdVOYKRI5,[],8
314,1270582747975712769,2020-06-10,13:05:08,👥 Dissociative Identity Disorder 👥   Do you know other facts about DID❓Let us know by starting a thread here! 💬  #ReMind #singapore #mentalhealth #mentalhealthawareness #did #dissociativeidentitydisorder #multiplepersonalitydisorder #recovery #mentalillness #bpdawareness,"['remind', 'singapore', 'mentalhealth', 'mentalhealthawareness', 'did', 'dissociativeidentitydisorder', 'multiplepersonalitydisorder', 'recovery', 'mentalillness', 'bpdawareness']",18
315,1270142076848672773,2020-06-09,07:54:03,I'm at Institute Of Mental Health (IMH) in Singapore  https://t.co/msdV7W2g23  https://t.co/g97I23O0Ei,[],8
317,1269567162609479682,2020-06-07,17:49:33,I'm at Institute Of Mental Health (IMH) in Singapore  https://t.co/Oa1kEaSovE  https://t.co/XCPmsXo3fj,[],8
318,1269478323345715200,2020-06-07,11:56:32,I'd be interested to see the role social media is playing on the mental health of people through this year and the unique stresses and strains it is bringing. Does anyone know if anyone is studying it?,[],36
319,1268817610499473408,2020-06-05,16:11:06,Mental health day off and this beautiful weather for company #Grateful #Fromwhereirun  https://t.co/75R0VEcLxu,"['grateful', 'fromwhereirun']",10
320,1268340827782168576,2020-06-04,08:36:32,Ok ew why is she laughing to herself like that??   Hello INSTITUTE OF MENTAL HEALTH pick this rotten family up,[],20
321,1268331621922623488,2020-06-04,07:59:57,I'm at Institute Of Mental Health (IMH) in Singapore  https://t.co/OFA2IUbHQh,[],8
322,1268074725659381760,2020-06-03,14:59:08,💥Post-Traumatic Stress Disorder 💥  Inspired by Amy's story? Tag a friend below to help them learn more about PTSD! 💌  #ReMind #WellnessWednesdays #PTSD #PostTraumaticStressDisorder #MentalHealthIssues #MentalHealth #MentalHealthAwareness  https://t.co/dP8bhgI2TG,"['remind', 'wellnesswednesdays', 'ptsd', 'posttraumaticstressdisorder', 'mentalhealthissues', 'mentalhealth', 'mentalhealthawareness']",16
323,1267814803092824066,2020-06-02,21:46:18,"Remember, non-black allies. It’s not about you. Take care of yourself, and your mental health, absofuckinglutely, but don’t call attention to yourself in needless ways. It’s all about Black people in America right now.",[],36
324,1267094975252254720,2020-05-31,22:05:58,"Today is the last day of Mental Health Awareness Month 💙 My wish for everyone is simple: to be kind to themselves and to others, to always prioritize your mental health and well-being, and to know it is OKAY to reach…  https://t.co/HpuO4aBujh",[],39
325,1266408959826518017,2020-05-30,00:39:59,It’s OK not to feel OK. My latest on @successmagazine to help you deal with your negative emotions  #toxicpositivity #Emotions #Mentalhealth #InThisTogether #resilience,"['toxicpositivity', 'emotions', 'mentalhealth', 'inthistogether', 'resilience']",18
326,1265984183161073664,2020-05-28,20:32:04,"@codenamewallaby Being kind to myself -rest, sleep, exercise, laughter - and prioritizing my physical and mental health over the deadlines or internal pressure to write. It's helping. I think both the fiction and non fiction are coming out stronger.",[],36
327,1265822853309448192,2020-05-28,09:51:00,Day 52 of #circuitbreakersg. Are we done ruining the economy? And mental health? @govsg,['circuitbreakersg'],11
328,1265806460211965953,2020-05-28,08:45:52,My joy to have completed and received the certificate on Mental Health Awareness from New Skills Academy!  https://t.co/av3cUvyBgH,[],17
329,1265113849499283456,2020-05-26,10:53:41,PSA: just by mentioning about mental health doesn’t make you seem like you’re bringing awareness. really act on doing things please. it’s a taboo topic in asia and why should it be,[],35
330,1262979455934361602,2020-05-20,13:32:21,🧐Borderline Personality Disorder☁️  Swipe for MORE FAQs about the topic ✨➡️  #WellnessWednesdays #remind #singapore #mentalhealth #mentalhealthawareness #bpd #borderlinepersonalitydisorder #recovery #anxiety #mentalillness #bpdawareness  https://t.co/Oa9yxlVgSE,"['wellnesswednesdays', 'remind', 'singapore', 'mentalhealth', 'mentalhealthawareness', 'bpd', 'borderlinepersonalitydisorder', 'recovery', 'anxiety', 'mentalillness', 'bpdawareness']",10
331,1262978766260719616,2020-05-20,13:29:37,"🧐Borderline Personality Disorder☁️  This week on #WellnessWednesdays, we uncover Borderline Personality Disorder! Think you know what it’s all about? Swipe for FAQs about the topic ✨➡️  #remind #singapore #mentalhealth #mentalhealthawareness #bpd #borderlinepersonalitydisorder  https://t.co/gXYkkoZA5m","['wellnesswednesdays', 'remind', 'singapore', 'mentalhealth', 'mentalhealthawareness', 'bpd', 'borderlinepersonalitydisorder']",25
332,1261975502383800320,2020-05-17,19:03:00,#MyChristianDiary #004 Keep Talking to Jesus  https://t.co/X2F1jfQB3o via @YouTube #JesusisKing #Mentalhealth #COVID19,"['mychristiandiary', 'jesusisking', 'mentalhealth', 'covid19']",5
333,1260898364251463683,2020-05-14,19:42:51,"I've been clinically diagnosed with Generalised and Social Anxiety Disorder, with Depression. I believe I have undiagnosed ADHD. I am excused from handling firearms due to my suicidal tendencies. LOONA was talking about reinvention, not self-harm. Do not trivialise mental health.",[],39
334,1260484791151058950,2020-05-13,16:19:27,"👥 Facts &amp; Myths: Bipolar Disorder 👥  This #WellnessWednesdays, we’re going to bust some myths on our 2nd instalment of Facts &amp; Myths! Read on below.   ___ #remind #singapore #mentalhealth #mentalhealthawareness #bipolar #disorder #facts #myths  https://t.co/GjCGHHnOC9","['wellnesswednesdays', 'remind', 'singapore', 'mentalhealth', 'mentalhealthawareness', 'bipolar', 'disorder', 'facts', 'myths']",21
335,1260484199682801666,2020-05-13,16:17:06,👥 Facts &amp; Myths: Bipolar Disorder 👥  Some time ago on our #WellnessWednesdays post we covered Bipolar Disorder! But do you know there are some misconceptions regarding this mental health condition? ___ #remind #singapore #mentalhealth  #bipolar #disorder  https://t.co/BnWSjmtMxM,"['wellnesswednesdays', 'remind', 'singapore', 'mentalhealth', 'bipolar', 'disorder']",27
336,1260440334602993664,2020-05-13,13:22:48,Tip: Remember to moderate your news exposure and to limit to one or two news sources. #COVID19 #mentalhealth #singapore  https://t.co/P6b8PqZsBi,"['covid19', 'mentalhealth', 'singapore']",16
337,1260001254375219200,2020-05-12,08:18:03,"Family can be toxic too so it’s only logical and wise to take a break when it’s needed. Unfortunately, for some, cutting ties may be the only way. Remember, mental health comes first.",[],35
338,1259841203656368128,2020-05-11,21:42:04,"""Jitne bhi chocolate khalo Kuch depression Kabhi Kam nahi hotey""  Pretty much going through what #KonkanaSenSharma is, in #LifeInAMetro  . . . #Bollywood #MentalHealth #HangInThere","['konkanasensharma', 'lifeinametro', 'bollywood', 'mentalhealth', 'hanginthere']",17
339,1259527370727231488,2020-05-11,00:55:00,Trust your therapist when he/she says Journaling helps. It does.  #SelfCare #mentalhealth #BreakTheStigma #gratitude,"['selfcare', 'mentalhealth', 'breakthestigma', 'gratitude']",11
340,1259421416270643200,2020-05-10,17:53:59,"take advantage of others, but these aren't the issues. the issue is the gay community's poor state of mental health. some men can't have sex with guys their age due to their immaturity.",[],30
341,1258697997061246976,2020-05-08,17:59:22,"As migrant mental health suffers in Singapore dorms, aid groups rally  https://t.co/N72ExBLeOc",[],11
342,1258605071501328384,2020-05-08,11:50:07,"Shades of Blue // 💙  #SeeItBlue is a nationwide campaign on mental health awareness during this challenging time.  More than 30 (and counting) key landmarks in Singapore such as esplanadesingapore, gardensbythebay,…  https://t.co/KHfbw0HzKf",['seeitblue'],27
345,1256113695232421889,2020-05-01,14:50:17,Family #screenfree weekend challenge! With three #teenagers it was gone in less than 3 minutes! #pandemicbaking #Mentalhealth  https://t.co/LsqwW2y1Sn,"['screenfree', 'teenagers', 'pandemicbaking', 'mentalhealth']",12
346,1253981666135216129,2020-04-25,17:38:21,👉 ReTweet if you are agree #Mindfulness #MANWITHAMISSION #money #wise #MoneyForThePeople #OneMillionBoys #studentlife #معا_في_رمضان #سوق_الذهب #كوريا_الشمالية #MotivationalQuotes #motivational #MotivationalSpeaker #motivation #mentalhealth #motiongnyaphics #motionGraphics  https://t.co/mJZL2cB7z4,"['mindfulness', 'manwithamission', 'money', 'wise', 'moneyforthepeople', 'onemillionboys', 'studentlife', 'معا_في_رمضان', 'سوق_الذهب', 'كوريا_الشمالية', 'motivationalquotes', 'motivational', 'motivationalspeaker', 'motivation', 'mentalhealth', 'motiongnyaphics', 'motiongraphics']",5
347,1252960992557858817,2020-04-22,22:02:34,it sucks but do what’s best for your mental health,[],11
348,1251047906913644546,2020-04-17,15:20:39,#SocialEmotionalLearning has to be the priority right now. Relationships &amp; connections are what matter above everything else. #distancelearning #scchat #relationships #Mentalhealth #SAISrocks  https://t.co/nCgWnbeNzI,"['socialemotionallearning', 'distancelearning', 'scchat', 'relationships', 'mentalhealth', 'saisrocks']",15
349,1250436415592120322,2020-04-15,22:50:48,"Big question is when situation in the dormitories will stabilise. Days or weeks? And as numbers rise in the dorms, anxiety/mental health of workers who live there shld be addressed -- along with social distancing etc.    https://t.co/XZYpUwpAIw",[],36
350,1248563774958620673,2020-04-10,18:49:35,@ingridgoeswest speaks volume on mental health that leads to certain obsessions and @evilhag did very well in the role. You feel for the main character and agree on the commentary on social media “influencers”. Recommended film to watch and learn. #IngridGoesWest  https://t.co/4axmIXXA3y,['ingridgoeswest'],38
