,id,date,time,tweet,hashtags,num_words
114,1362823262036664321,2021-02-20,01:56:00,This is the reason why i really hate social media sometimes. It’s something that is addicting but could be very DANGEROUS for your mental health.,[],26
115,1362801781592498185,2021-02-20,00:30:39,"""But, I have also learnt that to #thrive, I cannot focus on just one aspect of my #health. Instead, I need to work on both physical and #mentalhealth to live a happier and brighter life"":  https://t.co/jANVmb9uv8 @serenebutterfly #ChronicLife #ChronicPain","['thrive', 'health', 'mentalhealth', 'chroniclife', 'chronicpain']",32
118,1362770542621696004,2021-02-19,22:26:31,"Lagi2 girls&amp; ladies out there. Nak jaga muka awet muda, kena banyakkan senyum, kurangkan stress, control your emotion. Kurangkan negative thinking, overthinking. Its not good for your mental health &amp; ofc not good for your looks.",[],35
119,1362767470034001927,2021-02-19,22:14:18,"Speaking of my degree, I will always remember the time when I wrote an entire essay on laksa while my mental health was at rock bottom and I got an A+ for it. 'Fun' times.",[],35
120,1362755775488090115,2021-02-19,21:27:50,Skripsi be testin mental health as well,[],7
121,1362720941420150784,2021-02-19,19:09:25,wow this mid term question about suicide and mental health is just heavy...,[],13
122,1362707143560998913,2021-02-19,18:14:35,We Need to Talk More About Mental Health at Work  https://t.co/k5he6DHVda  https://t.co/UVZNGRRnL2,[],10
124,1362697003441020931,2021-02-19,17:34:17,"""Be kind to yourself when you are having a bad day, give yourself some slack and don't expect to be perfect.""  Read more about How to manage your mental health 👉  https://t.co/13Sg5hl5xl  #Education #Tuition #Onlinelearning #Students #Teachers #Learning #Studying #Teaching #Tutor  https://t.co/oaSWYh3fKy","['education', 'tuition', 'onlinelearning', 'students', 'teachers', 'learning', 'studying', 'teaching', 'tutor']",29
125,1362683772022312960,2021-02-19,16:41:43,"I'm discussing “Mental Health Talks- How do you take care of you? (7-8pm)” with The Indian Startup Club. Today, 19 Feb at 21:30 SGT on @joinclubhouse. Join us!  https://t.co/4wGj4MPO0v",[],24
126,1362680202078261249,2021-02-19,16:27:32,"Effects of Exercise on the Immune Function, Quality of Life, and Mental Health in HIV/AIDS Individuals  https://t.co/2OI6Oe7v1r",[],17
127,1362678612869136385,2021-02-19,16:21:13,"""Be kind to yourself when you are having a bad day, give yourself some slack and don't expect to be perfect.""  Read more about How to manage your mental health 👉  https://t.co/B85cmZs1bk  #Education #Tuition #Onlinelearning #Students #Teachers #Learning #Studying #Teaching #Tutor  https://t.co/QksvPAauFX","['education', 'tuition', 'onlinelearning', 'students', 'teachers', 'learning', 'studying', 'teaching', 'tutor']",29
128,1362670386622525447,2021-02-19,15:48:32,Contact with Mental Health Services After Acute Care for Self-Harm Among Adults Released from Prison: A Prospective Data Linkage Study  https://t.co/gOmjnmGYBU,[],19
129,1362659638164942850,2021-02-19,15:05:49,Need to do pushups for my Mental health,[],8
131,1362626118927310851,2021-02-19,12:52:37,“is hbl affecting your mental health” damn right it is.,[],10
132,1362621892125855746,2021-02-19,12:35:50,Also note: We are not trained mental health professionals/social workers. I know some of us are - but we are careful with our public and private lives.   We can't solve your problems.,[],31
133,1362601804605714432,2021-02-19,11:16:00,"One of the hardest things about these times is keeping consistency for the long run - maintaining social distancing/staying at home, taking care of mental health. Our pets play a significant role in this, and we should be thankful for their affection and warmth.",[],44
134,1362533575048916994,2021-02-19,06:44:53,Good morning .. If you choose to let this  go.. Do it. Dont regret.. And start a new beginning  😊 #goodmorning #Mentalhealth,"['goodmorning', 'mentalhealth']",18
135,1362523939268947973,2021-02-19,06:06:36,Mental health tips now part of secondary school curriculum  https://t.co/zMJ2pZ6vJn,[],9
136,1362470199874772993,2021-02-19,02:33:03,"@MHBloggerRT @pixee_pea My first guest post ever checks it out, and don’t forget to press the Like button.  Self-talking is not harmful and talking with yourself in 3rd or second person is even more beneficial for your mental health.   https://t.co/m6pY0vIxk5",[],36
137,1362469510880624642,2021-02-19,02:30:19,"""Sometimes when we struggle w our #physicalhealth we forget about our #mentalhealth..yet the 2 are closely connected. As I have been studying #psychology for the past yr, I see more &amp; more how the 2 are related"":  https://t.co/G9TvJmQwBN @janevspain #ChronicPain #InvisibleIllness  https://t.co/ZIHvj4GAlh","['physicalhealth', 'mentalhealth', 'psychology', 'chronicpain', 'invisibleillness']",31
138,1362424273512652804,2021-02-18,23:30:34,"""It is a blessing to be a #blessing to others, so if people have been good to you in your life, thank them. Let them know"":  https://t.co/I0fL03JbVt @PainWarriorCode #BeKind #KindnessMatters #gratitude #MentalHealth","['blessing', 'bekind', 'kindnessmatters', 'gratitude', 'mentalhealth']",25
139,1362417771385032705,2021-02-18,23:04:43,"Mental health staff yang dalam command centre like us pun kene jaga actually. 1 of my guy colleague cried just now. And 3 of us suddenly realised that everyone of us haven't rest since last Tuesday, Wednesday.",[],34
140,1362412792012279813,2021-02-18,22:44:56,"I like how the sidekick enjoys my playlist as much as I do, my mental health has been depending on it for the past few months 🥲",[],26
141,1362401257994952714,2021-02-18,21:59:06,I’m so thankful for arfa &amp; Shaherra bcs they’re the two people that cares about my mental health the most.,[],21
142,1362363736024047617,2021-02-18,19:30:00,"""#Disabled people don’t get any more #depressed than abled people do and we shouldn’t be making #movies that makes everyone think all disabled people are depressed.. puts a very negative view on #disability and not true at all"":  https://t.co/p5RhnOngYd @sarahlynn358 #MentalHealth","['disabled', 'depressed', 'movies', 'disability', 'mentalhealth']",36
143,1361593795767193603,2021-02-16,16:30:32,It came a lil late but this is his gift for me. Encouragement and motivation for my mental health... Thank you sayang...  https://t.co/N3MzxXWOzU,[],22
144,1361552593076428808,2021-02-16,13:46:49,Watched The Vanishing at the Cecil Hotel.. sad.. just sad.. #Mentalhealth #MentalHealthAwareness #bipolardisorder Had to add the hashtag  #cyberbullying cos of the band #Morbid being falsely accused by web sleuths,"['mentalhealth', 'mentalhealthawareness', 'bipolardisorder', 'cyberbullying', 'morbid']",25
145,1361279082940403716,2021-02-15,19:39:59,"Watching season 4 of @NBCThisisUs. The tv show sucks out my discomforts of my mother's death, moving abroad, mental health inquietude to the point that after crying rivers I feel emotionally light. @ThisIsUsWriters has been instrumental so I can embrace the past + move forward",[],40
146,1359124283998408706,2021-02-09,20:57:35,"@FuschiaScribe Okay, thanks. This helps. Although, isn't it a bit dangerous for unqualified individuals to give mental health advise? It's a highly specialized field that takes years of study and practice.",[],28
147,1358092464184119296,2021-02-07,00:37:30,Seems so ridiculous to spend money for your mental health but if it really helps.....,[],15
148,1357233727147962368,2021-02-04,15:45:11,"Me to husband: I want to rest, can I resign for a while?  Him: Yup, I'll support your decisions. It is also healthy for your mental health. 🥰  Huhuhu 🥲",[],27
149,1356492348566294528,2021-02-02,14:39:12,Not the mental health part.,[],5
151,1355910749344784384,2021-02-01,00:08:08,"After 15 months painfully fighting leukemia, I’m finally back to work on @getbravely — we’re working to make #mentalhealth accessible, even delightful, to everyone in the world.  I’m so excited (and relieved) to be back! 🥳",['mentalhealth'],34
153,1355667738279116803,2021-01-31,08:02:30,"My company is now offering us mental health therapy.  Given that I spent all of last year at home, telling her dad jokes, my wife probably needs it more than I do.",[],32
156,1355051842359582721,2021-01-29,15:15:09,left -last sem. right-this week. prove that mental health makes a hella diff. all it took was a rly tough month of taking time/work to be self aware and resolving my issues instead of escaping 🥴  https://t.co/GD1whM7c3B,[],35
158,1353851853650313217,2021-01-26,07:46:49,"@chuckdegroat Thanks for the quote, Chuck. Enjoyed your books. I work with people with mental health problems and that quote brings up so starkly the laissez-faire attitude of the church towards those on the margins of society.",[],35
159,1353666825255411712,2021-01-25,19:31:35,"I’m so glad that I realise at this age, actually earlier than that, that marriage isn’t for me. I’ve seen / heard too much fuckery that comes with it. And it’s just not great for any individual’s mental health and personal growth. This is just my opinion.",[],51
160,1353588313135869952,2021-01-25,14:19:36,@Amittoz I worry about their mental health,[],6
161,1353255820637552641,2021-01-24,16:18:24,Singaporean's solo effort in highlighting Mental Health with an Indie Game   https://t.co/1nntblL5v2,[],10
163,1351736587638300673,2021-01-20,11:41:31,I suddenly miss my 3 months hiatus from social media. I did it last 2017 and looks like I’ll be doing it again this year. It’s indeed beneficial to my mental health! 😌,[],32
164,1351465631204339712,2021-01-19,17:44:50,"Oh God, my mental health can’t take another nationwide lockdown... here’s hoping the vaccines are effective against new strains.",[],21
165,1351357728657080321,2021-01-19,10:36:04,Working for 9 days straight now. I know im burning out when tidur pun boleh mimpi kerja. Fck this isn’t good for my mental health 😥😥,[],25
166,1350342917563457537,2021-01-16,15:23:34,Y’all hurt ur friend’s mental health (unintentionally or not) when y’all in bad mental states. And still have the nerves to say “I don’t want others going through the same shit I went through”,[],38
169,1346953830156537856,2021-01-07,06:56:32,Love this!!!   Watching Soul really made me think of this too- appreciating the awesomely beautiful little things!!   When you’re in the dark depths of mental health troubles sometimes it’s very hard but remembering that gaze of the beauty of the 🌍 will return! #mentalhealth,['mentalhealth'],44
170,1346950808424771586,2021-01-07,06:44:32,This whole tweet chain is absolutely amazing!!   @matthaig1 bringing some realness to the 🌍 of mental health!!   So grateful for all of his work! Would recommend #Reasonstostayalive and #notesonanervousplanet to everyone!!,"['reasonstostayalive', 'notesonanervousplanet']",27
171,1346794284498894849,2021-01-06,20:22:34,"@hetisemma @formulaarmsweak there are selfish and stupid people who breach covid restrictions every day. but bc lando has status, he gets the backlash 10x worse. how do you think that fairs for his mental health?",[],32
172,1346784945671340033,2021-01-06,19:45:27,@hetisemma @formulaarmsweak so what’s your stand with lando here? no sympathy and just a big “fuck you” to his mental health?   genuinely asking,[],22
173,1346657193886670852,2021-01-06,11:17:49,I'm at Institute Of Mental Health (IMH) in Singapore  https://t.co/xCveKyKKoc  https://t.co/zpI4CVc6cw,[],8
174,1346276778415857665,2021-01-05,10:06:11,Honestly rate yourself  Looks - 3/10 Creativity - 1/10 Mental health - 1/10 🧠  Empathy - 100/10 Humour - 5/10 Patience - 8/10 Social skills - 0/10 Memory - 5/10  Intelligence - 8/10 Hungry - lol/10,[],16
175,1346135304688738304,2021-01-05,00:44:01,i don’t wanna seem conceited but here’s how i honestly view myself 😬  looks 7/10 creativity 7/10 mental health 5/10 empathy 10/10 humour 7/10  patience 9/10 social skills 8/10 memory 5/10  intelligence 8/10 sleep schedule 5/10,[],27
176,1346104175994703874,2021-01-04,22:40:19,@ftmhlkmn Honestly rate yourself   Looks - 7/10 Creativity - 9/10 Mental health - 5/10 Empathy - 3/10 Humour - 10/10 Patience - 10/10 Social skills - 9/10 Memory - 4/10 Intelligence - 9/10 Hungry - 2/10,[],15
177,1346028121515028485,2021-01-04,17:38:06,I'm at Institute Of Mental Health (IMH) in Singapore  https://t.co/7TNjsKciB7  https://t.co/mF5wKv50EO,[],8
178,1345758814901915648,2021-01-03,23:47:59,"""STILL WATERS"" :  https://t.co/gL6JTBdSLa  A Short Film by Kargo Productions   Come, take this 12-min journey with us and watch till the end as we aim to shed light on Mental Health.  #StillWaters #ShortFilm #MentalHealth #Actor #KPsandhu","['stillwaters', 'shortfilm', 'mentalhealth', 'actor', 'kpsandhu']",29
179,1345334986367328257,2021-01-02,19:43:50,"Being the go to caregiver of an elderly with dementia is really taking a toll on my mental health and emotions. Like fml i feel like im gonna break down any moment, and being extra sensitive",[],36
180,1344891714180325376,2021-01-01,14:22:26,@DawnYatesArtist Not unless you want to destroy your mental health and risk a heart attack or stroke.,[],16
181,1344788409244471296,2021-01-01,07:31:56,"All i hope in 2021 are me being healthy and not frown or jealous in other people's wealth and achievements, but instead encourages me to never stop praying and working hard to achieve success like others. And also not to worsen my mental health ☺️",[],42
183,1343870858289278977,2020-12-29,18:45:55,"My Short Film; ""STILL WATERS"" premiers LIVE, TOMORROW at 9PM across FACEBOOK, INSTAGRAM and YOUTUBE. A simple movie which attempts to raise awareness on Mental Health. Hope it resonates with you. Here is an image, of one of the scenes from the film.  https://t.co/ZZbWY9I6yL",[],42
184,1343494844480696321,2020-12-28,17:51:46,I'm at Institute Of Mental Health (IMH) in Singapore  https://t.co/bL1HfYJfm3  https://t.co/PI1VDHkVmC,[],8
185,1343053406051643392,2020-12-27,12:37:39,I'm at Institute Of Mental Health (IMH) in Singapore  https://t.co/g64Eni8Epc  https://t.co/JOfDkbctvx,[],8
186,1342873495965855745,2020-12-27,00:42:45,It’s easy to see who has grown and who has stagnated during this quarantine year. 🙄   I srsly don’t have to put up with this. It ain’t worth my mental health.,[],33
187,1342567568356245504,2020-12-26,04:27:06,oh right my mental health!,[],5
188,1342418516008300545,2020-12-25,18:34:49,"This @WIRTHHats cap comes all the way from Vancouver. WIRTH support Mental Health with the proceeds. To my friends in North America, in particular Canada would highly encourage you supporting. Thank you to @DownieLive for the support to this initiative and the design of this cap!  https://t.co/koVoCm6CxC",[],44
189,1342067153701228545,2020-12-24,19:18:38,"If orang tak boleh faham i, takpe. That's totally not their fault. I want to focus on my wellbeing and good mental health.",[],22
190,1340831929835245570,2020-12-21,09:30:18,"Reflection #3: Mental Health (cont’d)  Towards the later half of the year, things really began crumbling for me. Am truly grateful to be seeing a therapist to help me reset. I wish I didn’t have to pay so much but there is a price to seeking affirmative mental healthcare in SG.",[],52
191,1340831239251456002,2020-12-21,09:27:33,Reflection #3: Mental Health  This year was a pretty tough year. I struggled through a lot of insecurity and self-doubt which comes when you’re pushing into areas that you’re not familiar with and fleeing the feeling of safety that keeps us assured. COVID exacerbated this.,[],45
192,1340521084366409728,2020-12-20,12:55:06,"Tonight's the night for this match🔴⚫ Please Man Utd, no more heart attacks for us fans! For the sake of our mental health !! #MUNLEE #mufc","['munlee', 'mufc']",22
193,1340183470048329730,2020-12-19,14:33:33,"Defamation can do so much more to someone than just ""a speech"". It impacts someone's mental health, social life and even can cause people to be suicidal",[],26
194,1340089504598769667,2020-12-19,08:20:10,Morning stress reliever.....  A much needed escapade for mental health sake.... @ Johor Bahru  https://t.co/0olSU3I3yH,[],13
195,1339539092661362694,2020-12-17,19:53:01,"@caterpillowx It really wrecked my mental health. I would spend my nights in a tizzy, trying to recover from all the horrible news out there. I was motivated with a sense of justice but at the end of the day, felt that my pieces just “ended there”. I didn’t realise this until much later.",[],54
196,1339069148748345346,2020-12-16,12:45:38,Me: *failed my exam* started laughing and texting all my friends that I have to resit for my paper.   Me also 10 mins later: having a mental breakdown.   That is why I’m worried for my mental health. Why the fuck did I laugh when I saw my results at first Bruh,[],51
198,1338289285338808320,2020-12-14,09:06:44,all the junior high school bullies now retweeting mental health shit I cannot lmaoooooooo,[],14
199,1335453019320643585,2020-12-06,13:16:25,@bratanov I think all of what you mentioned. It’s just pure denial at this time for them. They are just trying to ease their way to another chapter in their life and these statements just to maintain their “mental health “ I believe is helpful. 😊,[],44
200,1334642784121180160,2020-12-04,07:36:50,Humans are the root cause of creating mental stress for their co-workers in this pandemic. Reporting Officers are loading their staffs with more work loads without much consideration. #Mentalhealth #COVIDー19,"['mentalhealth', 'covidー19']",27
201,1334053578336452609,2020-12-02,16:35:33,arguing abt someone n then bringin up their mental health issue js ain tit bruh,[],15
202,1333801134583005186,2020-12-01,23:52:25,They fucked my mental health yet they dw to acknowledge,[],10
203,1333752262229860352,2020-12-01,20:38:13,@LauraHeathh_ Just read this blog - it’s honest and am sure many can relate to it. These are important because it will make others realise that they are not alone in what they are going through.  Your blogs will increase awareness of mental health. This is brilliant,[],46
205,1333368322503577603,2020-11-30,19:12:35,"In other news, I’m really excited to see my therapist on Wednesday. Mental health is so so so important. Hopefully I can walk away from it with some new coping strategies ✨",[],32
206,1332955705687429120,2020-11-29,15:53:00,"Just when I thought my mental health was stabilising, another anxiety attack hit! Wapow!  https://t.co/d3dlCMZwmQ",[],14
207,1332837347822624772,2020-11-29,08:02:41,I'm at Institute Of Mental Health (IMH) in Singapore  https://t.co/ONHSWArI4U  https://t.co/6wN98RDAkU,[],8
208,1331421951357718530,2020-11-25,10:18:24,mental health is so important and taking the stigma off it is as important,[],14
209,1331040298097512448,2020-11-24,09:01:51,"Guest speaker at 96.3好FM Radio &amp; Facebook Live Interview ""Views regarding the Tripartite Advisory on Mental Health"" (conversation in Mandarin language) on 24th November 2020.  https://t.co/dIDQDRBwfT",[],21
210,1330409907317661696,2020-11-22,15:16:54,Wake up.  Look at my phone  Something something covid something something mental health Something something bikini pic Something something tiktok dance something something biden something something dirty memes   Eh dah malam?!,[],31
211,1329608624662974466,2020-11-20,10:12:53,'A necessary investment': Why firms choose to cover employees for mental health services  https://t.co/gInzQ0i2l8,[],13
212,1329100809829707778,2020-11-19,00:35:01,"📌 Wow... I am on a billboard.   #scape #somaticmovement #mental #health #wellbeing #dancetherapy #somatictherapy #vincentyong #movementSG @ Singapore, City. Asia.  https://t.co/0Us04TYf1N","['scape', 'somaticmovement', 'mental', 'health', 'wellbeing', 'dancetherapy', 'somatictherapy', 'vincentyong', 'movementsg']",9
213,1329028695521189889,2020-11-18,19:48:27,tw // suicidal thoughts  i was (still am) trying to cope with a loss on top of struggling with school and my mental health lol nothing’s changed  https://t.co/a8UV4DGJqO,[],27
214,1328897120208785408,2020-11-18,11:05:37,Mental health. So critical right now.,[],6
215,1328689615755116552,2020-11-17,21:21:04,“We cannot promote mental health only because it is fodder for economic growth. That’s like promoting living because zombies aren’t known to be great office workers.”,[],28
216,1328618520632934400,2020-11-17,16:38:34,Can I have counseling for my mental health being pls,[],10
217,1328617923141795840,2020-11-17,16:36:12,Fuck I literally had a panic attack at work.. great .. there goes my mental health again .-.,[],16
218,1328377023920652288,2020-11-17,00:38:57,I'm not feeling it for my mental health advisor to visit me at home tmr...,[],14
220,1327638564532854784,2020-11-14,23:44:34,🤗 14 Nov 2020 🤗 @ Institute Of Mental Health/Woodbridge Hospital  https://t.co/aIfd9MPedr,[],7
221,1327638272005320704,2020-11-14,23:43:25,🤗 14 Nov 2020 🤗 @ Institute Of Mental Health/Woodbridge Hospital  https://t.co/i6Ty8u4sYz,[],7
222,1327550061572624384,2020-11-14,17:52:54,"Some women be like, I want him to have Daniel Craig’s body, have a stable job, normal family, I want him to drive a sports car, disregard his mental health &amp; make him obey me.",[],35
223,1327242915131785216,2020-11-13,21:32:24,@sueannajoe_ This is mental health issues.,[],5
224,1327221699591323648,2020-11-13,20:08:06,Me on the podcast talking about employee mental health and wellbeing. Its more important than ever to destigmatise and provide meaningful support structures. #futureofwork #Mentalhealth,"['futureofwork', 'mentalhealth']",23
225,1325974050364010496,2020-11-10,09:30:23,Ok minus all the breakdowns and shit because a good mental health who? We don’t know her,[],18
226,1325728110843584513,2020-11-09,17:13:07,"quit my job cause my mental health was depleting, now i’m considered jobless so its depleting even more time to do smtg to my hair",[],26
227,1325457256356438016,2020-11-08,23:16:50,👀👀👀 08 Nov 2020 👀👀👀 @ Institute Of Mental Health/Woodbridge Hospital  https://t.co/HLDIbwIX05,[],7
228,1325334508170694656,2020-11-08,15:09:04,"It’s important to check in on each other’s mental health.   It’s okay to go to couples counselling.  It helps.  It doesn’t mean you two are ending, or failing.   Talk about money.  Talk about your financial goals.  Let your partner know what you expect from them, and vice versa.",[],52
230,1323788973261516800,2020-11-04,08:47:40,Literally rn only two people on earth warrant emergency phone calls at any hour with news of their imminent / passing. The other two I live with. Silent mode is essential to mental health.,[],33
232,1322296811596455941,2020-10-31,05:58:21,30 Oct 2020 Evening No 🌧️ 🌈 @ Institute Of Mental Health/Woodbridge Hospital  https://t.co/ufA5DUgBYV,[],9
233,1322075467566903297,2020-10-30,15:18:49,Did more for my mental health than the 25 push up challenge  https://t.co/a3FFcPTBO7,[],11
234,1321491801505554435,2020-10-29,00:39:32,"Running from Depression, Running to Freedom.  Brian Chan's testimony about how running has helped him overcome mental health issues and how when he was faithless, God remained faithful and not give up on him.    https://t.co/Ef9X9mmn9P  https://t.co/cmQRcXZw4R",[],33
235,1321347316184346625,2020-10-28,15:05:24,"🙈 𝗦𝗵𝘆𝗻𝗲𝘀𝘀 𝘃𝘀 𝗦𝗼𝗰𝗶𝗮𝗹 𝗔𝗻𝘅𝗶𝗲𝘁𝘆 👉🏻👈🏻  The differences between shyness and social anxiety run deeper than we thought. Indeed, there's more to anxiety than meets the eye 👁  Swipe ⬅️ to find out more  #ReMind #WellnessWednesday #singapore #mentalhealth #shyness  https://t.co/MsYE09epYA","['remind', 'wellnesswednesday', 'singapore', 'mentalhealth', 'shyness']",25
236,1320888644077375489,2020-10-27,08:42:48,Take care of your mental health. Take care. Take care.,[],10
237,1320712178257674243,2020-10-26,21:01:35,Night guys . 8 hours sleep for thr good mental health and focus for the whole day 🙌🏻,[],15
238,1320061310848004096,2020-10-25,01:55:16,"one thing’s for sure, when you surround yourself with people who’s all about positivity and appreciation, your mental health rides on that wave too and honestly that’s a nice feeling x",[],34
239,1319976549882363905,2020-10-24,20:18:28,"highkey hope I, too, will find a better work-life balance in grad school than what I currently have in the undergrad program I'm in. the real sophomore slump is the one in my mental health",[],33
240,1319557557296328704,2020-10-23,16:33:32,"From Mental Health to Credit Risk, Here Are Next Big ESG Topics  https://t.co/QhnVBOgUaO",[],12
241,1319553776986906625,2020-10-23,16:18:31,@Mia_Squaddie 900 emails to date to 26 news outlets. Totally cray cray. Pity the state of her mental health. No family? Not working? No job? No life?,[],24
242,1319448644475482113,2020-10-23,09:20:45,I'm amazed this is how Trump brings up mental health into the debate. Despicable. #Debates2020,['debates2020'],13
243,1319428588953767940,2020-10-23,08:01:04,@msderossi Meditate please. Mental health is very important :) Follow @DeepakChopra or download @calm ;),[],10
244,1319358364611084288,2020-10-23,03:22:01,"I can't stress this enough, if you want to have an improved mental health, get away from social media, especially instagram. I feel so much better now. 🥰",[],26
245,1318873028143448064,2020-10-21,19:13:28,Those who have severe mental health issues would never wanna admit that they have it.,[],15
246,1317763525607972870,2020-10-18,17:44:42,"@danchiang @KumarrNotCow I am a full believer in education as the levelled but for a family that has to wait 5-10 years before their kids get that step up, their progress can be quite an excruciating wait + add in mental health issues from all that stress.",[],43
