postUrl,description,commentCount,pubDate,username,postId
https://www.instagram.com/p/CLwH2XBrZef/,"Today is the fifteenth and final day of Chinese New Year, 元宵节 (yuánxiāo jié), also colloquially known as Chap Goh Mei.
⠀⠀⠀⠀⠀⠀
Celebrations this year have been subdued due to the pandemic. People are meeting in smaller groups and making fewer house visits. Vaccinations for seniors are underway, and progressively for the rest of our population.
⠀⠀⠀⠀⠀⠀
If the global pandemic abates, I hope next year we can hold our usual boisterous celebrations, and usher in the Year of the Tiger together with a roar! Wishing everyone a safe and healthy Chap Goh Mei! 祝大家元宵节快乐! – LHL
⠀⠀⠀⠀⠀⠀
(MCI Photo by Betty Chua)⠀⠀⠀⠀⠀⠀",95,2021-02-26T10:22:56.000Z,leehsienloong,2517546713601644447
https://www.instagram.com/p/CLigvw3Lipt/,"Chingay Parade 2020 was one of our last major events before COVID-19 brought large gatherings to a halt. One year later, we still can’t hold the usual street parade. But obstacles can also be opportunities to try something new! 

I was among 150 guests who watched Chingay 2021, our first-ever Digital Chingay, at the Mediacorp theatre last night. Many more tuned in on TV or via the internet. Chingay Parades of years past may have featured fancy floats and large contingents of performers. But this year’s format was refreshing and original, including more performances by members of the community, and friends from ASEAN! I applaud @pafrenz on a captivating reimagining of the show! – LHL

([1] Photo by me; [2-5] MCI Photos by Fyrol)",46,2021-02-21T03:31:07.000Z,leehsienloong,2513715556460014162
https://www.instagram.com/p/CLigvw3Lipt/,"Chingay Parade 2020 was one of our last major events before COVID-19 brought large gatherings to a halt. One year later, we still can’t hold the usual street parade. But obstacles can also be opportunities to try something new! 

I was among 150 guests who watched Chingay 2021, our first-ever Digital Chingay, at the Mediacorp theatre last night. Many more tuned in on TV or via the internet. Chingay Parades of years past may have featured fancy floats and large contingents of performers. But this year’s format was refreshing and original, including more performances by members of the community, and friends from ASEAN! I applaud @pafrenz on a captivating reimagining of the show! – LHL

([1] Photo by me; [2-5] MCI Photos by Fyrol)",46,2021-02-21T03:31:07.000Z,leehsienloong,2513715556485394908
https://www.instagram.com/p/CLigvw3Lipt/,"Chingay Parade 2020 was one of our last major events before COVID-19 brought large gatherings to a halt. One year later, we still can’t hold the usual street parade. But obstacles can also be opportunities to try something new! 

I was among 150 guests who watched Chingay 2021, our first-ever Digital Chingay, at the Mediacorp theatre last night. Many more tuned in on TV or via the internet. Chingay Parades of years past may have featured fancy floats and large contingents of performers. But this year’s format was refreshing and original, including more performances by members of the community, and friends from ASEAN! I applaud @pafrenz on a captivating reimagining of the show! – LHL

([1] Photo by me; [2-5] MCI Photos by Fyrol)",46,2021-02-21T03:31:07.000Z,leehsienloong,2513715556443272164
https://www.instagram.com/p/CLigvw3Lipt/,"Chingay Parade 2020 was one of our last major events before COVID-19 brought large gatherings to a halt. One year later, we still can’t hold the usual street parade. But obstacles can also be opportunities to try something new! 

I was among 150 guests who watched Chingay 2021, our first-ever Digital Chingay, at the Mediacorp theatre last night. Many more tuned in on TV or via the internet. Chingay Parades of years past may have featured fancy floats and large contingents of performers. But this year’s format was refreshing and original, including more performances by members of the community, and friends from ASEAN! I applaud @pafrenz on a captivating reimagining of the show! – LHL

([1] Photo by me; [2-5] MCI Photos by Fyrol)",46,2021-02-21T03:31:07.000Z,leehsienloong,2513715556468468455
https://www.instagram.com/p/CLigvw3Lipt/,"Chingay Parade 2020 was one of our last major events before COVID-19 brought large gatherings to a halt. One year later, we still can’t hold the usual street parade. But obstacles can also be opportunities to try something new! 

I was among 150 guests who watched Chingay 2021, our first-ever Digital Chingay, at the Mediacorp theatre last night. Many more tuned in on TV or via the internet. Chingay Parades of years past may have featured fancy floats and large contingents of performers. But this year’s format was refreshing and original, including more performances by members of the community, and friends from ASEAN! I applaud @pafrenz on a captivating reimagining of the show! – LHL

([1] Photo by me; [2-5] MCI Photos by Fyrol)",46,2021-02-21T03:31:07.000Z,leehsienloong,2513715556476853985
https://www.instagram.com/p/CLigvw3Lipt/,"Chingay Parade 2020 was one of our last major events before COVID-19 brought large gatherings to a halt. One year later, we still can’t hold the usual street parade. But obstacles can also be opportunities to try something new! 

I was among 150 guests who watched Chingay 2021, our first-ever Digital Chingay, at the Mediacorp theatre last night. Many more tuned in on TV or via the internet. Chingay Parades of years past may have featured fancy floats and large contingents of performers. But this year’s format was refreshing and original, including more performances by members of the community, and friends from ASEAN! I applaud @pafrenz on a captivating reimagining of the show! – LHL

([1] Photo by me; [2-5] MCI Photos by Fyrol)",46,2021-02-21T03:31:07.000Z,leehsienloong,2513715556501955988
https://www.instagram.com/p/CLaqjjjgbvM/,"Happy Birthday to everyone! Today is 人日 (rén rì), the 7th day of the lunar calendar. According to Chinese custom, this marks the day human beings were created.⠀
⠀
Traditionally, Singaporeans will gather and toss yusheng. This year instead of shouting out the usual auspicious exclamations associated with lohei, some creative Singaporeans have come up with apps to replace that boisterous noise. @zaobaosg also has their own online tool called Lohei Butler, with the corresponding greeting for each ingredient.⠀
⠀
We’ve had to modify our habits in many ways, but I hope the tossing of yusheng still remains as meaningful and fun as ever. Heng, Ong, Huat ah! – LHL",56,2021-02-18T02:23:18.000Z,leehsienloong,2511506903524293580
https://www.instagram.com/p/CLIaIW_Lzb7/,"We are celebrating Chinese New Year under strict but necessary safety measures. Our COVID-19 situation is stable, but please stay vigilant to prevent new outbreaks.
⠀⠀⠀⠀
It has been a difficult year, and the comfort and support of families and friends have helped us to get through these trying times.
⠀⠀⠀⠀⠀⠀⠀
The Year of the Ox brings new hope. Our national vaccination programme is progressing. Please take the vaccine when your turn comes – both for yourself, and&nbsp; your loved ones too.
⠀⠀⠀⠀⠀⠀⠀
Let us also give heartfelt thanks to the essential workers keeping Singapore going through the festive period, as well as our Malay, Indian and Eurasian friends who will be covering for their Chinese colleagues.
⠀⠀⠀⠀⠀⠀⠀
You can read my Chinese New Year Message 2021 (in English and Mandarin) on the PMO website at go.gov.sg/cny2021pm. I wish all Singaporeans good health, and a very happy Chinese New Year. – LHL⠀⠀⠀⠀⠀⠀⠀

(MCI Photo by Terence Tan)",140,2021-02-11T00:13:04.000Z,leehsienloong,2506368116279162619
https://www.instagram.com/p/CKoGbx5r-bB/,"Honoured to address distinguished participants at the @worldeconomicforum #DavosAgenda Week Special Address on the State of the World today.

The world has changed beyond imagining since then. Economies around the world have been ravaged by border closures and lockdowns. Countries have experienced second and third waves of infection, and new variants of the virus are emerging. Meanwhile, other long-term challenges remain, like climate change, which is accelerating dangerously.

Global cooperation to tackle shared challenges has never been more critical. Forums such as the WEF not only promote dialogue, but bring together leaders from small and large countries, industry, and civil society. 

I look forward to meeting these leaders in person at the #wef2021 meeting here in Singapore in May. Let us build upon the discussions at this Davos Agenda Week and forge a new path forward. – LHL

(MCI Photo by Lee Jiawen)",81,2021-01-29T11:05:15.000Z,leehsienloong,2497274290663057089
https://www.instagram.com/p/CKSmpAtLGDj/,"Wrote to @potus Joe Biden and @vp Kamala Harris to congratulate them on their swearing-in yesterday. ⠀
⠀
Mr Biden takes office at a time when many pressing challenges confront the US and the rest of the world, not least dealing with COVID-19. Strong American leadership will decisively contribute to our collective recovery, and the shape of the post-pandemic world. ⠀
⠀
This US election was contentious and bitter. I wish Mr Biden every success in his endeavours to heal the divisions. National Youth Poet Laureate Amanda Gorman put it beautifully in her poem she recited at the inauguration: “So we lift our gazes not to what stands between us, but what stands before us. We close the divide because we know to put our future first, we must first put our differences aside. We lay down our arms so we can reach out our arms to one another, we seek harm to none and harmony for all.”⠀
⠀
Singapore has been a long-standing strategic, defence and economic partner of the US. I look forward to working with Mr Biden and his Administration to strengthen America’s engagement of Asia and ASEAN. I hope to meet him face-to-face as soon as we are able to, either in Singapore or Washington DC. – LHL⠀
⠀
(Catching up with then-Vice President Joe Biden during my visit to the White House in 2013. / PMO Photo by Alex Qiu)",165,2021-01-21T02:43:23.000Z,leehsienloong,2491223487913156835
https://www.instagram.com/p/CJqIaq1LmKG/,"Deeply saddened to learn of the passing of Encik Mahmud Awang on Monday. He was one of Singapore’s founding leaders.

A widely respected unionist, Encik Mahmud first got involved in union work when he joined the Singapore Traction Company (STC) as a bus conductor. He became close friends with Mr Ahmad Ibrahim, Mr Devan Nair and Mr Lee Kuan Yew, and won the support of many unions.

Encik Mahmud was elected to the Legislative Assembly in the 1963 General Election, and subsequently to the Parliament of newly independent Singapore. In the years when Singapore was in Malaysia, Malay PAP leaders, including Encik Mahmud, Othman Wok, Rahim Ishak, and others, came under enormous pressure by UMNO politicians to choose race over nation. But Encik Mahmud and his comrades held firm in their conviction. Their courage and leadership kept alive the vision of a multiracial Singapore, and enabled it to become the reality today.
 
Mr Lee was forever grateful for Encik Mahmud’s stout-hearted support at this critical moment in our history, and they kept in touch. At Mr Lee’s state funeral, Encik Mahmud was one of the pallbearers.
 
Encik Mahmud may have left us, but his legacy will live on. My thoughts are with his family in this time of loss. – LHL

(Encik Mahmud Awang (extreme left), a pallbearer at Mr Lee Kuan Yew’s funeral in 2015. / MCI Photo by LH Goh)",123,2021-01-05T09:29:40.000Z,leehsienloong,2479831561888752262
https://www.instagram.com/p/CJdcTJlrKz0/,"2021 brings hope that the darkest days of 2020 are behind us. That we are in a good situation now, and able to gather and celebrate the start of the new year in small groups, is the result of enormous effort and sacrifice. ⠀⠀⠀⠀⠀⠀⠀ A new generation has shown we have what it takes to make our small island nation survive and succeed, but the fight against COVID-19 is not yet won. In the months and years ahead, we will face new and unexpected hurdles. Things may happen that force us to change our plans. But so long as we stay together as one Singapore, I am confident we will blaze a path forward.
⠀⠀⠀⠀⠀⠀⠀
Happy New Year, Singapore! Stay safe, and stay strong. You can read my New Year Message for 2021 here: go.gov.sg/nym2021 – LHL
⠀⠀⠀⠀⠀⠀⠀
(Photo by me)⠀⠀⠀⠀⠀⠀⠀",182,2020-12-31T11:13:16.000Z,leehsienloong,2476259831391759604
https://www.instagram.com/p/CJZ_3-nLHCP/,"I have always been fascinated by trains, and all things to do with trains. So on Monday I took a #jalanjalan along the Rail Corridor, from Rifle Range Road to Ghim Moh.

Trains no longer run along the Rail Corridor. But at some places the tracks are still there, and one can imagine instead of joggers and cyclists, the ghosts of the old trains still rattling past, bringing travellers from Singapore to Malaysia, or back.

We are redeveloping the Rail Corridor into a 24km ‘green corridor’ that will allow everyone to enjoy our rich biodiversity and heritage in our City in Nature. Looking forward to that! – LHL

(Photos by me)",250,2020-12-30T03:07:11.000Z,leehsienloong,2475290389241570374
https://www.instagram.com/p/CJZ_3-nLHCP/,"I have always been fascinated by trains, and all things to do with trains. So on Monday I took a #jalanjalan along the Rail Corridor, from Rifle Range Road to Ghim Moh.

Trains no longer run along the Rail Corridor. But at some places the tracks are still there, and one can imagine instead of joggers and cyclists, the ghosts of the old trains still rattling past, bringing travellers from Singapore to Malaysia, or back.

We are redeveloping the Rail Corridor into a 24km ‘green corridor’ that will allow everyone to enjoy our rich biodiversity and heritage in our City in Nature. Looking forward to that! – LHL

(Photos by me)",250,2020-12-30T03:07:11.000Z,leehsienloong,2475290389233227734
https://www.instagram.com/p/CJZ_3-nLHCP/,"I have always been fascinated by trains, and all things to do with trains. So on Monday I took a #jalanjalan along the Rail Corridor, from Rifle Range Road to Ghim Moh.

Trains no longer run along the Rail Corridor. But at some places the tracks are still there, and one can imagine instead of joggers and cyclists, the ghosts of the old trains still rattling past, bringing travellers from Singapore to Malaysia, or back.

We are redeveloping the Rail Corridor into a 24km ‘green corridor’ that will allow everyone to enjoy our rich biodiversity and heritage in our City in Nature. Looking forward to that! – LHL

(Photos by me)",250,2020-12-30T03:07:11.000Z,leehsienloong,2475290389342129222
https://www.instagram.com/p/CJZ_3-nLHCP/,"I have always been fascinated by trains, and all things to do with trains. So on Monday I took a #jalanjalan along the Rail Corridor, from Rifle Range Road to Ghim Moh.

Trains no longer run along the Rail Corridor. But at some places the tracks are still there, and one can imagine instead of joggers and cyclists, the ghosts of the old trains still rattling past, bringing travellers from Singapore to Malaysia, or back.

We are redeveloping the Rail Corridor into a 24km ‘green corridor’ that will allow everyone to enjoy our rich biodiversity and heritage in our City in Nature. Looking forward to that! – LHL

(Photos by me)",250,2020-12-30T03:07:11.000Z,leehsienloong,2475290389325437063
https://www.instagram.com/p/CJZ_3-nLHCP/,"I have always been fascinated by trains, and all things to do with trains. So on Monday I took a #jalanjalan along the Rail Corridor, from Rifle Range Road to Ghim Moh.

Trains no longer run along the Rail Corridor. But at some places the tracks are still there, and one can imagine instead of joggers and cyclists, the ghosts of the old trains still rattling past, bringing travellers from Singapore to Malaysia, or back.

We are redeveloping the Rail Corridor into a 24km ‘green corridor’ that will allow everyone to enjoy our rich biodiversity and heritage in our City in Nature. Looking forward to that! – LHL

(Photos by me)",250,2020-12-30T03:07:11.000Z,leehsienloong,2475290389333797949
https://www.instagram.com/p/CJZ_3-nLHCP/,"I have always been fascinated by trains, and all things to do with trains. So on Monday I took a #jalanjalan along the Rail Corridor, from Rifle Range Road to Ghim Moh.

Trains no longer run along the Rail Corridor. But at some places the tracks are still there, and one can imagine instead of joggers and cyclists, the ghosts of the old trains still rattling past, bringing travellers from Singapore to Malaysia, or back.

We are redeveloping the Rail Corridor into a 24km ‘green corridor’ that will allow everyone to enjoy our rich biodiversity and heritage in our City in Nature. Looking forward to that! – LHL

(Photos by me)",250,2020-12-30T03:07:11.000Z,leehsienloong,2475290389316942694
https://www.instagram.com/p/CI9-YmwL9NQ/,"Deeply saddened to hear of the passing of Tun Hajah Rahah, the widow of Malaysia’s second Prime Minister Tun Abdul Razak, and the mother of former Prime Minister Najib Razak.⠀
⠀
Tun Hajah Rahah was a source of strength, courage and inspiration for her family and for all Malaysians. She stood resolutely beside her husband, Tun Razak, when he led Malaysia at a critical period in its history. She will be remembered for her devotion to country and family. Our thoughts are with her family and the people of Malaysia during this time of mourning. – LHL⠀
 ⠀
(Photo courtesy of @nationalarchivessg)",73,2020-12-19T05:55:25.000Z,leehsienloong,2467402540630659920
https://www.instagram.com/p/CIX8Lw5gt7O/,"Terima kasih!
谢谢!
நன்றி!
 
A big thank you to all our workers for your contributions to Singapore, especially during COVID-19.
2020 has been a year like no other. Many workers have had their wages and livelihoods affected by the pandemic, particularly those in hard-hit sectors. Frontline and essential workers have made many sacrifices, to keep their families and all of us safe.

We do not know when this pandemic will end, but there’s light at the end of the tunnel. We’re closer to getting a vaccine, and starting to reopen our borders. In the meantime, stay safe and stay strong. 
During this pandemic, labour MPs have been working overtime helping union workers, while the Air Transport Executive Staff Union has been working with SIA and other airlines to assist ground staff and protect their interests. Therefore, I nominate NTUC Assistant Secretary-General @patricktaytg and President of the AESU Daniel Loh to show your appreciation next! – LHL
#toast2U #toast2Uchallenge
-------------------------------------------------
For every #toast2U hashtag, NTUC Income will pledge $2 to the NTUC U Care Fund, which helps low-income members and their families through various assistance programmes to defray their cost of living and children’s school expenses, as well as members whose livelihood had been affected by Covid-19.
When nominated:
1. All you need to do is record yourself “receiving” the drink from the person who nominated you and give a toast accompanied by a note of appreciation in the post.
2. “Pass” the drink on by nominating two others.
3. Tag @UHeartsg for us to keep track of the donations, and remember to make your post public!
This @UHeartsg initiative is by @nebosg and @young.ntuc, supported by NTUC Income.",323,2020-12-04T11:25:28.000Z,leehsienloong,2456696812963290830
https://www.instagram.com/p/CITD1PKrMP3/,"Had a video call with Malaysian PM @muhyiddinyassin_official earlier this evening to discuss the KL-Singapore High Speed Rail (HSR) project. The project is currently suspended, until 31 December 2020.

We took stock of the status, and gained a better understanding of each other’s positions. Both sides will provide further details on the project in due course.

The pandemic has been tough for both sides of the Causeway. Happy that our friendship and cooperation with our neighbour continue to be robust, despite COVID-19. – LHL

(MCI Photos by LH Goh)",60,2020-12-02T13:55:41.000Z,leehsienloong,2455323069815475544
https://www.instagram.com/p/CITD1PKrMP3/,"Had a video call with Malaysian PM @muhyiddinyassin_official earlier this evening to discuss the KL-Singapore High Speed Rail (HSR) project. The project is currently suspended, until 31 December 2020.

We took stock of the status, and gained a better understanding of each other’s positions. Both sides will provide further details on the project in due course.

The pandemic has been tough for both sides of the Causeway. Happy that our friendship and cooperation with our neighbour continue to be robust, despite COVID-19. – LHL

(MCI Photos by LH Goh)",60,2020-12-02T13:55:41.000Z,leehsienloong,2455323069807325093
https://www.instagram.com/p/CITD1PKrMP3/,"Had a video call with Malaysian PM @muhyiddinyassin_official earlier this evening to discuss the KL-Singapore High Speed Rail (HSR) project. The project is currently suspended, until 31 December 2020.

We took stock of the status, and gained a better understanding of each other’s positions. Both sides will provide further details on the project in due course.

The pandemic has been tough for both sides of the Causeway. Happy that our friendship and cooperation with our neighbour continue to be robust, despite COVID-19. – LHL

(MCI Photos by LH Goh)",60,2020-12-02T13:55:41.000Z,leehsienloong,2455323069790366152
https://www.instagram.com/p/CIATEQOrHft/,"Congratulations to all students who collected their PSLE results today!
⠀⠀⠀⠀⠀⠀⠀
You should all be proud of yourselves. Not only for reaching this milestone, but also for overcoming additional hurdles brought on by the pandemic. Between the circuit breaker, Home-Based Learning, and extra safety measures in school, this year has tested not only your academic ability, but also your resilience and perseverance. Your teachers and parents have done well too, giving you their full support.
⠀⠀⠀⠀⠀⠀⠀
As you face new challenges in life, remember how you coped this year. I wish all of you the best in your academic journey ahead! – LHL
⠀⠀⠀⠀⠀⠀⠀
(Students at Northoaks Primary School / MCI Photo by Fyrol)⠀⠀⠀⠀⠀⠀⠀",108,2020-11-25T07:03:14.000Z,leehsienloong,2450042052477220845
https://www.instagram.com/p/CH6wmVfLPyL/,"In some years, the @apec Economic Leaders Meeting (AELM) takes place back-to-back with the #G20 Summit. There are common participants between the two meetings. APEC is a forum of 21 Asia-Pacific economies including Singapore, while the G20 comprises 19 major economies and the European Union. Singapore is an invited guest country of the Kingdom of Saudi Arabia to this year’s G20 Summit. Top of the agenda was COVID-19 and how we can overcome the pandemic and restore growth and jobs. – LHL⠀
⠀
([1] Photo courtesy of @g20org, [3-4] MCI Photos by Lee Jia Wen)",30,2020-11-23T03:25:51.000Z,leehsienloong,2448483083241663629
https://www.instagram.com/p/CH6wmVfLPyL/,"In some years, the @apec Economic Leaders Meeting (AELM) takes place back-to-back with the #G20 Summit. There are common participants between the two meetings. APEC is a forum of 21 Asia-Pacific economies including Singapore, while the G20 comprises 19 major economies and the European Union. Singapore is an invited guest country of the Kingdom of Saudi Arabia to this year’s G20 Summit. Top of the agenda was COVID-19 and how we can overcome the pandemic and restore growth and jobs. – LHL⠀
⠀
([1] Photo courtesy of @g20org, [3-4] MCI Photos by Lee Jia Wen)",30,2020-11-23T03:25:51.000Z,leehsienloong,2448483083233435766
https://www.instagram.com/p/CH6wmVfLPyL/,"In some years, the @apec Economic Leaders Meeting (AELM) takes place back-to-back with the #G20 Summit. There are common participants between the two meetings. APEC is a forum of 21 Asia-Pacific economies including Singapore, while the G20 comprises 19 major economies and the European Union. Singapore is an invited guest country of the Kingdom of Saudi Arabia to this year’s G20 Summit. Top of the agenda was COVID-19 and how we can overcome the pandemic and restore growth and jobs. – LHL⠀
⠀
([1] Photo courtesy of @g20org, [3-4] MCI Photos by Lee Jia Wen)",30,2020-11-23T03:25:51.000Z,leehsienloong,2448483083250276744
https://www.instagram.com/p/CH6wmVfLPyL/,"In some years, the @apec Economic Leaders Meeting (AELM) takes place back-to-back with the #G20 Summit. There are common participants between the two meetings. APEC is a forum of 21 Asia-Pacific economies including Singapore, while the G20 comprises 19 major economies and the European Union. Singapore is an invited guest country of the Kingdom of Saudi Arabia to this year’s G20 Summit. Top of the agenda was COVID-19 and how we can overcome the pandemic and restore growth and jobs. – LHL⠀
⠀
([1] Photo courtesy of @g20org, [3-4] MCI Photos by Lee Jia Wen)",30,2020-11-23T03:25:51.000Z,leehsienloong,2448483083216544779
