Unnamed: 0,postUrl,description,commentCount,pubDate,username,postId
4533,https://www.instagram.com/p/B-kBI35nEAg/,"One of the newly confirmed cases (Case 1115) is linked to three previous cases (Cases 510, 511 and 1007), forming a new cluster at The Orange Ballroom. The Orange Ballroom is a wedding and corporate venue located at 845 Geylang Road.

Three other new clusters were also identified on April 4, at Sengei Tengah Lodge, Toh Guan Dormitory and Cochrane Lodge ll.

Image via The Orange Ballroom.",130,2020-04-04T14:45:17.000Z,mothershipsg,2.28e+18
4534,https://www.instagram.com/p/B-j-LuNHi72/,"Out of the 75 new cases, six are imported, while 69 are local cases who have no recent travel history. 40 cases are linked to previous cases or clusters, while 29 cases are currently unlinked.

Four new Covid-19 clusters have emerged: at Sungei Tengah Lodge, Toh Guan Dormitory, Cochrane Lodge ll, and The Orange Ballroom.

Image via Sungei Tengah Lodge.",689,2020-04-04T14:19:28.000Z,mothershipsg,2.28e+18
4588,https://www.instagram.com/p/B-cUGqbnHSC/,"[JUST IN] Two of the confirmed cases (Cases 972 and 974) reported today are linked to a previous case (Case 868), forming a new cluster at a dormitory located at 55 Sungei Kadut Loop.

According to the Building and Construction Authority’s (BCA) directory, the building is registered to TENDA Equipment & Services Pte Ltd.

Photos via Google Maps.",15,2020-04-01T14:57:05.000Z,mothershipsg,2.28e+18
4612,https://www.instagram.com/p/B-ZupUTn978/,"Four of the newly confirmed cases are linked to a previous case (Case 875), forming a new cluster at Westlite Toh Guan dormitory (18 Toh Guan Road East). Westlite Toh Guan is a 7,800-bed worker accommodation with 22 communal facilities.

Photo from Google Maps",40,2020-03-31T14:51:17.000Z,mothershipsg,2.28e+18
4617,https://www.instagram.com/p/B-ZfPBxH-eL/,"[BREAKING] The amended regulation will affect all workplaces regardless of size, enforcing telecommunication for all the days of the working week.

To ensure compliance, Ministry of Manpower (MOM) officers will be assessing workplaces to see if work from home (WFH) measures are feasible.

Employers found to be flouting the regulations will receive a stop-work order.

Photo from Josephine Teo and MOM/FB.",68,2020-03-31T12:36:38.000Z,mothershipsg,2.28e+18
4630,https://www.instagram.com/p/B-XCkHEnt3e/,"Four of the confirmed cases are linked to a new cluster at S11 Dormitory @ Punggol (2 Seletar North Link). Seven of the confirmed cases are linked to a new cluster at Wilby Residences (25 Wilby Road). Five of the confirmed cases were also established to be linked to a new cluster at Hero’s, a sports bar located at 69 Circular Road.

Photo from Google Maps",38,2020-03-30T13:47:37.000Z,mothershipsg,2.28e+18
4763,https://www.instagram.com/p/B-BWcgCH6gJ/,"The Ministry of Manpower will also be limiting the entry or return of work pass holders.

Only those providing essential services like healthcare and transport will be allowed entry or return.

Singapore citizens, Permanent Residents and Long Term Pass holders can still return to Singapore, and will be issued a 14-day Stay-Home Notice.

Photos from Shawn Ang/Unsplash & Guan Zhen Tan.",100,2020-03-22T03:38:03.000Z,mothershipsg,2.27e+18
4771,https://www.instagram.com/p/B9_w7rKHg9f/,"16 of them breached their Stay-Home Notice or Leave-of-absence (LOA) requirements.

Some were caught working at their workplaces, while others were found leaving their places of residence during the 14-day period.

Photo from Ministry of Manpower’s Facebook page.",74,2020-03-21T12:51:01.000Z,mothershipsg,2.27e+18
4834,https://www.instagram.com/p/B91kAgGB9yO/,"In response to questions about MOM support measures offered to companies with workers affected by the Malaysia lockdown, Minister for Manpower Josephine Teo mentioned that many of such workers are hired by companies that provide healthcare, security, cleaning, waste management and other essential services in Singapore.

Read more in the link in our bio.",20,2020-03-17T13:45:53.000Z,mothershipsg,2.27e+18
4848,https://www.instagram.com/p/B90bQ11nj0T/,"Minister of Trade and Industry Chan Chun Sing assured local employers that Singapore’s economic agencies are working to provide temporary accommodation in Singapore for their Malaysian workers who may wish to stay here during Malaysia’s lockdown.

The economic agencies are working with the companies, dormitory operators and hotels to provide accommodation options for such workers.

Chan also mentioned that companies who need help for their workers’ accommodation can contact and work with said economic agencies and their own trade associations.

Photo by Zheng Zhangxin.",128,2020-03-17T03:10:01.000Z,mothershipsg,2.27e+18
4879,https://www.instagram.com/p/B9t-gc-nuiu/,"This brings the total number of Covid-19 cases in Singapore to 212.

Eight cases were discharged today. The total number of discharged cases is now 105.

Photos from Josephine Teo/FB.",50,2020-03-14T15:03:18.000Z,mothershipsg,2.26e+18
4970,https://www.instagram.com/p/B9g7Uh9nBE7/,"The Ministry of Health announced on Mar. 9 that it will need to prioritise resources at public hospitals in view of the rising number of Covid-19 cases globally and the expected rise in the number of confirmed cases in Singapore.

Therefore, foreigners on short-term visit pass holders who seek treatment for Covid-19 in Singapore will have to pay for their own treatment.

This new ruling has started two days ago on Mar. 7.

Photo from Josephine Teo/FB.",92,2020-03-09T13:25:20.000Z,mothershipsg,2.26e+18
5339,https://www.instagram.com/p/B8i5QlpHXI_/,"Hand sanitisers have been made available to PUB staff, and every employee has been given a personal thermometer. They are to monitor their daily body temperature and report it twice daily.",29,2020-02-14T11:14:25.000Z,mothershipsg,2.24e+18
5414,https://www.instagram.com/p/B8bUwYenPJ3/,"Resorts World Sentosa has been monitoring the coronavirus situation and previously stepped up on precautionary measures. Here’s a statement from their website:

Resorts World Sentosa is monitoring the novel coronavirus situation closely and is taking guidance from the Ministry of Health.

The safety and well-being of our guests and team members are our top priority. We have increased the frequency of disinfection across the resort, especially in areas with high traffic. Hand sanitisers, masks and thermometers are also available at various touchpoints.

Should you feel unwell during your stay or develop respiratory symptoms such as fever, cough or runny nose, please approach our team members immediately for assistance.” Photo from Google Maps",93,2020-02-11T12:40:45.000Z,mothershipsg,2.24e+18
5437,https://www.instagram.com/p/B8WYe9AndrI/,"The worker reported onset of symptoms on Feb. 1, but was only admitted to the intensive care unit at Changi General Hospital (CGH) on Feb. 7.

Prior to hospital admission, he had visited Mustafa Centre (145 Syed Alwi Road) and stayed at The Leo dormitory (25 Kaki Bukit Road).",105,2020-02-09T14:37:08.000Z,mothershipsg,2.24e+18
