id,conversation_id,created_at,date,time,timezone,user_id,username,name,place,tweet,language,mentions,urls,photos,replies_count,retweets_count,likes_count,hashtags,cashtags,link,retweet,quote_url,video,thumbnail,near,geo,source,user_rt_id,user_rt,retweet_id,reply_to,retweet_date,translate,trans_src,trans_dest
1364558871004663811,1364558871004663811,2021-02-24 20:52:41 +08,2021-02-24,20:52:41,+0800,809083181601275907,singaporejobs88,Singapore Jobs,,Singapore's Resilience Package: Support for Businesses and Jobs in 2021  https://t.co/p9KvVYD7xv #singapore #jobs,en,[],['https://bit.ly/3sl7a3q'],[],0,0,0,"['singapore', 'jobs']",[],https://twitter.com/SingaporeJobs88/status/1364558871004663811,False,,0,,Singapore,,,,,,[],,,,
1364447887510265863,1363672802822299649,2021-02-24 13:31:41 +08,2021-02-24,13:31:41,+0800,628070803,singtelsupport,Singtel Support,,"@anand_sailor Hi Anand, we received the latest advise from our team. The mail package has been sent out on 16 February. You should be getting your SIM card  by today if not latest by Friday. (1/2)",en,[],[],[],0,0,0,[],[],https://twitter.com/SingtelSupport/status/1364447887510265863,False,,0,,Singapore,,,,,,"[{'screen_name': 'anand_sailor', 'name': 'ABHISHEK ANAND', 'id': '773260058'}]",,,,
1364054907175772162,1364054907175772162,2021-02-23 11:30:07 +08,2021-02-23,11:30:07,+0800,2909601067,avpn_asia,AVPN,,"Applications for Seed Awards 2021 now open! Maximum prize money of 15,000 Euros and a 12-month support package are awaiting for the winners! For more information, please visit:  https://t.co/tQ7TObdBXC",en,[],['https://avpn.asia/event/seed-awards-2021-call-for-applications/'],[],0,0,1,[],[],https://twitter.com/avpn_asia/status/1364054907175772162,False,,0,,Singapore,,,,,,[],,,,
1364054907146371072,1364054907146371072,2021-02-23 11:30:07 +08,2021-02-23,11:30:07,+0800,2909601067,avpn_asia,AVPN,,"Applications for Seed Awards 2021 is now open! Maximum prize money of 15,000 Euros and a 12-month support package are awaiting for the winners! For more information, please visit:  https://t.co/tQ7TObdBXC",en,[],['https://avpn.asia/event/seed-awards-2021-call-for-applications/'],[],0,0,1,[],[],https://twitter.com/avpn_asia/status/1364054907146371072,False,,0,,Singapore,,,,,,[],,,,
1362780902506565635,1362780902506565635,2021-02-19 23:07:41 +08,2021-02-19,23:07:41,+0800,1226485709235572737,boob_red,Little Red Boob,,"There's still time to book your FREE nursery and prenatal session!  Book a package of 3 postpartum home support visits and get a FREE PRENATAL nursery session  During your nursery session we will walk through your nursery plans, gadgets and gizmos to dis…  https://t.co/vk2UllHdSZ  https://t.co/06K3xBEhnG",en,[],['https://instagr.am/p/CLejJAiswWS/'],['https://pbs.twimg.com/media/EumSAmLXYAI5h-u.jpg'],0,0,0,[],[],https://twitter.com/boob_red/status/1362780902506565635,False,,1,https://pbs.twimg.com/media/EumSAmLXYAI5h-u.jpg,Singapore,,,,,,[],,,,
1362582822666571778,1362582822666571778,2021-02-19 10:00:35 +08,2021-02-19,10:00:35,+0800,1112925341637468160,hostpteltd,HoST Pte Ltd,,Are you looking for the cost-effective package with right technical &amp; development support which is critical for machine builders to simply implement the latest IIoT technology while securely connect machines to manage on-sites and remotely?  Join here  👉 https://t.co/4Qi8ZGiCfM  https://t.co/LtwURb4Hbo,en,[],['http://ow.ly/hI1V50Djj8B'],['https://pbs.twimg.com/media/Eujd2u0XEAQ2q99.jpg'],0,0,0,[],[],https://twitter.com/HoSTpteltd/status/1362582822666571778,False,,1,https://pbs.twimg.com/media/Eujd2u0XEAQ2q99.jpg,Singapore,,,,,,[],,,,
1362308291724931073,1362308291724931073,2021-02-18 15:49:41 +08,2021-02-18,15:49:41,+0800,71161529,aimsimmigrate,AIMS Immigration & Relocation Specialist,,Know any travellers who needs to serve Stay-Home-Notice (SHN) suitable accommodation of their choice upon arrival at Singapore?  AIMS Global Mobility Team has rolled out a comprehensive SHN support package and services to make their SHN a breeze! Scan the WhatsApp QR code now!  https://t.co/Fg3ewBCRyO,en,[],[],['https://pbs.twimg.com/media/EufkKVUVoAM_Chh.jpg'],0,1,0,[],[],https://twitter.com/AIMSImmigrate/status/1362308291724931073,False,,1,https://pbs.twimg.com/media/EufkKVUVoAM_Chh.jpg,Singapore,,,,,,[],,,,
1362245465882853377,1362245465882853377,2021-02-18 11:40:03 +08,2021-02-18,11:40:03,+0800,1015456945447170048,hiremaidea,hiremaid.com.sg,,Budget 2021’s $870m Support Package For the Aviation Industry Will Increase Wage Subsidies by 50%  https://t.co/qqX4sKDkB0,en,[],['http://dlvr.it/RsxSwH'],[],0,0,0,[],[],https://twitter.com/HIREMAIDEA/status/1362245465882853377,False,,0,,Singapore,,,,,,[],,,,
1362161664829743104,1362161664829743104,2021-02-18 06:07:03 +08,2021-02-18,06:07:03,+0800,34565395,thenewpaper,The New Paper,,Aviation support package will increase pay subsidies for local workers  https://t.co/9SIXlQGLHl,en,[],['http://dlvr.it/Rswmld'],[],0,1,0,[],[],https://twitter.com/thenewpaper/status/1362161664829743104,False,,0,,Singapore,,,,,,[],,,,
1361881888395124740,1361866776221343745,2021-02-17 11:35:19 +08,2021-02-17,11:35:19,+0800,2238000366,kssksam,Saminda Kularathne,,@Ang31ooo Yeah but for work i think its still not there. Gonna struggle with lot of packages as still there is no support.,en,[],[],[],1,0,1,[],[],https://twitter.com/KSSKsam/status/1361881888395124740,False,,0,,Singapore,,,,,,"[{'screen_name': 'Ang31ooo', 'name': 'Angelo 🥩', 'id': '455476316'}]",,,,
1335526973137772546,1335526973137772546,2020-12-06 18:10:17 +08,2020-12-06,18:10:17,+0800,131190522,mamaaqr,𝖓𝖚𝖗,,"Oh BTW an update, they actually reviewed my Care and Support package to the maximum amount so the balance payout in june was given to me.",en,[],[],[],0,0,2,[],[],https://twitter.com/mamaaqr/status/1335526973137772546,False,https://twitter.com/mamaaqr/status/1334352061027086336,0,,Singapore,,,,,,[],,,,
1321770832482332677,1321770832482332677,2020-10-29 19:08:18 +08,2020-10-29,19:08:18,+0800,1309858065190010880,ferventweds,Fervent Weddings,,💍 We have launched 💍  Certified Wedding Planners for your Event Needs!  We have Promotional Packages for All Couples👫  Do check us out at  https://t.co/23dVwfjs2k  Do support us by sharing and following our page for more updates!  💖Let’s make Dream Weddings a Reality💖  https://t.co/TeX8rWSbLU,en,[],['http://www.ferventweddings.com'],['https://pbs.twimg.com/media/Elffj7RVgAQC1gc.jpg'],0,0,0,[],[],https://twitter.com/FerventWeds/status/1321770832482332677,False,,1,https://pbs.twimg.com/media/Elffj7RVgAQC1gc.jpg,Singapore,,,,,,[],,,,
1268403835933868032,1268403835933868032,2020-06-04 12:46:54 +08,2020-06-04,12:46:54,+0800,1230681308684120065,admiraltyz10,Admiraltyz10,"{'type': 'Point', 'coordinates': [1.4309063, 103.79760504]}",Some residents were checking on date the next support package releasing the money. Hope this help.  For more details pls check.   https://t.co/e6MQPdKbSB @ Admiralty Zone 10 Residents' Committee  https://t.co/O2cN2NDUXE,en,[],"['http://go.gov.sg/careandsupport-cash', 'https://www.instagram.com/p/CBABJUcnMqo/?igshid=9tamf7z0voa5']",[],0,0,0,[],[],https://twitter.com/admiraltyz10/status/1268403835933868032,False,,0,,Singapore,,,,,,[],,,,
1265188499990278144,1265188499990278144,2020-05-26 15:50:19 +08,2020-05-26,15:50:19,+0800,1118789222842789889,ruiqinneo,Rui Qin,,"#Singapore announces the ""Fortitude Budget"", the 4th #COVID19 financial package to help businesses keep #jobs for 10 months. Government support now totals at $92.8 billion, 20% of #GDP.  https://t.co/8B1m4i91pV",en,[],[],['https://pbs.twimg.com/media/EY7aOcBUwAEjlMw.jpg'],0,0,0,"['singapore', 'covid19', 'jobs', 'gdp']",[],https://twitter.com/ruiqinneo/status/1265188499990278144,False,,1,https://pbs.twimg.com/media/EY7aOcBUwAEjlMw.jpg,Singapore,,,,,,[],,,,
1257261433747697665,1257261433747697665,2020-05-04 18:50:59 +08,2020-05-04,18:50:59,+0800,1968356929,kamal_sk21,sravanthi,,Sir we already talk with him but nothing on going process sir to day I visit to hospital he all chasing for diposit for delivery packages please I need your support 🙏 sir,en,[],[],[],1,1,2,[],[],https://twitter.com/kamal_sk21/status/1257261433747697665,False,https://twitter.com/kamal_sk21/status/1257240517525397505,0,,Singapore,,,,,,[],,,,
1254472754675384320,1254358249031077888,2020-04-27 02:09:46 +08,2020-04-27,02:09:46,+0800,1968356929,kamal_sk21,sravanthi,,@kiranindu8 @RaoKavitha @DGCAIndia @ysjagan @SingaporeUN @SingaporeAirID @AmitShah @leehsienloong @HardeepSPuri My hopes are there. at least my maternity packages don't treat me I am Non local. just look me as comen pregnant🤰 women normal hospital charges also I am really happy to give birth baby in Singapore. Thank you for all your support 🙏,en,[],[],[],0,0,2,[],[],https://twitter.com/kamal_sk21/status/1254472754675384320,False,,0,,Singapore,,,,,,"[{'screen_name': 'RaoKavitha', 'name': 'Kavitha Kalvakuntla', 'id': '177673457'}, {'screen_name': 'DGCAIndia', 'name': 'DGCA', 'id': '1137307520093941760'}, {'screen_name': 'ysjagan', 'name': 'YS Jagan Mohan Reddy', 'id': '2965511647'}, {'screen_name': 'SingaporeUN', 'name': 'Singapore Mission UN', 'id': '3026209914'}, {'screen_name': 'SingaporeAirID', 'name': 'Singapore Airlines', 'id': '2982743472'}, {'screen_name': 'AmitShah', 'name': 'Amit Shah', 'id': '1447949844'}, {'screen_name': 'leehsienloong', 'name': 'leehsienloong', 'id': '34568673'}, {'screen_name': 'HardeepSPuri', 'name': 'Hardeep Singh Puri', 'id': '2289628938'}]",,,,
1253617671800680451,1253617671800680451,2020-04-24 17:31:58 +08,2020-04-24,17:31:58,+0800,1968356929,kamal_sk21,sravanthi,,@fayazmd006 Singapore MP also try to support me but the government hospital saying we non local so he want charge me more than double double the maternity packages. Because of covid 19 I can't travel he all know the issue still the price to expensive. Because of non local brother,en,[],[],[],1,0,2,[],[],https://twitter.com/kamal_sk21/status/1253617671800680451,False,,0,,Singapore,,,,,,[],,,,
