,Unnamed: 0,id,date,time,tweet,hashtags,num_words
982,250,1362699803071705092,2021-02-19,17:45:25,"[Budget 2021] Help is on the way for companies to innovate, transform and scale up their businesses.  Read more here:   https://t.co/k4GcZQwYPZ",[],19
983,251,1362692816208502785,2021-02-19,17:17:39,"RDU: Budget 2021 comes across as “falling short”, may add more burden to S’poreans via GST and petrol duty hike  https://t.co/UMKKEzawKY",[],20
984,252,1362686117800267777,2021-02-19,16:51:02,"""The growing #Data stream, fuelled by the roll-out of #5G services will present many opportunities for organisations to be #DataDriven"", see what @Cloudera #APAC VP, Mark Micallef says in response to the #Singapore #Budget #2021.  https://t.co/nrXHEsUTrz  https://t.co/74D112gM3a","['data', '5g', 'datadriven', 'apac', 'singapore', 'budget']",26
985,253,1362683804184285189,2021-02-19,16:41:51,Great overview of Singapore Budget 2021 by our dear team at @Talenox !   https://t.co/8mv3pu9OXF,[],10
986,254,1362677230208356353,2021-02-19,16:15:43,"Read our Singapore Budget 2021 Newsletter that provides a summary of select key measures and tax changes announced in this year's Budget, here:  https://t.co/2b1jiNFGjh  https://t.co/mLnOt54zkZ",[],21
987,255,1362666177277919234,2021-02-19,15:31:48,#SGBudget2021: We share the top 12 highlights of the 2021 Budget and what it means for Singaporeans and businesses:  READ:  https://t.co/kTwnS8nBWW  #SGBudget2021 #SingaporeBudget #JobsSupportScheme #SGbudgetupdatebyInCorp,"['sgbudget2021', 'sgbudget2021', 'singaporebudget', 'jobssupportscheme', 'sgbudgetupdatebyincorp']",17
988,256,1362662309546500096,2021-02-19,15:16:26,"@BDHerzinger what if we spent the space force budget (and tbh I'm not sure what the number is) to permanent human settlements on other planets, or exotic space propulsion  or like anything really that will let me live in the asteroid belt like man was intended",[],44
989,257,1362661562176036869,2021-02-19,15:13:28,"(I mean, obviously we need to fund the Navy, but I’m pretty sure we could put most of the Space Force’s budget toward something else)",[],27
990,258,1362653461914021888,2021-02-19,14:41:16,"Soh Pui Ming, our Singapore Head of Tax joins academics and business leaders at @BusinessTimes Budget Roundtable. The panelists share their key takeaways from the #SGBudget2021 with BT, and discuss how the initiatives will affect companies in Singapore.  https://t.co/66XN4TC8wT  https://t.co/FC7tKwjwJL",['sgbudget2021'],36
991,259,1362650782726676482,2021-02-19,14:30:38,"@Proxima06_Aiai Furthermore, if you are passionate about the company/brand most likely consumers are / will be too.   “Cult companies” have huge financial implications that no advertisement budget can buy.",[],28
992,260,1362649305761210370,2021-02-19,14:24:45,Businesses in Singapore will receive support from Budget 2021 to innovate and transform from their operations.  For more information:  https://t.co/jCh9SJR4jC  https://t.co/Jp8i2Sa9Ea,[],18
993,261,1362643075428933633,2021-02-19,14:00:00,"Each year we get to put on our journo hats and do Singapore Budget coverage for @Singtel, turning the story around in a few hours. Always fun.  https://t.co/8g35yFPTng  #budget #singapore #sme #highlights #economy","['budget', 'singapore', 'sme', 'highlights', 'economy']",26
994,262,1362642701456392193,2021-02-19,13:58:31,#SGBudget2021 recognizes that helping individuals and enterprises embrace transformation is key to moving forward on the road to recovery. Goh Siow Hui shares her views on the Budget with @zaobaosg. Subscribers can read the full article (in Chinese):  https://t.co/mtaAz3IvT3,['sgbudget2021'],36
995,263,1362639481820512260,2021-02-19,13:45:43,@enbootle YE i would mass produce these but too expensive for my budget rn💀,[],13
996,264,1362636289577607171,2021-02-19,13:33:02,BUDGETARIAN DIET..eat depends on the budget..  PKNTsaWinRadio withJAYDA,[],9
997,265,1362636213048467456,2021-02-19,13:32:44,Emerging stronger together: 8 winners (and non-winners) from the Singapore Budget 2021  https://t.co/UexvBPZOGM  https://t.co/asSjheuLYz,[],9
998,266,1362623754585563136,2021-02-19,12:43:14,ICYMI: Our earlier explainer on budget deficits and how they could be funded #SGBudget2021  https://t.co/R2gFKRyIEA,['sgbudget2021'],13
999,267,1362620639484416000,2021-02-19,12:30:51,"The decision to remove the tax exemption on provident fund contributions of ₹2.5 lakh and above in the #budget was based on the principle of #equity, said revenue secretary Ajay Bhushan Pandey. Read More:  https://t.co/bwtfsE4O5D #tax #tax #taxes #government #providentfund  https://t.co/VMbp0GXWJk","['budget', 'equity', 'tax', 'tax', 'taxes', 'government', 'providentfund']",31
1000,268,1362616289575993346,2021-02-19,12:13:34,"Times may be tough but there are opportunities for businesses and individuals to turn things around with #SGBudget2021. Join us to discuss budget measures, #transformation, regulatory and tax matters on 22 Feb. Registration is complimentary  https://t.co/av7ioIBaRH #TransformNow","['sgbudget2021', 'transformation', 'transformnow']",32
1001,269,1362610387863019529,2021-02-19,11:50:07,@mjr51883 @cnnbrk you guys budgeted more than 700 billion dollars for the military in 2019... where as mars 2020 has a budget of 2.8 billion over 10 years... what's the bigger waste of money?,[],26
1002,271,1362601444918972416,2021-02-19,11:14:35,Stay up-to-date on the key measures announced in the Singapore Budget 2021 statement by reading our Budget highlights here:  https://t.co/8QF7uPy3u9 #SGBudget2021,['sgbudget2021'],17
1003,272,1362596470650675201,2021-02-19,10:54:49,"At the 2021 Budget Statement, Deputy Prime Minister and Finance Minister Heng Swee Keat announced the following changes in continued support of workers, businesses, and the community.  Visit  https://t.co/eRlTdH5L0P for a complete summary of #SGBudget2021 support and tax changes.  https://t.co/fdmAWay92i",['sgbudget2021'],36
1004,273,1362595357939564544,2021-02-19,10:50:23,"Budget 2021 has focused targeted help towards sectors that are most impacted by #COVID19. $870 million has been provided to support the aviation sector, one of the key pillars of our economy - but is this support justified? (1/2)",['covid19'],34
1005,275,1362583454123229187,2021-02-19,10:03:05,"Join us for a series of #SGBudget2021 webcasts with guest speakers from the @EDBsg, Dr. Tan Khee Giap, and our EY speakers. Gain insights into the key Budget measures, their impact on your business, and how you can seize opportunities for growth.  https://t.co/aohNCgFibk  https://t.co/zC0ZAUUXE1",['sgbudget2021'],40
1006,276,1362581096232194052,2021-02-19,09:53:43,@rbf_auntie No more budget sad version from a small bottle that doesn't taste enough garliiic.,[],13
1007,277,1362574879241961474,2021-02-19,09:29:01,"If you're managing a project, you're also managing time, people, and BUDGET! 📈 Brush up on your budgeting skills using this short guide 👇 #projectmanagement #costvariance  https://t.co/cWwDrxJ9Gy","['projectmanagement', 'costvariance']",20
1008,278,1362558068765065217,2021-02-19,08:22:13,"If you’re in financial quandary, don’t be ashamed to downgrade your lifestyle. Many have lost their jobs in this pandemic. So be realistic. Be practical. You’ll adjust and find your equilibrium. Don’t live on a strained budget. You’ll emerge the winner eventually.",[],47
1009,279,1362551039614853122,2021-02-19,07:54:17,Budget 2021: Venture Debt programme for high-growth enterprises to be extended and enhanced    https://t.co/w8onE1niHb,[],11
1010,280,1362439688959582209,2021-02-19,00:31:49,@KLOPPISTHEBOSS @Citehzen LOL you're saying like we didn't miss Aguero KDB Jesus Laporte. Also Pep got 198 points in back to back seasons and did a treble and a quadruple. Just cry and cry your club tried to be stingy and buy budget players and are in danger of finishing outside the top 4.,[],48
1011,283,1362420425414742020,2021-02-18,23:15:16,Budget 2021: His solo effort to clean up #mangroves has grown into 100 volunteers reforesting Kranji Coastal Nature Park - @sivasothi continues to leave a trail of likeminded #nature champions. #RoleModel #conservation    https://t.co/Lb2fPvfywg via @TODAYonline,"['mangroves', 'nature', 'rolemodel', 'conservation']",25
1012,284,1362400446195802116,2021-02-18,21:55:53,ok she really said BUDGET,[],5
1013,285,1362386382711361539,2021-02-18,21:00:00,"Exfoliation is the unsung hero in every skincare routine, so here are 42 best face scrubs for every skin type, including budget-friendly options!  https://t.co/6W5YIundtQ #facescrubs #facialexfoliation #exfoliator  https://t.co/D0Pj9FwPQo","['facescrubs', 'facialexfoliation', 'exfoliator']",21
1014,286,1362384621284052992,2021-02-18,20:53:00,"Join @ForesightNewsUK and an expert panel to discuss the UK Budget 2021, to understand what Chancellor Rishi Sunak must do to help the UK recover from a year of crisis. February 25, 2:30pm GMT.  Register here:  https://t.co/N6LMoZZpXU  https://t.co/swKG6k4hpA",[],33
1015,287,1362383398858227715,2021-02-18,20:48:08,@CT_Voter I guess budget is not there? I heard b4 dat they nd such big sponsors for such stuff but seeing how Siti has a lot of endorsements also qn where those have gone into? We won’t know bt i guess they don’t see much value in investing this much on a MV? Not to sure on that also?,[],59
1016,288,1362372333302812673,2021-02-18,20:04:10,SDP’s Bryan Lim comments about Budget 2021: ‘need to rethink policies’  https://t.co/c9yr1KTrfd via @Independentsg,[],12
1017,289,1362371379362938881,2021-02-18,20:00:23,"Singapore has big plans to grow a thriving startup scene. From creating fellowships to changing laws, the budget announcement could be music to a startup’s ears. Click to read:  https://t.co/skx5ptXgTw  Photo credit: Unsplash",[],33
1018,290,1362364173129310210,2021-02-18,19:31:45,"The Falcon Budget-Lite is an affordable 4-wheel mobility scooter that is rugged enough to handle the rough pavements of Malaysia, but can also be disassembled and put into a car for transport. Call 010-518-4600 to arrange a FREE test drive!  https://t.co/cjKQyy2cYq  https://t.co/eRmG6YUYqc",[],38
1019,291,1362355038606163970,2021-02-18,18:55:27,@YusufDFI madam how will you pay for the budget deficit?,[],9
1020,292,1362349672296116224,2021-02-18,18:34:07,How To Makeover Any Room In Your Home On A Budget  https://t.co/34avxfvpha,[],11
1021,293,1362348637376950274,2021-02-18,18:30:01,Your approach to sales analytics doesn't have to break the bank.  Here's some advice to help you get the data you need when on a shoestring budget.    https://t.co/oxSiOGUAiJ #SalesMetrics #SalesTips via @VanillaSoft,"['salesmetrics', 'salestips']",26
1022,294,1362343634406830080,2021-02-18,18:10:08,"Hell of a budget with only these two characters for the rest of the movie, by the way.  #MonsterHunterMovie",['monsterhuntermovie'],18
1023,296,1362341091413000193,2021-02-18,18:00:01,"Following the #SGBudget2021 announcement, join our Deloitte experts in our Budget 2021 webinar as they unpack and dissect the key highlights shared by DPM Heng Swee Keat:  https://t.co/qKLFetDJ2p  https://t.co/LTVN49NkCO",['sgbudget2021'],25
1024,297,1362340729926787076,2021-02-18,17:58:35,We look at the impact the S’pore 2021 Budget would have on key sectors.  https://t.co/pjeJvOKJU9  https://t.co/0oGdjTWZVT,[],14
1025,298,1362340231224123394,2021-02-18,17:56:36,Find out what the latest Budget 2021 has in store for small- and medium-sized enterprises (SMEs) like your business. #SGBudget2021 #singapore #economy #SME  https://t.co/E6nuhOCekm,"['sgbudget2021', 'singapore', 'economy', 'sme']",17
1026,299,1362331175759478784,2021-02-18,17:20:37,"[💻Webinar - Budget Talk 2021]  We are delighted to invite you to the traditional #budget talk, happening virtually on Wednesday, 24th of February at 10 AM.  Please register👉 https://t.co/5SWb0bvD8S  https://t.co/iRghTbCzAO",['budget'],23
1027,300,1362327275799072770,2021-02-18,17:05:08,#ICYMI: Highlights from Budget 2021 announced by DPM Heng Swee Keat!   https://t.co/JEZTdl4DIF,['icymi'],9
1028,301,1362324063268519939,2021-02-18,16:52:22,A targeted Budget needed to drive transformation and recovery  https://t.co/03vD1Gzw0V #singapore #jobs,"['singapore', 'jobs']",9
1029,302,1362315103329083394,2021-02-18,16:16:45,the common denominator bet the pork price freeze fiasco and the vaccine indemnification budget debacle is - the people in gov expect private sector to absorb all costs to public crises,[],30
1030,303,1362309359150145536,2021-02-18,15:53:56,"(February 23, 10:00am - 11:00am) #AmChamREPRESENT Join us as a panel of experts discuss key aspects of Budget 2021, highlights from the subsequent Committee of Supply (COS) debates, and the overall implications for our business community.  Register here:  https://t.co/pF20Ta5xtj  https://t.co/tZzfBhTyaV",['amchamrepresent'],34
1031,304,1362298403074445312,2021-02-18,15:10:24,their money all went into stage budget so they can't pay their bills. their WiFi is so bad too.,[],18
1032,305,1362296994937647108,2021-02-18,15:04:48,Missed the broadcast of this year's budget? In this piece we wrote for @Singtel we round up all the important takeaways that every SME should know.  https://t.co/NX8ueJRZB4 #budget #singapore #sme #highlights #economy,"['budget', 'singapore', 'sme', 'highlights', 'economy']",24
1033,307,1362284053659934726,2021-02-18,14:13:23,"As a densely populated tropical island state, Singapore is a vulnerable to the effects of #climatechange. In DPM Heng's  Budget 2021, he highlighted #technology as a game-changer, such as this IEM modeller:  https://t.co/fQLeY6sxjO","['climatechange', 'technology']",27
1034,308,1362276208843452421,2021-02-18,13:42:12,"The Singapore Budget 2021 focused on not only making lemonade from 2020’s lemons, but also planting seeds for the future. #YahooFinance   https://t.co/V8mNs4BJPv",['yahoofinance'],19
1035,309,1362270925522149378,2021-02-18,13:21:13,This year’s Budget focuses on helping Singapore stay relevant to the world beyond the pandemic. We analyze the key tax measures to help you understand how #SGBudget2021 could impact you and your business. Read our Synopsis:  https://t.co/ENNizekhoM  https://t.co/vgEdvJIYGU,['sgbudget2021'],36
1036,311,1362263135688609792,2021-02-18,12:50:15,Commentary: #Budget 2021 and how #Singapore’s tax system is changing for the better  https://t.co/gFNS5GfJZF,"['budget', 'singapore']",10
1037,312,1362261081490485251,2021-02-18,12:42:06,"@dburbach As a downpayment, let's get rid of the appx $70 billion appropriated annually for the OCO budget and reallocated the funds for infrastructure and Covid relief   https://t.co/fMpscZVezg",[],24
1038,313,1362250488910123008,2021-02-18,12:00:00,"Just as Budget 2021 focuses on restructuring Singapore's economy for long-term resilience, discussions in the Middle East now are centred on economic diversification. Sign up for our Annual Conference to learn about trends linking Asia &amp; the Middle East!  https://t.co/JhE1ekNpfu",[],35
1039,314,1362245475630374914,2021-02-18,11:40:05,"@FPLMarcin Dallas and 1 Mancity asset is a must. the rest, you can play around accordingly to your budget. reckon rudiger/burnley CB might be a good rotation defenders",[],27
1040,315,1362245465882853377,2021-02-18,11:40:03,Budget 2021’s $870m Support Package For the Aviation Industry Will Increase Wage Subsidies by 50%  https://t.co/qqX4sKDkB0,[],13
1041,316,1362243129336762371,2021-02-18,11:30:45,Budget 2021. Heng Sweet Keat digging into reserves and taking more money from Singaporeans instead of slashing his own pay.  https://t.co/l2uORCY9DZ,[],19
1042,317,1362239399681921026,2021-02-18,11:15:56,Budget 2021: Volunteers set up pop-up grocery booths in housing estates in a bid to prevent food wastage  https://t.co/AdKOE3ZEk9,[],16
1043,318,1362236423017955331,2021-02-18,11:04:07,A targeted Budget needed to drive transformation and recovery  https://t.co/qrPaTPBuJf,[],9
1044,319,1362236159947010054,2021-02-18,11:03:04,Singapore Budget 2021: $75.3 million (S$1 Billion) to support Digital Transformation.   Contact us for more information.   https://t.co/xdOwwLm7jG Call: 65152988  #odes #mccoy #AI #ArtificialIntelligence #5G #ierp #IntelligentAutomation #intelligentERP #iot #IIoT #DX #digitization  https://t.co/fte3vl9Bxr,"['odes', 'mccoy', 'ai', 'artificialintelligence', '5g', 'ierp', 'intelligentautomation', 'intelligenterp', 'iot', 'iiot', 'dx', 'digitization']",15
1045,320,1362234000006279170,2021-02-18,10:54:29,"Singapore Budget 2021: $75.3 million (S$1 Billion) to support Digital Transformation.   What are you waiting for? ""ODES, the Start of your Digital Transformation"".   https://t.co/PHbXEeonXI #AI #ArtificialIntelligence #5G #ierp #IntelligentAutomation #intelligentERP #iot #IIoT #DX  https://t.co/hlaWF5s9bR","['ai', 'artificialintelligence', '5g', 'ierp', 'intelligentautomation', 'intelligenterp', 'iot', 'iiot', 'dx']",21
1046,321,1362233551224074240,2021-02-18,10:52:42,#Singapore: Budget 2021: Govt to issue up to $90b in new bonds to finance #infrastructure like MRT lines and tidal walls  https://t.co/pfiB2UPw8k   #SmartCities #FutureCities #Resilience #ClimateChange  https://t.co/YIlbKCtfCJ,"['singapore', 'infrastructure', 'smartcities', 'futurecities', 'resilience', 'climatechange']",17
1047,322,1362233115737919488,2021-02-18,10:50:58,#Singapore: Budget 2021: More incentives to encourage early adoption of #ElectricVehicles:  https://t.co/jTq3ipQUil  @ChannelNewsAsia   #EV #SmartCities #FutureCities #Mobility  https://t.co/2uXTSilFYt,"['singapore', 'electricvehicles', 'ev', 'smartcities', 'futurecities', 'mobility']",8
1048,323,1362231377370836995,2021-02-18,10:44:04,Budget 2021 is a far-sighted but firmly grounded fiscal strategy  https://t.co/V6ZlpnrtG5,[],8
1049,324,1362231375894482944,2021-02-18,10:44:03,"Budget 2021: S$11b for Covid relief, and even more to fortify future  https://t.co/ua1CIj44q4",[],11
1050,325,1362228338408886272,2021-02-18,10:31:59,"@ketengahketepi KO okay price depend on your budget, Doctor will ask first no more paksaan. And for first time visit they hv promotion package best on your range",[],27
1051,326,1362226389529686021,2021-02-18,10:24:14,"The Singapore Green Plan, announced by DPM Heng in his Budget 2021 statement, is a long-term plan that aims to secure a green, liveable, and sustainable home for generations of Singaporeans to come.   For more information:  https://t.co/IYPVBLWObH  https://t.co/GV6h6Txt96",[],34
1052,327,1362217544145338370,2021-02-18,09:49:05,"We believe it's the little things that make staying in a villa so special.  Let us do the ground work for you and help you plan the perfect holiday.  Tell us eactly what you want, including preferred dates, location, number of guests and budget and we'll…  https://t.co/qJCJCsGbpK  https://t.co/BuX7MoNLvN",[],44
1053,328,1362213274008252416,2021-02-18,09:32:07,Still my favourite Budget coverage pic - circa 2011 locked up in another newsroom #singaporebudget #journolife   📸 @sooseetan  https://t.co/f7x2Nem5Z0,"['singaporebudget', 'journolife']",12
1054,329,1362206913212030977,2021-02-18,09:06:51,AWARE expresses concern on shortfall of targeted measures for caregivers in Budget 2021  https://t.co/qTFzqSvMoe via @tocsg,[],13
1055,330,1362200659089620992,2021-02-18,08:42:00,A targeted Budget needed to drive transformation and recovery #SGBudget2021  https://t.co/pSdksJCWlq  https://t.co/cZewz90mgU,['sgbudget2021'],9
1056,331,1362190103708397571,2021-02-18,08:00:03,"Happy Year of the OX🐮 ! 🧧How can you have an Ox-Picious &amp; Incredi-Bull Year ahead ? 🧧 *Register for this upcoming webinar on 9 March, 10am SGT* Learn about how you can upgrade critical assets on a budget. Register now at  https://t.co/Bs5g7O6YZ9  https://t.co/Jx2fWIZ30F",[],34
1057,332,1362187507635421187,2021-02-18,07:49:44,"@IshakBb Mechanical system failure, susah nak betulkan, need big budget and method 😀",[],11
1058,333,1362180039731777537,2021-02-18,07:20:04,The level of the carbon tax post-2023 will be reviewed and results will be announced during next year's Budget to give time for businesses to adjust to any revisions.  https://t.co/wl9gBSudLT,[],28
1059,334,1362167211004026882,2021-02-18,06:29:05,Commentary: Budget 2021 and how Singapore’s tax system is changing for the better  https://t.co/HxznKnqpNa #asia #singapore #italy  https://t.co/ZIaYe76R8F,"['asia', 'singapore', 'italy']",13
1060,335,1362162803696537602,2021-02-18,06:11:34,Commentary: Budget 2021 and how Singapore’s tax system is changing for the better  https://t.co/3yrzu9dLR4  https://t.co/Xa1uxAMLUX,[],13
1061,337,1362101154230923273,2021-02-18,02:06:36,Singapore DPM Heng Swee Keat Announces More Support for EV Cars During Budget 2021  https://t.co/txCjhdB3Ea via @Tech360.tv Official,[],15
1062,338,1362075138678657026,2021-02-18,00:23:13,"@ajayajhere We could’ve had this direct, as a swag, only if @shivaraj1983 had a budget 😝",[],14
1063,339,1361663248332849154,2021-02-16,21:06:31,"""Highlights of Budget 2021: From household vouchers to GST on imported low-value goods bought online, Singapore News &amp; Top Stories - The Straits Times""  https://t.co/UKAw4dV9k7",[],20
1064,340,1361658860511981571,2021-02-16,20:49:05,"budget 2021 has gd things n is suppose to help the economy   my bf, selective reading: petrol increase?! knn",[],18
1065,342,1361591902345158659,2021-02-16,16:23:01,Somebody keeps coughing in the parliament house during budget 2021,[],9
1066,343,1359281610697232384,2021-02-10,07:22:44,"On the other hand, does this mean cuter graphics capture more of the public’s heart?   &gt; or it could just be who got the bigger budget for acquisition 🤔   GooglePay vs Grab:  https://t.co/hGzzX4xobT",[],31
1067,345,1358043459974619140,2021-02-06,21:22:46,Niat nak spend $200 je today last last above my budget zz but all good now hehe,[],16
1068,346,1357783942556913664,2021-02-06,04:11:32,Dems Pass Budget Blueprint To Bypass GOP Obstruction (Radio)  https://t.co/kFhM2ei27A,[],9
1069,347,1357004669818601473,2021-02-04,00:34:59,"Invest in a grinder and you'll always have fresh coffee. And if you're low on budget, a hand grinder doesn't cost much too! Check out our online store and purchase one today!  https://t.co/Lej0rmQwTs",[],29
1070,349,1356434503426793474,2021-02-02,10:49:21,"@villi They are an early stage startup with an MVP, you’ve got to be realistic about what they can achieve with the limited resources available to them. Operating on a shoestring budget no doubt.",[],34
1071,350,1356197358271344640,2021-02-01,19:07:01,@swamy64 This year did not see any tax on tobacco products -  normally we see in every budget this has been the practice - or am I missing something,[],26
1072,351,1355285775349235713,2021-01-30,06:44:43,@nurjannahzain I go with the MacBook or a combination of iMac and an iPad Pro. Of course the second option means a bigger budget but the iPad Pro is very convenient to move around with. Whichever combination- Apple is very good for presentation.,[],42
1073,352,1355018259947425793,2021-01-29,13:01:42,Im looking for 2nd hand  4 seater dining table with budget below 200...  haiyyaaa so hard to find one 😭,[],16
1074,354,1352580077175758857,2021-01-22,19:33:14,@GarrettHaake @RepAndyBiggsAZ At this rate we’re going to balance the government budget with all the fines in the House.,[],18
1075,355,1351843190677012481,2021-01-20,18:45:07,"@StevePhilips16 @TimWilsonMP @DaveSharma @AlboMP Budget surplus right there, read it in the Herald Sun",[],10
1076,356,1351699135339003907,2021-01-20,09:12:41,“[F]riendlier rhetoric alone will not persuade our partners that [US] is a reliable ally. Sufficient investment in defense capabilities is the clearest indicator... that Washington will stand by its friends. Cuts to our defense budget communicate the opposite message.”,[],40
1077,357,1351388417167290370,2021-01-19,12:38:00,NS Boys meeting up at Clarke Quay deciding to go budget at Get Juiced or spend all their NS allowance in Zouk.,[],22
1078,358,1346119687201931265,2021-01-04,23:41:57,6 ways to be financially responsible: 1. Save before you spend ✅ 2. Control your spending ✅ 3. Budget your money well (need to improve myself on this.Nag-eexceed minsan🤣🤣 4. Pay your bills first ✅ 5. Build emergency fund ✅ 6. Stay away from bad debts ✅,[],35
1079,359,1345931764066205696,2021-01-04,11:15:13,"My colleague: Siva, I want to propose to my GF, any good location that you can recommend? My GF doesn’t want a crowded place, just between both of us.  Me: any budget?  He: No, I’m not gonna spend any money and not planning to buy a ring too.  Me: your house or her house lor",[],57
1080,361,1343964058857304064,2020-12-30,00:56:15,"@EV_Stevee @alex_avoigt Agreed, the mindset shifts will take many years. Not as easy as the CIO/CEO thinks it is. Most of them will also take the lower cost &amp; “faster” delivery approach of outsourcing sw delivery as revenue falls and budget tightens. A very myopic strategy.",[],44
1081,364,1343283607503192084,2020-12-28,03:52:23,"@GTStudiosMedan It’s quite typical of people to put kids shows into a box - low effort, low budget, not worth watching. Missing the forest for the trees. Some of these shows are more expensive and watch better than your regular sinetron lol.",[],41
1082,365,1343109669619867649,2020-12-27,16:21:13,@Cristiano @PestanaCR7 Wow.  When i and family can visit holiday this beautiful place CR7. No budget,[],13
1083,366,1342655983504408576,2020-12-26,10:18:26,This month just teruk spend way over my budget,[],9
1084,367,1341976418649952257,2020-12-24,13:18:05,@sarahcoldheart SG govt no budget? How can?,[],6
