,Unnamed: 0,id,date,time,tweet,hashtags,num_words
366,249,1362745486914953219,2021-02-19,20:46:57,"@PunYaab After corporates takes over storage &amp; all kind of supplies   It results in ending over 5 lakh suppliers of; pesticides,machines,seeds,karyana &amp;labourers linked to stores  More people will be jobless  More hungry stomachs   More poverty More Economy Crisis #ReleaseDetainedFarmers  https://t.co/WTuV9DUVTo",['releasedetainedfarmers'],38
367,250,1362745182848835587,2021-02-19,20:45:44,"@ClaudiaWebbe After corporates takes over storage &amp; all kind of supplies   It results in ending over 5 lakh suppliers of; pesticides,machines,seeds,karyana &amp;labourers linked to stores  More people will be jobless  More hungry stomachs   More poverty More Economy Crisis #ReleaseDetainedFarmers  https://t.co/7J3ITts7y3",['releasedetainedfarmers'],38
368,251,1362743308238221317,2021-02-19,20:38:17,@JonLassman Agreed! Gig economy is here to play a crucial role in this #futureofwork🙌,['futureofwork'],12
369,252,1362740806222704642,2021-02-19,20:28:21,"@samjawed65 @zoo_bear After corporates takes over storage &amp; all kind of supplies   It results in ending over 5 lakh suppliers of; pesticides,machines,seeds,karyana &amp;labourers linked to stores  More people will be jobless  More hungry stomachs   More poverty  More Economy Crisis #ReleaseDetainedFarmers  https://t.co/KKBOIJUKr4",['releasedetainedfarmers'],38
370,253,1362739608593657858,2021-02-19,20:23:35,"@FriedrichPieter After corporates takes over storage &amp; all kind of supplies   It results in ending over 5 lakh suppliers of; pesticides,machines,seeds,karyana &amp;labourers linked to stores  More people will be jobless  More hungry stomachs   More poverty  More Economy Crisis #ReleaseDetainedFarmers  https://t.co/dNYPIRosBZ",['releasedetainedfarmers'],38
371,254,1362739202996101129,2021-02-19,20:21:59,"@yadavtejashwi @NitishKumar After corporates takes over storage &amp; all kind of supplies   It results in ending over 5 lakh suppliers of; pesticides,machines,seeds,karyana &amp;labourers linked to stores  More people will be jobless  More hungry stomachs   More poverty  More Economy Crisis #ReleaseDetainedFarmers  https://t.co/uo79nfifTU",['releasedetainedfarmers'],38
372,255,1362739086377689090,2021-02-19,20:21:31,"@BBCBreaking @BBCWorld After corporates takes over storage &amp; all kind of supplies   It results in ending over 5 lakh suppliers of; pesticides,machines,seeds,karyana &amp;labourers linked to stores  More people will be jobless  More hungry stomachs  More poverty  More Economy Crisis  #ReleaseDetainedFarmers  https://t.co/LhAmfxSZjm",['releasedetainedfarmers'],38
373,256,1362739024788484100,2021-02-19,20:21:16,"@DChaurasia2312 After corporates takes over storage &amp; all kind of supplies   It results in ending over 5 lakh suppliers of; pesticides,machines,seeds,karyana &amp;labourers linked to stores More people will be jobless  More hungry stomachs   More poverty  More Economy Crisis  #ReleaseDetainedFarmers  https://t.co/f2Lf0JIxpM",['releasedetainedfarmers'],38
374,257,1362737410065358852,2021-02-19,20:14:51,"@Swamy39 After corporates takes over storage &amp; all kind of supplies   It results in ending over 5 lakh suppliers of; pesticides,machines,seeds,karyana &amp;labourers linked to stores  More people will be jobless  More hungry stomachs   More poverty More Economy Crisis #ReleaseDetainedFarmers  https://t.co/DToMNrK8DM",['releasedetainedfarmers'],38
375,258,1362736768383021059,2021-02-19,20:12:18,"@CNN @MaeveReston After corporates takes over storage &amp; all kind of supplies   It results in ending over 5 lakh suppliers of; pesticides,machines,seeds,karyana &amp;labourers linked to stores  More people will be jobless  More hungry stomachs   More poverty  More Economy Crisis #ReleaseDetainedFarmers  https://t.co/cnD27hpyGA",['releasedetainedfarmers'],38
376,259,1362735556912771080,2021-02-19,20:07:29,"@BBCWorld After corporates takes over storage &amp; all kind of supplies   It results in ending over 5 lakh suppliers of; pesticides,machines,seeds,karyana &amp;labourers linked to stores  More people will be jobless  More hungry stomachs   More poverty  More Economy Crisis #ReleaseDetainedFarmers  https://t.co/Xt0CG6HWvZ",['releasedetainedfarmers'],38
377,260,1362733435190579204,2021-02-19,19:59:03,Time for @MrKRudd's enquiry into the Murdochracy and let's have a #MurdochfreeAustralia   Google’s Sky News Australia team-up will make it a climate misinformation powerhouse  https://t.co/mziQYkeTDM via @renew_economy,['murdochfreeaustralia'],22
378,261,1362718678039605253,2021-02-19,19:00:25,"#China has become one of the most desirable outsourcing destinations. Strategically located in Beijing &amp; Shanghai, we tap into the second-largest economy globally.  Grow your brand today:  https://t.co/HeUIAGVw1b   #TDCX #WeAreTDCX #Asia #CX  https://t.co/K9JPb1i2Lb","['china', 'tdcx', 'wearetdcx', 'asia', 'cx']",24
379,262,1362698963355271170,2021-02-19,17:42:05,"Great meeting with Singapore’s Minister for Communications and Information S Iswaran @SingaporeMCI Important discussions on our world leading 🇦🇺🇸🇬 Digital Economy Agreement, COVID vaccinations &amp; cyber security. And as a graduate of @UniofAdelaide Mr Iswaran has close ties with 🇦🇺  https://t.co/0P5figO0Cl",[],36
380,263,1362675605163048963,2021-02-19,16:09:16,"There is no road to a #NetZero economy without financial services, as companies need funding and insurance to manage physical and transition risks. #Sustainable finance has become an urgent priority across financial services.  https://t.co/N3ej5mpOsz  https://t.co/dergfuo9t0","['netzero', 'sustainable']",31
381,264,1362670344486625284,2021-02-19,15:48:21,"@BlackDickNixon3 @kixes of course tycoons in SG, or anywhere else, just want to get richer; wall street &amp; silicon valley have already destroyed all old economy in america &amp; elsewhere; that's why u got trump movement &amp; ISIS  but do SG liberals know anything about democracy? e.g. they dont like criticism",[],46
382,265,1362669712652427266,2021-02-19,15:45:51,"I think it’s not just about which companies are doing business with the regime itself, but about how much power SG (govt + companies) has over Myanmar’s economy, and therefore over the military regime.  Anyway, lmk if anyone wants to add to the doc!",[],45
383,266,1362669027324096512,2021-02-19,15:43:07,"Now that we have the blessing from our policymakers to enter #hydrogeneconomy time to technology expert take over.   - if the Green H2-economy ought to succeed we need to apply an all-in/all-out International ""blue ocean""   interdi… https://t.co/HLI5RRJbGM  https://t.co/IW37XNwBOH",['hydrogeneconomy'],33
384,267,1362667263451664385,2021-02-19,15:36:07,"On February 18, the first application of the Freedom Consensus Reputation System ""FCH Reputation Ranking"" ( https://t.co/71wYZRUulZ) was released.  The reputation ranking is based on the ""FIPA3_ Reputation Index"" protocol ( https://t.co/vHVcKLRA6s)",[],27
385,268,1362644286718676992,2021-02-19,14:04:49,"Building a fairer economy means ensuring organizations reflect the nation's diversity - from factory floor to boardroom. At @HP, we work closely with businesses to build more equitable and inclusive workplaces, including on diversity. #diversityequityandinclusion",['diversityequityandinclusion'],31
386,269,1362643075428933633,2021-02-19,14:00:00,"Each year we get to put on our journo hats and do Singapore Budget coverage for @Singtel, turning the story around in a few hours. Always fun.  https://t.co/8g35yFPTng  #budget #singapore #sme #highlights #economy","['budget', 'singapore', 'sme', 'highlights', 'economy']",26
387,270,1362611846297972743,2021-02-19,11:55:54,"@fmtoday Yeah, we are fully aware of that! But is the Pandemic under control? Is the Govt putting in place plans to reopen the economy, incl. tourism?",[],26
388,271,1362595357939564544,2021-02-19,10:50:23,"Budget 2021 has focused targeted help towards sectors that are most impacted by #COVID19. $870 million has been provided to support the aviation sector, one of the key pillars of our economy - but is this support justified? (1/2)",['covid19'],34
389,272,1362563396240048128,2021-02-19,08:43:23,"@babygoblen If you don't feel safe in a restaurant, don't go. But if restaurants are shutdown a lot of people (like what happened to you) will continue to lose their jobs due to the pandemic and the economy suffers as a result.",[],39
390,273,1362563308545470464,2021-02-19,08:43:02,"Biden to debut at G7 with vaccines, economy and China in focus  https://t.co/Wi0s9tNeRk",[],11
391,274,1362561041796722689,2021-02-19,08:34:02,"While there’s talk everywhere about the benefits of the circular economy, architects and construction firms often struggle to turn green ambitions into practical outcomes. If Recycling Building Materials Is a Construction Priority, Leave It to BIM  https://t.co/gnFpnUKeGA",[],37
392,275,1362559522695311365,2021-02-19,08:27:59,@TaviCosta And economy is booming. looks like economy never needed these 18.3M people!,[],12
393,276,1362558411779399680,2021-02-19,08:23:35,Uber faces UK Supreme Court ruling on worker rights in gig economy test  https://t.co/wcGsFMuCZx  https://t.co/eEPRu5tKjD,[],13
394,277,1362557416764698629,2021-02-19,08:19:37,"@POTUS Don't just control, we can't but God can. Muster all members of both houses to cone to God in humility to pray for forgiveness of sins  and His mercy to heal USA from covid pandemic and restore the economy.",[],37
395,278,1362527340786380803,2021-02-19,06:20:07,"Liquidity injected by the Bangko Sentral ng Pilipinas (BSP) meant to support the country’s economy rose to about 11.09 percent of the country’s gross domestic product (GDP), Governor Benjamin Diokno said on Thursday.   https://t.co/GOD1ou5v69",[],34
396,279,1362522081481527297,2021-02-19,05:59:13,"The National Economic and Development Authority (NEDA) reiterated on Thursday the need to further expand public transportation capacity and extend active transport support to make workers mobile, reduce hunger and help boost the country’s economy.   https://t.co/5Q9yHHc0l5",[],36
397,280,1362513540213403648,2021-02-19,05:25:16,"Treasury Secretary Yellen:  - Stimulus checks will jumpstart economy, aid families living on the edge  - Very important to have a big relief package",[],22
398,281,1362474913475538947,2021-02-19,02:51:47,@GoziconC Buhari economy. No1 in Africa. Now competing with world. Don't mind lazy youths,[],11
399,282,1362431426768044035,2021-02-18,23:58:59,"@sunilrtambey @DelhiPolice @PMOIndia @JoeBiden @BarackObama @GretaThunberg Modi has destroyed Indian economy...we have to go abroad to find jobs ....shame on Modi ...cant give Jobs ...want youth to go overseas...GDP -8% , unemployment worcet ever , USD ro INR .. Worset ....   https://t.co/WcKK8Bugv6",[],32
400,283,1362426482514042884,2021-02-18,23:39:20,@VEERA0004 @SecBlinken @MarisePayne @moteging @DrSJaishankar Support India to over take China and USA as the biggest economy. USA will be very very very happy.,[],19
401,284,1362401550946205699,2021-02-18,22:00:16,"U.S. Employment: Cautious Optimism After a Challenging Winter. January’s #employment report contained mixed details, but supports perceptions that the #economy is going through... Read more:  https://t.co/fRHBm3nKmL Or take a free trial:  https://t.co/U8frINtkW1 #macroeconomics  https://t.co/Sx7HWCAe8f","['employment', 'economy', 'macroeconomics']",30
402,285,1362397322265640960,2021-02-18,21:43:28,"The economy is very very bad, please let's avoid pregnancy.  https://t.co/qKEzmTwThC",[],9
403,286,1362386591457701891,2021-02-18,21:00:49," https://t.co/xEElVCtdTm THE national Covid-19 immunisation programme will begin on 26 Feb 21, Prime Minister Muhyiddin Yassin said on 16 Feb 21. Read more... #news #asia #asean #centennialasia #economy #malaysia #malaysianews","['news', 'asia', 'asean', 'centennialasia', 'economy', 'malaysia', 'malaysianews']",18
404,287,1362381553297408000,2021-02-18,20:40:48,Full decoupling from China could wipe out hundreds of billions from economy – US Chamber of Commerce  https://t.co/TeyJJ3B156 #,[],16
405,288,1362371358760595456,2021-02-18,20:00:18,#DYK Wastes from our #palmoil mills can be repurposed as renewable energy to power our mills! Find out how this circular economy works!  https://t.co/iavOHGU6KA  https://t.co/UDniTKoRjy,"['dyk', 'palmoil']",21
406,289,1362367643483660292,2021-02-18,19:45:32,A day with 17 new clusters still with 2K ++ and now look like again to economy again and later restart again the MCO 3.0! What a strategy,[],24
407,290,1362365573057769480,2021-02-18,19:37:18,"@BenedictDunant Why he blamed people? Who started all these? Why they keep arresting the people? If the coup never happen, our lives and economy will still be good. Oh.. I forgot, he will not get this position without the coup.",[],39
408,291,1362345757517312002,2021-02-18,18:18:34,"Great discussion with senior executives from 🇦🇺 companies in 🇸🇬 on the #business opportunities &amp; challenges of #COVID19, the #digital economy &amp; working with 🇸🇬 on our shared #sustainability agenda. @bhp @QBE @VisyIndustries @LendleaseGroup @meatlivestock @kwmlaw @ANZ_Newsroom  https://t.co/c8kCZOl0SK","['business', 'covid19', 'digital', 'sustainability']",21
409,292,1362343366894247936,2021-02-18,18:09:04,Read our latest report on Indonesia economy  https://t.co/BfRftti0vD for more info.,[],10
410,293,1362341105535234049,2021-02-18,18:00:05,The largest and newly formed bank in Indonesia is expected to become one of the largest Islamic banking institutions in the world. Find out how this would impact the emerging Sharia fintech scene and the Islamic economy.   https://t.co/UnRL4145WQ,[],37
411,294,1362340231224123394,2021-02-18,17:56:36,Find out what the latest Budget 2021 has in store for small- and medium-sized enterprises (SMEs) like your business. #SGBudget2021 #singapore #economy #SME  https://t.co/E6nuhOCekm,"['sgbudget2021', 'singapore', 'economy', 'sme']",17
412,295,1362339977762197505,2021-02-18,17:55:36,"The China-US trade war looks set to continue, says economics professor Zhu Ying. Whether in preventing technology transfer or seeking to enforce ""structural changes” in China’s economy, the US will seek leverage through the trade war. #USChina #Biden   https://t.co/nBSTFpMAd7","['uschina', 'biden']",36
413,297,1362326269086507016,2021-02-18,17:01:08,"“The outlook for the U.S. economy over the next three years looks stronger now than it did three months ago"", according to 39 forecasters surveyed which includes SKBI's principle researcher, Thomas Lam. Read the full report here &gt;&gt; https://t.co/NAN3CCeRLO  https://t.co/KlXMLw9QJM",[],36
414,298,1362304528628944897,2021-02-18,15:34:44,"Dear Indian Fintech founders, it is time to back crypto. Look at what Crypto is doing for Square &amp; PayPal’s business.  Total crypto market cap $1.5 Tn  DeFi economy now has $40B value. Stable coins to power your rails.   Why wouldn’t you want that for India?",[],45
415,299,1362296994937647108,2021-02-18,15:04:48,Missed the broadcast of this year's budget? In this piece we wrote for @Singtel we round up all the important takeaways that every SME should know.  https://t.co/NX8ueJRZB4 #budget #singapore #sme #highlights #economy,"['budget', 'singapore', 'sme', 'highlights', 'economy']",24
416,300,1362278562124861440,2021-02-18,13:51:33,"#Indonesia's #economy remains resilient amid the COVID-19 pandemic, thanks to swift policy support measures. With continued synergy in policy support and effective #vaccine roll-out, the economy is poised to #rebound in 2021.   For more insights, read:  https://t.co/BfRfttzBnb","['indonesia', 'economy', 'vaccine', 'rebound']",30
417,301,1362271126114553858,2021-02-18,13:22:00,The #renewables &amp; #LNG industry are keenly eyeing #Vietnam's booming economy and #electricity demand. So far it's #coal that's benefited most with shipped imports jumping from virtually zero in 2015 to almost 25 mln tons in 2020. Let's hope cleaner tech makes more inroads soon.  https://t.co/XmtQOyoDp1,"['renewables', 'lng', 'vietnam', 'electricity', 'coal']",33
418,302,1362261683993911301,2021-02-18,12:44:29,Trade between China and the European Union (EU) in 2020 has remained strong and continued to grow despite the pandemic and struggling global economy. The continuous growth in trade is partially attributed to their mutual cooperation to contain the COVID-19 pandemic.  https://t.co/24OyYF5WvN,[],40
419,303,1362261268233617410,2021-02-18,12:42:50,"Fuck my life, next week I have a total of 14 hours Economy class in just three days",[],17
420,304,1362257101297381376,2021-02-18,12:26:17,"Kant says that to encourage circular economy, there is a need to develop an enabling framework that uses smart regulations, market-based instruments, research and innovation, incentives, information exchange for voluntary approaches. @USIBC @UKIBC @DiasporaIndiaNZ @odi_india @RBI",[],30
421,305,1362256774292594692,2021-02-18,12:24:59,"No economy can succeed without tapping the 'incredible potential of women,' ex-@PepsiCo CEO @IndraNooyi said at @ProcterGamble and @unwomenasia #WeSeeEqual 2021 virtual event  https://t.co/loeJUh0PBS",['weseeequal'],18
422,306,1362250615804620800,2021-02-18,12:00:30,"There's a lot of good that can be achieved with APIs — and even more with the API economy. Learn more from @wef, @Capgemini, and @accenture.  https://t.co/3N9dSkhDix",[],21
423,307,1362250488910123008,2021-02-18,12:00:00,"Just as Budget 2021 focuses on restructuring Singapore's economy for long-term resilience, discussions in the Middle East now are centred on economic diversification. Sign up for our Annual Conference to learn about trends linking Asia &amp; the Middle East!  https://t.co/JhE1ekNpfu",[],35
424,308,1362244496063258625,2021-02-18,11:36:11,"2/3 ...discuss plans to defeat the pandemic, rebuild the global economy and deal with China as a cohesive group. Expect this to be risk positive as it’s a step towards finally having a coherent global policy to living with the pandemic till vaccination efforts succeed.",[],45
425,309,1362242763102711812,2021-02-18,11:29:18,@md_aufa_ obvious en kau part of singapore’s growing economy,[],9
426,310,1362230153728909313,2021-02-18,10:39:12,#SGBudget2021 shows how reserves from the past are being used to weather the present storm and drive #transformation for SG to emerge stronger ahead of structural changes in the global economy. @BusinessTimes subscribers can read the full article here:  https://t.co/6djCE7H9HN  https://t.co/6jt4CYFvzJ,"['sgbudget2021', 'transformation']",36
427,311,1362220406250250243,2021-02-18,10:00:28,Japan helps Indian manufacturers to play a role in global economy; JETRO implements 'Strengthening Overseas Supply Chains' program  https://t.co/I00GwWx0pe @IndianEmbTokyo @indiajapanforum @JapaninIndia @JETROUSA @jica_usa @sony_india @Nissan @Govt_Karnataka @TheOfficialSBI @Honda,[],18
428,312,1362212750953340928,2021-02-18,09:30:03,"@mmpadellan @AOC It’s a terrible idea. If we want to put money back into the economy, let’s just give it to left-handed people with a Q in their name. Better still, make college more affordable.",[],34
429,313,1362203064829059073,2021-02-18,08:51:33,Our recent webinar with David Shambaugh and Wang Gungwu got picked up by the SCMP. Asean tilts towards China economy as US ‘neglect’ causes uncertainty: analysts  https://t.co/wA2idrlfpO via @scmpnews,[],27
430,314,1362146080889049092,2021-02-18,05:05:07,"Trade Secretary Ramon Lopez told reporters he favors shifting the whole country to MGCQ by March, as proposed by the economic team. He said the economy can no longer afford taking another month of operating with some sectors closed.   https://t.co/Hoq21OHuli",[],39
431,315,1362146074241081345,2021-02-18,05:05:06,The Department of Trade and Industry (DTI) on Wednesday warned policymakers that families may sink into poverty and hunger if they insist on keeping several sectors of the economy shut.   https://t.co/Hoq21OHuli,[],30
432,316,1362142519673450503,2021-02-18,04:50:58,"@d_hsu_work @ElizKolbert @MichaelEMann How about a civilization changing , and therefore saving of  this planet, dropping of capitalism.   As long as evergrowing profits run our economy we wil inevitably destroy our planet.  No amount of greenwashing by billionaires wil do anything to abate that future.",[],41
433,317,1362121537617338373,2021-02-18,03:27:36,"Vietnam’s progress toward a more liberal, market-friendly economy has proceeded in fits and starts.   https://t.co/TWO43CyshG",[],14
434,318,1362117169505574916,2021-02-18,03:10:14,"Fed Minutes:   - Stimulus &amp; vaccines to provide economy a ""sizable boost""  - Members noted the importance of communicating any changes to asset purchasing well in advance",[],24
435,319,1362105997498613761,2021-02-18,02:25:51,tldr no thoughts head empty can't survive in the economy,[],9
436,320,1362082428588748807,2021-02-18,00:52:11,"""The results confirm that countries with an economy intensive on rents from oil and natural gas are on average noticeably more susceptible to predatory publishing than the rest of the world. Moreover, interestingly, this seems to be specific to oil and natural gas"" - This is odd",[],46
437,321,1362072340239015936,2021-02-18,00:12:06,"its always ‘hujung hujung ke dapur juga nanti’ huhh!! you should overthink about this, what if you face a household collapse? or your husband punya economy deteriorated or you have been cheated? atleast you have your own guarantee for any possibilities AAAaaaAA think abt it hun",[],46
438,322,1362070161289736194,2021-02-18,00:03:27,@RehamKhan1 @RehamKhan1 Handsome fcuk boi cum playboy PM Niazi is hell bent on annihilating Pakistan’s economy.,[],15
439,324,1361947367079964672,2021-02-17,15:55:30,theres a lot to do but i’m stuck with this kind of economy state...,[],15
440,325,1361918547677487105,2021-02-17,14:00:59,Dear TMJ:) Please do something for us especially Johorian as most of the economy mainly depend on Singapore. Suggest set up special committee to combat the pandemic and temporarily lock Johor till become green back and invite Singapore for travel bubble,[],41
441,326,1361658860511981571,2021-02-16,20:49:05,"budget 2021 has gd things n is suppose to help the economy   my bf, selective reading: petrol increase?! knn",[],18
442,327,1361263739324960773,2021-02-15,18:39:01,So should we be prudent in our spending or spend more to help our local economy? I’m confused...,[],19
443,329,1360591449775951878,2021-02-13,22:07:34,China economy had always been a paradox for most outsiders(for lack of understanding local social systems) and even insiders(for lack of understanding economic knowledges)    https://t.co/W74OaCdlDG,[],26
444,330,1360589343539142660,2021-02-13,21:59:12,Nearby restaurant and pub all open like nothing happened.  Economy still have to run,[],14
445,331,1360576166193553416,2021-02-13,21:06:50,"That’s like saying since you visited a country MD it’s economy picked up, the credit should go to you. This does not prove anything except that you are sucking up to the powers to be...hoping to land up a plum position in the govt if ever. Very shallow",[],51
446,332,1359667316565307392,2021-02-11,08:55:24,"@jamesplloyd ""...lifting the rule could have serious repurcussions for Hong Kong's economy and society."" 🙄",[],12
447,333,1358976945543729157,2021-02-09,11:12:07,#Temasek's CEO to retire in Oct 2021. #singapore #SWF #GIC #governmentreserves #economy   https://t.co/GzAs2LRGoK,"['temasek', 'singapore', 'swf', 'gic', 'governmentreserves', 'economy']",5
448,334,1357595848247369730,2021-02-05,15:44:07,Cisco really taking advantage of the pandemic asking engineers to take more certification exams just to leverage their economy,[],19
449,335,1357108889867571200,2021-02-04,07:29:07,"Any article about Papua New Guinea that criticises their relationship with China should also acknowledge the immense damage Australia has done to PNG, its people, &amp; its economy.",[],27
450,337,1356511001684832256,2021-02-02,15:53:20,Imposing carbon tax hike is a strong statement to reduce greenhouse gas emissions but it will also hurt low-income families &amp; seniors more. A rebate may help the vulnerable groups but the covid affected economy may make the journey painful.,[],38
451,338,1356332882273292288,2021-02-02,04:05:33,Mizuho's Ricchiuto: Economy Will Grow For A Long Time (Radio)  https://t.co/0kf9ygcSA6,[],9
452,339,1355375803706470400,2021-01-30,12:42:27,"@raneunn In finance, there is something called dead cat bounce. This is what would happen with economy as well. Even a moribund economy would show a “growth” after nine consecutive quarters of economic contraction. That contraction was due to Nehru not making Modi work.",[],43
453,340,1354706229281447937,2021-01-28,16:21:48,"COVID-19 vaccinations rolled out to workers in hotel industry, 'critical pillar' of economy  https://t.co/VSThi7PyAA",[],13
454,342,1353255266184126464,2021-01-24,16:16:12,@tanhuiyi @nervousfag Agree with @tanhuiyi. Heard an interview with an economist recently &amp; he said it is critical for SG to open up for overseas visitors in order to save our economy. Govt is taking precautions to quarantine them so the risk of them infecting local population is reduced.,[],45
455,343,1353038018433544192,2021-01-24,01:52:56,@UnseenJapanSite yea they seem to think that they can save both the economy n ppl lives at the same time  without  much planning.  Hope the vacines would do its trick,[],29
