,index,Sentences,Comment Datetime,Textblob_polarity_score,Textblob_subjectivity_score,Vader_neg_score,Vader_neu_score,Vader_pos_score,Vader_compound_score,Emotions
0,0,You can pre order more.,3/9/21,0.5,0.5,0.0,1.0,0.0,0.0,neutral
20,20,How come I try to put on the mask feels very warm leh.,3/1/21,0.78,0.78,0.0,0.834,0.166,0.2944,anger
21,21,Some more the smell very strong not nice to wear.,3/1/21,0.2544444444444445,0.8177777777777777,0.183,0.564,0.253,0.2494,anger
40,40,Super metal teeth.,3/3/21,0.3333333333333333,0.6666666666666666,0.0,0.339,0.661,0.5994,joy
41,41,Also don't know where the kosong cases of confirmed influenza cases come from.,3/3/21,0.4,1.0,0.0,1.0,0.0,0.0,fear
47,56,Squaredot wrote: Better separate your parents from your boy.,3/3/21,0.5,0.5,0.0,0.734,0.266,0.4404,neutral
51,60,"No joke....somemore not as if my side/hose no manpower to take care (wife coming bk soon liao 1700h)) Asked her to wear at least a KN95 in the house and put on flat mask for the kid she told me not to kua zhang, kid is stick, wear mask uncomfortable.",3/3/21,-0.27499999999999997,0.5083333333333333,0.127,0.815,0.058,-0.4215,anger
52,61,wtf,3/3/21,-0.5,1.0,1.0,0.0,0.0,-0.5859,neutral
57,86,"(btw there is also influenza test in the form of PCR, serology and of coz the good old viral culture) but govt say 8 months no flu eh lol",3/4/21,0.5333333333333333,0.5,0.173,0.669,0.158,-0.1406,joy
60,89,Smell : weird smell so wash before usage.,3/2/21,-0.5,1.0,0.221,0.779,0.0,-0.1779,fear
64,93,Shape : weird chin shaped like meant for people with underbite jaw.,3/2/21,-0.5,1.0,0.129,0.682,0.189,0.2023,joy
66,95,Function : TBC waiting for it to dry after washing 5.,3/2/21,-0.06666666666666665,0.6,0.0,1.0,0.0,0.0,neutral
71,109,Curious..,3/2/21,-0.1,1.0,0.0,1.0,0.0,0.0,neutral
75,113,The 1st and 2nd batch of free mask the material used like not \u901a\u98ce as i can smell my own breath whenever i breathe in and out.,3/2/21,0.3333333333333333,0.6,0.0,0.799,0.201,0.7003,fear
76,114,"IndigoEyes wrote: To be fair, I don't know why some Singaporeans who not travelling joined that group also.",18/1/21,0.7,0.9,0.0,0.874,0.126,0.3182,anger
79,117,"People like TS joined a group not meant for them, hear something they don't like then spread to edmw... abit lol.",18/1/21,0.8,0.7,0.0,0.685,0.315,0.7783,anger
86,124,articland05 wrote: too many le i nv buy any masks...all use govt give de.,3/1/21,0.5,0.5,0.0,1.0,0.0,0.0,neutral
94,132,ichinisan wrote: This type of machine which is only used for collecting masks can have issues so easily.,3/1/21,0.21666666666666667,0.9166666666666667,0.0,0.845,0.155,0.4795,anger
96,134,Not expert but think cause this one involve more electronics and network bah.,3/1/21,0.5,0.5,0.0,1.0,0.0,0.0,neutral
104,142,I think it\x92s because of the weather now; very hot again.,3/1/21,0.325,1.0,0.0,1.0,0.0,0.0,neutral
106,144,"ahwei91 wrote: collected liao... the aunty after me, her mask dropped halfway and stuck on top of the exit hole, unable to take out... see before also.",3/1/21,0.0,0.5,0.069,0.868,0.062,-0.0516,fear
112,150,what more you want?,3/1/21,0.5,0.5,0.0,0.655,0.345,0.1477,neutral
117,157,Must think from general population.,3/1/21,0.05000000000000002,0.5,0.0,1.0,0.0,0.0,neutral
123,163,So audacious and totally disregard the law and others safety.,15/1/21,0.0,0.75,0.166,0.487,0.347,0.3818,anger
134,174,I'll be glad to get rid of the cuck muzzle once they stop slapping fine on people for not wearing.,24/2/21,0.45833333333333337,0.75,0.092,0.708,0.2,0.3818,anger
141,182,Its been more than a year.,22/2/21,0.5,0.5,0.0,1.0,0.0,0.0,joy
144,185,When more people take chances of re opening will be faster.,22/2/21,0.5,0.5,0.0,0.829,0.171,0.2648,fear
150,191,The side effect very mild one.,22/2/21,0.43333333333333335,0.65,0.0,1.0,0.0,0.0,joy
151,192,Now we are safe just waiting for you.,22/2/21,0.5,0.5,0.0,0.707,0.293,0.4404,neutral
153,194,"Hong: this is not aids, healthy still got to wear.",22/2/21,0.5,0.5,0.201,0.799,0.0,-0.3089,anger
158,199,"I am sure Pan mama can work out special discounts for the both of you when we reopen.. Pan: agrees immediately, once reopen i give both of you special discount.",22/2/21,0.4047619047619048,0.6772486772486772,0.0,0.716,0.284,0.8176,joy
160,201,Chen smack the table and said ok lets take the vaccine!,22/2/21,0.625,0.5,0.0,0.801,0.199,0.3595,joy
162,203,Pan: thats right we will be waiting for you.,22/2/21,0.2857142857142857,0.5357142857142857,0.0,1.0,0.0,0.0,joy
165,231,no need so complicated.,22/2/21,-0.5,1.0,0.423,0.577,0.0,-0.296,neutral
169,235,Frankly I think they did a damn good job.,20/11/20,0.7,0.6000000000000001,0.255,0.472,0.274,0.0516,neutral
172,238,Good job on this PAP.,20/11/20,0.7,0.6000000000000001,0.0,0.58,0.42,0.4404,neutral
175,241,"We are much more obedient compared to any other country's populace except maybe Japan, and our country is small and easy to control, which Japan is not.",20/11/20,0.19166666666666668,0.6016666666666667,0.0,0.9,0.1,0.4404,neutral
177,243,"As a Singaporean, please give yourself credit for being an obedient boi boi wear mask every day.",20/11/20,0.4,0.9,0.0,0.741,0.259,0.5994,joy
179,245,There is no such thing as lion's share of the credit going to the PAP.,20/11/20,0.0,0.5,0.116,0.632,0.253,0.3818,fear
182,248,"Anyway, yes, what I mean is, you can ownself praise ownself as a private citizen of this country.",20/11/20,-0.15625,0.53125,0.0,0.69,0.31,0.743,neutral
183,249,"Bidacurry wrote: Ok, so you point is?",20/11/20,0.5,0.5,0.0,0.732,0.268,0.296,neutral
187,253,"While waiting for his drinks order to be completed, he said he ""lightly coughed twice"" as his throat had been feeling irritated.",21/2/21,0.4,0.7,0.122,0.816,0.061,-0.3612,anger
193,259,Chen told Lianhe Wanbao that he understands that people might be more wary of others' coughing during this period.,21/2/21,0.0,0.6,0.0,1.0,0.0,0.0,anger
196,262,"They are also in touch with the customer in question ""to find out more about the facts of the situation"".",21/2/21,0.5,0.5,0.0,1.0,0.0,0.0,joy
203,290,"In the end I ordered from watsons Taiwan and send to sg.. Watsons mask is kyky, dk why sg stops selling them If you can't handle me at my worst, then you sure as hell don't deserve me at my best.",21/2/21,0.16666666666666666,0.7296296296296295,0.199,0.676,0.125,-0.5859,anger
208,295,"First-time offenders who breach safe distancing measures are fined $300, and second-time wrongdoers $1,000.",21/2/21,0.5,0.5,0.144,0.69,0.167,0.1027,anger
209,296,Offenders may also face prosecution in court for egregious cases and higher fines if convicted.,21/2/21,0.25,0.5,0.305,0.695,0.0,-0.6908,anger
211,298,"Fines for not wearing masks totalled more than $510,000.",21/2/21,0.5,0.5,0.0,1.0,0.0,0.0,anger
212,299,MSE added that gathering in groups larger than the permitted size was one of the most common infringements of the Covid-19 safety measures.,21/2/21,0.06666666666666667,0.5,0.0,0.887,0.113,0.4215,fear
216,303,"Since Jan 26, households can have a maximum of eight unique visitors per day.",21/2/21,0.375,1.0,0.0,1.0,0.0,0.0,neutral
222,309,"In response to queries from The Sunday Times, the police said it supports other agencies to enforce safe management measures at known hot spots.",21/2/21,0.20833333333333334,0.5750000000000001,0.0,0.803,0.197,0.6597,anger
223,310,"Meanwhile, the Ministry of Manpower (MOM) conducts inspections of workplaces to ensure that companies abide by safe management measures.",21/2/21,0.5,0.5,0.0,0.756,0.244,0.6705,anger
227,314,"But if he was wearing his mask like in the photo, too bad, deserve it.",20/2/21,-0.6999999999999998,0.6666666666666666,0.184,0.684,0.132,-0.25,fear
231,318,Idiot nurse.,20/2/21,-0.8,0.8,0.767,0.233,0.0,-0.5106,neutral
247,337,"I had seen many moronic lowlives, including yp who take off their masks just to cough into the air.",20/2/21,0.5,0.5,0.298,0.702,0.0,-0.7783,fear
250,340,Have to tell them off nicely.,20/2/21,0.6,1.0,0.0,0.633,0.367,0.4404,anger
251,341,"since we are pretty much controlled, maybe it's time to review and relax the mask rules?",21/2/21,0.225,0.6,0.0,0.697,0.303,0.7269,neutral
252,342,"like only when take public transport, go wet markets, cinemas, supermarkets, shopping malls and other potential crowded places then need to wear masks?",21/2/21,-0.045,0.5683333333333334,0.0,0.898,0.102,0.3612,anger
253,343,"s-ghost wrote: since we are pretty much controlled, maybe it's time to review and relax the mask rules?",21/2/21,0.225,0.6,0.0,0.724,0.276,0.7269,neutral
257,348,"With special rulings for those activists, woke ppl, US always better ppl.",21/2/21,0.4285714285714286,0.5357142857142857,0.0,0.641,0.359,0.6808,joy
261,354,Yes some guys look good with mask on But the moment they remove.....,19/2/21,0.7,0.6000000000000001,0.0,0.663,0.337,0.6808,anger
263,356,Duh!,20/2/21,-0.375,0.6,0.0,1.0,0.0,0.0,neutral
264,357,"Anyways, I've tried both surgical and different types of n95 masks.",20/2/21,0.0,0.6,0.0,1.0,0.0,0.0,anger
265,358,The most comfortable is those that has a lot of room in the mask and with a vent.,20/2/21,0.45,0.65,0.0,0.807,0.193,0.5563,fear
266,359,"However, n95 masks with a vent only protect the user but not others so I would say the best has to be without a vent.",20/2/21,0.5,0.65,0.0,0.725,0.275,0.8225,anger
267,360,"3M does good n95 masks and like I've said, go with those that has a lot of room in the mask for you to breathe.",20/2/21,0.7,0.6000000000000001,0.0,0.803,0.197,0.6597,joy
269,362,It's really just wear for show only.,20/2/21,0.1,0.6,0.0,1.0,0.0,0.0,anger
270,363,"And if you are walking up the stairs or something, you will find that when you inhale so hard, the mask will be sucked to your nostrils, making it very difficult to breathe.",20/2/21,-0.4708333333333333,0.7708333333333333,0.203,0.797,0.0,-0.769,fear
275,377,N95 is more for fine particulate prevention not necessary medical purpose.,20/2/21,0.22916666666666669,0.5,0.0,0.828,0.172,0.2682,neutral
276,378,My worst disposable mask ever bought - Ultron Medical.,20/2/21,-0.5,0.5,0.369,0.631,0.0,-0.6249,joy
280,382,"Masks were thick and looked good and but omg, the fibres!",20/2/21,0.2875,0.5375000000000001,0.0,0.817,0.183,0.3054,fear
284,386,Threw all 4 boxes away as I was risking my health when I kept on pulling and touching the exterior of the mask to get the fibres out of my nose.,20/2/21,0.5,0.5,0.078,0.922,0.0,-0.3182,fear
287,389,Tried a number of brands for disposable masks and the best one by far is the brand called 'smile365' sold at Japan Home.,20/2/21,0.55,0.65,0.0,0.784,0.216,0.6705,fear
290,392,elimmel wrote: Sure many never go see doctor la.,19/2/21,0.5,0.6944444444444444,0.0,0.777,0.223,0.3182,neutral
310,432,Otherwise this will unfortunately be the new norm for many years to come.,16/2/21,0.04545454545454545,0.6515151515151515,0.167,0.833,0.0,-0.34,joy
311,433,Ye_Rongtian wrote: Our borders will open when everyone have been shot.,16/2/21,0.0,0.5,0.0,1.0,0.0,0.0,anger
313,435,I am afraid wearing of masks will be here for a while... And so will the mutated forms of the Covid 19,16/2/21,-0.6,0.9,0.0,1.0,0.0,0.0,fear
323,445,More WFH 2.,15/2/21,0.5,0.5,0.0,1.0,0.0,0.0,joy
331,453,"In fact, some masks/coverings also vary in effectiveness in source control in preventing infection spread, eg some DIY cloth masks, look pretty nia.",13/2/21,0.25,1.0,0.043,0.83,0.126,0.4767,fear
332,454,The gaiter/scarf that created a hoo-haa here is a good eg.,13/2/21,0.7,0.6000000000000001,0.0,0.588,0.412,0.5994,joy
341,471,"Try using your hands to cusp the sides and nose, it'd be much more unbreathable.",13/2/21,0.5,0.5,0.0,1.0,0.0,0.0,neutral
344,474,Look at the more DIY type pretty pretty cloth masks (not talking about the temasek ones).,13/2/21,0.3333333333333333,0.8333333333333334,0.0,0.669,0.331,0.7862,joy
345,475,"Maybe this also applies a bit to the cheaper non-surgical $2.50 for 50pcs MIC ones, coz i did measure significantly lower levels of filtration on my laser particle counter.",13/2/21,0.375,0.875,0.078,0.922,0.0,-0.296,anger
346,476,Nevertheless it would save you from the $300 fine definitely.,13/2/21,0.20833333333333334,0.5,0.0,0.476,0.524,0.7717,neutral
349,479,"Even if this Sundry shop uncle did not wear a mask at all, there is still a chance that he has not spread to the festive crowd @ chinatown blk 335 even if he has come across a total of say 50 customers.",13/2/21,0.0,0.75,0.0,0.881,0.119,0.6124,anger
353,483,"And after that maybe then spring up as symptomatic case who sees the GP and uses TT actively, then that case becomes unlinked.",13/2/21,-0.13333333333333333,0.6,0.0,0.905,0.095,0.3182,neutral
354,484,"Then people will be proclaiming ""see, this chinatown uncle did not spread at all other than to his own family"".",13/2/21,0.2375,0.6875,0.0,1.0,0.0,0.0,anger
355,485,"Nobody would be none the wiser , unless if TT is 100% perfectly utilised for forward and backward contact tracing.",13/2/21,1.0,1.0,0.082,0.736,0.182,0.5126,fear
357,487,So many places just walk in nia.,13/2/21,0.5,0.5,0.0,1.0,0.0,0.0,neutral
358,488,The most vurnerable area of contaction is through the eyes.,13/2/21,0.5,0.5,0.0,1.0,0.0,0.0,fear
359,489,The use of mask is to protection your surrounding against u in case u sick.,13/2/21,-0.7142857142857143,0.8571428571428571,0.216,0.784,0.0,-0.5106,fear
366,496,does it mean all of us need to wear ffp2 mask from now on?,2/10/21,-0.3125,0.6875,0.0,1.0,0.0,0.0,fear
375,505,"She has also tested preliminarily positive for the B117 strain, and is pending further confirmatory tests.",2/10/21,0.11363636363636363,0.5227272727272727,0.064,0.745,0.191,0.5267,joy
378,508,It is possible for one to be infected just before or just after vaccination as it typically takes a few weeks for an individual to build up immunity after completing vaccination.,2/10/21,-0.09166666666666667,0.5,0.099,0.901,0.0,-0.4939,fear
387,520,I understand that all passengers must be suited up ie wear full protective gown with masks and gloves etc when check in.,2/10/21,0.35,0.55,0.0,1.0,0.0,0.0,joy
397,530,"Based on our investigations so far, the cases are in the community, and there are no new cases in the dormitories.",2/11/21,0.015909090909090914,0.7272727272727273,0.099,0.901,0.0,-0.296,neutral
402,535,"* * * We are still working through the details of the cases, and further updates will be shared via the MOH press release that will be issued tonight.",2/11/21,0.0,0.5,0.0,0.912,0.088,0.34,joy
405,538,It is important that everyone remain vigilant and adhere to the safe management measures.,2/11/21,0.45,0.75,0.0,0.632,0.368,0.6597,neutral
418,551,The jogger is quite far away and he is complaining.,2/9/21,0.1,1.0,0.167,0.833,0.0,-0.2023,anger
419,552,why dont you take the time to read and if everyone is far away from each other and saliva doesn't spray and linger then there is absolutely zero need for mask right?,2/9/21,0.11517857142857144,0.7026785714285714,0.0,1.0,0.0,0.0,neutral
440,580,They think that they are talented and a class above locals now.,2/9/21,0.35,0.5,0.0,0.752,0.248,0.5106,anger
443,583,Then got one idiot some nights come home from work (close to midnight) and chat on his phone at the carpark of the residents block.,2/9/21,-0.8,0.8,0.212,0.788,0.0,-0.7351,fear
445,585,Damn weird.,2/9/21,-0.5,1.0,1.0,0.0,0.0,-0.5267,anger
447,587,Anyone know why they love talking on phones?,2/9/21,0.5,0.6,0.0,0.625,0.375,0.6369,neutral
449,589,Sent from From Power of LOVE using GAGT,2/9/21,0.5,0.6,0.0,0.587,0.413,0.7125,joy
451,591,Sent from From Power of LOVE using GAGT at least 20-30 mins of spewing from phone talk is ok?,2/9/21,0.2333333333333333,0.5,0.0,0.704,0.296,0.7983,joy
455,599,Only sinkies are wise to wear (fishing peoole all also wear).,2/9/21,0.35,0.95,0.0,0.763,0.237,0.4767,anger
456,600,"Been there numerous times,...",2/9/21,0.0,0.5,0.0,1.0,0.0,0.0,neutral
458,602,Many are residents from the Reflections by the Bay (ie non locals).,2/9/21,0.5,0.5,0.0,1.0,0.0,0.0,joy
463,607,will be hard for TS to prove otherwise.,2/9/21,-0.2916666666666667,0.5416666666666666,0.167,0.833,0.0,-0.1027,anger
467,611,"Stupid, selfish Indian woman btw",2/9/21,-0.6499999999999999,1.0,0.684,0.316,0.0,-0.7579,anger
470,614,The only rule is need to wear mask when no exercising.,2/9/21,0.0,1.0,0.18,0.82,0.0,-0.296,neutral
472,616,"If u want to raise a case, most likely there wont be any.",2/9/21,0.25,0.75,0.0,0.885,0.115,0.0772,fear
475,620,I don't think TS is wrong.,2/9/21,-0.5,0.9,0.437,0.563,0.0,-0.4767,anger
476,621,"Sorry if u really concerned she is not wearing mask and spreading covid, going up close to speak to her is incredibly irresponsible!",2/9/21,0.2333333333333333,0.7000000000000001,0.193,0.807,0.0,-0.5838,fear
479,624,"TurboBumbleBee wrote: Sorry if u really concerned she is not wearing mask and spreading covid, going up close to speak to her is incredibly irresponsible!",2/9/21,0.2333333333333333,0.7000000000000001,0.179,0.821,0.0,-0.5838,fear
480,626,"Omg murderer soory hor, before you attack here are the facts i was wearing a mask i didnt go up close hence i had to speak louder to which she used the word barking since she more educated than me and since she beelive that talk no mask, no saliva will fall on anyone",2/9/21,0.5,0.5,0.208,0.792,0.0,-0.9022,fear
481,627,"wendychan202 wrote: soory hor, before you attack here are the facts i was wearing a mask i didnt go up close hence i had to speak louder to which she used the word barking since she more educated than me and since she beelive that talk no mask, no saliva will fall on anyone Mask is to protect others not to protect yourself.",2/9/21,0.5,0.5,0.112,0.81,0.078,-0.3182,anger
482,628,U are taking unnecessary risk and putting yourself and many others in harm\x92s way.,2/9/21,0.04999999999999999,0.7,0.149,0.851,0.0,-0.2732,anger
484,630,U should have just let the authorities who are better equipped handle this.,2/9/21,0.5,0.5,0.0,0.791,0.209,0.4404,anger
485,631,U are not just a potential mass murderer but an uneducated idiot as well!!!!,2/9/21,-0.5,0.9,0.457,0.543,0.0,-0.8562,anger
486,632,Right now u are basically on par with hitler!!,2/9/21,0.4464285714285714,0.5357142857142857,0.0,1.0,0.0,0.0,fear
488,635,"to spew essentially... if its so ok, then why arent you brave cowards walking around without masks?",2/10/21,0.43333333333333335,0.6,0.134,0.727,0.139,0.0233,neutral
489,636,"and say  FU  to PAP, it should actually be healthy dont wear mask...?",2/10/21,0.5,0.5,0.284,0.575,0.141,-0.5766,fear
492,639,she is higher educated SUPPOSEDLY... (degree buy from where?),2/10/21,0.25,0.5,0.0,1.0,0.0,0.0,neutral
495,642,The fact is our MIW favours them more than us.,2/10/21,0.5,0.5,0.0,0.763,0.237,0.4215,anger
497,644,Be the obedient sinkie that the white would be happy about.,2/10/21,0.4000000000000001,0.6333333333333333,0.0,0.73,0.27,0.5719,joy
498,645,Wa they keep pretending and deluding themselves that they can go about normally and not get covid simply because they wear a mask which is not 100% foolproof.,2/10/21,0.075,0.5035714285714286,0.076,0.875,0.049,-0.1984,anger
499,646,then proceed to go many places which have lots of people.,2/10/21,0.5,0.5,0.0,1.0,0.0,0.0,anger
500,647,Rokusaburo wrote: Wa they keep pretending and deluding themselves that they can go about normally and not get covid simply because they wear a mask which is not 100% foolproof.,2/10/21,0.075,0.5035714285714286,0.071,0.883,0.046,-0.1984,anger
502,650,i think meeting covid in sg is as good as striking lottery.,2/10/21,0.6,0.8,0.0,0.775,0.225,0.4404,joy
503,651,wear mask is good enough at these rates.,2/10/21,0.35,0.55,0.0,0.707,0.293,0.4404,anger
506,654,Most people erroneously think that wearing a mask is to prevent catching the virus from another person.,2/10/21,0.19999999999999998,0.6666666666666666,0.0,0.932,0.068,0.0258,anger
507,655,The fact is : The COVID-19 virus can be easily caught directly or indirectly through the eyes which is not covered by the mask.,2/10/21,0.26666666666666666,0.6166666666666667,0.0,0.902,0.098,0.34,fear
509,657,"This is why when the infection rate in the population is low, only the infected need to wear mask and there is no point for a healthy person to wear mask.",2/10/21,0.16666666666666666,0.6,0.207,0.718,0.075,-0.5859,anger
510,658,A healthy person wearing a mask can still easily get the virus through his/her eyes if he/she is exposed to the virus.,2/10/21,0.4666666666666667,0.6666666666666667,0.056,0.726,0.218,0.5859,anger
514,662,Wearing mask is just giving people a false sense of security.,2/10/21,-0.4000000000000001,0.6,0.0,0.625,0.375,0.5859,fear
515,663,BHills wrote: Most people erroneously think that wearing a mask is to prevent catching the virus from another person.,2/10/21,0.19999999999999998,0.6666666666666666,0.0,0.939,0.061,0.0258,anger
519,675,"(edit - of coz if you wanna wear some stylish safety glasses shd there be an uptick in cases, go ahead, nobody stopping) Unless, of coz, you still go and dig underneathe and rub it (before sanitisation).....then LLST.",2/10/21,0.5,1.0,0.0,0.928,0.072,0.4215,fear
521,677,"""Healthy"" also need to wear mask....so as to reduce (nobody said it can be totally stopped) infection risk.",2/10/21,0.25,0.625,0.122,0.878,0.0,-0.3321,neutral
525,681,"You would not know whether or not you are truly ""healthy"" or not, unless you get tested very frequently, which is of coz practically impossible here.",2/10/21,-0.012222222222222209,0.63,0.088,0.912,0.0,-0.3412,neutral
526,682,"This has been discussed so many times and well known in the news etc, some people so do not get it.",2/10/21,0.5,0.5,0.0,0.905,0.095,0.2732,anger
528,684,The most important evidence of mask wearing comes from real world epidemiological data.,2/10/21,0.3666666666666667,0.6,0.0,0.851,0.149,0.2716,fear
529,685,That is the most important aspect - does it work in the real world in dropping infections all around the world?,2/10/21,0.3666666666666667,0.6,0.0,0.901,0.099,0.2716,neutral
536,694,Dumb people are destined to be eradicated from the face of the earth.. unfortunately.. some of the people who follow the rules will also be brought down along with them.. this is how it works in the real world... a.sholes... kills...,2/10/21,-0.20763888888888893,0.5222222222222223,0.076,0.924,0.0,-0.5106,anger
537,704,"Add : If the infected rate is high, the chances of catching the virus in crowded places would be high even if everyone wears mask.",2/10/21,0.3066666666666667,0.66,0.119,0.815,0.067,-0.34,fear
548,715,"The real world epidemiological data is all there liao, am sure SG covid task force/experts/authorities know that.",2/10/21,0.35,0.5944444444444444,0.0,0.874,0.126,0.3182,neutral
551,718,"Plus there are asymptomatics out there which have infected others before.....no need for symptoms or ""healthy no need wear mask"".",2/10/21,0.5,0.5,0.215,0.677,0.108,-0.4019,neutral
553,722,Most importantly is to find the weakest link and get it fixed.,2/10/21,0.3333333333333333,0.5666666666666667,0.208,0.629,0.163,-0.1796,neutral
557,726,(AC places might be viable for a bit longer tho) The unlinked cases that pop up from time to time/sick don't go GP as well.... (sometimes cannot totally blame them for some cases) Fatigue or something....,2/10/21,0.0,0.75,0.054,0.886,0.06,0.0651,anger
564,733,"too many holes/exceptions in the system, with vaccine and mask, the thing gets stopped in its tracks before it becomes a cluster.",2/9/21,0.5,0.5,0.087,0.913,0.0,-0.2263,fear
565,734,elimmel wrote: Returned on 1 Feb but only tested on 7 Feb?,2/10/21,0.0,1.0,0.0,1.0,0.0,0.0,neutral
579,750,"snap99 wrote: The chances of people following the rules at Makan places is close to zero Hmm...since you mentioned that, they do makan during the flight as well, and that is the only time when the infectors are potentially unmasked, if you know what i mean.",2/10/21,-0.078125,0.696875,0.0,0.917,0.083,0.4404,anger
581,752,Is safe.,2/10/21,0.5,0.5,0.0,0.256,0.744,0.4404,neutral
590,761,"The airline industry and experts keep emphasizing/promoting that they have healthy airflow in the cabin, airflow that is introduced from the ceiling and sucked into inlets located at the side bottom panels.",2/10/21,0.5,0.5,0.084,0.84,0.076,-0.0772,joy
593,764,"This also means that even out in the open, the transmission risk is only reduced, and that's with universal masking.",2/10/21,0.0,0.5,0.1,0.9,0.0,-0.2732,joy
597,774,lala24 wrote: WHO v long ago is irrelevant.,2/10/21,-0.275,0.7,0.0,1.0,0.0,0.0,neutral
599,776,lol.,2/10/21,0.8,0.7,0.0,0.0,1.0,0.4215,fear
601,778,on paper they only contributed 20m.,2/10/21,0.0,1.0,0.0,1.0,0.0,0.0,neutral
602,779,whereas usa is easily 10 times the sum.,2/10/21,0.43333333333333335,0.8333333333333334,0.0,0.745,0.255,0.34,fear
604,781,funding them is Not as good as bribing them.,2/10/21,0.7,0.6000000000000001,0.231,0.769,0.0,-0.3412,anger
605,784,"your are wrong, US funds the most https://howmuch.net/articles/who-contribution",2/10/21,0.0,0.7,0.307,0.693,0.0,-0.4767,fear
610,789,"Bus MRT, so many people standing,sitting beside u for 20 to 30s mins.",2/9/21,0.5,0.5,0.0,1.0,0.0,0.0,anger
611,790,"Airport so dirty with so many foreigners virus keep coming here 2 days ago the case of the airport security tag wearer already clearly demonstrated that even with PPE (albeit the lowest level, surgical mask+gloves+face shield), you still can be infected even with very short interaction time with infected pax (wearing masks as well) at the airport.",2/9/21,1.0408340855860843e-17,0.5183333333333333,0.181,0.743,0.076,-0.796,joy
612,791,Just that it's gonna be rare.,2/9/21,0.3,0.9,0.0,1.0,0.0,0.0,anger
614,793,Temasek masks are ok.,2/9/21,0.5,0.5,0.0,0.577,0.423,0.296,neutral
615,794,But be wary of some of the DIY type / Shopee Lazada Taobao cloth masks that claim to be comfortable to wear and airy etc.,2/9/21,-0.04999999999999999,0.75,0.0,0.875,0.125,0.5106,anger
616,795,It needs to be 2 layers min and high thread count.,2/9/21,0.16,0.5399999999999999,0.0,1.0,0.0,0.0,neutral
