,index,Sentences,Comment Datetime,Textblob_polarity_score,Textblob_subjectivity_score,Vader_neg_score,Vader_neu_score,Vader_pos_score,Vader_compound_score,Emotions
6768,7853,"Dear PM Lee, Kindly look onto the report of contamination on news and video that leak.",29/1/20,0.6,0.9,0.113,0.613,0.274,0.5267,fear
6769,7854,"Even though Singapore is ready, but precaution is better than things happen.",29/1/20,0.35,0.5,0.0,0.641,0.359,0.6808,neutral
6773,7858,"Sir , if we were to wear mask only when sick , true in the street not many wearing .",28/1/20,-0.15357142857142858,0.7517857142857143,0.156,0.711,0.133,-0.128,fear
6779,7864,They will be travelling all over Singapore for various activities.,28/1/20,0.0,0.5,0.0,1.0,0.0,0.0,anger
6783,7868,I m glad that NCID Hospital in Tan Tock Seng was completed just in time to handle this situation.,28/1/20,0.5,1.0,0.0,0.842,0.158,0.4588,joy
6784,7869,This shows that Govt are well prepared and take Healthcare seriously and the situation are still in controlled.,28/1/20,-0.3333333333333333,0.6666666666666666,0.082,0.725,0.193,0.3182,joy
6788,7873,Its dangerous for kids to go school now.,29/1/20,-0.6,0.9,0.307,0.693,0.0,-0.4767,fear
6789,7874,"N it's hard for them to wear mask all the time esp during pe, recess time",29/1/20,-0.2916666666666667,0.5416666666666666,0.091,0.909,0.0,-0.1027,anger
6795,7880,"Dear PM Lee, I read with concern that the latest patient went to the hospital in a Taxi.",28/1/20,0.5,0.9,0.0,0.852,0.148,0.3818,fear
6796,7881,"I remember during SARS, they can only go to the hospital in an ambulance.",28/1/20,0.0,1.0,0.0,1.0,0.0,0.0,fear
6797,7882,Can you please remind everybody to please only go to the hospital in an ambulance  if they are a high risk individual and not go to the hospital in any form of public transport.,28/1/20,0.04,0.5016666666666667,0.057,0.817,0.125,0.3612,fear
6798,7883,"It is very unfair to the Taxi , grab driver.",28/1/20,-0.65,1.0,0.298,0.702,0.0,-0.5256,anger
6799,7884,Worse if they took bus or MRT.,28/1/20,-0.4,0.6,0.341,0.659,0.0,-0.4767,fear
6807,7894,I think the most important thing now is to remain calm and be socially responsible.,29/1/20,0.35000000000000003,0.7,0.0,0.622,0.378,0.6901,fear
6809,7896,"If the virus is so deadly, masks can't help either... just take care of yourself, a strong immune system will see you through this!",29/1/20,0.1708333333333333,0.5666666666666667,0.075,0.628,0.297,0.774,joy
6811,7898,"That way, we are more likely to stop the virus from spreading rapidly and gain a better understanding of the virus to develop vaccine treatment.",28/1/20,0.3333333333333333,0.6666666666666666,0.083,0.706,0.212,0.5908,joy
6814,7901,I believed many are trying to buy it.,28/1/20,0.5,0.5,0.0,1.0,0.0,0.0,neutral
6816,7903,It will bring some assurance to many.,28/1/20,0.5,0.5,0.0,0.714,0.286,0.34,joy
6822,7909,Singapore is a small City country and densely packed with many different countries of people working and living here.,30/1/20,0.08333333333333333,0.5,0.0,1.0,0.0,0.0,joy
6823,7910,We needed more stricter control of people coming into Singapore especially from the whole of China and must be put on strict Quarantine.,30/1/20,0.2333333333333333,0.6333333333333333,0.0,1.0,0.0,0.0,fear
6827,7914,These are all good hygiene practices be it this Wuhan virus or not.,30/1/20,0.7,0.6000000000000001,0.0,0.805,0.195,0.4404,neutral
6828,7915,Keep everybody safe and hope that this will end soon with everyone doing their part.,30/1/20,0.5,0.5,0.0,0.691,0.309,0.7003,anger
6829,7916,"Stay safe, we will prevail.",30/1/20,0.5,0.5,0.0,0.58,0.42,0.4404,neutral
6830,7917,"Dear PM Lee, I wondered why government don't want to encourge people who live in Singapore wear masks?",29/1/20,0.13636363636363635,0.5,0.065,0.797,0.138,0.3352,anger
6832,7919,It's really really dangerous to our kids.,29/1/20,-0.6,0.9,0.38,0.62,0.0,-0.5678,anger
6845,7932,"If government is sincerely looking to resolve and prevent spreading in the community, and since we have ample stocks (or do u intend to keep the masks to grow mould ?)",28/1/20,0.5,0.5,0.0,0.799,0.201,0.7003,fear
6849,7936,We have no idea who were so lucky to have catch their virus.,28/1/20,0.3333333333333333,0.8333333333333334,0.131,0.654,0.215,0.3434,anger
6851,7938,"We should be looking to keep it out, and not welcome it by saying that we are prepared to receive it.",28/1/20,-0.4,0.9,0.106,0.813,0.081,-0.1481,anger
6855,7942,"I saw unity staff keeping musk for themselves.. what control have put in place .. you want me to be calm, can sell me the musk immediately",28/1/20,0.30000000000000004,0.75,0.0,0.87,0.13,0.3818,anger
6857,7944,Will the country still be as strong ?,29/1/20,0.4333333333333333,0.7333333333333333,0.0,0.645,0.355,0.5106,neutral
6858,7945,So no family no country ..we need to place our family life as utmost importance now..life is at stake .. so please with our earnest appeal..which only you and your cabinet could decide the fate of singapore!!,29/1/20,0.0,1.0,0.108,0.69,0.202,0.6585,joy
6861,7949,Demand is over supply and there are selfish people that are selling at unreasonable price on Carosell.,28/1/20,-0.5,1.0,0.235,0.765,0.0,-0.5574,fear
6865,7953,This carrier would then be able to enter SG.,28/1/20,0.5,0.625,0.0,1.0,0.0,0.0,joy
6867,7955,Don't be 1 step behind AGAIN.,28/1/20,-0.4,0.7,0.0,1.0,0.0,0.0,neutral
6869,7957,Wash hands and dont glad hand (shake hands) during meetings.,28/1/20,0.5,1.0,0.0,0.563,0.437,0.7351,neutral
6870,7958,Its not rude to just say hello.,28/1/20,0.15,0.6,0.0,0.708,0.292,0.357,neutral
6874,7962,Good luck everyone.,28/1/20,0.7,0.6000000000000001,0.0,0.145,0.855,0.7096,neutral
6876,7964,Got to act fast as these are places where people all squeeze together.,28/1/20,0.2,0.6,0.0,1.0,0.0,0.0,anger
6877,7965,It is common sight to see people coughing or sneezing using their hands and then holding on to the railing on board MRT or Bus.,28/1/20,-0.3,0.5,0.0,1.0,0.0,0.0,neutral
6878,7966,"Ideally, those who are sick should be wearing a mask.",28/1/20,0.09285714285714286,0.9285714285714286,0.252,0.534,0.214,-0.128,anger
6879,7967,"But the reality is, most of them do not wear and do not even cover their mouths when they sneeze or cough.",28/1/20,0.5,0.5,0.0,1.0,0.0,0.0,fear
6880,7968,Thats why people who are not sick wear masks instead.,28/1/20,0.35714285714285715,0.8571428571428571,0.0,0.769,0.231,0.4023,anger
6882,7970,Im wondering where we can buy especially for my kids.,28/1/20,0.0,1.0,0.0,1.0,0.0,0.0,neutral
6887,7975,KIndly correct  your  ministers  for  their  baseless  remarks  where  this  is  concerned.,28/1/20,0.6,0.9,0.0,0.775,0.225,0.4939,fear
6891,7979,They  are  so  many  and  its  important  to  trace  who  are  the  ones  from  Hubei  (not  just  recent)  and  to  follow  through.,28/1/20,0.3,0.5833333333333334,0.0,0.921,0.079,0.2023,neutral
6893,7981,"Since you all dont take mrt trains and buses, you dont understand that there are many coughing and sneezing in the carriages without covering their mouths or wearing a mask.",28/1/20,0.5,0.5,0.0,1.0,0.0,0.0,fear
6895,7983,"So the advice that there is no need to wear a mask if generally well, is not the right advice because we may be well but there  are  others who have no qualms spreading their germs.",28/1/20,0.16785714285714287,0.5178571428571428,0.114,0.805,0.081,-0.3182,anger
6897,7985,1) I think all parents agree that extend the school holidays that important to stop the spread  2) quarantine is let the one who at home their family not quarantine the family can spread.,28/1/20,0.4,1.0,0.057,0.722,0.222,0.6597,fear
6901,7989,Symptoms will only show after two weeks.,28/1/20,0.0,1.0,0.0,1.0,0.0,0.0,joy
6902,7990,Now is just waiting for things to happen only.,28/1/20,0.0,1.0,0.0,1.0,0.0,0.0,neutral
6906,7994,The more you let them travel around SG the higher the chance for more people to be affected.,28/1/20,0.4166666666666667,0.5,0.082,0.816,0.102,0.1027,joy
6914,8002,"Whatever it is , the saying goes Haters gonna hate , irrelevant of anything & unfortunately and regretfully , this matter had provided the best and legit platform for these people to be out in full force .",28/1/20,-0.09000000000000001,0.75,0.134,0.732,0.134,0.0065,fear
6916,8004,"Believe in everyone , everything more positively  even if u may  hate the government to the last piece of your bone and we shall prevail.",28/1/20,-0.018181818181818188,0.503030303030303,0.13,0.74,0.13,-0.0018,fear
6917,8005,Keep going & go around doing things right PM Lee & team .,28/1/20,0.2857142857142857,0.5357142857142857,0.0,1.0,0.0,0.0,neutral
6918,8006,#Live politics out .,28/1/20,0.13636363636363635,0.5,0.0,1.0,0.0,0.0,fear
6919,8007,#Spread beliefs not hate,28/1/20,0.4,0.9,0.0,0.5,0.5,0.4585,fear
6921,8009,"For those who are ill and visit the clinics , masks should be part of the prescription if they arent wearing one when consulting the dr.",29/1/20,-0.5,1.0,0.104,0.896,0.0,-0.4215,fear
6924,8012,It is not fair to say there is no need to wear a mask if you are not ill.,29/1/20,-0.04999999999999999,0.95,0.206,0.794,0.0,-0.4874,fear
6927,8015,You are also being socially responsible for others by doing so during this outbreak.,29/1/20,0.2,0.55,0.0,0.85,0.15,0.3182,anger
6928,8016,"Also, how should one define ill to determine to wear a face mask or not?",29/1/20,-0.5,1.0,0.0,1.0,0.0,0.0,fear
6932,8022,"When not well, they then went to the various clinics in shopping mall.",28/1/20,0.0,0.5,0.131,0.869,0.0,-0.2057,anger
6939,8032,"Good to have stringent enforcement but people will still make noise,I cant do this,do that",29/1/20,0.7,0.6000000000000001,0.0,0.878,0.122,0.2382,anger
6942,8035,"To minimise this risk, can I propose having a hotline (in different languages) for individuals suspected of being contracted with the virus to call in.",28/1/20,0.0,0.6,0.169,0.831,0.0,-0.5065,joy
6948,8041,Maybe all these tourists/residents/travellers/workers should be 1st sent to all the ministers' home meet with the ministers' and their family members and only then should they be allowed to roam the city.,29/1/20,0.0,1.0,0.0,1.0,0.0,0.0,anger
6949,8042,We will be more confident with the government's words that way..,29/1/20,0.5,0.6666666666666667,0.0,0.741,0.259,0.5413,anger
6951,8044,"Stay healthy, maintain a well balanced diet and hydration by drinking more water, Vit C , fresh fruits and vegetables.",28/1/20,0.43333333333333335,0.5,0.0,0.655,0.345,0.7479,joy
6952,8045,"Not well got fever especially please see doctor, wear mask and rest well at home.",28/1/20,0.0,1.0,0.199,0.659,0.142,-0.009,fear
6953,8046,"Keep cool, do not panic.",28/1/20,0.35,0.65,0.0,0.375,0.625,0.6126,neutral
6955,8048,"One of the most important message was already proven wrong, there was community spread when the above message was written, can the government be a lot more responsible in public communication!",29/1/20,0.15714285714285717,0.5166666666666667,0.088,0.77,0.142,0.2211,fear
6958,8051,Every life is precious to the family concerned!,29/1/20,0.625,1.0,0.0,0.637,0.363,0.6114,fear
6963,8057,Give the masks to pp who need them more... pp who are not well and weak.,28/1/20,0.0625,0.5625,0.1,0.768,0.132,0.1511,neutral
6965,8060,Take more healthy food.,28/1/20,0.5,0.5,0.0,0.501,0.499,0.4576,joy
6966,8061,Take fruits and vegetables rich in vitamin-c to strengthen your body and immune system.,28/1/20,0.375,0.75,0.0,0.576,0.424,0.7964,fear
6967,8062,Prevention is always better than cure.,28/1/20,0.5,0.5,0.0,0.633,0.367,0.4404,neutral
6968,8063,"Sir, not only Mask went out of stock, Sanitizer as well!",28/1/20,0.0,1.0,0.0,0.807,0.193,0.3382,anger
6969,8064,Question here is are they really selling like hot cake out of anxiety?,28/1/20,0.225,0.525,0.11,0.711,0.179,0.2682,joy
6972,8067,Many are rushing to buy mask and we need to avoid paranoid.,29/1/20,0.5,0.5,0.296,0.704,0.0,-0.4939,neutral
6975,8070,How sure are we in telling people that there is no need to wear a mask if you are not ill?,29/1/20,0.375,0.9444444444444444,0.098,0.8,0.102,0.0258,fear
6980,8075,I always believe prevention is better than cure.,29/1/20,0.5,0.5,0.0,0.674,0.326,0.4404,neutral
6996,8091,"As much as we would like to be socially responsible, it is impossible to do so if we cant even get masks.",29/1/20,-0.08888888888888886,0.5833333333333334,0.0,0.806,0.194,0.5859,fear
6998,8093,This is the perfect timing to encourge everyone to go cashless..not only for convinence but also to safe guard against the spread of the virus through a medium like currency.,28/1/20,0.5,0.8333333333333334,0.0,0.733,0.267,0.8573,joy
6999,8094,Just like this is a great opportunity to transform the business..it is also a great chance to induce a change in habits.,28/1/20,0.8,0.75,0.0,0.475,0.525,0.9382,joy
7003,8099,"Seems like they keep saying theres enough masks means they do have tons of stocks kept for maybe ""grave situations"".",29/1/20,0.0,0.5,0.113,0.779,0.108,-0.0258,neutral
7009,8105,You wear a mask only when you're unwell?,29/1/20,0.0,1.0,0.0,1.0,0.0,0.0,anger
7012,8108,"Irresponsible aside, theres also those who dont see the seriousness in this, the older generation especially.",29/1/20,0.08333333333333333,0.6666666666666666,0.161,0.776,0.064,-0.4122,fear
7013,8109,Pretty sure they will only start wearing if the government tells them to and emphasize the severity of the situation.,29/1/20,0.25,0.9629629629629629,0.0,0.766,0.234,0.6705,anger
7015,8111,"If you want to convince us that its not a severe case yet for us all to be wearing mask, then show us some scientific proof that we're safe without doing so.",29/1/20,0.5,0.5,0.0,0.763,0.237,0.7494,anger
7018,8114,"If citizens co-operate with govt, i think they all should be safe",13/2/20,0.5,0.5,0.0,0.775,0.225,0.4404,fear
7021,8117,I hope my little contribution here will help to protect the people living in Spore.,29/1/20,-0.1875,0.5,0.0,0.573,0.427,0.802,fear
7028,8124,"Not only Hubei, other provinces also have people contacted..those people are trying ways to get through the inspections, sure cannot detect.",28/1/20,0.125,0.7546296296296297,0.0,0.897,0.103,0.3182,fear
7030,8126,"We are not against them, but we are trying protect ourselves, our own people in SG..Also, even though no SG people got it, but who can guarantee will not happen?",28/1/20,0.6,1.0,0.078,0.756,0.165,0.4767,anger
7032,8128,"no matter how much precaution we take, there is sure a chance to get it, so long people from China keep flying into SG...lastly, our elderly and children are.the most prone to contact such virus..  *Once again, this is nothing against China people, but just that we need to really protect our beloved ones...",28/1/20,0.2928571428571428,0.526984126984127,0.026,0.764,0.21,0.883,neutral
7034,8130,"Some infected does not even know themselves.. please don't wait until you are sick and then you wear a mask, that will be too late!",31/1/20,-0.5446428571428572,0.7285714285714285,0.226,0.698,0.076,-0.6696,neutral
7036,8132,I don't think is enough.,30/1/20,0.0,0.5,0.0,1.0,0.0,0.0,neutral
7038,8134,Why government always don't see far only see near,30/1/20,0.06666666666666667,0.7999999999999999,0.0,1.0,0.0,0.0,neutral
7039,8135,"Dear Pm Lee, Since our border control has the records of those from Wuhan, would it be better for authorities to be pro active by tracing them to the place where they reside and take the necessary actions.",29/1/20,0.12222222222222223,0.7000000000000001,0.0,0.81,0.19,0.802,anger
7042,8138,So is it possible that school children also learn from home via e-learning?,28/1/20,0.0,1.0,0.0,1.0,0.0,0.0,neutral
7044,8140,I dont understand why the government and ministers kept telling those not sick dont need mask.,29/1/20,0.35714285714285715,0.8571428571428571,0.0,0.838,0.162,0.4023,anger
7045,8141,This statement is very wrong for this Wuhan Virus as it spreads before it shows symptoms.,29/1/20,-0.65,1.0,0.184,0.816,0.0,-0.5256,anger
7054,8150,I have a question - the instruction to students and teaching staff that has returned from China to be on 2 weeks of absence - please advise how that will prevent the possible  spread of the virus - does it mean that the family members of these people are also not allowed out -remain indoors at all times ( defacto quarantine ?,28/1/20,-0.10833333333333334,0.5625,0.0,0.939,0.061,0.34,joy
7059,8156,I even stay on with the project till end n make sure we r safe.,29/1/20,0.5,0.6944444444444444,0.0,0.658,0.342,0.6369,joy
7060,8157,Due to this unforseen circumstances it teaches us to be more wary n im glad im a qualified first aider n AED medic which mean im ready to serve my country for any disaster n viruses that penetrate in our zone n do my deed for my fellow citizen n stop being paranoid.,29/1/20,0.0732142857142857,0.5851190476190476,0.148,0.749,0.103,-0.3687,fear
7061,8158,It takes all to do their resposibility not to totally hopeless n depend on the leader alone to solve the problem.,29/1/20,0.0,0.75,0.187,0.635,0.178,-0.0524,anger
7063,8160,"i know teacher and school has been monitoring, guiding, emphasizing on hygiene, but there are so many kids, it is hard to ensure all kids follow what teacher says and small kids watch Dr binoc on youtube and know what virus is but at their age, they won't understand what it mean by death from virus, they won't understand what is death.",30/1/20,-0.08854166666666667,0.5322916666666666,0.169,0.784,0.047,-0.872,neutral
7066,8163,it will be too late..,30/1/20,-0.3,0.6,0.0,1.0,0.0,0.0,neutral
7068,8165,A very good evening to you!PM Lee N everybody at Parliament Just a simple feedback to all of you Currently i am working at Oasis Terrace.i was just purchading a  bottle of handwash liquid at the ntuc located there .i was really shocked n stunned at the long queues there bcos of this Wuhan Virus issue.,28/1/20,0.031999999999999994,0.5474285714285714,0.083,0.858,0.058,-0.0952,anger
7069,8166,I noticed a a lot ot rather chaotic confusion among the customers who were in the queue bcos  at times we also were confused who was next in the queue bcos everybody just queued up.for myself personally i ever worked at Cold Storage before there is an express counter 4 customers w a limit of maximum 4 items or lesser.this way will save up a lot of time for many customers especially at a moment like this.besides i was surprised even the ntuc staff were not aware of the quantity restriction stated by every mart A purchase of 2 items Supposing sanitary snti bacteria wet wipes.i met w this issue last week.the pt rimers were not aware of this matter.certain customers did not know either.it is a kind of miscommunication btween staffs,28/1/20,-0.012500000000000002,0.5222222222222223,0.077,0.862,0.062,-0.235,anger
7074,8171,"Its the Gov resp to ensure there are enough mask for sale , not by giving us 4 and telling is job is done",28/1/20,0.0,0.5,0.083,0.812,0.106,0.1441,anger
7076,8173,I do get more assurance when its coming from you.,28/1/20,0.5,0.5,0.0,0.748,0.252,0.4005,neutral
7080,8177,There's so much more also like coming home changing into fresh clothes when being at home.,31/1/20,0.4,0.5,0.0,0.734,0.266,0.6222,joy
7082,8179,"Oh and clean shoes more often too as in Singapore lots of bear feet walking on floors in residences,  temples .",31/1/20,0.43333333333333335,0.6000000000000001,0.0,0.876,0.124,0.4019,fear
7084,8182,All that i said is so done in Singapore anyhow sparkling clean !,31/1/20,0.45833333333333337,0.7000000000000001,0.0,0.634,0.366,0.636,anger
7085,8183,# calmly it's Singaporean way.,31/1/20,0.30000000000000004,0.75,0.0,0.566,0.434,0.3182,neutral
7087,8185,Nice to know many Singaporean are understanding and from the comments posted here .. Can see all are serious and concern about fellow Singaporean.. happy to see no nonsense  or negative comments too.. well done ..,28/1/20,0.25333333333333335,0.7133333333333333,0.208,0.611,0.181,-0.0772,joy
7089,8187,"There are many cases on other parts of China too , especially Beijing and Shanghai .",28/1/20,0.125,0.625,0.0,1.0,0.0,0.0,neutral
7090,8188,These 2 cities are not locked down and the China government most likely will not lock down these 2 cities .,28/1/20,0.047222222222222214,0.5194444444444445,0.0,1.0,0.0,0.0,anger
7095,8193,We need to act fast .,28/1/20,0.2,0.6,0.0,1.0,0.0,0.0,neutral
7105,8204,Especially if there is any elderly person or very young kids take more care in this hygiene area.one good way if possible is to go for the vaccination for flu  vaccine.it might be a good way of immunisation whereby the chances of getting flu easily will be much reduced,28/1/20,0.33291666666666675,0.6566666666666667,0.087,0.687,0.226,0.807,fear
7109,8208,We can only wait and hope there isn't any further people who contract the virus.,29/1/20,0.0,0.75,0.0,0.828,0.172,0.4404,neutral
7116,8215,Any spread will be very fast and lethal.,28/1/20,0.26,0.78,0.0,1.0,0.0,0.0,fear
7117,8216,Is this fake news from a mainstream news channel?,28/1/20,-0.5,1.0,0.307,0.693,0.0,-0.4767,fear
7119,8218,"Mr Lee , i am greatly disturbed and  appalled after listening to the closed door conversation of CCS with those trade leaders.",28/1/20,-0.03333333333333333,0.6166666666666667,0.255,0.745,0.0,-0.7316,fear
7120,8219,We know your addressed the general  masses as 'fellow Singaporeans' but CCS called us idiots.,28/1/20,-0.375,0.65,0.0,1.0,0.0,0.0,anger
7122,8221,He further reiterated the reason/rational of telling Singaporeans to wear a mask only if you are sick it seems there is a hidden agenda; there is not enough masks to go around as opposed to other MP saying there is ample in the stockpile.,28/1/20,-0.16765873015873015,0.5942460317460317,0.074,0.926,0.0,-0.5106,fear
7125,8224,"So far, we have not heard you as a Head of the country coming out to clarify his behaviour.",28/1/20,0.1,1.0,0.0,1.0,0.0,0.0,neutral
7126,8225,"I am utterly dismay at his command of the English language, it sets me wondering what has happened to our bilingualism policy.",28/1/20,0.0,0.5,0.134,0.866,0.0,-0.4754,fear
7132,8232,your 4g leader too naive.,28/1/20,-0.3,1.0,0.344,0.656,0.0,-0.2732,neutral
7133,8233,"you must use your father iron fist to tackle with China people, don't be so nice to China patient.",28/1/20,0.6,1.0,0.0,0.833,0.167,0.5598,neutral
7139,8239,Many foreigners and Singaporeans will be attending this event together.,28/1/20,0.5,0.5,0.0,1.0,0.0,0.0,anger
7140,8240,As many report show that the symptoms of coronavirus may not surface as fever.,28/1/20,0.5,0.5,0.0,1.0,0.0,0.0,fear
7145,8245,"You, your leaders and many are working very hard to help manage and contain the situation.",28/1/20,0.060416666666666646,0.6020833333333333,0.091,0.75,0.159,0.3117,anger
7149,8249,So why did we still allow them to enter Singapore and freely move about.,28/1/20,0.4,0.8,0.0,0.714,0.286,0.5859,anger
7152,8252,"As a result, SG though a very small country is now ranked top 3 behind China and Thailand.",28/1/20,-0.07500000000000001,0.5733333333333334,0.0,0.886,0.114,0.2023,joy
7153,8253,Can we act fast and step up more effective measures before it is too late.,28/1/20,0.24999999999999994,0.625,0.0,0.805,0.195,0.5256,neutral
7155,8255,We got to stop people from the high risk Country ( and not just Wuhan city) from coming into our land .,28/1/20,0.16,0.5399999999999999,0.193,0.807,0.0,-0.5106,fear
7157,8257,The schools and companies are already stepping up measures and asking those who have been to China or been in close contact with such ;  to stay away from their premises .,28/1/20,0.0,0.5,0.0,1.0,0.0,0.0,anger
7158,8258,But their efforts alone are not going to be enough.,28/1/20,0.0,0.5,0.182,0.818,0.0,-0.25,fear
7164,8264,Respectfully yours ....,28/1/20,0.5,0.7,0.0,0.426,0.574,0.4019,neutral
7166,8266,to shut out all China PRC from entering Singapore temporary and not just on wuhan PRC only since at the meantime all infected are China PRC and to quarantine immediately 14days for those Singapore travelling back from China.,28/1/20,0.0,0.5,0.08,0.92,0.0,-0.4939,fear
7168,8268,"Don't wait till the viruses start infecting the community, it may be too late.",28/1/20,-0.3,0.6,0.0,1.0,0.0,0.0,fear
7169,8269,That's not enough because the virus has already spread beyond residents of Hubei province to people in major cities in China like Beijing and Shanghai.,28/1/20,0.03125,0.5,0.0,0.906,0.094,0.3612,anger
7180,8280,"I have been going around day and night to look for blue surgical masks, even happy if I could get 10, yet there is none.",28/1/20,0.4,0.55,0.0,0.856,0.144,0.5719,joy
7183,8283,"OK, so now we have a precious commodity of 4.",28/1/20,0.5,0.75,0.0,0.513,0.487,0.7672,neutral
7184,8284,Time to salute the govt :D Sure healthy ones- dont need to wear a mask.,28/1/20,0.6666666666666666,0.7962962962962963,0.0,0.549,0.451,0.8415,fear
7190,8290,Also saw alot of China people arriving in the airport and many are not wearing masks.,28/1/20,0.5,0.5,0.0,1.0,0.0,0.0,fear
7193,8293,So this is now finally officially declared urgent case.,28/1/20,0.0,1.0,0.0,0.816,0.184,0.2023,joy
7197,8297,"Cleanliness and strict hygiene helps but the  critical point is still, I   think would be that of a temporary ban of travellers from China.",28/1/20,0.0,0.8,0.274,0.663,0.063,-0.7935,fear
7207,8307,We believe prevention is better than cure and sometimes it is good to be a bit kiasu.,28/1/20,0.6,0.55,0.0,0.707,0.293,0.7003,neutral
7211,8311,"For those parents who are comfortable to let their children to go to school tomorrow, they can go ahead to do so.",28/1/20,0.4,0.8,0.0,0.864,0.136,0.5106,joy
7213,8313,"Of course, it will be even better if MOE can announce closing of schools for 14 days.",28/1/20,0.5,0.5,0.0,0.847,0.153,0.4404,neutral
7215,8315,I seriously and sincerely hope you can consider and approve our requests.,28/1/20,0.08333333333333334,0.5833333333333333,0.108,0.51,0.382,0.6486,joy
7216,8317,Pls encourage more companies to allow their employees work from home,30/1/20,0.5,0.5,0.0,0.542,0.458,0.6969,anger
