,index,Sentences,Comment Datetime,Textblob_polarity_score,Textblob_subjectivity_score,Vader_neg_score,Vader_neu_score,Vader_pos_score,Vader_compound_score,Emotions
1871,2675,Now China has opened up their production and many millions of mask is produced everyday.,15/4/20,0.15,0.55,0.0,1.0,0.0,0.0,neutral
1876,2680,Some were also given gentle warnings when they were out but no fines.,15/4/20,0.2,0.8,0.269,0.612,0.119,-0.3506,anger
1877,2681,"When I went to buy dinner for my family, I saw a handful of them not wearing masks and I hardly see any police officers around in the evening time.",15/4/20,-0.2916666666666667,0.5416666666666666,0.0,1.0,0.0,0.0,fear
1880,2684,Anyone pass by them could easily caught the virus.,14/4/20,0.43333333333333335,0.8333333333333334,0.0,0.769,0.231,0.34,fear
1883,2687,This is worst than people doing exercise.,15/4/20,-1.0,1.0,0.406,0.594,0.0,-0.6249,anger
1890,2694,One behind another.,15/4/20,-0.4,0.7,0.0,1.0,0.0,0.0,fear
1892,2696,Is d control measures getting more stricter or what?,15/4/20,0.5,0.5,0.0,1.0,0.0,0.0,fear
1894,2698,Every wrong decision cost lives.,14/4/20,-0.5,0.9,0.437,0.563,0.0,-0.4767,anger
1895,2699,Be wise.,14/4/20,0.7,0.9,0.0,0.244,0.756,0.4767,anger
1897,2701,There are so many exercises to do indoors.,14/4/20,0.5,0.5,0.0,1.0,0.0,0.0,neutral
1902,2706,"For the love of your family and your own life, stay home.",14/4/20,0.55,0.8,0.0,0.724,0.276,0.6369,joy
1904,2708,"If it is so, ones life is meaningless.",14/4/20,-0.5,1.0,0.293,0.707,0.0,-0.4404,fear
1905,2709,Do read the excellent article Joyce Tan shared.,14/4/20,1.0,1.0,0.0,0.496,0.504,0.7269,joy
1907,2711,The government took a gamble asking Singapore residents to wear mask only when one is sick.,15/4/20,-0.35714285714285715,0.9285714285714286,0.191,0.809,0.0,-0.5106,fear
1909,2713,It cost one approximately $30 a month to wear mask everyday.,15/4/20,-0.30000000000000004,0.6,0.0,1.0,0.0,0.0,neutral
1911,2715,Many lost over hundreds or thousands of dollars per month of their income.,15/4/20,0.5,0.5,0.161,0.839,0.0,-0.3182,anger
1916,2720,"Today, it cost $300 fine.",15/4/20,0.4166666666666667,0.5,0.0,0.69,0.31,0.2023,neutral
1918,2722,Those who  did not get this news update will be slap with $300 fine.,15/4/20,0.4166666666666667,0.5,0.0,0.779,0.221,0.34,anger
1919,2723,I hope the government can reflect and do better when they make policy changes.,15/4/20,0.5,0.5,0.0,0.655,0.345,0.7003,neutral
1926,2730,Can you identify that those exemptions are 100% free from the virus or not carriers?,18/4/20,0.4,0.8,0.0,0.809,0.191,0.5106,neutral
1927,2731,If not the more stringent measures that you say will be futile.,18/4/20,0.5,0.5,0.209,0.791,0.0,-0.4404,fear
1931,2735,Don't get me wrong.,18/4/20,-0.5,0.9,0.0,0.54,0.46,0.3724,fear
1932,2736,The measures are good long awaited for.,18/4/20,0.32499999999999996,0.5,0.122,0.556,0.322,0.4215,neutral
1933,2737,Better late than never.,18/4/20,0.1,0.55,0.0,0.508,0.492,0.4404,neutral
1935,2739,"These exemptions actively breaths, pant.",18/4/20,-0.13333333333333333,0.6,0.0,0.635,0.365,0.3182,neutral
1944,2748,Good job!,15/4/20,0.875,0.6000000000000001,0.0,0.239,0.761,0.4926,neutral
1945,2749,Especially on the revoking passes/ PR status on foreigners.,15/4/20,0.0,1.0,0.0,1.0,0.0,0.0,anger
1946,2750,"Seems like westerner do not believe on wearing mask, saw so many of them in the park/ roadside playing with young children and in cold storage without mask.",15/4/20,0.0,0.6333333333333333,0.0,0.858,0.142,0.5106,joy
1950,2754,"If u want your love one to be at risk of being infected , then go out n exercise without mask.",17/4/20,0.5,0.6,0.214,0.565,0.222,0.0516,fear
1952,2756,As easy as that .,17/4/20,0.43333333333333335,0.8333333333333334,0.0,0.508,0.492,0.4404,anger
1971,2776,This is ridiculous Loh.. delivery guys who cycle to deliver - they have to wear masks Cycling under the hot sun.,17/4/20,-0.04166666666666666,0.925,0.116,0.884,0.0,-0.3612,anger
1982,2787,Stop your crap and tighten the rules please!,17/4/20,-1.0,0.8,0.411,0.403,0.186,-0.4199,anger
1986,2791,We walk to take fresh air in for inhale and exhale breathing.,17/4/20,0.3,0.5,0.0,0.827,0.173,0.3182,fear
1987,2792,Esp those who walk alone and walk after 8pm where paths are empty.,17/4/20,-0.1,0.5,0.257,0.743,0.0,-0.4215,neutral
1988,2793,Those delivery boys cycling under hot air using mask.,17/4/20,0.25,0.8500000000000001,0.0,1.0,0.0,0.0,neutral
1993,2798,Common sense we need to breath fresh air.,17/4/20,0.0,0.5,0.0,0.753,0.247,0.3182,neutral
1995,2801,Guys I find that some of you are right !,24/4/20,0.3571428571428571,0.5357142857142857,0.0,1.0,0.0,0.0,joy
1996,2802,Especially for those who  dont exercise when you run you run and you have sweat on your body [ and dont use exercise as an excuse to do some leisure sight seeing of the whole city ] I most of the time make sure that my mask is attached to my Chin and put it on up to my nose when I know there group of runners come by... and then I open again..,24/4/20,0.19166666666666665,0.5564814814814815,0.0,0.949,0.051,0.3818,fear
1998,2804,For some of us exercise is key to being healthy.,24/4/20,0.25,0.75,0.0,0.769,0.231,0.4019,joy
1999,2805,Some of us have problems with some of member of the house but cant afford to get another housing for example they do need some space ... [ we never know ]   So please dont judge others and be kind coz every house members fighting their own war ..,24/4/20,0.6,0.95,0.221,0.702,0.077,-0.8233,anger
2000,2806,I hope everyone can be kind to each other ..,24/4/20,0.2375,0.6375,0.0,0.526,0.474,0.743,joy
2002,2808,I appreciate your comments who can understand that some of us really need fresh air ... but also make sure to bring distance with others ...,24/4/20,0.3333333333333333,0.5296296296296296,0.0,0.77,0.23,0.6797,joy
2006,2812,So unhygienic and the birds do not know wear it and fly around then spread again.,17/4/20,0.8,0.9,0.0,1.0,0.0,0.0,fear
2009,2816,The only place i could find mask is Mustafa and guess where it is from... How can I find out if this one is approved and safe to use?,28/1/20,0.25,0.75,0.0,0.814,0.186,0.6908,neutral
2019,2826,Obviously not everyone is considerate to wear mask when they're sick.,28/1/20,-0.35714285714285715,0.6785714285714286,0.388,0.612,0.0,-0.6914,anger
2021,2828,So basically no1 knows whether you're really safe or not.,28/1/20,0.5,0.5,0.0,0.738,0.262,0.4927,neutral
2030,2837,Must reserve the condoms for those who are alreasy suspected to have AIDS or those who show signs of pregnancy...... isnt it too late?,31/1/20,-0.3,0.6,0.076,0.924,0.0,-0.2263,fear
2034,2842,Were they all sick beforehand?,31/1/20,-0.7142857142857143,0.8571428571428571,0.452,0.548,0.0,-0.5106,neutral
2035,2843,Did they know they were even sick?,31/1/20,-0.7142857142857143,0.8571428571428571,0.355,0.645,0.0,-0.5106,neutral
2036,2844,Wearing a mask would not only protect a person but subconsciously they would not touch their face as much.,31/1/20,0.06666666666666667,0.5833333333333334,0.09,0.91,0.0,-0.1511,fear
2040,2848,Sick people are then healthy people but then they got infected.,10/2/2020,-0.10714285714285715,0.6785714285714286,0.396,0.491,0.113,-0.6808,neutral
2043,2851,"It means, they need more proof.",10/2/2020,0.5,0.5,0.0,1.0,0.0,0.0,neutral
2050,2858,"To each his own... but my take.. in this situation, we must  1) remain calm, United and kind (look out and help one another) 2) aware that masks are limited, prioritise who can use it... esp those in the frontlines and those who are sick 3) lets take precautions, stay healthy, happy, aware (wash hands, eat healthy food, stay away from live animals)   4) continue to have faith, trust and be positive  Again... to each his own... but this is mine   We can overcome this",1/2/2020,0.30599400599400595,0.6304195804195805,0.056,0.613,0.331,0.9884,joy
2052,2860,"If people are well, dont need to wear, if tio spread, too late.",31/1/20,-0.3,0.6,0.0,0.851,0.149,0.2732,fear
2055,2864,If tio too late.,31/1/20,-0.3,0.6,0.0,1.0,0.0,0.0,neutral
2062,2871,We are smart enough to avoid crowded places .,31/1/20,0.10714285714285714,0.5714285714285714,0.202,0.55,0.248,0.128,fear
2069,2878,These are more important questions than just asking when we can get free mask.,31/1/20,0.43333333333333335,0.7666666666666666,0.0,0.69,0.31,0.659,fear
2071,2880,"Think of the sick, the disabled, the old and those who live far from your distrbution centres and those that do not have any mode of transportation.",31/1/20,-0.11558441558441561,0.5714285714285714,0.113,0.887,0.0,-0.5106,fear
2077,2886,I think it is fair enough to inform people that there will be no gatherings and picnic in the park/on the greens.,17/4/20,0.35,0.7,0.094,0.809,0.098,0.0258,fear
2081,2890,"Unlike runners, this period of time, most smokers just stand at smoking point to smoke.",17/4/20,0.5,0.5,0.0,1.0,0.0,0.0,anger
2095,2908,"If so, please do not ever, ever implement such potentially fatal policy again and by using WHO advice as an excuse!",6/4/2020,-0.020833333333333332,0.5166666666666667,0.136,0.701,0.163,-0.2261,anger
2099,2913,They have to deal with alot of people everyday.,4/4/2020,-0.2,0.6,0.0,1.0,0.0,0.0,fear
2104,2918,"The item we receive from TPY is just a normal cover and which after testing, its not even water or droplets - proof, I wonder what happen when someone sneeze in the air and how will this face cover prevent us from breathing in the virus .",5/4/2020,0.15,0.6499999999999999,0.0,0.974,0.026,0.0258,fear
2105,2919,"I will not throw this away, since you guys take such a effort to source them, I will probably keep it in my drawer or use it to wipe some dust off the shelves",5/4/2020,0.0,0.5,0.0,1.0,0.0,0.0,anger
2111,2925,"Therefore, my husband and I bought our own reusable mask from another local manufacturer that provides quality and comfort reusable masks that is tested to be good for 100 washes.",12/6/2020,0.4333333333333333,0.5333333333333333,0.0,0.833,0.167,0.6597,joy
2114,2928,"Also, maybe it is more prudent to only provide for those who are struggling to make ends meet, but need to go out to work and will need the reusable masks more than me or a good percentage of Singaporeans and PRs.",12/6/2020,0.425,0.65,0.042,0.872,0.086,0.4497,fear
2120,2934,If the top don't wear mask to hospital the world were follow.,31/1/20,0.5,0.5,0.0,0.859,0.141,0.2023,fear
2121,2935,Please learn how to fly kite.,31/1/20,0.8,0.9,0.0,0.685,0.315,0.3182,neutral
2125,2939,Stop saying people shouldnt wear mask because it may make things worse due to bad hygiene habits!!,1/2/2020,-0.5083333333333333,0.5472222222222222,0.401,0.599,0.0,-0.855,anger
2126,2940,Manipulate peoples fear is not the right thing to do as a governor.,1/2/2020,0.2857142857142857,0.5357142857142857,0.225,0.775,0.0,-0.4939,fear
2129,2943,Wearing it only when you feel sick is too late.,1/2/2020,-0.33809523809523806,0.8190476190476191,0.268,0.732,0.0,-0.5106,neutral
2134,2948,"Pls wake up and stop your dream la, that why he can said so loudly, and for ppls in the frontline serving customers in retail or food industry dun need to wear mask?",31/1/20,0.1,0.8,0.062,0.845,0.093,0.0258,fear
2135,2949,If this ppls got the virus because of your word as he kept mentioning the expert said not necessarily to wear.. Do you want to respond for your word?,31/1/20,0.0,1.0,0.0,0.956,0.044,0.0772,anger
2138,2952,So are they using it Wisely???,31/1/20,0.7,0.9,0.0,0.6,0.4,0.5171,neutral
2139,2953,Or are they sick?,31/1/20,-0.7142857142857143,0.8571428571428571,0.524,0.476,0.0,-0.5106,neutral
2142,2956,Falsehood of security if wear mask... so the only way is to let it be?,30/1/20,0.0,1.0,0.0,0.854,0.146,0.34,fear
2144,2958, I wonder did those with symptoms had masked themselves up... social responsibility is so so important.,30/1/20,0.21666666666666667,0.5333333333333333,0.0,0.838,0.162,0.4047,fear
2145,2959,Ideally one only needs a mask if unwell.,31/1/20,0.45,1.0,0.0,0.682,0.318,0.4215,fear
2147,2961,"If you all keep telling us not to wear masks, then we healthy ones will fall sick.",31/1/20,-0.10714285714285715,0.6785714285714286,0.157,0.714,0.129,-0.1531,neutral
2148,2962,So many of us have no choice because we have to protect ourselves against those sick ones who dont wear masks.,31/1/20,-0.10714285714285715,0.6785714285714286,0.211,0.69,0.1,-0.4404,anger
2149,2963,MPs and government dont take mrt everyday to get to work so honestly you all dont understand.,31/1/20,0.19999999999999998,0.75,0.0,0.805,0.195,0.5949,neutral
2150,2964,Wearing a mask is uncomfortable but why do you think they are being snapped up?,31/1/20,-0.5,1.0,0.122,0.878,0.0,-0.2023,anger
2151,2965,Its annoying to keep hearing our leaders say only wear if you are unwell.,31/1/20,-0.4,0.95,0.172,0.828,0.0,-0.4019,anger
2152,2966,"If you encounter what normal citizens have to face daily with sick ppl sneezing and coughing in the mrt carriages, then you wont keep telling us only wear if we are unwell.",31/1/20,-0.14107142857142857,0.6267857142857143,0.096,0.904,0.0,-0.5106,fear
2153,2967,"If we dont wear, we will most definitely become unwell.",31/1/20,0.25,0.5,0.0,0.75,0.25,0.4576,neutral
2154,2968,Can you blame citizens for accusing the leaders for sitting in their ivory towers and not understanding the problems healthy ones are facing in the trains?,31/1/20,0.5,0.5,0.132,0.708,0.16,0.2163,anger
2155,2969,"In these circumstances, the way to stay healthy IS to wear a mask.",31/1/20,0.5,0.5,0.0,0.803,0.197,0.4019,anger
2161,2975,"Are you sure that it is safe, it is unnecessary to wear a mask?",31/1/20,0.19999999999999998,0.762962962962963,0.0,0.679,0.321,0.6369,anger
2168,2982,What is the contingency plan if the mask is not the ultimate solution?,31/1/20,0.0,1.0,0.141,0.859,0.0,-0.2411,fear
2169,2983,Are there no plans to combat the crisis should it develop further besides talking about mask?,31/1/20,0.0,0.5,0.401,0.599,0.0,-0.8271,neutral
2171,2985,"Can current wuhan people in singapore be located and required to be screened, tested , quarantined where necessary to prevent spreading.",30/1/20,0.0,0.7,0.0,0.945,0.055,0.0258,fear
2178,2993,No right!,22/4/20,-0.17857142857142855,0.5357142857142857,0.714,0.286,0.0,-0.3595,neutral
2183,2998,MP Sun Xueling has been posting many great ideas on how to make reusable masks on FB.,30/4/20,0.65,0.625,0.0,0.796,0.204,0.6249,joy
2186,3001,Mask making from household items could be easily found  from internet.,5/4/2020,0.43333333333333335,0.8333333333333334,0.0,0.806,0.194,0.34,fear
2190,3005,You sure this is washable?,6/4/2020,0.5,0.8888888888888888,0.0,0.635,0.365,0.3182,neutral
2192,3007,"If you wash your hands before making, you need to make sure you need to wash all the tools before using as well.",6/4/2020,0.5,0.8888888888888888,0.0,0.827,0.173,0.5267,neutral
2193,3008,Isnt using needle and thread way better than using staples which can pose a risk when you wear or wash the mask?,6/4/2020,0.5,0.5,0.088,0.792,0.121,0.2023,anger
2194,3009,"And with that masking tape, confirm damage after one wash. With the use of thread, staples and masking tape become redundant   Yes, its simple but not practical (and ugly).",6/4/2020,-0.3,0.5190476190476191,0.066,0.876,0.058,-0.0644,anger
2197,3012,Please dont use staples especially if disassembly is suggested after wearing.,5/4/2020,0.0,1.0,0.0,0.813,0.187,0.3182,neutral
2198,3013,"If you prick your finger/face while disassembling this mask while preparing to wash it, bacteria and viruses may directly enter through the prick and into the blood - it can be as bad as a needle injury in hospitals (eg healthcare workers accidentally poking their fingers w needles from patients w infectious diseases).",5/4/2020,-0.29999999999999993,0.5333333333333333,0.235,0.765,0.0,-0.91,fear
2199,3014,"Maybe sewing is a better option, or how about velcro?",5/4/2020,0.5,0.5,0.0,0.734,0.266,0.4404,neutral
2202,3019,Not sure how breathable the waterproof totebag side can be  I just tried putting a waterproof totebag over my nose and mouth - I cant breathe at all   Cute initiative though!,5/4/2020,0.1875,0.9444444444444444,0.065,0.826,0.109,0.3248,fear
2204,3021,Many may try this and may do more harm than good.,5/4/2020,0.5666666666666667,0.5333333333333333,0.238,0.564,0.198,-0.1604,neutral
2205,3022,To everyone else: collect your free reusable facemask from the government asap!,5/4/2020,0.5,0.8,0.0,0.754,0.246,0.5562,fear
2209,3026,I was confused as i saw the statement on free mask without a date to say wear only if unwell.,12/7/2020,0.0,0.8333333333333334,0.112,0.728,0.16,0.25,fear
2210,3027,Singaporean so demanding and hard to please.,1/2/2020,-0.2916666666666667,0.5416666666666666,0.38,0.394,0.226,-0.1423,neutral
2211,3028,It is with ppl like this that makes things worst.,1/2/2020,-1.0,1.0,0.281,0.548,0.171,-0.3818,joy
2212,3029,"Wonder what is more scary, singaporean or the virus",1/2/2020,0.0,0.75,0.304,0.696,0.0,-0.5413,fear
2213,3030,Msg confusing.... Don't wear mask if you are not sickSo which means wear mask only when you are sick or being infected...,1/2/2020,-0.33809523809523806,0.7523809523809524,0.136,0.864,0.0,-0.5106,neutral
2216,3033,Please correct me if i am wrong.,1/2/2020,-0.5,0.9,0.33,0.426,0.245,-0.2023,neutral
2218,3038,"Surely, hundreds were healthy?",31/1/20,0.5,0.6944444444444444,0.0,0.263,0.737,0.6808,neutral
2222,3045,"It is VERY IRRESPONSIBLE to dish out this kind of advisory ""Do not wear a mask if you are well"".",1/2/2020,0.4,0.6,0.206,0.794,0.0,-0.6867,anger
2223,3046,"""Wear one only if you are sick"".",1/2/2020,-0.35714285714285715,0.9285714285714286,0.0,1.0,0.0,0.0,neutral
2224,3047,I have my own masks at home at all times (due to annual haze).,1/2/2020,0.2375,0.6875,0.0,1.0,0.0,0.0,anger
2225,3048,"If I wear one in crowded places & public transport to protect myself from the potential bugs in the air, will people think I'm the one who is sick (since I'm wearing a mask) & ostracise me instead?",1/2/2020,-0.2380952380952381,0.6412698412698412,0.087,0.844,0.069,-0.1779,fear
2226,3049,"If you do not want people to mis-use the FOUR PRECIOUS SURGICAL MASKS PER HOUSEHOLD you are dishing out now, you can tell people to USE THOSE 4 MASKS only when they are sick cos those 4 masks are meant to be used that way.",1/2/2020,-0.07142857142857144,0.9523809523809524,0.092,0.817,0.091,0.229,anger
2228,3051,It can potentially mislead the ignorant in the public to think anyone wearing a mask must be sick.,1/2/2020,-0.2380952380952381,0.6412698412698412,0.265,0.735,0.0,-0.6597,fear
2229,3052,Such advisory just serves to further stigmatise mask-wearing & promote wrong behaviors.,1/2/2020,-0.16666666666666666,0.6333333333333333,0.211,0.612,0.177,-0.128,anger
2230,3053,Folks like myself who take precautionary measures to protect ourselves & our family (while we are still not sick) are being civic minded.,1/2/2020,0.35714285714285715,0.8571428571428571,0.0,0.797,0.203,0.6249,fear
2231,3054,Just take the advice and be happy to ppl helps you willing... they are also taking risks n at the same time their families do worried for them too,20/4/20,0.35000000000000003,0.625,0.124,0.694,0.182,0.4588,joy
2235,3058,how about ask them to bring out their phone and flash a QR code and make sure person read the webpage in front of you.,21/4/20,0.5,0.8888888888888888,0.0,0.909,0.091,0.3182,joy
2255,3078,"Go to Chong Pang food market, the crowd is amazing.",10/2/2021,0.6000000000000001,0.9,0.0,0.703,0.297,0.5859,fear
2259,3082,"So to tell me,me and wife should safe distance at home to ah?",10/3/2021,0.5,0.5,0.0,0.805,0.195,0.4404,neutral
2260,3083,"Understand the need for rules,if its too rigid and there is no efficiency on ground, kinda just paper law.regardless all stay safe and go out when needed imo.",10/3/2021,0.5,0.5,0.112,0.725,0.163,0.4019,neutral
2264,3087,Or buildings put away the machines after certain hours.,7/2/2021,0.21428571428571427,0.5714285714285714,0.0,0.792,0.208,0.2732,fear
2266,3089,"I was in Tampines shopping, but got to use my token only once.",7/2/2021,0.0,1.0,0.0,1.0,0.0,0.0,anger
2268,3091,"Virus is very courteous, it knows when to attack and when to allow you to eat.",10/2/2021,0.78,1.0,0.144,0.602,0.254,0.3384,anger
2271,3094,No safe distancing ambassador in sight.,21/10/20,-0.25,0.5,0.242,0.44,0.319,0.1779,neutral
2274,3097,Are we really good for phase 3?,21/10/20,0.7,0.6000000000000001,0.0,0.653,0.347,0.4927,joy
2276,3099,"Almost 6 months ago when we were experiencing a maj outbreak in workers dorms, many negative minded people seemed not to have faith in our gov/ 4G leaders, mocking our leaders, making all kind of nasty comments on them, saying that they were incompetent and useless.",20/10/20,-0.17499999999999996,0.5611111111111111,0.328,0.672,0.0,-0.9554,anger
2279,3102,"Besides having a team of selfless and committed healthcare workers and other frontline heroes, another reason is due to we have a capable and competent gov with strong leadership.",20/10/20,0.17666666666666667,0.51,0.0,0.618,0.382,0.9118,anger
2281,3104,Thank you to our 4G leaders that never stop to make our Singapore safe for everyone here.,20/10/20,0.5,0.5,0.0,0.658,0.342,0.7421,anger
2285,3108,Singapore can definitely do it.,20/10/20,0.0,0.5,0.0,0.597,0.403,0.4019,neutral
2292,3115,MOH needs to improve its own department before telling the public what to do.,21/10/20,0.3,0.5333333333333333,0.0,0.818,0.182,0.4404,fear
2297,3120,You need to learn from CAAS what it means to provide top quality services and take ownership of your identity.,21/10/20,0.5,0.5,0.0,0.913,0.087,0.2023,neutral
2302,3125,(3)  In fact approximately 90% of the PCR positive cases are false positives.,20/10/20,-0.19090909090909094,0.5818181818181819,0.0,0.611,0.389,0.7906,fear
2305,3128,(7)  The crisis will never end if we are waiting for zero positive tests.,20/10/20,0.22727272727272727,0.5454545454545454,0.208,0.609,0.183,-0.128,neutral
2306,3129,"Everyone has probably had a cold caused by a coronavirus and will likely have a few viral fragments matching those of the cousin SARS-CoV-2 virus (8)  Testing healthy asymptomatic individuals is non-sensical, unscientific and a colossal waste of money.",20/10/20,0.04285714285714285,0.6285714285714287,0.073,0.857,0.07,-0.0258,fear
2313,3136,Enough is enough.,21/10/20,0.0,0.5,0.0,1.0,0.0,0.0,fear
2317,3140,Stop telling me more about safe entry and trace together.,21/10/20,0.5,0.5,0.164,0.598,0.238,0.2449,neutral
2319,3142,Singapore is a really hot country in the morning until afternoon until evening.,21/10/20,0.25,0.8500000000000001,0.0,1.0,0.0,0.0,joy
2320,3143,Super hot weather and there isn't a single rain drop.,21/10/20,0.1706349206349206,0.5769841269841269,0.0,0.551,0.449,0.6921,joy
2321,3144,Just like what Tan Cheng Bock say = just do a covid 19 test for every Singaporeans and isolate those who are positive.,21/10/20,0.22727272727272727,0.5454545454545454,0.069,0.695,0.236,0.6486,fear
2323,3146,Friends from Malaysia and Singapore who like stocks and those who like to learn are welcome to join the group.,20/10/20,0.8,0.9,0.0,0.53,0.47,0.9062,joy
2324,3147,There are wonderful stock technology exchanges and solutions.,20/10/20,1.0,1.0,0.0,0.526,0.474,0.6597,neutral
2325,3148,Welcome to learn and explore together: https://chat.whatsapp.com/FJ3xLPBG9QS2xUZSkquj4C,20/10/20,0.8,0.9,0.0,0.667,0.333,0.4588,neutral
2329,3152,We have so many imported non Singaporeans cases.,14/9/20,0.5,0.5,0.0,1.0,0.0,0.0,neutral
2332,3155,Are you controlling the wrong people?,14/9/20,-0.5,0.9,0.383,0.617,0.0,-0.4767,anger
2334,3157,Many companies and businesses are suffering and closing down unnecessarily.,14/9/20,-0.018518518518518528,0.562962962962963,0.256,0.744,0.0,-0.4767,neutral
2337,3160,One day throw one is better since need to wear.,13/9/20,0.5,0.5,0.0,0.756,0.244,0.4404,neutral
2345,3168,"Nah phase 3 will not start, unless  we and the whole world is free from covid 19, even if we are free from it like 0 case for week.. we should be grateful to be living in sg since we dun have to have movement lock in own town like other country in their own city and can't go work in another town or so",13/9/20,0.3458333333333334,0.7291666666666666,0.019,0.781,0.2,0.9217,anger
2349,3172,But there will be more complaints because everyone will be late for work etc.,13/9/20,0.1,0.55,0.187,0.813,0.0,-0.4576,anger
2351,3174,Importantly is to take good care of yourself and stay safe.,13/9/20,0.5333333333333333,0.7000000000000001,0.0,0.383,0.617,0.8834,joy
2352,3175,"While there is a need to slowly open up, to protect those vulnerable and prevent potential cluster outbreak, MOM should assure the following :  1) All incoming travellers must be tested COVID-19 negative, taking into consideration the 14-day incubation period, before allowed to move around freely in Singapore.",13/9/20,-0.06666666666666667,0.5499999999999999,0.103,0.733,0.165,0.34,fear
2353,3176,Widely reported asymptomatic incubation period was the critical blind spot that the MTF failed to address in Feb when the Wuhan couple started the church cluster resulting in unnecessary Circuit Breaker and drawing down more than necessary from our reserves.,13/9/20,-0.14444444444444446,0.6069444444444444,0.183,0.817,0.0,-0.8074,anger
2360,3183,Setup easy and effective hotlines for public to report non compliances to follow up with fines and penalties.,13/9/20,0.3444444444444444,0.5666666666666667,0.0,0.727,0.273,0.7184,fear
2361,3184,"Only ZERO tolerance, effective enforcement of Social distancing, mask wearing and measures to address the asymptomatic incubation blind spot could ensure that the previous costly  mishandling is not repeated.",13/9/20,-0.0066666666666666706,0.5399999999999999,0.114,0.667,0.219,0.5859,fear
2367,3190,We cant travel there to visit our own kids and this coming 04 of Dec 2020 is my Son 6 year old birthday .,14/9/20,0.35,0.6,0.0,1.0,0.0,0.0,joy
2370,3193,When resume it slowly takes its own sweet time and again implement so many restrictions.,18/6/20,0.2875,0.6375,0.0,0.824,0.176,0.4588,neutral
