,index,Sentences,Comment Datetime,Textblob_polarity_score,Textblob_subjectivity_score,Vader_neg_score,Vader_neu_score,Vader_pos_score,Vader_compound_score,Emotions
898,939,You and Minister Gan are working very hard to keep Singapore and people here to be safe and healthy.,2020-03-29,0.20694444444444446,0.5680555555555555,0.073,0.687,0.24,0.6003,anger
902,943,Easier to enforce too because hotel security and cctv system can easily detect if people exit their rooms.,2020-03-23,0.43333333333333335,0.8333333333333334,0.0,0.664,0.336,0.765,neutral
905,946,"It does not make sense to close entertainment venues, bars and centres only.",2020-03-25,0.0,1.0,0.0,0.811,0.189,0.4215,neutral
908,949,Masked up should be OK?,2020-04-19,0.5,0.5,0.0,0.577,0.423,0.4466,anger
911,952,"While the ""circuit breaker"" is in place, we should also implement universal testing (a local lab has devised a 5min test with a 95% accuracy rate) and round up all Covid infected persons to maximise the effectiveness of cutting off viral transmission within the community... then once the month is up, we should legally mandate (and strictly enforce) all noses and mouths to be covered in public (once u step outta your house for no matter how long and for no matter what purpose)... this will enable us to embrace both defensive (semi-lockdown) and offensive (testing + treatment) measures in tandem to combat Covid so we can resume a greater semblance of domestic socioeconomic normalcy as soon as possible... the living conditions of our FWs also need urgent and significant improvement bcoz we're only as strong as our weakest link, and right now the FW dorms are looking pretty dodgy...",2020-04-08,0.07960317460317459,0.514047619047619,0.106,0.759,0.135,0.2023,fear
918,976,Would earn a quick buck from predicting there will be a spike in CoVid19 cases.,2020-03-23,0.3333333333333333,0.5,0.0,1.0,0.0,0.0,fear
921,979,All the other retail shops that want to do these kind of launches should take note 👀,5/12/20,0.2375,0.6375,0.0,0.92,0.08,0.0772,anger
925,983,Adidas did online balloting for the shoes and did all the necessary measures to prevent the above scenario.,5/12/20,0.0,0.55,0.0,0.939,0.061,0.0258,anger
930,988,"> # MP Seah Kian Peng explains visit to market after Facebook post on 'playing role of safe distancing ambassador'

> SINGAPORE: Member of Parliament Seah Kian Peng has explained why he was out and about at his constituency on Sunday (Apr 26), after netizens questioned his Facebook post that said he was ""playing the role of a safe distancing ambassador"".",28/4/20,0.5,0.5,0.022,0.828,0.15,0.7906,anger
934,992,"> In response to CNA queries, Mr Seah said he has been working from home ""almost the entire week"", and that he was out on Sunday as he had to sign some documents at the community club.",28/4/20,0.0,0.625,0.0,1.0,0.0,0.0,anger
938,996,At all times observing safe distancing rules.,28/4/20,0.5,0.5,0.0,0.674,0.326,0.4404,anger
939,997,"Based on what I saw, happy that things are all in order,"" he explained.",28/4/20,0.8,1.0,0.0,0.764,0.236,0.5719,joy
943,1001,"All parties concerned observed the safe distancing rules.""",28/4/20,0.5,0.5,0.0,0.517,0.483,0.6808,fear
947,1005,> Safe distancing ambassadors have been appointed to remind people of these rules.,28/4/20,0.5,0.5,0.0,0.791,0.209,0.4404,anger
948,1006,Those who do not comply will be issued a fine.,28/4/20,0.4166666666666667,0.5,0.0,0.816,0.184,0.2023,fear
949,1007,"> In his Facebook post on Sunday, Mr Seah said he observed that compliance with safe distancing measures was high, and temperature screening and crowd control measures were in place at popular places like supermarkets and wet markets.",28/4/20,0.29,0.585,0.0,0.806,0.194,0.802,anger
950,1008,"> ""Take care and stay safe,"" he wrote, adding hashtags like #socialdistancing and #walkabout.",28/4/20,0.5,0.5,0.0,0.659,0.341,0.6908,joy
958,1016,"> 

> Another MP, Liang Eng Hwa of Holland-Bukit Timah GRC, also posted about being a safe distancing ambassador on Sunday.",28/4/20,0.5,0.5,0.0,0.854,0.146,0.4404,fear
960,1018,"> Mr Liang wrote: ""Joined as one of the Safe Distancing Ambassador (SDA) this evening.",28/4/20,0.5,0.5,0.0,0.818,0.182,0.4404,fear
962,1020,"> 

> 

> Download our app or subscribe to our Telegram channel for the latest updates on the coronavirus outbreak: https://cna.asia/telegram

---
1.0.2 | [Source code](https://github.com/fterh/sneakpeek) | [Contribute](https://github.com/fterh/sneakpeek)",28/4/20,0.5,0.9,0.0,1.0,0.0,0.0,fear
968,1026,> Investigations suggested that the safe distancing ambassador had advised the man not to loiter along Hougang Avenue 8.,21/4/20,0.5,0.5,0.0,0.854,0.146,0.4404,sadness
973,1031,"> If found guilty, he can be jailed for up to four years, fined, or both.",21/4/20,-0.5,1.0,0.316,0.684,0.0,-0.7184,neutral
978,1036,"> ""Everyone should take the circuit breaker measures seriously, and cooperate and comply with the instructions of the enforcement officers and safe distancing ambassadors,"" said the police.",21/4/20,0.08333333333333334,0.5833333333333333,0.059,0.839,0.101,0.296,fear
979,1037,"> ""They are doing an important duty to keep our population safe.",21/4/20,0.45,0.75,0.0,0.657,0.343,0.5719,anger
984,1075,Unpopular opinion but MPs should really inspect their own estate to at least get a sense of the situation on the ground.,27/4/20,0.16666666666666666,0.5333333333333333,0.0,1.0,0.0,0.0,joy
986,1077,"I think it's fair that these incidents are seen with a political lens

If Parliament (by extension, the ruling party) is happy to make law to allow for GE (with a year to go when the changes were made then) to take place within the pandemic climate, politicians (especially those from the ruling party) should be ready to be viewed as acting for political means",27/4/20,0.24285714285714285,0.5142857142857143,0.0,0.848,0.152,0.8555,joy
987,1078,>Unpopular opinion but MPs should really inspect their own estate to at least get a sense of the situation on the ground.,27/4/20,0.16666666666666666,0.5333333333333333,0.0,1.0,0.0,0.0,joy
988,1080,If he wants to do than sure just make sure he practises what he preaches.,27/4/20,0.39999999999999997,0.6259259259259259,0.0,0.739,0.261,0.5574,neutral
995,1087,Police in many countries are doing that in this COVID situation.,18/4/20,0.5,0.5,0.0,1.0,0.0,0.0,joy
996,1088,Even some of which are considered more democratic than Singapore.,18/4/20,0.5,0.5,0.0,1.0,0.0,0.0,anger
998,1090,Beat up the violent criminals.,18/4/20,-0.8,1.0,0.717,0.283,0.0,-0.8225,anger
1000,1092,So what they are asking for their own injuries.,18/4/20,0.6,1.0,0.0,1.0,0.0,0.0,neutral
1003,1095,"Just don't cluster fuck in groups of more than 5, you should not be afraid of the SDA or EO, you should be afraid of covid-19.",8/10/20,-0.275,0.725,0.0,0.898,0.102,0.431,fear
1007,1099,"For posts flaired as such (by OP), we will be exercising greater moderation in the comments section against joke replies and irrelevant or off-topic comments and discussion.",20/1/21,0.0,0.6666666666666666,0.0,0.842,0.158,0.5719,fear
1008,1100,Please report such posts and comments.,20/1/21,0.0,0.5,0.0,0.685,0.315,0.3182,neutral
1017,1109,"Now that we have some community cases and new clusters, I know people might say the number is low but we can't be complacent especially since there are new strains of the virus.",21/1/21,0.06818181818181818,0.5522727272727272,0.125,0.804,0.071,-0.4342,sadness
1018,1110,"I really think we should reduce gathering as a precaution, better be safe than sorry.",21/1/21,0.175,0.55,0.076,0.585,0.339,0.6705,sadness
1022,1114,"I’d rather we have people posting in reddit to remind us about what we should or should not be doing, rather than people on reddit talking in hindsight about what we should have done and where we went wrong.",8/2/21,-0.5,0.9,0.075,0.925,0.0,-0.4767,sadness
1024,1116,My post didn't mean to blame any individual or party.,8/2/21,-0.15625,0.54375,0.0,0.628,0.372,0.577,anger
1025,1117,Because frankly blaming is a feel-good move that doesn't do anyone any good.,8/2/21,0.7,0.6000000000000001,0.199,0.621,0.18,-0.0772,anger
1026,1118,">Pandemic fatigue is very real, and I'm sure quite a number of us have felt it by now.",8/2/21,0.38,0.6394444444444445,0.101,0.704,0.196,0.2247,fear
1028,1120,">  
>My wish is for as many of us as possible to adhere to the restrictions so that we won't witness another spike in cases, and if we're unfortunate enough a second Circuit Breaker.",8/2/21,0.0,0.6,0.084,0.84,0.076,-0.0772,fear
1029,1121,"Be responsible, be safe.",8/2/21,0.35,0.525,0.0,0.278,0.722,0.6369,anger
1034,1126,You should seriously consider it ( ͡° ͜ʖ ͡°),8/2/21,-0.3333333333333333,0.6666666666666666,0.195,0.805,0.0,-0.1779,anger
1036,1128,the common link is the location - the airport.,10/2/21,-0.3,0.5,0.0,1.0,0.0,0.0,neutral
1038,1130,"its more likely that the problem will come in lapses from operation than lapses in immigration policy, which is where the government comes in.",10/2/21,0.25,0.75,0.105,0.895,0.0,-0.4019,fear
1041,1133,entire economies will go bust if we do so.,10/2/21,0.0,0.625,0.0,1.0,0.0,0.0,neutral
1048,1140,it's easy to sit on a high horse and deride the government for not being prudent when you only make considerations upon a small window of factors.,10/2/21,0.08583333333333334,0.6933333333333332,0.075,0.821,0.104,0.2023,fear
1052,1144,"and don't get me wrong, i hold the govt of singapore to the same high standards i hold the people of singapore.",10/2/21,-0.11333333333333333,0.5216666666666666,0.0,0.882,0.118,0.3724,fear
1053,1145,"if they're shit, i'll be the first to raise my pitchforks.",10/2/21,0.024999999999999994,0.5666666666666667,0.265,0.735,0.0,-0.5574,anger
1055,1147,"this growing ""superiority complex of the collective people"" idea needs to be kept in check, otherwise it can lead to our own downfall.",10/2/21,0.15,0.7,0.0,0.837,0.163,0.4767,anger
1056,1148,"recognizing our own problems and shortcomings is a strength, not accepting our own faults is a weakness.",10/2/21,0.6,1.0,0.45,0.417,0.133,-0.7639,joy
1057,1149,"and especially in times of a crisis like we are in now, a weakness like this only spells greater trouble for the future.",10/2/21,0.06,0.5650000000000001,0.299,0.467,0.234,-0.4767,fear
1058,1150,He's lucky he won't get caned.,18/1/21,0.3333333333333333,0.8333333333333334,0.0,0.641,0.359,0.4215,sadness
1060,1152,"Jesus fucking christ why are redditors so authoritarian

I've never seen a post about a prison sentence that wasn't just exclusively filled with ""he got off easily he deserves a life sentence"" or detailing all the ways that they should be violently tortured

These ultra harsh covid laws aren't good.",18/1/21,-0.011111111111111108,0.8055555555555557,0.267,0.65,0.083,-0.9187,anger
1062,1154,"You're harshly punishing this guy, yet schools are still in session and large gatherings still happening.",18/1/21,0.007142857142857131,0.5642857142857143,0.194,0.806,0.0,-0.5574,fear
1063,1155,Are you guys serious?,18/1/21,-0.3333333333333333,0.6666666666666666,0.302,0.698,0.0,-0.0772,neutral
1064,1156,"No one should go to prison for half a year just for visiting his loved one, yet the only person in contact was his fiance?",18/1/21,0.17777777777777778,0.6555555555555556,0.181,0.691,0.128,-0.1531,sadness
1065,1157,"Give them a fine, whatever but dont put them in Prison?",18/1/21,0.4166666666666667,0.5,0.321,0.578,0.101,-0.6187,neutral
1067,1159,"This crime, with its latent potential for egregious harm to others, deserves a much harsher sentence.",18/1/21,0.1,0.6,0.453,0.489,0.058,-0.872,joy
1072,1164,"I think his charge should only go extreme if he was, in fact, infected with the virus.",18/1/21,-0.0625,1.0,0.176,0.824,0.0,-0.4939,sadness
1078,1170,I'm just disappointed at how light the punishment is.,18/1/21,-0.175,0.725,0.474,0.526,0.0,-0.743,sadness
1084,1176,An authoritarian government would lock you in your own home during a pandemic.,19/1/21,0.6,1.0,0.0,1.0,0.0,0.0,anger
1091,1183,"It's not about being perfect, it's about being responsible.",18/1/21,0.6,0.775,0.244,0.569,0.187,-0.1774,anger
1095,1187,Running around without a mask while people are getting sick and dying?,18/1/21,-0.7142857142857143,0.8571428571428571,0.248,0.752,0.0,-0.5106,fear
1097,1189,It's because of selfish entitled pricks that we're probably going to take longer to recover from this.,18/1/21,-0.5,1.0,0.237,0.664,0.1,-0.4404,sadness
1099,1191,Most countries don't give a fuck about nationality if you break their laws.,18/1/21,0.04999999999999999,0.55,0.0,0.794,0.206,0.431,fear
1105,1197,Ive had to fly twice during this pandemic and I was reluctant to do so even for absolutely essential reasons.,18/1/21,0.4,0.6,0.1,0.9,0.0,-0.25,fear
1113,1205,Drugs should be legalized and then regulate the fuck out of them.,18/1/21,-0.4,0.6,0.241,0.759,0.0,-0.5423,anger
1118,1210,That's the way these selfish pricks should be treated.,18/1/21,-0.5,1.0,0.417,0.583,0.0,-0.6124,anger
1120,1212,"This is a hotel quarantine, much more serious that a house quarantine.",18/1/21,0.08333333333333334,0.5833333333333333,0.15,0.85,0.0,-0.1513,fear
1128,1220,"So yes, the dude should to punished harshly for violating a hotel quarantine order.",18/1/21,-0.2,0.7,0.333,0.513,0.154,-0.5434,anger
1130,1222,"Instead, we are lenient and put in these policies in place.",18/1/21,0.5,0.9,0.0,0.826,0.174,0.2732,anger
1131,1223,A bad apple like this spoils for everyone else.,18/1/21,-0.6999999999999998,0.6666666666666666,0.292,0.5,0.208,-0.25,anger
1133,1225,Of course I know all this and more on the matter.,18/1/21,0.5,0.5,0.0,0.868,0.132,0.0935,neutral
1134,1226,The scary part is that some people in these countries seem to be quite keen on the matter.,18/1/21,-0.5,1.0,0.145,0.679,0.176,-0.079,anger
1135,1227,I'd say more people than there should as this should be extremely fringe.,18/1/21,0.1875,0.75,0.0,1.0,0.0,0.0,anger
1136,1228,"And they are often part of the modern day nationalist crowd, which makes things even more disturbing.",18/1/21,0.06666666666666665,0.5333333333333333,0.183,0.817,0.0,-0.5563,anger
1141,1233,This is like saying that gay people in Saudi should just follow the rules and not be gay.,18/1/21,0.4166666666666667,0.5833333333333334,0.0,0.872,0.128,0.3612,anger
1146,1238,She should have joined him right away of the plan was to break protocol anyway.,19/1/21,0.2857142857142857,0.5357142857142857,0.0,1.0,0.0,0.0,anger
1148,1240,It is huge and the most powerful.,18/1/21,0.4000000000000001,0.7999999999999999,0.0,0.481,0.519,0.659,fear
1151,1243,"South Korea, Japan and Taiwan on top 10 lowest birth rates in world.",18/1/21,0.5,0.5,0.169,0.714,0.117,-0.2023,neutral
1156,1248,> This sounds like a hilarious white supremacist make belief.,18/1/21,0.25,0.5,0.0,0.427,0.573,0.6908,joy
1159,1251,2 K-pop albums on top 100?!,18/1/21,0.625,0.5,0.0,0.657,0.343,0.2714,neutral
1160,1252,"lmao give me fucking break..

https://www.billboard.com/charts/year-end/2020/top-album-title-sales",18/1/21,0.0,0.9,0.0,0.562,0.438,0.5994,fear
1164,1256,Those are 2 different sentences and neither should be punished so severly.,18/1/21,0.0,0.6,0.0,0.71,0.29,0.3979,anger
1165,1257,"I'm not going to push legalization in europe and NA but be like "" oh well singapoor are fine and completely moraly i'm justified"" nothing should give the death penalty.",18/1/21,0.3055555555555556,0.6,0.211,0.518,0.271,0.1768,sadness
1166,1258,"Everybody has already said all the common sense stuff on why you are wrong so im just gonna go ahead and say...  you're a total dumb fuck idiot, your comment is bad and you should feel bad
""Petty and fear based"" tell that to everyone who has a loved one die of covid... tell that to all the healthcare worker who has died of covid...

Dumb fuck",18/1/21,-0.3499999999999999,0.6621212121212121,0.414,0.545,0.041,-0.9878,fear
1167,1259,Its not really illegal to be gay in Saudi.,18/1/21,0.33333333333333337,0.5416666666666667,0.0,0.718,0.282,0.4838,fear
1168,1260,"Its illegal for men to have gay sex, and its illegal to advocate for gay rights.",18/1/21,-0.041666666666666644,0.5416666666666667,0.34,0.66,0.0,-0.802,sadness
1169,1261,"While it isn't a choice to be gay, it is a choice to have sex or to write posts on the internet.",18/1/21,0.4166666666666667,0.5833333333333334,0.0,1.0,0.0,0.0,sadness
1171,1263,I would also suggest that homosexuals visiting Saudi should take precautions and not to share their sexuality openly.,18/1/21,0.0,0.5,0.106,0.894,0.0,-0.2235,joy
1173,1265,"Btw fwiw gay sex is illegal in Singapore too, even though it's not typically enforced.",18/1/21,4.625929269271485e-18,0.5277777777777778,0.205,0.795,0.0,-0.5574,neutral
1176,1268,The food is amazing and the attractions are something different.,18/1/21,0.30000000000000004,0.75,0.0,0.548,0.452,0.765,fear
1179,1271,Anything for hainanese chicken rice though,18/1/21,-0.6,0.95,0.0,1.0,0.0,0.0,neutral
1180,1272,Maybe you should take your own advice and google it.,19/1/21,0.6,1.0,0.0,1.0,0.0,0.0,neutral
1181,1273,I'm pretty sure I know my own country better than you.,19/1/21,0.4625,0.8472222222222222,0.0,0.455,0.545,0.8126,neutral
1189,1281,Let's also consider the fact that the WHO came out in September and recognized that lockdowns do more harm than good.,18/1/21,0.6,0.55,0.146,0.732,0.122,-0.1604,joy
1196,1288,How the previous guy can even make such a stupid comment is beyond me honestly.,18/1/21,-0.09166666666666665,0.6416666666666666,0.185,0.652,0.163,-0.1027,anger
1199,1291,Enough said.,18/1/21,0.0,0.5,0.0,1.0,0.0,0.0,anger
1200,1292,I'm comparing dead people to dead people and I didn't make the violent rioters comparison.,18/1/21,-0.4000000000000001,0.6,0.378,0.484,0.138,-0.7546,sadness
1202,1294,Good luck comparing the two.,19/1/21,0.7,0.6000000000000001,0.0,0.337,0.663,0.7096,neutral
1207,1299,I'm not personally against the punishment for quarantine rule breakers despite finding it quite harsh.,18/1/21,-0.1,0.5,0.33,0.67,0.0,-0.7501,anger
1209,1301,I mean sure.,18/1/21,0.09375,0.7881944444444444,0.0,0.303,0.697,0.3182,neutral
1210,1302,If you want to pretend that Singapore executes and canes literally everyone who does something wrong or illegal.,18/1/21,-0.5,0.7,0.346,0.598,0.056,-0.7783,fear
1212,1304,Housing is subsidised for almost every citizen who wants to buy into government housing ( I own one with my wife.,18/1/21,0.4,0.55,0.0,1.0,0.0,0.0,anger
1214,1306,It's great and is actually designed to make it possible to own a home.,18/1/21,0.35,0.7125,0.0,0.745,0.255,0.6249,joy
1216,1308,"I don't think id ever have been able to peruse being a designer and still get to own a home in a city that I can find work )

The food is subsidised, local hawker culture is some of the tastiest and cheapest food around.",18/1/21,0.3666666666666667,0.5416666666666666,0.0,1.0,0.0,0.0,anger
1218,1310,The idea that you can go out everyday and it's cheaper to eat and sit down with family and friends than to eat at home (unless super frugal) still blows my mind.,18/1/21,-0.007407407407407436,0.5185185185185185,0.0,0.811,0.189,0.7906,joy
1219,1311,"The national insurance equivalent, CPF is usable for more than just your eventual pension.",18/1/21,0.5,0.5,0.0,1.0,0.0,0.0,fear
1221,1313,"Albeit as someone who suffers from a lot of health issues I do miss the NHS ), you can use it to pay for your home loan and your employer has to match you monthly contribution as well.",18/1/21,-0.6,0.7,0.152,0.796,0.052,-0.4588,anger
1222,1314,"Education is some of the best in the world, the school rankings here leave me feeling stupid as hell when I meet kids who are in 'not as good' schools who are still brighter and more educated than I could ever say I was at that age.",18/1/21,0.35,0.6000000000000001,0.204,0.65,0.146,-0.5116,anger
1223,1315,"Albeit that this comes with the cost of extreme child stress, which is the problem Singapore is now trying to work out how to address.",18/1/21,-0.125,1.0,0.193,0.807,0.0,-0.6705,sadness
1229,1321,The greater good overlaps with your personal good and mine.,18/1/21,0.475,0.5,0.0,0.458,0.542,0.8074,neutral
1230,1322,No littering means a cleaner and more pleasant environment.,18/1/21,0.6166666666666667,0.7333333333333334,0.176,0.4,0.424,0.4754,neutral
1232,1324,Can it go too far?,18/1/21,0.1,1.0,0.0,1.0,0.0,0.0,neutral
1233,1325,Absolutely.,18/1/21,0.2,0.9,0.0,1.0,0.0,0.0,neutral
1238,1330,"Well, going by game theory, an individual should realise if they act purely in their own self interest, everyone else will, too.",18/1/21,0.10357142857142856,0.575,0.0,0.797,0.203,0.6249,fear
1239,1331,"By working for the ""greater good"" everyone is cooperating.",18/1/21,0.6,0.55,0.0,0.565,0.435,0.6597,neutral
1241,1333,All it takes is finding out the VPN wasn’t as secure as advertised and boom.,18/1/21,0.4,0.6,0.0,0.854,0.146,0.34,fear
1246,1338,"""Individuals know the risk of Covid so Government should just let them infect people and cause deaths""

Unlike being gay or a weird fetish, acting nonchalantly about the virus will cause a death or injured another person.",18/1/21,-0.027777777777777773,0.5277777777777778,0.251,0.749,0.0,-0.8555,sadness
1249,1341,"I couldn't give a fuck if you told me you had covid or know people who have had covid and did not have many ill effects, because I know perfectly nice young people who stayed isolated and only went out to get groceries and still got Covid because of these very people who break the law.",19/1/21,0.07142857142857142,0.6857142857142857,0.037,0.768,0.195,0.8715,anger
1253,1345,"Are you telling me that he so desperately needed to see his fiancé that he had to break the law and possibly infect a whole slew of people who have already followed the rules and are now enjoying this ""freedom"" that you say has been stolen?",19/1/21,0.02500000000000001,0.75,0.126,0.808,0.065,-0.4882,anger
1256,1348,"It's exactly due to this ""muh freedom/rights"" bullshit that idiots like you spew which is why the COVID situation is so fucking terrible in other countries now.",19/1/21,-0.5125,0.6375,0.22,0.706,0.074,-0.7159,neutral
1257,1349,"P.s we have way more freedom than these idiots who are out protesting lockdowns btw, and that's because we chose to obey the rules set to keep our countrymen safe.",19/1/21,0.06666666666666665,0.6,0.075,0.726,0.199,0.6801,anger
1263,1355,"We should be calling out idiotic behavior from any country or government, that includes my own by the way.",19/1/21,-0.033333333333333326,0.9166666666666667,0.167,0.833,0.0,-0.5574,anger
1265,1357,"Do you want people to be healthy and thrive, maybe only when it works for you?",19/1/21,0.25,0.75,0.0,0.778,0.222,0.4588,joy
1269,1361,"These should load faster, but Google's AMP is controversial because of [concerns over privacy and the Open Web](https://www.reddit.com/r/AmputatorBot/comments/ehrq3z/why_did_i_build_amputatorbot).",19/1/21,0.275,0.725,0.115,0.885,0.0,-0.296,fear
1270,1362,"Fully cached AMP pages (like the one you shared), are [especially problematic](https://www.reddit.com/r/AmputatorBot/comments/ehrq3z/why_did_i_build_amputatorbot).",19/1/21,0.0,1.0,0.0,1.0,0.0,0.0,neutral
1272,1364,">certain classes of narcotics have also proven to have no therapeutic effect whatsoever, such as methamphetamine

The case against capital and corporal punishment - in general beyond drug trafficking - is just as strong as the case against cannabis.",19/1/21,0.1611111111111111,0.5777777777777778,0.126,0.796,0.077,-0.2732,anger
1274,1366,"Saying that the drug policy is uniformly regressive, as are its punishments, is not the same as equating potential of damage of cannabis vs opioids or meth.",19/1/21,0.0,0.5625,0.194,0.806,0.0,-0.7184,anger
1279,1371,> That's very silly maths because each person infected then infects others who infects others etc.,19/1/21,-0.65,1.0,0.182,0.739,0.079,-0.4228,anger
1281,1373,"I'm sorry, but that's an absurd line of thinking.",19/1/21,-0.5,1.0,0.126,0.874,0.0,-0.0387,sadness
1282,1374,"If you go to work with a cold, then it eventually hits an old person that it kills, should you then be charged with manslaughter?",19/1/21,-0.25,0.6,0.194,0.806,0.0,-0.6486,anger
1283,1375,You can't just put all the blame on one arbitrary individual in the chain...,19/1/21,-0.05,0.5,0.156,0.844,0.0,-0.34,anger
1286,1378,> 1 in a thousand chance of ruining thousands of peoples lives is still a serious crime.,19/1/21,-0.3333333333333333,0.6666666666666666,0.382,0.506,0.112,-0.5859,fear
1287,1379,"You're right, it is a serious crime and should have a serious punishment.",19/1/21,-0.12698412698412698,0.623015873015873,0.571,0.429,0.0,-0.8074,anger
1288,1380,"I just reject prison sentences because they should serve a purpose of rehabilitation, and I don't think there's much potential to change this man in a positive way by locking him up.",19/1/21,0.11363636363636363,0.7727272727272727,0.172,0.69,0.138,-0.296,anger
1291,1383,"I agree that the maximum potential damage should not be what sentencing is based on, it should be roughly mean expected damage (roughly because you can't exactly quantify damage).",19/1/21,-0.05249999999999999,0.5475,0.186,0.699,0.115,-0.5355,anger
1292,1384,"> I just reject prison sentences because they should serve a purpose of rehabilitation, and I don't think there's much potential to change this man in a positive way by locking him up.",19/1/21,0.11363636363636363,0.7727272727272727,0.172,0.69,0.138,-0.296,anger
1294,1387,I just reject the idea that what he did isn't as serious as things we give 6 months for in the UK.,19/1/21,-0.3333333333333333,0.6666666666666666,0.123,0.821,0.056,-0.3565,sadness
1295,1388,"The thing is, if it had been harsh like this, then people would have done what was needed.",19/1/21,-0.2,0.7,0.136,0.748,0.117,-0.1027,anger
1296,1389,"It's not about throwing loads of people in prison, it's about setting the tone for how serious this is.",19/1/21,-0.3333333333333333,0.6666666666666666,0.213,0.787,0.0,-0.5574,anger
