,index,Sentences,Comment Datetime,Textblob_polarity_score,Textblob_subjectivity_score,Vader_neg_score,Vader_neu_score,Vader_pos_score,Vader_compound_score,Emotions
9253,12474,"The fact is that blanket, conservative quarantines are *ridiculously* disruptive to people's lives and businesses, and is a factor outside most people's circle of control.",10/9/20,0.05555555555555556,0.5166666666666667,0.091,0.909,0.0,-0.3182,fear
9257,12478,To make the measures more surgical and targeted would reap significant benefits.,10/9/20,0.4375,0.6875,0.0,0.694,0.306,0.5267,fear
9261,12482,"That, together with Safe Entry, should get you enough of the way there.",10/9/20,0.25,0.5,0.0,0.805,0.195,0.4404,anger
9263,12484,Isn't this enough?,10/9/20,0.0,0.5,0.0,1.0,0.0,0.0,anger
9264,12485,I am not convinced with any of the messaging thus far.,10/9/20,0.1,1.0,0.201,0.799,0.0,-0.3089,anger
9268,12489,>Trace Together now is a different beast.,15/9/20,0.0,0.6,0.0,1.0,0.0,0.0,joy
9270,12491,The [stated rationale was that contacts needed to be identified more accurately and quickly](https://www.straitstimes.com/singapore/majority-of-tracetogether-users-have-not-re-registered-with-id-numbers).,15/9/20,0.45000000000000007,0.5666666666666667,0.0,1.0,0.0,0.0,fear
9271,12492,Think we should especially draw our attention to this .,15/9/20,0.0,1.0,0.0,1.0,0.0,0.0,fear
9272,12493,"If you need a fast way to contact people, just stick with linking up the tokens with a phone number (doesn't have to be unique for every individual) or some other means of communication, heck some people can even set up emails just for the purpose of contact tracing.",15/9/20,0.11249999999999999,0.59375,0.0,0.973,0.027,0.0772,anger
9273,12494,I understand a pre-existing national ID system can be an ubiquitous means of identifying people easily but it doesn't take that much effort to link phone numbers instead of NRICs and drastically cut privacy concerns.,15/9/20,0.31666666666666665,0.5166666666666667,0.075,0.877,0.048,-0.2382,fear
9278,12499,Is this going to replace Safe Entry?,10/9/20,0.5,0.5,0.0,0.674,0.326,0.4404,fear
9282,12503,"I feel like I would just misplace the token if I had it, I can't imagine senior citizens doing much better with it--although I can understand how this would be ""easier"" than asking them to use an app and scan the QR code.",10/9/20,0.5,0.5,0.0,0.87,0.13,0.6597,anger
9283,12504,"Some purely positive outcomes:

The token would reduce manpower demand for SafeEntry.",9/9/20,0.22727272727272727,0.5454545454545454,0.097,0.65,0.253,0.5256,fear
9287,12508,Only if businesses would be able to get some TraceTogether Bluetooth beacon could manpower decrease.),9/9/20,0.25,0.8125,0.0,1.0,0.0,0.0,fear
9292,12513,"Asking everyone in the area during a certain time to track their symptoms for 14 results in a lot of anxiety in aggregate, especially in situations like the NTU failure.",9/9/20,-0.034126984126984145,0.6238095238095238,0.148,0.709,0.144,-0.0352,anger
9294,12515,enough to a confirmed case.,9/9/20,0.2,0.75,0.0,1.0,0.0,0.0,fear
9296,12517,"If you are forced to unnecessarily work in the office, report to MOM, if not your MP and the Manpower ministers email address.",9/9/20,-0.35000000000000003,0.55,0.12,0.88,0.0,-0.4588,fear
9302,12523,Remember that the CPF sums were not meant to be arbitrarily raised.,9/9/20,-0.1,0.6,0.0,1.0,0.0,0.0,anger
9308,12529,"Especially if SafeEntry becomes mandatory in more places, or in public transport.",10/9/20,0.16666666666666666,0.5222222222222223,0.0,0.894,0.106,0.0772,fear
9313,12534,But that doesn't sound like doing a dead drop of your token or participating in a large enough lucky draw of tokens in order to thwart attempts of tracing the holder of the token would run afoul of the Act.,10/9/20,0.14952380952380953,0.5123809523809524,0.188,0.75,0.062,-0.6917,fear
9315,12536,The strange thing is that it would actually be likely that Singaporeans would be suspicious of this *if it weren't happening in their homes*.,12/9/20,-0.025,0.575,0.163,0.837,0.0,-0.5106,anger
9316,12537,"Imagine flying on a nice holiday to Bangkok, only to be greeted at the airport by the customs that you'll need to wear a tracking token that can track your entire movement in Bangkok for the whole holiday trip ""for public order and so that we can improve our tourism experience and offerings"".",12/9/20,0.16,0.6183333333333334,0.0,0.777,0.223,0.9042,joy
9318,12539,and honestly that's actually the kind of skepticism we should be applying to this whole scenario.,12/9/20,0.35,0.575,0.119,0.726,0.155,0.1796,fear
9321,12542,"Say no more, I'm in!""",12/9/20,-0.3125,0.5,0.384,0.616,0.0,-0.3595,fear
9322,12543,"And one of the major drawbacks of the Apple/Google contact tracing, if you are informed that you may come into contact with a COVID-19 patient, you voluntarily report yourself to the authorities so that you can be tested and quarantined.",10/9/20,0.0625,0.5,0.0,1.0,0.0,0.0,joy
9323,12544,"Go figure out of 10, how many people will voluntarily do that?",10/9/20,0.5,0.5,0.0,1.0,0.0,0.0,anger
9337,12558,The current approach may be a situation where the data is only uploaded on specific events occurring but whats to stop that from changing?,10/9/20,0.0,0.5083333333333333,0.113,0.887,0.0,-0.4215,fear
9343,12564,Others have mentioned that it only tracks certain locations.,10/9/20,0.10714285714285714,0.7857142857142857,0.0,0.792,0.208,0.2732,anger
9346,12567,Note the difference with the Australian approach which has unique IDs for the token/app that is changed every 14 days.,10/9/20,0.1875,0.5,0.0,1.0,0.0,0.0,joy
9350,12571,Most Singaporeans dont care enough about this but this is the epitome of how a police state is formed.,10/9/20,0.25,0.5,0.0,0.884,0.116,0.3031,fear
9364,12585,Impossible I tell you.,10/9/20,-0.6666666666666666,1.0,0.0,1.0,0.0,0.0,anger
9366,12587,"> For people concerned with privacy, isn't SafeEntry legit much worse than TT?",10/9/20,-0.4,0.6,0.22,0.78,0.0,-0.4767,fear
9370,12591,"I agree with what you said, especially when the patient involved has visited a large area with a single SafeEntry code - say an MRT station.",10/9/20,0.047619047619047616,0.5476190476190476,0.0,0.894,0.106,0.3612,anger
9371,12592,"Plus, the TT token is its own thing, so it's probably even better than the current system that's pegged to your NRIC.",10/9/20,0.3666666666666667,0.6333333333333333,0.0,0.879,0.121,0.4404,anger
9379,12600,(Dont tell me to delete my own files just to keep TT' logs).,10/9/20,0.6,1.0,0.0,1.0,0.0,0.0,anger
9380,12601,">The big bulk of my data is already used by Google so I lost my sense of ""privacy"" awhile ago

You lost it long ago, doesn't mean it is OK for other whom hasn't lost their own privacy, to be like you.",10/9/20,0.10208333333333335,0.5104166666666666,0.178,0.714,0.108,-0.5485,anger
9384,12605,Family check in conveniently lets the caregiver/accompanying to perform safe entry on behalf.,10/9/20,0.5,0.5,0.0,0.805,0.195,0.4404,joy
9388,12609,">For all the talk of how it cant be or wont be used to track people, the fact remains that any such database is open to abuse.",10/9/20,0.0,0.5,0.139,0.861,0.0,-0.6369,anger
9396,12618,"> Once we are at this point where the device is already mandatory, and the government has already started in this direction, it's very easy for them to expand on this even further with little justification.",10/9/20,0.1252777777777778,0.6666666666666666,0.0,0.825,0.175,0.6997,anger
9400,12622,"From here, you will be able to work out things such as: Who meets and travels together often.",10/9/20,0.25,0.5625,0.0,1.0,0.0,0.0,joy
9402,12624,"> Once the majority already accepts this reality, it will be very difficult for this to go the other direction.",10/9/20,-0.3875,0.6875,0.126,0.769,0.104,-0.1263,anger
9406,12628,curious why that would even be necessary in the first place - seeing as apparently the odds of catching a virus in a crowded space like train or bus is soooo low that social distancing is not required at all.,10/9/20,0.11904761904761905,0.5642857142857143,0.051,0.831,0.117,0.4019,anger
9409,12631,Just because no one is one has been prosecuted doesnt mean they cant be.,10/9/20,-0.3125,0.6875,0.286,0.714,0.0,-0.5859,anger
9418,12641,They have not been willing to show us that this is the case.,10/9/20,0.25,0.75,0.0,1.0,0.0,0.0,anger
9421,12644,"That could be grounds, albeit somewhat shaky grounds, to keep these measures in place indefinitely.",10/9/20,-0.3333333333333333,0.5,0.103,0.897,0.0,-0.1548,anger
9430,12653,"the question isnt what data we give up, it is who we trust more with that data be it a profit-driven corporation or your government.",10/9/20,0.5,0.5,0.0,0.875,0.125,0.5106,anger
9437,12660,"SafeEntry already does a lot of this, the only difference being you having to stand there to scan the QR code.",10/9/20,0.0,1.0,0.0,1.0,0.0,0.0,fear
9438,12661,"As far as I understand it, the data stays on the phone/device until required for contact tracing.",10/9/20,0.1,1.0,0.0,1.0,0.0,0.0,joy
9445,12668,Why single out a particular use case as being a potential for disaster?,10/9/20,0.031746031746031744,0.5158730158730158,0.291,0.709,0.0,-0.6249,anger
9449,12672,"The idea is to find out who's been in close contact with you long enough to be at risk, since you can't rely on people to have good memories or be truthful to you when doing contact tracing.",10/9/20,0.2875,0.5,0.049,0.814,0.137,0.5859,anger
9451,12674,"[https://www.todayonline.com/world/how-coronavirus-infected-some-not-all-restaurant](https://www.todayonline.com/world/how-coronavirus-infected-some-not-all-restaurant)   
[https://www.scmp.com/news/china/science/article/3074351/coronavirus-can-travel-twice-far-official-safe-distance-and-stay](https://www.scmp.com/news/china/science/article/3074351/coronavirus-can-travel-twice-far-official-safe-distance-and-stay)  
Now maybe they actually got infected elsewhere, but given that these researchers believe they had likely gotten it from those settings, having an app like TraceTogether would help contact tracers have a better picture of how the virus might spread and who might be infected.",10/9/20,0.16666666666666666,0.5333333333333333,0.11,0.706,0.183,0.6428,joy
9454,12677,">  
>This will be tested out first at venues where there are larger groups  coming together, especially when attendees have to interact closely  with one another or where masks may not be worn all the time due to the  nature of the activities.",10/9/20,0.03125,0.5520833333333333,0.0,0.956,0.044,0.2235,fear
9455,12678,">  
>(...) More pilots will start progressively from October at larger-scale  business-to-business events, before the programme expands further to  include venues such as F&B outlets, cinemas, gyms and certain  workplaces.",10/9/20,0.17857142857142858,0.5178571428571428,0.0,0.885,0.115,0.3612,fear
9461,12684,"We could be window shopping (not entering any shops) on different levels, maybe you browse level 1 to 3 and me 4 to 6.",10/9/20,0.0,0.6,0.0,1.0,0.0,0.0,fear
9463,12686,"SafeEntry can only prove that we are in the same building (no data from shops because we both didn't enter any), but TraceTogether token (or app) is able to link (via bluetooth) if we were in close proximity for a significant amount of time.",10/9/20,0.21875,0.65625,0.0,0.95,0.05,0.296,fear
9464,12687,"It's true that they can do some inferring based on the places that you've checked in, but it does depend on whether the shops are diligent enough to ensure that it happens.",10/9/20,0.175,0.575,0.0,0.85,0.15,0.6486,anger
9465,12688,"Some shops don't have enough manpower to check for safeentry before entering, so some people have been able to walk into those shops freely, which would create gaps that I'd imagine the contact tracers would prefer not to have when trying to map out everything.",10/9/20,0.3,0.6416666666666667,0.0,0.896,0.104,0.6124,fear
9472,12695,"Just because you brought your PC, doesn't mean all google search belongs to you.",10/9/20,-0.3125,0.6875,0.0,1.0,0.0,0.0,anger
9476,12699,"Just because you brought stuff online, and lost the ownership of your data, doesn't mean it is fine for others to lost it as well.",10/9/20,0.05208333333333334,0.59375,0.156,0.712,0.132,-0.1779,anger
9478,12701,Please check for secure connection.,10/9/20,0.4,0.6,0.0,0.39,0.61,0.5719,fear
9481,12704,Priority all wrong here.,10/9/20,-0.5,0.9,0.508,0.492,0.0,-0.4767,anger
9482,12705,"Just because the other side is a Gov website or organization, doesn't mean transparency/integrity/honesty are all top tier.",10/9/20,0.020833333333333332,0.5208333333333334,0.0,0.899,0.101,0.2023,anger
9484,12707,"4) Ya, but i'm saying is this ""You lost it long ago, doesn't mean it is OK for other whom hasn't lost their own privacy, to be like you"".",10/9/20,0.12250000000000001,0.5925,0.155,0.657,0.188,0.307,anger
9488,12711,"I think the worst thing is this is not regulated even by your phone since it relies on always-on Bluetooth, unlike SE which requires you to launch the app.",10/9/20,-1.0,1.0,0.132,0.868,0.0,-0.6249,fear
9491,12714,Correct me if I'm wrong.,10/9/20,-0.5,0.9,0.437,0.563,0.0,-0.4767,fear
9494,12717,"See, this is the kind of argument we'll end up seeing down the road once we consent to this.",10/9/20,0.2222222222222222,0.5944444444444444,0.129,0.784,0.088,-0.2247,fear
9496,12719,"""*


As mentioned in another comment in this thread, I'm naturally a cynic so I can totally see this playing out.",10/9/20,0.05,0.575,0.11,0.782,0.107,-0.0182,anger
9497,12720,"In a way, I would say that this is already playing out in a different way in US right now.",10/9/20,0.14285714285714285,0.5678571428571428,0.0,0.899,0.101,0.2023,fear
9502,12725,unless it's actually not and the government was only guessing?,10/9/20,0.0,0.55,0.0,1.0,0.0,0.0,fear
9506,12729,I mean one of the reasons SafeEntry was introduced was precisely because memory based contact tracing is unreliable.,10/9/20,0.04375000000000001,0.74375,0.0,1.0,0.0,0.0,fear
9507,12730,"if we are talking about other circumstances, like you're hanging out with your friends at a place that does not require checking in - surely you'd remember your friends.",10/9/20,0.1875,0.6319444444444444,0.0,0.665,0.335,0.891,joy
9508,12731,the argument made that it's for older people/groups who are too poor to own smart phones doesn't even hold up since SafeEntry also accepts NRIC.,10/9/20,0.14523809523809522,0.6440476190476191,0.177,0.665,0.158,-0.1531,anger
9521,12744,"TraceTogether was originally the Bluetooth tracing thing alone, no?",10/9/20,0.375,0.75,0.375,0.625,0.0,-0.4939,fear
9523,12746,"& also u/law90026, I actually typed quite a long post in response to the both of you but I had to stop to attend an urgent meeting, and Chrome just happily refreshed the tab by itself lol.. let me try to reconstruct the post.",10/9/20,0.3875,0.55,0.06,0.789,0.151,0.6486,fear
9524,12747,"Appreciate your responses, I thought I would be the one getting downvotes for my perspective but I am glad that people are looking at both sides of the argument.",10/9/20,0.5,1.0,0.101,0.717,0.182,0.3818,fear
9525,12748,"All in the spirit of good discussions :)

The concern for privacy is definitely on the minds of a lot of people since there were plans to use digital tools for contact tracing.",10/9/20,0.3,0.525,0.0,0.731,0.269,0.8519,fear
9546,12770,3) All that Ive mentioned above is thus why I said its not what data but who has our data is more important and a more current concern.,10/9/20,0.27999999999999997,0.5,0.0,0.905,0.095,0.3898,fear
9547,12771,Since handheld technology surpassed the pager most people have already given up their data.,10/9/20,0.5,0.5,0.0,1.0,0.0,0.0,anger
9551,12775,"If it works like the TT app on android, then I know for sure the location isn't being tracked, and the data stays on the phone.",10/9/20,0.5,0.8888888888888888,0.0,0.827,0.173,0.5859,fear
9552,12776,I don't think it's actually a good thing that SafeEntry already has all this data.,10/9/20,0.7,0.6000000000000001,0.0,0.805,0.195,0.4404,joy
9555,12779,"My problem is that there seems to be only an uproar when the government mandates that a device be put on you, that (as far as we know for now) stores data on the user side until required, when in reality the privacy breach has already happened.",10/9/20,0.05,1.0,0.057,0.943,0.0,-0.4019,fear
9556,12780,I utterly hate the slippery slope fallacy.,10/9/20,-0.8,0.9,0.444,0.556,0.0,-0.6115,fear
9558,12782,"Watch:  
Reject TraceTogether Token Transits to  
Reject TraceTogether Transits to  
Reject Safe Entry Transits to   
Reject SocialDistancing Transits to  
Reject Mask Mandate Transits to    
Reject Laws everyones a sov cit! 

So we absolutely must not reject the token because it mean we will all be sov cits.",10/9/20,0.1708333333333333,0.6958333333333333,0.0,0.885,0.115,0.6921,fear
9566,12790,unless it's actually not  and the government was only guessing?,10/9/20,0.0,0.55,0.0,1.0,0.0,0.0,fear
9567,12791,I think there's still some debate on whether air-cons play any role in the spread of the virus since it's difficult to prove.,10/9/20,-0.5,1.0,0.1,0.803,0.096,-0.0258,fear
9568,12792,"[https://www.nature.com/articles/d41586-020-02058-1](https://www.nature.com/articles/d41586-020-02058-1)

>I mean one of the reasons SafeEntry was introduced was precisely because  memory based contact tracing is unreliable.",10/9/20,0.04375000000000001,0.74375,0.0,1.0,0.0,0.0,fear
9569,12793,"if we are talking about  other circumstances, like you're hanging out with your friends at a  place that does not require checking in - surely you'd remember your  friends.",10/9/20,0.1875,0.6319444444444444,0.0,0.665,0.335,0.891,joy
9578,12802,"It's also problematic that the wording of the articles so far:

> ""This will be tested out first at venues where there are larger groups coming together, especially when attendees have to interact closely with one another or where masks may not be worn all the time due to the nature of the activities.""",10/9/20,0.045,0.6416666666666666,0.052,0.914,0.034,-0.2528,fear
9579,12803,"> More pilots will start progressively from October at larger-scale business-to-business events, before the programme expands further to include venues such as F&B outlets, cinemas, gyms and certain workplaces.",10/9/20,0.17857142857142858,0.5178571428571428,0.0,0.881,0.119,0.3612,fear
9584,12808,"As usual, the heavy handed implementation, together with the ""Trust us, we won't abuse the power"" just leaves a very bad taste in the mouth.",10/9/20,-0.4533333333333333,0.5388888888888889,0.121,0.667,0.212,0.4357,joy
9586,12810,"It is a significant intrusion into our lives and by the time it becomes prevalent, it will be too late.",10/9/20,0.037500000000000006,0.7375,0.0,0.909,0.091,0.2023,fear
9608,12832,"The point is that once you consolidate all this huge amounts of data into the hands of the government, it's very hard to convince them to let it go.",10/9/20,0.010416666666666685,0.8020833333333333,0.052,0.798,0.15,0.4932,anger
9614,12838,"I think the problem in this thread is the people who have convinced themselves that the government is totally, completely, absolutely, irredeemably, evil beyond any point of moral salvation.",10/9/20,-0.26666666666666666,0.7166666666666667,0.216,0.707,0.076,-0.7133,anger
9616,12840,"But come on, while the Singapore government probably doesn't give a shit about you, it gives a shit about maintaining its reputation amongst international investors.",10/9/20,-0.13333333333333333,0.5333333333333333,0.0,0.782,0.218,0.7048,fear
9619,12843,However further easing of measures in hopes to opening more of the economy will likely cause an increase in community spread as people interact more.,10/9/20,0.25,0.625,0.0,0.756,0.244,0.7269,fear
9622,12846,Like they are fearing backlash ;).,10/9/20,0.25,1.0,0.363,0.392,0.245,-0.296,fear
9626,12850,"For example, I don't see it necessary in a restaurant because safe distancing is already in place, unless they further ease up measures to pre-covid times, or allow buffets again.",10/9/20,0.16666666666666666,0.6666666666666666,0.0,0.774,0.226,0.743,anger
9627,12851,"That said, government may decide if it works well enough to just implement across the board, which means your fears coming true.",10/9/20,0.175,0.575,0.105,0.712,0.184,0.2732,fear
9631,12855,"Even if an effective vaccine is found today, rolling it out will take years so I hope a therapeutic is found instead.",10/9/20,0.6,0.8,0.0,0.725,0.275,0.7809,fear
9633,12857,And I think Singapore is trying hard to pioneer this to lead the way.,10/9/20,-0.2916666666666667,0.5416666666666666,0.104,0.896,0.0,-0.1027,fear
9645,12869,"If the pandemic is over, and they still continue, then I'll not only set the device on fire, I'll migrate.",10/9/20,0.0,1.0,0.112,0.888,0.0,-0.34,joy
9649,12873,They choose not or invest because of the risk to their own business.,11/9/20,0.6,1.0,0.149,0.851,0.0,-0.2732,anger
9651,12875,"My comment on heavy-handed comes because of the obvious discomfort a significant segment of the population have had regarding TT when it was first launched in June and the rolling out now, with the article saying it will soon the expanded to F&B, gyms, work places, etc (if not intended, then why say that and create unnecessary discomfort?).",10/9/20,0.056249999999999994,0.6520833333333333,0.046,0.866,0.088,0.1531,fear
9655,12879,"Obviously I am hopeful that I'm just being a cynical SOB, but recent times have shown, if anything, that I'm possibly not cynical enough.",10/9/20,-0.06,0.65,0.26,0.661,0.079,-0.6016,anger
9659,12883,"If thats the only way to achieve it, then I think we, as a society, have lost something quite important and fundamental.",10/9/20,0.2,1.0,0.103,0.804,0.093,-0.0534,fear
9661,12885,A TraceTogether token removes this hurdle for the government since it does all the work once it is in your hands -> they'll only need to deploy someone at the door to ensure you have your token when you enter the mall and every activity you do in the mall can be logged.,10/9/20,0.0,1.0,0.0,0.951,0.049,0.3818,anger
9669,12893,"So you're saying that we enable this for now, see how it plays out and if shit hits the fan you'll leave to another land?",10/9/20,-0.2,0.8,0.159,0.698,0.143,-0.128,anger
9674,12898,"Taking an extreme example, if one day the press statement is that all COVID carriers should be taken out back and shot (because 100% chance if person is dead he's least likely to move around and infect other people), should we just go along with it until after the pandemic to decide if that's a good/bad idea?",10/9/20,-0.125,0.5291666666666667,0.071,0.896,0.033,-0.5106,anger
9675,12899,"What I'm seeing in this thread is that people are uncomfortable for privacy reasons, and the government has done nothing since 3 months ago to counter these concerns.",10/9/20,-0.5,1.0,0.091,0.909,0.0,-0.3818,fear
9676,12900,"The opensource review already qualified that further review is needed to ensure that the TT token is ""safe"" from a privacy standpoint, but we have had nothing since.",10/9/20,0.25,0.5,0.0,0.935,0.065,0.2023,fear
9690,12914,"The government has to think of that, and to reopen more things slowly and surely.",10/9/20,0.2333333333333333,0.5962962962962962,0.0,0.828,0.172,0.4404,fear
9694,12918,Identifying the devices from the hashes is the hard part.,10/9/20,-0.2916666666666667,0.5416666666666666,0.135,0.865,0.0,-0.1027,fear
9695,12919,The point is that so far the only arguments I've seen here are identical to the anti-lock down protesters.,10/9/20,-0.018518518518518528,0.762962962962963,0.213,0.787,0.0,-0.5574,anger
9698,12922,"Wearing a mask is uncomfortable too, and I'm wearing one.",10/9/20,-0.5,1.0,0.245,0.755,0.0,-0.3818,fear
9709,12933,"It's more that 

TT: Show me once you have your token.",10/9/20,0.5,0.5,0.0,1.0,0.0,0.0,joy
9712,12936,"I agree damage is already done, just saying that at our current stage it's still possible to rollback but if the law gets passed we're pretty screwed (since trying to repeal a PAP passed law through a PAP supermajority is lulz).",10/9/20,0.08333333333333333,0.7999999999999999,0.138,0.732,0.13,-0.09,joy
9716,12940,Just because he says there are Singaporeans paying full price doesn't mean everyone is doing it.,10/9/20,0.01874999999999999,0.61875,0.0,1.0,0.0,0.0,anger
9718,12942,"You clearly do not understand economics and asset enhancement and you are trying to act smart, but still offended when you have been called out.",10/9/20,0.08214285714285713,0.513095238095238,0.086,0.725,0.188,0.2382,anger
9719,12943,Are Lee Kuan Yew's words holding true?,10/9/20,0.35,0.65,0.0,0.682,0.318,0.4215,fear
9721,12945,"One qn I have is, once COVID19 blows over and I delete the app/remove permissions - will it be comepletely removed from my mobile and close the doors on any potential dataflow from that point onwards?",21/3/20,0.0,1.0,0.0,1.0,0.0,0.0,fear
9722,12946,"Given the number of data leaks in recent months from health records to blood donator data, it is not far fetched for people to be worried about such apps and data collection.",21/3/20,-0.016666666666666666,0.5833333333333334,0.066,0.896,0.039,-0.2263,fear
9729,12953,Is the code open source?,21/3/20,0.0,0.5,0.0,1.0,0.0,0.0,fear
9734,12958,"""9I8VPeQeWDofj39c8dPySoUXLqh2"" It is not possible, or at least, computationally extraordinarily difficult to break this hash without a password that only MOH has.",21/3/20,-0.2,0.85,0.111,0.889,0.0,-0.3612,fear
9736,12960,No one cares enough about you to do all that.,21/3/20,0.0,0.5,0.167,0.606,0.227,0.2023,joy
9737,12961,Lmao.,21/3/20,0.6,1.0,0.0,0.0,1.0,0.5994,fear
9742,12966,"OP also replied to one of the comments by saying "" There isn't anything inherently scary about bluetooth"".",21/3/20,-0.5,1.0,0.0,0.859,0.141,0.3875,fear
9746,12970,You have to be within bluetooth range and you have to handshake with the right authentication or permission for bluetooth access.,21/3/20,0.2857142857142857,0.5357142857142857,0.0,1.0,0.0,0.0,joy
