,index,Sentences,Comment Datetime,Textblob_polarity_score,Textblob_subjectivity_score,Vader_neg_score,Vader_neu_score,Vader_pos_score,Vader_compound_score,Emotions
16,18,SG is the easiest place to roll out such things yet still can screw up so badly Ya How many did Salty Dragon slap for tgis farce This is the opportunity for Salty Lizard to shine,3/6/21,-0.14999999999999997,0.5416666666666666,0.168,0.671,0.161,-0.0754,anger
19,24,"Yeah when I went to collect, the girl told me the battery will die out in 4-6mths (not sure what factors affect the battery life).",3/7/21,-0.25,0.8888888888888888,0.133,0.714,0.153,-0.1027,fear
21,26,"Honestly I\x92ve better things to do with my time then to queue, hoping they\x92re open or have tokens for me to collect.",3/7/21,0.3666666666666667,0.6333333333333333,0.0,0.686,0.314,0.8271,anger
25,30,This kind of innovation so useless.... simi trace with bluetooth... u know how many pings u will get just by taking the MRT?,3/7/21,0.19999999999999998,0.5333333333333333,0.0,0.897,0.103,0.3197,fear
27,32,Bluetooth is not designed to be used like this... but some scholar thinks its a good idea.. Bloody stupid,3/7/21,-0.3,0.8333333333333334,0.301,0.499,0.2,-0.5927,anger
28,33,U forgot phitam whipped out his hp on parliament only to discover that most of the pap miw never switch on or carry the trace together token or app?,3/7/21,0.25,0.75,0.0,1.0,0.0,0.0,fear
33,38,"Afterall u need QR Code from tt for scanning Peasantboy wrote: Yeah when I went to collect, the girl told me the battery will die out in 4-6mths (not sure what factors affect the battery life).",3/9/21,-0.25,0.8888888888888888,0.099,0.787,0.114,-0.1027,fear
35,40,"Honestly I\u2019ve better things to do with my time then to queue, hoping they\u2019re open or have tokens for me to collect.",3/9/21,0.3666666666666667,0.6333333333333333,0.0,0.686,0.314,0.8271,anger
38,43,"usage means maybe 60% take liao and keep using, so every mall that has entrants, 90% of them using these token to enter, not safe entry app.. its the repeat usage that is counted for entries (90%), not the % of the population that has the token.. Word play here must read n analyse carefully... these MSM /  white scums like to do these stunts to boost their ratings...",27/2/21,-0.11666666666666665,0.5,0.033,0.861,0.106,0.6362,anger
42,47,"About 4.7 million residents have the TraceTogether app or have collected the TraceTogether tokens, and this has allowed the authorities to shave days off the contact tracing process, said Minister-in-charge of the Smart Nation initiative Vivian Balakrishnan in Parliament on Friday (Feb 26).",26/2/21,0.21428571428571427,0.6428571428571429,0.0,0.94,0.06,0.4019,joy
49,54,This download number indicated in Playstore simply refers to the number of times the app is being downloaded only right?,27/2/21,0.09523809523809523,0.6309523809523809,0.0,0.874,0.126,0.1531,anger
54,59,These people are still living in their own beliefs.,27/2/21,0.6,1.0,0.0,1.0,0.0,0.0,fear
82,98,Already sounds wrong.,27/10/20,-0.5,0.9,0.608,0.392,0.0,-0.4767,fear
83,99,"Even if the law does not apply, they can amend the law to cater for such \x93wrong\x94 doing.",27/10/20,0.0,0.5,0.0,1.0,0.0,0.0,fear
84,108,Dude why pichar lobang....  already intend to drop into my rfid safe pacsafe backpack,27/10/20,0.5,0.5,0.124,0.706,0.171,0.2023,fear
90,140,"totally agree legislate it in parliament, that is what parliament is for man",27/10/20,0.0,0.75,0.0,0.811,0.189,0.4201,anger
92,150,ya i got bring this up in the original thread can this device be used to track us and prosecute us in other matters?,27/10/20,0.125,0.5625,0.103,0.766,0.13,-0.0772,anger
93,151,"honestly it should not be used even for tracking robbery or fights or murder.......... (of course it can, im talking about the legality) this type of thing if in Taiwan or US or HK, they need to legislate this and inform whether it will be used for purposes other than COVID tracing",27/10/20,0.2375,0.6375,0.048,0.898,0.054,0.0772,anger
94,152,defnull wrote: ya i got bring this up in the original thread can this device be used to track us and prosecute us in other matters?,27/10/20,0.125,0.5625,0.096,0.783,0.121,-0.0772,anger
95,153,"honestly it should not be used even for tracking robbery or fights or murder.......... (of course it can, im talking about the legality) this type of thing if in Taiwan or US or HK, they need to legislate this and inform whether it will be used for purposes other than COVID tracing becoz we aint in a real democracy",27/10/20,0.225,0.525,0.044,0.908,0.049,0.0772,anger
97,157,"honestly it should not be used even for tracking robbery or fights or murder.......... (of course it can, im talking about the legality) this type of thing if in Taiwan or US or HK, they need to legislate this and inform whether it will be used for purposes other than COVID tracing No parliamentary debate at that time",27/10/20,0.2375,0.6375,0.078,0.874,0.048,-0.2263,anger
106,167,"I won't be surprised if TS will be in the news soon, together with the one who suggested tempering (another thread) U this xinjiao govt lackey u threatening sinkie jin satki We pay ur salary okay",28/10/20,0.3,0.7,0.173,0.776,0.051,-0.5523,fear
107,168,fapperoo wrote: defnull wrote: ya i got bring this up in the original thread can this device be used to track us and prosecute us in other matters?,1/8/21,0.125,0.5625,0.09,0.797,0.113,-0.0772,anger
108,169,"honestly it should not be used even for tracking robbery or fights or murder.......... (of course it can, im talking about the legality) this type of thing if in Taiwan or US or HK, they need to legislate this and inform whether it will be used for purposes other than COVID tracing No parliamentary debate at that time Up this Thread as topic has become very relevant now.",1/8/21,0.33166666666666667,0.7583333333333333,0.067,0.892,0.041,-0.2263,anger
111,192,"Hey, bro.....u overthinking lah whad Faraday's Cage pouch if u are doing anything illegal man.... Why the hell would you be bringing yr tracetogether token along  or turn on your bluetooth on yr tracetogether hp app lol just saying lah",1/8/21,0.15000000000000002,0.6,0.174,0.766,0.06,-0.7506,fear
112,201,IF the ah mah can be jailed 6 months for not telling where she went... (esp to meet the ah gong)... then ... your faraday's cage pounch will make you a criminal because u intentionally obfuscate your location...and tracetogether token can collect criminal information,1/8/21,-0.4,0.55,0.208,0.792,0.0,-0.875,anger
113,210,"Hey, bro.....u overthinking lah whad Faraday's Cage pouch if u are doing anything illegal man.... Why the hell would you be bringing yr tracetogether token along to commit a crime or even turn on your bluetooth on yr tracetogether hp app lol Use yr brain...just saying lah",1/8/21,0.15000000000000002,0.6,0.206,0.705,0.088,-0.8271,fear
116,225,"I won't be surprised if TS will be in the news soon, together with the one who suggested tempering (another thread) Great, more people like you spouting ********.",1/9/21,0.4666666666666666,0.7166666666666667,0.051,0.737,0.211,0.7361,joy
127,244,"Instead of helping end the covid, dotards find ways to sabo everyone in the name of \x93freedom\x94, totally like the mob supporters of trump.",1/9/21,0.0,0.75,0.0,0.727,0.273,0.7841,anger
131,248,"Better don't use smart phone, don't use mobile phone, don't use internet.",1/9/21,0.35714285714285715,0.5714285714285714,0.149,0.66,0.191,0.1635,anger
132,249,Better don't come out at all.,1/9/21,0.5,0.5,0.0,0.633,0.367,0.4404,anger
133,250,Because you are so important that government bothers to track what u eat and when u ****.,1/9/21,0.4,1.0,0.105,0.757,0.138,0.1447,anger
141,270,i mean one that the authorities can check my point is.. there is not so many IFs in the world crimes are solved with or without TT for centuries.,1/9/21,0.09375,0.59375,0.0,0.928,0.072,0.2732,fear
157,296,fapperoo wrote: Dude why pichar lobang....  already intend to drop into my rfid safe pacsafe backpack thank you for your advise.,1/10/21,0.5,0.5,0.082,0.706,0.212,0.5106,joy
160,299,sizzy6 wrote: i mean one that the authorities can check my point is.. there is not so many IFs in the world crimes are solved with or without TT for centuries.,1/10/21,0.09375,0.59375,0.0,0.932,0.068,0.2732,joy
161,300,"at least there has not been a case where it couldnt be solved without TT The difference is, videos from cctv and data from TT convey different sensitivities of information.",1/10/21,-0.15,0.5,0.061,0.939,0.0,-0.2057,fear
164,304,You are debating on wrong points seriously.,1/10/21,-0.41666666666666663,0.7833333333333333,0.49,0.51,0.0,-0.5859,anger
166,306,I am saying if one were to stop spf from using data inside tt to investigate a serious crime then he'll be a fool.,1/10/21,-0.3333333333333333,0.6666666666666666,0.368,0.632,0.0,-0.836,anger
167,309,If ur loved one got murdered means u got something to do with it... U think whole street everyone so free go murder someone so valuable to u?,1/10/21,0.4333333333333333,0.6666666666666666,0.223,0.501,0.275,0.2893,fear
168,310,This stupid fallacy is same as the cpf logic of ah peh take cpf money will go spend in Batam on indo chickens... Govt might as well ask everyone work from home until virus gone because what if one day ur loved ones kena virus and died because he/she went out on a trip to work/dinner...,1/10/21,-0.033333333333333326,0.6416666666666667,0.109,0.797,0.094,-0.25,anger
169,311,blasterlord2 wrote: You are debating on wrong points seriously.,1/10/21,-0.41666666666666663,0.7833333333333333,0.407,0.593,0.0,-0.5859,anger
170,314,"Wow, ownself post fallacious arguments yet this retarded blasterlord2 wants to tell others that they are wrong.",1/10/21,-0.25,0.7000000000000001,0.361,0.494,0.144,-0.6908,anger
171,315,You are already wishing for people to die when you hope that such an act of murder was to happen just to prove your point through emotional appeals.,1/10/21,0.0,0.575,0.226,0.605,0.168,-0.6369,fear
173,317,"And now you're using the ambiguous definition of ""serious crime"" to smoke your way out.",1/10/21,-0.3333333333333333,0.6666666666666666,0.27,0.73,0.0,-0.5859,anger
175,319,Only retarded fool like blasterlord2 will willingly give up this responsibility of their own lives to others for them to abuse and misuse.,1/10/21,0.012499999999999983,0.8875,0.334,0.588,0.077,-0.8519,anger
176,320,"If SPF is that great, the Parti-Liew case wouldn't have escalated into such a fiasco and PR disaster for the authorities.",1/10/21,0.4,0.625,0.26,0.596,0.144,-0.5106,anger
177,321,And you want to give them more tools to abuse and misuse without ever fixing the underlying bias the authorities have?,1/10/21,0.5,0.5,0.233,0.715,0.052,-0.6771,anger
178,322,"marktan4422 wrote: TT is never safe from virus The question here isn't about virus or pandemic control....but rather about TRUST, which sadly has quickly evaporated just like alcohol-based hand sanitiser when Government backtrack on its earlier assurance that TT is only for contact tracing ....Frankly I am shocked with this about turn less than 6 months after GE.",18/1/21,-0.18333333333333335,0.6238095238095237,0.109,0.714,0.177,0.6835,fear
179,323,"8 Jun 2020 - Balakrishnan said, \u201c(The) TraceTogether app, TraceTogether running on a device, and the data generated (are) purely for contact tracing.",18/1/21,0.21428571428571427,0.5,0.0,1.0,0.0,0.0,fear
185,329,"Manthink wrote: The question here isn't about virus or pandemic control....but rather about TRUST, which sadly has quickly evaporated just like alcohol-based hand sanitiser when Government backtrack on its earlier assurance that TT is only for contact tracing ....Frankly I am shocked with this about turn less than 6 months after GE.",18/1/21,-0.17222222222222225,0.6444444444444445,0.083,0.719,0.198,0.7925,fear
186,330,"8 Jun 2020 - Balakrishnan said, \x93(The) TraceTogether app, TraceTogether running on a device, and the data generated (are) purely for contact tracing.",18/1/21,0.21428571428571427,0.5,0.0,1.0,0.0,0.0,fear
189,333,Not going to scare anyone...Just take note of CPC's Act 40 effective from 2 Jan 2021....So best to refer to AGC official site what CPC covers and how it empowers the police.,18/1/21,0.8,0.55,0.0,0.738,0.262,0.8729,fear
191,335,"The police officer or authorised person referred to in subsection (1) shall be entitled to \u2014 (a)\taccess any information, code or technology which has the capability of retransforming or unscrambling encrypted data into readable and comprehensible format or text for the purposes of investigating the arrestable offence;",18/1/21,0.4,0.7,0.045,0.913,0.043,-0.0258,fear
193,337,Such devices is not just our mobile phones or laptops which we spend our $ to own and run....as long as the device can log and transmit our activity is suffice.,18/1/21,0.18333333333333332,0.6333333333333333,0.0,1.0,0.0,0.0,fear
195,339,Welcome to Big Brother 2021.,18/1/21,0.4,0.5,0.0,0.571,0.429,0.4588,joy
196,340,gravity_infinity wrote: any pouch that has the rfdi protection should be enough how much for this kind of pouch?,18/1/21,0.26666666666666666,0.5333333333333333,0.0,1.0,0.0,0.0,anger
200,344,Manthink wrote: Not going to scare anyone...Just take note of CPC's Act 40 effective from 2 Jan 2021....So best to refer to AGC official site what CPC covers and how it empowers the police.,2/3/21,0.8,0.55,0.0,0.751,0.249,0.8729,fear
202,348,"Just that there's no data to access The word "" obstructs "" under Section 40 is very vague at best, or all-encompassing at worst...AGC can easily widen this definition in any prosecution.",2/3/21,0.2611111111111111,0.5944444444444444,0.182,0.642,0.176,0.1952,fear
211,357,"Too lazy to keep checking the app permissions (goal post keeps shifting, remember?)",2/3/21,-0.25,1.0,0.172,0.828,0.0,-0.3612,anger
214,368,"blasterlord2 wrote: The difference is, videos from cctv and data from TT convey different sensitivities of information.",2/12/21,0.0,0.6,0.0,1.0,0.0,0.0,joy
215,370,You just killed your own point of argument.,2/12/21,0.19999999999999998,0.5,0.538,0.462,0.0,-0.7906,anger
216,371,You are saying TT data are not sensitive compared to CCTVs and various other forms of survellance.,2/12/21,-0.05833333333333333,0.5916666666666667,0.0,1.0,0.0,0.0,anger
223,386,XiaoJinLing wrote: I thought only moh (or spf) can extract and view?,31/1/21,0.0,1.0,0.0,1.0,0.0,0.0,fear
233,397,I believe a student working on a class assignment would have known how to better handle these sensitive data,31/1/21,0.3,0.7,0.0,0.838,0.162,0.4404,anger
236,400,why the f is data put into excel file which can be easily passed around?,2/1/21,0.43333333333333335,0.8333333333333334,0.0,0.69,0.31,0.6597,joy
239,403,and somemore got full address!!!,2/1/21,0.68359375,0.55,0.0,1.0,0.0,0.0,joy
248,412,Any data shared with the Ministry of Health (MOH) will be used for contact tracing persons possibly exposed to COVID-19.,2/1/21,0.0,1.0,0.06,0.829,0.111,0.2732,anger
251,415,They are substituted by a random permanent ID.,2/1/21,-0.5,0.5,0.0,1.0,0.0,0.0,anger
259,423,Don't be so stupid and believe everything they deliberately show u.,2/1/21,-0.7999999999999999,1.0,0.304,0.696,0.0,-0.656,anger
263,427,I saw a primary key.,2/1/21,0.2,0.75,0.0,1.0,0.0,0.0,fear
270,434,not enough time/manpower to filter lor.. contact tracing more impt,2/1/21,0.25,0.5,0.0,1.0,0.0,0.0,fear
273,437,"Ok this shop owner, so many people buy things from them and catch all those who didn't use the tt also?",2/12/21,0.5,0.5,0.0,0.901,0.099,0.296,anger
284,448,Of course you can say that you can't tell if the TT still in good condition.,2/12/21,0.7,0.6000000000000001,0.0,0.838,0.162,0.4404,anger
287,451,If it\x92s solely to be used as contact tracing then the chances r higher.,2/12/21,0.25,0.5,0.0,0.87,0.13,0.2023,joy
299,464,Lol do you have money that the govt owes you?,2/12/21,0.8,0.7,0.0,0.763,0.237,0.4215,anger
302,467,When reach certain points got $5 ntuc vouchers.,2/12/21,0.21428571428571427,0.5714285714285714,0.0,0.652,0.348,0.296,anger
309,475,\u27a1\u27a1 Effective contact tracing is an important enabler to ringfence community transmission.,2/12/21,0.5,0.9,0.0,0.671,0.329,0.5994,fear
318,484,She was placed on quarantine at a dedicated facility on 10 February when Case 60138 was confirmed to have COVID-19 infection.,2/12/21,0.4,1.0,0.0,0.864,0.136,0.4588,joy
324,490,Let's do the right thing.,2/12/21,0.2857142857142857,0.5357142857142857,0.0,1.0,0.0,0.0,joy
328,494,I think may chut funny pattern again what can apply to them cannot apply to u....,13/2/21,0.25,1.0,0.0,0.828,0.172,0.4404,fear
331,497,"As long as they never check in those places requiring TT, they didnt do anything wrong.",2/12/21,-0.275,0.65,0.0,0.855,0.145,0.3724,anger
333,499,Y only local under this?,2/12/21,0.0,0.5,0.0,1.0,0.0,0.0,fear
335,501,This time for a start already stewpig enough to not continue... design problem.,2/12/21,0.0,0.5,0.0,0.83,0.17,0.3089,anger
338,504,If it\u2019s only for covid n sole purpose then ok. To have all other things r just making things complicated why they didn\u2019t take a back step n think of whole pic,2/12/21,0.010714285714285716,0.5035714285714286,0.0,0.925,0.075,0.296,fear
342,508,"(nearly 80%) Also, quite a fair number of tokens already out of batt (3 in my own, sister's and my parents family already).",2/12/21,0.4666666666666666,0.7666666666666666,0.0,0.827,0.173,0.489,fear
346,512,Must be keep hallucinating tat government want to check on them like they are important people in the society.,2/12/21,0.4,1.0,0.0,0.741,0.259,0.5574,anger
347,513,"Plow98 wrote: PAP dropping ball Chewing gum, littering, smoking, spitting, drink beer wrong time, kick ball in playground, big happy family gathering, no mask ...  all kenna fine.",2/12/21,0.1791666666666667,0.625,0.152,0.69,0.158,0.0516,joy
357,523,"Of coz we cant say for certain, but the risk is always there.",2/12/21,0.21428571428571427,0.5714285714285714,0.269,0.731,0.0,-0.4691,fear
358,524,And looks like it is high risk.,2/12/21,0.16,0.5399999999999999,0.219,0.521,0.26,0.1027,fear
371,537,"As think more, if not most people are covered by these measures, rather than not.",2/12/21,0.125,0.5,0.0,1.0,0.0,0.0,fear
372,538,"For think from certain perspectives see, to greater extent perhaps, with the making of many places needing the app or token to access, its somewhat implied, don't need to be so explicit about it.",2/12/21,0.4047619047619048,0.5238095238095238,0.0,0.874,0.126,0.5574,fear
373,539,"Don't have these many people cannot go that many places also, especially places where there are concentrated public presence.",2/12/21,0.25,0.5166666666666667,0.0,1.0,0.0,0.0,anger
374,540,"In that respect, given the inconvenience, think those that don't have these usually don't go far and/or don't come in contact with that many places or people also.",2/12/21,0.3,0.75,0.079,0.823,0.098,0.1531,fear
375,541,Thus is a different kind of lesser risk.,2/12/21,0.19999999999999998,0.6666666666666666,0.259,0.741,0.0,-0.2732,joy
379,545,The design of tt already flawed to begin with...,2/12/21,-0.5,0.5,0.0,1.0,0.0,0.0,fear
385,556,To make things complicated..  they use it for other things like spf pple dun wan to use liao ...  blame who?,2/12/21,-0.27499999999999997,0.5083333333333333,0.1,0.795,0.105,0.0258,anger
388,559,110k and less than 50 death is a tremendous result.,2/12/21,0.08333333333333333,0.5333333333333333,0.312,0.688,0.0,-0.5627,fear
391,562,Dun tell me is unexpected when they decided to do that.,2/12/21,0.1,1.0,0.0,1.0,0.0,0.0,fear
399,570,"For most of us here who stake out every Covid-19 thread at HWZ, we get updated from the sharing and would check the locations.",2/12/21,0.5,0.5,0.0,0.891,0.109,0.4215,fear
402,573,I am supportive of the TT token but since when has they made it mandatory.,2/12/21,0.5,1.0,0.0,0.797,0.203,0.2617,anger
403,574,I don\x92t think it is right to shame them when it has not been made mandatory,2/12/21,0.2857142857142857,0.5357142857142857,0.25,0.75,0.0,-0.5142,anger
407,578,"WussRedXLi wrote: Of coz we cant say for certain, but the risk is always there.",2/12/21,0.21428571428571427,0.5714285714285714,0.238,0.762,0.0,-0.4691,fear
412,591,Lol,2/12/21,0.8,0.7,0.0,0.0,1.0,0.4215,fear
415,594,"Also what's the point of carrying token, still most shops don't have the scanner.",2/12/21,0.5,0.5,0.0,1.0,0.0,0.0,anger
418,599,"Many shops still dont have the scanner, just enter as u please with QR code at entrance.",2/12/21,0.5,0.5,0.0,0.867,0.133,0.3182,joy
422,603,Safe Entry via browser or app.,2/12/21,0.5,0.5,0.0,0.633,0.367,0.4404,fear
423,607,"Didn't say you other than this must carry this thing... some foreigners may not to use this... Yup, compulsory only for check-in, not mandatory to bring that damn thing around.",2/12/21,-0.0625,0.6875,0.123,0.877,0.0,-0.4445,anger
424,608,icyflame wrote: I am supportive of the TT token but since when has they made it mandatory.,2/12/21,0.5,1.0,0.0,0.821,0.179,0.2617,anger
429,613,"THUS, quickly get those tokens out so EVERYBODY can get one, AND make them more manageable-size not buibui like tamagotchi!",2/12/21,0.47916666666666663,0.5,0.112,0.888,0.0,-0.3404,fear
435,619,"We who don't bring it out with us all the time should be frowned upon, especially if you're blaming this father & son for not having theirs.",2/12/21,0.0,1.0,0.122,0.878,0.0,-0.5367,anger
440,625,"Yup, compulsory only for check-in, not mandatory to bring that damn thing around.",2/12/21,0.0,1.0,0.263,0.737,0.0,-0.4445,anger
445,643,How difficult is it to lose 2% of phone battery life over say 6 hours?,2/12/21,-0.5,1.0,0.302,0.698,0.0,-0.6369,fear
450,648,The battery seemed to have gotten exhausted since first use.,2/12/21,-0.07500000000000001,0.5166666666666666,0.217,0.783,0.0,-0.3612,joy
451,649,Could the vendor have provided lousy battery or the TT token is high draining?,2/12/21,-0.16999999999999998,0.52,0.212,0.788,0.0,-0.5423,fear
456,654,SkyNinja wrote: Make it illegal if didn't bring TT token with working battery lor.,2/12/21,-0.5,0.5,0.217,0.783,0.0,-0.5574,anger
459,657,"And outside, the light is not easy to see.",2/12/21,0.061111111111111116,0.5277777777777778,0.231,0.769,0.0,-0.3412,fear
462,665,"If the govt did not do their part  mass testing, banning flights and people coming from high risks areas, why should we do our part to help them cover their asses?",2/12/21,0.16,0.5399999999999999,0.062,0.858,0.08,0.1531,anger
466,675,Got a lot of ppl dun trust TT after the police access thing Spent million on stupid fancy tech but no one uses it.,2/12/21,-0.44999999999999996,0.55,0.184,0.737,0.079,-0.431,anger
480,695,It's a good time to replace with the slimmer and smaller TT.,2/12/21,0.35,0.55,0.0,0.775,0.225,0.4404,joy
484,699,Don't need to return to own CC in case they're still distributing the buibui ones?,2/12/21,0.6,1.0,0.0,1.0,0.0,0.0,anger
486,705,I don't want to have latest version with latest firmware version etc.,2/12/21,0.5,0.9,0.109,0.891,0.0,-0.0572,anger
494,713,"Using TT doesn't stopped visitors from coming, only incumbent can put in measures to stop visitors from coming.",13/2/21,0.0,1.0,0.111,0.805,0.084,-0.1366,anger
495,714,TT at most is mitigate the effect after it has happened.,13/2/21,0.5,0.5,0.0,1.0,0.0,0.0,fear
497,716,It's nearly/barely 4 months and the battery is already weak?,2/3/21,-0.375,0.625,0.266,0.734,0.0,-0.4404,fear
503,722,middleclass wrote: They change battery only or change a whole new TT token for you?,2/3/21,0.11212121212121212,0.6181818181818182,0.0,1.0,0.0,0.0,joy
507,732,Like this also utterly shocked beyond belief,2/3/21,-0.7,0.8,0.257,0.495,0.248,-0.024,joy
521,753,"The one I originally got, they pulled out a plastic tab before giving me.",2/3/21,0.375,0.75,0.0,0.821,0.179,0.34,fear
522,754,I believe the battery started working only when they pulled out the tab.,2/3/21,0.0,1.0,0.0,1.0,0.0,0.0,anger
541,789,just need the bar code to gain entry nia ma U think this is some kind of delivery order need to send to your house?,2/3/21,0.6,0.9,0.0,0.871,0.129,0.5267,fear
542,797,Drama leh.......utterly shocked beyond belief......lol,2/3/21,-0.7,0.8,0.365,0.635,0.0,-0.3182,fear
546,801,"locksleychang wrote: The one I originally got, they pulled out a plastic tab before giving me.",2/3/21,0.375,0.75,0.0,0.844,0.156,0.34,fear
551,808,Now my token ok. U gotta be kidding bro.,2/4/21,0.5,0.5,0.0,0.625,0.375,0.3818,fear
552,809,"They said it's ""free"", but yet u insist of paying because u claim to be afraid of getting covid at CC.",2/4/21,-0.09999999999999998,0.8500000000000001,0.0,1.0,0.0,0.0,fear
553,810,"Then the battery shop that u went to, u think that shop is free from covid?",2/4/21,0.4,0.8,0.0,0.798,0.202,0.5106,fear
557,814,"the light is under the cover, it blinks green .",2/4/21,0.1,0.5,0.0,1.0,0.0,0.0,fear
559,816,i just saw it blink once only then stop for a long time.,2/4/21,-0.025,0.7,0.18,0.82,0.0,-0.296,joy
563,820,not gonna sit around and stare like an idiot.,2/4/21,-0.8,0.8,0.258,0.547,0.195,-0.2023,fear
565,822,"When u drive and stop at red light, u can wait for 1 minute like an idiot for the light to change to green right?",2/4/21,0.014285714285714282,0.5059523809523809,0.204,0.704,0.093,-0.4588,fear
573,830,The battery compartment is clearly marked behind the token.,2/4/21,-0.15000000000000002,0.6499999999999999,0.0,0.748,0.252,0.4019,fear
575,832,"In fact, the battery compartment is also fairly easily assessed in the first generation token.",2/4/21,0.3416666666666667,0.5833333333333334,0.0,0.854,0.146,0.34,joy
578,835,Actually is a good thing then?,2/4/21,0.7,0.6000000000000001,0.0,0.58,0.42,0.4404,joy
587,844,"If need to go visit to change the token every 6 months or lesser, might as pack in FOC swab test or whatever test during the collection for a peace of mind.",2/4/21,0.0,0.5,0.0,0.892,0.108,0.5423,fear
588,852,you should be happy i wished mine just turn dead just immediately.,2/4/21,0.30000000000000004,0.7,0.253,0.529,0.218,-0.1531,joy
