,index,Sentences,Comment Datetime,Textblob_polarity_score,Textblob_subjectivity_score,Vader_neg_score,Vader_neu_score,Vader_pos_score,Vader_compound_score,Emotions
12884,16215,"> 
In addition, shoppers at Phoon Huat and Redman outlets will also be allowed only 10 minutes to shop.",24/4/20,0.0,1.0,0.0,1.0,0.0,0.0,fear
12885,16216,"> On top of that, no cash and no change will be available; only contactless payment methods are available.",24/4/20,0.325,0.575,0.208,0.708,0.085,-0.3818,anger
12888,16219,Dude people are baking like mad.,24/4/20,-0.625,1.0,0.33,0.412,0.258,-0.1779,anger
12890,16221,"Well I've always loved going to phoon huat/redman, firstly they have a pretty wide variety of ""ang moh"" pantry ingredients that are actually pretty good quality for their price.",24/4/20,0.3416666666666666,0.6888888888888888,0.0,0.601,0.399,0.936,joy
12894,16225,Sadly I haven't gone there since before the announcement of the CB because the queues have been horrendous.,24/4/20,-0.5,1.0,0.306,0.694,0.0,-0.765,fear
12895,16226,"I know they sell nice dried pasta and some outlets sell eggs, but I guess people expect to be baking a lot more at home, hence the long queues.",24/4/20,0.21249999999999997,0.625,0.0,0.929,0.071,0.2263,joy
12896,16227,"Kinda looking forward to this restriction of it means queues will be shorter, my sourdough started that I've been cultivating for more than a year needs to be fed with flour, and I'm running out...",24/4/20,0.5,0.5,0.067,0.933,0.0,-0.3346,anger
12897,16228,"I see it as a good thing, you know.",24/4/20,0.7,0.6000000000000001,0.0,0.674,0.326,0.4404,joy
12899,16230,"Personally I use it primarily because from what I understand, it's a very ethical company, and they treat their employees well and empower them in company decisions.",25/4/20,0.22,0.5266666666666667,0.0,0.714,0.286,0.8122,anger
12908,16239,I'm pretty upset at the idea of having to out myself as trans every time I go to NTUC.,1/5/20,0.25,1.0,0.119,0.734,0.147,0.1531,fear
12912,16243,"> # NRIC required to enter all 148 FairPrice outlets for contact tracing purposes

> Starting April 27, visitors to all 148 FairPrice outlets will be required to provide their NRIC numbers upon entry, a FairPrice spokesperson confirmed with Mothership.",30/4/20,0.2,0.55,0.0,1.0,0.0,0.0,joy
12913,16244,"> Visitors can either present their NRIC card for scanning or they will be asked to scan a QR code with their phone and sign in with SingPass, or manually key in particulars via the government-developed SafeEntry check-in system.",30/4/20,0.0,0.5,0.0,1.0,0.0,0.0,joy
12918,16249,"The latest initiative to facilitate contact tracing at our stores is in compliance with the latest precautionary measures set by the authorities.""",30/4/20,0.5,0.9,0.0,1.0,0.0,0.0,joy
12923,16254,"Yeah wtf first time requiring IC and the worker took it out of my hands to scan it, like I can just hold it...",30/4/20,-0.125,0.6666666666666666,0.133,0.702,0.165,-0.0258,fear
12925,16256,They might lighten the restrictions after the original CB's end date to see how things goes.,30/4/20,0.375,0.75,0.0,0.867,0.133,0.3182,joy
12928,16259,just provide the number for the person to key in.,3/5/20,0.0,1.0,0.0,0.874,0.126,0.0772,anger
12936,16267,Singapore has the highest number of CONFIRMED cases.,30/4/20,0.4,1.0,0.0,0.843,0.157,0.0772,fear
12943,16274,Look at all the apologists out in full swing.,30/4/20,0.35,0.55,0.0,1.0,0.0,0.0,joy
12944,16275,"This is not a case of singapore being a little worse than everyone else where some difference of fudging numbers by other countries is acceptable

Singapore is the worst in south east asia, by a very significant margin, even compared to countries where testing is done properly.",30/4/20,-0.20416666666666664,0.5958333333333333,0.135,0.78,0.086,-0.5445,anger
12951,16282,Or are you going to accuse them of not testing enough either?,30/4/20,0.0,0.5,0.141,0.859,0.0,-0.2023,anger
12952,16283,This is a typical fallacy called whataboutism I see from people trying to defend the indefensible.,30/4/20,-0.16666666666666666,0.5,0.0,1.0,0.0,0.0,anger
12953,16284,"The only argument you have left is ""oh well its only limited to foreign workers, singaporeans are safe"" and believe me, you do not want to even attempt to pull that kind of BS argument on me

So moral of the story, Stop being an apologist and just admit they fucked up

&#x200B;

Downvoters: Go ahead and refute any point I made in this post with evidence/proof or GTFO, you're just a crying baby.",30/4/20,0.01035714285714286,0.5217857142857143,0.206,0.716,0.079,-0.8756,anger
12955,16286,> Now I'm not gonna deny that the govt did fuck up with regards to the situation in the dorms right now.,1/5/20,-0.05714285714285716,0.5678571428571428,0.143,0.774,0.083,-0.3536,fear
12957,16288,Yes we did have a chance to do something about that before shit hit the fan.,1/5/20,-0.2,0.8,0.167,0.509,0.324,0.34,anger
12965,16296,The most likely reason the number of cases are so low in those countries is because THEY HAVE LOWER CASES.,1/5/20,0.16666666666666666,0.6,0.237,0.709,0.054,-0.6569,anger
12969,16300,What matters is we have a statistically significant number of total tests carried out.,1/5/20,0.1875,0.8125,0.0,0.704,0.296,0.296,anger
12973,16304,"I eagerly await to read your findings

Your narrative of not being allowed to criticise them because ""oh they can't be perfect, look at how hard they are trying"" is completely disingenuous.",1/5/20,0.26944444444444443,0.6472222222222221,0.196,0.697,0.107,-0.5103,anger
12974,16305,They are the most highly paid government on earth.,1/5/20,0.33,0.52,0.0,1.0,0.0,0.0,anger
12977,16308,Your whitewashing is undermining genuine efforts to do so,1/5/20,0.4,0.5,0.238,0.762,0.0,-0.3612,joy
12983,16314,"TBH tho, SingPass used to be a nightmare (through my own fault) cos it wasn't that widely used (yet).",26/10/20,0.25,0.7,0.0,1.0,0.0,0.0,anger
12986,16317,I'm really mostly impressed with the app ever since we had to use it cos of COVID.,26/10/20,1.0,1.0,0.0,0.826,0.174,0.5233,anger
12987,16318,I haven't had to reset a password since graduating but I believe you don't have to go through the painful waiting of a mailer for it anymore.,26/10/20,-0.7,0.9,0.149,0.851,0.0,-0.5927,anger
12991,16322,"In those places, you don't *have* to get an ID card once you turn a certain age.",26/10/20,0.21428571428571427,0.5714285714285714,0.0,0.877,0.123,0.2732,fear
12997,16328,"Identity is theft is an issue in many countries, especially the US precisely because of the lack of unified ID.",26/10/20,0.3,0.7666666666666666,0.1,0.786,0.114,0.0772,fear
13002,16333,Singapore having civil SSO is fucking fantastic.,26/10/20,0.4,0.9,0.0,0.606,0.394,0.5984,fear
13004,16335,Australia is one such place and we have an equivalent to SingPass called MyGov.,26/10/20,0.0,0.5,0.0,1.0,0.0,0.0,fear
13007,16338,"So while not as user friendly at the start, such things do exist in countries like what you mentioned.",26/10/20,0.1875,0.5,0.119,0.768,0.113,-0.033,anger
13013,16344,Basically don't lose it and you should make sure no one has access to it without permission.,26/10/20,0.5,0.8888888888888888,0.106,0.674,0.22,0.3309,anger
13014,16345,Source: bloody bored and read about it while serving my PNS duty,26/10/20,-0.65,0.95,0.333,0.667,0.0,-0.6124,anger
13016,16347,"I have not carried my IC out for many years TBH..nothing happened so far and with the IC embedded inside the app (and recently with photo updated inside), it's easier for me

>Holders of an NRIC are responsible for the card's custody but are not required to carry the card on their person.",26/10/20,0.2,0.575,0.0,0.934,0.066,0.3716,anger
13017,16348,"Areas that will require NRICs to be verified include passports (immigration officers), polling stations (police officers) and those who undergo National Service in Singapore's Armed Forces, police force and civil defence force.Notwithstanding this, if no identification can be produced the police may detain suspicious individuals until such identification can be produced either in person or by proxy.",26/10/20,0.0,0.5,0.121,0.856,0.023,-0.7269,fear
13024,16355,"From the point of view of Americans, it's slightly different.",26/10/20,0.0,0.6,0.0,1.0,0.0,0.0,anger
13028,16359,"They can go Jason Bourne and live ""off the grid"".",26/10/20,0.13636363636363635,0.5,0.0,1.0,0.0,0.0,fear
13042,16373,The government makes ample use of that fact - its the worst of both worlds as a result.,27/10/20,-1.0,1.0,0.215,0.785,0.0,-0.6249,anger
13044,16375,It's a more nuanced thing than that.,26/10/20,0.5,0.5,0.0,1.0,0.0,0.0,joy
13055,16386,It's highly possible that you will see the National Guards fighting back at the Federal troops.,26/10/20,0.0,0.5,0.143,0.857,0.0,-0.3612,joy
13060,16391,They will only  show up to shoot if they think they can kill you.,26/10/20,0.0,1.0,0.372,0.628,0.0,-0.7964,fear
13061,16392,"What is more likely to happen in the near-term, is a popular Civil War 2.0.",26/10/20,0.3666666666666667,0.7999999999999999,0.209,0.642,0.15,-0.2732,fear
13062,16393,Guns are already drawn at highly partisan protests.,26/10/20,0.16,0.5399999999999999,0.237,0.763,0.0,-0.2911,anger
13063,16394,> It's a more nuanced thing than that.,27/10/20,0.5,0.5,0.0,1.0,0.0,0.0,joy
13064,16397,"The infantry is important in military conflict because infanteers have extremely cost effective ways to kill armour and attack helicopters, via manpads and anti-material weapons like the matador.",27/10/20,0.19375,0.7250000000000001,0.312,0.504,0.184,-0.7447,fear
13068,16401,There is a role for light infantry.,27/10/20,0.4,0.7,0.0,1.0,0.0,0.0,fear
13069,16402,"The thing is, light infantry is usually much more heavily armed than even the gun nuts of the US.",27/10/20,0.2333333333333333,0.5666666666666667,0.217,0.783,0.0,-0.5719,fear
13074,16412,"The national guard will likely come into play, but it still has little to do with the arming of civilians and the second amendment.",27/10/20,-0.0625,0.5,0.0,0.931,0.069,0.1779,fear
13080,16418,"France, a much larger country, only has ~200.",27/10/20,0.0,0.75,0.0,1.0,0.0,0.0,joy
13084,16422,No serious guerillas that live will foolishly attack a well-armed and well-coordinated combined arms column or a well dug-in light infantry platoon.,28/10/20,0.23434343434343433,0.6222222222222221,0.355,0.566,0.079,-0.743,fear
13088,16426,"The proliferation of cheap drones and masses precision directed munitions means any airfield, airstrips, surface ships, or poorly camouflaged objects are targets waiting to be destroyed.",28/10/20,0.0,0.6499999999999999,0.113,0.887,0.0,-0.4939,fear
13094,16432,"This is hilarious because SS was a way to force workers to save, and newborns aren't working.",28/10/20,0.5,1.0,0.0,0.704,0.296,0.7096,anger
13120,16460,"It's these kinds of things that worry many, especially the more discerning out there, and rightfully so.",9/6/20,0.3333333333333333,0.6666666666666666,0.153,0.847,0.0,-0.4404,fear
13122,16462,"Theres too many unknowns, and not enough safeguards, from both a technological and policy perspective.",9/6/20,0.25,0.5,0.135,0.865,0.0,-0.2584,fear
13123,16463,There are manifold concerns that remain to be addressed - and rushed implementation of something this privacy intrusive needs much more thought and debate than this is being given.,9/6/20,0.5,0.5,0.0,1.0,0.0,0.0,fear
13124,16464,"From a policy perspective, whilst the G has said that only a team of MOH officers will have access to the data and thats its protected by OSA, that doesnt mean that police and other investigative bodies cant use their investigate powers to request for the data which has been provided to MOH.",9/6/20,-0.14583333333333334,0.6875,0.0,0.944,0.056,0.4404,anger
13128,16468,This is particularly given that the Gs track record on surveillance is already questionable.,9/6/20,-0.16666666666666669,0.6666666666666666,0.145,0.855,0.0,-0.296,fear
13133,16473,"An additional consideration is that the Gs cybersecurity record is pretty poor, and data with this level of sensitivity is always going to be a nice prize for people looking to get at it.",9/6/20,0.15,0.8666666666666667,0.075,0.7,0.225,0.7351,joy
13135,16475,"To me, it isnt about that at all, but rather the potential for this to be the first step down a very dangerous path.",9/6/20,-0.1713888888888889,0.6555555555555556,0.173,0.827,0.0,-0.6798,anger
13136,16476,"Look, I agree with you that the government isn't there to track you (they have better means, trust me).",9/6/20,0.5,0.5,0.0,0.633,0.367,0.8271,anger
13147,16487,"And x5,000,000, by the way, because maybe it's only 10k devices that are rigged by the supplier (e.g.",9/6/20,0.0,1.0,0.128,0.872,0.0,-0.3612,anger
13148,16488,they knew that it would be distributed to PM/ministers or worthy targets).,9/6/20,0.3333333333333333,1.0,0.0,0.791,0.209,0.4404,anger
13154,16494,"Heck, even US cannot secure their bloody nuclear silos properly, what more SG government and this small stupid, one-off project.",9/6/20,-0.15833333333333333,0.5833333333333334,0.219,0.684,0.097,-0.4642,anger
13158,16498,"The details doesn't have to be a full github code dump, but lay out the high level principles on (1) why we need this (2) how this device works (3) how is privacy protected.",9/6/20,0.255,0.5449999999999999,0.049,0.846,0.105,0.4678,anger
13163,16503,"Not that it is workable for contact trancing, but for example If the device needs to touch a dedicated reader or press a button to register a contact share, it feels completely different.",9/6/20,0.0,0.6,0.0,0.805,0.195,0.7783,fear
13164,16504,"As much as I agree with your general sentiment,

>the device only has Bluetooth as the means of transmitting data.",9/6/20,0.08333333333333333,0.5666666666666667,0.0,0.878,0.122,0.3612,joy
13166,16506,"I don't think this has been confirmed, has it?",9/6/20,0.4,1.0,0.0,1.0,0.0,0.0,anger
13167,16507,"In the Tracetogether app, if you test positive, MOH sends you a code that allows you to upload your data to the server, presumably through data network or Wifi.",9/6/20,0.22727272727272727,0.5454545454545454,0.0,0.882,0.118,0.5574,fear
13168,16508,I would not be surprised if the device DOES have another means of transmitting data.,9/6/20,0.1,0.9,0.114,0.886,0.0,-0.1695,fear
13172,16512,"Technology, of course, isn't going to be perfect, but it shouldn't be shunned altogether.",9/6/20,1.0,1.0,0.0,0.847,0.153,0.3291,anger
13176,16516,The question has to be asked though: how secure does this entire system have to be in theory in order to convince the general population to accept this particular move?,9/6/20,0.15416666666666667,0.5145833333333334,0.0,0.794,0.206,0.7184,fear
13194,16535,"The real reason is that without your NRIC, when MOH finds out that your phone has been a close contact, they can only call your phone number.",9/6/20,0.1,0.65,0.0,0.951,0.049,0.0772,joy
13204,16545,"Nevertheless, I am ok with the NRIC link.",9/6/20,0.5,0.5,0.0,0.732,0.268,0.296,joy
13210,16551,Good to know that you agree with me.,9/6/20,0.7,0.6000000000000001,0.0,0.526,0.474,0.6597,joy
13218,16561,"Also, I noted the new feature of ""NRIC/FIN barcode feature that facilitates quick and secure check-ins at all SafeEntry locations. """,3/6/20,0.2898989898989899,0.5181818181818182,0.0,0.882,0.118,0.34,anger
13225,16568,"Sadly, this might mean that SafeEntry, which gives the government much more data on our whereabouts, would likely become more pervasive over time.",3/6/20,0.0375,0.7375,0.113,0.887,0.0,-0.4215,fear
13226,16569,The larger retailers/malls (NTUC etc) have always had the ability to scan barcode for SafeEntry.,3/6/20,0.0,0.5,0.0,0.859,0.141,0.3182,fear
13230,16573,As far as I can tell the app asks permission to request for location but does not actually requests for location data.,3/6/20,0.05,0.55,0.0,1.0,0.0,0.0,anger
13231,16574,What Im trying to bring across is that with a better user experience.,3/6/20,0.5,0.5,0.0,0.791,0.209,0.4404,joy
13234,16577,They would not need to reinvent the wheel of showing how many contacts youve came across or to add additional languages.,3/6/20,0.5,0.5,0.0,1.0,0.0,0.0,fear
13238,16581,What good does how many people youve interact with when the App stops working in 5 minutes because you forgot to place it in the foreground?,3/6/20,0.6,0.55,0.058,0.836,0.105,0.3182,anger
13243,16586,In fact it's a little bit of an overkill even to have that NRIC barcode function.,3/6/20,-0.1875,0.5,0.0,1.0,0.0,0.0,anger
13244,16587,"A typical user would only need to be onboarded, and  open it when they're contacted by MOH for contact tracing and that's pretty much the only point of contact the UI needs with its users.",3/6/20,0.04722222222222222,0.7000000000000001,0.0,0.912,0.088,0.4939,fear
13245,16588,I like the new onboarding process and I think it's a great improvement over the older versions.,3/6/20,0.36767676767676766,0.5126262626262627,0.0,0.534,0.466,0.8625,joy
13259,16602,"Which explains why they added the SafeEntry feature, so that people would use the app more often and hence increasing the priority of the app being picked up by BAR.",3/6/20,0.5,0.5,0.0,1.0,0.0,0.0,anger
13260,16603,"While this is a pretty smart way to game BAR, I think that adopting the API provided by Apple is still the way to go.",3/6/20,0.021428571428571425,0.6809523809523809,0.0,0.781,0.219,0.7096,fear
13261,16604,As it gives the developers a more fine grained control over the polling rates.,3/6/20,0.45833333333333337,0.5,0.0,0.851,0.149,0.2716,fear
13265,16608,"i'm entirely fine with safeentry because i actively do it, and i actively know that i'm ""checking in"" or ""checking out"".",6/6/20,0.049999999999999996,0.5666666666666668,0.0,0.705,0.295,0.6901,fear
13268,16611,not that i do shady shit but this seems like a severe misstep for personal privacy.,6/6/20,-0.15,0.5750000000000001,0.286,0.551,0.163,-0.3506,joy
13273,16616,"But its so stupid on 2 fronts: 

1) We already have Safe-Entry at almost all malls and places like Starbucks/McDonalds.",6/6/20,-0.7999999999999999,1.0,0.183,0.712,0.105,-0.4341,anger
13279,16622,So what is the point of making all of us wear that shit when we go out?,6/6/20,-0.2,0.8,0.184,0.816,0.0,-0.5574,fear
13280,16623,"Arbo just install barcode scanners everywhere lah, and require all to don HAZMAT suits with unique barcodes tied to our NRIC lor",6/6/20,0.375,1.0,0.0,1.0,0.0,0.0,anger
13285,16628,> one of the key questions asked in this study was whether Singaporeans would be agreeable to having their mobile phone data tracked **without** their consent in the fight against Covid-19.,7/6/20,0.0,1.0,0.076,0.787,0.137,0.2732,anger
13287,16630,"From a thread earlier awhile back, truly scary numbers to think about",7/6/20,-0.16666666666666666,0.5,0.212,0.596,0.192,-0.0772,fear
13289,16632,"This part of his reply was not elaborated on, and frankly, might never be touched on by civil servants taichi-ing such revealing questions away",6/6/20,0.0,0.5,0.0,1.0,0.0,0.0,anger
13292,16635,"You can say that  I never do anything wrong, I have nothing to be scared

But how would you feel when everything you do is made known to the party watching over you.",7/6/20,-0.5,0.9,0.0,0.847,0.153,0.6433,anger
13297,16640,"> Our current local transmission is only 3, these teams should be able to handle the volume with their existing resources.",6/6/20,0.125,0.50625,0.0,1.0,0.0,0.0,anger
13302,16645,"I believe privacy was the main motivation behind making tracetogether Bluetooth-only and open-source and IMO has contributed to the high adoption rate, so I don't see any reason they'll diverge from that.",6/6/20,-0.024444444444444453,0.5244444444444444,0.0,0.924,0.076,0.34,fear
13303,16646,Petition is stupid as fuck.,7/6/20,-0.6,0.8,0.697,0.303,0.0,-0.7845,anger
13312,16655,"If it's just a HPB steptracker kindda watch device but with TraceTogether bluetooth functionality then I can see it being a good thing, since they're relatively cheap and we can give it to the old folks who don't use smartphones.",7/6/20,0.4000000000000001,0.5,0.0,0.903,0.097,0.5927,joy
13320,16665,"But its so stupid on 2 fronts: 


Vivian balakrishnan has mentioned that Tracetogether is not compulsory because of a technological issue and not an legislative challenge.",6/6/20,-0.7999999999999999,1.0,0.203,0.797,0.0,-0.6796,anger
13321,16666,So not gonna be surprised if this is compulsory in the end,6/6/20,0.1,0.9,0.132,0.868,0.0,-0.1695,anger
13328,16674,"It can easily say, more than half of Singaporeans **do not** agree to having their phone data tracked without their consent in the fight against Covid-19.",7/6/20,0.2555555555555556,0.5000000000000001,0.137,0.706,0.157,0.1615,anger
13329,16675,"The question is also worded trickily, assuming that Singaporeans are ok with their phone being tracked, just not without their consent.",7/6/20,0.5,0.5,0.077,0.766,0.157,0.2246,fear
13330,16676,"Maybe more would answer ""No"" if they asked if they would be ok with their phone data tracked with or without their consent.",7/6/20,0.5,0.5,0.067,0.845,0.088,0.1366,fear
13333,16679,"Given that theres legislation that has moved through the parliament in a day, by the time we start this when it is hits the parliament floor, it might be too late already",6/6/20,-0.3,0.6,0.0,1.0,0.0,0.0,fear
13342,16688,"Don't forget, you may be fine with this keeping covid under control, but will you be fine with it becoming permanent?",6/6/20,0.4277777777777778,0.6166666666666667,0.0,0.785,0.215,0.4466,anger
13347,16693,"Remember when they said that CB was only going to be 1 month, a short period of time?",7/6/20,0.0,0.65,0.0,1.0,0.0,0.0,anger
13350,16696,i think it will prob be something like that rather than  super scary sounding ankle-braclet sounding device.,7/6/20,-0.08333333333333334,0.8333333333333333,0.142,0.575,0.283,0.4939,joy
13351,16697,This could be one of those things that sounds really bad but might not really be that bad.,7/6/20,-0.49999999999999983,0.5111111111111111,0.322,0.678,0.0,-0.8218,fear
13353,16699,"Yes, annoying and not very practical, however...",6/6/20,-0.45,0.6,0.26,0.481,0.26,0.0,anger
13356,16702,"Providing a hardware device for people who don't have a smartphone is a good idea, however to make everyone use a propitiatory bit of government tech is something that causes me to make sure my tinfoil hat is on as tight as my mask.",6/6/20,0.34047619047619043,0.5915343915343915,0.0,0.88,0.12,0.6369,anger
13371,16717,"> Don't forget, you may be fine with this keeping covid under control, but will you be fine with it becoming permanent?",6/6/20,0.4277777777777778,0.6166666666666667,0.0,0.785,0.215,0.4466,anger
13375,16724,"Don't think Singaporeans would be that dumb, and I don't think the govt will be that dumb to keep it in place forcibly either",6/6/20,-0.08333333333333333,0.6666666666666666,0.239,0.761,0.0,-0.765,anger
13379,16728,">Also, I am seconded to MOH helping out in contact tracing, so I think I know what kind of volume we are having.",6/6/20,0.6,0.9,0.0,0.896,0.104,0.296,fear
13382,16731,How many man-hours does it take to manually trace one person's activities for 24 hours?,6/6/20,0.5,0.5,0.0,1.0,0.0,0.0,anger
13384,16733,The new API only allows for decentralized data collection.,6/6/20,0.06818181818181818,0.7272727272727273,0.0,1.0,0.0,0.0,anger
13385,16734,It would not allow MOH to be able to identify and reach out to the contacts of infected people.,6/6/20,0.5,0.625,0.222,0.728,0.05,-0.5812,anger
13388,16737,This is not good enough for MOH.,6/6/20,-0.175,0.55,0.286,0.714,0.0,-0.3412,anger
13391,16740,"So when a person is infected, it is possible to retrieve from his/her mobile the list of device IDs he or she was nearby and then perform exposure notification.",6/6/20,0.0,1.0,0.106,0.894,0.0,-0.4939,anger
13394,16743,Perhaps the government thinks the number of people not updating to the latest version of Android or iOS will be a problem...,6/6/20,0.5,0.9,0.0,0.939,0.061,0.0772,fear
13395,16744,"I see this as a privacy intrusion, when there is already an option for a more elegant solution to work with people's personal handphone.",6/6/20,0.3333333333333333,0.6,0.0,0.761,0.239,0.7159,anger
13400,16749,Legislating a mandatory tracking device is something else entirely.,6/6/20,0.0,0.625,0.0,0.843,0.157,0.0772,fear
13401,16750,Even convicted criminals only get trackers placed on them with a Court order.,6/6/20,0.0,1.0,0.252,0.748,0.0,-0.5719,anger
13406,16756,>Legislating a mandatory tracking device is something else entirely.,6/6/20,0.0,0.625,0.0,0.843,0.157,0.0772,fear
13407,16757,">
>Even convicted criminals only get trackers placed on them with a Court order.",6/6/20,0.0,1.0,0.252,0.748,0.0,-0.5719,anger
13409,16759,It's a contact tracing device which most likely will work through device handshakes like Tracetogether does.,6/6/20,0.25,0.75,0.0,0.848,0.152,0.3612,joy
13413,16763,>Do you trust any government when they say that they will only use it for it's intended purpose?,6/6/20,0.0,1.0,0.0,0.837,0.163,0.5106,anger
13421,16771,"Personally, I'm still okay with the updated measures - the pandemic is ultimately still ongoing

Issuing tracking devices to everyone on a mandatory basis is another ball game altogether",6/6/20,0.024999999999999994,0.55,0.0,0.887,0.113,0.296,anger
13430,16780,"I said and I quote
>    ""will you be fine with it becoming permanent""

That does not even say anything remotely close to might become permanent.",6/6/20,0.2555555555555556,0.5166666666666667,0.0,0.924,0.076,0.2023,fear
13439,16789,This would inadvertently provide a significant important data set.,6/6/20,0.3875,0.9375,0.0,0.625,0.375,0.3818,anger
13445,16795,"Basically my comment said 
> I don't know where you are quoting that from but that is definitely not by me.",6/6/20,0.0,0.5,0.0,0.835,0.165,0.5499,fear
13446,16796,"Also, I am seconded to MOH helping out in contact tracing, so I think I know what kind of volume we are having.",6/6/20,0.6,0.9,0.0,0.896,0.104,0.296,fear
