,index,Sentences,Comment Datetime,Textblob_polarity_score,Textblob_subjectivity_score,Vader_neg_score,Vader_neu_score,Vader_pos_score,Vader_compound_score,Emotions
5196,8042,You can do a peaceful protest (whats the use anyway) but why are your people throwing stuff and screaming at the police of the host country?,2/2/21,0.25,0.5,0.169,0.759,0.072,-0.4215,anger
5202,8048,"Have some shame , posting a news with containing false information... none of us around the world is using violence to solve it , all of us are handling with a peaceful way.",2/2/21,-0.07500000000000004,0.55,0.194,0.672,0.134,-0.4939,joy
5205,8051,Next time please think and check twice before you post regarding sensitive and important issue like this .,2/2/21,0.16666666666666666,0.6333333333333333,0.0,0.68,0.32,0.6808,joy
5224,8075,"The photos 1,2,4 are not Myanmar people How can you fake the news like this Shame on you #thestraitstimes  You give people the wrong message and photos What kind of attitude do you have?",2/2/21,-0.13333333333333333,0.9333333333333332,0.232,0.709,0.059,-0.8087,anger
5226,8077,they could.be fake peoples that is commanded by the military of myanmar to make a violane  I'm talking it very strongly because our leader command us to stay peace,2/2/21,-0.012222222222222209,0.6844444444444444,0.091,0.735,0.173,0.4201,anger
5237,8088,"Yesterday, our Myanmar people peacefully protest.",2/2/21,0.25,0.5,0.213,0.426,0.362,0.34,anger
5251,8103,Or may be the reuters are not paid enough.,2/2/21,0.0,0.5,0.0,1.0,0.0,0.0,fear
5254,8106,U are using some WRONG photos.,2/2/21,-0.5,0.9,0.489,0.511,0.0,-0.5904,anger
5257,8109,"The people's education was at its lowest ebb.When Daw Aung San Suu Kyi returned to Burma, the people were happy when she first started working for the country.In the election, we received the most support from the people and won the election, but the disgusting military dictator lied in various ways.The Burmese people do not accept the junta's military power at all",2/2/21,0.05000000000000001,0.5047619047619047,0.169,0.741,0.09,-0.7833,joy
5262,8114,"UN and the world media, please help our country- our leaders- our people - from this bitter acts.",2/2/21,-0.1,0.5,0.146,0.629,0.225,0.1901,anger
5269,8124,This is false news.Please do not post biased news about Myanmar.,2/2/21,-0.4000000000000001,0.6,0.0,0.846,0.154,0.2057,joy
5270,8125,This is an important time for the Burmese.,2/2/21,0.4,1.0,0.0,0.795,0.205,0.2023,anger
5272,8127,Being Singapore's one of the biggest journalism and yet you make this kind of mistake?,3/2/21,0.6,0.9,0.161,0.839,0.0,-0.4005,anger
5277,8132,I recommend the Strait Times editors and the personnel to review the authenticity and better research futher more details about this.,3/2/21,0.5,0.5,0.0,0.769,0.231,0.6597,joy
5291,8146,Many people in the world said this is not right .,2/2/21,0.17857142857142858,0.5178571428571428,0.0,1.0,0.0,0.0,anger
5292,8147,This is such a jungle law.,2/2/21,0.0,0.5,0.0,1.0,0.0,0.0,anger
5294,8149,You can't even say right or wrong.,2/2/21,-0.10714285714285715,0.7178571428571429,0.341,0.659,0.0,-0.4767,anger
5295,8150,Your country also accept many of our dictator's money in  bank.,2/2/21,0.5,0.5,0.0,0.794,0.206,0.3818,joy
5302,8166,You can read on many other news that the myanmar protesters only protest peacefully.,2/2/21,0.15625,0.59375,0.213,0.601,0.186,0.128,anger
5305,8169,"If they ever dared to protest and cause riot here - sorry, l needed to voice out to our leaders to revoke their immigration pass, work permit, PR status or whatever they hv and sent them to jail before deportation.",4/2/21,-0.3,0.5,0.165,0.835,0.0,-0.7096,anger
5308,8172,"I would more appreciate if The Straits Times keep the media ethic and remove those photos which are not taken by you media, taken somewhere from internet.",2/2/21,0.5,0.5,0.0,0.893,0.107,0.4576,fear
5310,8174,The world will misleading to our honor and also yours if they found out that's false new.,2/2/21,-0.13181818181818186,0.5272727272727272,0.129,0.718,0.153,0.128,joy
5314,8179,Myanmar in Thailand does not relate in these photo and not include myanmar people in these photos except only the third photo.,2/2/21,0.0,0.5,0.0,1.0,0.0,0.0,fear
5321,8197,We are not protesting violently.,2/2/21,-0.8,1.0,0.0,0.357,0.643,0.6602,anger
5326,8202,Those people have to take leave from work or if they are paid hourly they wont be able to earn anythjng which might have a huge impact on them.,2/2/21,0.45000000000000007,0.7625,0.041,0.881,0.078,0.2732,fear
5329,8205,Maybe u can look up 8888 uprising n understand why we r trying to do this as peacefully as possible.,2/2/21,0.0,1.0,0.0,0.825,0.175,0.5267,fear
5334,8210,Unlike u all many of us have to live in fear not knowing what they r going to do us.,2/2/21,0.3181818181818182,0.5,0.158,0.842,0.0,-0.4939,fear
5337,8213,We have shed enough blood.,2/2/21,0.0,0.5,0.0,1.0,0.0,0.0,fear
5350,8228,Myanmar people in abroad support for democracy peacefully without violence.,2/2/21,0.25,0.5,0.0,0.427,0.573,0.8553,anger
5352,8231,"They have power to control 50% of our country.Now that the military is in power, they will not be afraid to kill anyone again.",2/2/21,-0.35,0.5,0.17,0.83,0.0,-0.6908,fear
5354,8233,",they dont have god, they don't choose Ethnicity , they are like animals that will not afraid to kill their own mother to get power .",2/2/21,0.44999999999999996,0.95,0.062,0.723,0.215,0.6623,fear
5363,8263,"Myanmar people are told to stay home, keep calm and not to involve in riots.",2/2/21,0.30000000000000004,0.75,0.177,0.699,0.124,-0.25,fear
5364,8264,There have been such messages sharing among Myanmar people.,2/2/21,0.0,0.5,0.0,0.741,0.259,0.4215,anger
5368,8268,People already know enough to not fall into this trap again.,2/2/21,0.0,0.5,0.208,0.792,0.0,-0.3869,fear
5380,8318,I just can't stay calm after reading some blaming comments.,2/2/21,0.30000000000000004,0.75,0.424,0.576,0.0,-0.6324,anger
5382,8321,Using the wrong photos which would make everyone misjudge about the Myanmar situation.,2/2/21,-0.5,0.9,0.205,0.795,0.0,-0.4767,anger
5388,8327,UN and the world media help our country- our leaders- our people - from this bitter acts.,2/2/21,-0.1,0.5,0.163,0.702,0.135,-0.1406,anger
5395,8364,To The Straits Time You need to look at your facts straight before posting something controversy at this critical moment of Myanmar.,2/2/21,0.1,0.6000000000000001,0.107,0.815,0.077,-0.184,fear
5396,8365,"Yesterday, the peaceful protests of Myanmar citizens happened in front of Myanmar Embassy in Thailand.",2/2/21,0.25,0.5,0.105,0.718,0.177,0.3182,fear
5401,8370,"We are not stupid, why would we fight with Thai police while we are residing in their country?",2/2/21,0.39999999999999997,1.0,0.122,0.749,0.13,0.0454,fear
5402,8371,"During these few weeks, Thai people are also not pleased with government way of handling Covid 19 and delay of vaccination.",2/2/21,-0.225,0.55,0.199,0.801,0.0,-0.5727,fear
5422,8436,Using the wrong photos which would make everyone misjudge about the situation.,2/2/21,-0.5,0.9,0.22,0.78,0.0,-0.4767,anger
5423,8440,"As you are famous newspaper,shouldn't make such mistakes..Using such wrong photos in this critical time in our country leading to get worse our Myanmar's situation , it seems like your newspaper is siding our Myanmar military in unobvious way...",2/2/21,-0.07142857142857142,0.6285714285714284,0.195,0.75,0.055,-0.745,anger
5426,8470,"Burmese people are frankly exhausted from trying to explain this to the ignorant people:  Now before all of you come in here saying ""the government deserve it because they're responsible for genocide"" NO.",2/2/21,-0.1,0.625,0.194,0.747,0.059,-0.6408,anger
5430,8474,"Before y'all priviledged people sitting in your cozy house start making judgements like ""oh but she could have voiced out..."" SHE COULDN'T.",2/2/21,-0.19999999999999998,0.75,0.0,0.923,0.077,0.1901,fear
5433,8477,"And it's obvious the smear campaign was successful because the west eats up whatever the media feed without thinking critically or doing any researching, stripping off the Nobel Prize and titles, making her the figurehead of the genocide.",2/2/21,0.25,0.75,0.056,0.785,0.159,0.6808,fear
5437,8481,(Search U Ko Ni)  This coup is extremely bad.,2/2/21,-0.6999999999999998,0.6666666666666666,0.351,0.649,0.0,-0.5849,fear
5440,8484,She was in the process of gaining more power so that she can work towards it.,2/2/21,0.5,0.5,0.0,0.843,0.157,0.4215,fear
5443,8487,Please read and research more.,2/2/21,0.5,0.5,0.0,0.635,0.365,0.3182,joy
5455,8503,There are fake riots going on with protestors for hire.,2/2/21,-0.5,1.0,0.444,0.556,0.0,-0.7506,fear
5459,8507,Stupid Fake photos.,2/2/21,-0.6499999999999999,1.0,0.867,0.133,0.0,-0.7579,anger
5463,8511,They didn't even protests on your land lol #crd,2/2/21,0.8,0.7,0.0,0.611,0.389,0.5371,anger
5470,8538,"We are not weak, stay strong.",2/2/21,0.3104166666666667,0.6791666666666667,0.297,0.439,0.264,-0.0762,fear
5476,8558,I get that you are scared but isnt this the only thing we can do at this moment.,2/2/21,0.0,1.0,0.109,0.891,0.0,-0.2382,fear
5480,8576,I have never  my voice against this matter since some are making their own accusations & assumptions.,2/2/21,0.6,1.0,0.14,0.791,0.068,-0.2903,anger
5487,8583,"Moreover, our country has not only Rohingya Muslims (war refugees) in Rakhine State which caused by armed & dangerous people, accordingly; our ethnic groups from Multiple states are getting the same treatment.",2/2/21,-0.15,0.50625,0.094,0.906,0.0,-0.4767,fear
5490,8586,"Decades later, Rohingya Muslims requested for their own land with their own government so on & so on which messed things up.",2/2/21,0.39999999999999997,0.6666666666666666,0.118,0.882,0.0,-0.3947,anger
5491,8587,"Even after all those thing happened, like I said, most of us still dont know about it until the world did.",2/2/21,0.5,0.5,0.0,0.884,0.116,0.3612,fear
5507,8629,"We , Myanmar citizens need  the world to know what's happening in Myanmar right now   before our wifis are cut off.",2/2/21,0.2857142857142857,0.5357142857142857,0.1,0.9,0.0,-0.2732,fear
5519,8660,This media sharing fake news and information about Myanmar report to them about fake photos We have evidences about sharing fake news information  This is a big misunderstanding!!!,2/2/21,-0.375,0.775,0.328,0.531,0.141,-0.8114,joy
5521,8662,Myanmar people didn't protest by this way We 'Myanmar' in foreign countries only protest peacefully.,2/2/21,0.041666666666666664,0.5416666666666666,0.0,0.636,0.364,0.7077,anger
5533,8687,Thank you very much President Halimah for inspiring Singaporeans.,27/1/21,0.38,0.63,0.0,0.569,0.431,0.6486,joy
5539,8693,"No need to specify anyone who had been poke with a needle knows its not worse than bitten by an army ant drawing blood for test,injection for all kinds of vaccination before this is like another routine",27/1/21,0.2,0.6,0.055,0.82,0.126,0.4318,fear
5543,8697,"I supposed, if the driver is thinking of doing something bad against you, he will think again.",24/12/20,-0.6999999999999998,0.6666666666666666,0.189,0.811,0.0,-0.5423,fear
5546,8700,Why wasnt him arrested earlier???,23/12/20,0.0,0.5,0.476,0.524,0.0,-0.5632,anger
5548,8702,What went wrong with our law enforcement?,23/12/20,-0.5,0.9,0.341,0.659,0.0,-0.4767,anger
5550,8705,Why still protect this kind of pervert???,23/12/20,0.6,0.9,0.352,0.426,0.222,-0.368,fear
5551,8706,All perverts must show their face to let other ppl aware of this kind of pervert!,23/12/20,0.2916666666666667,0.5083333333333333,0.354,0.646,0.0,-0.8264,anger
5552,8707,Scumbag ought to be whip and enjoy the rest of his days in prison,23/12/20,0.4,0.5,0.346,0.507,0.147,-0.6486,joy
5555,8710,We know Singapore and other countries will not has 0 infected case but one thing for sure Singapore can control the spread of this virus.,8/12/20,0.1875,0.6319444444444444,0.0,0.822,0.178,0.5809,fear
5565,8720,Why these people did not perform any test at the own country before depart and arrive in Singapore..,7/12/20,0.6,1.0,0.0,1.0,0.0,0.0,fear
5568,8724,"about how people get paid, so I decided to try her and now I can also say that she is the most honest woman I have ever met here .. since I start Investing in her platform I get my income without any issues ... you can also be part of this great opportunity to contact her via the link below .... https://www.facebook.com/giovanafx1.tradinginvestment",10/9/20,0.6333333333333334,0.7166666666666667,0.0,0.83,0.17,0.9056,anger
5569,8725,That good for AIA staff.,17/6/20,0.7,0.6000000000000001,0.0,0.58,0.42,0.4404,joy
5575,8731,"Whether it is a problem involving Money, Love Justice Revenge or Affection or even a serious problem of Bad Luck You should know that something can be done and he is  ready to give you his uncommonly effective Help.",9/6/20,0.05333333333333336,0.6466666666666667,0.231,0.441,0.328,0.7717,fear
5577,8733,Beware of importers & scams he is considered one of the most powerful spell casters.,9/6/20,0.4,0.75,0.201,0.635,0.164,-0.1796,fear
5579,8735,He has a big range of powerful spells to use for your needs.,9/6/20,0.15,0.55,0.0,0.797,0.203,0.4215,fear
5581,8737,"-guaranteed money, wealth and power -protection of wealth, love and life -become a star and famous instantly - destroy evil spirits, Satanism and witchcraft -gambling powers to win all types of bets, at the casino and lotto, his Email:  godwinsolu2@gmail.com#love #protection #business #help #casino #life #wealth #gambling #powers #spell",9/6/20,0.12000000000000002,0.6,0.125,0.648,0.227,0.7579,fear
5585,8741,Singapore is a much more densely populated then our neighbours.,9/6/20,0.5,0.5,0.0,1.0,0.0,0.0,fear
5589,8745,You enjoy the goodness of lower manpower cost...but the govt bears the cost when facing their issues?,9/6/20,0.4,0.5,0.098,0.625,0.277,0.6124,anger
5597,8753,Why are we rushing to open up the borders w malaysia when domestically we are still in a semi lockedown?,9/6/20,0.0,0.5,0.0,1.0,0.0,0.0,anger
5601,8757,"By reopening so soon, we are introducing unnecessary problems into the country.",9/6/20,-0.4,0.9,0.197,0.803,0.0,-0.4019,joy
5609,8765,"We are willing to come in and take lesser pay ,jus hire us .",8/6/20,0.125,0.625,0.104,0.896,0.0,-0.1027,fear
5620,8776,Let's pray that these workers will be able to reach Singapore safely without being infected.,9/6/20,0.5,0.5625,0.0,0.544,0.456,0.8035,joy
5622,8778,"However, For me, I feel that the Malaysian Workers deserve a safe return to Singapore for those who either miss their colleagues or bosses.",9/6/20,0.5,0.5,0.065,0.816,0.118,0.3182,fear
5634,8790,My Samsung Note 9 battery on a full charge goes to 50% in 3-4 hours without any use.,7/10/20,0.35,0.55,0.0,1.0,0.0,0.0,anger
5640,8796,"When I was using the camera phone to scan QR SafeEntry, my batt didn't drain as fast.",30/10/20,0.2,0.6,0.0,1.0,0.0,0.0,anger
5646,8802,Feel good to election n NDP,3/7/20,0.7,0.6000000000000001,0.0,0.58,0.42,0.4404,joy
5648,8804,They  take  advantage  of  every  situation  to  scam  people  of  their hard earned money.,27/3/20,-0.2916666666666667,0.5416666666666666,0.282,0.608,0.11,-0.4767,anger
5658,8814,They deserve it for what they do to all the people they had scammed and will scam further.,27/3/20,0.0,0.5,0.179,0.821,0.0,-0.5719,anger
5659,8815,I cant believe after so many months still have scammer calls ask to collect documents from the health ministry and using automatic voice calls.,1/11/20,0.5,0.5,0.0,1.0,0.0,0.0,joy
5663,8819,The pandemic is getting worse.,9/4/20,-0.4,0.6,0.437,0.563,0.0,-0.4767,fear
5666,8822,"If you're interested in, please inbox or email: phanphuongkhanh2510@gmail.com Whatsapp: +84936925945  Thank you!",9/4/20,0.3125,0.5,0.0,0.562,0.438,0.7777,joy
5676,8832,You have a tough time tracing contacts but I saw that KTV now are open masquerading as bistro with girls running around rooms serving customers.,24/1/21,-0.19444444444444445,0.6666666666666667,0.054,0.946,0.0,-0.0644,joy
5680,8836,Can the relevant authority please do something about this KTV cum Bistro?,24/1/21,0.4,0.9,0.0,0.735,0.265,0.3818,joy
5683,8839,Can you please make an option for delivevery I would be happy to pay the fees.,25/10/20,0.8,1.0,0.072,0.619,0.309,0.6808,joy
5684,8840,Can  mail coronavirus compensation six hundred dollar checks so please figure out a way to deliver this more efficiently.,25/10/20,0.5,0.5,0.0,0.728,0.272,0.717,joy
5695,8852,Very angry with this kind of people.,13/2/21,-0.025000000000000022,0.95,0.375,0.625,0.0,-0.5563,anger
5699,8856,How many more Chinatown visitors have come into contact with this guy.,12/2/21,0.5,0.5,0.0,1.0,0.0,0.0,joy
5705,8862,I really wonder is stomach important or refuse to swab important.,12/2/21,0.3333333333333333,0.7333333333333334,0.172,0.547,0.281,0.1027,anger
5708,8865,Should also imposed penalties for ppl who do not open trace together or never bring token with them.,12/2/21,0.0,0.5,0.071,0.929,0.0,-0.0772,anger
5710,8867,Airport is a dangerous place because we allow infected to enter.,12/2/21,-0.6,0.9,0.414,0.461,0.125,-0.6597,joy
5714,8871,"Until the idiotic garment decide what the F they want, don't put such idiotic headlines out bcos it is not the People's Fault.",12/2/21,-0.4444444444444444,0.7222222222222223,0.25,0.626,0.124,-0.685,anger
5715,8872,It is the Fault of you stupid government who don't know that the hell you are doing.,12/2/21,-0.7999999999999999,1.0,0.433,0.567,0.0,-0.8934,anger
5727,8884,"In fact, government should make every body to carry their Trace Together token, failing to carry should fine them, they must treated this token as their IC.",12/2/21,0.4166666666666667,0.5,0.11,0.831,0.06,-0.3612,anger
5728,8885,"Make Distancing officers to surprise check on them in the public place, especially crowded place.",12/2/21,0.0,0.5333333333333333,0.0,0.87,0.13,0.2732,fear
5733,8890,Now why didn't both men bring it out especially when they are aware they are unwell???,12/2/21,0.125,0.625,0.0,1.0,0.0,0.0,anger
5740,8897,Your caption sounds like they did wrong by not using the app or bringing the token with them..  #1- Its not compulsory.. yet!,12/2/21,-0.625,0.9,0.126,0.781,0.093,-0.2244,anger
5743,8900,Make the token/app compulsory then its a different story.,12/2/21,0.0,0.6,0.0,1.0,0.0,0.0,joy
5749,8906,Don't be naive!,16/9/20,-0.375,1.0,0.0,0.487,0.513,0.2746,anger
5751,8908,The difference is the technologies employed is getting more sophisticated.,16/9/20,0.5,0.75,0.0,0.698,0.302,0.5984,joy
5754,8911,"""The EUs General Data Protection Regulation is one of the better known, and strictest, frameworks - increasingly becoming a model for other countries to follow. """,16/9/20,0.21875,0.55625,0.0,0.884,0.116,0.4404,anger
5756,8913,The owner might not be technically competent to access the risks on all the software he uses and so it might not be a comprehensive solution to address security risks.,16/9/20,0.5,0.6666666666666666,0.28,0.652,0.068,-0.6667,fear
5766,8923,"Everyone is hoping to resume their normal life and contact Tracing is a Must so to break the chain...In life, we have to give and take....Let be rational and support this....Tis is a effort that Govt have make..",8/6/20,0.15,0.6499999999999999,0.0,0.861,0.139,0.6705,joy
5767,8924,I suspect there is a more sinister notice behind this.,8/6/20,-0.13333333333333333,0.7333333333333334,0.516,0.484,0.0,-0.7501,fear
5768,8925,I seriously doubt the government will force Singaporeans to wear this.,8/6/20,-0.3333333333333333,0.6666666666666666,0.344,0.656,0.0,-0.4939,anger
5771,8928,Very cunning,8/6/20,0.0,0.9099999999999999,0.0,1.0,0.0,0.0,joy
5773,8930,Not trying to be funny with PAP or anything like that.,9/6/20,0.25,1.0,0.0,0.625,0.375,0.6597,fear
5777,8934,Just throw it after Covid19 become extinct.,9/6/20,-0.4,0.6,0.0,1.0,0.0,0.0,anger
5781,8938,The opportunist in the business line clearly adamant to reap more fortune out of the Covid-19 pandemic.,8/6/20,0.3,0.6,0.0,0.794,0.206,0.4404,anger
5789,8946,"If u never do anything evil or bad, why afraid ppl to know ?",9/6/20,-0.7666666666666666,0.8555555555555555,0.206,0.588,0.207,0.0041,fear
5790,8947,"However, what if u run into a Positive carrier ??",9/6/20,0.22727272727272727,0.5454545454545454,0.0,0.639,0.361,0.6072,fear
5805,8962,This the least i could do to prevent innocent loss of life.,8/6/20,0.1,0.55,0.167,0.58,0.254,0.0516,fear
5819,8976,The other countries didn't need this crap & still did well.,8/6/20,-0.4625,0.5875,0.229,0.611,0.16,-0.2263,anger
5831,8988,"I find it ridiculous that gov even approve this, think they are sick or they just blindly approve like how the new hdb design over the years.",8/6/20,-0.3528138528138528,0.7445887445887446,0.185,0.735,0.08,-0.5106,anger
5837,8994,Why don't more people do it?,8/6/20,0.5,0.5,0.0,1.0,0.0,0.0,anger
5841,8998,"Know how to ask gov to do more, do for you you also don't care.",8/6/20,0.5,0.5,0.158,0.842,0.0,-0.3875,anger
5844,9001,Dont belive their crap.,9/6/20,-0.8,0.8,0.0,0.579,0.421,0.2924,fear
5859,9016,How is it different from the TraceTogether app that the 25% of us have downloaded and turned on?,8/6/20,0.0,0.6,0.0,1.0,0.0,0.0,fear
5866,9023,LOL Can find another government who listens to their people?,8/6/20,0.8,0.7,0.0,0.718,0.282,0.5473,anger
5871,9028,(link to app for those interested https://coin.onelink.me/ePJg/795a4180)  This coin app paired with the Bluetooth device mines cryptocurrency both actively as well as in the background.,9/6/20,0.058333333333333334,0.55,0.0,0.756,0.244,0.7269,joy
5874,9031,"If you allow the virtual mining of xsgd while in possession of the Bluetooth device like in the COIN app, not only will it help contact tracing, but allow those to earn some spare cash along the way.",9/6/20,0.0,1.0,0.0,0.821,0.179,0.6597,joy
5900,9057,"Compared to people in many countries, Singaporeans are indeed very lucky to have great PM and his team that always care and hedge its people.",19/2/21,0.5777777777777778,0.75,0.0,0.679,0.321,0.8858,joy
5911,9068,"Good health; blessing follow you in and out; Everything goes well; true blessings come; You will be blessed in everything and be prosperous; I wish everyone will be blessed, and be as strong and healthy as an ox in the Year of the Ox, and beautiful as a spring flower!",11/2/21,0.5966666666666667,0.6966666666666667,0.0,0.485,0.515,0.9893,joy
5913,9070,"As we bid adieu to the year of Rat , which has been challenging and unprecedented in more than one way, heres something positive to look out for a Oxcipious new year.",11/2/21,0.39272727272727276,0.6799999999999999,0.0,0.848,0.152,0.6369,joy
5927,9084,"Taking this opportunity to wish all the heros both in front line, backend and the resolute Singaporeans during these difficult times, a very Happy New Year.",11/2/21,0.21212121212121213,0.8181818181818182,0.073,0.587,0.34,0.8439,joy
5931,9088,Congratulations that they went through the COVID-19 vaccination exercise especially the seniors after 70 to go for it .,6/2/21,0.0,1.0,0.0,0.813,0.187,0.5994,joy
5932,9089,"Certainly great efforts for the vaccination team, the community partners, and volunteers for their hard work in carrying out the task .",6/2/21,0.25416666666666665,0.6458333333333333,0.054,0.695,0.251,0.7269,joy
5937,9095,Given priority those senior citizens to jabs COVID19 as there are on high risk easy get sick.,9/2/21,-0.04031746031746031,0.7434920634920634,0.242,0.628,0.13,-0.3612,fear
5944,9102,"Father, we also ask that You give our leaders courage so that even when its hard, they would continue to boldly represent their constituents needs and those of the most vulnerable.",9/2/21,0.010416666666666657,0.5520833333333333,0.099,0.744,0.157,0.4779,fear
5947,9106,Anyway a good start for the loss souls.,8/2/21,0.7,0.6000000000000001,0.225,0.49,0.284,0.1531,joy
5948,9107,Our PM Lee is a great leader who lead by example and a good role model  May God bless u with good health always,29/1/21,0.7333333333333334,0.65,0.0,0.519,0.481,0.93,joy
5949,9108,"Mr PM Lee,  thanks for leading us to be confident and reassured that taking vaccination is a safe and wise move.",30/1/21,0.475,0.6083333333333334,0.0,0.503,0.497,0.93,joy
5955,9114,but definitely there will be side effects kicking in.,29/1/21,0.0,0.5,0.0,0.693,0.307,0.5499,fear
5958,9117,thanks PM Lee for reassuring us that theres nothing to be afraid about ,29/1/21,-0.19999999999999998,0.55,0.0,0.682,0.318,0.6808,fear
5960,9119,"Also, if certain brands are not available in Singapore, does it mean it is not approved?",29/1/21,-0.09940476190476193,0.5529761904761905,0.127,0.76,0.114,-0.0598,fear
5964,9124,Such travellers shud be allowed to travel seemlessly without entry permits and  3.,17/2/21,0.0,0.5,0.0,1.0,0.0,0.0,anger
5965,9125,"If there is  mandatory SHN requiement for such people, it shud be in the confines of their home rather than hotels.",17/2/21,0.0,0.5,0.0,0.939,0.061,0.0772,fear
5974,9134,Just a difficult job.,29/1/21,-0.5,1.0,0.556,0.444,0.0,-0.3612,fear
5979,9139,MOH booklet (given after vaccination) says... *Please refer to photo* It is a good reference and informative.,1/2/21,0.7,0.6000000000000001,0.0,0.838,0.162,0.4404,joy
5981,9141,Only if side effects get worse or fever persist after 48 hours.. Than SEE A DOCTOR.,1/2/21,-0.2,0.8,0.181,0.819,0.0,-0.4767,fear
5984,9144,"For Taxis and PHV drivers, they will be more worried about vehicle rental if they fall sick after vaccination.",1/2/21,-0.10714285714285715,0.6785714285714286,0.254,0.746,0.0,-0.6997,fear
5985,9145,"Part timers or ""hand to mouth"" workers will be worried about salary if they fall sick after vaccination.",1/2/21,-0.7142857142857143,0.8571428571428571,0.362,0.638,0.0,-0.8176,fear
5986,9146,"MOH should address or work with the relevant authorities to sort this out and ""TRY"" to assist as much as possible.",1/2/21,0.2,0.95,0.0,1.0,0.0,0.0,anger
5989,9149,Thank you for leading us to be confident and reassured that taking vaccination is a safe and wise move.,30/1/21,0.5666666666666667,0.7444444444444445,0.0,0.474,0.526,0.9246,joy
