,Comments,Datetime,num_words
0,Happy Chinese New Year to All Singaporean and to All Chinese around the World💐❤️🎈,2021-02-12,14
1,Happy chinese new year everyone..,2021-02-12,5
3,"Good morning Gong Xi Fa Cai ,good health always 😊💕💕💕",2021-02-13,9
4,Happy new year to all of us!,2021-02-12,7
7,😇✨🧧🌏💓🌎💪🌍🧧 C 🧧 🌈🐄 N 🐄🧧 Y 🌈 A HEALTHY IS G(💓)LD 👍✨😇,2021-02-12,8
16,"During house visits, people are cursing MOH.  OMG.",2021-02-13,8
17,"This Ox year, I hope America will stop bullying China. The whole world Chinese will thank Americans.",2021-02-13,17
19,O the frind in a few days and I will be there ❤️😂,2021-02-12,12
20,https://www.facebook.com/1663012860577644/posts/2819931138219138/  hello hi there to whom it may concern at ministry of health and in this post here we all can see clearly that the young man in black polo tee can be seen not wearing his mask properly and is just so clear that is mask is below his nose and shouldn't he be fine and i know that ministry of health is fair and strict too and so please take action on this young man for flouting the covid 19 rules and regulations thank you.,2021-02-17,84
23,"Think out of box, use prerecord message to replace shouting while tossing yusheng la.",2021-01-24,14
24,If the Mainland Chinese allowed to visit Singapore during this CNY. After CNY sure cases goes up.,2021-01-25,17
28,"I will bribe my next door neighbour with 2 oranges, bak kua,Lian know and ask him to close 2 eyes and don't count as I expect more than 8 visitors. Love thy neighbour.",2021-01-26,30
29,"So time to revise dining out,  increase the number to 12 pax max but with safe distance measures still...  Visitors to different household also should be increased to 10pax this allow family members to bond...  We also want to encourage bonding  which this Covid 19 has caused a lot of isolation ",2020-09-23,48
30,And gatherings of friends of more than 5pax is not allowed? Explain?,2020-09-24,11
31,When we all workers can go anywhere in Singapore,2020-09-23,9
32,I’d like to suggest that those of us who are serving Singapore so well by increasing the birth rate not be penalised by having to get a separate kid’s table when we eat out at restaurants. I can’t even take my kids out to eat without making some of them sit at a separate table. 🤦🏻‍♀️,2020-09-23,58
33,100 people? Are we planning to return to Circuit Breaker ? ,2020-09-23,9
34,how about the funeral service can go to 100 people,2020-09-23,9
35,When dormitory workers allow to go community .?,2020-09-23,7
36,How about funeral service also increase to 100 people?,2020-09-23,8
37,"Wedding ceremonies can be a cultural importance to almost all races in Singapore, will the Ministry allow more than 100 people for the occasion if the venue/hall is good enough to accommodate more guests say up to 200...",2020-09-24,37
38,Can we play 11 aside football?,2020-09-23,5
39,And why dining with immediate family members still restricting it to 5 persons per table? Can't comprehend,2020-09-23,15
40,What about religious prayers with karaoke type singing in private homes. Are this allowed?,2020-09-24,14
41,How about those who flout the rule of wearing masks? I still see many not wearing masks. ,2020-09-23,17
42,But then eat outside with my family only 5 pax lai I clap for you forever and ever,2020-09-23,17
44,"When covid-19 (or coronavirus as it was named) first started, the gov was slow to react and even advised that wearing of face mask was not required then.  Even though there is a decreased in number of cases here in SG, there are still transmissions happening, especially in the dormitories. And the number of daily transmissions around the world is still very high. Yes, numbers are low here. Yes, there are screening at all our borders to prevent inbound infections. Yes, there are having safe distancing rules. Yes, there are laws to punish those who do not follow the rules. So what! Are all this measures full proof? No it's not. The situation is still in the pandemic stage across the world. Until the number of transmissions are reduced, the chances of transmissions are still high. Gov.sg,you Reacted Too Slowly in the beginning, now you are Reacting Too Fast rushing into opening up the community.",2020-09-26,154
45,What about international travel? I want to visit Singapore! ,2020-09-26,9
48,Sin Rashid Mona A Rashid,2020-09-24,5
49,Why can't we remove our mask when are are outside?,2020-09-23,9
50,"I think the change on wearing mask adjusted from 2yo to 6yo may need to review again. At 6yo, kids are practically attending K2. Most centers grouped their K1 & K2 in the same center....from my personal encounter. Which means these K2 kids may be wearing mask while the K1 kids do not need to do so. It may be a measure tough for centers to adhere. May i suggest that this measure be either adjusted from 2yo to 5yo or 7yo. Then it’s either all kindergartens kids to wear or not to wear mask. This will also help centers from encountering issues where some parents arguing abt age for kids whose birthdays are around end of year.",2020-09-23,108
52,"I think Ministry of Health, Singapore should review restrictions for incoming travelers from India. Why does It takes so long for you to implement this measure when you ban China pretty early? I thought i read that they are supposed to be tested covid free before departure but apparently seems not so. And Does the covid cert now helps? There are so many fake certs made in India as your media reported. Wondering if you will relook at it if there is better way? Thank you 🙏 ",2020-09-23,86
53,"We still not have  vaccine yet , 100 pax In one event is too many  . Just hope we not return to CB .",2020-09-24,20
54,Stop forcing everyone to put on their mask anymore can?,2020-09-23,10
55,What about sports I’m larger groups? Soccer for example. 22 people playing sports together is less than 50 people at a wedding ain’t it? Plus you’d get more verbal interaction at a wedding than among those 22 people playing soccer. Consistency much?,2020-09-24,42
56,Rahmah Hussin for your info,2020-09-23,5
57,Better to also enforce everyone to wear a mask when taking public transport this will be even more effective in slowing the spread of the virus,2020-04-03,26
58,No wonder you guys taking tighter measure cause it is spreading like crazy: https://youtu.be/lMjGt0YHxxs,2020-04-03,13
59,Please note that not all are abiding to law of social distancing especially queue at Supermarket they just ignore it and thermometer are faulty at restaurants how to monitor the virus from spreading on such cases please do a check on the ground and make them do the proper job.,2020-04-03,50
60,How do I report a pharmacist still at work today while having cough? She coughed so many times with a mask on but isn’t she suppose to be on 5 days MC ? Location at Oasis Guardian today. I told the Sales staff n cashier n they noted that she’s sick n coughing n they doesn’t dare to tell her to go home. So what can I do in this situation if own colleagues just keep quiet even after I complaint n she’s still serving customers. ,2020-04-03,88
61,Plz dear  MOM  the Singapore's lots of Foreign worker coming work in here. they every month take few money like if they have work than there get money either can't take any single of cent.. plz take care those man they were suffer this prob.🙏🙏🙏🙏🙏 The all man are not same.  The Foreign worker aslo part of the family member in Singapore gov... So plz also take a responsibility  for those kind of people,2020-04-03,72
62,"One more measure is being overlooked, please arrange for rapid test kit , which is available.... activate retired nurse or medics corp , arrange home test , if someone suspect himself or herself with COVID , they call hotline and response team arrives to test ....this is highly necessary. Please look into this ,   It will greatly reduce risk of exposure to COVID",2020-04-04,58
63,"Happy on the use of reusable masks to stop the spreading. Thank you minister Wong and taskforce, finally. Will be good to make it mandatory to wear these masks whenever ones go out. 👍",2020-04-03,33
64,"yes, please be more stern and assertive. people just don't get it really, this concept of social distancing.. i don't know how to further simplify how much it'll help but really.. stubborn people will remain stubborn, so please do be stern and enforce the need for social distancing on those who jussssst can't get it. we can try our best to educate and advice, but some really, it just won't get into their head.. ""drinking together only what"".. ""not so near what"".. ""aiyah, ok one lah"".. many are still complacent, especially those who've never been critically ill or have a critically ill love ones.. so please, for stubborn people, please do have authorities to help make sure they disperse and go home, not loiter and later regroup to catch up, chillout, jam, game together etc...",2020-04-05,129
65,Finally our Iron Teeth Papaya Minister come out and say wearing a mask is correct.  As usual any mistake done by them without any apology.,2020-04-03,25
66,Thank you for a near lockdown.... Very well planned and thought of.  Thank you,2020-04-03,14
67,"Ministry of Health, Singapore Good job . Any new measures is most welcomed at this most crucial phase to fight this stubborn virus.   However I feel we are having a missed opportunity here in curbing the number of imported cases. Although , the number of imported cases have steadily dropped, there is still a few cases Everyday . At the moment , we must drill that mindset that even one case is one too many.   Thus , I had hoped the recently announced circuit breaker measures would have included a semi closure of air travel into Singapore for a period of time. We could have used this measure to stop the number of imported cases to zero , so that we could fully concentrate on bringing the number of local infections down.   I do hope the officials will consider also suspending all passenger arrivals and departures for this one month and to only allow cargo flights to operate. This timeframe would help our medical resources to fully concentrate on all local cases. ",2020-04-03,166
68,Omg mostly Malaysian can go bk Liao no job for them as sg company closed 1 mth 😓😓😓 Monday sure many car in custom Liao 😓😓😓,2020-04-03,23
69,Perhaps can Ensure All Food Preparations are done wearing masks for this Crucial Hygiene Period 😷,2020-04-03,15
70,The way to stop the spread is to lockdown all countries.. I said it 2 months ago.,2020-04-03,16
71,"Dear MOH, pls send out notice about joggers/walkers/cyclists also need to practice safe distancing. Lots of people still neglecting this. Thanks",2020-04-04,23
72,You doctor ah...Does it mean she is infected when she cough. I use to cough for almost 2 months but still go back to work as doctors from KTPH and Yishun polyclinic found nothing.,2020-04-04,34
73,A taskforce be created to patrol around. Teenagers very difficult they ignore and go out. Elderly always drink coffee sit at coffee shop.,2020-04-03,23
75,"This was long, long overdue.",2020-04-04,5
76,Why aren't we into Red Alert yet?,2020-04-03,6
77,Dorscon Red without labelling it??,2020-04-04,5
78,"We thank Minister Wong and Gan for finally making the correct decision to encourage wearing mask in public. The communication should be more focus on stopping the spreaders rather than keeping one safe. As long as we can mitigate virus droplets flying, we have succeeded. Scream, if you see someone not wearing mask in crowded and enclosed places, like market, shopping mall, buses and MRT. Peer pressure is the most effective. Support the frontline to flatten the curve.",2020-04-03,78
81,So are we on Dorscon Red now yet?,2020-04-03,8
82,Kanchiong spiders all panicky liao,2020-04-03,5
85,"MOH, please be aware that privately arranged hitching services like GrabHitch may be an overlooked highly Covid-19 spreading potential if they are not banned. These services also affected the main fulltime businesses on taxi and PHV services. Please look into enforcing them.",2020-04-04,42
86,"I have a widow neighbour who stays alone in her unit. Her daughter, with her family of 4, still come and visit her over the weekend and stay overnight. Can meh? I am really confused. ",2020-04-19,34
87,Plz dear  MOM  the Singapore's lots of Foreign worker coming work in here. they every month take few money like if they have work than there get money either can't take any single of cent.. plz take care those man they were suffer this prob.🙏🙏🙏🙏🙏 The all man are not same.  The Foreign worker aslo part of the family member in Singapore gov... So plz also take a responsibility  for those kind of people,2020-04-03,72
88,"FOREIGN VIRUS HAS BEEN ALLOWED TO SPREAD FROM AIRPORTS TO CITIES, TO HOMES !  HEALTH MINISTER HAS MESSED IT UP !  https://www.channelnewsasia.com/news/singapore/covid-19-pm-lee-urges-returning-travellers-to-stay-home-isolate-12575938  LET ME REVEAL THE MEANING OF QUARANTINE !  EXAMPLE: IMAGINE YOU GO TO A COUNTRY WHICH IS BRANDED AS A PLACE FOR YELLOW FEVER PANDEMIC.  AFTER THAT, SAY, YOU GO TO VENICE.  YOU CANNOT ENTER THE NEXT COUNTRY AND WILL BE PUT IN A ""QUARANTINE ISOLATION"" OUTSIDE THAT COUNTRY.  ONLY AFTER THE INCUBATION PERIOD IS OVER, THE HEALTH DEPARTMENT WILL CHECK EACH AND EVERY MEMBER OF THE QUARANTINED.  ONLY THEN ARE YOU ALLOWED TO ENTER THE COUNTRY.  WE IN SINGAPORE BROUGHT IN THE CORONAVIRUS VIA AIRPORTS, CHECKPOINTS, PORTS, ETC..  SINGAPORE DID NOT CARE ABOUT ACCEPTED QUARANTINE PROCEDURES !  SINGAPORE ALLOWED ALL PASSENGERS TO DISEMBARK AND GO TO THEIR HOMES !  WHAT IS ALL THIS ?  ONLY PEOPLE WITH FEVER WERE DETAINED FOR QUARANTINE.  HULLO HEALTH MINISTER, STOP YOUR BULLSHIT AND DO YOUR JOB PROPERLY !  FLU VACCINATION WHICH HEALTH MINISTERS LOVE (KOSHER EVIL PHARMA DONATIONS) IMPOSED ON BABIES IS USELESS; AS FLU VIRUSES MUTATE EVERY SEASON.  A VIRUS IS REPLICATED ONLY INSIDE THE LIVING CELLS OF AN ORGANISM.  VIRUSES CAN INFECT ALL TYPES OF LIFE FORMS, INCLUDING BACTERIA.  THERE ARE MILLIONS OF TYPES OF VIRUSES IN THE ENVIRONMENT.  HUMAN BODY CAN PROVIDE IMMUNITY UNLESS THESE VIRUSES ARE CULTURED IN THE LAB ON A PERTI DISH BY HUMANS.  CORONAVIRUSES ARE SIMILAR TO INFLUENZA VIRUSES IN THAT THEY BOTH CONTAIN SINGLE STRANDS OF RNA.  CORONAVIRUS (SARS-COV-2) WAS DETECTABLE IN AEROSOLS FOR UP TO THREE HOURS, UP TO FOUR HOURS ON COPPER.  IT SHOWS THAT COVID-19 IS MAN MADE FOR BIOLOGICAL WARFARE.  COVID-19 PANDEMIC DEMANDS THAT ALL AC AIR DUCTS (CENTRAL AIR CONDITIONING) MUST HAVE SPECIAL AIR DUCT FILTERS WHICH MUST HAVE A PLANNED MAINTENANCE PROCEDURE, RECORDED BY VIDEO.  MAINTENANCE OF SYSTEMS AND FILTRATION HAS AN IMPACT ON HOW CONTAMINANTS FLOW THROUGH THE AIR, SO BUILDINGS THAT HAVE NOT BEEN PROPERLY SERVICED TO MAINTAIN APPROPRIATE CIRCULATION, FILTRATION, HUMIDITY AND TEMPERATURES CAN CONTRIBUTE TO HIGHER AMOUNTS OF MICROORGANISMS MOVING THROUGH THE SYSTEMS.  THIS EXPLAINS WHY NEW YORK IS AN EPICENTER FOR COVID-19.  THE ONLY WAY VIRUSES GROW ARE WITHIN BODIES, WHICH MEANS YOU HAVE TO BRING THE GERMS INTO YOUR BODY; OFTEN VIA TOUCHING YOUR FACE, IN ORDER TO GET SICK.  WE ASK HEALTH DEPARTMENT TO INSPECT ALL OFFICERS OF LARGE COMPANIES...  CHECK IF DIRECT SUNLIGHT (NOT FILTERED THROUGH GLASS) IS PROVIDED TO THE EMPLOYEES AT THEIR DESKS.  IN WUHAN THERE ARE MANY CHINESE DOCTORS WHO HAVE BEEN INFECTED BY ASYMPTOMATIC PATIENTS.  ASYMPTOMATIC CASES REMAIN UNDIAGNOSED AND THEREFORE UNQUARANTINED.  WE STILL DON'T HAVE SERUM TESTS TO TEST SUCH SLEEPER PASSIVE CARRIERS.  UNDETECTED, ASYMPTOMATIC PATIENTS COULD CREATE FRESH TRANSMISSION ROUTES ONCE LOCKDOWNS ARE EASED.  WE ARE IN FOR A LONG HAUL !  DIAMOND PRINCESS CRUISE SHIP OUTBREAK SHOWED THAT 35 OF THE 104 INFECTED PASSENGERS REMAINED ASYMPTOMATIC EVEN AFTER AN AVERAGE OF 10 DAYS OF OBSERVATION AT THE SELF-DEFENCE FORCES CENTRAL HOSPITAL IN JAPAN.  ON MARCH 23 2020, THE HEALTH MINISTRY IN THE SOUTHWESTERN CHINESE CITY OF CHONGQING, SAID 18% OF PATIENTS WERE ASYMPTOMATIC.  EXISTENCE OF PRE-ASYMPTOMATIC (ASYMPTOMATIC) PATIENTS MEANT THAT SCREENING PROCEDURES AT AIRPORTS AND OTHER POINTS OF ENTRY WERE INSUFFICIENT TO PREVENT THE CORONAVIRUS FROM SPREADING.  THIS IS WHY THERE MUST BE ESTABLISHED QUARANTINE PROCEDURES AT AIRPORTS, CHECKPOINTS, PORTS, ETC., FROM WHICH COVID-19 GAVE ENTRY.  JUST ONE TWO SECOND TEMPERATURE CHECK IS NOT ENOUGH !  CHILDREN WHO EAT GOOD ORGANIC FOOD ARE LESS SICK FROM COVID-19, BUT MAY STILL SPREAD THE CORONAVIRUS.  THIS CHILD CAN SPREAD THE DISEASE TO A MALNOURISHED FEEBLE CLASSMATE.  CHILDREN WORLDWIDE RARELY HAVE SEVERE SYMPTOMS WHEN INFECTED BY COVID-19.  TRUE NUMBER OF INFECTIONS IN U.S.A. (MANY WITH MILD OR NO SYMPTOMS) IS FAR HIGHER THAN ESTABLISHED.  AGAIN, AN ASYMPTOMATIC CARRIER (HEALTHY CARRIER OR JUST CARRIER) IS A PERSON OR OTHER ORGANISM THAT HAS BECOME INFECTED WITH A PATHOGEN, BUT THAT DISPLAYS NO SIGNS OR SYMPTOMS.  ALTHOUGH UNAFFECTED BY THE PATHOGEN, CARRIERS CAN TRANSMIT IT TO OTHERS, HOW CERTAIN PATHOGENS CAN REMAIN DORMANT IN A HUMAN FOR A PERIOD OF TIME.  A COMMON PRINCIPLE IN EPIDEMIOLOGY, THE 80–20 RULE, SPECULATES THAT 80% OF THE DISEASE TRANSMISSION IS CONDUCTED BY ONLY 20% OF PEOPLE IN A POPULATION.  WE WATCH !",2020-04-03,679
89,Please consider a full lockdown.  Your police can't police every mall or supermarkets...partial lockdown is worse in the long run,2020-03-27,20
90,Can you empower police to arrest people who are sneezing and coughing in public transport without masks and enjoy people staring at them,2020-03-27,23
91,Coffeeshop always group of 10 or more old folks gathering. How? Coffeeshop tape “X” on the chairs 🪑 & still leave the chairs 🪑 next to the table what for? Pls enforce it!,2020-03-27,29
92,"These are good measures. However, these measures may deter people from seeking medical help if they are not feeling well for any reasons for fear of given the stay home order. Some GPs may simply issue MC for this reason juz to be ‘kiasu’ but the condition of the patient is otherwise. Staying a distance is not applicable to public transport. The latest measure is outside of work and school gathering. The purpose of this measure is to minimise gathering of 10. Public transport may still be crowded n ppl with flu symptoms or suspected virus may spread. Public library may also have ppl though short of gathering sort. The virus spread nay happen. Think again on public transport. ",2020-03-27,118
93,Are couples or families allowed to seat face to face instead of 1m apart effective today ? Or will be fined for not spacing out ? ,2020-03-27,23
94,Pls go to Kaki Bukit Road 3 or 4 and see the real situation.  So many workers sitting together along the roadside (is already very dangerous if one vehicle out of control will bang into the whole row of workers) while waiting for their company's transportation to pick them up.  And in one lorry sitting side by side😏,2020-03-27,55
95,THERE still loophole. HOW about those with flu symptoms self medication will still spread the virus.,2020-03-27,16
96,"""Any individual who is issued a medical certificate by a medical practitioner certifying that he/she has acute respiratory symptoms must not, without reasonable excuse, leave the individual’s place of accommodation for 5 days starting on the day the medical certificate is issued"". when this start as i do know of people violation this. any hotline i can call to report?",2020-03-27,61
97,What i say no understand  because we r construction workar soo the moh say 1metar dis but we follow lory to going work side then inside lory we alll set together even 10 ecn gep also no have that moh no see jast talking can if u make low most see every thing lory inside how to set 1metar dis,2020-03-27,57
98,Deny those who abuse the police officer of ventilators... It will scare them more than probation which is a free holiday with food.,2020-03-27,23
99,"Those people didn’t follow up SHN , continue working after back from oversea ,please go and check at tuas south mega yard .",2020-03-27,22
100,distancing at coffee ahop hawker and q.i would like to know how about our transport system LOL .go and take alook at the buses and mrt .,2020-03-27,27
101,"Previously family members can still sit together in 1 table in public, with the updated ruling, can family members still sit together to have their meals in public? or must they also sit 1m apart?",2020-03-27,33
102,"Do the social distancing rules apply to family members or mother and young child or baby in public? If not, there should be clarification, since family are usually in close proximity at home anyway!!",2020-03-27,34
103,"hoe about the school our future core ,dont just think about education ,think about what if the virus spread in school thr u close down .can let the kids to study at home tru internet and maybe just bring the june holiday  forwards",2020-03-27,43
104,How about in the mrt? All seats are usually occupied. May not be transient if it’s a Long journey. ,2020-03-27,20
105,Deny ventilators to people who don't wear masks or use their tee shirt or hands to cover sneeze or cough.,2020-03-27,19
106,"Those overseas undergrads whom just returned to SG for holidays. What if these young people got restless, and with their YOLO attitude, sneak out during their SHN for class gatherings to catch up with one another?",2020-03-27,36
107,Still a lot of companies ddnt apply less manpower at work/ remote working from office,2020-03-27,15
108,"Why only people coming back from Europe and US is conveyed to designated hotels for SHN, but people from other regions are given time to OTOT for the day, use public transport to go home and then expect them to self-isolate from the other people living with them in the same house?",2020-03-27,51
109,How about families? Can sit at adjacent seats?,2020-03-27,8
110,All hawker market and shopping mall still many people. Sad,2020-03-27,10
111,"Family excluded..however when din-in more than 10, pls spilt in2 2tables.😅",2020-03-27,8
112,I don't see any seats demarcated inside out trains yet,2020-03-27,9
113,What about the backpackers hostel. I have asked the hostel operator and I was told 1m distancing doesn't apply to hostel,2020-03-28,19
114,"Hello, would like to ask what are you going to advise on people who does not have a lot of medical leaves? If they do not have a lot and yet employers do not offer alternatives except that they either no pay, how are you going to advise them then? Will there be any mandate or rules for employers too on this matter?  I feel that the new rule on medical leave is going to back fire as many will no longer go and see the doctor for slight symptoms and wait until their symptoms get serious then they go see doctor. Now people may go see doctor if the symptoms are slight since mc will not be enforced, but if mc are to be enforced, there will be more people who will not see doctor for slight symptoms anymore due to the fact that many do not want to loose their jobs during this difficult times.  No point telling us about the resilience budget cos covid-19 is not going to go away anytime soon. It may run longer than SARS and people need to put food on the table too.  If you are going to enforce anything, please enforce in full cycle and not halfway, enforce at employees' end and yet not enforcing it on the employers' end.  PS: Doctors now give MCs as if it is free, as long as you cough a little, running nose a little, also give 5 days MC. Then ask you to see them again and again. 5 days MC given consequently without any other remedy like sending to hospital for test or anything. Just keep giving people 5 days MC again and again.  Now that you enforce MCs, who would dare to go see them anymore?",2020-03-27,291
115,Where can i report an eatery not comply to the social distancing?,2020-03-28,12
118,"The Infectious Diseases (Measures to Prevent Spread of COVID-19) Regulations 2020 does not specify any exceptions for related persons sitting together in a public place with reference to regulation 6. However, NEA has a press release with several  other agencies (none under MOH) which indicates unclear exceptions for related diners in F&B establishments. This seems contradictory, it would cause confusion for the public and owner/occupiers of a public place.  There should be a strong and clear message - whether related diners can sit at fixed seats demarcated not to be occupied, whether related diners can sit within 1 metre from another, whether there are other exceptions for related diner or related persons.",2020-03-29,110
120,"Last night, few groups of people is still having gathering at Pasir Ris park and there is more than 10 people in a group. Could related department kindly look in this matter?",2020-03-29,31
121,Show no mercy to idiots like bak kut teh man who acts stupid & ignores SHN & other idiots like him! And good move to fine/jail those who sit on crossed out seats & queue less than 1m apart. Ignorance is no excuse. Fine/jail them & set an example to other idiots!,2020-03-27,49
123,Mrt sitting is lesser than 1 meter.,2020-03-27,6
124,"The sg leaders say social distance, reduce crowd, stay home, minimise outing, bcp plans etc. My daughter doing her intern for mass comm. Her company sending her to tourists areas for shooting. How to enforce irresponsible employers....who do not abide by govt rules. She jus started day 2. She is from Ngee Ann Poly",2020-03-24,54
125,Thank you for implementing stricter measures. May I ask how about gym ? There are a few cases link to gym and right now there's no indication within this new measures. ,2020-03-24,29
126,"All  Singapore resident (Non-citizen), PR, Long term pass, work pass holder who have disregarded our travel advisory should be denied entry back in Singapore.🤦‍♂️🤦‍♂️",2020-03-24,23
