,Comments,Datetime,num_words
127,"Now that stricter social distancing measures are put in place, we need to ensure better social responsibility and personal hygiene.  1. There have STILL been many instances of people coughing/sneezing without wearing masks or covering their mouths with tissue paper in enclosed space (MRT, bus) where commuters are captive for longer than 10 minutes, which is enough to catch the coronavirus. 2. There are even people removing their masks to cough before putting their masks back on. 3. I witnessed a 70+ y.o. man digging both nostrils with his finger then held the bus metal pole with the same hand!  Such socially irresponsible and unhygienic behaviour is so rampant that they are the weakest link in our INTERNAL fight against Covid-19 even as we try so hard to control imported cases. I am afraid these people will do us in and infect countless innocent people.  These people need to be nabbed and fined as education has no effect on their selfish behaviour.",2020-03-24,159
128,"If this carry on, viruse outbreak is a true issue in front of us. Only thing is to delay it. But it seems our government have not step up yet. Of course Singaporeans trust our medical facilities that's why everyone will rush back. Because we trust our government. But tis time round, if our government still don't delay or prevent those at overseas to rush Home at a shoot. We going to be gone. And by right, those at overseas should have know this cases during end December. So by right they have came back. So those still at overseas is stubborn. So please Government shld think ba. Or maybe we Singaporean die a few more ppl then they wake up ba.   Saying all tis is because it really affects not just economy (lockdown pubs🤔cinema) but open airport big door😁  It's just tearing out medical facility and people. Please think for our Frontline people and their health. Can they manage? Still don't close tis big door, our medical ppl will be tear apart",2020-03-24,170
129,"Tks for the more stringent measures, hope the 40k and their families who traveled overseas during school holiday wont cause more local transmission. Strict quarantine and hard rules on social distancing are extremely important. For the whole week we got daily untraceable cases which means sg already have wild local transmission. People just don't want to accept this fact.. ",2020-03-24,57
130,"Keep doing measures like close down pubs, cinema for what use. Current issue or current covid19 cases recently is all incoming. By right is take up measures on Singaporean from gg out and coming back Singapore. Should have step up steps on how we are going to fetch back Singaporean by batches and not, let them cm back as they like. Because in BTW they find source or flights to be back, they may enter some dangerous flight terminal.😏😏😏 Example Country like china,Korea & japan their figures on covid19 are totally lies and can't believe. Their government only cares on $ and $ and $ Olympics.",2020-03-24,102
131,Hi Sirs should we disallow travel aboard rather than still let them go.if long term pass holders want to leave don't allow them entry . Should we control the returning Singaporean stagger their return so that we don't have sudden spike of imported cases our health facilities will be stress and propose disallow long term holders to come back at this moment.,2020-03-24,58
132,"So proud of our govt in being able to roll this out without cost to citizens and resident, and trying their utmost to prevent a lock down.",2020-03-24,27
133,"Good move to let returnee to observe SHN at dedicated accommodation with the transport arranged from airport! So that it doesn’t affect the household member who don’t travelled... not risking of them using public transport of taxi. This is good measure that could be expanded to cover other high risk/cases countries returnee if possible....   Can share is social distancing also enforced  on public transport - bus or MRT ? Would there be educational advertisement to raise awareness and share good practices ?   Thirdly, traceTogether is a good apps to ease the contact tracing - faster n comprehensive. For traveller or residents , would there be informative video on the apps to encourage more people to use it ? Thanks .",2020-03-24,116
134,We have to thank the authorities for such harsh implementations of such measures to curb and contain the Covid-19 virus in SG. 🙏🙏🙏,2020-03-24,22
135,Need to ban Singapore residents from travelling. Unless they are leaving for good and not coming back,2020-03-25,17
136,Public transport is another area of concern. How to social distancing in crowded bus and train? Limit numbers of people in a cabin ? Cross out seats on the bus ? No standing pax ? Everyone must wear a mask on public transport? What's the best way ?,2020-03-24,43
137,How to apply delicated facilities isolation? For those at overseas coming back...   It is so unclear...   Pls help.... Pls state where to apply so it will be clear for those. If not ppl later 趴趴走， then lots of ppl have alot of jobs to do again.,2020-03-24,45
138,"Well, this shows a good move to contain the virus. 👍",2020-03-24,10
139,"Thanks for further measures taken.  But how about Gym, Swimming pools, play grounds, public transport like MRT/LRT/Buses?",2020-03-24,19
140,Why are our casinos still allowed to operate ? Shouldn’t the casinos be the first ones to be closed.,2020-03-24,19
141,Bus and MRT how? Social distance mean only 10 passengers allow per trip?    Why tuition centre where school is more crowded.,2020-03-24,20
142,"Good moves. Thank you, MOH!",2020-03-24,5
143,"Good move though on hindsight, it could have come earlier. Who's footing the bill on the hotel though?",2020-03-24,17
144,How about markets? How to do safe distance 🤦‍♀️🤦‍♀️🤷‍♀️🤷‍♀️,2020-03-24,8
145,"Can SkillsFuture Singapore send an advisory to all adult learning training providers carrying out SkillsFuture courses in Singapore in regards to the Covid19 measures announced by MOH today? It is not specific on whether Training Providers providing face-to-face training SkillsFuture courses for adult learners  (non - senior) are allowed to conduct classes (if there are 10 pax or less per class, already adhered to social distancing of 1 Meters apart) or we are allowed to conduct in alternative modes (using Elearning instead of the original face to face mode). Would appreciate clarification soonest as we have classes coming up in a few days and we need to make the necessary arrangements",2020-03-24,107
146,so who will pay for the SHN in the hotel?,2020-03-25,10
147,Why school is still running? ,2020-03-24,5
148,Then pls close school... parents are worry about their child interacting in big group.. how safe school is now...,2020-03-24,19
150,JoJo Lkk Kashi Bin Akinasa ,2020-03-24,5
151,"Can anyone clarify me,is it mean that once we are back from Malaysia or other countries will be quarantined rite? In 14 days if nothing happened and day 20th tested positive,the Gov will give the subsidized?",2020-03-24,36
153,How about safe distancing on mrt and buses.,2020-03-21,8
154,Senior activities have been suspended but why elderly attending the day rehab is still continuing and they're much older than those Seniors joining the community activities.,2020-03-20,25
155,No use. There are a lot of uncultured and unreasonable ppl. I got a scolding from an uncle. He was standing too close and it’s not his turn yet. I told him nicely to keep a distance. He yelled and scolded me. ,2020-03-20,43
156,Most of the cases are imported please look into it seriously before thing get worst we might be short of medical staff and equipment which cannot be obtained anytime as you wish,2020-03-20,32
157,Good move and well done #taskforce.  We already have too many imported cases in Singapore.  We may not be able to control this situation. Hospital beds may not be enough 😱🤦‍♀️,2020-03-20,29
158,My area hawker is 1 of the 3 to implement seat distancing but then I’m still seeing seniors gathering beside each seat after their morning walk/exercise. Probably as children we might want to remind ours parents about this social distancing ,2020-03-20,40
159,In mrt distancing possible? Many tourists attraction entry free or discounted price to attract crowd. The world was so into revenue till humanity was lost. Today we loosing all the revenue. What goes around comes around.,2020-03-20,36
160,A Kindergarten/Nursery is also a 'workplace'... How do teachers distance themselves from the children who attend classes and also ensure adequate distance between themselves? Especially now that many may have taken short breaks during the first semester holidays and returning to school on Monday on 23/3?? Doesn't social distancing include kindergartens and nurseries?,2020-03-20,52
161,"And to organizers who are organising bazaar n sale events, please heed the government advice and cease the events!",2020-03-20,19
162,Definitely a good initiative but not very feasible due to the limited space most companies have. Outdoor probably yes.,2020-03-20,19
163,"so how does one stand in MRT or bus ... one metre apart, too?  ",2020-03-20,13
164,# of primary kids in a classroom able to have this implemented? also not forgetting they do have some teamwork.,2020-03-20,19
165,Some Companies rather sacrifice their employees and their families ,2020-03-20,9
166,"I can provide free donation supplies masks, those who have channels can contact, now can provide supplies as follows, (I) disposable surgical masks (2) surgical mask (3) the N95 KN95 All products supplied daily are qualified",2020-03-21,32
167,"MOH, aside imported cases. I'm more worry about those unlink cases. What are these tracing status now. Appreciate your advise.",2020-03-20,19
168,How do you intend to apply safe distance for kids in school?... not doable,2020-03-21,14
169,How about introducing stricter rules on foreigners coming into SG?  That might help in reducing the number of import cases!!! 😏,2020-03-20,20
170,Are schools not considered large gatherings? Social distancing is a MEGA word for primary school kids!,2020-03-20,16
171,We play our part...how about the G got play his part ant..want to ask MY to release the WP holder to enter sg and work.,2020-03-20,27
172,Good to know most are imported cases to avoid complex tracing! ,2020-03-20,11
173,Most restaurant are not practicing the 1m distance between tables. ,2020-03-20,9
174,Stop letting import case in,2020-03-21,5
177,try to do that in MRT...,2020-03-20,6
179,Try USS today .. large crowds ,2020-03-20,5
180,wahahaha. ur ass mrt can help?,2020-03-21,6
182,"It's scary that there are so many imported cases. To my dismay, why aren't the front liners - those staff at Airport like immigration officers, policemen putting on masks since they are always meeting up with so many travellers daily? They are at high risk too, aren't they?",2020-03-21,44
183,"I would like to make a case for wider screening at our checkpoints (to include the asymtomatic)^, early detection, isolation and treatment to prevent onward transmission since the majority of our new cases are imported.   We need not be constrained by the finite hospital beds here. Cruise ships can be converted into temporary floating hospitals to treat foreigners who still insist on coming here for free testing and (paid) treatment and non-residents. China and the US are working on this already:  https://www.express.co.uk/news/world/1256184/coronavirus-news-COVID-19-latest-china-hospital-pandemic-wuhan-diamond-princess?fbclid=IwAR32hk8XzDK9S9APbRsUo6ygXIl1ZixXmSoNwWUGog4NzF6AQVMjNqCCWDs  ^ ""Researchers estimated that 44 per cent of the transmissions could occur before an infected person displayed symptoms.""  https://www.scmp.com/news/china/society/article/3076022/coronavirus-infects-faster-and-lasts-longer-sars-raising-new?utm_content=article&utm_medium=Social&utm_source=Facebook&fbclid=IwAR2GEhZNQgY2amEXXP342wCWzCyNoxdm4L9kjO_qEaowUSwe12KVVo9ISLE#Echobox=1584636479",2020-03-20,96
184,Dont come near me!💪 maintain 1M,2020-03-20,5
186,"Hello I am an old money/Coins collector, Do have for sale?? WhatsApp my number for good deals 👇👇 http://www.wasap.my/+1(914)2815574",2020-03-21,18
187,"Kindly do something on local hawker food centres, etc .especially during rush hours and weekends. The people crowding and queing for food is too many. Its overcrowding and there is no 1mtr jap in between.  Kindly look into this.",2020-03-21,38
188,"How about pubs , disco, clubs who are packed with people ?",2020-03-21,10
