,Comments,Datetime,num_words
377,"Then is it fair to others who have to bare increase petrol prices, increase GST, etc. so that your company can survive? And their salary might be even lower than most of your employees.",2021-02-21,34
378,"Come on! By now if the businessmen and employers still not pivot, please go work for others. Seriously.  Business is competitive and need to adapt. Don’t use other people’s jobs as excuse to get subsidy and for lack of entrepreneurial ability. Rather we channel funding to growing industries and businesses. ",2021-02-21,52
379,Retrench the foreigners and keep the Singaporeans?,2021-02-21,7
380,Cut down rental charge by gov,2021-02-21,6
381,Retrench those high paid workers..,2021-02-21,5
382,"So many comments deleted lol, saw several deleted while scrolling. Media censorship to show a positive response to mainstream articles and govt policies LOL",2021-02-21,24
383,FILED BANKRUPT AND SACKS ALL WORKERS,2021-02-21,6
384,Our travel agent never bebefit any from whatever subsidies rolled out.,2021-02-21,11
385,Means the probability your being laid off is 50/50 if the coy not able to support business of making money🥱🥱🥱😢😢😢,2021-02-21,19
386,Every good things must come to an end.,2021-02-21,8
387,Casino. SIA . All no need worry. Rest better start buying white rice and soy sauce for breakfast lunch dinner,2021-02-21,19
388,"U go check,in the food businesses they earn so much n laughing with counting big stack of monies.",2021-02-21,19
389,Some may survive others may sink to the bottom of the ocean,2021-02-21,12
390,Find a way improvise money won’t drop fr sky forever ,2021-02-21,11
394,Subsidies go to their own co lol,2021-02-21,7
395,Reduce pay n cut costs,2021-02-22,5
397,"Our 4g task force has proven their forte... Deem as world standards for pandemic management. Even Foreign Direct Investment, Singapore alone take 55% of ASEAN share. 10 other countries share remaining 45%. Why, because limpeh Singapore is the best managed country in the world. Since 1965... We have punch way above our weight in the world guided by the best government in the world. No resources but acquired deep reserves thru near zero corruption and CPIB enforcement. Safest country, racial harmony, HDB, CPF, only 7 percent gst versus NZ  gst 15% & Finland gst 24 %. Majority of citizens pay no income tax vs Finland average tax rates of 54%. In Singapore, PM invite top tier talent with good character and upbringing to serve as Minister with coffee sessions until they agree to give up their dreams. In most other countries, first and second tier talent are chasing their first billion dollars. Only 3rd tier talent or below are serving as Ministers. Our secret formula... The best as Ministers, oppies pick up the losers in life",2021-02-26,164
398,Some companies accepted subsidies also retrenched staff so it makes no difference! Don't give them too much subsidies or they will be over reliant on government to rescue them!,2021-02-21,28
399,The government rather see Singaporean being jobless then foreign s.,2021-02-23,10
400,No difference we’re back sell tissue papers collect card boxes ,2021-02-21,11
401,Catch up on the highlights of #SGBudget2021: https://str.sg/JHN9,2021-02-16,6
402,Can see billions moving around but how much cash is given out to citizens if any,2021-02-16,16
403,"Singapore no resources like petroleum, gas reserves or rare earth. Yet accumulation of deep reserves with zero nett debt. Gst of only 7 %, NZ is 15 % gst and Finland, world happiest country gst is 24 %. In Singapore, only first tier talent with good character and upbringing are invited by PM for coffee. Minister salary formula cannot be replicated by other countries, stuck with tier 3 or worse as ministers.",2021-02-16,65
404,Need money to support the top-heavy pay structure. Without Covid-19 no one will know the struggle to upkeep such a unsustainable pay structure.,2021-02-16,22
405,"More Citation pls. I also can say ""2020 YTD personal debt $1.3b. Source : Wife"" 😂 Just kidding.",2021-02-17,15
406,2020 Budgets silenced the demagogues.   But not the one yesterday.   They are out yesterday cursing...,2021-02-17,14
409,"Sounding very much like Chauncey Gardener from Being There ""In the spring the garden will bloom"".🤔",2021-02-16,16
410,"Is a vicious cycle. Those highly paid officers who suggested this scheme to Finance Minister ought to be reprimanded. Their solutions thus far is so simple and don't need a scholar to do it. Increase water tax = discourage usage of water. Did this work? Increase in ERP = Discourage vehicle population during peak hours.  Increase in Conservancy charges = any reason given? Increase in household maid levy = any reason given? Increase in Electricity tariff = Discourage using electiricity. Now, increase in petrol = discourage drivers from driving more often.  So, the solution is simple. To solve a problem just increase fees.  Hence, they only have ONE solution for almost All matters.  So shameful.",2021-02-16,108
411,The petrol increase is totally NOT justifiable. Electric car take up is not high given that infrastructure is not mature yet and much to be done. Govt should put up incentives for adoption first rather than tax existing. ,2021-02-17,38
412,Make hay while the sun shines,2021-02-16,6
413,Collect so much tax..but any spent..what is the use..useless..,2021-02-16,12
414,"With all the impending increments of taxes, I worry I may not even survive to see the sun shine again...🤣🤣🤣",2021-02-16,20
415,The sun is not shining now? ,2021-02-17,6
416,Your petrol tax is incredibly high and too much to tax la,2021-02-16,12
417,The sun is rising n setting every day pandemic or not just that it is not as shining as it should have been,2021-02-16,23
418,"He is going to step down very soon, don’t talk so much please! ",2021-02-16,14
419,Shine for PAP corporation Inc only ...,2021-02-17,6
420,“seize new opportunity” = making the people pay more taxes,2021-02-16,9
421,count all the help n money one is getting lah ,2021-02-17,10
422,"When PM Lee, he shoots down the sun.",2021-02-17,8
423,Those who bought properties in 2020 will gain in coming years.,2021-02-17,10
424,Future recovery plans that is ,2021-02-16,5
425,Limpeh Singapore is the best managed country in the world hor. Confirm and chop.,2021-02-16,14
426,We just want you to be gone forever and our country can progress.,2021-02-16,13
427,The sun will always be there. Humanity ......?,2021-02-17,7
428,Catch up on the highlights of #SGBudget2021: https://str.sg/JHN9,2021-02-16,6
430,The petrol increase is totally NOT justifiable. Electric car take up is not high given that infrastructure is not mature yet and much to be done. Govt should put up incentives for adoption first rather than tax existing. ,2021-02-17,38
431,Increasing in fuel cost will also increase the living cost.... transportation is part of the chain effect,2021-02-16,17
432,"Petrol duties have been raised with immediate effect, road tax rebates wef 1st August 2021 to help offset increased costs.",2021-02-16,18
433,Time to take back those $$ given to you last Apr! Hooray! ,2021-02-18,11
434,"Why choose to increase petrol duties?  Why not Just adopt WP proposal, increase carbon tax by 10x!  Gov will get more revenue using WP’s model!   No need to be so nice and give rebate somemore! Just herng herng whack 10x!   Be brutal like WP! ",2021-02-16,43
435,What!! Petrol tax increase with immediate effect but road tax rebates only from Aug 2021😓,2021-02-16,14
436,We have responsible Government that care for us and long term planning. Unlike Opposition. Thats y we need to increase Pap vote to at least 75% to bring #SengkangAljunied back home to Pap.,2021-02-16,31
437,Been thinking of switching to hybrid car to save on petrol...but Govt don’t seem to support leh. ,2021-02-16,19
438,"The purpose is to push ppl to buy EV. Green this green that. But the infrastructure is not exactly ready till a few years later. And the cost of EV is so much more expensive.   If that's the case, then this increase in petrol cost should only come later right? Now it just looks like a cash grab",2021-02-16,57
439,Look forward to Food increase. Coz transportation with petrol duties increase. It a cycle chain. No GST hike does not meant no other ways to increase revenue.,2021-02-16,27
440,Road infrastructure is not even ready to support EV cars. Yet immediate effect to increase petrol prices ??? What’s going to increase next with immediate effect? 🤦‍♂️,2021-02-16,26
441,"Suka Suka increase... many folks’ salaries are already frozen...    If u care about our lifelihood, pls reduce income taxes... During LkY times, already got bigger tax discount...",2021-02-17,27
442,Push to EV....then once u commit....impose Power consumption tax....then LanLan....What happened to CNG and Diesel cars?!?!,2021-02-18,20
443,GST 2022 7% raised to 9% ... by 2022 salary will probably not even raise 0.1% ... 😢,2021-02-16,10
444,Balancing act? Give some before taking back.,2021-02-16,7
445,Around half the average price of petrol in australia... A massive county with limited public transport.,2021-02-16,16
446,Transport.bus and MRT fare will.increase by this year,2021-02-16,6
448,"Before gst goes up, petrol goes up, it affects lives of ordinary Singaporean even they do not own a car!",2021-02-18,20
449,Good to hike petrol excise duty.,2021-02-16,6
450,Is it to collect enough duties then can give rebates? Thats why raise is immediate but  rebates so much later? Why raise duties now? Thought the last raise was quite recent?,2021-02-16,31
451,Can fares will increase agai,2021-02-16,5
452,"Petrol increased,  all things will follow increase.",2021-02-16,7
453,Any news on Malaysian cars? Their unpaid fines....black smoke from their trailers n lorries....modified car plates???,2021-02-16,18
454,Well played well played. Full tank 50litre means we pay $32 more woooo,2021-02-17,11
455,Tax immediate Rebate wait loong loong in installment.,2021-02-18,8
456,Since EV infra is not well equipped. I think I can only consider diesel. 🤦🏻‍♂️,2021-02-16,14
457,Now we have the East Coast plan.....,2021-02-17,7
458,"All this figure will not come down anymore, likely it will keep going up...",2021-02-17,14
459,“When u wanna increase” u do it immediately. “When wanna give rebates” u drag months later.  ,2021-02-16,16
460,This is called “give and take” policy 😭,2021-02-16,7
461,"Please la, the petrol tax increase is permanent whereas the 15% road tax rebate is only once. ",2021-02-16,16
462,"Singapore government should TRIPLE cars only erp, coe, petrol tax, import tax as revenue to finance expenditure on mrt and buses with even more subsidies to lower fares. With grab and taxis and autonomous vehicle which is overall cheaper and more convenient, cars are for show off and prestige in Singapore. One lane of the road can be reclaimed for bicycles and escoooter. Car park becomes more greenery",2021-02-16,68
466,Tax those container ships passing Singapore straits. They emit lots of co2 too,2021-02-17,12
467,Private hire cars gt discount. Those doing delivery job using car no discount.😒😔,2021-02-16,13
468,Prices of Essential products will go up lor,2021-02-17,8
469,Good! Need ban petrol so people will stop using polluting cars,2021-02-17,11
470,"A 1-time annual rebate, followed by increased costs for each time you refuel, forever. 🤣",2021-02-16,14
471,VTO is the only way to go! This budget favors the rich and elites.Ordinary folks are hardest hit!,2021-02-16,17
472,Petrol increased will lead to transport fees up... Same like water increase lead to coffee n tea increase too..,2021-02-16,19
473,"At the end, we save or you earn🤣",2021-02-16,8
474,You give one time but your increase is forever... I rather you don't give at all...,2021-02-16,15
475,Rise so little ?  I expected increase 25% minimum  Is that consider a blessing? ,2021-02-16,12
476,“The Government will seek the president’s consideration for the use of past reserves if the outlook worsens.”   Wayang.,2021-02-16,19
477,Sorry but Halimah doesn't come across as someone who will say no to whatever comes from the ruling party.  Having the President be the watchdog for reserves is meaningless if the President wasn't democratically elected from a pool of nominees that aren't directly associated with the ruling party. ,2021-02-16,45
478,"Aiyah the President is just a puppet on a string she is not the only one making the final decision but many advisers around but the final yes or no answer ,credit lies with her cannot be the only decision",2021-02-16,40
479,Government seek president for use reserve our president sure  approve Without approve no other way. .,2021-02-20,15
481,Singapore captured 55 % of ASEAN foreign direct investment. Malaysia capture 5%. The rest of the ASEAN countries share 40%. Limpeh Singapore is the best managed country in the world hor,2021-02-16,27
482,"lmao use reserves kpkb, don’t use also kpkb. the whole lot of you really got itchy fingers waiting for your cpf isit?",2021-02-17,23
483,Global Covid-19 pandemic will be a permanent feature. Only a matter of time for double whammy... when is the Ebola pandemic in Africa is going to be a globetrotting virus?,2021-02-17,30
484,All here oppose for the sake of it. Look just vote for multparty and have political fighting problem solved.,2021-02-16,19
485,I understand it's inevitable to rise GST but can make essential items non taxable??,2021-02-16,13
486,Great news! We believe that raising GST will benefit the poor in these challenging times. Let’s hope the government will implement it soon without further delay.,2021-02-16,27
487,Actually GST can dont imply to essential stuff like medication baby milk powder staple food.and extras,2021-02-16,15
488,That mean left 9 months will start increase GST to 9% 1st Jan 2022..,2021-02-16,10
489,Mai Suka Suka raise GST during Covid times... Everyone already on reduced earnings now... still bird talk somemore...,2021-02-16,18
490,"OPPN Trolls, time of the year. KPKB. Let the party begin！  ",2021-02-16,11
491,Mr Plan MR Plan nothing interesting,2021-02-18,6
492,"Singapore should learn from the happiest country in the world, Finland. In Finland, the income tax average is 54 percent and gst is 24 percent. In NZ, the gst is 15 percent abs each citizen owes 151000 in national debt. Increasing taxation allows our government to have much more aresources to help the Community... The rich will be disadvantage by any increases in tax and gst",2021-02-16,62
493,Maybe they should consider not taxing some groceries like vegetables fruits that costs little instead of GST in every single item on sale,2021-02-16,23
494,Please let us withdraw our money at least 20 percent from the CPF regardless of OA SA MA or RA regardless of whom it may concern. This difficult situation will help those in needs & some countries already allowed their nation people to withdraw their Money to help their people in this predicament in needs ,2021-02-16,53
495,What.. tax on patrol up again? Soft target !! A group who can't oppose haha ,2021-02-16,13
496,Socialism Singapore with 1 long leader,2021-02-16,5
497,Don't need give long window period from 2022 to 2025 as confirmed will be in 2022. Great teaser,2021-02-16,14
498,You vote for what you get!,2021-02-17,6
499,Those member of parliament work for their pocket not citizens ,2021-02-16,10
503,"Sir,You Support Liverpool or Man U?",2021-02-16,7
504,Do something good for Singaporean please. Allow SA to pay for housing loan when OA runs out,2021-02-16,17
507,"Give one chicken... trying their best to get 3 chickens back. 😂 Erp, gst, petrol rises",2021-02-16,14
512,Huh? Postponed again? Sometimes some things are better to introduce them faster rather than delayed so that we don't get a sudden huge increase in the future....,2021-02-16,26
514,Now air shipment from overseas less than $400 also need to pay gst!!!! See whether you guys will still buy from Taobao!,2021-02-17,21
515,"Worldpeace , your east coast plan already lobang",2021-02-16,7
516,Rob Peter to pay Paul ,2021-02-16,5
517,"Can some one explain why SO huge amount $870. Million to Aviation sector ( 1/May speech mentioned to save SIA ) other sectors only $60 million agri food , $30 million Electric vehicle ) why $870 millions ",2021-02-16,29
518,"What comes out must go back (w compound interest). Money dun drop from e sky, my dear fellow citizens. Vote with this in mind..",2021-02-16,24
519,Thank you Mdm President for your wise decision 🙏🙏🙏,2021-02-16,8
520,"Tax is necessary. Every time take free thing also paisey, must give back to society lah.",2021-02-16,16
522,"Er, would President Halimah disagree or refuse? I should think not. The president and the PM's cabinet adalah dua-dua padan.",2021-02-16,18
523,Too little. Should have catered 25bil at least. We are definitely not out of the woods,2021-02-16,15
524,"As if she knows what is really there in the Reserves. 😂 🤣 😂 If she doesn't know how much is still there in the Reserves, how she approves? 😂 🤣 😂 🤣",2021-02-16,25
525,Criticize criticize criticize. Wow there are so many experts and presidential calibre here. 👏👏👏,2021-02-17,13
526,"Have you ever... ever seen any PAP MP or the President that said 'No' to LHL's request? Even LHL says a born Indian is actually a Malay, the law will back it up and certify it. LHL is God in Singapor, because you gave him your vote.",2021-02-16,46
527,"The reserves amounted to at least 3 figures billions what is 11 billion?Just like an ant to an elephant. Nothing to worry they know how to earn back what is drawn,given out in bad times when the storm had passed and the sun out shining brightly than ever before you can be certain there will be many ways to earn easy $ just wait and see",2021-02-16,65
528,"Limpeh Singapore is the best managed country in the world hor. With deep reserves and zero nett debt. No petroleum, gas reserves or rare earth deposits. Only a ministerial pay formula that other countries can never implement to ensure top tier talent as ministers. Most countries ministers are corrupted tier 3 and below talent as top tier talent are chasing their first billion dollar",2021-02-16,63
529,It’s all our own $ anyway just to make us happy but then GST increasing soon and more will come in future as everything seems to be increasing including transport electricity petrol etc ,2021-02-20,33
530,The puppet will yes to anything.,2021-02-17,6
536,Relief politicians and temasek pay and bail out the Rich. 100$ for each family. Go along now,2021-02-16,16
538,Can Halimah says let me check and get back to you? Will it offend anyone?,2021-02-16,15
543,Can she say no? 😂 just a vase.. An ugly one ,2021-02-16,10
544,Oh please...give me a break. You expect this Indian Lady to guard our money??? Or she more likely to open vault wider ?,2021-02-16,23
545,"Compared to 老李, HSK is a really dull speaker because he is reading as opposed to presenting.",2021-02-18,16
546,"Singapore government should TRIPLE cars only erp, coe, petrol tax, import tax as revenue to finance expenditure on mrt and buses with even more subsidies to lower fares. With grab and taxis and autonomous vehicle which is overall cheaper and more convenient, cars are for show off and prestige in Singapore. One lane of the road can be reclaimed for bicycles and escoooter. Car park becomes more greenery",2021-02-16,68
547,When times are good which is not too far from the horizon cos nothing bad lasts forever just increase what they think is good will recoup what had been given out,2021-02-16,31
548,👁👁👁 Heaven watching Tis buget dun really help the poor n low income family 😡😡😡 Petrol if increase 10 cent to 15  cent. Every damn thing will follow suit.  One Tank nw u pay $5 to $10 more. SP power sure to go up.Every hawker n bussiness will increase their price. !!! The poor will die faster !!!,2021-02-17,49
549,"Islandwide mosquito problems? Open pest control company. Covid problems? Open ventilator production company. SG needs 60,000 charging stations? 😱💰",2021-02-16,17
550,WAYANG always by JUNTA PAP,2021-02-16,5
551,"Any budget to develop dedicated bike paths for this greener future? Please stop the PCN nonsense. A path that people can walk/run/crawl is not a bike path, its just like any other pedestrain path. ",2021-02-16,36
552,We would not have expected anything lesser frankly considering how you are humming and hawing with the opening of our borders.,2021-02-16,21
553,"Some folks will be very happy again, especially the old ones. But think again, who are going to pay back to the piggy bank? Your next generations. So why should you be happy? ",2021-02-16,33
554,"Happily spending our reserve like Gov sibeh wo lui, now double quick time want to collect back.",2021-02-17,17
555,😰worried for my children and our future,2021-02-16,7
556,Can I don’t want the chicken wing and u don’t take my whole chicken too! ,2021-02-16,17
557,Please let us withdraw our money from the CPF at least 20 percent regardless of OA SA MA or RA from our CPF whatever balance that we have in our CPF regardless whom it may concern . It’s help alot for those who are in need for this difficult situation. Some countries already allowed and help theirs nations for this predicament in times of needs . ,2021-02-16,64
558,It’s no longer exceptional as the post Covid-19 world is the new norm.   Are we going to draw on reserves every year given that we have to live with this new norm?  ,2021-02-17,33
559,Yes but then they probably going to impose increases in various form of other taxes to “claw” back the spending. Eg the increase in petrol tax. This is classic PAP. No help will be given free ,2021-02-16,36
561,"But at the same time increase petrol, fares and etc. Sibei confused.",2021-02-16,12
562,"Aiyah the reserves are meant to use in emergencies its the duty of the govt to take care,look after the people in good or bad times.",2021-02-16,27
564,So why aren’t they covering Sep again .seriously what’s the point? Everything have extension but Not SIRS .,2021-02-16,19
565,Most countries fund their covid fight with debt for their future generations to pay.,2021-02-16,14
566,Haha. You dip but you are already announcing how to gonna s*ck back from us.,2021-02-16,16
567,Since when the tax raise is not necessarily! Raise more than reduce at this pandemic .,2021-02-16,15
568,Don’t worry can collect back when Gst rises to 9 percent,2021-02-16,11
569,I am more afraid of post pandemic...if you know what I mean,2021-02-16,13
570,"Rise this and that , still dip into reserves u sure no?",2021-02-16,11
571,11b also don't hv must dip into reserve,2021-02-16,6
572,"Can't always keep, got to spend some if need to..",2021-02-16,9
575,No need worry la... we got alot in our reserve. More free money plssssss,2021-02-16,14
576,"In our opinion, the government should liquidate Temasek, GIC, and return every single dollar that they have taxed (Interpret: Stolen) from Singaporeans.  The Singapore Government has completely overreacted to a virus with 99.95% survival rate, while causing massive damage to the economy, jobs, and businesses here. They are using the reserves to hide their mistakes (by bailing out the people who are damaged by their policy)  The Singapore Government are spending our reserves irresponsibly, and they cannot be entrusted with our money.",2021-02-16,81
577,"Still remember. The previous slogan of the stirers ""government wants to make money"". If government didn't make money to build up the reserve. Today COVID we eat grass",2021-02-16,27
578,If the opposition brings up the idea of using the reserves it will  be the hottest news on the newspapers the next day ,2021-02-16,23
579,Tell us the actual amount you dipped into... Paper cannot wrap fire.,2021-02-16,12
580,Dip my foot Robbing Peter to pay Paul ,2021-02-16,8
581,"On paper, our GST and taxes are low.   However, consider the following:   1) BTOs are about $600 psf in 2018. You can get a freehold condo in New York for $200-300 psf.   Land sales is a  contribution to our state revenue, AKA taxes.  2) Singaporean men have to serve NS- it takes away 2/40 income producing years. I consider this as a tax, the low stipend given represents a cost saving on the state (the opposite of taxes)   So if you take all of this into account, our taxes are very high indeed. For the same amount of taxes, you can get free healthcare, unemployment benefits in Canada:   https://www.investopedia.com/financial-edge/0411/do-canadians-really-pay-more-taxes-than-americans.aspx",2021-02-16,102
582,Cost of living in Singapore is already high. Now you are increasing GST and tax online goods.  This is not a good move especially for those from low income family.  Got to know people from low income when I did my volunteer work.   Feeling empathy for them,2021-02-16,47
583,Thanks for bringing the East Coast plan to Singapore ,2021-02-20,9
584,Must be suggested by East Coast residents.,2021-02-16,7
585,everything increase due to inflation. but criteria for qualifying for GST vouchers and subsidy for grants never increase or review.,2021-02-18,20
586,So expected on 2025. GST will be.12%.and expect one bowl of Mee will be from $7/ on ward..,2021-02-16,17
587,"Govt. also need $ they are not printing $ easily anytime they like want or pluck from a tree producing $ guarded by armed guards somewhere.They had already withdrawn billions from reserves to help the citizens how to put back?Simple,increase taxes in many areas.Stop grumbling you do not know nothing if you are not in the ruling party think its so easy",2021-02-16,59
588,This is the together east coast plan,2021-02-16,7
589,Camping for someone to make a political comment 😂,2021-02-16,8
