,comment_id,comment_parent_id,comment_body,comment_link_id,created_dts,author,score
0,gjo5v67,t3_kz8efj,"knowing our government, even if we go back to phase 2, we won't call it phase 2, but instead call it phase 3 v2 / phase 3.2 / phase together / or some kind of confusing shit like that",t3_kz8efj,2021-01-18 08:57:57,sct_trooper,131
1,gjnkgw0,t3_kz8efj,"I think got a lot of people who are sick and yet don’t see a doctor out of fear of being swabbed and subsequently being tested positive. Bring positive means you will be sent to ncid or any other hospital for mandatory quarantine and treatment with a potential loss of income and freedom for over two weeks. 

It’s no surprise to me that unlinked community cases still exist. Look at the unmasked crowds dining in cafes and restaurants. Look at the malls. Sometimes I feel people just forget covid still exists here because of our seemingly low community cases. Sigh.",t3_kz8efj,2021-01-18 06:04:17,Momoftwomonsters,63
2,gjmxwg4,t3_kz8efj,"Sick please go see doctor. Especially if you have covid symptoms. Don't be like that 44 year old woman, sit on the symptoms (fever, chills, loss of smell/taste) for about 2 weeks and got found out because her husband tested positive due to mandatory testing.",t3_kz8efj,2021-01-18 03:16:42,AceIclair,77
3,gjnnmdu,t3_kz8efj,We should reduce the group capacity for CNY. Unpopular but necessary.,t3_kz8efj,2021-01-18 06:26:33,bukitbukit,49
4,gjnum76,t3_kz8efj,"I think if the new variant, which spreads much more rapidly, takes hold here, then maybe even a phase 1.5.",t3_kz8efj,2021-01-18 07:20:32,redstarsum,14
5,gjnpgu7,t3_kz8efj,"I dont think govt will go back to phase 2 unless really really got super many community cases. They would probably just tweak some rules and regulations. Maybe cut back down to 5 peeps gathering again or places of worship cut back down the numbers, up the number of officers around and so on..",t3_kz8efj,2021-01-18 06:40:20,gennypuff,22
6,gjok1yf,t3_kz8efj,"Cny would be the best gauge whether restrictions are sufficient. I feel that TT would be made compulsory before cny. The crux is individuals don't really care about cost to the society or external cost. Unless there is support from the govt or companies, people are sick or with mild symptoms would not willingly go seek medical assistance.",t3_kz8efj,2021-01-18 11:02:37,dogssel,4
7,gjnxyi7,t3_kz8efj,"Absolutely agree that we should adopt the “better be safe than sorry” approach, especially as SG has such a high population density. I’ve already seen people blatantly walking around without masks and no-one calling them out on it. We all know that the new variant is sooo much more contagious and it’s not something to be trifled, with when much of the population still remains unvaccinated.",t3_kz8efj,2021-01-18 07:49:38,Toffeenutlatte912,10
8,gjnyeh3,t3_kz8efj,"Not a health expert but ppl need to seriously stop walking & eating in crowded places ( esp orchard), its like  they walk ard everywhere without mask among thousands of ppl cuz they needa drink their boba",t3_kz8efj,2021-01-18 07:53:26,blimeyo,14
9,gjnyo9u,t3_kz8efj,"It won't make a difference if we go back to phase 2. The only way to make a difference is for people to see a doctor and take PCR test if they're unwell. Secondly, is for the government to restrict the borders and/or extend the SHN to 21 days. With the new variants around the world, no one knows whether there's any change to the length of the infectious period.",t3_kz8efj,2021-01-18 07:55:49,WinterSmile,7
10,gjoeyqy,t3_kz8efj,"Go back to Phase 2 and sacrifice our economy? Yeah, not gonna happen",t3_kz8efj,2021-01-18 10:18:55,thattragedy,3
11,gjmplnw,t3_kz8efj,We should stop the imports of the foreigners for now and try to damp down the community cases.,t3_kz8efj,2021-01-18 02:26:42,pendelhaven,17
12,gjotb88,t3_kz8efj,Maybe you should proactively go back to phase 1 yourself to set a good example,t3_kz8efj,2021-01-18 12:34:52,theviperpanda9655,4
13,gjonqir,t3_kz8efj,Phase 2 and 3 not much difference. If you want to be safe then CB or Phase 1 :),t3_kz8efj,2021-01-18 11:37:53,Jammy_buttons2,5
14,gjnbjzc,t3_kz8efj,"Think of the GDP! If they can't stop importing cases, do you think they will stop the economy?",t3_kz8efj,2021-01-18 04:57:54,Imran_Rahim,3
15,gjpnoxq,t3_kz8efj,"Restaurants will hate u if we go back to phase 2. There’s no need to worry, just follow the existing guidelines and all will be fine. It’s normal for community case to resurface every now and then. This is the time for every biz to pick up the lost bucks in 2020.",t3_kz8efj,2021-01-18 19:46:45,Humptydumpty179,1
16,gjo0t6l,t3_kz8efj,There's barely any difference between phase 2 and 3. Wouldn't change much anyway.,t3_kz8efj,2021-01-18 08:14:27,bitflag,-1
17,gjsrw2c,t3_kz8efj,No.,t3_kz8efj,2021-01-19 12:51:30,haikallp,0
18,gjo1g2i,t3_kz8efj,"I support mass vaccination more though. The recent community cases aren't open transmissions, yet.",t3_kz8efj,2021-01-18 08:20:05,Elifgerg5fwdedw,-5
19,gjod9i9,t1_gjo5v67,">phase together 

Lmao I’m dead",t3_kz8efj,2021-01-18 10:03:54,Maplestori,107
20,gjoi43w,t1_gjo5v67,Phase Together HAHA 💀,t3_kz8efj,2021-01-18 10:45:54,ddarnittoheck,30
21,gjov5jb,t1_gjo5v67,Together we have a phase together plan 😌,t3_kz8efj,2021-01-18 12:54:56,Gwayguay,26
22,gjqofy5,t1_gjo5v67,Phase 2XS Pro Max,t3_kz8efj,2021-01-19 01:59:04,helloween123,10
23,gjpi0vd,t1_gjo5v67,"Phase ""3 -1.""
Social gathering limit + ""-3""
 
""We're not rolling back. We want to heighten our measure during this high risk period."" -- taskforce..",t3_kz8efj,2021-01-18 18:13:47,Zoisen,6
24,gjo87vc,t1_gjnkgw0,">I think got a lot of people who are sick and yet don’t see a doctor out of fear of being swabbed and subsequently being tested positive. Bring positive means you will be sent to ncid or any other hospital for mandatory quarantine and treatment with a potential loss of income and freedom for over two weeks.

No biggie because it's worth the risk for some. The price they pay is small compared to the negative externalities that others incur. That's why some are calling for harsh penalties for not seeking medical attention despite having some covid-19 symptoms - to better reflect the costs incurred by the larger society.",t3_kz8efj,2021-01-18 09:18:46,Calikura,15
25,gjopldx,t1_gjnkgw0,"Not to mention your close contacts will probably have to undergo the same thing, so there’s that “paiseh” aspect of not wanting to bother others unnecessarily",t3_kz8efj,2021-01-18 11:56:27,funkycarebear,4
26,gjnteby,t1_gjmxwg4,"The worst part is from 9 Jan she experienced symptoms till 16 Jan she tested positive, there’s no mention whether she has stayed at home all the while.

Imagine she didn’t, and she didn’t use TT. Now we got ppl who might be very well infectious walking around without knowing they come into contact with this lady.  All the effort by the collective individuals of this island might be ruined by just an irresponsible person. Sigh.",t3_kz8efj,2021-01-18 07:10:33,Kuumogg,39
27,gjo7n3y,t1_gjmxwg4,"This is the root of the problem. None of this group size limit and 1m distancing and banning BBQs and KTV or whatever shit helps at all, if we have fuckers with acute coughs and fevers squeezing onto buses, mrts and into markets and malls instead of going to the doctor and getting ordered to stay home for 5 days.",t3_kz8efj,2021-01-18 09:13:42,Calikura,12
28,gjo13yb,t1_gjmxwg4,A prolonged infection increases the likelihood of COVID mutations as well.,t3_kz8efj,2021-01-18 08:17:06,Elifgerg5fwdedw,2
29,gjsq3a9,t1_gjmxwg4,Cant get quarantined if you never tested positive *taps head*,t3_kz8efj,2021-01-19 12:33:08,Fellinlovewithawhore,1
30,gjo4k8g,t1_gjmxwg4,"There need to be a consequence for falling sick, not seeking medical help, end up with covid, spreading everywhere, causing loss of lives. 

Some people just too stubborn to see a doctor or just too selfish to give up a little bit of freedom for greater good. They didn’t realise their action could cause harm. 

Perhaps some hefty fine will knock some sense into their head.",t3_kz8efj,2021-01-18 08:46:50,Doppelgangeryc,-1
31,gjnwt6o,t1_gjnnmdu,"Just ban cny pls i dowan see my chou relatice face

Covid is a godsend",t3_kz8efj,2021-01-18 07:39:37,SamBellFromSarang,61
32,gjo24hy,t1_gjnnmdu,"I suppose those who break phase 3 guidelines will not care much about phase 2 guidelines as well.

I'd accelerate mass vaccination and active community testing.",t3_kz8efj,2021-01-18 08:26:04,Elifgerg5fwdedw,13
33,gjompnk,t1_gjnnmdu,I'm surprised a statement hasn't been officially addressed for this. Last year covid cny my friends were cautious already.,t3_kz8efj,2021-01-18 11:27:54,FodderFries,4
34,gjo4spk,t1_gjnum76,"When that happen, it would be too late to contain already. The reason why UK gov found out the new strain is because their #of cases keep rising despite lock down.",t3_kz8efj,2021-01-18 08:48:47,Doppelgangeryc,11
35,gjo8sis,t1_gjnpgu7,So phase 2 restrictions except in name?,t3_kz8efj,2021-01-18 09:23:51,Boogie_p0p,9
36,gjoad3g,t1_gjnpgu7,"If we have many community cases, phase 2 will not stop it.",t3_kz8efj,2021-01-18 09:38:06,9650bot,5
37,gjo7d6t,t1_gjnbjzc,"Between Phase 2 and 3, there's really minimal difference on the economy. 

[https://www.gov.sg/article/moving-into-phase-3-of-re-opening-on-28-dec-2020](https://www.gov.sg/article/moving-into-phase-3-of-re-opening-on-28-dec-2020)

Slightly more people can go to attractions. There's a higher mall/shop capacity but it seems to me that malls stopped limiting capacity before Phase 2 ended. Other than that, Phase 3 just allows for larger religious congregations, ceremonies, and live performances. The 8 person gathering thing is probably the biggest change, but we all know that groups larger than 5 were already going to restaurants together and sitting at 2 tables.

The main issue is that people are not taking the measures seriously any more.",t3_kz8efj,2021-01-18 09:11:18,DuePomegranate,2
38,gjsue71,t1_gjqofy5,This guy apples,t3_kz8efj,2021-01-19 13:18:51,stratint,3
39,gjo9zwi,t1_gjo87vc,"To play the devil's advocate, that may encourage covid patients to falsely report their symptom start date.

The woman in yesterday's case could have reported that she only started having symptoms the day before and it would be near impossible for authorities to check.

Perhaps false declaration of symptom onset date has already happened in the past but we have no way of knowing.

This would really mess with the contact tracing.",t3_kz8efj,2021-01-18 09:34:47,9650bot,23
40,gjoktez,t1_gjo87vc,Unfortunately I think some people just can’t be bothered with it. I have seen people who sneezed and coughed openly with their masks down all the time! Are they sick? No one knows if they refuse to seek medical treatment. Sigh.,t3_kz8efj,2021-01-18 11:09:44,Momoftwomonsters,5
41,gjnwdfa,t1_gjnteby,"Hence masking and keeping up hygiene is still very important. Infected people can still contaminate surfaces, we should not neglect fomite risks even though they aren’t the main vector.",t3_kz8efj,2021-01-18 07:35:47,bukitbukit,8
42,gjol4kx,t1_gjo7n3y,"Or just being kiasu and staying home instead. Maybe people need to learn to tell irresponsible employers fuck you if they insist on ill people coming in to work or threaten them with the sack. Again, time to whack the errant bosses. They will only stop pressuring ill employees from coming in when faced with criminal charges.

These idiots make a mockery out of proper HR and company regulations in other firms that strongly discourage employees from turning up to work ill.",t3_kz8efj,2021-01-18 11:12:38,bukitbukit,3
43,gjo9gp1,t1_gjo4k8g,I'm sure fear of more punishment will only make some people stay away from getting themselves checked.,t3_kz8efj,2021-01-18 09:29:51,horsetrich,13
44,gjoe7fp,t1_gjo4k8g,"You can implement all the consequences you want but this is impossible to enforce.

How can you tell if people are too stubborn to visit doctor?",t3_kz8efj,2021-01-18 10:12:14,chenz1989,4
45,gjo1dlu,t1_gjnwt6o,inb4 zoom cny reunion with e-hongbao,t3_kz8efj,2021-01-18 08:19:29,yewjrn,21
46,gjo9m61,t1_gjnwt6o,Exact same sentiment I have with last year Hari Raya . Chou relative face 😆,t3_kz8efj,2021-01-18 09:31:15,MisakiFC24,4
47,gjp8pan,t1_gjnwt6o,lol,t3_kz8efj,2021-01-18 15:44:12,Prize_Used,1
48,gjon7bl,t1_gjompnk,"Same here. My circle, especially since we have friends and families abroad in badly-hit cities, have been vigilant and cautious since last CNY. It’s not fun, it’s not like the old days but we need to have patience for the long haul.",t3_kz8efj,2021-01-18 11:32:41,bukitbukit,5
49,gjoa4qv,t1_gjo7d6t,"If people already weren’t following the rules what good is going back to Phase 2?

This is the consequence of SG being in circuit breaker for such an insane length of time — everyone has accumulated a lot of COVID fatigue",t3_kz8efj,2021-01-18 09:36:00,CharlesBrun,5
50,gjokuuo,t1_gjo9zwi," people who come in contact with the host do notice such things as its really sensitive now to even cough as people will immediately take notice. 

Even family members none the wiser would implicate you into it if details are inconsistent",t3_kz8efj,2021-01-18 11:10:07,denyhexes,4
51,gjoo9qo,t1_gjo9gp1,"I don’t understand your logic. 

If they are infected, getting treatment is in their best interest. There is no penalty involve. 

The penalty is only applicable when they know they could be infected but make conscious decision to hide it for reason like avoiding quarantine/penalty for breaking rules, and resulting in more people being infected or dying from the disease. 

There need to be an increasing heavier penalty for people to understand it’s better off if they take responsibility for their own actions, sooner rather than later. Some people are not capable of behaving socially responsibly voluntarily, hence rules and penalty are required. 

Once you do away with all the rules, 100% people will stop wearing mask, stop taking social distancing seriously. We would end up like any other country with uncontrolled spread. Covidiot is everywhere.",t3_kz8efj,2021-01-18 11:43:11,Doppelgangeryc,-5
52,gjommmx,t1_gjoe7fp,"Of course, the heavier penalty should come after more publicity on the government strategy to contain the virus to raise awareness. That our ability to contain the virus is heavily rely on the public to report to PHPC once they have symptom. 

For those with mild or no symptom, yes they could get away. But for those cases with serious symptoms, it would be uncovered eventually. Note, the purpose of the penalty is not to penalise them, but more to deter people from hiding and to encourage them to stand out, when they think they could have been infected.",t3_kz8efj,2021-01-18 11:27:04,Doppelgangeryc,-1
53,gjo1img,t1_gjo1dlu,I prerecord myself listening attentively then slack off to pcc,t3_kz8efj,2021-01-18 08:20:43,SamBellFromSarang,7
54,gjobefm,t1_gjoa4qv,"I'm not saying that we should go back to Phase 2. I'm saying that we should address the issue of people not taking the measures seriously. Malls aren't enforcing capacity limits. The government says ""work from home remains the default"" but work places are discouraging/prohibiting WFH. Work places may even be telling employees to avoid going to the doctor as to avoid getting hit with a 5-day MC. And because TT data can be seized by the police, everyone is finding ways to cheat the TT system.",t3_kz8efj,2021-01-18 09:47:25,DuePomegranate,4
55,gjpgwjt,t1_gjo1img,You got your priorities right,t3_kz8efj,2021-01-18 17:54:48,Rikuboy,1
56,gjod15x,t1_gjobefm,"Yeah, I don’t know how much can be done. The TT situation was such a breach of public trust the program is doomed. Otherwise limits can only be enforced so much. Sporeans really did a good job voluntarily adhering for a long time so it’s tough to expect many more months of strict adherence (especially when COVID numbers are still very low compared to neighbours).",t3_kz8efj,2021-01-18 10:01:50,CharlesBrun,4
