id,conversation_id,created_at,date,time,timezone,user_id,username,name,place,tweet,language,mentions,urls,photos,replies_count,retweets_count,likes_count,hashtags,cashtags,link,retweet,quote_url,video,thumbnail,near,geo,source,user_rt_id,user_rt,retweet_id,reply_to,retweet_date,translate,trans_src,trans_dest
1364622128255930368,1364622128255930368,2021-02-25 01:04:03 +08,2021-02-25,01:04:03,+0800,386442740,segla_men,SeglaMen ሰግላሜን 🏁,,"No one should ever underestimate the destructive power of drones, so far over 52K+ Tigrayans have died, &amp; drones have destroyed historical and ancient places of worship such as Al-Nejashi. @WorldBank do NOT sponsor #TigrayGenocide #SanctionEthiopia   https://t.co/6FU6tzwxkJ",en,"[{'screen_name': 'worldbank', 'name': 'world bank', 'id': '27860681'}]",['https://bbc.in/2Pae7WZ'],[],0,0,0,"['tigraygenocide', 'sanctionethiopia']",[],https://twitter.com/Segla_Men/status/1364622128255930368,False,,0,,Singapore,,,,,,[],,,,
1272683813920026626,1272683813920026626,2020-06-16 08:14:01 +08,2020-06-16,08:14:01,+0800,2378489462,bernardlim108,Bernard Lim,"{'type': 'Point', 'coordinates': [1.29306, 103.856]}","Phase 2 look. Come Friday, Singapore enters phase 2. Gatherings of up to 5 persons are allowed. Gyms, restaurants, hawker centres, coffee shops and retail are open. Bars and places of worship remain closed. Please…  https://t.co/Q5qyoXi1qP",en,[],['https://www.instagram.com/p/CBebdDtHTaA/?igshid=1v0zrv6er0vr0'],[],0,0,0,[],[],https://twitter.com/bernardlim108/status/1272683813920026626,False,,0,,Singapore,,,,,,[],,,,
1262718825352454145,1262718825352454145,2020-05-19 20:16:42 +08,2020-05-19,20:16:42,+0800,14487706,tutu22,とぅとぅ,,"え。。。ちょ。。。ま。。。 Singapore to exit circuit breaker on Jun 1, visiting of parents, places of worship allowed with restrictions  https://t.co/XaWUHWzAu1",ja,[],['https://www.channelnewsasia.com/news/singapore/singapore-exit-circuit-breaker-jun-1-visit-parents-worship-12749222#.XsPOHAq9lsw.twitter'],[],0,0,3,[],[],https://twitter.com/tutu22/status/1262718825352454145,False,,0,,Singapore,,,,,,[],,,,
1248293772909142017,1248271441696456707,2020-04-10 00:56:42 +08,2020-04-10,00:56:42,+0800,186552769,zeejenks,cat//dad,,@anndylian @leehsienloong @WHO Earlier clusters also heavily linked to places of worship.,en,[],[],[],1,0,2,[],[],https://twitter.com/zeejenks/status/1248293772909142017,False,,0,,Singapore,,,,,,"[{'screen_name': 'anndylian', 'name': 'Anndy Lian #Blockchain #Crypto #Singapore', 'id': '274334177'}, {'screen_name': 'leehsienloong', 'name': 'leehsienloong', 'id': '34568673'}, {'screen_name': 'WHO', 'name': 'World Health Organization (WHO)', 'id': '14499829'}]",,,,
1242659223202226177,1242659223202226177,2020-03-25 11:47:00 +08,2020-03-25,11:47:00,+0800,1128989622464200704,aliisbk1,AliciaCtheWorld,,Many countries have already suspended prayer sessions. And closed places of worship for now.,en,[],[],[],0,0,0,[],[],https://twitter.com/AliIsBk1/status/1242659223202226177,False,https://twitter.com/richardmarx/status/1242598706160922625,0,,Singapore,,,,,,[],,,,
1242421049267875845,1242421049267875845,2020-03-24 20:00:35 +08,2020-03-24,20:00:35,+0800,28138067,alvinongco,Alvin Ong,,"This is huge…   https://t.co/ewcij4Woy2  “As for places of worship, MOH stated that all religious services and congregations are to be suspended, with only private and essential rites allowed at a place of worship, for a group of no more than 10 people.”",en,[],['https://mothership.sg/2020/03/singapore-social-limit-10-people/'],[],0,0,0,[],[],https://twitter.com/alvinongco/status/1242421049267875845,False,,0,,Singapore,,,,,,[],,,,
1240502311111118849,1240498634258403328,2020-03-19 12:56:13 +08,2020-03-19,12:56:13,+0800,91630900,muloongo,Muloongo Muchelemba,,"@CNsekela @mohzambia @EdgarCLungu @Mwebantu Now we see why there is a separation of state and religion elsewhere. The state represents 100% of the population; churches, mosques and other places of worship do not. Not everyone is religious. This is a matter of national security so religion needs to take a backseat.",en,[],[],[],0,0,1,[],[],https://twitter.com/Muloongo/status/1240502311111118849,False,,0,,Singapore,,,,,,"[{'screen_name': 'CNsekela', 'name': 'Charles Nsekela', 'id': '941005656'}, {'screen_name': 'mohzambia', 'name': 'Ministry of Health Zambia', 'id': '1200316338'}, {'screen_name': 'EdgarCLungu', 'name': 'Edgar Chagwa Lungu', 'id': '742699047941771264'}, {'screen_name': 'Mwebantu', 'name': 'Mwebantu', 'id': '581123471'}]",,,,
1240498634258403328,1240498634258403328,2020-03-19 12:41:36 +08,2020-03-19,12:41:36,+0800,91630900,muloongo,Muloongo Muchelemba,,Zambia needs to ban all religious services immediately. Places of worship were the biggest spreader of #coronavirus in many countries. People should use the radio or live tv instead.  @mohzambia @EdgarCLungu @Mwebantu   #Zambia #ZedTwitter,en,"[{'screen_name': 'mohzambia', 'name': 'ministry of health zambia', 'id': '1200316338'}, {'screen_name': 'edgarclungu', 'name': 'edgar chagwa lungu', 'id': '742699047941771264'}, {'screen_name': 'mwebantu', 'name': 'mwebantu', 'id': '581123471'}]",[],[],11,18,62,"['coronavirus', 'zambia', 'zedtwitter']",[],https://twitter.com/Muloongo/status/1240498634258403328,False,,0,,Singapore,,,,,,[],,,,
1239582844566917120,1239582844566917120,2020-03-17 00:02:35 +08,2020-03-17,00:02:35,+0800,44498706,brodicole,Brodi Cole,"{'type': 'Point', 'coordinates': [1.4691, 103.7512]}",Malaysia just announced it is going into lockdown March 18-31. What does this mean?  1) A total ban on public movement and mass activities 2) All businesses and places of worship closed except for shops and…  https://t.co/QECw1in7Et,en,[],['https://www.instagram.com/p/B9zO3wMFfer/?igshid=11dhwjcp75znl'],[],0,0,0,[],[],https://twitter.com/brodicole/status/1239582844566917120,False,,0,,Singapore,,,,,,[],,,,
