id,conversation_id,created_at,date,time,timezone,user_id,username,name,place,tweet,language,mentions,urls,photos,replies_count,retweets_count,likes_count,hashtags,cashtags,link,retweet,quote_url,video,thumbnail,near,geo,source,user_rt_id,user_rt,retweet_id,reply_to,retweet_date,translate,trans_src,trans_dest
1247055899698458624,1247055899698458624,2020-04-06 14:57:50 +08,2020-04-06,14:57:50,+0800,141241551,raymond936,Raymond,,Hello @SingPostCusCare  Pls dun hand us use yr tablet to key in our info for covid-19 contact tracing. We prefer contactless way of keying info. This what Safra started 1st and it might has caused virus cluster. Safra has since changed their way of doing it contactless  #singpost,en,"[{'screen_name': 'singpostcuscare', 'name': 'singpost cuscare', 'id': '819117420'}]",[],[],0,0,0,['singpost'],[],https://twitter.com/Raymond936/status/1247055899698458624,False,,0,,Singapore,,,,,,[],,,,
1246969955930632198,1246969955930632198,2020-04-06 09:16:19 +08,2020-04-06,09:16:19,+0800,123224818,unnamed101,Oscar Cassetti,,"Do your part for contact tracing - Download TraceTogether App to help contact tracers determine if you have been exposed to virus - Keep your taxi receipts for 1 month to help contact tracing team, if you or your driver is infected  https://t.co/jqSBkLu8S7",en,[],['http://Go.gov.sg/traceapp'],[],0,0,0,[],[],https://twitter.com/unnamed101/status/1246969955930632198,False,,0,,Singapore,,,,,,[],,,,
1246260366859841536,1246260366859841536,2020-04-04 10:16:40 +08,2020-04-04,10:16:40,+0800,41269448,santoshaka,𝙎𝙖𝙣𝙩𝙤𝙨𝙝 𝙏𝙝𝙖𝙥𝙖 𝙈𝙖𝙜𝙖𝙧,,अन्त के छ था’भैन । सिंगापुरमा चै कोभिड-१९ को contact tracing को लागि आर्मी पनि प्रयोग गरिया’छ । यत्तिको सिरियस भएर भिड्न पर्याछ ।,ne,[],[],[],0,3,10,[],[],https://twitter.com/SantoshAKA/status/1246260366859841536,False,,0,,Singapore,,,,,,[],,,,
1245599647797673987,1245566844649590784,2020-04-02 14:31:12 +08,2020-04-02,14:31:12,+0800,224502057,vonbraun01,Aman,,"@sportsinsights7 Here’s the thing. While all this kumbaya stuff is great, if Canada actually practiced contact tracing, temperature checks everywhere, mandated social distancing, cigarette sale restriction. They might have a fighting chance. Priorities.",en,[],[],[],0,0,0,[],[],https://twitter.com/Vonbraun01/status/1245599647797673987,False,,0,,Singapore,,,,,,"[{'screen_name': 'sportsinsights7', 'name': 'Bryan Barbieri', 'id': '3051838545'}]",,,,
1244927593352065027,1244927593352065027,2020-03-31 18:00:42 +08,2020-03-31,18:00:42,+0800,152561321,azhrmj,azhrmj,,Contact tracing gomen sg makin ketat. Tengah hari td aku kena enable location from phone lepas dpt mesej from them. Then aku pergi makan restaurant and salon rambut Kimage kena isi nama and phone no. Fuh..,in,[],[],[],0,0,0,[],[],https://twitter.com/azhrmj/status/1244927593352065027,False,,0,,Singapore,,,,,,[],,,,
1244639483212988419,1244639483212988419,2020-03-30 22:55:51 +08,2020-03-30,22:55:51,+0800,1062889275610415104,muhamma22492130,MUHAMMAD FARID,"{'type': 'Point', 'coordinates': [1.41485377, 103.8398959]}","Umi and ayah missed  you so much eventho 3 days never meet both of you is like 3years, due of my fever,cough, flu and the doctor gave me 5 days  of mc and my wife is under contact tracing due to convid 19 positive…  https://t.co/fhG52fGH7u",en,[],['https://www.instagram.com/p/B-XKXXJBb7v/?igshid=1kg07vuogcoof'],[],0,0,0,[],[],https://twitter.com/MUHAMMA22492130/status/1244639483212988419,False,,0,,Singapore,,,,,,[],,,,
1243818092431650817,1243818092431650817,2020-03-28 16:31:56 +08,2020-03-28,16:31:56,+0800,913765669870514177,kyzermutt,Kyzermutt,,"Our govt have developed an app that uses Bluetooth to track which users an affected personnel have been close to.  It doesn't require any details apart from your phone number, and neither does it require permissions.  Quite the novel solution to ease the burden on contact tracing",en,[],[],[],0,0,2,[],[],https://twitter.com/kyzermutt/status/1243818092431650817,False,,0,,Singapore,,,,,,[],,,,
1243721368027328512,1243504097107611650,2020-03-28 10:07:36 +08,2020-03-28,10:07:36,+0800,20836740,gulasahi,Steve Dawson,,"@MaddockMirror ‘Fewer’ people. Singapore is a bit like SIM city: small, sea-locked, malleable. Contact tracing is a very detailed exercise that gets exponential at each level.  The UK is large and unwieldy, the degree of difficulty by comparison is significant. 🍎 🍊",en,[],[],[],0,0,0,[],[],https://twitter.com/Gulasahi/status/1243721368027328512,False,,0,,Singapore,,,,,,"[{'screen_name': 'MaddockMirror', 'name': 'David Maddock', 'id': '988805420960624640'}]",,,,
1243442692576575488,1243442692576575488,2020-03-27 15:40:14 +08,2020-03-27,15:40:14,+0800,416165773,trevisanale,Alessandra Trevisan,,#preparation #aggressivetesting #contacttracing #SingaporefightingCovid19,und,[],[],[],0,0,0,"['preparation', 'aggressivetesting', 'contacttracing', 'singaporefightingcovid19']",[],https://twitter.com/TrevisanAle/status/1243442692576575488,False,https://twitter.com/FinancialTimes/status/1242428884202795008,0,,Singapore,,,,,,[],,,,
1243394616222613505,1243394616222613505,2020-03-27 12:29:12 +08,2020-03-27,12:29:12,+0800,397966748,veloruntheworld,Ra,,"Baru baca ini, Saya setuju sama Fadli Zon &amp; Analisanya. Jgn bandingkan dgn Singapura (meski SG bisa aja lockdown) - SG penanganannya cepat sebelum WHO bertindak, &amp; disini contact tracing pakai detective. Community spread gak se massive di Indonesia, ntar nyesel lo Jokowi..",in,[],[],[],0,0,0,[],[],https://twitter.com/VeloRuntheworld/status/1243394616222613505,False,https://twitter.com/fadlizon/status/1242028243395342336,0,,Singapore,,,,,,[],,,,
1242673823163363328,1242673823163363328,2020-03-25 12:45:01 +08,2020-03-25,12:45:01,+0800,1174647267782848512,ardyyyanugrah,RioArdy,,"Imagine one whole club touch wood gets infected... How many more cross infections is gonna happen... Contact tracing makes the family of those in the club gets quarantined, then if they take grab home? The driver also kene quarantine? Thinking of the bigger picture.",en,[],[],[],1,10,4,[],[],https://twitter.com/ardyyyanugrah/status/1242673823163363328,False,,0,,Singapore,,,,,,[],,,,
1242631912356581379,1242631912356581379,2020-03-25 09:58:29 +08,2020-03-25,09:58:29,+0800,118669913,karnaprasad,karnaprasad,,Help speed up contact tracing with TraceTogether  https://t.co/CPL1SEiMw8,en,[],['https://www.gov.sg/article/help-speed-up-contact-tracing-with-tracetogether'],[],0,0,0,[],[],https://twitter.com/karnaprasad/status/1242631912356581379,False,,0,,Singapore,,,,,,[],,,,
1242300785427238912,1242282523692056592,2020-03-24 12:02:42 +08,2020-03-24,12:02:42,+0800,5854302,patchouliw,Patchouli Woollahra nee Alia Fairbrooke,,"@ChuckBaggett Well, I do regular checks of the page when I'm present, and the local authorities have several tracking methods including a app called TraceTogether on hand for contact tracing too.",en,[],[],[],0,0,0,[],[],https://twitter.com/PatchouliW/status/1242300785427238912,False,,0,,Singapore,,,,,,"[{'screen_name': 'ChuckBaggett', 'name': 'Chuck Baggett: How can you hide promoted tweets?', 'id': '16659187'}]",,,,
1242193304390782976,1242186920685338629,2020-03-24 04:55:37 +08,2020-03-24,04:55:37,+0800,431878370,makennacamille,Makenna,,@fightfortheftr I’m in Singapore and the gov here is using (voluntary) national contact tracing via an app to identify and inform anyone who was in contact with an infected person. They’re basically tracking everyone’s movements to reduce spread. I think it’s the best thing ever.,en,[],[],[],0,0,0,[],[],https://twitter.com/makennacamille/status/1242193304390782976,False,,0,,Singapore,,,,,,"[{'screen_name': 'fightfortheftr', 'name': 'Fight for the Future', 'id': '382376904'}]",,,,
1242137216308011008,1242130357832560641,2020-03-24 01:12:44 +08,2020-03-24,01:12:44,+0800,134866460,davidjrainey,David Rainey 🇸🇬,,"@ProfChalmers I don’t know that the UK couldn’t have done contact tracing, but there are at least three things that made it especially effective in Singapore: Every adult remembers SARS. They trust the govt. and every govt system is connected and almost everything is digital.",en,[],[],[],1,0,1,[],[],https://twitter.com/davidjrainey/status/1242137216308011008,False,,0,,Singapore,,,,,,"[{'screen_name': 'ProfChalmers', 'name': 'James Chalmers', 'id': '2302973899'}]",,,,
1242026927960911872,1242026927960911872,2020-03-23 17:54:30 +08,2020-03-23,17:54:30,+0800,162345130,thongkh,thongkh,,"#WHO Says #Lockdowns Won’t Curb #COVID19, Contact #Tracing &amp; #Isolation Like What #Singapore Does Are #Best 👍🏻   https://t.co/FculO3t96r  https://t.co/25mbeRaQS4",en,[],['https://mustsharenews.com/who-lockdowns/?utm=telegram'],['https://pbs.twimg.com/media/ETyQ6IGU8AAs49h.jpg'],0,0,0,"['who', 'lockdowns', 'covid19', 'tracing', 'isolation', 'singapore', 'best']",[],https://twitter.com/thongkh/status/1242026927960911872,False,,1,https://pbs.twimg.com/media/ETyQ6IGU8AAs49h.jpg,Singapore,,,,,,[],,,,
1241532592920211456,1241532592920211456,2020-03-22 09:10:11 +08,2020-03-22,09:10:11,+0800,81628977,asifsaleem80,Asif Saleem,,An excellent digital initiative for contact tracing by government of Singapore. Trace together helps tracking of ppl who gets COVID-19 and digitally track who they have been around.  https://t.co/qHGTVLkJjx,en,[],['https://www.tracetogether.gov.sg/'],[],0,0,1,[],[],https://twitter.com/asifsaleem80/status/1241532592920211456,False,,0,,Singapore,,,,,,[],,,,
1241315188080435203,1241315188080435203,2020-03-21 18:46:18 +08,2020-03-21,18:46:18,+0800,1087508383601573888,lokshee,shee-mei lok,,Innovative way to do contact tracing.  https://t.co/8uihHJvpR2,en,[],['https://www.channelnewsasia.com/news/singapore/singapore-s-new-covid-19-contact-tracing-app-tracetogether-how-12562608'],[],0,2,4,[],[],https://twitter.com/LokShee/status/1241315188080435203,False,,0,,Singapore,,,,,,[],,,,
1241275631221923841,1241275631221923841,2020-03-21 16:09:06 +08,2020-03-21,16:09:06,+0800,162345130,thongkh,thongkh,,WATCH: Have you downloaded the #TraceTogether #app to help contact tracing amid the #COVID19 #outbreak?  Here’s how it works:  https://t.co/Gn9jLCfGEj  #Download it here:  https://t.co/5WW5D75Mut,en,[],"['https://youtu.be/6n9ZsHSc4YA', 'https://www.tracetogether.gov.sg/']",[],0,0,0,"['tracetogether', 'app', 'covid19', 'outbreak', 'download']",[],https://twitter.com/thongkh/status/1241275631221923841,False,,0,,Singapore,,,,,,[],,,,
1241242836323815426,1241064262887518208,2020-03-21 13:58:48 +08,2020-03-21,13:58:48,+0800,22361966,_philiproberts,Philip Roberts,,"@savasavasava Right.  It would be wonderful to see this type of crowdsourced contact tracing emerge from a community initiative for the reasons you suggest.  Then again, if that happened, I can imagine criticism of the government like “why aren’t they dealing with this?”.",en,[],[],[],1,0,0,[],[],https://twitter.com/_PhilipRoberts/status/1241242836323815426,False,,0,,Singapore,,,,,,"[{'screen_name': 'savasavasava', 'name': 'sava', 'id': '16699990'}]",,,,
1241217924687261697,1241217924687261697,2020-03-21 12:19:48 +08,2020-03-21,12:19:48,+0800,2866145822,vandanahari_sg,Vandana Hari,,"I have signed on to this app by @sporeMOH, which facilitates contact tracing if needed through one's mobile phone. Another brilliant idea in the fight against #coronavirus. #FightCOVID19 #fightCoronavirus #coronavirussingapore  https://t.co/7wV4tuKyEm",en,"[{'screen_name': 'sporemoh', 'name': 'ministry of health', 'id': '78772642'}]",[],['https://pbs.twimg.com/media/ETmxH79U0AAlXnr.jpg'],0,1,3,"['coronavirus', 'fightcovid19', 'fightcoronavirus', 'coronavirussingapore']",[],https://twitter.com/VandanaHari_SG/status/1241217924687261697,False,,1,https://pbs.twimg.com/media/ETmxH79U0AAlXnr.jpg,Singapore,,,,,,[],,,,
1241197586746236931,1241197586746236931,2020-03-21 10:58:59 +08,2020-03-21,10:58:59,+0800,266481056,margrietvonno,NLambasSingapore,,Singapore works on contact tracing #Covid_19 You can download the app: trace-together:  https://t.co/WdZbEzmtBF,en,[],['https://mothership.sg/2020/03/trace-together-covid/'],[],0,0,0,['covid_19'],[],https://twitter.com/MargrietVonno/status/1241197586746236931,False,,0,,Singapore,,,,,,[],,,,
1241174895423176705,1241071626071965697,2020-03-21 09:28:49 +08,2020-03-21,09:28:49,+0800,15291489,wce917,Christopher Ellis 🇸🇬🇺🇸,,"@opinion_joe I have been thinking of this! In Singapore we have to ""sign in"" to buildings, establishments etc for contact tracing...with the same pen! Some do allow sign in with qr code",en,[],[],[],0,0,0,[],[],https://twitter.com/wce917/status/1241174895423176705,False,,0,,Singapore,,,,,,"[{'screen_name': 'opinion_joe', 'name': 'Joe Nocera', 'id': '2561646679'}]",,,,
1241126198702301184,1241126198702301184,2020-03-21 06:15:19 +08,2020-03-21,06:15:19,+0800,32332382,tomtyronebeiron,Tom Tyrone Beiron,,Singapore launches TraceTogether mobile app to boost COVID-19 contact tracing efforts  https://t.co/S63XhReNdU,en,[],['https://www.channelnewsasia.com/news/singapore/covid19-trace-together-mobile-app-contact-tracing-coronavirus-12560616#.XnVAcDFxVMk.twitter'],[],0,0,0,[],[],https://twitter.com/TomTyroneBeiron/status/1241126198702301184,False,,0,,Singapore,,,,,,[],,,,
1241020094085337088,1241020094085337088,2020-03-20 23:13:42 +08,2020-03-20,23:13:42,+0800,68087176,bryanbma,Bryan Ma,,"Singapore's @GovTechSG just rolled out this app for #COVID19 contact tracing via Bluetooth. Kinda like Tile for people, but w/o location info and more of a locally stored proximity log, if I understood it correctly  https://t.co/fL3S7u1rrb  https://t.co/FiEPWBOLr2",en,"[{'screen_name': 'govtechsg', 'name': 'govtech (singapore)', 'id': '123167035'}]",['https://www.tracetogether.gov.sg/'],"['https://pbs.twimg.com/media/ETj9LTxU8AAsDF0.jpg', 'https://pbs.twimg.com/media/ETj9L3vUUAAfhgw.jpg', 'https://pbs.twimg.com/media/ETj9MXJUEAEP_ZQ.jpg']",2,18,29,['covid19'],[],https://twitter.com/bryanbma/status/1241020094085337088,False,,1,https://pbs.twimg.com/media/ETj9LTxU8AAsDF0.jpg,Singapore,,,,,,[],,,,
1240977995164045312,1240977995164045312,2020-03-20 20:26:24 +08,2020-03-20,20:26:24,+0800,178040437,jasondlp,Jason de la Peña 🇪🇸🇮🇳🇬🇧,,So so clever. The Lion City leading from the front once again. Proud to say that this island is my home. 👏🏼🙌🏼👍🏼🙏🏼 #coronavirus #covid19  Singapore launches TraceTogether mobile app to boost COVID-19 contact tracing efforts  https://t.co/D6IRkPZ9lW,en,[],['https://www.channelnewsasia.com/news/singapore/covid19-trace-together-mobile-app-contact-tracing-coronavirus-12560616'],[],0,1,1,"['coronavirus', 'covid19']",[],https://twitter.com/jasondlp/status/1240977995164045312,False,,0,,Singapore,,,,,,[],,,,
1240837525272322048,1240837525272322048,2020-03-20 11:08:14 +08,2020-03-20,11:08:14,+0800,109549653,evnnathan,Evan Nathan,,Singapore nomor 1 di dunia dalam penanganan Covid-19  Warga2 disini juga tidak paranoid dan tidak mengalami misinformasi dalam perkembangan terkini Virus Corona.  Pemerintah kompeten dalam contact tracing dan transparan kepada warganya.  Situasi food court Takashimaya 18 Maret  https://t.co/Zi8BtsYjj1,in,[],[],[],1,1,1,[],[],https://twitter.com/EvnNathan/status/1240837525272322048,False,,1,https://pbs.twimg.com/ext_tw_video_thumb/1240837464303886336/pu/img/1ztLfWFRJ2Zx8iml.jpg,Singapore,,,,,,[],,,,
1240696505930932224,1240688955420364805,2020-03-20 01:47:52 +08,2020-03-20,01:47:52,+0800,16006707,homiliai,Jules Yim｜ 芊文,,"@eccemarco Singapore is probably the safest place to be at the moment. Do look at our contact tracing protocols, stay-at-home process and NCID to see how we do it. 😊 How about your? Pretty wild in Europe at the moment.",en,[],[],[],1,0,2,[],[],https://twitter.com/homiliai/status/1240696505930932224,False,,0,,Singapore,,,,,,"[{'screen_name': 'eccemarco', 'name': 'Marco Valente', 'id': '22420895'}]",,,,
1240638926798241793,1240488068420734976,2020-03-19 21:59:04 +08,2020-03-19,21:59:04,+0800,34635043,maximos62,💧 Russell Darnley,,"@Hambledown_Road @guyllrees @stephenjduckett I don’t see sufficient awareness in Australia. It needs, right now: - aggressive case detection  - contact tracing, with prompt isolation &amp; treatment - quarantining of close contacts;  - strict social distancing",en,[],[],[],1,1,1,[],[],https://twitter.com/maximos62/status/1240638926798241793,False,,0,,Singapore,,,,,,"[{'screen_name': 'Hambledown_Road', 'name': 'Dean Mayes', 'id': '575490127'}, {'screen_name': 'guyllrees', 'name': 'Guy Rees', 'id': '176399326'}, {'screen_name': 'stephenjduckett', 'name': 'Stephen Duckett', 'id': '1000499544'}]",,,,
1239899084598607872,1239890336291467266,2020-03-17 20:59:12 +08,2020-03-17,20:59:12,+0800,1578193502,esteetorok,Estée Torok 💙,,"@nwheeler443 They are already doing this for contact tracing of #COVID in Singapore, I believe ..",en,[],[],[],1,0,0,['covid'],[],https://twitter.com/EsteeTorok/status/1239899084598607872,False,,0,,Singapore,,,,,,"[{'screen_name': 'nwheeler443', 'name': 'Nicole Wheeler', 'id': '3284736732'}]",,,,
1239332597777305600,1239328825466486784,2020-03-16 07:28:11 +08,2020-03-16,07:28:11,+0800,20516440,tmllr,Tom Miller,,"When cases started presenting, there was a contact tracing task force set up to identify people exposed to the other sick people. They famously discovered clusters around a church and a business meeting that probably prevented a lot of infections.",en,[],[],[],1,0,0,[],[],https://twitter.com/tmllr/status/1239332597777305600,False,,0,,Singapore,,,,,,[],,,,
1238435205985079296,1238435195461586944,2020-03-13 20:02:16 +08,2020-03-13,20:02:16,+0800,40859142,fafuierice,Fafui,,"in Singapore, they actually put you in jail if they catch you lying about contact tracing or violating your Stay At Home quarantine. Let’s be clear, not bail or warnings. Just jail. That’s how much they punish people heavily with this shit. And that’s also why people are",en,[],[],[],1,0,0,[],[],https://twitter.com/fafuierice/status/1238435205985079296,False,,0,,Singapore,,,,,,[],,,,
1238109161637978112,1238109161637978112,2020-03-12 22:26:41 +08,2020-03-12,22:26:41,+0800,950533420626538498,juniordevsg,JuniorDevSG 🇸🇬,,Gentle reminder for tomorrow:  1) Do see a doc if you are not feeling well.  2) We have a hard limit of 30 attendees. Temperature &amp; personal particulars will be taken for contact tracing (just in case). 3) Live stream and Zoom are available.   https://t.co/atRsgE2W5t,en,[],['http://meetu.ps/e/HN7fr/3bQQt/a'],[],1,2,11,[],[],https://twitter.com/JuniorDevSG/status/1238109161637978112,False,,0,,Singapore,,,,,,[],,,,
1237906081646440448,1237787570500755458,2020-03-12 08:59:43 +08,2020-03-12,08:59:43,+0800,258339909,atiyaahdollfie,Atiyaah A. Miu,,@aanand @ThaumPenguin Contact tracing gone utterly nuts.,en,[],[],[],0,0,0,[],[],https://twitter.com/AtiyaahDollfie/status/1237906081646440448,False,,0,,Singapore,,,,,,"[{'screen_name': 'aanand', 'name': 'Betsy DevOps', 'id': '14149919'}, {'screen_name': 'ThaumPenguin', 'name': 'Twenty-Twenty-Thaum', 'id': '1694592770'}]",,,,
1237767354286665729,1237748045418303488,2020-03-11 23:48:28 +08,2020-03-11,23:48:28,+0800,315816992,bencharoenwong,Ben Charoenwong,,"@GaborNyeki @economeager @fasani_f @Osea82 @ClimentQD @causalinf @MarkJHandley Contact tracing in Singapore actually uses it's full system of CCTVs around the country. Anyone within a 2 meter radius with an infected person is notified and quarantined.   Now, many places (malls, school, country clubs), take temp n attendance w contact info for tracing",en,[],[],[],2,1,4,[],[],https://twitter.com/BenCharoenwong/status/1237767354286665729,False,,0,,Singapore,,,,,,"[{'screen_name': 'GaborNyeki', 'name': 'Gábor Nyéki', 'id': '987014316317659141'}, {'screen_name': 'economeager', 'name': 'Rachael Meager', 'id': '143430352'}, {'screen_name': 'fasani_f', 'name': 'Francesco Fasani', 'id': '3402910521'}, {'screen_name': 'Osea82', 'name': 'Osea Giuntella', 'id': '84969649'}, {'screen_name': 'ClimentQD', 'name': 'Climent Quintana-Domeque 🎗 BLM', 'id': '1035596672825524226'}, {'screen_name': 'causalinf', 'name': 'scott cunningham', 'id': '392977409'}, {'screen_name': 'MarkJHandley', 'name': 'Mark Handley', 'id': '587372595'}]",,,,
1237587140344598528,1237160094896238592,2020-03-11 11:52:22 +08,2020-03-11,11:52:22,+0800,103819251,nasseramparna,Nasser Amparna,,South Korea can serve as a blueprint for curving down #Covid19 cases.  (Second to China) I think the BEST approach is  widespread testing and contact tracing.   I hope Philippines will do the same. Be aggressive with TESTING!  https://t.co/ensR7yILu3,en,[],[],['https://pbs.twimg.com/media/ESzK8U_UcAAMffY.jpg'],1,2,6,['covid19'],[],https://twitter.com/nasseramparna/status/1237587140344598528,False,,1,https://pbs.twimg.com/media/ESzK8U_UcAAMffY.jpg,Singapore,,,,,,[],,,,
1237384235024928775,1237382880327688192,2020-03-10 22:26:05 +08,2020-03-10,22:26:05,+0800,15291489,wce917,Christopher Ellis 🇸🇬🇺🇸,,"@fozziewossie @tomfgoodwin Same with temp controls are private clubs, churches, (need to fill in travel declaration, give name and phone # if a guest for contact tracing). Temp declaration at kids school every day.",en,[],[],[],0,0,2,[],[],https://twitter.com/wce917/status/1237384235024928775,False,,0,,Singapore,,,,,,"[{'screen_name': 'fozziewossie', 'name': 'Michael Foster', 'id': '166972007'}, {'screen_name': 'tomfgoodwin', 'name': 'Tom Goodwin', 'id': '227399720'}]",,,,
1235742168523739136,1235742168523739136,2020-03-06 09:41:06 +08,2020-03-06,09:41:06,+0800,131461818,angsb_,sam,,"ok @DOHgovph , contact tracing may take a while but the places where the foreigners had been to should easily be collected.  Model country tayo dba?  https://t.co/hg8UnRIfJg",en,"[{'screen_name': 'dohgovph', 'name': 'department of health', 'id': '186347409'}]",[],['https://pbs.twimg.com/media/ESY88tYX0AA38_4.jpg'],0,0,0,[],[],https://twitter.com/angSB_/status/1235742168523739136,False,,1,https://pbs.twimg.com/media/ESY88tYX0AA38_4.jpg,Singapore,,,,,,[],,,,
1235506142022750208,1235506142022750208,2020-03-05 18:03:13 +08,2020-03-05,18:03:13,+0800,131461818,angsb_,sam,,"trace na agad dapat mga pinuntahan sa PH imposible ni isa sa nakasalmuha nya ndi nya nahawa.. meron yan,  hanapin lang agad... dito ipakita ng DoH at govt na prepared tayo at sa contact tracing pa lang dapat ipakita na model country tayo.",tl,[],[],[],1,0,0,[],[],https://twitter.com/angSB_/status/1235506142022750208,False,https://twitter.com/cnnphilippines/status/1235499952467369984,0,,Singapore,,,,,,[],,,,
1235491947004874753,1235491947004874753,2020-03-05 17:06:49 +08,2020-03-05,17:06:49,+0800,59823199,okkymadasari,Okky Madasari,,"In the mid of #coronavirus taking selfie after class is compulsory, part of precautionary measures (contact tracing data).   Ini usai kelas yg aku ajar hari ini. Kebetulan pas anakku lagi ikut ✌️  https://t.co/Cf3ioh3zXQ",in,[],[],"['https://pbs.twimg.com/media/ESVZXd3UwAALrJI.jpg', 'https://pbs.twimg.com/media/ESVZYA3U8AA-A8A.jpg']",1,4,54,['coronavirus'],[],https://twitter.com/okkymadasari/status/1235491947004874753,False,,1,https://pbs.twimg.com/media/ESVZXd3UwAALrJI.jpg,Singapore,,,,,,[],,,,
1234694307744899077,1234694307744899077,2020-03-03 12:17:17 +08,2020-03-03,12:17:17,+0800,22361966,_philiproberts,Philip Roberts,,This is where we’re at.  SG government’s “gold standard” #COVID19 surveillance and contact tracing targeted by scammers.  https://t.co/1OtdDJ51tW,en,[],[],['https://pbs.twimg.com/media/ESKD63_UcAAt-Wg.jpg'],0,1,0,['covid19'],[],https://twitter.com/_PhilipRoberts/status/1234694307744899077,False,,1,https://pbs.twimg.com/media/ESKD63_UcAAt-Wg.jpg,Singapore,,,,,,[],,,,
1234034466210734080,1234031007776542720,2020-03-01 16:35:18 +08,2020-03-01,16:35:18,+0800,19288130,declanmacfadden,Déaglán MacPháidín,,@IrishTimes Shocking to see such a lack of information relating to this confirmed case🤬. So you’re going to conduct this #contacttracing in secrecy? Why? GDPR??? #Wakenup quickly. This is not junior infants time. Check out how #Singapore manages these crises before it’s too late,en,[],[],[],1,3,5,"['contacttracing', 'wakenup', 'singapore']",[],https://twitter.com/declanmacfadden/status/1234034466210734080,False,,0,,Singapore,,,,,,"[{'screen_name': 'IrishTimes', 'name': 'The Irish Times', 'id': '15084853'}]",,,,
1233928848279924737,1233928848279924737,2020-03-01 09:35:37 +08,2020-03-01,09:35:37,+0800,1573050702,redbeanbunn_,💙 한,,Last day of contact tracing today.. at this rate the new cluster is spreading looks like i will be back in april.,en,[],[],[],0,0,0,[],[],https://twitter.com/redbeanbunn_/status/1233928848279924737,False,,0,,Singapore,,,,,,[],,,,
1232966554137923584,1232924609223307265,2020-02-27 17:51:48 +08,2020-02-27,17:51:48,+0800,2597586254,afa_singapore,AfA Singapore,,This is purely to facilitate COVID-19 contact tracing in this period of heightened public health response to COVID-19 epidemic.,en,[],[],[],0,0,1,[],[],https://twitter.com/afa_singapore/status/1232966554137923584,False,,0,,Singapore,,,,,,[],,,,
1232736718282842112,1232736716542210049,2020-02-27 02:38:31 +08,2020-02-27,02:38:31,+0800,40859142,fafuierice,Fafui,,"Were so bothered by it that they had to engineer a test which can find out whether or not you had the nCov for a period of time even if you have already recovered. So they did and they found out the missing link. Also, they are so diligent about contact tracing that",en,[],[],[],1,0,0,[],[],https://twitter.com/fafuierice/status/1232736718282842112,False,,0,,Singapore,,,,,,[],,,,
