id,conversation_id,created_at,date,time,timezone,user_id,username,name,place,tweet,language,mentions,urls,photos,replies_count,retweets_count,likes_count,hashtags,cashtags,link,retweet,quote_url,video,thumbnail,near,geo,source,user_rt_id,user_rt,retweet_id,reply_to,retweet_date,translate,trans_src,trans_dest
1271650390593789952,1271369367469596674,2020-06-13 11:47:33 +08,2020-06-13,11:47:33,+0800,1002377186647498753,inkspilledonme,low 慈恩,,"@yokelII @business The device does not have a inbuilt gps like those fitness trackers. It uses Bluetooth and will only work if you have the SG contact tracing app, the device only has Bluetooth and will only send a signal when in close proximity with another device so contact tracing is made easier",en,[],[],[],0,0,0,[],[],https://twitter.com/inkspilledonme/status/1271650390593789952,False,,0,,Singapore,,,,,,"[{'screen_name': 'yokelII', 'name': 'Paul DeGeorge', 'id': '4356651138'}, {'screen_name': 'business', 'name': 'Bloomberg', 'id': '34713362'}]",,,,
1271645550807400448,1271645548886421504,2020-06-13 11:28:20 +08,2020-06-13,11:28:20,+0800,23088232,pavithren,Pavithren (he/him/his) | Viren | பவித்ரன் | 🇸🇬,,Make sure you download the contact tracing apps from official sources and check the permissions you are granting! #security #privacy,en,[],[],[],0,0,0,"['security', 'privacy']",[],https://twitter.com/pavithren/status/1271645550807400448,False,,0,,Singapore,,,,,,[],,,,
1271645548886421504,1271645548886421504,2020-06-13 11:28:19 +08,2020-06-13,11:28:19,+0800,23088232,pavithren,Pavithren (he/him/his) | Viren | பவித்ரன் | 🇸🇬,,"Fake COVID-19 Contact Tracing Apps Used to Download Malware that Monitors Devices, Steals Personal Data via @Anomali  https://t.co/EBeF6IvAZE #tracetogether #sg",en,"[{'screen_name': 'anomali', 'name': 'anomali', 'id': '197216119'}]",['https://www.anomali.com/blog/anomali-threat-research-identifies-fake-covid-19-contact-tracing-apps-used-to-monitor-devices-steal-personal-data'],[],1,0,0,"['tracetogether', 'sg']",[],https://twitter.com/pavithren/status/1271645548886421504,False,,0,,Singapore,,,,,,[],,,,
1270297490512699395,1269898639402385408,2020-06-09 18:11:37 +08,2020-06-09,18:11:37,+0800,797582389102854144,lucy_1st,LucyFirst 🐳,,@BSohSmallSpaces I’m all for contact tracing. That I can choose to have or not.,en,[],[],[],1,0,0,[],[],https://twitter.com/Lucy_1st/status/1270297490512699395,False,,0,,Singapore,,,,,,"[{'screen_name': 'BSohSmallSpaces', 'name': 'brian', 'id': '554278732'}]",,,,
1270023081583448064,1270023081583448064,2020-06-09 00:01:13 +08,2020-06-09,00:01:13,+0800,2251509301,zest_singapore,C'un gars pour rien,,COVID-19 contact tracing ‘absolutely essential’; wearable TraceTogether tokens to be rolled out in June  https://t.co/yX6a0WyWnQ,en,[],['https://www.channelnewsasia.com/news/singapore/covid-19-contact-tracing-wearable-devices-trace-together-12815796#.Xt5guYWF-Hg.twitter'],[],0,0,0,[],[],https://twitter.com/zest_singapore/status/1270023081583448064,False,,0,,Singapore,,,,,,[],,,,
1269844681627590656,1269049796704296960,2020-06-08 12:12:19 +08,2020-06-08,12:12:19,+0800,1244969412,zuperwtf,Zuper,,"@JohnSilverstar2 @JJWINAZZ @_Haplo @Damkyan_Omega Par contre à Singapour c’est obligation de scanner le QR code à l’entrée de chaque bâtiment où tu rentres pour le contact tracing. Port du masque obligatoire. Interdiction de s’arrêter quand tu te balades, interdiction de sortir en famille (groupe de 4 ou +).",fr,[],[],[],2,0,0,[],[],https://twitter.com/Zuperwtf/status/1269844681627590656,False,,0,,Singapore,,,,,,"[{'screen_name': 'JohnSilverstar2', 'name': 'Archibald History', 'id': '1020834163'}, {'screen_name': 'JJWINAZZ', 'name': 'Champ aux Lyons', 'id': '1189780777116020737'}, {'screen_name': '_Haplo', 'name': 'Haplo', 'id': '1281560822'}, {'screen_name': 'Damkyan_Omega', 'name': 'Mathieu M.J.E. Rebeaud', 'id': '3468565703'}]",,,,
1269286008429801478,1269286008429801478,2020-06-06 23:12:21 +08,2020-06-06,23:12:21,+0800,68510201,sereneyew,Serene Yew Ker Huan,,Singapore Government: Singapore says 'No' to wearable devices for Covid-19 contact tracing - Sign the Petition!  https://t.co/52mABogfNb via @Change,en,"[{'screen_name': 'change', 'name': 'change.org', 'id': '15947602'}]",['http://chng.it/2fb68MYJ'],[],0,0,0,[],[],https://twitter.com/sereneyew/status/1269286008429801478,False,,0,,Singapore,,,,,,[],,,,
1267606669971816449,1267606669971816449,2020-06-02 07:59:15 +08,2020-06-02,07:59:15,+0800,574389856,justintanwc,Justin Tan Wen Cong,"{'type': 'Point', 'coordinates': [1.28945022, 103.81687987]}",Just scan SafeEntry for #Coronavirus contact tracing purposes as part of the safe re-opening of Singapore's wealthy economy despite Fortitude Budget is implemented in use on lots of business re-opening at a later…  https://t.co/dIIcF55OGG,en,[],['https://www.instagram.com/p/CA6WosFAKf4/?igshid=1rq9f1q4h00qp'],[],0,0,0,['coronavirus'],[],https://twitter.com/justintanwc/status/1267606669971816449,False,,0,,Singapore,,,,,,[],,,,
1260196272750735360,1260196272750735360,2020-05-12 21:12:59 +08,2020-05-12,21:12:59,+0800,815498542236078081,laavy_k,Laavanya Kathiravelu,,Wonderfully concise and important piece by @hallam_stevens about contact tracing apps and the importance of citizen science in building solidarity.,en,"[{'screen_name': 'hallam_stevens', 'name': 'hallam stevens', 'id': '572324513'}]",[],[],0,1,7,[],[],https://twitter.com/laavy_k/status/1260196272750735360,False,https://twitter.com/NTUHistory/status/1260053455961567232,0,,Singapore,,,,,,[],,,,
1259293048753672193,1259217296184107008,2020-05-10 09:23:54 +08,2020-05-10,09:23:54,+0800,863580393827479553,ronburgundyhk,archer sterling,,@serem435 @counter_args @adrianfine @Tesla Do you want 100pc contact tracing and living under communist diktat?  Because that’s what tsla did in China.  That’s the ‘best practise’ that @elonmusk is referencing. Does that work in Bay Area?,en,"[{'screen_name': 'elonmusk', 'name': 'elon musk', 'id': '44196397'}]",[],[],1,0,2,[],[],https://twitter.com/ronburgundyhk/status/1259293048753672193,False,,0,,Singapore,,,,,,"[{'screen_name': 'serem435', 'name': 'Serem', 'id': '845778197925036033'}, {'screen_name': 'counter_args', 'name': 'bit.ly/prop-22🌹✊🏽📢🦺', 'id': '1178147410633117697'}, {'screen_name': 'adrianfine', 'name': 'fadrian', 'id': '37061130'}, {'screen_name': 'Tesla', 'name': 'Tesla', 'id': '13298072'}]",,,,
1259155593937313792,1259154526658899968,2020-05-10 00:17:42 +08,2020-05-10,00:17:42,+0800,449686978,harirzharfan19,harIR,,Xde cip. Xde apa. Kad bodoh dengan barcode and qr code. Tu je. Tapi contact tracing padu gila babi. Jiran aku baru dpt tahu yg dia kena stay-at-home notice sbb dia ada close contact. Cemana diorang detect? Thru QR code tu lah.,in,[],[],[],0,0,0,[],[],https://twitter.com/HarirZharfan19/status/1259155593937313792,False,,0,,Singapore,,,,,,[],,,,
1258735997581357059,1258735997581357059,2020-05-08 20:30:22 +08,2020-05-08,20:30:22,+0800,50274262,mistertechblog,Lup Yuen Lee 李立源,,"""How Contact Tracing Will Work on iPhones and Android Phones""...   https://t.co/KRkM0RgxSI",en,[],['https://sea.pcmag.com/help/37304/heres-how-contact-tracing-will-work-on-iphones-and-android-phones'],[],0,0,1,[],[],https://twitter.com/MisterTechBlog/status/1258735997581357059,False,,0,,Singapore,,,,,,[],,,,
1257225557944627202,1257225557944627202,2020-05-04 16:28:25 +08,2020-05-04,16:28:25,+0800,420668824,bladeluca,Luca,,"Singapore doing the utmost best with contact tracing (everywhere you go), masks and social distancing measures. As laudable as it is blatantly futile, having been in a queue at the supermarket.",en,[],[],[],0,0,0,[],[],https://twitter.com/bladeluca/status/1257225557944627202,False,,0,,Singapore,,,,,,[],,,,
1257186927683334144,1257186927683334144,2020-05-04 13:54:55 +08,2020-05-04,13:54:55,+0800,742063704,yunsuhada,yun,,IC is for contact tracing.,en,[],[],[],0,0,0,[],[],https://twitter.com/yunsuhada/status/1257186927683334144,False,https://twitter.com/moonsyi/status/1256966481771810816,0,,Singapore,,,,,,[],,,,
1256876763398811649,1256876763398811649,2020-05-03 17:22:26 +08,2020-05-03,17:22:26,+0800,368825076,nickmarsh6,Nick Marsh,,ID checks at my local supermarket now - contact tracing in action  https://t.co/oPVNg9g2fB,en,[],[],['https://pbs.twimg.com/media/EXFSvOCU0AAvaei.jpg'],2,4,9,[],[],https://twitter.com/NickMarsh6/status/1256876763398811649,False,,1,https://pbs.twimg.com/media/EXFSvOCU0AAvaei.jpg,Singapore,,,,,,[],,,,
1256605620561571840,1256561315256156160,2020-05-02 23:25:01 +08,2020-05-02,23:25:01,+0800,1322651870,marvo5marvo,The Legendary Marvo,,"@marcwebber @andydurrant75 I went out to the shops in Singapore today, had my temperature take 4 times, had to wear a mask and my details were taken 3 times for future contact tracing if needed. Singapore has over 17,000 cases and 16 deaths. Our total dead would be less than 200 if we could match that.",en,[],[],[],0,0,0,[],[],https://twitter.com/Marvo5Marvo/status/1256605620561571840,False,,0,,Singapore,,,,,,"[{'screen_name': 'marcwebber', 'name': 'Marc Webber', 'id': '14154800'}, {'screen_name': 'andydurrant75', 'name': 'Andy Durrant', 'id': '382866449'}]",,,,
1256535252001943553,1256466741980360704,2020-05-02 18:45:24 +08,2020-05-02,18:45:24,+0800,134866460,davidjrainey,David Rainey 🇸🇬,,"@karlieeuh I’ve no idea why the contact tracing functionality wasn’t just added to TraceTogether- the QR code just becomes another data point.  The QR code link to SingPass is really clunky, multiple popping windows and SingPass failures about 1 out of 5 times.",en,[],[],[],0,0,1,[],[],https://twitter.com/davidjrainey/status/1256535252001943553,False,,0,,Singapore,,,,,,"[{'screen_name': 'karlieeuh', 'name': 'Opiniated Charles', 'id': '35972618'}]",,,,
1255845227652239360,1255845227652239360,2020-04-30 21:03:29 +08,2020-04-30,21:03:29,+0800,771712311723778048,nhabzilicious01,ASTercenio,,iba din ang contact tracing👏,tl,[],[],[],0,0,1,[],[],https://twitter.com/nhabzilicious01/status/1255845227652239360,False,,0,,Singapore,,,,,,[],,,,
1254229983683244034,1254222837935529984,2020-04-26 10:05:05 +08,2020-04-26,10:05:05,+0800,41320948,kiwibrew,Jonathan Brewer 🇳🇿🇸🇬,,@stilgherrian I’ve been using TraceTogether for a month now. And participating in the NZ discussion around contact tracing. That Canadian article you linked is 👎.,en,[],[],[],1,0,0,[],[],https://twitter.com/kiwibrew/status/1254229983683244034,False,,0,,Singapore,,,,,,"[{'screen_name': 'stilgherrian', 'name': 'Stilgherrian', 'id': '11189732'}]",,,,
1253910985041047552,1253910985041047552,2020-04-25 12:57:30 +08,2020-04-25,12:57:30,+0800,2154673341,josezzeluis,Jose Luis Pereira,,"China já não esconde todas as mortes. Já não é só Wuhan. Mas quem revela tá fodido. Contact tracing o caralho, não dou número para governo algum, @govpt. Filhos da puta nunca mais!",pt,"[{'screen_name': 'govpt', 'name': 'república portuguesa', 'id': '31237480'}]",[],[],0,0,1,[],[],https://twitter.com/JoseZzeluis/status/1253910985041047552,False,https://twitter.com/Rmlc63/status/1251549727268712449,0,,Singapore,,,,,,[],,,,
1253842667462512640,1253842667462512640,2020-04-25 08:26:01 +08,2020-04-25,08:26:01,+0800,50274262,mistertechblog,Lup Yuen Lee 李立源,,Contact Tracing apps coming soon...   https://t.co/dmsMNw00Bs,en,[],['https://www.reuters.com/article/us-health-coronavirus-europe-tech-idUSKCN2262LM'],[],0,0,0,[],[],https://twitter.com/MisterTechBlog/status/1253842667462512640,False,,0,,Singapore,,,,,,[],,,,
1253840949882437633,1253840949882437633,2020-04-25 08:19:12 +08,2020-04-25,08:19:12,+0800,50274262,mistertechblog,Lup Yuen Lee 李立源,,Contact Tracing app with Ultrasound...   https://t.co/5P2C1xPOWz,en,[],['https://www.novid.org/'],[],0,0,0,[],[],https://twitter.com/MisterTechBlog/status/1253840949882437633,False,,0,,Singapore,,,,,,[],,,,
1253297533993930753,1253296580800573441,2020-04-23 20:19:51 +08,2020-04-23,20:19:51,+0800,10872822,sehof,Sense Hofstede,,"@wenliunyc It’s also not true for Singapore. The app apparently a low adoption rate and contact tracing relies heavily on manpower. Also, coming from the Netherlands I’ve found the health care system here comparatively  paper-based. Singapore banks still use cheques!!",en,[],[],[],0,1,20,[],[],https://twitter.com/sehof/status/1253297533993930753,False,,0,,Singapore,,,,,,"[{'screen_name': 'wenliunyc', 'name': 'wen liu', 'id': '1203712593887744000'}]",,,,
1252750370960363521,1252750370960363521,2020-04-22 08:05:38 +08,2020-04-22,08:05:38,+0800,90597912,poortan,poor tan,,Are we in DORSCON Red since the government seems to have given up contact tracing?  https://t.co/CtCE56fahz why are PRs in the same tier as Citizens? If so we are as good as 2nd class in our own country. What do you think?,en,[],['https://www.theonlinecitizen.com/2020/04/21/are-we-in-dorscon-red-since-the-government-seems-to-have-given-up-contact-tracing/'],[],0,0,0,[],[],https://twitter.com/poortan/status/1252750370960363521,False,,0,,Singapore,,,,,,[],,,,
1252749256269590528,1252749256269590528,2020-04-22 08:01:12 +08,2020-04-22,08:01:12,+0800,90597912,poortan,poor tan,,Are we in DORSCON Red since the government seems to have given up contact tracing?  https://t.co/CtCE56fahz why we use CB and not lockdown becos our PM has the highest paid minister therefore must be creative n different from them. What do u think?,en,[],['https://www.theonlinecitizen.com/2020/04/21/are-we-in-dorscon-red-since-the-government-seems-to-have-given-up-contact-tracing/'],[],0,0,0,[],[],https://twitter.com/poortan/status/1252749256269590528,False,,0,,Singapore,,,,,,[],,,,
1252119741017190401,1252119741017190401,2020-04-20 14:19:44 +08,2020-04-20,14:19:44,+0800,50274262,mistertechblog,Lup Yuen Lee 李立源,,Using hardware Bluetooth gadget for Contact Tracing vs #TraceTogether...   https://t.co/8HkxP2FLna,en,[],['https://www.newsroom.co.nz/2020/04/17/1132682/nz-considering-100m-contact-tracing-covidcard'],[],0,0,1,['tracetogether'],[],https://twitter.com/MisterTechBlog/status/1252119741017190401,False,,0,,Singapore,,,,,,[],,,,
1251323260727255041,1251323260727255041,2020-04-18 09:34:48 +08,2020-04-18,09:34:48,+0800,50274262,mistertechblog,Lup Yuen Lee 李立源,,Demo of Apple+Google #ContactTracing API on iPhone...   https://t.co/Yb6i12nwLD,en,[],['https://twitter.com/qzervaas/status/1251001445563826177?s=09'],[],0,0,2,['contacttracing'],[],https://twitter.com/MisterTechBlog/status/1251323260727255041,False,https://twitter.com/qzervaas/status/1251001445563826177?s=09,0,,Singapore,,,,,,[],,,,
1250956916974481408,1250956916974481408,2020-04-17 09:19:05 +08,2020-04-17,09:19:05,+0800,41320948,kiwibrew,Jonathan Brewer 🇳🇿🇸🇬,,"All the solutions we're working on now around essential activities, contact tracing, remote working, universal broadband - we'll need those again. COVID-19 isn't where this ends.",en,[],[],[],0,0,6,[],[],https://twitter.com/kiwibrew/status/1250956916974481408,False,,0,,Singapore,,,,,,[],,,,
1250952600511381505,1250952600511381505,2020-04-17 09:01:56 +08,2020-04-17,09:01:56,+0800,50274262,mistertechblog,Lup Yuen Lee 李立源,,Good explainer for Apple+Google #ContactTracing...   https://t.co/uTf9Ji4KTM,en,[],['https://hackaday.com/2020/04/16/google-and-apple-reveal-their-corona-tracing-plans-we-kick-the-tires/'],[],0,0,0,['contacttracing'],[],https://twitter.com/MisterTechBlog/status/1250952600511381505,False,,0,,Singapore,,,,,,[],,,,
1250822568023674887,1250822557516935173,2020-04-17 00:25:14 +08,2020-04-17,00:25:14,+0800,2325195296,bintmohari,ص,,"Da mcm2 bantuan dorang kasi utk rakyat, tapi rakyat nak jugak kena saman. Tolonglah. Fikir sikit. Bayangkan Kita kat US. Kalau dorang nak buang org, dorang buang aje. Who cares. Takda solidarity payout pape. N u think got contact tracing?",in,[],[],[],1,0,0,[],[],https://twitter.com/bintmohari/status/1250822568023674887,False,,0,,Singapore,,,,,,[],,,,
1250822561832845312,1250822557516935173,2020-04-17 00:25:12 +08,2020-04-17,00:25:12,+0800,2325195296,bintmohari,ص,,"It’s really a collective effort. We all should comply with the measures rolled out. If you are asked for contact tracing, just answer accordingly. Play your part. If you are supposed to stay home, STAY HOME. If you want to go out, MASK UP.",en,[],[],[],1,0,0,[],[],https://twitter.com/bintmohari/status/1250822561832845312,False,,0,,Singapore,,,,,,[],,,,
1250310320100278272,1250309150921261061,2020-04-15 14:29:44 +08,2020-04-15,14:29:44,+0800,1180672560880476160,ali_naseer786,Naseer ( نصير ) 🇸🇬🇲🇻,,@PearLNextDoor_ Do a proper contact tracing without delay 🦠,en,[],[],[],0,1,2,[],[],https://twitter.com/Ali_Naseer786/status/1250310320100278272,False,,0,,Singapore,,,,,,[],,,,
1249848568896081920,1249842193461895170,2020-04-14 07:54:54 +08,2020-04-14,07:54:54,+0800,15291489,wce917,Christopher Ellis 🇸🇬🇺🇸,,"@tomfgoodwin Well, numbers do keep increasing but it's largely contained outside of foreign worker dormitories largely due to contact tracing.  Extreme social distancing measures weren't out in place til last Tues/Weds. Masks only made mandatory a couple days ago for markets, malls,",en,[],[],[],1,0,0,[],[],https://twitter.com/wce917/status/1249848568896081920,False,,0,,Singapore,,,,,,"[{'screen_name': 'tomfgoodwin', 'name': 'Tom Goodwin', 'id': '227399720'}]",,,,
1249728810678980611,1249728810678980611,2020-04-13 23:59:01 +08,2020-04-13,23:59:01,+0800,553773314,us_man10,usman abdullah,"{'type': 'Point', 'coordinates': [1.29306, 103.856]}",COVID-19: 12 Apr update New cases: 233 - Local cases (linked): 66 (linked to known clusters/cases) - Pending contact tracing: 167 (16 are S'pore citizens/PRs; 10 are Work Pass/Long Term Pass holders; 141 are Work…  https://t.co/w150AJ2nc0,en,[],['https://www.instagram.com/p/B-7UKVNHuyf/?igshid=nka49nhj3hqt'],[],0,0,0,[],[],https://twitter.com/US_man10/status/1249728810678980611,False,,0,,Singapore,,,,,,[],,,,
1249639574990491649,1249624343610421249,2020-04-13 18:04:26 +08,2020-04-13,18:04:26,+0800,3428986318,501deghie,Mountaindale,,"@Mamato_Marcello the earliest vaccine can be developed is within a year,it takes 4 phases to develop the vaccine,so its not gonna be anytime soon. Social distancing ,hygiene care,contact tracing,containment n mitigation are all we have and believe it or not it works.",en,[],[],[],1,0,0,[],[],https://twitter.com/501deghie/status/1249639574990491649,False,,0,,Singapore,,,,,,"[{'screen_name': 'Mamato_Marcello', 'name': '🇲🇾 Mamato Marcello', 'id': '320876615'}]",,,,
1249355146905006080,1249311220143919104,2020-04-12 23:14:13 +08,2020-04-12,23:14:13,+0800,14070017,kickino,Sebastian Wieseler,,@moeffju 100%ig. Genau richtig. Aber mit der App steht die Regierung auch noch recht am Anfang. Muss man halt fairerweise schon so sagen. Deshalb geht das meisten Contact Tracing halt über Anrufe,de,[],[],[],0,0,0,[],[],https://twitter.com/kickino/status/1249355146905006080,False,,0,,Singapore,,,,,,"[{'screen_name': 'moeffju', 'name': 'a pretty they/them catgirl', 'id': '5618832'}]",,,,
1249354436800962561,1249311220143919104,2020-04-12 23:11:24 +08,2020-04-12,23:11:24,+0800,14070017,kickino,Sebastian Wieseler,,@moeffju Die App wurde relativ spät ausgerollt. Das meiste Contact Tracing geht halt über die klassische Detektivarbeit - anrufen. Fragen wo&amp;wann Leute waren. Versuchen die Ketten abzubilden. Contact Trancing ist was hilft. Ich glaube den echten Mehrwehrt der App sieht man hier noch nicht,de,[],[],[],1,0,1,[],[],https://twitter.com/kickino/status/1249354436800962561,False,,0,,Singapore,,,,,,"[{'screen_name': 'moeffju', 'name': 'a pretty they/them catgirl', 'id': '5618832'}]",,,,
1249272195915771904,1249210926705901568,2020-04-12 17:44:36 +08,2020-04-12,17:44:36,+0800,1322651870,marvo5marvo,The Legendary Marvo,,"@DrillingCobbler It did. There were cases but they used contact tracing and mass testing to contain them. If we had locked the UK down, as in stop any visitors coming via planes or boats, we could have remained virus free. We chose not to, flights are still arriving even now with no checks.",en,[],[],[],3,0,1,[],[],https://twitter.com/Marvo5Marvo/status/1249272195915771904,False,,0,,Singapore,,,,,,"[{'screen_name': 'DrillingCobbler', 'name': 'shane webster', 'id': '59073969'}]",,,,
1249264272724525057,1249210926705901568,2020-04-12 17:13:07 +08,2020-04-12,17:13:07,+0800,1322651870,marvo5marvo,The Legendary Marvo,,@DrillingCobbler You really asking me how a virus spreads? It takes 1 person to come to the UK &amp; maybe visit Cheltenham for the races or go to a Sterephonics concert. Without contact tracing &amp; testing that one person could affect the entire country. Especially if you didn't react for 2 weeks.,en,[],[],[],2,0,0,[],[],https://twitter.com/Marvo5Marvo/status/1249264272724525057,False,,0,,Singapore,,,,,,"[{'screen_name': 'DrillingCobbler', 'name': 'shane webster', 'id': '59073969'}]",,,,
1248850029801959425,1248850029801959425,2020-04-11 13:47:04 +08,2020-04-11,13:47:04,+0800,68087176,bryanbma,Bryan Ma,,"Pulling this one up in case anyone looking at Apple/Google's contact tracing is wondering about how much battery life might get consumed, if Singapore's TraceTogether is anything to go by",en,[],[],[],0,2,10,[],[],https://twitter.com/bryanbma/status/1248850029801959425,False,https://twitter.com/bryanbma/status/1241366723707559942,0,,Singapore,,,,,,[],,,,
1248837255516418048,1248837255516418048,2020-04-11 12:56:18 +08,2020-04-11,12:56:18,+0800,50274262,mistertechblog,Lup Yuen Lee 李立源,,Issues with the Apple and Google Contact Tracing protocol...   https://t.co/0Qj48Ww4ay,en,[],['https://abe-winter.github.io/2020/04/10/leaky.html'],[],1,0,2,[],[],https://twitter.com/MisterTechBlog/status/1248837255516418048,False,,0,,Singapore,,,,,,[],,,,
1248830959962574849,1248830959962574849,2020-04-11 12:31:17 +08,2020-04-11,12:31:17,+0800,27613973,luminosita81,Andy Tan,,Automated contact tracing is not a coronavirus panacea by @jasonbay  https://t.co/TYIHxORox7,en,"[{'screen_name': 'jasonbay', 'name': 'jason bay', 'id': '13559552'}]",['https://blog.gds-gov.tech/automated-contact-tracing-is-not-a-coronavirus-panacea-57fb3ce61d98'],[],0,0,1,[],[],https://twitter.com/luminosita81/status/1248830959962574849,False,,0,,Singapore,,,,,,[],,,,
1248745256113197057,1248745256113197057,2020-04-11 06:50:44 +08,2020-04-11,06:50:44,+0800,50274262,mistertechblog,Lup Yuen Lee 李立源,,Technical Drafts of #Apple and #Google's #BluetoothLE Contact Tracing protocol...   https://t.co/5IkIvgNPRe,en,[],['https://www.apple.com/covid19/contacttracing'],[],0,0,1,"['apple', 'google', 'bluetoothle']",[],https://twitter.com/MisterTechBlog/status/1248745256113197057,False,,0,,Singapore,,,,,,[],,,,
1248169097302433793,1248169097302433793,2020-04-09 16:41:17 +08,2020-04-09,16:41:17,+0800,738288294220304384,jaekyunnie06,⭐ᗰᑌᒪTIᖴᗩᑎᗪOᗰ KᑭOᑭᖴᖇEᗩK ᒍᗩEKYᑌᑎᑎIE,,NFIAs! 🎉  #DongsungChallenge  @NFlyingofficial  I will do it pater once I feel better huhu.. This Contact Tracing thingy seriously 😭  #HappyDongSungDay  #엔피아와_동성이의_첫생일_생일축하해 #MakdoongieDay,en,"[{'screen_name': 'nflyingofficial', 'name': '엔플라잉 (n.flying)', 'id': '2272601820'}]",[],[],0,0,1,"['dongsungchallenge', 'happydongsungday', '엔피아와_동성이의_첫생일_생일축하해', 'makdoongieday']",[],https://twitter.com/jaekyunnie06/status/1248169097302433793,False,https://twitter.com/nflyingfanbase/status/1248131463024742401,0,,Singapore,,,,,,[],,,,
1248168587128213504,1248168587128213504,2020-04-09 16:39:15 +08,2020-04-09,16:39:15,+0800,738288294220304384,jaekyunnie06,⭐ᗰᑌᒪTIᖴᗩᑎᗪOᗰ KᑭOᑭᖴᖇEᗩK ᒍᗩEKYᑌᑎᑎIE,,Contact Tracing be like...... SINO BA NAGING KATABI KO FROM MARCH 26 TO CURRENT!? 😭😭😭😭😭,en,[],[],[],2,0,1,[],[],https://twitter.com/jaekyunnie06/status/1248168587128213504,False,,0,,Singapore,,,,,,[],,,,
1248122987611480066,1248122987611480066,2020-04-09 13:38:03 +08,2020-04-09,13:38:03,+0800,15005824,hv2008,Himanshu Verma,,Comprehensive take on what needs to be done by @banik_nilanjan Watching things unfold here in Singapore can relate to the article. Only thing I would add is a contact tracing app like #TraceTogether Bluetooth based. Only collects phone number. @saurjyesh  https://t.co/mOch71fLnr,en,"[{'screen_name': 'banik_nilanjan', 'name': 'nilanjan banik', 'id': '4891729710'}, {'screen_name': 'saurjyesh', 'name': 'saurjyesh', 'id': '14741396'}]",[],['https://pbs.twimg.com/media/EVI5OyqU8AMEkqR.jpg'],1,3,5,['tracetogether'],[],https://twitter.com/hv2008/status/1248122987611480066,False,,1,https://pbs.twimg.com/media/EVI5OyqU8AMEkqR.jpg,Singapore,,,,,,[],,,,
1247789492297019398,1247789492297019398,2020-04-08 15:32:52 +08,2020-04-08,15:32:52,+0800,50274262,mistertechblog,Lup Yuen Lee 李立源,,Contact Tracing the anonymous way...   https://t.co/Ez43loX9uB,en,[],['https://www.theatlantic.com/ideas/archive/2020/04/contact-tracing-could-free-america-from-its-quarantine-nightmare/609577/'],[],0,0,2,[],[],https://twitter.com/MisterTechBlog/status/1247789492297019398,False,,0,,Singapore,,,,,,[],,,,
1247355231182000128,1247355231182000128,2020-04-07 10:47:16 +08,2020-04-07,10:47:16,+0800,135715667,abasmayorrrr,Jet,,Kaya pala mahirap ang contact tracing diyan sa Pilipinas kasi bawal idisclose yung medical history ni Patient. Di din pwede pilitin si Patient na idisclose yung med history niya kasi protected siya sa lecheng privacy law na yan.,tl,[],[],[],0,0,0,[],[],https://twitter.com/abasmayorrrr/status/1247355231182000128,False,,0,,Singapore,,,,,,[],,,,
