,comment_id,comment_parent_id,comment_body,comment_link_id,created_dts,author,score
0,gfpe9g9,t3_kc86yv,[deleted],t3_kc86yv,2020-12-13 23:30:53,,25
1,gfobsm7,t3_kc86yv,Vaccine update in sg perhaps,t3_kc86yv,2020-12-13 18:17:24,grindrbuddy,39
2,gfobcqa,t3_kc86yv,"Sigh, aite imma head to NTUC",t3_kc86yv,2020-12-13 18:13:37,SometimesFlyHigh,75
3,gfoba6l,t3_kc86yv,I don't think it's phase 3 announcement yet tho because for the previous phase announcements it wasn't done by the PM,t3_kc86yv,2020-12-13 18:12:58,FarTear8,22
4,gfocvyo,t3_kc86yv,PM Lee at 5 PM,t3_kc86yv,2020-12-13 18:28:41,iamabear1,21
5,gfocrrw,t3_kc86yv,"What we want: Phase 3

What we probably get: Covid updates on cases, vaccines and mothership statements.",t3_kc86yv,2020-12-13 18:27:34,milo_dino,44
6,gfpq2pz,t3_kc86yv,my guess is that there will be an update on the vaccination plan and timeline. seeing as how MUIS had suddenly released that infographic on vaccines as a pre-empt for all the possible resistance.,t3_kc86yv,2020-12-14 00:57:10,ImInUranus,4
7,gfoz2vg,t3_kc86yv,P3 but everything is the same as P2.,t3_kc86yv,2020-12-13 21:38:56,sebbiu,3
8,gfp0h9j,t3_kc86yv,"P3 is a minor update so likely don't need PM to do a special event. More likely vaccinations, especially since there is a lot of resistance and concern even in Singapore.",t3_kc86yv,2020-12-13 21:48:53,psgvaincra,2
9,gfoh0yz,t3_kc86yv,"I don't care bout P3 but when is Phase ""No Masks"" going to happen?",t3_kc86yv,2020-12-13 19:05:08,WhiteMirrorSociety,7
10,gfogrg4,t3_kc86yv,Vaccine updates... pls...,t3_kc86yv,2020-12-13 19:02:58,mortichro,2
11,gfpasfu,t3_kc86yv,"Even if SG is ready to re-open, others may not be ready.
Look at S. Korea, they got their shit together earlier but somehow COVID-19 is making a come back again.",t3_kc86yv,2020-12-13 23:01:42,ihoj,1
12,gfoalys,t3_kc86yv,"> # PM Lee to address nation on Singapore’s Covid-19 situation at 5pm on Monday

> SINGAPORE -Prime Minister Lee Hsien Loong will be addressing the nation at 5pm on Monday (Dec 14) to give an update on the Covid-19 situation and the outlook for next year.

> The co-chairs of the ministerial task force tackling the pandemic - Health Minister Gan Kim Yong and Education Minister Lawrence Wong - will hold a press conference immediately after, he said in a Facebook post.

> ""It's been some time since my last address on Covid-19,"" Mr Lee wrote. ""But please stay calm - no need to stock up on anything!""

> Over the course of this year, PM Lee has made several major speeches laying out Singapore's plan to tackle the Covid-19 pandemic.

> In his first such address on Feb 8, he urged Singaporeans to stay resolute in the face of what was then a new and relatively unknown virus.

> Just over a month later, he warned that more stringent measures might have to be taken, as the pandemic looked set to continue for some time.

> This was followed by his announcement of the circuit breaker on April 3. All schools and most workplaces were shut, with social interactions and movement outside the home severely limited in an effort to stop the spread of the virus.

> Mr Lee added a special appeal to seniors several days later, urging them to stay home for their own safety.

> On April 21, the Prime Minister then announced that the circuit breaker would be extended as total case numbers continued to climb, especially in migrant worker dormitories.

> Mr Lee, along with Senior Ministers Teo Chee Hean and Tharman Shanmugaratnam, as well as Deputy Prime Minister Heng Swee Keat, Trade and Industry Minister Chan Chun Sing and Education Minister Lawrence Wong, also made a series of national broadcasts on Singapore's future post Covid-19.

> In June, he also explained why he had decided to call the general election on July 10 despite the pandemic.

> Watch PM Lee’s speech live on The Straits Times website, Facebook page and YouTube channel.

---
1.0.2 | [Source code](https://github.com/fterh/sneakpeek) | [Contribute](https://github.com/fterh/sneakpeek)",t3_kc86yv,2020-12-13 18:07:00,sneakpeek_bot,1
13,gfoecmp,t3_kc86yv,"Oh shit, it's the end of the year already. Probably something about plans for the coming year. Maybe even entertaining the idea of opening up to Malaysia.",t3_kc86yv,2020-12-13 18:42:15,jinhong91,-4
14,gfsmi72,t1_gfpe9g9,More importantly: TT is now mandatory,t3_kc86yv,2020-12-14 16:36:43,SamBellFromSarang,1
15,gfobvja,t1_gfobcqa,"Everytime I see an announcement like this, I think about the grocery store workers as the PTSD chihuahua meme.",t3_kc86yv,2020-12-13 18:18:11,EarthwormJane,52
16,gfoh24w,t1_gfobcqa,Buy rice buy tissue,t3_kc86yv,2020-12-13 19:05:24,WhiteMirrorSociety,7
17,gfr23eq,t1_gfoba6l,Well the CB announcement was done by him....,t3_kc86yv,2020-12-14 06:44:20,honzaf,2
18,gfok6cg,t1_gfocvyo,But he is PM 3,t3_kc86yv,2020-12-13 19:32:39,deangsana,16
19,gfp8dck,t1_gfocrrw,"What we probably get: “Singapore has tackled the covid-19 situation pretty well. We have done vigorous contact tracing with our TraceTogether application, cut down on the local transmitted cases, resumed many of our activities and also is on our way to obtaining a vaccine that can help us to fight against the coronavirus. Singapore, we can do this. Thank you.”",t3_kc86yv,2020-12-13 22:43:12,randyed,16
20,gfrn85s,t1_gfocrrw,"I'd be more happy to hear him announce a vaccination program than to hear about phase 3 (which makes no change to anything anyway). 

Given the size of Singapore, the availability of infrastructure, and the wealth of the nation we could have all residents immunised in a matter of months...",t3_kc86yv,2020-12-14 09:49:33,zoinks10,1
21,gfojtv0,t1_gfoh0yz,"I dont think this will happen soon, esp considering Temasek just gave out free masks. In any case mask wearing is an economically least disruptive covid control measure (compared to social distancing or lockdown), make no sense to remove it soon.",t3_kc86yv,2020-12-13 19:29:25,tryingmydarnest,33
22,gfohzk3,t1_gfoh0yz,"This is what I'm waiting for too.

P3 will be no change of life for me.",t3_kc86yv,2020-12-13 19:13:10,Holeshot75,7
23,gfoih58,t1_gfoecmp,"not so soon, they still have 1k+/day",t3_kc86yv,2020-12-13 19:17:25,username2002,7
24,gfpbwbj,t1_gfoh24w,"Due to the stock out issues during the first few months of the pandemic, we get so many more toilet paper brands nowadays.

Diversified toilet paper sources!",t3_kc86yv,2020-12-13 23:09:41,puncel,4
25,gfr8ri8,t1_gfr23eq,CB is not a Phase transition! It was a key decision and hence he had to do it but phase 1 or phase 2 he got do leh?,t3_kc86yv,2020-12-14 07:40:36,FarTear8,1
26,gfrneqq,t1_gfojtv0,"They could probably roll back the ""must wear outside"" bit now, and make it mandatory only in inside settings. But they won't do it because the message might be mixed or lost and it's easier to just keep it as-is.",t3_kc86yv,2020-12-14 09:51:13,zoinks10,5
27,gfokzf5,t1_gfojtv0,I don't mind the 1 metre distance but the mask...it irritates me the most especially on hot days where walking a sizeable distance from point A to B causes the mouth to sweat and it will absorb into the mask,t3_kc86yv,2020-12-13 19:40:12,WhiteMirrorSociety,8
28,gfomzyu,t1_gfokzf5,Agree... Now my face has more pimples than usual (and even now my chin also have omg 😱),t3_kc86yv,2020-12-13 19:58:58,Tsunamari,7
29,gfrc9le,t1_gfokzf5,"I feel wear mask at work is super useless.

If I'm spending 9 hrs a day in close contact with my colleagues, mask or no mask will still too right.

Public places and transport still bopian la",t3_kc86yv,2020-12-14 08:10:21,iedaiw,0
30,gfoqlsn,t1_gfomzyu,"Now if only there were a lightweight fabric with loops that you can wear over your face, that would cover up the pimples ...",t3_kc86yv,2020-12-13 20:34:24,earlymorning1706,17
31,gfsjpmg,t1_gfrc9le,"No. It’s still a mitigation barrier. Everyone masking up limits whatever comes out from
their mouth.",t3_kc86yv,2020-12-14 15:51:12,bukitbukit,1
32,gfp0xs1,t1_gfoqlsn,Guess only the DET mask is suitable for me haha so to let my skin 'breathe'😂😂,t3_kc86yv,2020-12-13 21:51:50,Tsunamari,0
33,gfsj40u,t1_gfp0xs1,The new mask by Gov is kinda puffed tbh,t3_kc86yv,2020-12-14 15:41:45,WhiteMirrorSociety,2
34,gfsodcv,t1_gfsj40u,I see. It was pretty alright for me haha...😆,t3_kc86yv,2020-12-14 17:08:59,Tsunamari,1
