,post_id,user_id,date_time,comment_raw
27,2278856732331923107,207567201,2020-04-03 10:28:33,"In the age of safe distancing and belt tightening, F&B players in Singapore say the industry is hanging by a thread.

The urgent need for support from landlords is a sentiment many restaurant owners share. “There is so much rental pressure on restaurants where the operating cash flow is just two months out. If restaurants and retailers don’t get help from landlords, we cannot survive. (The landlords) have made so much money from us tenants over the last few years and now is the time they really have to step up to help us,” said Cynthia Chua of Spa Esprit Group, which includes establishments like Tiong Bahru Bakery.

Substantial rentals are not the only challenge facing Singapore’s restaurants today. “There’s a lot of uncertainty as to when produce is coming in. Right now, we can get fish locally or from Malaysia, but with meat (mostly from Australia), the worry is what will happen when stocks here run out” said Cheek and Cloudstreet chef-owner Rishi Naleendra.

But the greatest challenge is the lack of traffic. Relish’s Willin Low said: “If people stop coming out, then there’s no point in keeping a restaurant open.” Read the story on CNA Lifestyle, link in bio. #Singapore #food #restaurant #F&B #coronavirus #COVID19 #safedistancing #socialdistancing (Photo: Instagram/Tiong Bahru Bakery)"
28,2280297450967494941,207567201,2020-04-05 10:11:00,"While many were out and about busy stocking up on stuff before Singapore's ""circuit breaker"" measures kick in on Apr 7, actress Rebecca Lim was also seen going around different parts of the island this weekend.

But instead of shopping, she and a friend were giving away 400 care packs for the elderly and frontline heroes in essential services, with some help from sponsors. Aside from going door-to-door, Lim also handed out care packs to taxi drivers, cleaners and construction workers.

She wrote on Instagram: ""I hope you spread love and choose kindness. We will get there. #SGcares #SGUnited."" #RebeccaLim #Singapore #charity #helping #circuitbreaker #coronavirus #COVID19 (Photos: Instagram/Rebecca Lim)"
29,2280310854931406920,207567201,2020-04-05 10:37:38,"How does one bring a bit of cheer into a stressful place like a hospital? Dress up in Teletubbies chic, that's how.

Filipino nurse Adrian Pe, who also happens to be a fashion designer, recently brightened up healthcare workers’ work lives in the Philippines with his colourful, homemade protective suits. Seeing that hospitals were low on personal protective equipment, he decided to put his sewing skills to good use. The Teletubbies-themed protective suits that are now worn by the staff at The Medical City Iloilo.

In an Instagram post, Pe wrote: “I work a lot in the hospital and the work there is exhausting. And I have always taught myself to look for the beauty in it; to look in the beauty in the faces of the patients and to be grateful. And I will bring this aspect as a Nurse Designer, to see situations with a SILVER LINING”. #Teletubbies #Philippines #nurse #fashion #hazmat #hospital #inspiration #COVID19 #coronavirus (Photo: Instagram/senoritoaidz)"
30,2284679072315639915,207567201,2020-04-11 11:16:30,"Malaysia-based Singaporean actor Aaron Aziz has spent RM50,000 (S$16,500) to distribute essential supplies to the less fortunate during Malaysia’s MCO (Movement Control Order). Through his organisation Journey to Insyirah, Aziz relayed help to close to 1,000 needy individuals and families across Malaysia, including Pahang, Melaka, Johor, Perlis, Kedah, Selangor and Kuala Lumpur. “I hope that whatever we do will be of help to the needy at this moment,"" he said. 🇸🇬🇲🇾💪#AaronAziz #charity #philanthropy #Singapore #Malaysia #MCO #coronavairus #COVID19 #CNAlifestyle (Pic: 8days.sg)"
31,2284716112323325344,207567201,2020-04-11 12:33:21,"Stay home, Singapore. Let’s make this circuit breaker work. #StayHome #StaySafe #CircuitBreakerSg #COVID19"
32,2286278879215935213,207567201,2020-04-13 16:15:02,"Kepuh village on Java island has deployed a cast of ""ghosts"" to patrol the streets, hoping that age-old superstition will keep people indoors and safely away from the coronavirus. Yes, ghosts.

Volunteers dressed up as pocong – traditional ghostly figures in Indonesia that are typically wrapped in white shrouds with powdered faces – walk the streets to basically scare villagers into staying at home.

At first it didn’t work because people actually went out to catch them walking around, but organisers have since changed tactics – they’re now launching surprise patrols. And it seems to be working. According to one resident, “Since the pocong appeared, parents and children have not left their homes. And people will not gather or stay on the streets after evening prayers.” Boo!

Read more on CNA Lifestyle, link in bio. #Indonesia #ghosts #pocong #socialdistancing #coronavirus #COVID19 (Photo: Reuters)"
33,2286756473388604347,207567201,2020-04-14 08:03:56,How’s everyone doing? Singapore is well into its “circuit breaker” period and we hope everyone’s been behaving themselves. Here’s a little reminder of the do’s and don’ts you can share with family and friends online. Stay safe everybody! #Singapore #safedistancing #circuitbreaker #coronavirus #COVID19 (Art: Rafa Estrada)
34,2287505310013121968,207567201,2020-04-15 08:51:44,"PSA: It’s now mandatory to wear a mask when stepping out of the house.

Singapore’s Minister for National Development Lawrence Wong made the announcement on Apr 14. Individuals who are caught refusing to wear a mask will be fined S$300 on their first offence, while those who flout the rule a second time will be fined S$1,000.

Foreign residents caught breaching these rules might have their work passes or permanent resident status revoked.

There are some exemptions: Children below the age of two don’t need to, and adults who are exercising (running and jogging) only need to put once they stop.

But that begs the question – how do you clean your reusable cloth masks? Experts say you should wash it as often as you wash your underwear, meaning after every use. You should also boil it in water once in a while.

We’ve got a whole story on mask maintenance on CNA Lifestyle so click on the bio link now! #mask #facemask #coronavirus #COVID19 #Singapore (Art: Rafa Estrada)"
35,2288284651290450353,207567201,2020-04-16 10:40:09,"When it comes to helping out in a pandemic crisis, every little step counts – and retired army captain Tom Moore is literally doing that in his garden.

The 99-year-old war veteran has become a celebrity by raising at least £6.4 million for Britain's health service with a walk around his garden during the COVID-19 crisis.

Captain Tom, who has used a walking frame to move around since breaking his hip, has set himself the target of walking the 25m around his garden 100 times before his 100th birthday later this month.

The story has lifted the hearts of a nation stuck in lockdown for the last month and weary of the relentless wave of grim news. Moore had originally aimed to raise £500,000 but that target has been smashed as media attention from around the globe has zoomed in on his garden in Bedfordshire, central England.

His son-in-law Colin Ingram said Moore wanted to give something back after receiving such good care from the state-run National Health Service (NHS) when he broke his hip two years ago and in subsequent hospital visits. ""We said we'd give him a pound a lap, and thank goodness I didn't say I'd match any money he raised,” quipped Ingram.

Raising money for the NHS has given Moore a new lease of life and the veteran has no plans to stop, even though he is due to hit his 100-lap target on Thursday morning. Read more on CNA Lifestyle, link in bio. #CaptainTom #walking #fundraising #coronavirus #COVID19 #inspiration (Photo: Reuters)"
36,2288968176972937979,207567201,2020-04-17 09:18:11,"Everyone’s working from home – and that includes a famous street artist like Banksy.

Unable to go out and spray on walls, he’s taken to creating a new artwork in his bathroom. He recently posted a photo on his Instagram account with the quip: “My wife hates it when I work from home.” It features his trademark stenciled rats running amok around the sink and toilet.

The big question is – does he still wear a mask at home? #Banksy #workfromhome #streetart #artist #graffiti #coronavirus #COVID19 (Photos: Instagram/Banksy)"
37,2289699210144456649,207567201,2020-04-18 09:30:37,"This weekend might be a good time to clean the house. Actually, you might want to take it a step further by disinfecting.

Wiping the shelves and the TV console with a cloth dampened with just water isn't enough to kill the coronavirus. You'll need a cleaning agent that effectively kills bacteria, viruses and fungi (read the label because not all can do all three). To make it more effective, let the liquid dry off on its own, and target these high-touch areas: Doorknobs, table surfaces, hard dining chairs (seat, back, and arms), kitchen and bathroom counters, taps, toilets (seats and flush handles), light switches, TV remote controls, and game controllers.

Read more of our tips on CNA Lifestyle, link in bio. #house #cleaningtips #coronavirus #COVID19 (Photos: Unsplash)"
38,2290470670064466377,207567201,2020-04-19 11:03:23,"McDonald's Singapore will suspend restaurant operations in all its outlets from Apr 19 until the end of the ""circuit breaker"" period.

In a press release, it said: ""McDonald’s Singapore today announced it has been advised by the Ministry of Health that as a preventative action in the fight against COVID-19 in Singapore, it is suspending restaurant operations, including McDelivery and Drive-Thru, till May 4."" This move - which includes drive-through and delivery services - went into effect from 11am Sunday, and comes a day after the fast food chain announced the suspension of takeaways.

In announcing its previous move to suspend takeaways, the company said that it would continue to pay salaries of employees, including seniors, whose roles will be disrupted during this period. There are seven McDonald's employees infected with COVID-19 to date. #McDonalds #Singapore #fastfood #circuitbreaker #coronavirus #COVID19"
39,2291845206349602400,207567201,2020-04-21 08:34:20,"They were supposed to help save the day. Instead, it’s back to the drawing board for the Virus Vanguard, Singapore’s anti-COVID-19 superhero team.

The five-member fictional team made its debut on the Gov.sg website on Apr 21 but was taken down less than a day, with the Ministry of Communications and Information (MCI) saying it’s “undergoing a review” after receiving a lot of feedback about the characters.

Virus Vanguard was a collaboration between Gov.sg and art collective Band of Doodlers. The plan was to create a comic series to convey the different aspects of the ""circuit breaker"" measures aimed at stemming the spread of the coronavirus. But some characters were criticised for too much levity while others felt the emphasis could have been on healthcare workers.

But one character drew much of the flak – MAWA Man, a Manchester United-supporting character who really doesn’t like Liverpool FC. The name, Must Always Walk Alone, was a jibe at the latter’s motto You’ll Never Walk Alone. An online petition by LFC supporters to withdraw the character received more than 500 signatures.

Band Of Doodlers founder Mas Shafreen has apologised, saying the characters “came across insensitive… A group of us, including myself, wanted to create superhero characters to show appreciation for our frontliners, including healthcare workers, and how we can battle this together.” Read more on CNA Lifestyle, link in bio. #VirusVanguard #superhero #MAWA #YNWA #LFC #coronavirus #COVID19 (Photo: Gov.sg)"
40,2292564831156716204,207567201,2020-04-22 08:24:06,"Singapore’s “circuit breaker” period has been extended to June 1. But if you were thinking of ordering online a nice, refreshing cup of bubble tea to comfort yourself, that might be hard.

The list of essential services that will stay open during this period have been trimmed even further. That means specialised food and beverage outlets will have to shut for now, including outlets that “predominantly” sell drinks like bubble tea, fruit juice, smoothies, coffee, soya bean and alcoholic drinks. Popcorn stores, bak kwa shops, ice cream shops, outlets that mainly sell cakes, cupcakes, cheese and other desserts will have to close too.

And if you’ve got zero shaving skills, you might have to resign yourself to growing your hair out this circuit breaker period), as hairdressers and barbers will have to close their outlets. Read our story on what you can or cannot do under tighter circuit breaker rules on CNA Lifestyle, link in bio. #Singapore #circuitbreaker #bubbletea #coronavirus #COVID19 (Photo: Unsplash)"
41,2297650378157991096,207567201,2020-04-29 08:48:10,"Lights, camera, online action! There’s big news in the world of Hollywood – movies that were only released on streaming platforms or video on demand to be eligible for the Oscars next year.

The rule change was, of course, because of the coronavirus pandemic, which has affected a lot of movie releases this year. Usually, the Academy of Motion Picture Arts and Sciences requires at least a seven-day run in Los Angeles theaters for movies to be eligible.

The news comes right after after the world’s biggest film festivals – which were also affected by COVID-19 – decided to hold a huge 10-day online festival in May instead. Called We Are One: A Global Film Festival, it’ll feature films curated from over 20 festivals around the world, including biggies such as Cannes, Sundance, Berlin, Venice and Toronto film festivals. #Oscars #AcademyAwards #Hollywood #movie #streaming #film #festival #coronavirus #COVID19 (Photo: AFP)"
42,2299864837039440608,207567201,2020-05-02 10:07:55,"UK's Princess Charlotte, the daughter of Prince William and his wife Kate, celebrated her fifth birthday on Saturday (May 2). And to mark the occasion, a handful of photographs were released to show what she's been doing during lockdown.

And apparently, she's being very charitable. The photographs were taken last month by her mother at the Sandringham Estate in eastern England, where the family helped to pack and deliver food parcels for isolated pensioners in the local area. #PrincessCharlotte #royalfamily #PrinceWilliam #KateMiddleton #lockdown #COVID19 #coronavirus (Photos: Reuters)"
43,2307838010108307294,207567201,2020-05-13 10:09:11,"Canadian rocker Bryan Adams has recently apologised after a backlash and accusations of anti-Chinese racism over his online rant about the pandemic forcing the cancellation of his London shows this week.

The Please Forgive Me and Cuts Like A Knife singer issued a statement offering ""apologies to any and all that took offence to my posting yesterday” and added: ""I have love for all people."" Adams had said in earlier expletive-laced Twitter and Instagram posts that his gigs at the Royal Albert Hall were nixed thanks to ""bat eating, wet market animal selling, virus making greedy bastards."" He also admonished the Chinese to go vegan.

While animal rights groups praised his call to stop eating meat, others interpreted the expletive-laced comments as anti-Chinese. In his apology, Adams explained: ""No excuse, I just wanted to have a rant about the horrible animal cruelty in these wet markets being the possible source of the virus, and promote veganism."" Read more on CNA Lifestyle, link in bio. #BryanAdams #antiChinese #rock #music #concert #PleaseForgiveMe #CutsLikeAKnife #COVID19 #coronavirus (Photo: AFP)"
44,2312200292502129457,207567201,2020-05-19 10:36:15,"Twenty years after leaving the group, Robbie Williams will be taking back his spot in Take That – but only for an online concert for charity, which will take place on May 29.

He’ll be joining Gary Barlow, Mark Owen and Howard Donald for a benefit show for music therapy charity Nordoff Robbins and Crew Nation, which provide support for concert crew members during the pandemic outbreak. No word yet on whether Jason Orange will also be re-joining his old group.

The concert will be hosted on the Compare The Meerkat YouTube and Facebook pages. Read more on CNA Lifestyle, link in bio. #RobbieWilliams #TakeThat #concert #charity #music #boyband #GaryBarlow #MarkOwen #HowardDonald #JasonOrange #coronavirus #COVID19 (Photo: Reuters)"
45,2317987898666165506,207567201,2020-05-27 10:15:12,"Remember that viral video of Andrea Bocelli singing by himself in Milan’s Duomo? That touching performance by the famous blind Italian tenor back in Apr 12 turned out to be much more poignant than we thought – he recently revealed he had tested positive for COVID-19 a month before that.

Bocelli described his experience as “a nightmare”. “It was a tragedy, my whole family was contaminated. We all had a fever – though thankfully not high ones – with sneezing and coughing,” he told journalists at a hospital in Pisa where he had gone with his wife to donate their plasma for COVID-19 research.

Read more on CNA Lifestyle, link in bio. #AndreaBocelli #singer #tenor #Milan #Duomo #coronavirus #COVID19 (Photo: AFP)"
46,2321899337730534435,207567201,2020-06-01 19:54:41,"As Singapore segues into its post-circuit breaker journey, Mediacorp and Gov.sg present a montage of stories featuring people who’ve been impacted by the ongoing COVID-19 outbreak, and how everyone has come together to emerge stronger during the crisis. It's capped off with a song performance led by singer Joanna Dong and the Singapore Symphony Choruses. #SingaporeTogether #StrongerAsOneSG #COVID19 #circuitbreaker #resilience #storiesofhope (Video: Mediacorp)"
47,2329878735071189150,207567201,2020-06-12 20:01:19,"From closed venues to cancelled shows, how is Singapore’s art community coping during the COVID-19 pandemic?

DJ KoFlow gives us a sneak peek at what he's been up to, with a special tutorial demo just for you. He's part of a brand new documentary on the #stayhome lives of 8 Singaporean artists, titled Artists Unstaged, which premieres on Jul 24 (Friday), 9.30pm, on CNA.

If you like what he's done, don't forget to sound-off in the comments below! #DJKoFlow #Singapore #music #djing #tutorial #howto #COVID19 #pandemic (Video: @djkoflow )"
48,2332586569829924429,207567201,2020-06-16 13:40:09,"Phase 2 of Singapore’s reopening will start on Friday (Jun 19) with social gatherings of up to five people allowed. Retail outlets can open, dining in at F&B outlets will be permitted, and tuition and other private enrichment classes can resume with some exceptions. Bookmark this and share with family and friends. And remember to mask up and practice safe distancing! #Singapore #Phase2 #COVID19 #mask #safedistancing (Art: Rafa Estrada)"
49,2336874372752968303,207567201,2020-06-22 11:39:15,"Last year, Nat Ho moved to Los Angeles to start a course in music production. No one imagined the world would change in just a few short months – and the 36-year-old Singaporean actor-singer would experience the Black Lives Matter protests and the COVID-19 pandemic in another country.

CNA Lifestyle recently had a quick email chat with Ho. “I think when the Black Lives Matter protests first happened, they were peaceful, until various groups with different agendas started hijacking the movement, rioting and looting until curfews were implemented. Won’t lie – that week was pretty stressful. I could hear sirens and police helicopters every night, and the occasional sound of gunshots. Later that week, there was also a report of an active shooter in my neighborhood, so that was slightly stressful,” he said.

But for the most part, he’s been safe and sound. Aside from his music course, he also found time to do a bit of acting – he’s part of a web series called Comisery, which was shot entirely over Zoom and was a project to celebrate Asian-Pacific American Heritage Month. Read our interview with Nat Ho in CNA Lifestyle, link in bio. #NatHo #LosAngeles #Singapore #actor #singer #pandemic #COVID19 #BlackLivesMatter (Photo: Instagram/iamnatho)"
50,2341926440072963466,207567201,2020-06-29 10:56:48,"Making ends meet hasn't been easy with the global pandemic taking a toll on some families' incomes. But two stay-home mothers who live in Jalan Kukoh, one of the least well-off neighbourhoods in Singapore, have tried to weather the storm by starting home-based food businesses.

Nurhazirah Binte Rahmat launched Zirah La Cocina to sell crisp, fluffy tahu begedil, while Siti Khadijah started Lady’s FoodIcon to sell her “poprolls” after learning about the carbonara popiah food trend in Malaysia.

Both mothers are part of Project Cookoh, an initiative that began in April, thanks to Samantha Kwan, a member of the volunteer organization Readable, which works with children in the area to equip them with literacy skills.

Read their inspiring stories on CNA Lifestyle, link in bio. #Singapore #JalanKukoh #Readable #mothers #begedil #tahubegedil #popiah #carbonarapopiah #food #ZirahLaCocina #LadysFoodIcon #inspiring #COVID19 #circuitbreaker (Photos: Ijah, Zirah, Lady’s FoodIcon, Zirah La Cocina)"
51,2347076800437681801,207567201,2020-07-06 13:29:39,"Broadway actor Nick Cordero died on Sunday (Jul 5) after months of battling COVID-19. He was 41 years old.

His wife, Amanda Kloots, had been updating her page with news of Cordero’s health for the past few months since he was first hospitalised at the end of March. He’d had several complications from the disease, and had his leg amputated in April.

Cordero was a Tony Award-nominated actor for his role in Bullets Over Broadway, and was also known for appearing in Rock Of Ages, Waitress and A Bronx Tale. Read more on CNA Lifestyle, link in bio. #NickCordero #Broadway #actor #COVID19 #coronavirus (Photo: Instagram/nickcordero1)"
52,2349872674603539029,207567201,2020-07-10 10:06:39,"We stayed up late in Singapore to have a chat with Hollywood’s nicest guy, who has some important words to say about washing hands, wearing a mask and streaming movies at home, including his latest, Greyhound. Read more on CNA Lifestyle, link in bio. #TomHanks #Greyhound #Hollywood #movie #celebrity #actor #COVID19 (Video: Joyee Koo)"
53,2350551192194879111,207567201,2020-07-11 08:32:39,"If you're out this weekend and have to use a public bathroom, think not just of yourself but others after you. The best defenses against bathroom contagions are a mask, social distancing, limiting the surfaces you touch with your hands and hand hygiene.

1. Consider larger bathrooms with multiple stalls because they have more air circulation.

2. If someone exits a bathroom stall or a single bathroom right before you, try waiting at least 60 seconds before entering – especially if the toilet seat lid is up, signifying more plume.

3. Skip the paper toilet seat covers. They are likely placebo – we have no idea if they offer protection from bacteria or viruses – and they could easily be contaminated with toilet plume, so touching them with your hands could be a source of infectious transmission.

4. If you need to dispose of a menstrual product in one of those little containers, touch the lid with a wad of toilet paper and sanitise your hands after. Those lids are among the worst surfaces in the bathroom stall: Touched by many unwashed hands and showered with infectious plume.

5. If the toilet has a lid, close it before you flush so it traps the plume. Think of the lid as a mask for the toilet.

6. If an automated toilet is flushing, step back because those things spray.

7. How you dry your hands after washing probably doesn’t matter; paper towels or dryers are likely equal. But do avoid shared, reusable hand towels.

8. Get out of there quickly. Chatting in bathrooms is the new smoking in bathrooms – it’s a relic of the past. If you have to open a door to exit, use hand sanitiser after you leave.

Read the full story on CNA Lifestyle, link in bio. #hygienetips #toilets #etiquette #pandemic #COVID19 (Art: The New York Times)"
54,2352034932427559621,207567201,2020-07-13 09:40:35,"Revered Bollywood actor Amitabh Bachchan's daughter-in-law and granddaughter have joined him and his son in testing positive for COVID-19, the family said on Sunday (Jul 12), in one of the highest-profile cases of the pandemic sweeping India.

From hospital with his father in Mumbai, Amitabh Bachchan's son Abhishek said his wife and former Miss World Aishwarya Rai Bachchan and their eight-year-old daughter had also been infected by the new coronavirus.

He tweeted: ""Aishwarya and Aaradhya have also tested COVID-19 positive. They will be self quarantining at home."" He added that other family members had tested negative and thanked Indians for their wishes and prayers. Read more on CNA Lifestyle, link in bio. #AmitabhBachchan #AishwaryaRai #AbhishekBachchan #India #Bollywood #celebrity #COVID19 (Photo: Reuters)"
