,title,name,score,id,url,num_comments,created_dts,upvote_ratio
0,Singapore's move to introduce wearable devices for contact tracing sparks public outcry,t3_gy9a1x,455,gy9a1x,https://www.zdnet.com/article/singapores-move-to-introduce-wearable-devices-for-contact-tracing-sparks-public-outcry/,208,2020-06-07 17:38:44,0.95
1,"Singapore plans to give a wearable device that will identify people who had interacted with carriers of coronavirus to all of its 5.7 million residents, in what could become one of the most comprehensive contact tracing efforts globally.",t3_gx0sep,62,gx0sep,https://www.reuters.com/article/us-health-coronavirus-singapore-tech-idUSKBN23C0FO,16,2020-06-05 16:39:09,0.93
2,"COVID-19: Govt developing wearable contact tracing device, may be distributed to everyone in Singapore",t3_gx012r,22,gx012r,https://www.channelnewsasia.com/news/singapore/covid-19-contact-tracing-device-trace-together-app-12806842,16,2020-06-05 15:33:24,0.87
3,Singapore launches app that automatically shares encrypted identification data with other mobile phones allowing the government to be more efficient at contact tracing by decrypting a patient's phone.,t3_flw4xt,19,flw4xt,https://www.youtube.com/watch?v=k1vCOx6RcWw,11,2020-03-20 22:43:12,0.8
4,Singapore changes the rules and will now use COVID-19 contact-tracing app data in criminal cases,t3_kqwou9,455,kqwou9,https://www.theregister.com/2021/01/05/singapore_covid_tracing/,80,2021-01-05 19:30:02,0.99
5,Singapore government to pass law to ensure contact tracing data can be used only for serious crimes,t3_ktp5ln,883,ktp5ln,https://www.straitstimes.com/singapore/legislation-to-be-passed-to-ensure-tracetogether-data-can-only-be-used-for-serious-crimes?utm_source=STSmartphone&utm_medium=share&utm_term=2021-01-08+21%3A21%3A11,43,2021-01-09 19:18:21,0.98
6,Apple-Google contact tracing system not effective for Singapore: Vivian Balakrishnan,t3_h9bu7l,10,h9bu7l,https://www.straitstimes.com/singapore/apple-google-contact-tracing-system-not-effective-for-singapore-vivian-balakrishnan?xtor=CS3-18&utm_source=STiPhone&utm_medium=share&utm_term=2020-06-15%2016%3A06%3A21,30,2020-06-15 16:07:00,0.65
7,Broken promises: How Singapore lost trust on contact tracing privacy,t3_kx061p,66,kx061p,https://www.technologyreview.com/2021/01/11/1016004/singapore-tracetogether-contact-tracing-police/,18,2021-01-14 14:30:33,0.82
8,Measures to tackle COVID-19 cases in dorms early on were 'insufficient': Teo Chee Hean,t3_h7dfw8,83,h7dfw8,https://sg.news.yahoo.com/measures-to-tackle-covid-19-cases-in-dormitories-early-on-were-insufficient-teo-chee-hean-115439249.html,39,2020-06-12 11:50:50,0.93
9,"1,037 NEW COVID CASES REPORTED [23/4/20]",t3_g6iav2,88,g6iav2,https://www.moh.gov.sg/news-highlights/details/1-037-new-cases-of-covid-10-infection,79,2020-04-23 15:25:32,0.93
10,"Singapore reports 932 new COVID-19 cases, bringing total past 17,000",t3_gbdjuv,148,gbdjuv,https://www.channelnewsasia.com/news/singapore/moh-covid19-coronavirus-cases-update-may-1-12693936,51,2020-05-01 15:13:43,0.98
11,The Spike in Singapore’s Coronavirus Cases Reveals an Uncomfortable Truth About the Treatment of Migrant Workers,t3_g33g9y,83,g33g9y,https://www.vice.com/en_asia/article/5dmx5x/singapore-coronavirus-migrant-workers-inequality,23,2020-04-17 22:51:30,0.87
12,Coronavirus: Cruise ships assessed for feasibility to temporarily house healthy foreign workers,t3_g2v9h8,24,g2v9h8,https://www.straitstimes.com/singapore/coronavirus-cruise-ships-assessed-for-feasibility-to-temporarily-house-healthy-foreign,31,2020-04-17 12:51:50,0.77
13,"Opinion: Companies that are running the foreign worker dormitories should be the ones footing the bill for the treatment of the foreign workers, not the taxpayers.",t3_g0mek9,790,g0mek9,https://www.reddit.com/r/singapore/comments/g0mek9/opinion_companies_that_are_running_the_foreign/,173,2020-04-14 00:34:02,0.89
