,Comment,Thoughtful?,Topic
410,"Vaccine distribution is a very complex process that touches on global sourcing, local distribution, chain of command and product security, visibility into all transportation modes used to distribute the vaccine and inventory. https://t.co/rUFmaNjDdP",0,vaccination
411,Chinese President Xi Jinping offers Covid-19 vaccines and trade ties in bid to keep Central and Eastern Europe on side https://t.co/RSvoY6SzEz,0,vaccination
412,@melissakchan @profgalloway My guess is we have to live with it and there won't be ever be a vaccine. Even the reg flu vaccine is no guarantee. We need to focus and move forward.,0,vaccination
413,I‘ll get it once it becomes available,0,vaccination
414,👍👏💕,0,vaccination
415,"Then you don't understand how clinical trials (or at least this clinical trial) work.

This vaccine has already been tested on the most number of human ""lab rats"" of all vaccines in history, at the time of release. Most trials involve hundreds of test subjects. This one involved thousands simply because so many cases are readily available. If anything, it's the most well tested vaccine in history. The only thing that is not known is long term effects, but that is the same with every other new vaccine when released.",1,vaccination
416,What vaccine? Phizer?,0,vaccination
417,Take the Chinese vaccine then. Good luck.,0,vaccination
418,⚡️ Russia is luring in vaccine participants with free ice cream https://t.co/HGSqZR7FpN @Quicktake,0,vaccination
419,"Actually Ministers getting vaccinated first isn't a bad thing. Its to set an example and give the people some form of confidence in the vaccine. 

Also, its important to protect leadership in times like this.",1,vaccination
420,Alcohol Pillar 酒柱 plausible sia. Like a drunken Water Breathing and can combo with Fire Breathing lmao.,0,vaccination
421,"Mfd in Oct 2020 Exp in Apr 2021 Administered around the globe in Jan/Feb/Mar 2021 Seems normal, no issues clinically...NOBODY is complaining. Countries are grateful. Asking us for more. @SaketGokhale seems to not understand this... Any vaccine available for Modi-hate infection?",0,vaccination
422,"I disagree. Pretty sure one of easiest way to carry out a mandatory vaccination is via school students, inclusive of tertiary students. Most of which are under 60",0,vaccination
423,Asset Allocation: Vaccine Rollout and Policy Stimulation vs Inflation Concerns. The critical driver for #equities remains #vaccine rollout/reduced social distancing and... Read more: https://t.co/f6NoaSFKDy Or take a free trial: https://t.co/VQNQauTYwO #macroeconomics #markets https://t.co/afRDfBnGis,0,vaccination
424,What I have been telling you since early December... South Africa halts rollout of AstraZeneca vaccine https://t.co/7jU0VOD2tf,0,vaccination
425,"Best not buy those manufactured in China....There are some ""black hearted"" 黑心 merchants or producers tat can make fake eggs n add all kinds of colours to fruits to make them look fresh n good and sell them to unsuspecting consumers...truly scary..But one of their MOST UNFORGIVABLE acts is making fake baby milk formula powder tat caused babies to fall sick after drinking...This is the Most Disgusting bcos babies are so defenceless n depend on milk powder to live on bcos not All mothers are able to breast feed their babies...so best not buy vaccine from China. Thank you very much..",0,vaccination
426,"I am not persuaded that once the vaccine arrives en masse, everyone will magically jump back to normal. International travel, concerts, theme parks, etc. Some will. Hell, I probably will. But I don't think I'm in the majority here.",0,vaccination
427,We're Tracking the Global Vaccine Race https://t.co/fIMps5fWVH,0,vaccination
428,Moderna wants to pack 50% more COVID-19 vaccine per vial https://t.co/j4PdXcjc7r https://t.co/pJsovTSgiE,0,vaccination
429,@elizabethbuhl,0,vaccination
430,After conducting a press conference every day for almost a year Malaysia’s Director General of Health @DGHisham is now calling on the media to be a vaccine against fake news. https://t.co/iNlN3qEHJ6 https://t.co/mFjbxxzic5,0,vaccination
431,"WFH doesn't mean you can't get the virus. Definitely you have a lowered risk of contracting covid, but what about going out to eat, meeting friends and family?",0,vaccination
432,Come soon in #Singapore Corona #vaccine,0,vaccination
433,"BREAKING: Singapore to enter #phase3 on 28 Dec, group gatherings limit raised from 5 to 8. Vaccines to be made free for all Singaporeans when available, but will be on voluntary basis.",0,vaccination
434,Vaccine and Cell Based Therapeutic Approaches in Acute Myeloid Leukemia https://t.co/AAO7duuiFS,0,vaccination
435,"Tolong la vaccine cepat2 siap, ill pay any amount...",0,vaccination
436,Sec Carlito Galvez updates PRRD regarding COVID-19 vaccine acquisition. Gamaleya Sputnik V has 91.6% efficacy.,0,vaccination
437,"@SAfmRadio @StephenGrootes For wht purpose exactly? Why must we use/spend money on vaccine tht is not affective to the variant we hv in SA, when other countries are using vaccine tht are 90% more affective?",0,vaccination
438,"@sanjaykhannaMD Rihanna of Barbados tweets lies about your ancestral land (my motherland)...the tool kit has been exposed (sure that you are aware). - AND - PM Modi sends vaccines to Barbados. Is this what you mean by ""looking after one another""? Please clarify, @sanjaykhannaMD",0,vaccination
439,its not like ministers arent in the high risk group,0,vaccination
440,"> John Han, a sales manager, said he wanted to wait for 80% of the population to take the vaccine without side effects.

That's just ridiculous. AFAIK, all vaccines have side effects. I often get fever and fatigue for a couple of days after getting a flu jab.",0,vaccination
441,Thailand to conduct Phase 1 clinical trials on locally produced Covid vaccine in March https://t.co/TgxcFJ6lbQ https://t.co/fvJqqNJZIA,0,vaccination
442,"Did you know flu vaccines change every year? And they ALL carry risk of side effects? Would you now forever not take any vaccines?

You talk about long term side effects. Vaccines are different from taking chemical drugs. For one vaccines are a 1 time occasion (the risk of long term effects are minimal), chemical drugs that cause long term damage to your body also don't cause that much damage on a single dosage, it usually damages your body because of frequent use. Also, vaccines are essentially inactivated viruses that activate the antibodies in your bodies to fight against the virus. The bigger worry is not long term side effects but short term side effects.",1,vaccination
443,Imagine we are just test subjects to see if the vaccine works LOL,0,vaccination
444,Not true - I see loads of idiot friends from the UK flying into Dubai and anywhere else that will take them right now (maybe it's not so idiotic to try and escape the UK). You'd be amazed how some people are not risk averse kiasu/kiasi and are blundering about life pretending nothing is happening.,0,vaccination
445,Delivering vaccines to remote areas needs continuous innovation - alternative last mile delivery for vaccines through drones from @Wingcopter #VaccinesForAll #HealthTech #DigitalHealth https://t.co/2pqmadt5Xc https://t.co/DfesC1yndH,0,vaccination
446,Equity in vaccine distribution key to speedy global recovery: AAPA - https://t.co/eyYg4jL67h https://t.co/oHFavTwn3V,0,vaccination
447,First comment,0,vaccination
448,Nah it will be something lame like Pro-PAP,0,vaccination
449,"Good things need new be touted, hence I smell a rat.",0,vaccination
450,"They will in all likelihood roll out the vaccination plans based on a combination of risk profiles (elderly, frail/immune-suppressed individuals, healthcare workers etc.) and economically vital professions (Airport staff, construction etc.).

Most healthy adults will probably be the last to be eligible for the vaccination",1,vaccination
451,"@QueenOfMyHappi1 @baymath So heres a thought. If the only vaccines available were not as effective on the variant that most dominant here, and the JnJ was not found to be more effective would we rather say let's not have any? No. We also have to retest efficacy when things arrive on our own. A catch 22",0,vaccination
452,"What am I twisting? You say there’s no data. Which is correct, there isn’t. A doctor says because there is no data, we don’t know the long term risks. So maybe don’t take immediately, wait and see. And yet somehow the doctor who says this is wrong in your world view because he should keep that opinion to himself? 

I mean all your responses have been saying that doctors shouldn’t be saying anything contrary about the vaccine even though they should be doing risk assessments. Risk assessment isn’t just about the immediacy of COVID, it’s also about the future. As an example, doing knee replacement. It improves quality of life now but it has to be replaced. That’s why doctors have to explain the risks to their older patients because if they outlive the replacement, they then have to be on wheelchair or undergo another surgery which is highly risky at an even older age. 

And couple that with the fact that Singapore has very low number of community cases now. Why is there surprise people are a lot more cautious about putting something into their bodies?",1,vaccination
453,Asset Allocation: Vaccine Rollout and Policy Stimulation vs Inflation Concerns. The critical driver for #equities remains #vaccine rollout/reduced social distancing and... Read more: https://t.co/Vf8zWkapn9 Or take a free trial: https://t.co/5oiAv6K7ka #macroeconomics #markets https://t.co/pFWR05iEBW,0,vaccination
454,Facebook to BAN claims about ‘man-made’ Covid-19 &amp; ‘unsafe’ vaccines as it launches election-like campaign to promote vaccination https://t.co/mOt2qTSTHv #,0,vaccination
455,"You are such a smile virus carrier, @ibabydivya ! And no one needs a vaccine for it.. 🙂 @ Singapore https://t.co/i4OodR2wT3",0,vaccination
456,Vaccine Missteps Bring Us Back to Earth https://t.co/DA474J4JMu,0,vaccination
457,After healthcare workers will it be compulsory for all Sg citizens because I really don’t want to take,0,vaccination
458,This vaccine shit is wild but not wholly surprising given how dynamic the virus and concomitant research are. On to 2022,0,vaccination
459,cheap manifesto.. 😡😡 So government doesn’t give COVID vaccine for free if they lose ?,0,vaccination
460,So how long is this going to go? If everyone adopts this wait and see methodology we will spend years waiting and seeing.... It is ultimately harmful.,0,vaccination
461,"Vaccine development proved that when enough smart people give a shit, they can do incredible things. Now do the same for climate change and space exploration",0,vaccination
462,Shall I do this later during my vaccine 😂😂,0,vaccination
463,@smadixit @prdpgtm I’ll hold my judgment till trials are done.. I’ll like to know if BCG vaccine helps in faster recovery and lower death rates,0,vaccination
464,"Israel is paying double or triple what the US and Europe are paying.

Gahmen is probably not willing to pay that amount.",0,vaccination
465,Verified,0,vaccination
466,This is classic! Canada is still scourging for Vaccines while India has already vaccinated 3 million and distributed a few millions to a dozen nations. #VaccineMaitri No time except for supporting #Khalistanis #NarendraModi,0,vaccination
467,Exactly. This is what I hope the goverment has the balls to do. Fuck public sentiment. Sometimes you need to grab someone by their tits and tell them what's good for them,0,vaccination
468,Is this actually the reason Australia are waiting until March? I'm deeply sceptical of this because 3 months is almost nothing considering that these vaccines have been in trials for longer than that. To hesitate is not necessarily a reasonable response. The proportion of people that are going to have long-term health effects from covid (even young and healthy people) is going to be far greater than from the approved vaccine. So anyone seriously worried about side effects should probably be staying at home at all times to prevent themselves getting covid.,1,vaccination
469,DHL's air freight station in Singapore has renewed its CEIV Pharma certification just in time to support the distribution of Covid-19 vaccines in the region and worldwide. @DHLGlFwdingAP @DeutschePostDHL #pharmalogistics #airfreight #DHL #payloadasia https://t.co/dTY6SDqoxC,0,vaccination
470,What do you work as?,0,vaccination
471,Mjolo the expiring vaccine 🤞🏾😅😭,0,vaccination
472,"The virus didn't change, it's as 'deadly' as it is, still no vaccine, still as infectious as ever. Our perception of it change as more information surface and how media portray the issue. Perception may not be the reality, but it has a much bigger impact than you think",0,vaccination
473,"Long term side effects usually comes from long term use of a medication. It happens because the way modern medicine works. 

The body has lots of natural processes going on. Some of this processes, when out of “balance”, can lead to disease. Drugs target aspects of such biological processes to bring it back to “balance”, sometimes by blocking it, sometimes by enhancing it. 

Drugs are *small* molecules. The body doesn’t care about the atoms making up the molecule, the body cares about the *shape*. These specially designed drug molecules go into the protein (or other molecules) and do its “magic”, affecting the natural biological processes and bring it into balance.

One problem with this is that the body sometimes likes to reuse the same protein (or family of similar proteins) in different places to control different processes. A drug may unintentionally affect an otherwise unintended process(es) and cause long term unforseen problems.

Another problem is that a drug can target some completely unexpected target. As I said earlier, the shape is important. While a drug can be designed to fit a certain protein, there is chance that by coincidence, it can also hit some unrelated protein elsewhere and affect other processes and cause problems in the long term.

Also, ultimately, all drugs are poison and the only thing that differentiate medicine from poison is the dosage. Too much of an effect can be bad. There are drugs that can cause damage to organs at higher dosages, for example. 

Sometimes, the drug molecule itself can be chemically reactive, and can cause damage. Keep using it and you get long term damage. Rarely, if such chemically reactive drug damage the DNA enough over the years, people can even get cancer. Fortunately, people know some of the common reactive features and avoid those.

To complicate things, the body tends to do things to a drug molecule to make it easier to get rid of it. That thing can be inherently toxic (such as one of paracetamol/panadol’s metabolite), or it can have effects of its own.

There are a lot of ways for a drug to cause long term problems and side effects. However, does this mean mRNA vaccines can do so too? There are differences between mRNA and drug molecules and that makes things different.

Ultimately, mRNA is a naturally occuring information carrying molecule. You have it in your body and it comes in many different lengths. The mRNA in the vaccine is not going to be any more reactive than those you already have!

Compared to drug molecules, mRNA are huge. Things bind to sites on the mRNA, not really the other way around. It’s not very likely to trigger things you wouldn’t expect a normal mRNA to trigger.

Inherently, mRNA are not toxic, so that is one safe part.

Although we cannot rule out the possibility that the viral product it encode for can target unwanted processes and cause effects, it isn’t something very likely. Given that mRNA is not very stable, it doesn’t stay for long and you are only exposed to the amounts injected. Even if the product is not harmless, it is transient and shouldn’t cause too much of an effect, and unlikely to cause a long-term one. Your body can take a bit of damage. You go out under the sun? Damage. Eat or touch stuff too hot? Damage. Etc etc.

It would be *far worse* to get the real deal, since the actual virus can replicate and make much much more potentially harmful viral proteins that a mRNA vaccine can cause your body to produce, on top of other problems associated with the actual covid virus.

To be honest, the most likely reactions are immune related ones and those most side effects are short term and not likely to be very harmful.

If you react very negatively to the mRNA in the vaccine and the protein it produces, I don’t think you would fare any better with the real virus.

The chances of the vaccine working as intended safely is high, probably better odds with that then the odds between mild and serious covid.",1,vaccination
474,CanSinoBIO's COVID-19 vaccine 65.7% effective in global trial - Pakistani official https://t.co/LU8aqQq33q via @yahoosg,0,vaccination
475,"This whole post is more or less asking how much you trust the covid vaccines and the level would differ from individuals as well as trust in the different vaccines and from your skepticism, it sounds like you are also concern with the [supply chain](https://www.globalcitizen.org/en/content/china-fake-vaccine-rabies-scandal-dpt/)",0,vaccination
476,Those that support the vaccine are now tweeting that they want the current vaccine most of them are in the media 😂😂😂,0,vaccination
477,"i think this is the first time i actually read PAP ministers ""afraid of being accused"" of something.",0,vaccination
478,"Please be vigilant, all of us are not in the clear yet as long as there is no vaccine for COVID19.",0,vaccination
479,Chinese vaccines win acclaim https://t.co/eAzf66uiPL,0,vaccination
480,Still unclear about the vaccine. Too short time in trial period. Worrisome 😢😢,0,vaccination
481,Were you there to track the process for any of the vaccines?,0,vaccination
482,"https://www.reddit.com/r/singapore/comments/kt202y/singapores_3_covid19_vaccines_and_is_one_better/gimwvlf/?utm_source=share&utm_medium=ios_app&utm_name=iossmf&context=3

Did a sus on sinovac in another thread and received a gold reply on how we should still have some faith on the vaccine approving process.",0,vaccination
483,Indian state rejects Bharat Biotech COVID-19 vaccine approved without efficacy data https://t.co/ZNQMml4lGS https://t.co/2NUEsym1XC,0,vaccination
484,"I did but I wasn't sure if it was the article you are referring to because well... it supports my point.

Are you referring to [this article?](https://www.ejinme.com/article/S0953-6205\(13\)00986-2/pdf) It's the first result.

Did you even read it?

It's a letter to the editor by Chinese doctors **APPEALING** to them to raise awareness of the corruption in the Chinese medical industry. It's literally proving my point. Congrats on clapping yourself.",0,vaccination
485,That plane is laughing,0,vaccination
486,NIMBY except now it is Not In My BodY,0,vaccination
487,"Right, because you were there to oversee every step of the process.",0,vaccination
488,ngl true and raven would have seen how to make the vaccine as well,0,vaccination
489,"It's not the vaccine, but the vaccine technology. 

The novel mRNA technology has not been tested long-term in a human population on a wide enough scale. 

On the other hand, the conventional inactivated virus technology has stood the test of time ever since the smallpox vaccine was created in 1796. 

We know inactivated virus vaccines don't cause long-term side effects in humans. We can't say the same for mRNA vaccines because we have absolutely no data.",0,vaccination
490,People are free to choose which INFO to take away. The Sobers: Vaccines The Wokes: Gasoline🔥,0,vaccination
491,We may never eliminate the virus but who cares when everyone has the vaccines 😃😃😃,0,vaccination
492,How about June 2021 still can go holiday,0,vaccination
493,Cepat lah buka Singapore. Batam waiting u for open lol,0,vaccination
494,"Japan's receives first batch of COVID-19 vaccine, courtesy of Pfizer https://t.co/18yBCYpT2H https://t.co/iuWuCT9trS",0,vaccination
495,Racist Trump. You claim that the vaccine will be available in 4 weeks. The your medical experts say it will only be ready in early 2021. You are stupid and brainless so listen to the expects. You are not fit for President. You are the biggest liar. You are a predator. https://t.co/W98hNRDoyb,0,vaccination
496,Facebook and Instagram will ban accounts spreading #Covid vaccine misinformation https://t.co/GusoHCWwgR https://t.co/VQEjhTtKy3 @Quicktake,0,vaccination
497,maybe it’s just in my head but i’m awfully tired and i have a terrible headache a few hours after my vaccine today :’(,0,vaccination
498,CoVid Vaccine is coming 😲 https://t.co/84dRpN90zi,0,vaccination
499,i hope the vaccine would be a success:D,0,vaccination
