,Comment,Thoughtful?,Topic
0,"Herd immunity kicks in at around 70% so we don't need to hit 100%, and your confusing effectiveness with efficacy.

Whilst it's likely that not everyone will be protected completely so far noone in the trials has had a severe case once they've passed 20 days from the first shot.

So yes, once we hit that target we can open up with very little risk.",1,vaccination
1,"straight up get struck by lightning better.

*雷の呼吸 壱ノ型 霹靂 一閃*",0,vaccination
2,The guide to getting the COVID-19 vaccine out quickly and safely. #COVID19 #Vaccine #SupplyChain #HERE360 https://t.co/2hNFla7vgH,0,vaccination
3,Other countries sud learn from Singapore,0,vaccination
4,Catholic priest developing COVID-19 vaccine for the poor https://t.co/P5LTnJbotj,0,vaccination
5,"At a briefing last month, Dr Zheng Zhongwei, an official at China's National Health Commission, said no serious adverse reactions have been recorded in vaccines used in the emergency use programme. https://t.co/lFjOFGbYnX via @stcom #SmallBusinessOwner #CircuitBreaker",0,vaccination
6,Day 3 after my 1st dose of COVID-19 vaccine. No signs and symptoms of anything. 👍🏻,0,vaccination
7,Yes 🤩🤩🤩!!!,0,vaccination
8,"i mean its good that is singaporeans are gonna get the vaccine for free but wait a min, it’s not free in other countries for their own people??",0,vaccination
9,Israel sits on Moderna vaccines after signing Pfizer data accord https://t.co/qQugxuzLAE,0,vaccination
10,"Yep, while maybe it may not be mandatory next time I really hope people will continue to do so when they are ill, especially after seeing how important mask wearing is now",1,vaccination
11,“Phase 3 will be sustained until a vaccine or treatment is available” https://t.co/yEvUngrDNU,0,vaccination
12,Vaccine aid steps up with deliveries https://t.co/xxVw5qIeBP,0,vaccination
13,First Shipment of vaccine will arrive by end of December! Thank you Singapore! #SGUnited,0,vaccination
14,Why didn't they wear their mask?🤨,0,vaccination
15,Free to all singaporeans...,0,vaccination
16,Indonesian people : Jancok gratis cok😂,0,vaccination
17,I'm waiting for DA who have been shouting from the roof tops that by now we should have have 60 million will today complain about government having rushed to get the AstraZenaca vaccine before the trials for the new variant were completed...I'm waiting.,0,vaccination
18,"“There are still a lot of unknowns about the #vaccine, so just because somebody has doubts or questions does not mean they are an #antivaxxer”: https://t.co/7Ex04fwvLS @VitalsLH #COVID19vaccine #vaccines #COVID_19",1,vaccination
19,"(Its done we are almost done with covid, the overflow of vaccines will reach to other countries by may) Fauci says all Americans should be able to get a vaccine by April, Lance... https://t.co/meUlt5j2Vj",0,vaccination
20,"🇸🇬Singapore More than 52,000 transport workers have received first dose of COVID-19 vaccine https://t.co/iqijegzGf2",0,vaccination
21,Here comes the plane *reversed* *chomps*,0,vaccination
22,"Thank you for a well thought out and easy-to-understand comment. By any chance, do you have links for further reading?

Genuinely curious. I was on the fence before your comment, but you've managed to nudge me in the direction of thinking that the vaccine should be safe and harmless to me.",0,vaccination
23,">The longest mRNA in your body

Aha! That where you missed it. Your perspective of biology is constrained to the human DNA-centric conception of biology. Why must an RNA baby be constrained to the nucleic acid lengths of a DNA biological system. Why can’t we have RNA long enough to transcribe information for a multicellular organism?!

Your condescending attitude is exactly what Foucault describes in *the order of things*. Epistemic assumptions that governs and organises the masses. Open up a little, and you’ll find the world is not as small as it was. I’ll help you...",0,vaccination
24,@escavor Its still being developed. No vaccine yet.,0,vaccination
25,"Here is a very good article and explanation with visuals on how the vaccination development and approval deviates from the usual process. There is really no reason to doubt the vaccine or wait further.

I also don't really understand the mentality of many in Singapore that we don't need to vaccinate now because the situation is somewhat under control locally. Once other countries are vaccinated and begin a return to normality, we will be forced to keep our borders shut because our own population is vulnerable.

https://www.ema.europa.eu/en/human-regulatory/overview/public-health-threats/coronavirus-disease-covid-19/treatments-vaccines/covid-19-vaccines-development-evaluation-approval-monitoring",1,vaccination
26,China claimed what they had sent to Myanmar military last night were seafood. Seafood -1 Vaccine -0 #ChinaSetupFirewallforJunta #ChinahelpMilitaryCoupforOwnbenefit #WhatsHappeningInMyanmar #SaveMyammar https://t.co/9A0bEm4UhI,0,vaccination
27,Brilliant clear #COVID2019 storytelling suggesting a vaccine will be possible,0,vaccination
28,"@aklee_writes I don't think it's just the kids. &gt;.&lt; But many don't understand how *bad* it is. And for the vaccines, a faster rollout, protection for *all*.",0,vaccination
29,"Im going to guess that clinics will only stock 1 of the 3 brands of vaccine. So potentially, people can crowdsource information from people who have already gotten vaccinated on the clinics that are stocking their preferred brand?",1,vaccination
30,"This decline in DPU is due to the impacts of the #pandemic, and Manulife US #REIT is expecting that the vaccine roll out will hasten the economic recovery, return to work, and enable businesses to start making decisions on office leases. #reitasiapac : https://t.co/HBneO0GTk6",1,vaccination
31,Hi bbs if yall didnt know our newest episode is out now! Go give it a listen 💖 We talked about the @CyberpunkGame and also the new #Covid_19 vaccine 😥,0,vaccination
32,@giorgioluciano Thanks! I hope it also helps to people working on visuals on the vaccines,0,vaccination
33,then can go out freely alr?,0,vaccination
34,Fair enough. Would you be concerned about potential side effects?,0,vaccination
35,@MbalulaFikile J&amp;J baby oil vaccine 🤣,0,vaccination
36,Die to covid then,0,vaccination
37,"I think as long as they take before the general population does. The trust still can be earn. Right now they target groups with high risk for vaccine. Touch wood, if there is a hidden cluster, it will end up saving more lives in the future with the choices they made today.",1,vaccination
38,"Don’t you think it’s a little contradictory though? Doctors are allowed to have their own opinions on medical treatments. There isn’t a one size fits all approach. What you’re saying is that ALL doctors should encourage the taking of the vaccine. That’s not how ALL doctors feel though, especially for the first ever roll out of a mRNA vaccine on a global scale. 

You’re right that it’s an opinion. But they are entitled to have them based on their own medical knowledge.a",1,vaccination
39,The last leg of #vaccine delivery is perhaps the most important. Here’s how data can help governments make informed decisions on which groups to prioritise: https://t.co/k9GptwkWw4,0,vaccination
40,The Department of Health is not keen on making Covid-19 vaccination mandatory but it will intensify information efforts to stress the importance of vaccines. https://t.co/J9Yuzm69xk,0,vaccination
41,"Its very strange to me then when it comes to COVID, the people I know who are normally very well informed have their brains turn into mush.

I have had patients who were literally crying or throwing a tantrum at my clinic counter because the Gardasil 9 vaccine was out of stock and they couldn't get their shots. It is also relatively new compared to the other HPV Vaccinations available (more variants). Even when DengVaxia came out, there was a small rush to get it.

But when it comes to a vaccine deadly pandemic which has so much time and effort poured into it, no one wants it. I understand hesitancy but not outright ""we are lab rats"" nonsense.",1,vaccination
42,"It's ""unfortunately"" for me, which could easily suggest we're being told we'll just have to make do with expired vaccine ... Come April! ... https://t.co/cl5W4Zl6DV",0,vaccination
43,After all money were made from paper can't bring them along when we follow the Rainbows.🏂🏄 The Independent: Chinese billionaire Jack Ma to donate 100 million yuan to help find Wuhan coronavirus vaccine. https://t.co/s54t2s11eV via @GoogleNews,0,vaccination
44,"Covid 19 no long term side effects? On the contrary, the long term side effects are clear at a personal and country level. Even if you are young and at a lower personal risk, you could still cause asymptomatic spread to your family, colleagues, etc. 

Then there is the side effect on society and the economy. The pandemic continuing until 2022 or whoever enough people are infected or vaccinated to achieve herd immunity is going to prolong the economic pain. I wouldn't expect the government to keep the stimulus taps open for another 2-3 years. 

The concerns about ""long-term risk"" do not factor these big picture considerations. Its not only about your personal risk. To have a full understanding of long-term risk requires a long term study. So ultimately its a risk tradeoff. Do I accept an unknown long-term risk, but one which isn't significant to the best of our knowledge, or should I be kiasee and wait for others to do first, so that they can do their part towards singapore achieving herd immunity. Meanwhile, I hope others will take the risk, since if enough others take the risk, I can benefit without taking it myself. A few words to describe this come come mind: kiasee, anti-social, selfish.",1,vaccination
45,👍👏❤️,0,vaccination
46,Lol no fckg way. Not gonna be traced like a dog .....,0,vaccination
47,"The Perils of Vaccine Nationalism. With few countries accessing #vaccines, a longer #pandemic with more variants will increase health costs for #DM. The evidence on economic costs... Read more: https://t.co/KvYN09JVqr Or take a free trial: https://t.co/y3k44NjC91 #macroeconomics https://t.co/om29vqADyt",0,vaccination
48,Not sure why you’re being downvoted. It’s as if your life is for others to play with.,0,vaccination
49,A great way to finish off a challenging year! 💪😊,0,vaccination
50,In theory yes. But Murphy will always find his way.,0,vaccination
51,Wow,0,vaccination
52,"They say that life will NOT be the same after the #CircuitBreaker 🤔🤷 ☑️ Truth be told NOT until the vaccine is found! But what about work, jobs, business? ✅ It's probably be remain status quo. WFH, social… https://t.co/BnWojzFiDp",0,vaccination
53,Vaccine vs variant: Promising data in Israel's race to defeat pandemic https://t.co/Q7WUvrqHyE,0,vaccination
54,"WHO Regional Head Dr Matshidiso Moeti tells Christiane Amanpour that South Africa is undertaking further studies after it temporarily halted Astrazeneca vaccine, it's a good step, they were looking forward to seeing SA vaccinating since it's the most affected country in Africa.",0,vaccination
55,@dude_basu @sagarikaghose Maybe you should have atleast learnt to spell devices correctly in those 25 years of service. India is the vaccine factory of the world. There’s no reason why we cannot mass produce vaccines or for that matter develop our own vaccine.,0,vaccination
56,⚰️ @ first 100 ladies getting free vaccine shots,0,vaccination
57,"@aurmanARK Hi Ali. Do you also follow the supply side of the Genomic Revolution? One of the unique enzyme suppliers to many of $ARKG therapeutics and vaccine producers saw 1000% return last year, yet no analyst coverage. Would be great to discuss.",0,vaccination
58,Oh our Christmas present has arrived,0,vaccination
59,Many of us are trying to figure out how #COVID19 #vaccines work. I am sharing this piece from an old infographic of mine containing information how the #ImmuneSystem works in case it can help someone #science #sciart #scicomm #sarscov2 https://t.co/sTnd5wHexC,0,vaccination
60,"The early-stage #clinicaltrial for a #COVID19 #vaccine has started in #Singapore, with the first vaccinations expected to be given to volunteers next week. https://t.co/zdizZ9K3DT",0,vaccination
61,S Africa seeks new vaccine plan after halting AstraZeneca (from @AP) https://t.co/0DfGobQhIi,0,vaccination
62,"The weather is super duper hot today, perfect for lazing in Bali villa or Phuket resort.😜 But that can only be a dream till the vaccine for covid is in production. So I decide to detour to check out my estate. Been… https://t.co/jlaFy2ivry",0,vaccination
63,"> And there has been no evidence nor reasons to think that there are no side effects. Heard of asbestos? Fireproof material used for decades, until it was found it causes lung disease. And by the time people realized the link, millions of people had been exposed to it. Sometimes diseases and side effects can occur years down the line. 

Sure, I understand that. But I feel that these are risks we already take on a daily basis. It's simply not feasible to wait for years of testing before approving the usage of every single new technology. For every case of asbestos, how many other new technologies were rolled out to the public without years or testing and had no side-effects? Are you proposing that we conduct years of testing for every single new technology before implementation?

To be completely clear, I do understand the need to be cautious of new technology, especially those that are directly injected / consumed by humans. However I also do think that given the pandemic we're in, it makes sense to encourage vaccine adoption given that the phase 3 trial studies have concluded that it's safe for use. You might think that Singapore is currently under control, but in reality we are sacrificing a huge amount of resources and our economy to maintain this ""control"" without a vaccine. You might not personally feel it, but a significant part of the population does, and the fewer people get vaccinated, the more their lives will be negatively impacted as a result.",1,vaccination
64,"By talking about Bell’s palsy like it’s a mosquito bite, you are disregarding that it’s a neurological reaction. It’s literally damaged nerves... and we’re suppose to be okay with that why? By doing this you are hurting the wrong people AND protecting the wrong people. Joking about it like that & referencing our tendency as a nation to line up for things like hello kitty is an insult to our intelligence. I hope anyone reading this can see a hidden agenda underneath all this. wouldn’t be afraid of inflation at this point. Compliance is the new currency anyway 🥱",0,vaccination
65,Iran begins immunization campaign with freshly delivered Russian Sputnik V vaccine https://t.co/vjzsFhzWh2 #,0,vaccination
66,I was thinking will having multiple vaccines have an effect on the virus? Like more likely for COVID’ 19 to mutate?,0,vaccination
67,"This is not only common sense, but consonant with the @WHO SAGE values framework for COVID-19 allocation, particularly global equity: “ensure that vaccine allocation takes into account the special epidemic risks and needs of all countries"" https://t.co/1HQRl2gVpC 7/8",1,vaccination
68,@bonglez Listening to 702 right now..thier line for the whole day is to defend goverment on vaccine blunder...is nyc to be Ramaphosa..if it was blunder for RET we will never hear end of it.,0,vaccination
69,"Collect GST voucher / goody bag when you get vaccinated.

&#x200B;

Sure got queue.",0,vaccination
70,#Facebook Will Take Down Posts With Claims About #vaccines It Deems False https://t.co/OReuRI0JeX,0,vaccination
71,"China pressurised Nepal to accept its Covid-19 vaccine, leaked letter reveals https://t.co/WNro4yddwU",0,vaccination
72,"@Independent A vaccine passport serves no purpose what so ever other than bolster the dying aviation, travel and tourism industry, lest not forget peoples hopes of returning to a life past when we could travel freely.",1,vaccination
73,How come seafood from China Is more important than Covid Vaccine??? #ShameonyouChina #RejectMilitaryCoup #SaveMyanmar #HearTheVoiceOfMyammar https://t.co/QamwgK2CJa,0,vaccination
74,"I think you can reserve those high expectations for yourself and not the industry or you would get very jaded very fast.

Its not a bed of roses here. That is the harsh truth. Good luck.",0,vaccination
75,@MattHancock You are now able to volunteer your teenage children for the trials of the Oxford vaccine Mr Hancock.,0,vaccination
76,Think how many billions were dumped into the economy last year. Paying triple even for a vaccine costing $30 each is fuck all in comparison if we get our economy going quicker,0,vaccination
77,"I’m jealous of the UK, they get the vaccine first....",0,vaccination
78,"Believe it or not- in my country, seafood is more important than vaccine😂 https://t.co/WyRwxaEUUW",0,vaccination
79,"@CateFox The attitude will be ""i've had the jav, just shut up and get on with it."" But they won't actually stop and think about how we got here and actually that the freedoms they had are no more. No vaccine has ever been mandatory, and not having one has never stopped you....",0,vaccination
80,"Medical professionals does not equal to virology experts or vaccine experts. Doctors get their information from scientist and other experts. 

The data is as sufficient as possible because they tested on a larger group of people. The reason they cut short the testing is because it became a matter of ethics to let the control group not have the vaccine during this pandemic as the control group was slowly increasing with the amount of infected people. 

Other type of vaccines has small pool of data hence they took longer. 

Phase 1 of the vaccine was to prove that it is safe. Phase 2 is to prove that it is effective in protecting against the virus. Phase 3 is to see that the virus has no long term side effects. As it is an emergency phase 3 cannot be completed. But phase 1 proves that the vaccine is safe for use.

And even if the vaccine is bad for some people. The rule of thumb for such things is the good of the many outweighs the good of one. 

When the human raced eradicated smallpox it came at a price of some people having life-threatening reactions. So would you rather have a disease that is guaranteed to kill someone or would you rather have a vaccine that will be an inconvenience to most people.",1,vaccination
81,"Lol racist logic. 你认为我不是华人吗？I said ""our Chinese blood"".

> I am simply questioning you cherry-picking the sources and not offering the full picture.

Please provide the sources you claim exist.",0,vaccination
82,"-claims to talk facts

-raises Korea and Japan as good examples

L-fucking-mao",0,vaccination
83,"@Chriseldalewis personally i think the vaccine is overrated, china got 1179 active cases without these expensive vaccines....",1,vaccination
84,"Scientists say vaccines were so far effective against the variants in the UK, but that mutations could potentially undermine the shots. https://t.co/oKyd70V1v7",0,vaccination
85,"@Mamato_Marcello the earliest vaccine can be developed is within a year,it takes 4 phases to develop the vaccine,so its not gonna be anytime soon. Social distancing ,hygiene care,contact tracing,containment n mitigation are all we have and believe it or not it works.",1,vaccination
86,"What dafug. So, he’d be willing to die for the country’s economy? Fkg bullsheeet. He’d sacrifice one of his grandchildren for the vaccine if he had the chance.",0,vaccination
87,@jjjenpuraaa 우리 장기 체류자라서 무료로 맞을 수 있어 백신,0,vaccination
88,"Vaccine drive gains speed, but maskless fans fuel worries (from @AP) https://t.co/IpP0SnnJgp",0,vaccination
89,"#COVID19 Moeti says SA announced it would pause the rollout of Astrazeneca due to the strain, government says the vaccine will be used under trial condition, WHO recommended that Astrazeneca should be used for priority group and WHO will monitor the situation.",0,vaccination
90,"with a bio timer that wakes you up at 7am on the dot to sing March of the Volunteers. 
*QILAI, QILAIIIIIIII*",0,vaccination
91,❤️,0,vaccination
92,LHL is the real plug. free vaccine. 💯,0,vaccination
93,"When there is no system, people complain quoting developed countries. When there is a system, then again complaining. Even SG has a system to register and show willingness for the vaccine as its voluntary. #sosrilanka",0,vaccination
94,First shipment of COVID-19 vaccines arrives in Singapore https://t.co/PnBn0hLLp5,0,vaccination
95,"Don't worry, he is a blow hard who knows jack but acts like his is well informed on all matters.

Probably doesn't realize that often the matrix used to the determine the % rise in the efficacy of vaccine use is tied heavily to the number of individual tested. Before he goes out to spew shit, does he even know the number of individuals tested?

Percentages rise in too shot amounts of time? Must be rigged, fraud or marketing ploy (without examining context or understanding process) Sounds vaguely familiar some orange guy said.",0,vaccination
96,"But first what kind of doctor discourages vaccines? It's one thing to not encourage you to take the vaccine is another thing to go out of their way to ADVISE you not to take the vaccine until a later time. If this doctor advises you to not take the vaccine until 2022, i reckon they must be telling other people not to take the vaccine until 2022, which is detrimental to this vaccination process regardless of the timeline. Sorry to say your relative must be a pretty shit doctor.",0,vaccination
97,"Edward Jenner, pioneer of modern immunology introduced smallpox vaccine in 1796. Thanks to global effort, smallpox was declared globally eradicated in 1980 with the last known natural occuring case in 1977",0,vaccination
98,@lokeshanand that caption though 🤣🤣🤣🤣,0,vaccination
99,"Thanks for this. I hate it when people say we are being experimented on, are the tens of thousands of people in the TRIAL chopped liver?",0,vaccination
100,That vaccine is Ineffective in its current form maybe the boosters will help it,0,vaccination
101,Covid-19 Vaccine Hunt Heats Up https://t.co/sMVEftwnmZ,0,vaccination
102,"""I feel that (getting vaccinated) is our duty of care to the patients we serve."" - Mr Sim Tao Ming, #NUSMedicine Phase II Student. If you are feeling apprehensive about the #COVID19 #vaccine, let these student accounts encourage you to take the jab 💉 https://t.co/q65XR0JTna https://t.co/cRWbQtBjwd",0,vaccination
103,Let's not forget that a wealthy Mr #AstraZeneca AKA @CyrilRamaphosa asked for rotten expired left over vaccine for black South Africans. That's just our worth to him and his coronavirus advisory committee. #RamaphosaHatesBlackPeople https://t.co/SsgZur4tas,0,vaccination
104,"In short - act blur, live longer.",0,vaccination
105,"China has major buyers for its #COVID19 vaccines in SE Asia, though studies of its #Sinovac vaccine reported divergent efficacy results. Acceptance of Beijing’s vaccine may undermine #China’s image as a credible vaccine supplier, writes @UmairJamal15 https://t.co/ayPpY0FZVO https://t.co/FwEXRKXZ3z",0,vaccination
106,Maybe this vaccine comes from devil 😂😂😂 https://t.co/ll0TpSjv3V,0,vaccination
107,@PadmaFlorida Are you still Work from Home? And when are you eligible for the vaccine?,0,vaccination
108,People don't want to take Sinovac because of lack of transparency with the clinical results and the fact that China is a ball of corruption where some official might be bribed to swap the vaccine out for insulin shots and the actual vaccine to be sold on the black market for example.,1,vaccination
109,👏👏👏👏,0,vaccination
110,Vaccine to arrive late December and is free for Singapore locals and long-term pass holders. Thank you Singapore government.,0,vaccination
111,Why not just vaccinate our PM and the leadership team in our MMTF first? There is good rationale to do that because them getting infected may impact covid policy response time. Plus it boosts confidence in the vaccine.,1,vaccination
112,They ownself say ownself shiok. You believe?,0,vaccination
113,Finally the right approach. The kiasu factor. 😂,0,vaccination
114,Thats nice,0,vaccination
115,Affordable price like $99.99 able to use like up to 10 times?,0,vaccination
116,USA be like 👀👀👀,0,vaccination
117,wah goverment giving free airpods? so nice ah? oh wait nvm,0,vaccination
118,DD must show leadership and send that vaccine back,0,vaccination
119,@ahlibababas,0,vaccination
120,How come seafood from China is more important than covid vaccine? https://t.co/jhEbW52ewM,0,vaccination
121,Wewww,0,vaccination
122,It’s Time to Trust China’s and Russia’s Vaccines https://t.co/n5fnTwH42q,0,vaccination
123,How does AstraZeneca's COVID-19 vaccine compare with Pfizer-BioNTech? https://t.co/eue7tRyCGg,0,vaccination
124,Makati Mayor Abby Binay on Monday revealed that the city government has procured 42 biomedical refrigerators and laboratory freezers to ensure proper and safe storage of Covid-19 vaccines. https://t.co/5cN4mWeMmZ,0,vaccination
125,"Got shot of Pfizer-BioNTech COVID-19 Vaccine. So far, no side effects. Will take another shot 3week later.",0,vaccination
126,If we have a reaction and we rush back to the A&E to get treated. Is it free??,0,vaccination
127,Not good signs of Vaccines 👇,0,vaccination
128,Kenya says it will get first coronavirus vaccines this month https://t.co/O3o7W3Qo60,0,vaccination
129,"Dubai Covid Vaccine News: In Dubai's Covid vaccine scramble, Sikhs serve doses to all | World News - Times of India https://t.co/J5cvfy1atS",0,vaccination
