,Comment,Thoughtful?,Topic
279,"The real question is about the tissue trophism of the mrna vaccine itself. Because of the nano lipid particle used to encase the mrna itself, it is theorised that the vaccine may potentially be able to cross the blood brain barrier and enter into immunologically privileged sites. Where does the vaccine go? 

Not much study on that for now. 

And currently Pfizers phase 3 data was collected over a period of 2 months. Safety and efficacy cannot be established beyond that period of time but we generally assume it to be safe. 

If future doses are required to maintain immunity, will compounded doses result in a different safety profile? 

There is a reason why hcws may want to shy away from the mrna vaccine for now because they actually read medical journals and not pro vaccine messages from the mass media. 

Attenuated virus vaccines have been well studied. And we do know that the attenuated virus retains the trophism of the target virus (in this case, sars cov2). 

https://www.bmj.com/content/371/bmj.m4037/rapid-responses",1,vaccination
280,@mr_kurangcerah,0,vaccination
281,"Keeping silence: 

“Why government keep quiet never give direction?? What are they doing? Sleeping ah?”

I’m those that more pro government being open about their stand and direction. 

Yes there maybe hiccups or insensitive comments if come out straight (initial covid response, which on hindsight, not best approach. But based on situation and limited knowledge then, direction is still sensible)",0,vaccination
282,@DGHisham @Khairykj ... we are going to use the same vaccine? ie Pfizer.. https://t.co/B2QlEiw5Fb,0,vaccination
283,Is seafood more important than Covid vaccine? We don't need seafood. We want Democracy. Stop supporting Dictatorship @UN_News_Centre @POTUS @CNN #WhatIsHappeningInMyanmar #StopChinaIntervention #StopMilitaryDictatorship https://t.co/2DIuw9xSqu,0,vaccination
284,@drtlaleng We going to have to smuggle vaccines again for South Africans like we did arvs,0,vaccination
285,The nurse like: “knncb”,0,vaccination
286,Just what we need - an anti vaccine nutjob who will discourage millions from getting a vaccine. Should be slapped on the back of his head like the petulant little brat he is.,0,vaccination
287,😂😮😮,0,vaccination
288,"India -- India has rolled out nearly 23 million doses of Covid-19 vaccines to 20 countries around the world, both as grants and commercial supplies, and more will be sent to countries in Africa and Latin America in the coming weeks. https://t.co/xija3hDrvS",0,vaccination
289,Vaccines take at least 1.5 years to be made actually safe and functionable. Antibody test would in the meantime allow those who have developed immunity to continue life as per normal,0,vaccination
290,"It is just 13 days after military coups and we are losing democracy,our leaders,lives,houses,future.The military also took not only our vaccines for COVID but also our future.This is unacceptable. #WhatsHappeningInMyanmar #Feb13Coup",0,vaccination
291,🍌,0,vaccination
292,Still no gurantee they’re actually taking the shot instead of a salinr placebo.,0,vaccination
293,Right now there's only the Pfizer-BioNTech vaccine as the other 2 are not here yet. If you're worried about getting Sinovac then can go opt to get vaccinated earlier (when open to public). We don't have enough details how the process will be like when there are 3 vaccines ready in the market.,1,vaccination
294,Sen. Christopher Lawrence “Bong” Go has called on concerned government agencies to conduct an investigation and crackdown on groups selling or distributing fake coronavirus disease 2019 (Covid-19) vaccines. https://t.co/6akc4tiFmM,0,vaccination
295,"@shaike49 @1Obefiend I got a feeling they brought in some boxes of the vaccine in advance for the whole jemaah, all of them would have got their double shots by now,suddenly so daring to travel ...makes you go hmmmm.",0,vaccination
296,China doing so well suddenly and the rest of the world is suffering and we still have no vaccine is my whole life a lie...,0,vaccination
297,"Vaccine strategy needs rethink after resistant variants emerge, say scientists | Society | The Guardian https://t.co/whN4VgRU86",0,vaccination
298,"Not sure what that has anything to do with anything. As it stands, ministers will still vaccinate before the vast majority, and it's not like healthcare workers are likely to get the sinovac vaccine at all anyway unless it gets approved right away.",0,vaccination
299,"The vaccines are out because the pandemic is an emergency. That doesn’t mean it’s fully tested to safety. 

There’s a reason why certain groups of people are recommended to not take the vaccine.",1,vaccination
300,i hope they give it to the frontline workers and the foreign workers first tho,0,vaccination
301,👏👏👏,0,vaccination
302,Israel have the 11th man.,0,vaccination
303,Scary,0,vaccination
304,Opportunities for Artificial Intelligence–Enabled Social Media Analysis of Public Attitudes Toward Covid-19 Vaccines | Catalyst non-issue content https://t.co/YZrDnDRxYu,0,vaccination
305,"The point is that I am not the one going around calling people irresponsible for not taking Panadol, nor am I obligated to take it when I am unwell.",0,vaccination
306,Even Indonesia has rolled out the vaccine for foreigners there. What happen to Msia?,0,vaccination
307,Can't wait for anti-vac people in the states to riot abt this lol,0,vaccination
308,"@Michael_Yon Let the White, Highly Privileged and rich be the lab rats for this vaccine. It is time for them to place themselves in danger for the sake of the rest.................. 🤡",0,vaccination
309,"I took, many of my colleagues took. We all only experience soreness for 1 day to 1.5 days. No side effect.",0,vaccination
310,"This is positive and reassuring news as #Singapore kicks off #COVID19 vaccination, starting with the @Pfizer-@BioNTech_Group vaccine. https://t.co/QGQMF5nKwT",0,vaccination
311,"Peter Lim is ruining Valencia CF, a centenary club. He is negligent in his management and has no respect for the club's fans. It is the worst thing that has happened to the club in its 101 year history.",0,vaccination
312,"Health care worker

I am definitely not anti-vaxx, and indeed this virus pandemic is unprecedented (in terms of how it spreads and affects almost worldwide) and hence coming up with the vaccine and approving it for use in such a short time is also unprecedented.

The thing is the long-term effects of the vaccines are not known, and that is the risk that most are willing to take because people *want* to revert back to their lives pre-covid.",1,vaccination
313,"So now other than free vaccine do we need to give them citizenship, free housing and free car/motorcycle and free education? Prioritize our own citizens first, many are awaiting welfare, don't be a hypocrite.",0,vaccination
314,@claytonkays @chifarayi @NMusandu @denvern3 That should not impact on the vaccine efficacy. The reason the Astrazeneca vaccine is less effective is because there is a different mutation in the virus spreading in South Africa that reduces effectiveness but doesn’t mean it won’t work at all. Just less than in original trial.,1,vaccination
315,zombie😰😰😰,0,vaccination
316,"Military in #Burma isn’t a blessing to #Myanmar, but a CURSE! They’ve stolen fund raised by renowned NGO, public funds for landmark “ShweDagon Pagoda”. Misusing Covid vaccine fund &amp; getting cheaper one which we ain’t sure it really covers! #UNHumanRightsCouncil #JusticeForMyanmar https://t.co/Fi18s14P7D",0,vaccination
317,"Majority are excited on the vaccines. Meanwhile, Wokes are crying over gasoline 🙈😅",0,vaccination
318,Phase 3 after this please,0,vaccination
319,"Same can also be said for the inactivated virus vaccines. So why only look at mRNA vaccines and say it's not safe?

It's because these people just don't trust vaccines, period.",1,vaccination
320,i wantu cry idw the vaccination ccb,0,vaccination
321,"For Singapore, requiring a certificate of vaccination before travelling would be the best way to weed out anti-vaxxers. Nothing quite like being stuck on an island with no escape if you don’t vaccinate 🤣",0,vaccination
322,"This is correct. Tune in to Fox/Newsmax/OAN and you'll see a constant barrage of all the actionable parts of the Q mythos (election lies, vaccine conspiracies, Soros stuff, human trafficking panic) w/o the official Q brand. That's what's scary, not how many people say ""hail Q""",0,vaccination
323,"Because we need to open sg to the world. Economy is dying. Do your duty as a citizen, comrade!",0,vaccination
324,Cartoon dog pitches Covid-19 vaccines to sceptical Japanese public https://t.co/XbunPKgR4a,0,vaccination
325,South Korea seeks to reassure ageing residents after raising COVID-19 vaccine questions https://t.co/T8eBeVI3nE https://t.co/rOEJ8phPUs,0,vaccination
326,All migrants living in UK eligible for COVID-19 vaccine https://t.co/ze4vOSAQpU,0,vaccination
327,COVID vaccines donated by India for Myanmar civilians were robbed by Military. Does he look like he should be in Priority Groups to receive the vaccine? Million of Elderly and Vulnerable people still haven't received first doses of vaccines. #WhatsHappeningInMyanmar https://t.co/n3JFR5CztF,0,vaccination
328,Hmm good question. Don't think there's anything on it yet. Can't be easy missing your family. Hopefully there's enough to go around.,0,vaccination
329,"@CalgaryGrogu @erinotoole The vaccines are NOT even traditional vaccines... they are cheap GMO mRNA gene therapies that can possibly save your life near term, but then later you die of the common cold due to a cytokine storm (immunity over-response to the Betacoronavirus aka common cold)",0,vaccination
330,Testing is not vaccination which gives any kind of assurance. A person tested today can get the virus tomorrow?. Test How many times? You are talking about a country of 1.2 Billion. #Rahulspeaksmorethinksless,0,vaccination
331,@raphaelhozhiyi wan to scalp vaccine on carousell ma hahaha,0,vaccination
332,@CGChinaLiYang They are trying to keep the world market to their own big pharmas. How many people could die from covid-19 while waiting for the western vaccines is not their concern.,0,vaccination
333,I haven’t bought &amp; read an actual newspoaper for some time so I did just now.....so.... -Corona Virus affecting world economy - Russia possibly Invading Syria - Corona Virus vaccine by end of the year earliest - Malaysia struggles to bring power stability vis-a-vis Umno/PAS,0,vaccination
334,Give the vaccines to the dormitory workers first. They deserved all the hard work they did.,0,vaccination
335,"Happy to share a new publication in @AMJPublicHealth, ""Enhancing the WHO’s Proposed Framework for Distributing COVID-19 Vaccines Among Countries,"" Co-written with @ZekeEmanuel, Florencia Luna, KC Tan and @JoWolffBSG: https://t.co/U5uSY51Wf4 . Summary thread follows. 1/8",0,vaccination
336,If people think anyone is going to waste microchips on vaccines when there are shortages of this magnitude they’ve forgotten that companies don’t give away free expensive stuff if they don’t have to.,0,vaccination
337,"@BrettDwyer1 @Rod_Morri Thanks Brett, I’m aware of the 14 day Q in Oz but I wasn’t aware of the long term plan. Will that be in place after a vaccine is found?",0,vaccination
338,"Facebook to ban groups, accounts sharing false Covid-19 vaccine information https://t.co/BmHSSH2IuF",0,vaccination
339,"SIA stewardess, who received first vaccine dose, among 11 new cases https://t.co/oKIR2K1JTi",0,vaccination
340,@beingevil It’s this bizarre power play they think I’m interested in engaging in. Person: Donch wan vaccine Me: Fine. you need to be sure you want it; hopefully you’ll change your mind later Person: DONCH WAN VACCINE /mocking look (y u no beg me) Me: I don’t negotiate with terrorists 🔥 https://t.co/mRW5iz8eKO,0,vaccination
341,Thailand bets on Chinese shots to start vaccine roll-out by end-February https://t.co/sNfEyhIWBl,0,vaccination
342,What's sinovac,0,vaccination
343,"It's either a democratic cacophony (i.e. having to contend with multiple opinions on a same matter because not everyone see the world similarly) or a dictatorial groupthink (I'm thinking of West Taiwan).

Edit: I hope that in your determination to downvote and obliviate me from my dichotomous proffering, explain in your own words why you think we need to put in place ""standards"" to put people out of the privilege in making their own opinions, especially in this platform where it is open to anyone.",0,vaccination
344,Novavax Covid-19 Vaccine Shows Promise in Early Study https://t.co/rD6Gpv5sD5,0,vaccination
345,"Disappointed that some of our healthcare workers are against vaccines. How is this going to inspire confidence in the public?

Some of these healthcare workers are probably working in nursing homes with very vulnerable elderly.",0,vaccination
346,Well so will it be the case that I'll go to the polyclinic or wherever and have absolutely no idea which (if any) vaccine is being injected into me until AFTER it's done?,0,vaccination
347,"Does the world need new Covid vaccines? 'Jury is out', Oxford's Pollard says https://t.co/LMLECeDdKp",0,vaccination
348,"There are fundamental differences between mrna vaccines from moderna and Pfizer and inactivated virus ones from sinovac. Just because something is newer doesn't mean it's better. As with any new vaccine type there are bound to be unforseen issues. 

I'd choose the one with a good track record and unfortunately it doesn't exist.",1,vaccination
349,@HermanMashaba We all knew about a South African variant long before cyril ramaphosas announced that the vaccines landed. It wasn't anything knew but I guess the knews got delivered late to anc government,0,vaccination
350,Coronavirus: What I learnt in Oxford’s vaccine trial https://t.co/JYl3KYZ1BJ via @BBC_Future There is hope!,0,vaccination
351,"Serious question, do you have any source which says that the length of the human trials in phase 3 was shorter for the Covid vaccine compared to other vaccines, or at least shorter than usually required? 

Usually phase 3 takes longer, but a lot of what usually happens in phase 3 was done in phase 1 and 2 (funding, preparation, and even manufacturing of the vaccine), or done in parallel. My understanding is that certain non-essential steps in phase 1 to 3 were indeed skipped or changed (eg trial on animals), but not the critical ones, incl human trials.

https://www.fda.gov/vaccines-blood-biologics/vaccines/emergency-use-authorization-vaccines-explained

I hear a lot of people saying that they are somewhat concerned about the vaccination, but it is always based on a feeling, or because a friend's friend is a doctor or nurse and has adviced against it, etc.",1,vaccination
352,"Xiao Di. No one drug is perfect and causes no allergic reaction to anyone. Everyone's chemical make up is different, the trick for this pharma companies to increase the efficacy rates as best as they can. There are people who are allergic to paracetamol.

If I get an allergic reaction to Panadol, do I sue GSK?",1,vaccination
353,Awesome singapore ...keep it up ...m proud of u,0,vaccination
354,Engineer who had received first dose of Covid-19 vaccine among 2 community cases in S'pore https://t.co/T9gj48nvqH,0,vaccination
355,"Another engrossing long Q+A interview from Rebubblica, this time with UK vaccine supremo Kate Bingham. Why does it take an Italian newspaper to make this format work? So easy, and yet so much more intellectually satisfying simply to run a transcript. https://t.co/8BFDUpCEmB",0,vaccination
356,"@tijanishere Communist China pun share the genome sequence with the world to create the vaccine, weirdos I tell you.",0,vaccination
357,"But believe this is the first time it had been deployed as a public vaccine roll out? And like ppl say, no matter how health agency has ensured that the process has been shorter due to cut in beuracacy, there is no way there is concrete report study on long term effects, given the virus is only on radar 1 year+ only",1,vaccination
358,Haha.. Understandable,0,vaccination
359,COVID vaccines donated by India and Myanmar people for Myanmar civilians were robbed by Military and look what they do with them now. Million of Elderly and Vulnerable people still haven't received first doses of vaccines yet. #whatshappeningnowinmyanmar #whatshappeninmyanmar https://t.co/TyyZHk47FK,0,vaccination
360,"Plenty of Black people want the Covid-19 vaccine but cannot get access to it, and a lack of available vaccines hasn’t stopped the internet and Fox News from stoking distrust, @youngsinick writes in @levelmag. https://t.co/0dMper0Szm",0,vaccination
361,I'm surprised Singapore isn't leading the way to get everyone vaccinated ASAP. Similar to the Israel speed of things.,0,vaccination
362,"European Union chief Ursula von der Leyen on Wednesday (Sept 16) warned against ""vaccine nationalism"" that she said could put lives at risk by depriving the most vulnerable in poorer nations of immunity. https://t.co/iMr0J646hk via @stcom #COVID19 #Pandemic",0,vaccination
363,"Couldn't we strive have a middle ground where there is some sort of minimal (intellectual or critical thinking) standard that one must reach before being allowed to join the ""democratic cacophony"".

I know this is idealistic and difficult to implement, but at least it's something to strive towards rather than resigning to one extreme or the other.",0,vaccination
364,"I accept your arguments regarding the statistical strength of the study. However, if you look at the number of Asians whom the dose was administered to, it's only 5% of the 41,135 apparently. And this is what I referred to when I mentioned a small sample size for the Asian subset.",1,vaccination
365,"Feels like there are some gaps with the understanding of what vaccines are and how side effect works while taking chemical drugs.

Vaccines are different from taking chemical drugs. For one vaccines are a 1-2 time occasion (the risk of long term effects are minimal), chemical drugs that cause long term damage to your body also don't cause that much damage on a short term dosage, it usually damages your body because of frequent use. Also, vaccines are essentially inactivated viruses that activate the antibodies in your bodies to fight against the virus. The bigger worry is not long term side effects but short term side effects.",1,vaccination
366,👏,0,vaccination
367,"Dun understand the Govt obsession w this clown. He was the one who said not so serious, no need to wear mask at the start of the pandemic.. asspert indeed",0,vaccination
368,"Making markets and providing liquidity in this crisis is a once in a lifetime education. After this anything is a calm market. From a human perspective though, this is the biggest crisis in my life time and I hope a vaccine is developed soon. World can't take anymore.",0,vaccination
369,﷽,0,vaccination
370,Early Vaccines May Not Prevent Infection https://t.co/APtu2Wa2R6,0,vaccination
371,"No offence lah, life’s too short!",0,vaccination
372,@metallica can make concert in sg already HAHA,0,vaccination
373,The Chinese pharmaceutical firm Sinovac Biotech Ltd. will be the first to ship a coronavirus disease 2019 (Covid-19) vaccine to the Philippines. https://t.co/f7rp8jnyqY,0,vaccination
374,(#Israel) #COVID19 #Vaccine Rollout exceeds 62.87% of population (highest in the world). While new deaths continue to fall; fall in new #COVID cases stagnated. https://t.co/Lc0wEPElFJ https://t.co/XeXLXrDWBD,0,vaccination
375,Pls pls let this vaccine be successful so tat we can all go back to the good old days.. No more masks wearing.. And we can all see our loved ones' smile.. 😊💕,0,vaccination
376,@CourtneyLee_33 @ChrisWickNews then probably best give them the vaccine so they stop spreading it. The sooner we stop being so bloody minded and partisan about things the sooner we might all come together,0,vaccination
377,never knew a plane could open that way 😳,0,vaccination
378,"There will be no public plans on finely delineated phases of distribution.

HCWs will be highly encouraged but not compulsory to take the vaccine, and it will be voluntary in long term care homes. 

The politician influencers like Ho Ching, GCT, Mdm President and first husband, will take it and announce I MSM. Ho Ching may shoot a video of her taking it. 

Then it will be opt-in, free for Pioneer, then Merdeka, and at cost including distribution, or a slight markup, for those of that age group. There will be no further prioritising of age group other than pioneer.

After the Merdeka stop queuing up, the mark-up for the jab(s) will be the same as voluntary covid tests, for the ""worried well"". 

Perhaps family of pioneers who got the jab(s), especially those who share rooms with them, may be next.",0,vaccination
379,From weed to vaccines,0,vaccination
380,@CateFox Not talking about lockdown. Talking about the vaccine certificates to be able to go supermarket.,0,vaccination
381,Even if this vaccine was fine the expiry date is just too close,0,vaccination
382,COVID vaccines donated by India for Myanmar civilians were robbed by Military Does he look like he should be in Priority Groups to receive the vaccine? Million of Elderly persons and vulnerable people still haven't received first doses of vaccines yet. #WhatsHappeningInMyanmar https://t.co/cPRsIxdr1e,0,vaccination
383,Yet more garbage comments from someone making claims they cannot back up,0,vaccination
384,Theirs gonna be side effect :/ YA SISS IM GOING TO THE NORTH POLE SEE YA-,0,vaccination
385,"He shouldnt be the first person, but he can be among the first stage recepients of the vaccine. It should be healthcare and all hospital staffs first, old people, and then baru cabinet and parliament members.",0,vaccination
386,"‘media and social media courts’ are out strongly against the french #BCG vaccine discussion. Noted the angst and I wouldn’t take it lightly. I first saw the France 24 Camille Locht interview m heard about volunteers and testing in #France, #Europe and #Australia.",0,vaccination
387,Engineer who received first dose of vaccine among 2 community cases https://t.co/OvwS9kRTwx,0,vaccination
388,@thisisayle We really need vaccines. But 20 months sobrang tagal nun...,0,vaccination
389,"Though not peer reviewed, if this study is picked up by sporting bodies you will not see any contact sport, athletics or cycling until there is a vaccine. The risks are just too great. For those just wishing to exercise it's probably best done in isolation. #CoVid #exercise",0,vaccination
390,I’m having my Covid vaccine tmr!,0,vaccination
391,"Fun fact, vaccines have all gone through the exact process they would normally go through.",0,vaccination
392,No time wasted come on,0,vaccination
393,Lol they said TT was not mandatory. You honestly think the govt would give Singaporeans the choice ?,0,vaccination
394,"@walashah Don’t stress hahahah. Just make sure you catproof your house, get a litter box and get cat food. The cat food you have to keep trying till you get it right 😆. And yes get your cat checked regularly at the vet + vaccines 👌🏼",0,vaccination
395,So mum should get her vaccine in Feb,0,vaccination
396,AI Enabled System Can Design New COVID Vaccine Target Sites in Minutes https://t.co/9HEaH30l9f https://t.co/gx2n1X3T8K,0,vaccination
397,Had this incredibly dark bizzare thought while jogging home. What if unbeknownst to us the vaccine has some long term side effect (say cancer 5 years down). Will there be some kind of mass extinction??? Is this how the world ends 😭😭😭,0,vaccination
398,UK's Johnson to host virtual G7 meeting to push for global vaccine roll-out https://t.co/fKg1IxlJUF #singapore #jobs,0,vaccination
399,S Africa seeks new vaccine plan after halting AstraZeneca (from @AP) https://t.co/0DfGobQhIi,0,vaccination
400,"When it comes to healthcare, especially a contagious virus, there shouldn’t be priorities or privileges. if the virus gets out of control, giving priorities won’t help.",0,vaccination
401,">So why would I rush to waste a few hours of my life at a polyclinic?

To reduce the probability of long-term effects from covid. [Even young and healthy](https://www.who.int/docs/default-source/coronaviruse/risk-comms-updates/update-36-long-term-symptoms.pdf?sfvrsn=5d3789a6_2) people have ended up with pretty serious long-term health effects from covid, even if it didn't affect them too much during the illness phase.",0,vaccination
402,"@doug_auclair That’s crazy, the #WHO just released the vaccine and it’s actually thermaflu 🤷‍♂️",0,vaccination
403,"From @WSJ “medical experts say it doesn’t detail how cold-storage for some #vaccines should be handled,” There has been discussion about what is not happening and where the issues are... let’s start a conversation about the solution. The infographic https://t.co/yxteX6RZxy https://t.co/26rApJjQeg",0,vaccination
404,"Sure what is the problem with the examples? To be fair, Japan and Korea, in terms of infections, are lower than the infections in other countries, at least in Asia. I fail to see where is the self-evident context here that would make it ridiculous to use them as an example.

Genuinely interested, this is not a smarty-ass pompous attempt to snarkily snide at the comment.",0,vaccination
405,"well of course, if anyone knew how how it'll cost to store these vaccines.",0,vaccination
406,👏👏👏,0,vaccination
407,CDC: people who have received two Covid-19 vaccine doses can skip quarantine https://t.co/IuT3QKfPDj https://t.co/sM4qw7yDg7,0,vaccination
408,@faizulazhar_ @aminoacid1798 @qayyum_mcfly @md_shafie @fiqfiqfiq macam kenal abang ni,0,vaccination
409,Yesss!!! Congrats! Let’s hope it’s the COVID19 vaccine next! 🙌,0,vaccination
