,Comment,Thoughtful?,Topic
130,"first buy, first obtainment i presume?",0,vaccination
131,From @WHO * It's safe to receive package from China * no evidence you can get it from your pets (but protect yourself still from bacteria) * Flu Vaccines do not provide protection as nCov needs a vaccine on its own * saline rinse has no significant effect Stay healthy #2019nCoV https://t.co/eylACWv1f4,0,vaccination
132,Coca-Cola expects sales growth as COVID-19 vaccines set to allow venues to reopen https://t.co/EHvPkrZVgi https://t.co/3XdVWkWtbS,0,vaccination
133,Ngl the packaging looks like maggi mee when I first looked at it,0,vaccination
134,Japan's Bitter Vaccine History https://t.co/t5JC0vIBSH,0,vaccination
135,Way to go,0,vaccination
136,"@florian_krammer “All 42 endpoint cases were graded either as mild (vaccinees=15; placebo=17) or moderate (vaccinees=4; placebo=6) with no cases of severe disease or hospitalisation in either arm.” However you spin the analysis, doesn’t this just say the vaccine doesn’t work? What am I missing?",1,vaccination
137,"Vaccine developed in less than a year against this deadly virus is definitely a proud moment of all us, please keep politics away from this. 🇮🇳 #ProudOfIndiaVaccine #COVID19 #Politics #PoliticsOverVaccine @republic @BharatBiotech @DBTIndia",0,vaccination
138,@elqy__,0,vaccination
139,"After meddling in our affairs using Khalistanis, Trudeau finally falls in line &amp; calls PM Modi seeking vaccines. Chalo https://t.co/mmj6tuKsHB",0,vaccination
140,"Doctors don’t actually do everything that is available. For example, doctors I know have told me they would never do lasik even though it’s supposedly safe.",0,vaccination
141,"yes. but the long term side effects of the vaccine is a real factor. and you need to take more than 1 dose. i personally wouldn't recommend taking the vaccine in its current rendition until a year or two later.

bear in mind this vaccine is rushed out.",1,vaccination
142,*salute* hopefully you won't have to wait too long,0,vaccination
143,Disappointment’ as experts confirm Covid vaccine that arrived in SA not effective against mild infection,0,vaccination
144,Finally,0,vaccination
145,@bhogleharsha Karona ball vaccine has been misspelt to karo noball vaccine,0,vaccination
146,Singapore will be Asia’s distribution hub for various vaccines.,0,vaccination
147,It might be the media or wtv but looking at it they are dealing with the problem with such effeciency. Or maybe its the style of governing. The real question is do china actually have a vaccine or information on how to actually cure this virus.,0,vaccination
148,Bo tah bo lampa,0,vaccination
149,So you're in the latter group?,0,vaccination
150,Thailand to administer 10 million COVID-19 vaccine shots monthly from June https://t.co/M5llxtW5FV https://t.co/6Ly8UcwuHc,0,vaccination
151,But we got people that are fear mongering (without any evidence) and peddling 'wait and see' narratives. What if this become common consensus?,1,vaccination
152,"💉 ICYMI: The first delivery of AstraZeneca’s #Covid19 vaccines arrived in Italy on Saturday which included more than 240,000 doses https://t.co/Tl0rAXXEeK @Quicktake",0,vaccination
153,We are participating in the largest global IQ test ever conducted. The cost to getting it wrong is becoming clear and it isn't pretty. Experimental DNA altering vaccines for a virus no worse than a bad seasonal flu.,0,vaccination
154,"This article was written back in November 17th when the effectiveness of the vaccines were not published yet, so of course it wasn't clear that it was effective then.

\> BUT MICHAL LINIAL, a professor of biological chemistry at the Hebrew University of Jerusalem, told the Post that she believes there is no cause for concern. 

\> As such, she said the worry should not be that the mRNA won’t get into the cells and instead will stay outside, floating in the body and causing some kind of reaction. Rather the concern should be that if it doesn’t enter the cells, it will disintegrate and therefore be ineffective.

The article also mentioned the above. Please try not to be alarmist when there has been no evidence nor reasons to think that there are side effects to this vaccine.",1,vaccination
155,"@hrnext Singapore won't allow you in. The US might be your best shot. I'm sure we'll see plenty of politics around vaccines. ""My vaccine works, yours doesn't"", ""We won't share vaccines""...",0,vaccination
156,"my side effects after taking second vaccination: giddyness, abdominal pain and diarrhea. while most of them who already took the vaccine had fever and shivers. mine is so weird sak",0,vaccination
157,Snopes fact check: Can You Buy COVID-19 Vaccines on the Dark Web? https://t.co/zI2BGYnW1U,0,vaccination
158,long term residents..uhhmm are the foreign workers included?,0,vaccination
159,@SibandaSibbs I haven’t heard official statement from @MCAZofficial but assume this is vaccine batch release testing. It is routine for reg agency to test quality of vaccines received to ensure they meet lab specifications in and consistent manufacturing batch to batch https://t.co/imCgnBglz4,0,vaccination
160,How much is EFF paid to promote the Vaccine 😂😂,0,vaccination
161,I mean you’re kinda equating personal convenience to actual safety concerns. People are allowed to value their safety over other things too.,1,vaccination
162,Ask bibi 🕎,0,vaccination
163,so if they can’t pay your just gonna let them die?,0,vaccination
164,"PH isn't alone in the military embarking on PR drives to get popular support for arms buys. Thailand did it for subs. Only problem now is COVID-19 makes for bad optics when govt is expected to spend more on health, social aid and vaccines not weapons. https://t.co/6BpdjRGuqA",0,vaccination
165,Japan Covid-19 vaccine czar Taro Kono outshines PM Suga to rise as potential successor https://t.co/svBhAQ8E3W,0,vaccination
166,Not going to take that vaccine,0,vaccination
167,"People no money to pay loans, businesses no money to pay workers, Parents no money for their kids&amp;food, Cases show no sign of stopping, Delayed vaccine. But minister priority is here. Lol https://t.co/vusORglfj2",0,vaccination
168,@jerricklim @clauds Actually some older folks doubt the ang moh vaccine. But they totally ok if you give them the China version. Thanks to all the China propaganda they been consuming online.,0,vaccination
169,"Myanmar Junta postponed Covid Vaccine flights from India. But why did they allow flights from Kuming, China? What did Kunming Flights bring for Junta? Is China supporting Military Coup? @UN_News_Centre @POTUS #WhatIsHappeningInMyanmar #StopMilitaryDictatorshipSupportByChina https://t.co/y5ypoomLVt",0,vaccination
170,Its at least 41 vials,0,vaccination
171,Moderna has outlined plans for phase 3 clinical trials for its Covid-19 vaccine. $MRNA @MadMoneyOnCNBC @jimcramer any suggestions? Thanks,0,vaccination
172,Prince Charles and Camilla get Covid vaccine https://t.co/uNiaeCdWma via @BBCNews,0,vaccination
173,"If you think a human cell, much less a human baby, can exist with RNA as its genetic material, I'm sorry to say you have no fucking idea what you're talking about.

It's completely fine to not understand any of it. But you look like a dumbass if you pretend that you do.",0,vaccination
174,VACCINES! Will they be mandatory? See Why Robert F. Kennedy Jr. Just SUED major media. REGISTER TO WATCH FOR FREE HERE https://t.co/ZQ2tVs00jO via @UpVir.al,0,vaccination
175,i lwkey afraid of needles so i go last,0,vaccination
176,Are you unable to read? It says above 50%,0,vaccination
177,The key issue isn't the vaccine expiry date but the efficacy of the vaccine itself. 22% it’s lower than our pass mark https://t.co/osb8sgMh1J,0,vaccination
178,Yey! vaccine finally come😁😁😁😁,0,vaccination
179,"Finally, the vaccines are ready, and we all need to be too. Find out how #ServiceNow can help orchestrate vaccine management ⬇️ https://t.co/33jMqpnIOH",0,vaccination
180,Pls no sinovac 😭,0,vaccination
181,Vaccines may allow international travel. But will travel ever return to normal? https://t.co/CUJMVOG6py,0,vaccination
182,@TheStalwart you see what happening. there r no permanent antibodies means no vaccines and there r new sub species emerging that can be carriers but virus is harmless to them. it’s a beautiful work of nature called evolution. humans have to evolve in covid-humans,0,vaccination
183,What's d update on d nurses who got the vaccine? R they feeling OK? #COVID19Vic #Singapore,0,vaccination
184,"So Australia's response to these vaccines is dangerous then. Because waiting 3 months for more data to come in regarding these vaccines is more harmful to the world and them.

So you're implying that we should override basic ethical concerns for ""the security of the masses"" then?",0,vaccination
185,Having an open vaccine vial about to expire is like having an open seat on a lifeboat as your ship is sinking. Dr. Gokal is being persecuted for not kicking people into the sea.,0,vaccination
186,"@erinotoole 99.97% of Canada lived for the past year. Vaccines are oncology (cancer) gene therapy (if u can even call mRNA a vaccine, its EXPERIMENTAL, so you're a 2 year science experiment) BTW: SARS CoV-1 ferrets in 2003 were OK after 2 doses but later died of the common cold (Coronavirus)",0,vaccination
187,"A smarter conspiracy theorist would say we're the second wave of lab rats.

Still, it's going to take a while for manufacturing to ramp up production AND we don't know any long-term effects.",0,vaccination
188,or you will see it in a year or two. maybe five?,0,vaccination
189,"Erm, when did i say you deserved to be called irresponsible and not instilling confidence in public?

If you decide not to take the vaccine, that is your choice. Your body your choice. You have a duty to not influence the public with your fears. There is a difference, please see the difference.",0,vaccination
190,👏👏,0,vaccination
191,Its not even proven these vaccines prevent the spread of COVID. Its just for self protection,0,vaccination
192,Facebook says it will take down false vaccine claims https://t.co/87Te7pJJnx https://t.co/VDLdI2ZbL4,0,vaccination
193,India seeks to rival China with broad shipments of COVID-19 vaccine https://t.co/wWyKLQ2tbX,0,vaccination
194,👍❤️🇸🇬🙏,0,vaccination
195,@newscientist How long will it be if we all wait the vaccines be ready to roll out enough to cover world population?,0,vaccination
196,"Reading between the lines, Singapore's vaccination rate has been 10k a day for the past month. Not accelerating. Likely vaccine supply constraints, https://t.co/KZb1UDY7uw",0,vaccination
197,Check our latest map visualizing governments' common policy responses to the COVID-19 pandemic - from vaccination protocols and school closures to travel restrictions. Let me know what you think! #Map #COVID19 #Vaccine https://t.co/txOCziUoG0,0,vaccination
198,"Well done, SG govt ❤️",0,vaccination
199,You can’t spin the facts and blame it on fake news. The vaccine is not ready as yet that’s a fact,0,vaccination
200,That’s only 2% of the population...,0,vaccination
201,COVID vaccines donated by India for Myanmar civilians were robbed by Military and look what they do with them now. Million of Elderly and Vulnerable people still haven't received first doses of vaccines yet. #COVID19Vaccine #TheVoiceOfMyanmar #WhatsHappeningInMyanmar https://t.co/iqXUMawBYf,0,vaccination
202,tf obviously right,0,vaccination
203,"Phase 3 will start on 28th December 2020: social gatherings up to 8 people. First shipment of vaccines by the end of December. Free vaccine for Singaporeans, PRs, and Long Term Pass holders (foreign employees residing in Singapore) https://t.co/J9rO9AD1i3",0,vaccination
204,I’ve gotten my first dose of the COVID-19 vaccine! 💉 https://t.co/PSDpIHlUIX,0,vaccination
205,"I think if you go down this route, you'll be killing any and all investment in future vaccine research. Past profits at Pharma companies have funded all the research that has brought is the vaccine in record time. Not a good idea.",0,vaccination
206,"The coronavirus variant first found in the British region of Kent is a concern because it could undermine the protection given by vaccines against developing COVID-19, the head of the UK’s genetic surveillance programme said. https://t.co/VP5sVAPDX7",1,vaccination
207,The Transparency from the Minister of Health is top class 👌🏿👌🏿 those that are going to be taking the vaccine you will be fine and for me I will be supporting you taking it,0,vaccination
208,"Just going by logical reasoning here but:

Moderna and Pfizer Vaccines require -20 and -70 degree storage temperatures which need a lot of specialised equipment that only larger institutions have. 

Sinovac can be stored at 2-8 degrees Celsius, so it requires presumably less infrastructure, something that your neighbourhood GP would already have.

So going by reasoning: It would be more practical for GPs to stock SinoVac's CoronaVac, cos of the reduced likelihood of Vaccines going bad and not needing new equipment. Polyclinics and Hospitals with higher grade storage facilities would get the Moderna and Pfizer ones just because they don't need as much new infrastructure.",1,vaccination
209,"Even after vaccinated, I think I would continue wearing mask in a crowded place. I have heard that clinics see less cases of people with flu, sore throat, cough sickness. Some of their medicine have expired due to unforeseen Covid-19.",0,vaccination
210,Celebrating Valentine’s with vaccine dose 2 because why not 💁🏻‍♀️,0,vaccination
211,"‘It’s about effectiveness &amp; availability, not geopolitics’: Austria’s Kurz will take Sputnik V or Chinese vaccine if approved https://t.co/I7I95tVLOB #",0,vaccination
212,Thoughts about the vaccine campaign guys#vaccine,0,vaccination
213,US’s Fauci: https://t.co/cwtgf9URpD Variant Little More Problematic Can Develop New Vaccine Boosters For Variants If Needed @LiveSquawk,0,vaccination
214,@nonopi.vrc,0,vaccination
215,"@KenQuin I can imagine, must be so tough. Here restaurants have been open for a while, but no bars or clubs. Reservations are hard to come by, everyone is eating out! When will you get your vaccine?",0,vaccination
216,"@buhakmeh US did have a trade agreement with Wakanda, realised it was a mistake and removed her. Guess the vaccine never reach US now... https://t.co/anFcffd1ZT",0,vaccination
217,Hi @straits_times,0,vaccination
218,"What the! Sinovac! China’s way of apologising their initial cover-up propaganda of this Wuhan coronavirus huh!! Doesn’t work for the world now that 84.8 million cases/people have been found to be infected and 1.86 million deaths have been recorded! Too late man China,it is too late to apologise! Like that @onerepublic song from 2007",0,vaccination
219,Prof Paul Tambyah addresses public concerns on COVID-19 vaccines in his latest Facebook live session https://t.co/LiFAoBL5si,0,vaccination
220,"I may not have had a formal education, but I daresay that my education has been broader and denser then any of you simpletons. Pro tip: the university of utube provides way more education than the national university of sex, or sex molest university, or national Tiong university

Source to back up what I wrote: https://www.ncbi.nlm.nih.gov/books/NBK26876/

Just sharing my humble knowledge to the world",0,vaccination
221,That's no vaccine. That latest medical report is damning enough to cast doubt on its efficacy as a vaccine.,0,vaccination
222,Your options are 1. Take a vaccine that is probably 99% safe but without liability TODAY 2. Take a vaccine that is probably 99.99% and with liabilities 5 YEARS LATER. I leave the choice to your wisdom ....,0,vaccination
223,@ivy.ang.9619,0,vaccination
224,#Malaysian oncologist in US shares experience of getting #COVID19 vaccine. https://t.co/iYUUYdnL51,0,vaccination
225,@dan_graeber Vaccine is the biggest game changer since Covid. The biggest stimulus too. It's curious that it's being welcomed like a cure... the months needed to achieve herd immunity have ceased to matter for the mkts. Perhaps that's what distress fatigue does to you.,0,vaccination
226,Human Challenge Studies to Accelerate Coronavirus Vaccine Licensure https://t.co/x6Mq9fYAR6,0,vaccination
227,Coming Soon: The ‘Vaccine Passport’ https://t.co/8wOpSbvXwr,0,vaccination
228,Pakistan lab expects Sputnik V vaccine for commercial sale in a week https://t.co/v7XHcQaSHT,0,vaccination
229,Modi assures Canada that India will strive to meet its COVID-19 vaccine needs https://t.co/rbDnjfaANp https://t.co/smWT6pMokA,0,vaccination
230,I think that's just simply not possible because of human nature. People are bastards.,0,vaccination
231,Prof Moshabela shares very important information about the vaccine that it’s not that useless and can be useful,0,vaccination
232,A,0,vaccination
233,[removed],0,vaccination
234,"I see. Yeah they've already announced a while back. Think was qantas. And what with the roll out of tt tokens, I'm expecting ppl to produce certificates of vaccinations to be able to access certain places.",0,vaccination
235,"@joncoopertweets I think we’ll find out. In other news, Saudi Arabia receives mysterious shipment of enough COVID vaccines to vaccinate everyone in Saudi 4 times.",0,vaccination
236,another blood test and another vaccine,0,vaccination
237,"I mean that’s a pretty extreme position to take considering we are in p3 without a vaccine. 

We can’t cherry pick the Singapore circumstances, which has a really low death rate, and then extrapolate that not taking the vaccine means death.",1,vaccination
238,"But everyone wont follow suit? That’s my point. Those who are at higher risk or less concerned about possible side effects, will take it first. They’re aware of the arguments being made and will proceed anyway because for them the risk is outweighed by the benefit. As that group gets it and no effects are noted, the rest will eventually follow suit.

The elderly in my family dead alr, and given the numbers nowadays it’s hardly much of a risk",1,vaccination
239,From the lab to the jab: how BioNTech-Pfizer won the vaccine race https://t.co/5I6xwKYiGe,0,vaccination
240,Well it was a an educated gamble if you want to get in the front of the queue. If you wanted the results first before buying then Singapore would probably be last few in line,1,vaccination
241,Follow @HeidiGiokos for concise updates from the department of health and command council presentation regarding the Covid 19 vaccine relating to SA #CovidVaccine #COVID19SA,0,vaccination
242,The big news this week: President Joe Biden has now secured enough vaccine doses to vaccinate all Americans. But there's more. @yeahyeahyasmin gathers the most important Covid-19 vaccine news from this week: https://t.co/7yefHxRdSs,0,vaccination
243,"@alexmaccaroon On what basis do you believe they will experience ""serious waves of death"" if they have vaccinated their population? Whilst I disagree with lockdowns generally and was highly critical of NZ before vaccines were developed, I don't see how their gamble hasn't paid off.",1,vaccination
244,"The next several months will be a period of great inequality. Frontline service workers will struggle on without a vaccination, while the rich move right to the front of the queue. I’m sure many have already had their vaccinations, regardless of age or health. Makes me sick.",1,vaccination
245,Safety and Immunogenicity of an AS03 B -Adjuvanted Inactivated Tetravalent Dengue Virus Vaccine Administered on Varying Schedules to Healthy U.S. Adults: A Phase 1/2 Randomized Study https://t.co/oDU7wNKTF9,0,vaccination
246,I saw a bunch of them come out of the police can. Is that necessary or are they just from the police,0,vaccination
247,PepsiCo expects revenue to grow in 2021 as vaccines take effect https://t.co/44Cl4GJDBq https://t.co/igI7alYkIp,0,vaccination
248,Day 2 after my 1st dose of COVID vaccine. My arm is no longer aching but I can feel the bump where the vaccination was given.,0,vaccination
249,"Yes agreed. Not just that — initial quantities will be limited so healthcare and 'frontline' workers should be prioritized, along with vulnerable populations like the elderly and immunocompromised.",1,vaccination
250,becarefull anything come free....... in this world nothing is free 😝,0,vaccination
251,"People who tell me that they still want to “consider all the data” before taking the COVID vaccine, get surprised that I refuse to BEG them to take the vaccine, and then repeat that no they won’t take the vaccine etc because they want to see me beg (so they can say no again!)... https://t.co/IAwdir14Wo",0,vaccination
252,am i the only one who doesnt want the covid vaccine? hahahah,0,vaccination
253,@chifarayi @claytonkays @NMusandu @denvern3 The variant identified in SA is now the dominant strain there. The expiry date is not a huge issue. The 6 month date was because companies only had 6 months of data at the time of regulatory approval. As we get more data on the stability of the vaccine this date can be extended.,1,vaccination
254,Global health officials back AstraZeneca vaccine after South Africa study rings alarm https://t.co/9y4Ie3G9ZX https://t.co/mbmms9SLxa,0,vaccination
255,@ChrisExcel102 @AdvoBarryRoux The vaccine isn't effective on mild to moderate symptoms of the new strand of Covid-19 found in SA. It expires in April also. https://t.co/wrVgUSCvMO,0,vaccination
256,"@gmanews Naadvisan po cguro yan ng mga advisers nya re mga news of deaths sa ibang bansa after vaccine for older people na may existing conditions, correct me if im wrong, maybe they are still waiting for the results if its vaccine related deaths before they can say pres will do 1st, imho",0,vaccination
257,Agree!,0,vaccination
258,@FollowMMA Not until they let me in the country Bro. Will hit Miami up as soon as I get the vaccine!,0,vaccination
259,China’s CanSino Covid-19 vaccine wins emergency approval in Mexico https://t.co/dHCYFd6nQq,0,vaccination
260,"Clown society. No one desires to think for themselves anymore, or help themselves overcome the things in their lives (smoking, drinking, eating tons of refined sugar, sitting in front of 2 monitors 5 days a week) An element of our immunity now is a cloth diaper on our face. And now this doctor & follows a script to fit a propaganda instead of HELP lives. Clearly sold to big pharma so please don’t call this healthcare, this is medicine care",0,vaccination
261,New Zealand to inoculate high-risk people first as Covid-19 vaccine gets full approval https://t.co/9pSlVcUy17,0,vaccination
262,So did she turn into a zombie?,0,vaccination
263,@dagenmcdowell In a way he is right if one work in this field know their May b e adverse affects of these vaccines or meds pass in a year time,0,vaccination
264,Take it asap. Then can go overseas.,0,vaccination
265,2 doses. A minimum gap of 28 days. Keep on your masks and maintain social distancing. For the virus to be defeated and the vaccine to take effect listen to the experts. #COVIDー19 #AtmaNirbharBharat #LargestVaccineDrive https://t.co/BDbWeFuqHi,0,vaccination
266,Today's community #COVID19 cases include a bus driver who transports people on stay-home notice and an engineer who tested positive after first vaccine dose. https://t.co/y7POSkUPTc https://t.co/Tq8CESLR99,0,vaccination
267,its beginning to look a lot like christmas 🎄,0,vaccination
268,"That’s one big bright smile I haven’t seen in a while. Capping off an exhausting, tiring, and mad year with good news in Singapore - Phase 3, Vaccines, and some normalcy back in our lives soon",0,vaccination
269,me when the government activates the vaccine chip and presses the air freshener button https://t.co/41JvRIHROC,0,vaccination
270,Why don't you ask the guy who claims that the vaccines are perfect. He would know.,0,vaccination
271,@ChangThaw Flight carried Covid Vaccine from India didn't allow to be landed but Seafoods carried flights allow to be landed on Myanmar? LOL... FIGHT FOR DEMOCRACY #ShameonyouChina #WhatsHappeningInMyanmar #CyberSpeechFreedom,0,vaccination
272,Nurse who drew blood for Ma’s tests a few days ago said she wasn’t keen on the Pfizer or Moderna vaccs bcos “I’ve never seen a vaccine created so fast with so little testing” and she resents being a guinea pig.,1,vaccination
273,This study from Italy validates our earlier report that cancer patients are indeed more prone to COVID-19. Next up will be the safety and efficacy of vaccines in our patients!! https://t.co/DGc20WAZE1 via @JAMAOnc #COVID19 #VaccinesSaveLives,0,vaccination
274,"The major task Minister is, how do you convince doomsayers who cast doubt on the vaccine? How do you deal with unflagging fear? It's a monumental undertaking and it requires reassurance that everything is on track. I will still want to be vaccinated &amp; vaccine is a strong tool 🙏",1,vaccination
275,@DamCou Macrames her own tampons and loudly proclaims vaccination causes autism. The world is full of these wallies.,0,vaccination
276,So does that person need the 2nd shot of vaccine now that he received 5 doses during the first shot? https://t.co/5jouIBn0J7,0,vaccination
277,Japan health ministry says it has approved Pfizer's COVID-19 vaccine https://t.co/dqYcZiPmvS https://t.co/WHkwr4LEoR,0,vaccination
278,"COVID-19 vaccine may be ready by year-end, says WHO's Tedros https://t.co/dKiQ2UJG4N via @Yahoo",0,vaccination
