,comment_id,comment_parent_id,comment_body,comment_link_id,created_dts,author,score
0,fv0exef,t3_ha39vi,"Why didn't they include ""journalism"" in the list of jobs?",t3_ha39vi,2020-06-16 21:52:48,Xylorios,19
1,fv0avfs,t3_ha39vi,"I have asked someone I know who studied designing about the non-essential thing. Naturally, he agreed that in Singapore there has been a lack of focus on the importance of a designer.

He quoted the news on Singapore polytechnic combining 8 programmes into one multidisciplinary course. In his opinion, this can result in a lack of specialisation that is important as foundations for a career, despite the fact that from 2nd year onwards specialisation is available. Another issue is that despite SP wanting to allow their students to become more adaptable, my friend did say that different disciplines have different requirements.

Plus he also mentioned that in Singapore, many people discredit the role of designers just because 'some people who know photoshop' prefer their own designs rather than one done by a graphic designer who has, through his course of studies, learnt the best placement for texts and infographics to help people get the message that is desired. 

Other examples he stated was the fact (from his point of view) that engineers in Singapore require designers to work within engineering constraints, while it is important that engineers should work to accommodate for the design constraints. To be fair, he did acknowledge that the work of an engineer and a designer should come hand in hand, instead of one party having veto power over the other, which he thinks is lacking in Singapore.

Hence, he thinks many people don't put importance on the work of a designer because many people with some skills (photoshop, illustrator) think that they are able to achieve the same result without a designer. However, a designer comes with a suite of skills that cannot be self-taught for most people.

He explains that some designs of apps or user interfaces in various places are not designer-standard and are ugly (in his opinion), and that it could have been done by a non-designer. This can have a negative effect from what is desired. A design that doesn't catch the eye, or is too plain, with mismatched colours would not attract people.",t3_ha39vi,2020-06-16 21:12:56,_sagittarivs,19
2,fv09u3b,t3_ha39vi,"non essential: sph

such an impt convo about jobs and fair pay and they made it about ""are artists essential?""",t3_ha39vi,2020-06-16 21:02:06,dravidan7,13
3,fv0b5ei,t3_ha39vi,"Damage control time from ST, but the creative industry has been hurt already.",t3_ha39vi,2020-06-16 21:15:46,milo_dino,9
4,fv0apb8,t3_ha39vi,"this whole article gives me headache. 

I'm sorry",t3_ha39vi,2020-06-16 21:11:11,BearWithAGyoza,2
5,fv0jqgc,t3_ha39vi,A lof of butthurt people lol,t3_ha39vi,2020-06-16 22:36:10,indaffa,-1
6,fv3v07w,t1_fv0exef,Because journalism is dead in Singapore. Why else would we rank lower than Russia in press freedom?,t3_ha39vi,2020-06-17 17:30:59,hearYEET,8
7,fv2smcx,t1_fv0avfs,">To be fair, he did acknowledge that the work of an engineer and a designer should come hand in hand, instead of one party having veto power over the other, which he thinks is lacking in Singapore.

This is project specific. Some projects emphasize design, while others emphasize cost or function.

Good design or aesthetics add immense value to any project. It's a force multiplier. But in many cases it's not *mission-critical.*",t3_ha39vi,2020-06-17 09:25:37,hurtbreak,5
8,fv35v2a,t1_fv0jqgc,"People have feelings, imagine if your job is listed in the top 5 non-essential jobs and you're not earning as much as before. Surely there will be much resentment and anger towards the article. The non-essential portion was really frankly, non-essential.",t3_ha39vi,2020-06-17 11:39:02,whitetigertrainer,6
9,fv4ucy1,t1_fv35v2a,"Agreed, it felt like a slap in the face. The article could have just featured only the essential jobs; nothing of value would be lost and less people would be upset.",t3_ha39vi,2020-06-18 00:05:04,Logi_Ca1,2
10,fuorsqu,t3_h83990,"less rhetoric, more action.",t3_h83990,2020-06-13 17:03:58,homeboundcoronavirus,34
11,fuql6mr,t3_h83990,Everyone gangsta until you say cost of living/taxes will go up.,t3_h83990,2020-06-14 05:03:22,caritas6,6
12,fuoqliu,t3_h83990,"huh.. Teachers say they are undervalued and underpaid; FDW says the work 12 hours but underappreciated; WP Holders say the same; Expats say they are paying taxes here but not getting any benefits; Even Students on scholarships say they need cut in school fees; 

I don't have to add anything about Singaporeans or residents. 

Must be our water or air which makes all of us complain continuously and constantly.",t3_h83990,2020-06-13 16:42:36,worldcitizensg,-41
13,fuozoy9,t1_fuorsqu,I'm all for it. I also don't want to see anyone complaining when cost of goods and services goes up,t3_h83990,2020-06-13 19:23:15,Zukiff,18
14,fuot95p,t1_fuoqliu,Or the injustice. Stop trying to dismiss real concerns.,t3_h83990,2020-06-13 17:30:25,,26
15,fuouddz,t1_fuoqliu,alot of behavioural biases in just this one comment right here,t3_h83990,2020-06-13 17:50:42,FitCranberry,9
16,fusm13y,t1_fuozoy9,"Sure, as soon as you can definitively prove that the cost increase is a direct consequence of paying those higher wages",t3_h83990,2020-06-14 20:18:11,blackreplica,3
17,fuou67j,t1_fuot95p,[deleted],t3_h83990,2020-06-13 17:47:06,,0
18,fuougij,t1_fuou67j,Think our entire country are conservatives,t3_h83990,2020-06-13 17:52:16,,2
19,fuoufue,t1_fuou67j,in this day and age is more like me vs us,t3_h83990,2020-06-13 17:51:56,FitCranberry,1
20,g8k68hs,t3_j9jlg5,Isn't this a little fast considering Indo had its daily high of 4850 cases as recently as last Thursday?,t3_j9jlg5,2020-10-12 11:39:41,togrias,65
21,g8kfvip,t3_j9jlg5,"Shows how reliant Singapore is on Indonesian cash, why are they opening up this lane for a country which has not peaked yet in terms of cases and is doing a poor job of controlling the virus?

&#x200B;

[https://www.google.com/search?q=indonesian+covid+19+cases+graph&rlz=1C5CHFA\_enSG789SG789&oq=indonesian+covid+19+cases+graph&aqs=chrome..69i57j0.5998j0j7&sourceid=chrome&ie=UTF-8](https://www.google.com/search?q=indonesian+covid+19+cases+graph&rlz=1C5CHFA_enSG789SG789&oq=indonesian+covid+19+cases+graph&aqs=chrome..69i57j0.5998j0j7&sourceid=chrome&ie=UTF-8)",t3_j9jlg5,2020-10-12 13:46:05,Significant-Pirate61,25
22,g8k6yfw,t3_j9jlg5,[deleted],t3_j9jlg5,2020-10-12 11:47:55,,70
23,g8kjha2,t3_j9jlg5,"I guess this is definitely not because Indonesia is doing well to control its covid situation.

Let's hope we can do well to track all incoming passengers from Indonesia (via ferry from batam or flights)",t3_j9jlg5,2020-10-12 14:42:54,jzsee,7
24,g8kb3x6,t3_j9jlg5,"Glad it's only RGL and not travel bubbles.

IMO, way too early for travel bubbles with ID, they are doing a lackluster job at best.",t3_j9jlg5,2020-10-12 12:39:33,puncel,12
25,g8k821j,t3_j9jlg5,Hope they implement the accredited lab results thing otherwise we'll kena India again.,t3_j9jlg5,2020-10-12 12:00:56,Boogie_p0p,19
26,g8m5lxp,t3_j9jlg5,Breaking news : “Singapore has decided to launch green lane with Covid-19”,t3_j9jlg5,2020-10-13 02:29:33,asdfgMaster,5
27,g8kwzl2,t3_j9jlg5,"Why Indonesia?  Vietnam, Hongkong, new zealand, mainland China are fine. But Indonesia? Very skeptical.",t3_j9jlg5,2020-10-12 19:00:37,kohminrui,7
28,g8k65p4,t3_j9jlg5,"> # Singapore, Indonesia agree to launch green lane for essential business and official travel

> SINGAPORE: Singapore and Indonesia have agreed to set up a reciprocal green lane (RGL) for essential business and official travel between both countries.

> Applications for the RGL will open on Oct 26 and travel will start soon after, Singapore's Ministry of Foreign Affairs (MFA) said on Monday (Oct 12).

> Advertisement

> Advertisement

> The agreement comes less than two months after MFA said on Aug 25 that Singapore and Indonesia planned to begin talks for a reciprocal green lane.

> Indonesian Foreign Affairs Minister Retno Marsudi told CNA in an exclusive interview last week the two countries were in the final phase of negotiations for the green lane, and that preparations were being made on the ground to facilitate arrivals.

> OPEN TO INDONESIAN CITIZENS, SINGAPOREANS AND SINGAPORE RESIDENTS: MFA

> Advertisement

> Advertisement

> MFA said on Monday that Singapore Foreign Affairs Minister Vivian Balakrishnan and Mdm Marsudi have reaffirmed the “excellent and longstanding relations” between Singapore and Indonesia in a telephone conversation.

> They also recalled their discussion in August this year on the importance of strengthening mutually beneficial cooperation in overcoming common challenges brought about by the COVID-19 pandemic.

> This includes the resumption of essential travel while safeguarding public health and safety in both countries.

> ""In this context, the ministers welcomed the conclusion of the negotiations,"" said MFA.

> Advertisement

> Indonesian citizens as well as Singapore citizens and residents are eligible for the RGL, also referred to by Indonesia as the travel corridor arrangement (TCA), said MFA.

> Travellers will have to abide by COVID-19 prevention and public health measures agreed by both countries, including pre-departure and post-arrival polymerase chain reaction (PCR) swab tests from mutually recognised health institutions.

> Operational details regarding the RGL, including the procedural requirements, health protocols and application process will be announced ""in due course"".

> TWO POINTS OF ENTRY EACH IN INDONESIA AND SINGAPORE

> Mdm Marsudi said at a press conference on Monday that there will be two points of entry in Indonesia for the RGL: Batam Centre Ferry Terminal and Jakarta's Soekarno-Hatta International Airport.

> The two entry points for Singapore will be Tanah Merah ferry terminal and Changi Airport, she added.

> Travellers will have to take the first PCR test 72 hours before departure, and the second test upon arrival at the airport or ferry terminal. Travellers will bear the costs of the tests, said Mdm Marsudi.

> Eligible travellers must also download and register themselves on the TraceTogether and SafeEntry mobile applications while in Singapore, or on the e-HAC and Peduli Lindungi applications while in Indonesia, she added.

> Mdm Marsudi said applicants from Indonesia must have a sponsor from a government agency or enterprises in Singapore and request for a SafeTravel pass.

> Singaporeans wanting to enter Indonesia must have a sponsor from the government or business entity and apply for a visa online.

> As Singapore progressively reopens amid the COVID-19 pandemic, special travel arrangements have been made with some countries and regions.

> It now has reciprocal green lane arrangements for essential business and official travel with China, Malaysia, Brunei, South Korea and Japan.

> It has also unilaterally lifted border restrictions for some visitors from Australia, excluding Victoria state, Vietnam, Brunei and New Zealand.

> Earlier this month, Singapore Transport Minister Ong Ye Kung said pursuing more green lane arrangements and negotiating air travel bubbles with countries that had low COVID-19 infection rates were among the plans to ""revive"" Changi Air Hub.

> Mr Ong said in a ministerial statement a facility has been set up at Changi Airport to swab up to 10,000 passengers a day.

> In the next few months, there are plans to set up a dedicated COVID-19 testing laboratory at the airport to support aviation recovery, he added.

> Indonesia reported 4,497 new COVID-10 infections and 79 new deaths on Sunday, the lowest daily fatality count since Sep 27. It now has a total of 333,449 COVID-19 cases, with 11,844 deaths.

> Singapore reported 10 new cases on Sunday, taking its national total to 57,876 infections and 27 deaths.

> Download our app or subscribe to our Telegram channel for the latest updates on the coronavirus outbreak: https://cna.asia/telegram

---
1.0.2 | [Source code](https://github.com/fterh/sneakpeek) | [Contribute](https://github.com/fterh/sneakpeek)",t3_j9jlg5,2020-10-12 11:38:49,sneakpeek_bot,2
29,g8kkrq7,t3_j9jlg5,I need to figure out a way to make use of this. It has been too long. I would ride a motorcycle through Jakarta Traffic jams while wearing SAF MOPP 4 to go see all the street food Bibiks. I would find a way to attach a mini clean room air lock to the front of my face if it meant I could safely  again enjoy all the nice Jakarta food again.,t3_j9jlg5,2020-10-12 15:04:32,Paullesq,-1
30,g8l9rsy,t3_j9jlg5,"For all the fear of bringing in new covid cases, I do hope to see my partner who is in Indo for the first time in more than 9 months.",t3_j9jlg5,2020-10-12 21:51:37,ayesirwhy,-2
31,g8kd93v,t3_j9jlg5,"All is so muddled. What about people who have spouse and children stuck in Indonesia that have LTVP, still 14 days, apply permission from ICA?

Then the other way, try to pick up telex family visa at embassy tell you must have doctors note and tickets. Now can only buy tickets for Batam or Jakarta (hell nah)

😢",t3_j9jlg5,2020-10-12 13:08:16,bitregister,-3
32,g8kab69,t1_g8k68hs,Need some of that sweet sweet Indo money,t3_j9jlg5,2020-10-12 12:29:11,x1243,29
33,g8kaf90,t1_g8k68hs,[deleted],t3_j9jlg5,2020-10-12 12:30:39,,66
34,g8kt2p9,t1_g8k68hs,"They've also got one of the lowest covid testing rates in the world. So even with the daily high of 4850 new cases, it's still massively under-reported.

Get ready for the second wave, I guess.",t3_j9jlg5,2020-10-12 17:44:25,curmudgeonintaupe,14
35,g8kcsc4,t1_g8k68hs,There is mandatory swab testing before departure (on their end) and upon arrival (on our end). I wouldn't be overly concerned right now.,t3_j9jlg5,2020-10-12 13:01:46,trashmaker,-23
36,g8kd28l,t1_g8k6yfw,They said low but never define what is low *taps head*,t3_j9jlg5,2020-10-12 13:05:36,CSlv,21
37,g8kagd7,t1_g8k6yfw,"Too bad, mandate pass liao. Pls wait 5 more years to vote.",t3_j9jlg5,2020-10-12 12:31:02,Orangecuppa,32
38,g8kkotr,t1_g8k6yfw,"Honestly the highest number from what i know comes from Jakarta. The rich chinese folks who does their businesses in Singapore mostly come from Surabaya which has a lower rate in cases. But then again I wouldn’t agree on them opening a green line for Indonesians until they get their shit together and sack their health minister for hiding from problems and have a proper system to curb the pandemic from spreading.

Jokowi is doing a shit job on both the pandemic and their labour laws.",t3_j9jlg5,2020-10-12 15:03:08,mortichro,2
39,g8khl24,t1_g8k6yfw,"High numbers but low rates?
Based on today
Indonesia: 4497 new cases out of 267 million people = 0.0015%
Singapore : 10 new cases out of 5.85 million = 0.0017%

Their rate is extremely low and lower than Singapore's.",t3_j9jlg5,2020-10-12 14:12:19,random_ang_moh,-15
40,g8kcih5,t1_g8k821j,Lol yeah. India full of crap labs.,t3_j9jlg5,2020-10-12 12:58:05,tenbre,17
41,g8kkiia,t1_g8k821j,Their labs are accredited but insufficient.,t3_j9jlg5,2020-10-12 15:00:11,mortichro,2
42,g8ka4fv,t1_g8k821j,"We should just insist on secondary tests upon arrival with our own labs, regardless of country of origin",t3_j9jlg5,2020-10-12 12:26:49,bukitbukit,-8
43,g8m5s11,t1_g8m5lxp,\*nydus worm roars\*,t3_j9jlg5,2020-10-13 02:31:00,togrias,1
44,g8kgvuw,t1_g8kcsc4,There is an incubation period.,t3_j9jlg5,2020-10-12 14:01:20,togrias,19
45,g8kb380,t1_g8kagd7,"Childish to think the new government won't pull the same shit. Look at Malaysia, PH made so many amazing promises, renegade on most of them when elected.",t3_j9jlg5,2020-10-12 12:39:18,nova9001,3
46,g8kkq4v,t1_g8khl24,"please read about what's going on before using numbers to justify your argument. 

1) Indonesia has a very low testing rate - i believe they only test \~10,000 people per day. High % of people that they test turn out positive (>20%). Compared to <1% for Singapore. This shows that there is potentially a large pool of untested infected in the community

[https://www.straitstimes.com/asia/se-asia/with-worlds-lowest-testing-rate-indonesia-far-from-covid-19-peak](https://www.straitstimes.com/asia/se-asia/with-worlds-lowest-testing-rate-indonesia-far-from-covid-19-peak)

2) I've spoken to people in Indonesia & while a large percentage of the urban population understands the potential severity and extent of COVID-19, there are many, especially those in the rural areas who do not believe that the virus is a threat and want life to continue as per normal. 

[https://www.channelnewsasia.com/news/asia/indonesia-covid-19-contact-tracing-threats-assaults-13078460](https://www.channelnewsasia.com/news/asia/indonesia-covid-19-contact-tracing-threats-assaults-13078460)

3) There are currently widespread demonstrations in Jakarta over new labor laws. Thousands are out in the streets not wearing masks (situation is similar to the US). There is also local election campaigning going on and rallies are attracting large number of people confined in a very small area

[https://www.nytimes.com/2020/10/08/world/asia/indonesia-protests-jobs.html](https://www.nytimes.com/2020/10/08/world/asia/indonesia-protests-jobs.html)

The net of it all is that there is rampant community spread of the virus in Indonesia and the situation is not being managed effectively by the government. As an example, just look at how many people were at the closing ceremony of a Mcdonald's in Jakarta. This just demonstrates how poorly the authorities are managing the spread. 

[https://www.channelnewsasia.com/news/asia/indonesia-mcdonalds-covid-19-sarinah-jakarta-12721378](https://www.channelnewsasia.com/news/asia/indonesia-mcdonalds-covid-19-sarinah-jakarta-12721378)",t3_j9jlg5,2020-10-12 15:03:46,Significant-Pirate61,14
47,g8kl1xk,t1_g8khl24,[deleted],t3_j9jlg5,2020-10-12 15:09:20,,2
48,g8kcp90,t1_g8ka4fv,I fucking hate that 99% of people don't read these articles.,t3_j9jlg5,2020-10-12 13:00:39,trashmaker,20
49,g8kc195,t1_g8kb380,renege,t3_j9jlg5,2020-10-12 12:51:39,AcrossTheWay23,28
50,g8kq0rn,t1_g8kl1xk,Yep.. totally should be going for Taiwan before Indonesia,t3_j9jlg5,2020-10-12 16:42:48,random_ang_moh,3
51,g8okx6v,t1_g8kl1xk,"I wonder if the Taiwan thing is more political than health. I.e. China and Taiwan relations, Taiwan not being an officially recognized country.",t3_j9jlg5,2020-10-13 19:17:42,pigsticker82,1
52,g8kcsnj,t1_g8kcp90,Yup two tests,t3_j9jlg5,2020-10-12 13:01:53,bitregister,9
53,fs92ztb,t3_gsuia7,"Neutrality means that we have to be friendly to everyone, while we are opening a travel bubble with China, we are also in talks to do the same with NZ and SK. We can't be selective in who we want to be friendly to if we want to uphold neutrality.

Alarmist talks like oh SG is gonna become Pro-China/Pro-US everytime we appear friendly to one side is not helpful at all, Singapore have to appear friendly to everyone to maintain neutrality.  With this kind of alarmist rhetoric is no wonder China thinks we are american dogs whereas TW/HK thinks that we are commie dogs.",t3_gsuia7,2020-05-30 07:09:27,xxxr18,81
54,fs87c8v,t3_gsuia7,Thank goodness we are not xenophobic,t3_gsuia7,2020-05-30 02:42:03,Achuapy,25
55,fs7ny4k,t3_gsuia7,Insert GTA: SA here we go again meme,t3_gsuia7,2020-05-30 00:11:01,fizzguy47,21
56,fs97pjl,t3_gsuia7,"Some of the comments are just so toxic.

Re-establishing travel network with ""safe countries"" is just the first logical step in the plan to restore normalcy. Almost any country that has the virus under control is doing this.

If Indo/Malaysia, or the US has it under control, Singapore will have similar arrangement with them in no time as well.

Some people seem to have very weird persecution complex.",t3_gsuia7,2020-05-30 07:54:23,goldenpisces,41
57,fs9g9ww,t3_gsuia7,"came in here expecting the usual standard negative jumping-to-conclusion commoner comments, not disappointed ;)",t3_gsuia7,2020-05-30 09:17:27,EdwardZzzzz,10
58,fs9srnj,t3_gsuia7,"Allow me to translate diplomatic language to Singlish:

“Both sides attached great significance to securing the connectivity of production and supply chains, and agreed to level up the efficiency of freight linkages and customs clearance, including facilitating the flow of goods such as essential medical supplies and food,"" the ministry added.

“I CarouPay you, can deliver today anot? I wan fast fast free delivery can? Got masks? Flu medicine? Test kits? Don’t say no stock k?” the towkay say.",t3_gsuia7,2020-05-30 11:27:20,PolicyChair,7
59,fs7iggr,t3_gsuia7,"Skip your closest and poor neighbour for the one way up north.

Love how Singapore like to carry balls",t3_gsuia7,2020-05-29 23:27:39,mortichro,28
60,fs7f07u,t3_gsuia7,"> # Singapore, China to launch 'fast lane' arrangement with COVID-19 measures for essential business, official travel

> SINGAPORE: Singapore and China have agreed launch to a ""fast lane"" arrangement in early June for essential travel for business and official purposes, Singapore's Ministry of Foreign Affairs (MFA) said in a statement on Friday (May 29).

> The arrangement will include ""effective COVID-19 prevent and control measures"", and will be first applied between the six Chinese provinces or municipalities directly under the central government - Shanghai, Tianjin, Chongqing, Guangdong, Jiangsu and Zhejiang - and Singapore.

> Advertisement

> Advertisement

> ""The arrangement will be gradually expanded to the other Chinese provinces and municipalities. Both sides agreed to explore the increase of air links between the two countries for the Fast Lane,"" MFA said.

> ""Both sides attached great significance to securing the connectivity of production and supply chains, and agreed to level up the efficiency of freight linkages and customs clearance, including facilitating the flow of goods such as essential medical supplies and food.""

---
1.0.2 | [Source code](https://github.com/fterh/sneakpeek) | [Contribute](https://github.com/fterh/sneakpeek)",t3_gsuia7,2020-05-29 22:59:07,sneakpeek_bot,1
61,fs7ghql,t3_gsuia7,This is quite scary. After China takes over HK and Taiwan where do you think they'll look next. Not sure if our govt realises this,t3_gsuia7,2020-05-29 23:11:34,InterimNihilist,-28
62,fs9oz1d,t3_gsuia7,"seems like there's no details yet on what are the extra measures in place for this ""fast lane"". i think it would be interesting to see the details, e.g. existing advisory says if you leave sg now you have to pay for SHN, would there be exemptions under this fast lane?",t3_gsuia7,2020-05-30 10:46:39,tnfybrhv,-1
63,fs9h2k8,t1_fs92ztb,">With this kind of alarmist rhetoric is no wonder China thinks we are american dogs whereas TW/HK thinks that we are commie dogs.

In reality, we are everybody's dogs.",t3_gsuia7,2020-05-30 09:25:22,milo_dino,94
64,fs9nofr,t1_fs92ztb,I have no objections to open up travel arrangements with whoever. I just think it's ridiculous that we are allowing overseas travel before we can even socialize.,t3_gsuia7,2020-05-30 10:33:02,hosehliao,25
65,fs9yqjs,t1_fs92ztb,"We are definitely more partial towards the west. Look at the weapons we buy, the ships we host, and where we train our military. That said, I don't think there's anything wrong with that. We, and our neighbours have traditionally sided with the west on most issues and it is absolutely okay to pick a side.",t3_gsuia7,2020-05-30 12:34:16,Gungalley,9
66,fs9msd3,t1_fs92ztb,"I think what ticks people off is that it really appears someone is cutting in line.

Instead of giving them special treatment and coddling, we should have announced a ""Phase 1"" travel bubble including NZ and SK as well.

But oh well, Germany is doing the same.",t3_gsuia7,2020-05-30 10:23:46,yuuka_miya,0
67,fsahjsc,t1_fs92ztb,"NZ has managed to control covid until it has only 1 active case left tho. Don't think the same can be said for China.

https://www.npr.org/sections/coronavirus-live-updates/2020/05/29/864917847/new-zealand-now-has-just-1-active-covid-19-case",t3_gsuia7,2020-05-30 17:00:23,shimmynywimminy,1
68,fs9sq16,t1_fs92ztb,"Let's be real la this is a wayang show for transparency

Our boss also say they neutral meritocratic, but we know who they like most and its the one that brings in the $$ and keeps the team alive",t3_gsuia7,2020-05-30 11:26:52,runesplease,-8
69,fs9smac,t1_fs87c8v,majority of us are not,t3_gsuia7,2020-05-30 11:25:44,pilipok,0
70,fs7pn7z,t1_fs7ny4k,"Same old shit again

Up and down this covid lane

Coz we give China the fast lane",t3_gsuia7,2020-05-30 00:24:13,adrenaline_junkie88,15
71,fs88avx,t1_fs7ny4k,/facepalm,t3_gsuia7,2020-05-30 02:49:41,Strangeronthebus2019,0
72,fs9d77p,t1_fs97pjl,"People never want to see how the cow is killed.

Don’t think people understand that even our food containers are imported from China. Allowing “fast entry” ensures that businesses can ensure supplies lines are unbroken.",t3_gsuia7,2020-05-30 08:47:11,leo-g,22
73,fs9wf79,t1_fs97pjl,"If the comments here are toxic, I don't know what to say about Facebook comments LOL",t3_gsuia7,2020-05-30 12:07:30,KawaiiSumo,-1
74,fs9howv,t1_fs9g9ww,Let's see if the same comments pop up when we establish the same lanes with SK and NZ =) also can't believe there's that stupid comment comparing it with Maia considering there are still some people crossing the causeway everyday.,t3_gsuia7,2020-05-30 09:31:26,Klubeht,3
75,fs81hwg,t1_fs7iggr,I’m not not pro-ccp or anything but this kind of deals take two hands to clap. And Malaysia is clearly not in the right place to do any kind of fast lane.,t3_gsuia7,2020-05-30 01:55:49,leo-g,62
