,comment_id,comment_parent_id,comment_body,comment_link_id,created_dts,author,score
76,fs915dp,t1_fs7iggr,"The volume of travel from Malaysia will obviously be way more than the volume from China so its reasonable that the one in Malaysia will have to wait due to sheer volume. Its not carrying balls, its logical sense.

(Besides SG is in talks with New Zealand n SK too so are we carrying Kiwi and Kimchi balls too?)",t3_gsuia7,2020-05-30 06:52:20,xxxr18,31
77,fs9dc6h,t1_fs7iggr,Malaysia dont even want their Malaysian citizens to come back. Our fault again?,t3_gsuia7,2020-05-30 08:48:31,,8
78,fs8juew,t1_fs7iggr,To be fair they did let all the Malaysian transit workers in without testing,t3_gsuia7,2020-05-30 04:23:28,Achuapy,13
79,fs95hb1,t1_fs7iggr,Because the curve of our closest neighbors are still pretty much going up while the ones on China is where we want to be at Phase 3,t3_gsuia7,2020-05-30 07:33:06,Zukiff,14
80,fs7s908,t1_fs7iggr,our government always looks at economical benefits before making certain decisions. China is a key partner to economic growth which we solely need now. No brainer really,t3_gsuia7,2020-05-30 00:44:09,Quish_,31
81,fs9chec,t1_fs7iggr,I thought imports from Msia still ongoing now?,t3_gsuia7,2020-05-30 08:40:13,milkmatchatea,4
82,fs7kaim,t1_fs7iggr,We are quite clearly taking sides now... not sure if it's the right one,t3_gsuia7,2020-05-29 23:42:18,sakibbfru92,15
83,fs9sjnw,t1_fs7iggr,"When your neighbour can't even decide on whether to proceed or back out on an already agreed rail project, and every time you look over its a different person heading the country...

Is it najib?

Maybe mahathir this time, 

oh wait Anwar is back?

Who's this newly elected guy no one knew?

Oh wait mahathir is in command again after his retirement..?",t3_gsuia7,2020-05-30 11:24:58,runesplease,3
84,fs7mhvn,t1_fs7ghql,"Neutrality means the West coming to bail us out if we fuck up.

Once we stop appearing neutral, I'm not sure whether that holds anymore.",t3_gsuia7,2020-05-29 23:59:39,yuuka_miya,21
85,fs8cipb,t1_fs7ghql,"Do you even know why hong kong is now a part of China and why Taiwan is heavily contested? 

Epic facepalm.",t3_gsuia7,2020-05-30 03:23:21,Xanthon,14
86,fs7iid6,t1_fs7ghql,"Your response is not related to the topic at hand and strikes me as fear-mongering. We are launching 'fast lane' arrangements with New Zealand & Australia; does that mean we are going to be 'take\[n\] over' by them?

China is only interested in maintaining its territorial integrity and all its aggressive measures since its modern inception are towards bordering nations, e.g. India, Vietnam, Soviet Union/Russia. There's no reason why Singapore will be taken over by China along the likes of Hong Kong & Taiwan, and China has never made overtures to claim Singapore as 'Chinese land'.

You can see a full list of wars with China here:  [https://en.wikipedia.org/wiki/List\_of\_wars\_involving\_the\_People%27s\_Republic\_of\_China](https://en.wikipedia.org/wiki/List_of_wars_involving_the_People%27s_Republic_of_China)",t3_gsuia7,2020-05-29 23:28:04,justmewayne,19
87,fs8jy4w,t1_fs7ghql,They can't take Taiwan in the foreseeable future.  Us 7th fleet is no joke,t3_gsuia7,2020-05-30 04:24:19,Achuapy,5
88,fs7owvj,t1_fs7ghql,"China is quite a distance away from us, and we are surrounded by muslim nations, mainland citizens may want SG to be part of China, but our national anthem & language will always be malay, along with our army commands. Like it or not, we have more cultural connection to Malaysia compared to China, CCP may say whatever they want but they can never claim SG because of 'majority chinese' when the first settlers here were orang laut.",t3_gsuia7,2020-05-30 00:18:31,shadowmanta,8
89,fs7i4t7,t1_fs7ghql,Username checks out,t3_gsuia7,2020-05-29 23:25:05,bencoolenboys,2
90,fs7llyk,t1_fs7ghql,What do u mean? We are a sovereign country,t3_gsuia7,2020-05-29 23:52:42,,3
91,fs95xd0,t1_fs7ghql,"Not sure what kind of stupid logic you are working on. Both Hong Kong and Taiwan is considered part of China for historical reasons.

HK is not being taken over, they already ARE part of China.

Even Taiwan officially recognizes itself as part of China. FYI official name of Taiwan is the Republic of China, the country call Taiwan does not exist. The so called 1 China policy is not just a China thing, the 1 China policy states that there is only one China and Taiwan is part of it. From China's perspective under the policy Beijing is the govt for that China, for the 1 China policy from Taiwan side, Taiwan is the legit govt of China.

SG have never been part of China nor does China claim us to be such. The SEA nations that China have historical claims to all have land borders to China. None of which PRC is currently claiming as their own

As for the issue of China somehow destroying democracy, China is basically running Africa right now and has not exported its political model into Africa so that assertion is false as well

Learn your facts before making stupid statements",t3_gsuia7,2020-05-30 07:37:24,Zukiff,1
92,fs9y0nc,t1_fs9oz1d,"ST wrote that testing beforehand will be required and additional measures are still being discussed. It’s also focused on businesses/employees needing to move around for work, not tourists.",t3_gsuia7,2020-05-30 12:25:50,,0
93,fs9j5x0,t1_fs9h2k8,True neutrality summarized.,t3_gsuia7,2020-05-30 09:46:16,xxxr18,27
94,fsa68bw,t1_fs9h2k8,"I believe the proper term is ""everyone's bitch"".",t3_gsuia7,2020-05-30 14:08:32,haracas,11
95,fsah4se,t1_fs9yqjs,The easiest way to see which way a country leans is to see who they import their weapons from.,t3_gsuia7,2020-05-30 16:53:37,fallenspaceman,1
96,fsak7fh,t1_fsahjsc,"Don’t think the same can be sad about Singapore either. We have a ton of active cases, so who are we to complain about China or SK",t3_gsuia7,2020-05-30 17:44:48,shxxroxxl,5
97,fs9tu1d,t1_fs9sq16,Isn’t that what meritocratic means,t3_gsuia7,2020-05-30 11:38:58,avery1822,5
98,fs9gs1w,t1_fs81hwg,"\>elects a  95 year old madhatter as the ruler

\>Madhatter reneges on every government-level commitment the Malaysian State has made to foreign partners over the years

\>Entrenched racism and corruption at every level of society and politics makes for a remarkable level of incompetency

But confused pikachu face when not given preferential treatment by other States after a crisis",t3_gsuia7,2020-05-30 09:22:28,ambidextrous12,38
99,fs9epv3,t1_fs95hb1,"I thought Malaysia was doing rather well, but I went to check their numbers and they've just had big spikes due to cases in illegal immigrant detention centres. That's going to be tough to clear out. I hope the Malaysians working to deal with this problem don't also get infected (like dorm staff in Singapore).

 [https://www.straitstimes.com/asia/se-asia/coronavirus-breaks-out-at-detention-centres-in-malaysia-health-ministry-warns-against](https://www.straitstimes.com/asia/se-asia/coronavirus-breaks-out-at-detention-centres-in-malaysia-health-ministry-warns-against)",t3_gsuia7,2020-05-30 09:02:06,DuePomegranate,7
100,fs83djf,t1_fs7s908,"Ya, and we were one of the first to ban Chinese tourists from entering, so I'm not entirely sure about the ball carrying.",t3_gsuia7,2020-05-30 02:10:39,Neptunera,23
101,fs9ism6,t1_fs7kaim,"Not really. We are just restoring our economy. Currently between US and China, its clear which one has lower health risk, China has dealt with the virus far better than US does. If we are going to wait till US has China levels and then restore travel to both, we'd be locking ourselves away from the 1st and 2nd largest economies for probably a year.",t3_gsuia7,2020-05-30 09:42:33,Pandacius,14
102,fs7lnfm,t1_fs7kaim,[removed],t3_gsuia7,2020-05-29 23:53:01,,0
103,fs7moru,t1_fs7mhvn,"We're clearly picking China here. Meanwhile Germany, Australia and US have publicly declared they oppose what China is doing. I guess our policy of neutrality went out the window",t3_gsuia7,2020-05-30 00:01:08,InterimNihilist,-1
104,fs7s4ax,t1_fs7iid6,"You missed out the contention in South China Sea with many other ASEAN countries.

Their ocean claims in area is pretty aggressive to the point of violating UN's Law of the Sea.",t3_gsuia7,2020-05-30 00:43:09,Caninomancy,24
105,fs7piep,t1_fs7iid6,"I’m personally worried about a massive Hakka occurring at Changi, after which we’ll all be subjugated and forced to eat steak without any sauces and shift our vowel pronunciation back by one.",t3_gsuia7,2020-05-30 00:23:11,zoinks10,8
106,fs7ivv1,t1_fs7iid6,China is especially aggressive at the moment. I get it that we can't openly go against them but being overtly friendly with them could have an opposite effect since most countries are discussing actions against China,t3_gsuia7,2020-05-29 23:31:04,InterimNihilist,12
107,fs7j10t,t1_fs7iid6,"Oh and you should also see how many PRCs online feel Singapore should be part of China just because we are majority Chinese. They already claim the south China Sea without any validity, what's to stop them to do the same with sg

Edit:
Funny in your list of territorial disputes you don't mention south China Sea which is the most relevant to us... Coz you know that's the one China pulled out of their ass and have no claim to",t3_gsuia7,2020-05-29 23:32:13,InterimNihilist,15
108,fs7mb3d,t1_fs7iid6,What about African states? https://www.wsj.com/articles/china-tightens-grip-on-east-african-port-11550746800,t3_gsuia7,2020-05-29 23:58:10,throwaway96655,9
109,fs7tt62,t1_fs7owvj,"I mean, there are a bunch of reasons why it's incredibly unlikely for us to be taken over by China, but us having ""more cultural connection to Malaysia"" isn't high on that list. 

You know you're reaching a little when you need to use army commands and the orang laut as your examples.",t3_gsuia7,2020-05-30 00:56:07,omnirai,22
110,fs7pis5,t1_fs7owvj,I hope you're right and I'm completely wrong,t3_gsuia7,2020-05-30 00:23:16,InterimNihilist,9
111,fs81yt3,t1_fs7owvj,"> our national anthem & language will always be malay, along with our army commands

Not sure if trolling or retarded.

That's just lip service.",t3_gsuia7,2020-05-30 01:59:29,DavlosEve,4
112,fs7m3no,t1_fs7llyk,Yeah until China use their twisted logic and lay claim to random territories,t3_gsuia7,2020-05-29 23:56:33,InterimNihilist,6
113,fsakbg0,t1_fsak7fh,Yea if I were NZ i wouldn't let us in either. Which is probably why it's too early to be thinking of reopening borders at all.,t3_gsuia7,2020-05-30 17:46:40,shimmynywimminy,-2
114,fs9jmvg,t1_fs9gs1w,"it's ironic that his election campaign was to ""right the wrongs""",t3_gsuia7,2020-05-30 09:51:06,fatenumber,10
115,fsahvnr,t1_fs9gs1w,"Malaysian here. I don't get the logic why you're thinking other states are openly ""leaving us out""? where did you get this news or conclusion from?   


There is literally a global pandemic and the border are still closed- like a lot of other countries.   


Why does it have to be a ""this country is better than that country"" debate?",t3_gsuia7,2020-05-30 17:05:50,CulturalStrawberry,0
116,fs8v43o,t1_fs83djf,[deleted],t3_gsuia7,2020-05-30 05:58:47,,-1
117,fs7nt3d,t1_fs7lnfm,[deleted],t3_gsuia7,2020-05-30 00:09:55,,8
118,fs928oy,t1_fs7moru,"Thats some pretty alarmist rhetoric considering that our navy recently took part in drills with the US  7th fleet in the south china sea so clearly the policy of neutrality is there.

Our neutrality means being involved and being friendly to both sides, not completely drawing ourselves from one side or the other. (Besdies won't that violate neutrality?)",t3_gsuia7,2020-05-30 07:02:23,xxxr18,18
119,fs9608i,t1_fs7moru,Policy neutrality means we DON'T pick sides. We work with both sides. Do you even know what neutrality means?,t3_gsuia7,2020-05-30 07:38:09,Zukiff,17
120,fs7mvem,t1_fs7moru,"I'm more concerned about how other ASEAN nations will react, given that we already aren't that popular around here and the last thing we want to do is look like we're damaging their interests.

Dr M marching across the Causeway may not be such of a meme now, and he won't need life-preserving cyborg modifications in order to do so.",t3_gsuia7,2020-05-30 00:02:33,yuuka_miya,-2
121,fs7o3gf,t1_fs7moru,"We can do something to side with US soon too, imo hopefully some vaccine trials with our ethnic Chinese population here. This move buys us some goodwill when we were one of the first to take action against Wuhan travellers",t3_gsuia7,2020-05-30 00:12:10,pannerin,-5
122,fsamd2m,t1_fs7moru,"Bruh we still do exercises with the US navy in the south china sea, Cina not taking over yet",t3_gsuia7,2020-05-30 18:21:39,burnburnfirebird,0
123,fs9mij4,t1_fs7piep,A massive Hakka is more likely to force you to eat lei cha,t3_gsuia7,2020-05-30 10:20:57,the13thAristocrat,1
124,fs9de59,t1_fs7j10t,"It’s not just online...I’ve been asked like 5 times at least face to face while talking to the citizens of China. They said that since Singapore is mainly Chinese we should be part of China too.

- I was a university tutor in Sydney and so...I was exposed to so many of them for the past few years.",t3_gsuia7,2020-05-30 08:49:03,crngpnts,8
125,fs7s8eb,t1_fs7mb3d,"What about them? In the article you posted, the government willingly sold 25% stake in their port to a Chinese company. PSA is a private company under Temasek Holdings. No way will they sell something of such national importance to foreign countries.",t3_gsuia7,2020-05-30 00:44:01,rostiii,10
126,fs9cqql,t1_fs7mb3d,"Can you analyse the news properly before commenting?

Africa has tons of natural resources and desperate for funding. They made super unfavourable deals.",t3_gsuia7,2020-05-30 08:42:44,leo-g,0
127,fs7qjna,t1_fs7mb3d,"If you consider having an overseas military base as taking over a country, then many other so-called ""countries"" will actually be part of another country.

Take for example the United States, which has military bases in Afghanistan, Australia, Bahrain, Belgium, Brazil, British Indian Ocean Territory, Bulgaria, Cuba, Cameroon, Curacao, Djibouti, Germany, Greece, Greenland, Honduras, Iceland, Iraq, Israel, Italy, Japan, Kosovo, Kuwait, Netherlands, Niger, Norway, Oman, Philippines, Portugal, Qatar, Romania, Saudi Arabia, Singapore, South Korea, Spain, Syria, Tunisia, United Arab Emirates, and the United Kingdom.

By your logic, Singapore is also aggressively taking over a few countries, as we have military bases in Australia, New Zealand, and the United States.

Meanwhile, China only has military bases in Afghanistan, Cambodia, Djibouti, Myanmar and Tajikistan. Who should we be more afraid of?",t3_gsuia7,2020-05-30 00:31:11,justmewayne,-10
128,fs85e9v,t1_fs7tt62,"How else are our Enciks going to give command sia.

""Whole lot, Attention!"" doesn't have quite the same kick as ""Baris Seddddddddddddddia! Samula! Whole lot knock it down.""",t3_gsuia7,2020-05-30 02:26:38,10000owls,1
129,fs82p22,t1_fs81yt3,"Sure its just lip service, and sure the malays are treated like crap, but that doesn't change the fact.",t3_gsuia7,2020-05-30 02:05:14,shadowmanta,6
130,fs7mvv7,t1_fs7m3no,That isnt how it works. Ur just fear mongering. They have as much relation to us as they do madagascar.,t3_gsuia7,2020-05-30 00:02:39,,-2
131,fs8cnk2,t1_fs7m3no,Random? You need to learn more about world history.,t3_gsuia7,2020-05-30 03:24:26,Xanthon,-2
132,fs90l7v,t1_fs8v43o,"Singapore was earlier than TW who was earlier than most countries, what revisionist?",t3_gsuia7,2020-05-30 06:47:18,xxxr18,11
133,fs7uxoi,t1_fs7nt3d,"When people say that, it just means they are resistant to change or have no ambition usually. Quite a dismissive attitude.. foreign relations dont matter? Honestly i do get why we need dem , but to cuddle up to em.. nah.",t3_gsuia7,2020-05-30 01:04:40,,-8
134,fs91tlq,t1_fs7mvem,"Which ASEAN nation have came out to oppose China? Not even Vietnam or indonesia. The only thing that unites ASEAN is our collective humjiness against China. The last time we spoke up for the philipines the whole of ASEAN collectivly diam diam for China, end up our terrex and relations with China got  damaged for no reason. Not one nation, not Indonesia, not vietnam not even the philipines themselves made a sound. Infact, the very nation that we were defending, the Philippines, they went and got THEMSEVLES in bed with China, just look at how durterte pivoted to China and practically gave up their claims. We spoke up for international law and justice and we got backstabbed by the Philippines themselves, so whats the point?

Asean's interest is not a moral but a economic one, if it benefits them to not speak up about China they won't so why should we tank for ASEAN when they have already so happily backstabbed us?",t3_gsuia7,2020-05-30 06:58:31,xxxr18,25
135,fs9chyj,t1_fs7mvem,Remember when we said respect international law about South China Sea? Nobody in ASEAN give a fuck and we got our tanks confiscated.,t3_gsuia7,2020-05-30 08:40:22,,15
136,fs7np28,t1_fs7mvem,"While ASEAN are a more important ally to Sg, I believe we still hold some sway among the members. I dont see them reacting too badly to this. Also because those economies need China more than we do. Wont be surprised if other Asean countries follow suit, including M'sia",t3_gsuia7,2020-05-30 00:09:02,InterimNihilist,2
137,fs7ofi6,t1_fs7o3gf,"I don't think that will happen, there are more than enough Chinese Americans for that.

Perhaps more port calls by EU navies? Or tell Singtel to throw out Huawei?",t3_gsuia7,2020-05-30 00:14:46,yuuka_miya,3
138,fs9tx7j,t1_fs9cqql,Are you dumb or incapable of comprehending simple statement? The guy I was replying to was saying that China is only interested in maintaining its regional territories but I disagree and pointed out African countries as well,t3_gsuia7,2020-05-30 11:39:56,throwaway96655,1
139,fs7rx7n,t1_fs7qjna,That’s not even the main point of the article LOL. I don’t really care too much if you read selectively 🤷🏻‍♂️,t3_gsuia7,2020-05-30 00:41:39,throwaway96655,10
140,fs7ncm8,t1_fs7mvv7,"Okay... Just saying when regimes with expansionist agendas have been given an inch, they usually go ahead and take the entire mile. You can look at history if you don't believe me.

There are already propoganda online that Sg is a good friend of china because of its Chinese majority. Who knows what they can do in the future. Personally it scares me because I live in Sg. Thats all",t3_gsuia7,2020-05-30 00:06:21,InterimNihilist,9
141,fs91y74,t1_fs90l7v,[deleted],t3_gsuia7,2020-05-30 06:59:42,,0
142,fs8x3n9,t1_fs7uxoi,So opening up fast lanes with New Zealand & Australia is ok but not China? You been smoking too much American weed recently?,t3_gsuia7,2020-05-30 06:16:09,pendelhaven,4
143,fs9n0y8,t1_fs91tlq,"Funny you say that

https://www.benarnews.org/english/news/indonesian/unclos-letter-05282020172147.html",t3_gsuia7,2020-05-30 10:26:13,yuuka_miya,0
144,fs7oswb,t1_fs7ofi6,"More convenient to get that data from a few clinical sites in just one other country. We aren't that pressed making test kits unlike the US too. 

We'd make green lanes with everyone let's be real",t3_gsuia7,2020-05-30 00:17:39,pannerin,4
145,fs7rlae,t1_fs7ncm8,"And if we look at history, we can see that China has never tried to expand its territory beyond its current day borders, give or take a border country or two. It has certainly never tried to claim any land south of Vietnam, let alone Singapore so many miles away. 

Heck, even when China was at its most expansionary during the Zheng He era, it never colonized the territories it landed on. Contrast that with the Western powers, which you very rightly pointed out have taken the entire mile when they were given inches through colonialism.",t3_gsuia7,2020-05-30 00:39:08,justmewayne,-10
146,fs934dj,t1_fs91y74,"Evidence? If i am not wrong when we banned the whole of China, Malaysia will still only banning **4** provinces of China. How is it slower?",t3_gsuia7,2020-05-30 07:10:38,xxxr18,4
147,fsa56xy,t1_fs9n0y8,"Only took 4 years, no biggie.",t3_gsuia7,2020-05-30 13:54:37,xxxr18,2
148,fs8mm2c,t1_fs7rlae,"First you say ""China has NEVER tried to expand its territory beyond its current day border"", then you immediately contradict that statement by saying ""give it take a border country or two"". So is it never or not?

Claims on the South China Sea? China is part of UN but doesn't want to adhere to the international rulings against its claim.

Border dispute with India's Ladakh region and China recently flew their helicopter to the border. Tension rise between military on both sides starts brawling and throwing stones at one another? China tries to push its border into Ladakh but was pushed back by the Indians, is this not border expansion?

Taiwan? Yes, Taiwan was part of China, last when KMT was the government. CCP has never ruled Taiwan for a single day. So in terms of history yes Taiwan was part of China but not under the CCP's administration. Thus CCP is indeed expanding their rule into Taiwan.

Remember when our Terrexes was held in Hong Kong in late 2016? Singapore has been training with Taiwan under Project Starlight since LKY was PM. But when President Xi took office it wasn't an issue until Taiwan's newly elected pro independent president Tsai was inaugurated in early 2016. All of a sudden our military equipment has been taken hostage on the same year. Singapore has since been threading precariously politically and coerced into picking sides by the CCP. Being neutral meant picking the opposite side in the eyes of the CCP. Expanding into our borders? No. Expanding their ideology and influencing on how our government rule the country? Yes. 

Singapore needs diversity and neutrality in the world's stage to survive and prosper, we aren't even able to self sustain our population in terms of food supply. If we were to pick side it leaves us with less wiggle room to do internationally for cooperation.",t3_gsuia7,2020-05-30 04:46:23,DeftlyHallows,12
149,fs9x1qz,t1_fs8mm2c,Don't bother using facts against this guy. Seems like he's already set his mind that China is a friendly nation when literally the whole world is concerned about their aggression,t3_gsuia7,2020-05-30 12:14:36,InterimNihilist,4
150,fs8wdrz,t1_fs8mm2c,"Stay safe all during this period with Covid-19, due to certain mindsets and values... it can prove dangerous for the survival of us all regardles of which country you hail from.

❤ you all, stay safe and take care.",t3_gsuia7,2020-05-30 06:09:48,Strangeronthebus2019,-1
