post_id,,username,date_time,comments_raw
101587439,23610600,Lum Steven,"Dec 22, 2020","The PM, president and all the pap members can start vaccination tmr."
101587439,23610600,Arif Hossain Arif,"Dec 22, 2020",Thank you Singapore
101587439,23610600,NoreenHong Tangbau,"Dec 22, 2020",Thank you Singapore
101587439,23610600,Artra Scent Solutions,"Dec 22, 2020",Thank you Singapore 
101587439,23610600,Mdjahid Mdjahid,"Dec 21, 2020",Singapore always the best.
101587439,23610600,Daisy Kms,"Dec 22, 2020",Bes Chie Guzman yung kickvac dumating n ba? 
101587439,23610600,Yeong Ket Kho,"Dec 21, 2020",Well done 🇸🇬Singapore! 👏👏👏
101587439,23610600,Ptr Lawrence C Malangen,"Dec 22, 2020",LET God's Protection be with Singaporean in Jesus name
101587439,23610600,Sabta Wapunya,"Dec 22, 2020",So can remove mask ? 
101587439,23610600,Angelo Umar Alber Soria,"Dec 23, 2020",Very sad to the phil until now didnt produced
101587439,23610600,Jayanthi Ravi Iyer,"Dec 22, 2020",Well done Singapore👏👏👏
101587439,23610600,Arman Khandakar,"Dec 21, 2020",Thanks to all who are try to fight against this situation
101587439,23610600,Maung Myint,"Dec 22, 2020",Good government and good singapore people .
101587439,23610600,David Lim,"Dec 21, 2020","Timely to vaccinate the most important people in our nation, our leaders."
101587439,23610600,Vicky Del Arenal,"Dec 22, 2020","Thank you, Singapore!!! ❤️"
101587439,23610600,Maria Nope Maria,"Dec 21, 2020","Thank you, singapore🥰🥰"
101587439,23610600,Mhd Arif,"Dec 21, 2020",Singapore Always The Best
101587439,23610600,Kuni Chiwa,"Dec 22, 2020",I don’t want to be the ginnie pig.  Let other try first.   I will wait the vaccine is more stable.  
101587439,23610600,Mizanur Rahaman Mizan,"Dec 22, 2020",Thanks a lot for singapore prime minister
101587439,23610600,Marran Ramiah,"Dec 21, 2020",great give it to all frontliners first and those vunerables 
101587439,23610600,Darren Tan,"Dec 21, 2020","Congrats, a way forward to normality soon."
101587439,23610600,Hannah Faith,"Dec 22, 2020",Sana ol Singapore Retchelle Palmero Sangco Emie Deloy Ampong
101587439,23610600,Elise Chong,"Dec 23, 2020",Why is Grab incentivising customers to hang out in groups larger than 5 before Phase 3?
101587439,23610600,Nenek Leeya,"Dec 22, 2020",Singapore the best place to stay!! 😃
101587439,23610600,Md Faruk,"Dec 21, 2020",Thank you Singapore 
101587439,23610600,Erandima Malalgoda Kondasinghe,"Dec 22, 2020",Wow..well done Singapore 🇸🇬
101587439,23610600,William Cwm,"Dec 21, 2020",Hope go normal safely. Nothing wrong hopefully.
101587439,23610600,Md Rabbul,"Dec 22, 2020",Thinks to much.for Singapore.
101587439,23610600,Edith Harmer,"Dec 22, 2020",Promising! Optimism and Great shipping! 🎄🎍⚘⚘🙏🙏🙏🙏🙏🙏🙏🙏
101587439,23610600,Md Sujon,"Dec 22, 2020",Thanks for Singapore government. ..
101587439,23610600,Md Ala Uddin,"Dec 22, 2020",We always Love Singapore ❤️❤️❤️
101587439,23610600,洽宏,"Dec 22, 2020",Sats cargos ground handing team : bravo 👏 
101587439,23610600,KimMy Natalie Wee,"Dec 21, 2020",Thank God it’s voluntary. Not taking the vaccine ! 🥳
101587439,23610600,ChanDaro Nov,"Dec 21, 2020",Singapore the best
101587439,23610600,Tong Pakitong Kitong,"Dec 23, 2020",This could be us but Duque be playin 🇵🇭
101587439,23610600,Jodie Loi Wen Tian,"Dec 21, 2020",Wa the plane open liddis im shookt my head pain Glenvicia Sim
101587439,23610600,Theodore Walter,"Dec 22, 2020",Well hard-work of American and European research paid off
101587439,23610600,Cinta Abadi,"Dec 21, 2020",Ciayooo singapura is the best👍👍💪💪
101587439,23610600,Czarina Imperial,"Dec 22, 2020","This is wonderful, Singapore! 🤩"
101587439,23610600,Kayekhay Mae,"Dec 22, 2020",Community are excited but some of them also scared
101587439,23610600,Marissa Ubando,"Dec 22, 2020","Thnk u very much Singapore,great job "
101587439,23610600,Nasir Khan,"Dec 22, 2020",Smooth & reliable flight on SIA CARGO!!!🛫👍
101587439,23610600,Arockia Raj,"Dec 21, 2020",Thank you so much for Singapore 🇸🇬
101587439,23610600,Muhammad Sani,"Dec 21, 2020",I was there too..
101587439,23610600,Akira Ichi,"Dec 21, 2020",Me @ the vaccines : ALL I WANT FOR CHRISTMAS IS YOU 
101587439,23610600,Ric Joseph Murillo,"Dec 22, 2020",One word: sanaol! 🥺
101587439,23610600,Koong Si Jie,"Dec 21, 2020",水月。  Super efficient of SG. 
101587439,23610600,Sk Harun,"Dec 21, 2020",Congress Singapore 🇸🇬 ♥️♥️
101587439,23610600,Lye Chee Keong,"Dec 21, 2020",Thanks for the hard work 🥰🥰
101587439,23610600,Masyrukh Lionz,"Dec 22, 2020",Have a nice life whoever take the vaccine 🤌🏼
101587439,23610600,Eng Eng Galicia Te,"Dec 22, 2020",Buti pa sila Branded pa giud atoa diri sa Pinas ano kaya????Sana kung rich lang ta. Happy for Singaporeans Wow!!!talaga ang govt nila.Sana all
101587439,23610600,Diana Grace Moscoso Cu,"Dec 22, 2020",Ilove Singapore
101587439,23610600,Monarc Fusilero,"Dec 22, 2020",Hope this will be a goo start to bring back things to normal
101587439,23610600,Peter Hofmann,"Dec 22, 2020",Great news.. hv the announced the quantity received ?
101587439,23610600,Md Ahsan Ullah,"Dec 21, 2020",Good luck to Singapore
101587439,23610600,Mahabul Hasan Shadin,"Dec 21, 2020","Thank you, Singapore ❤❤"
101587439,23610600,Ben Leow,"Dec 21, 2020",Thank you Pfizer ! We will sing home at window and clap for you 😆
101587439,23610600,Joni Hossain,"Dec 21, 2020",I love Singapore 🇸🇬
101587439,23610600,Sonny R Gaya,"Dec 22, 2020",Singaporeans should be thankful to Sen. DUQUE without him wala sana kayong PFIZER'S Vaccine.
101587439,23610600,Haiman Khalid,"Dec 22, 2020",Wow all the 60% commenters make me sick
101587439,23610600,Koh Koh,"Dec 21, 2020",Yeah.. it works if only more than 70% of the whole world population vaccinated. Dreaming in lalaland.  
101587439,23610600,Andrew Wee,"Dec 22, 2020",OMG why no freezing. It’s to be -70 Degrees C. Oh oh vaccine unusable 
101587439,23610600,Viluzo Canezal,"Dec 22, 2020","I'm still on a wait and see mode, not yet."
101587439,23610600,Zoraya Borelly,"Dec 22, 2020",GRACIAS SINGAPUR 🇸🇬 🙏🙏🙏❤️❤️❤️❤️❤️
101587439,23610600,Long Lyl,"Dec 21, 2020",stock at SATS coolport
101587439,23610600,Robert Gordon,"Dec 22, 2020","Well done Singapore Government, First in Asia to receive vaccine."
101587439,23610600,Dennis Chan,"Dec 22, 2020",Thought it must be stored at -17°
101587439,23610600,Ken Lum,"Dec 21, 2020",Thanks you Singapore 👍🙏🌈
101587439,23610600,Fahad Ombra Abdullah,"Dec 24, 2020",Walking Dead is coming 😂
101587439,23610600,MD Minto Rahaman,"Dec 21, 2020",singpour is a great??
101587439,23610600,Running Man,"Dec 22, 2020",.....hmmm..... notice something.......anh juah long zhong gong ho is ....FT ...arhhh
101587439,23610600,Kong Borja,"Dec 22, 2020",Duquesne oh! Look what you have failed to do!
101587439,23610600,Ng Chee Fong,"Dec 21, 2020",疫苗大馬要二月份才有
101587439,23610600,Chrisjose Tw,"Dec 22, 2020",Get the testers to jab first. Then talk.
101587439,23610600,Ian Jaffar,"Dec 22, 2020",Now vaccine here pls open the Malaysia border...
101587439,23610600,Angelo Cornelio,"Dec 23, 2020",Meanwhile in the Philippines. 😂
101587439,23610600,Bryan Adam Pamatian,"Dec 23, 2020",It should have been 🇵🇭😔
101587439,23610600,Richard Kuan,"Dec 22, 2020",我相信人民行动党和其党员一定会以身作则。。。让我们以热烈的掌声鼓励鼓励
101587439,23610600,Princess Daniel,"Dec 22, 2020",But Thailand is still....😭🥲
101587439,23610600,Ely Borromeo,"Dec 28, 2020",Na ol. -Philippines
101587439,23610600,Eliza Felix Divina,"Dec 27, 2020",Laging kulelat ang phil.kawawa tayo.wrong choice of leadership ...
101587439,23610600,KhonMaung Tid,"Dec 22, 2020",ซื้อจากใหน
101587439,23610600,Mel Evangelista,"Dec 21, 2020",.buti pa kayo dyan...ah...toy joseph.....
101587439,23610600,Ankit Shah,"Dec 21, 2020",The moment all waiting for. People can the end this year with Smile & Hope. Thank You & Gratitude 🙇
101587439,23610600,Rayner Tan,"Dec 21, 2020",My backside is ready for the jab 
101587439,23610600,Martin Magpantay Jr.,"Dec 22, 2020",Sama isa po. Jho Rob 
101587439,23610600,Md Jaynal Hajare,"Dec 21, 2020",Alhamdulillah  Sg💕💕
101587439,23610600,Don NG,"Dec 22, 2020",I'm waiting for moderna's brand.
101587439,23610600,Bantillo Jowee,"Dec 23, 2020",SANA ALL🤣
101587439,23610600,Chester Almonte,"Dec 22, 2020",Paolo Maling nuod lang mga taga pinas
101587439,23610600,Jackie Wellies,"Dec 22, 2020",Thank you government and science for taking care of us. 
101587439,23610600,Philip Bisnon,"Dec 23, 2020",Department of Health (Philippines) oh diba? ang galing nila. Puro kasi kickback nasa isip nyo eh. NYETA
101587439,23610600,Lovess Garan,"Dec 22, 2020",Nakakaingit naman. Happy for them 
101587439,23610600,Noel Diestro,"Dec 22, 2020",Dri sa pinas mas gusto Nila sinovac! dapat Lang sla Yong Mauna isama si duque at mga DDS .. hahaaa
101587439,23610600,Seow Leng Tay,"Dec 22, 2020",Steady Pom Pi Pi
101587439,23610600,Nancy Dejager,"Dec 22, 2020",Singapore 🇸🇬 Rocks  Bert de Jager
101587439,23610600,Jesus David,"Dec 24, 2020",Sige mauna na kayo...panoorin namin ang epekto
101587439,23610600,Evelyn Abalos,"Dec 22, 2020",Ayan na...sana dito din sa.Pinas
101587439,23610600,Honeylyn Mabunay,"Dec 24, 2020",Moen Alcos maypa ilang pasko merry kaayo HAHAHHAHAHAHAHAHWHW ANG PILIPINAS TAWN.... 
101587439,23610600,Batoon Heaven,"Dec 22, 2020",Wow buti pa kau . . Sa japan wala pa pinag aarlan pa. . Kaya dumadami na naman ang corona. . Di pa sila ready sa  vaccine
101587439,23610600,Ianne Yan,"Dec 22, 2020",should I or should I not???
101587439,23610600,Camille,"Dec 23, 2020",Mark John Baisa babe meron na sila sa SG
101587439,23610600,Yi Ge,"Dec 22, 2020",掌声雷动给爱国爱民新加坡政府
101587439,23610600,Irene Chan,"Dec 22, 2020",I wont go for the vaccine..no thanks. Mite hv side effects for some ppl dont go for the risk.
101587439,23610600,Michael Agnote,"Dec 22, 2020",Melvin Agnote punta na ako dyan me vaccine na daw po😂
101587439,23610600,Janet Wale Mamawan,"Dec 22, 2020",Tita Maricon Mamawan magpa-vaccine na kami dyan? 😁
101587439,23610600,Niña Luvelyn Mongcal,"Dec 23, 2020",PHILIPPINES: KAILAN KAYA? HAHAHAHA
101587439,23610600,Kyrie Nivrae Borromeo,"Dec 23, 2020",Arly Puertes Mauna pa gyud bakuna.ba.wow..pwede na mg kiat hahhahahha
101587439,23610600,Julianne DC Bascara,"Dec 23, 2020",Daddy Jrameel Bascara tara na sa sg 
101587439,23610600,Muhammad Syazwan,"Dec 21, 2020",Suriana Jaafar  depa mai dah
101587439,23610600,Abigail M. Caisip,"Dec 22, 2020",Corz Navarro Magbanua mapapa sana all ka nalang talaga
101587439,23610600,Beatrice Pangindian,"Dec 22, 2020",Bernadette Iris naol naman
101587439,23610600,黄祖耀,"Dec 22, 2020",Need volunteers?
101587439,23610600,Rome Magboo,"Dec 22, 2020",thank you digong kulelat ang pinas
101587439,23610600,Pauie Sibal,"Dec 22, 2020",Carina Marie Abad paki sendan nalang kami 🥲
101587439,23610600,Paolo Gabriel Henson,"Dec 23, 2020",Jamie paturok na 🤣
101587439,23610600,Pat Mc Combs,"Dec 22, 2020",Tara Singapore? Timothy Cu 
101587439,23610600,Peggy Lai,"Dec 21, 2020",Ong Chee Hau  疫苗安全抵达新国
101587439,23610600,Josh Morata,"Dec 22, 2020",John Paul 747 ni?
101587439,23610600,Maisarah Roos,"Dec 22, 2020",Gaz Zalie Syafiee RoOslan Fiza Crimson orang pertama kena cucuk haha 
101587439,23610600,Wk Daniel Lim,"Dec 22, 2020","The privilege to get vaccinated first will be given to our PM, all ministers and their spouse. They've worked hard for us. Thank you."
101587439,23610600,RJ Flores,"Dec 22, 2020",Sana all na lang kami Julie-Ann Quarteros Tarrayo hahaha 
101587439,23610600,Lesley Gomez,"Dec 23, 2020",sis going✈️singapore na talaga tayo Luz Wendy Noble Seo Yerim Fem Dela Cruz
101587439,23610600,Harianne Sagum,"Dec 22, 2020",Patricia Abis  atin dapat to e
101587439,23610600,Noah IL,"Dec 25, 2020","Hi, will we be putting a bar on South Africa travelers? Please ref. https://youtu.be/NmfLkEuyWdo"
101587439,23610600,John Albert Gonzaga,"Dec 22, 2020",Te ging Dian Maricar Largosa 
101587439,23610600,Aof Bunrat,"Dec 22, 2020",Mu'mint LM hiso mak mak woww
101587439,23610600,Natalie Foo,"Dec 22, 2020",Wei Ting u jab?
101587439,23610600,Jane Abianza,"Dec 22, 2020",Julianne Abianza lruan ni nonoy..
101587439,23610600,Sola Folklore,"Dec 22, 2020",Omggg SG your r leader of Asia what happed with my dirty country ? 😓😓😓
101587439,23610600,Chamblee Shawn,"Dec 22, 2020",Love Singapore someone need to come take me along lol. I love great leaders that cares for it citizen one love Singapore.
101587439,23610600,Nguyễn Đan,"Dec 22, 2020",Sang Nguyễn xịn ghê! 🥲 
101587439,23610600,Jayvee Ubaña,"Dec 27, 2020",Angelica Camille naol nalang talaga no
101587439,23610600,Jennifer L. Morante,"Dec 22, 2020",Cheliza Ambas balik ka na raw. 😊
101587439,23610600,Ma Liza Coralyn Mundo,"Dec 25, 2020",Lotty Grande  Ganito sana tayo sa January kaso... 🙄
101587439,23610600,Arindam Biswas,"Dec 22, 2020","Congratulations to Singapore Government for this wonderful achievement.  Kudos to you the way you successfully managed the covid situation. Singapore shown the world how to maintain all norms to keep people safe & battle this against the pandemic having lowest infection and mortality rates in the world while on the same time able to financially maintain and and support the entire population, businesses without any disruption. Well done!!! Thankful and grateful for all you have done to protect our lives and keep us going. Thank you so much Singapore. 🙏❤️🇸🇬"
101587439,23610600,Elvis Kelmendi,"Dec 21, 2020","Congratulations to the Government  of Singapore for this wonderful achievement.  The way you successfully led this Country  and People thorough this battle against  the pandemic which presented itself in the World mantaining one of the lowest infection and mortality rates in the world while on the same time despite having no natural resources were able to financially mantain and continue to mantain and support the entire population, businesses at normal levels without borrowing a single cent so too mamaged to be the first country in Asia and among the first in the World to recieve the first batches of vacciness. Action speaks volumes and reflect the excellent level of Governance. Well done. Gold standart indeed.  Singapore may not have natural resources but it has the best assets- that is the Government and the People. Amazing indeed. Forever thankful and grateful for all you have done and continue to do to protect our lives and keep us going. I am ready to sign up for vaccination whenever you want me to. Thank you so much Singapore. ❤️🇸🇬"
101587439,23610600,Grace Joseph,"Dec 22, 2020","Wow.... well done singapore 🇸🇬 We have to said thank you so much to the singapore front liner to those who made this happen Great Job singapore and PM Lee, Singapore is always the first and best rest of Asian...we're always feel safe here because of government work harder for us..we love Singapore."
101587439,23610600,Sathis Kumar,"Dec 22, 2020",Thank you Minstry of Health for taking care sharing the good and interesting of the new arrival of the new vaccines in Singapore.
101587439,23610600,Md Nur,"Dec 21, 2020",Singapore always the best in the world.
101587439,23610600,Zaini Abdol Rahman,"Dec 22, 2020",Shd we vote for the Ministers to vaccinate first? Coz its only 50 - 60 percentage possibly of immune to covid-19... What are the side effects? Diff body haf diff reaction...
101587439,23610600,Sheikh Imran Hossain,"Dec 22, 2020","Live in singapore very proud, thanks to prime minister."
101587439,23610600,KS Neoh,"Dec 22, 2020","Up to now, no one, not a single person in the entire world has questioned why the storage needs to be a such a low temperature of -80C.  What exactly is happening?  And at 2 deg C to 8 deg C for 5 days, what happens to the vaccine?   Will degradation take place?  The human body temp is around 36.5C to 37C, so after the injection won't the vaccine be destroyed?  MOH owes the nation an answer to these questions."
101587439,23610600,Ronald Lim,"Dec 22, 2020",Let those who approve the vaccine be the first to take it together with their family. They deserve it more!
101587439,23610600,Hong Ng,"Dec 22, 2020",We should thank President Trump for pressuring the vaccine producer to produce a.s.a.p. so that we can now start to resume enjoying life
101587439,23610600,Tan Kok Tim,"Dec 22, 2020","Vaccinating the whole world's population to stamp out this virus is a huge task. 7b shots of the vaccines.  Slow economic recovery or could be more a case of disturbing uncertainty that is prolonged with no clear direction or focus. So long as this virus is alive on earth among human beings, no place is safe. . ....................... Mask-wearing and safe distancing ….do we see the bigger picture to prevent community transmission of the virus?  The vaccine is not a cure but a preventive measure.Will red dot encourage the UN and the WHO to do this: the UN and WHO should get all countries to cooperate and shut down for 40 days and 40 nights to stamp out COVID-19?  The best of time is now for the countries in the northern hemisphere during this wintry period [Christmas, New Year 2021, and the Chinese Lunar New Year holidays] to shut down for 40 days [like in the olden days of the leprosy infection to quarantine the new arrivals until the all-clear signal to let them out].Now is the time to do just that for the all-clear of infected persons to stamp out COVID-19 and force it to have a natural ending.  As for all other countries, those at the equator and those in the southern hemisphere [summer time], all should unite and comply to shut down too for 40s day to stamp out this disease well and good. Can the UN and WHO obtain this universal cooperation by all countries around the world to shut down this earth for 40 days and 40 nights at the same time? Time for the whole world to go into hibernation for 40 days. If we don’t, do we want to continue with the madness for another 400 or more days worldwide affecting the economy and all aspects of human lives? Choose wisely to have a suffering of 40 or 400 days physically, mentally, economically and socially, or do we want more than 400?"
101587439,23610600,Kazi Abdullah Al-Imran,"Dec 21, 2020","*We have procured enough vaccines for all Singaporeans and long-term residents in Singapore to get vaccinated by end 2021, if there are no unforeseen disruptions to vaccine shipments. *  Owaooo. Have you forgotten about the migrant workers? If you don't have any plan, then I must say you are committing racism. #healthministrysingapore"
101587439,23610600,Sam Lowell,"Dec 21, 2020",A silver lining!  May our nation be blessed this season as well as the year to come! 
101587439,23610600,Zeuu Uus,"Dec 22, 2020","Remember the ""cure"" of pandamic virus now available but hey its voluntary so whatever happens you are still at your own cost LOLOL. Hmmm🤔🤔  Whatever that is inside that vaccines will just be another trouble. Make you weaker. Make your body depend on drugs. Ouh well time will tell.   A new virus is coming. Covid will already be the passed. Too late to take the vaccines for nothing so if you are already better now so be it you are immune and strong to covid.  Most people that say its good and awesome Singapore yada yada here are mostly not local. Hahaha thats why.... They dont know the real problem. Cause the locals would advocate."
101587439,23610600,欣婷,"Dec 21, 2020",Wonderful Christmas gift. Thank you Singapore🇸🇬
101587439,23610600,Ray Has,"Dec 22, 2020",Of this vaccine really works why the number in us still increased?
101587439,23610600,Jenebeth Pretal,"Dec 21, 2020",Congrats and Thank you Singapore!
101587439,23610600,Galivar Momtazur,"Dec 21, 2020",We are so proud of Singapore and it’s leaders. Well done Mr Lee and his team!❤️❤️
101587439,23610600,Hanif Hanif,"Dec 22, 2020","Thank you, SG government for the procurement that all Singaporeans & residents can be vaccinated👏🏻👏🏻God bless🙏🇸🇬"
101587439,23610600,Ma Ma Myat,"Dec 21, 2020",Congratulations to Singapore 🇸🇬
101587439,23610600,Nz Nizam,"Dec 22, 2020","We are so proud of Singapore and it's leaders,Well done Me Lee and his team!!!❤❤❤❤"
101587439,23610600,June Ho Ei Lin,"Dec 22, 2020",Thank u SG GOVT for free vaccine for all Singaporeans/PR/Migrant workers...truly now is the test of Faith by the GOVT n let's all hope n pray pandemic will be over soon in 6 mths or 1 year back to normal n that all will have no negative reaction from the jab n that message will be clear for people indicated simple  to understand what symptoms OR health issues they have that cannot have the jabs especially old folks on medication...STAY SAFE EVERYONE
101587439,23610600,Ronald Leyco,"Dec 22, 2020",Kudos to the very efficient and effective government of Singapore ❤
101587439,23610600,KO KO SI,"Dec 21, 2020",Thank you Singapore 🇸🇬 Singapore 🇸🇬 
101587439,23610600,Nilzar Terrex,"Dec 23, 2020",Priority for front liners especially medical professionals and researchers followed by Emergency responders and armed forces. Singaporeans and PRs are next whilst others wait.
101587439,23610600,Nhe Artates,"Dec 22, 2020",Good job Singapore always the best 👍
101587439,23610600,Kumari Alka Sinha,"Dec 22, 2020",Big Thank you to those who made this possible ❤
101587439,23610600,Mishti Malhotra,"Dec 22, 2020",THANK YOU SINGAPORE  🇸🇬  LV MY COUNTRY
101587439,23610600,Glenda Bautista Sobejana,"Dec 21, 2020","Awesome! Well done, Singapore! 👏👏👏 "
101587439,23610600,Ibrahim Joy,"Dec 21, 2020",Congratulations to Singapore 🇸🇬
101587439,23610600,Sheikh Mojahidoll Islam,"Dec 21, 2020","Congrats, a way forward to normality soon."
101587439,23610600,Erwin Lizada,"Dec 24, 2020",During 1918 Influenzia..Doctor general did an autopsy on a patient of said Influenzia Virus..They discover it was POISONED all deaths are Recipient of the PHUEMONIA VAXXINE that they are invented.. IT WAS VAXXINE POISONING  no VIRUS.. VIRUS NEVER EXIST as diseases.... SEEK THR TRUTH
101587439,23610600,Rasel Araman,"Dec 22, 2020",We are so proud of Singapore and it’s leaders. Well done Mr Lee and his team!🙏🙏🙏🙏❤️❤️
101587439,23610600,Jyoti Sharma,"Dec 21, 2020",Well done to the government of Singapore 👍🙏.
101587439,23610600,Jimmy Kris,"Dec 22, 2020","Singapore will always be successful. Meritocracy, all races are the same, rule of law and heart to serve, these are the qualities make u successful. "
101587439,23610600,Dampire Teo,"Dec 22, 2020",I don't want it. Don't make it compulsory.
101587439,23610600,Avi Dip,"Dec 21, 2020",Well done singapore  ❤️❤️❤️❤️
101587439,23610600,Mahmud Rasel,"Dec 22, 2020","Thank you, Singapore government  👍💖"
101587439,23610600,Nilzar Terrex,"Dec 23, 2020",Thank you all front liners. Hope this govt vaccinates all front liners followed by citizens and PRs. Priority for citizens and PRs.
101587439,23610600,Ethel KOi De Pauline,"Dec 22, 2020",Duque is waving from the philippines!!
101587439,23610600,Joyce Legaste,"Dec 22, 2020",Carla Villavecer sana all nalang
101587439,23610600,Mae Batalla,"Dec 22, 2020",sana all Mariel HAHAHA
101587439,23610600,Neril B Aguillon,"Dec 22, 2020",Nette C. Mike may vaccine na kami dito! 🙆‍♀️
101587439,23610600,張國新,"Dec 22, 2020",在没貨戴，只貨倉養鳥
101587439,23610600,Alberto Gino Barret,"Dec 23, 2020",Kawawang pinas. PH government is trash.
101587439,23610600,Jasmin Caronan,"Dec 22, 2020",Sana all Dean Kervynjay Susa Vergara
101587439,23610600,Rexes,"Dec 27, 2020","Clarizza Carandang uwi na may vaccine na, baon ka nalang pag balik mo HAHAHAHHAA"
101587439,23610600,RJ V. Abellanosa,"Dec 22, 2020",Boshing Boshing maka uli naka 😍
101587439,23610600,Mia Karin Martinez,"Dec 22, 2020",https://childrenshealthdefense.org/defender/alaska-healthcare-workers-allergic-reactions-pfizer-covid-vaccine/?fbclid=IwAR2zDD1A_oyAiqm9xJI_WYpwhukngNQa7LVUh1-J5T_AnD8GCzKfxBesguc
101587439,23610600,Aly Balagat,Jan-06,Zedryx Malabad
101587439,23610600,Vince Harvey Montano,Jan-04,Charissa Canlas
101587439,23610600,Alexandra Nicole Fulgencio,"Dec 30, 2020",Martin Cahiles
101587439,23610600,Gwen Pee,"Dec 30, 2020",Limberella Borres Victor 
101587439,23610600,Clarisse Manalastas,"Dec 28, 2020",Jude De Guzman Jenny Rose de Guzman 
101587439,23610600,Christan,"Dec 28, 2020",MAPAPASANAALL KA NA LANG!
101587439,23610600,John Izaach Baliuag,"Dec 28, 2020",Andrea Dabuet
101587439,23610600,Jem Rada,"Dec 28, 2020","Agot, baka naman pwedeng vaccine na lang ipasalubong mo sa'min ni Lanz merikurisumasu hapnyuyir 🤣"
101587439,23610600,Reggie Maki Pascual,"Dec 28, 2020",Regine Narciso Manalo bessss
101587439,23610600,Sharm Morante,"Dec 27, 2020",Ynreb Ramos 
101587439,23610600,Norzalon Unas,"Dec 27, 2020",Elorah Garcia Unas 
101587439,23610600,Σαμ Μπεκμ,"Dec 27, 2020",Jessica
101587439,23610600,Almira Caryl Tangpos,"Dec 27, 2020",Dan Caballero naol
101587439,23610600,Katrina Alyssa Simpao - Bayate,"Dec 27, 2020",Sana ol
101587439,23610600,Dianne Medina,"Dec 27, 2020",Xanise Alysa Perez sana ol
101587439,23610600,Pusong Mamon,"Dec 27, 2020",Thanks God I'm from Philippines But my Heart is like Singaporean .I hope That Singapore is will be Ok Soon 😊 Singapore is my Dream Place 😘🥰🥰🥰🥰
101587439,23610600,Marié Eleanor Bojocan,"Dec 27, 2020",Cedric Nomer Pimentel Caoile
101587439,23610600,CM Brufal,"Dec 27, 2020",Sana all
