post_id,,username,date_time,comments_raw
101587999,22900600,Yan-Dan Vincent Sophie Kai,Jan-14,Thank you!
101587999,22900600,GongMing SunTze,Jan-14,"Bravo to our Singapore's DYNAMIC DUO!  👍👍👍👍👍!  👏👏👏👏👏!  THANK YOU Minister Gan & Minister Wong!  THANK YOU for leading our Country's Task Force in battling the Covid 19 virus, contained its spread & kept Singapore, Singaporeans & our Foreign Friends WELL & SAFE!  From a Singaporean!  From a Citizen Soldier!  😎😊"
101587999,22900600,Teng K.S.,Jan-14,Well done Singapore
101587999,22900600,Taiyo Sona,Jan-14,"Morning inject, afternoon Go"
101587999,22900600,Rick Fernandez,Jan-14,Jasmine Lu
101587999,22900600,John Lum,Jan-14,Free ? 
101587999,22900600,Jimmy Seah,Jan-14,Thx u for all that you have done ! Grateful for dedicated public service leaders!
101587999,22900600,Le Tian Tian  乐 甜 甜,Jan-14,👍 💉 
101587999,22900600,Veronica Chin,Jan-14,Ricky Tan
101587999,22900600,Kaniyamkudy Isac,Jan-14,Thanks lot our government is great take care us very well 
101587999,22900600,Ooi Ah Yong,Jan-14,感恩李总理心宽，爱载人民，外劳也受惠，新加坡了不起，
101587999,22900600,Dalang Wu,Jan-14,水
101587999,22900600,Sumaiya Ali,Jan-14,Adil Aftab
101587999,22900600,Abigail Sim E Xuan,Jan-14,I tot why cch ppl giving Jab Sng Ler Jun Tan Zhen Yuan Don Seah Tan GuanYu xD
101587999,22900600,Leo Sim,Jan-14,Ok.
101587999,22900600,Kang Tiam Ming,Jan-14,Www.amitadbha.com!
101587999,22900600,Polakitan Jereme,Jan-14,Thank you!  Good  Health!
101587999,22900600,Tanushree Sinha,Jan-13,Abhineet Mattoo
101587999,22900600,Stefano Menenti,Jan-13,Dajeee 
101587999,22900600,Ho Soo Kit,Jan-13,Thanks. Good Health!
101587999,22900600,Ben Thuthy,Jan-13,Muhammadh Rafeeu Vincere Alyf
101587999,22900600,Pavel Kuznetsov,Jan-13,Good luck to you people :)
101587999,22900600,Aspa M Hatta,Jan-13,Ok
101587999,22900600,Shi Xian,Jan-13,Jun Mun
101587999,22900600,Lee Chin,Jan-13,Ja De
101587999,22900600,Safarullah Bin Mohd Rasheed,Jan-13,Take care.
101587999,22900600,Ñåsëêb Jãñ,Jan-13,Wo nicely thank you
101587999,22900600,Pulakeshi Chakrasali,Jan-13,👌
101587999,22900600,Jesper Lau,Jan-13,Congratulations🥇
101587999,22900600,Kelvin Goh,Jan-13,Pm
101587999,22900600,Yvette Tan,Jan-13,Well done!👍
101587999,22900600,Kumaresan Udayappan,Jan-13,Great Sir 👌👍
101587999,22900600,Mar Mar Yee,Jan-13,Thank you .
101587999,22900600,Kia Huat Tan,Jan-13,👏🙏🙏
101587999,22900600,Joe Power,Jan-13,"Up to you to decide.  IT'S NOT LOOKING GOOD FOR THE PFIZER VACCINE. ⬇️⬇️  FROM THE CDC;  3,150 people vaccinated in ONE DAY are ""unable to perform normal daily activities, unable to work"" after vaccination.   This is a massive 2.7% of people who can no longer work after having the Pfizer vaccine.  https://www.cdc.gov/vaccines/acip/meetings/downloads/slides-2020-12/slides-12-19/05-COVID-CLARK.pdf   Portuguese health worker, 41, dies two days after getting the Pfizer covid vaccine as her father says he 'wants answers' https://trib.al/eEWi66p   Mexican doctor hospitalized after receiving COVID-19 vaccine https://www.reuters.com/article/health-coronavirus-mexico-vaccines-idUSKBN2970H3  Hundreds of Israelis get infected with Covid-19 after receiving Pfizer/BioNTech vaccine. https://www.rt.com/news/511332-israel-vaccination-coronavirus-pfizer/   Wife of 'perfectly healthy' Miami doctor, 56, who died of a blood disorder 16 days after getting Pfizer Covid-19 vaccine is certain it was triggered by the jab, as drug giant investigates first death with a suspected link to shot. https://www.dailymail.co.uk/news/article-9119431/Miami-doctor-58-dies-three-weeks-receiving-Pfizer-Covid-19-vaccine.html   75-year-old Israeli man dies 2 hours after getting Covid-19 vaccine. https://www.israelnationalnews.com/News/News.aspx/293865   Death of Swiss man after Pfizer vaccine. https://www.reuters.com/article/us-health-coronavirus-swiss-death-idUSKBN29413Y   88-year-old collapses and dies several hours after being vaccinated. https://www.israelnationalnews.com/News/News.aspx/293952   Thousands negatively affected after getting Covid-19 vaccine. https://m.theepochtimes.com/thousands-negatively-affected-after-getting-covid-19-vaccine_3625914.html   Hospital worker with no prior allergies in intensive care with severe reaction after Pfizer Covid vaccine. https://metro.co.uk/2020/12/16/hospital-worker-in-intensive-care-after-suffering-severe-allergic-reaction-to-covid-vaccine-13763695/   4 volunteers develop FACIAL PARALYSIS after taking Pfizer Covid-19 jab, prompting FDA to recommend ‘surveillance for cases’. https://www.rt.com/usa/509081-pfizer-vaccine-fda-bells-palsy-covid/   Investigation launched as 2 people die in Norway nursing home days after receiving Pfizer’s Covid-19 vaccine. https://www.rt.com/news/511623-norway-covid19-vaccine-deaths/  Hundreds Sent to Emergency Room After Getting COVID-19 Vaccines https://m.theepochtimes.com/hundreds-sent-to-emergency-room-after-getting-covid-19-vaccines_3644148.html  U.S. officials report more severe allergic reactions to COVID-19 vaccines. https://www.google.com/amp/s/mobile.reuters.com/article/amp/idUSKBN29B2GS   NHS told not to give Covid vaccine to those with history of allergic reactions. https://www.google.com/amp/s/amp.theguardian.com/world/2020/dec/09/pfizer-covid-vaccine-nhs-extreme-allergy-sufferers-regulators-reaction  COVID-19: Single vaccine dose leads to 'greater risk' from new coronavirus variants, South African experts warn news.sky.com/story/amp/covid-19-single-vaccine-dose-leads-to-greater-risk-from-new-coronavirus-variants-south-african-experts-warn-12180837   CDC reveals at least 21 Americans have suffered life threatening allergic reactions to Pfizer's COVID vaccine www.dailymail.co.uk/health/article-9119029/amp/At-21-Americans-life-threatening-anaphylaxis-receiving-Pfizers-vaccine-CDC-reveals.html   Woman experiences side effects of COVID-19 vaccine www.everythinglubbock.com/news/local-news/woman-experiences-side-effects-of-covid-19-vaccine/amp/   COVID Vaccine Side Effects More Common After 2nd Dose. www.boston.cbslocal.com/2021/01/05/covid-vaccine-side-effects-fever-reaction/amp/   Bulgaria Reports 4 Cases Of Side Effects From Pfizer Covid Vaccine. www.ndtv.com/world-news/bulgaria-reports-4-cases-of-side-effects-from-pfizer-covid-vaccine-2347667%3famp=1&akamai-rum=off   Two NHS workers suffer allergic reaction to Pfizer vaccine. https://www.google.com/amp/s/www.telegraph.co.uk/global-health/science-and-disease/coronavirus-news-vaccine-pfizer-nhs-oxford-covid-uk-cases/amp/"
101587999,22900600,Joe Power,Jan-13,Good info. Up to u to decide.  https://youtu.be/7lnnEiUc9xw
101587999,22900600,Koo Wee Boon,Jan-13,一路好走
101587999,22900600,Wei Sung,Jan-13,FT WY
101587999,22900600,Rohanah Hassan,Jan-13,Good luck all.
101587999,22900600,Dennis Wai,Jan-13,Show time
101587999,22900600,Debarchana Chatterjee,Jan-13,Amarnath Banerjee
101587999,22900600,李胜添,Jan-13,Lynn Ng 
101587999,22900600,Yong Yokemei,Jan-13,"Thank you, Thank you."
101587999,22900600,Md Masud,Jan-13,Good job
101587999,22900600,Hani Hussain,Jan-13,lets do it...lets go...
101587999,22900600,Duong Lin,Jan-13,Heo Ham Ăn
101587999,22900600,Duong Lin,Jan-13,Adam Tay Poh Leong
101587999,22900600,Duong Lin,Jan-13,Duong Thao My Jade
101587999,22900600,Duong Lin,Jan-13,Tina Nguyen
101587999,22900600,Duong Lin,Jan-13,Nguyễn Quânn
101587999,22900600,Paulyn Smile Jordan,Jan-13,Bosco Lee 
101587999,22900600,Christian Canete Eraya,Jan-13,Sam Iue Ting 
101587999,22900600,Kien Ong,Jan-13,"yes, Lawrence u set a good example, I'm proud of you.  Cheers 😗"
101587999,22900600,Aiyan Samiyappa Aiyan Samiyappa,Jan-13,Great Sir
101587999,22900600,Rhys Brown,Jan-13,👍🏼
101587999,22900600,CtJas Ridzwan,Jan-13,Yvonne Goh  ur turn gonna be soon🤣🤣🤣
101587999,22900600,Sk Sagor,Jan-13,Good
101587999,22900600,Lau Bee Bee,Jan-13,❤️SG United 👍👍👍
101587999,22900600,Ai Rin,Jan-13,Nat Rin 😊
101587999,22900600,Andy Ong,Jan-13,👍
101587999,22900600,Mike Gee Port,Jan-13,Thank you for your work and support 
101587999,22900600,Dizen Mondal,Jan-13,all tha bast
101587999,22900600,Priti Bathla,Jan-13,Sameer Kochar
101587999,22900600,Acit Setan,Jan-13,I dun want to see all this stupid face.
101587875,47275600,Ashok Kumar,Jan-08,Can more be done to educate the public on what is meant by medically eligible? Will it be a medical assessment done immediately prior to getting the vaccination on-site or is there be an eligibility assessment carried out much earlier before a vaccination appointment can be made.
101587875,47275600,Paskal Raj,Jan-08,My big salutation to PM and his followers who got the vaccination. An extraordinary role model for everyone in humanity. 👍👏👏
101587875,47275600,Phang Carol,Jan-09,Thank u very much PM Lee and his term for giving very gd example to us by taking the vaccine. Allows the public to know that is safe.🙏
101587875,47275600,Neo Bart,Jan-08,"Appreciate so much to our government for being able to bring in Covid 19 vaccines at such short period. And that most of us are able to benefit from it, especially the frontline staff and the vulnerable ones 🙏🙏🙏"
101587875,47275600,Marc Fritz,Jan-08,PM Lee continues to amaze me! Some leaders of some countries don’t lead by example. Kudos! ☺️🙏🏻
101587875,47275600,Andrew Simpson,Jan-08,When will clear directions be given for the general vaccination of all Singaporean s and long term residents
101587875,47275600,Sakura Siow,Jan-08,"May I know what it means to be ""medically eligible""? It would be good if MOH provides a list of medical ailments that would deem a candidate non-eligible. Also, are we required to have a medical assessment by a doctor before confirming eligibility? If so, what sort of health check assessment would that be?"
101587875,47275600,Paul Wang,Jan-08,Set an exemplary  for our Singapore 🇸🇬 population to be vaccinated ! . Waiting for the covid 19 vaccination to be launched sooner than  later ! . The vaccine is not a passport to fighting  the coronavirus  ! . Stay at home ! .
101587875,47275600,Tia Traazil,Jan-08,MR CHNG... GLAD YOU ASK ''WHO PAYS F TREATMENT IN CASE OF SIDE EFFECTS?... ACTUALLY MOST OF THE TIME... ONE SUFFER ALONE WHEN IT COMES OF SIDE EFFECTS ... SEEKING TREATMENT MIGHT ENDANGER & COMPRIMISE OUR HEALTH ... MORE DRUGS?!?!?!?! AGREE??
101587875,47275600,Chua GK KG,Jan-09,Pm lead by example to our citizens. We're all together one Singapore.
101587875,47275600,Nora Safar,Jan-08,Wow.. no gloves needed....*Applaud*  even if wayang² also must set proper example what...
101587875,47275600,Daniel Tan,Jan-08,Somehow I see many unconvinced netizens on how realistic this is.. trust is so hard to get back once it's broken..
101587875,47275600,Suzanne Qiu,Jan-13,"Dear MOH, it seems some ""Health Care"" frontline workers have said (today)  they would ""wait and see"" ; they fear possible long-term effects... Please allow them to ""queue again "" but after all people awaiting vaccination have had theirs. They can have another chance, but AFTER us. They shouldn't be prioritized more than once. One young Doc was among them. I remember one particular young Doc dying in early days of Covid in Wuhan. He was (sadly)  accused of spreading fake news."
101587875,47275600,Wenzheng Yeo,Jan-08,Wow same nurse throughout...must be super stress
101587875,47275600,Elaine Kwan,Jan-08,"Reckon it makes sense and it will also put the General Public at ease to know that before getting the jab, we will be screened by a Dr. to confirm that we are medically eligible and fit base on our medical history to take the vaccine.   Else there are vast public still having doubt and confident on the vaccine due to the side effects cause by the vaccine."
101587875,47275600,Desmond Choo,Jan-08,"I took the screenshot from it. There is blk label 04/2021 on it, that shall be the expiry date. But do not know why it is in milky color"
101587875,47275600,Tay Kim Swee,Jan-09,Clean the air and make sure everyone wear their masks properly. Vaccines is not confirmed 100% cure...please make sure the patients put on mask and the nurses pit on the correct PPE and glove. DO NOT BE COMPLACENT...only need 1 to spread to whole nation if regulations is altered and not forcefully enforced under cameras and interviews.
101587875,47275600,Galen Loh,Jan-08,Y no minister follow?tot they lead Singapore!
101587875,47275600,Lum Steven,Jan-09,I am going to ask for one last time. Give me the 5 years of data on the vaccine. Be transparent.
101587875,47275600,Shrikanth Srk,Jan-08,Thank you Singapore for making the vaccine voluntary and not mandatory... Vaccines are not completely safe and they do come with serious side effects.. lots of children worldwide has suffered lifelong vaccine injury especially in India and Africa .. hence there is still a fear when it comes to accepting vaccines for many individuals..
101587875,47275600,Nelson Kwei,Jan-08,PM has set a very good example. The cabinet should follow too in order to convince Singaporeans to take the vaccine. 
101587875,47275600,Solan Iron Kkeeran,Jan-08,Health workers or the frontline workers first or the other way round
101587875,47275600,Simon Siva Ynwa,Jan-08,1st nurse not wearing gloves 🧤 then is this the COVID-19 vaccine or not 
101587875,47275600,Stylo Mylo,Jan-08,Why nurse not wearing any glove me work at Hospitalty need to wear gloves for handling food and service. 
101587875,47275600,Khoo Boon Liang,Jan-08,Never wear glove when handling injections.....!!!!
101587875,47275600,Jöanna Chew,Jan-08,Hi Nurse do you feel very stressful to be in charge of PM's vaccination? D:
101587875,47275600,Sasha Blak,Jan-08,Hopefully as a migrant worker here we can avail a vaccine too even we pay the cost for our own protection.
101587875,47275600,Chng HK David,Jan-08,Who pays for treatment in case of side effects ?
101587875,47275600,Chua Swee Hua,Jan-08,Thank you Mr PM Lee Hsien Loong for stepping up to take up in the Public Care from MOH for the safety sake of the COVID 19 Jab for each other 
101587875,47275600,Lin Xiu Yao,Jan-08,Will we get to use our own lunar cov19 vaccine in near future.
101587875,47275600,Lisa Tan,Jan-09,"Unless I get to choose the vaccine, I won’t go for it after hearing what happened to some who were jabbed with Pfizer."
101587875,47275600,Andrew LI,Jan-10,Are our experts immune to COVID-19? None of these 4 gentlemen were wearing masks in the panel discussion. Were they immunised with the vaccine? Are they not violating the SMM regulations? Or is this a new normal for Phase 3? Where are the regulations that allows not wearing masks when talking to each other within close distances? Are these experts endorsing not wearing masks in discussions within close distances?
101587875,47275600,Ronny Pikes,Jan-08,I still feel.she should wear  a visor and glove
101587875,47275600,Sarah Mangeet,Jan-08,Just wondering if safe not to use gloves while administering the vaccine? Hope all goes well though. Not east task for frontliners... salute!
101587875,47275600,Roslindah Ahmad,Jan-08,If a person allergic to Panadol can he or she take the vaccine
101587875,47275600,Rosli Pakngah,Jan-08,Why is the nurse not wearing gloves to protect PM from being infected by germs she might have on her hands?
101587875,47275600,MsBebe MrDevry,Jan-08,Why everyone questions abt why never gloves 🤣 no gloves needed for injections 🤦
101587875,47275600,Jagdish Sandhu,Jan-08,Why isn't the nurse wearing any gloves.
101587875,47275600,Ronny Pikes,Jan-08,Why the nurse not wearing gloves ah ....so unhygienice
101587875,47275600,John Tan,Jan-09,"I think that when any leader in charge of a country is the first to get a new vaccine, it is a good thing. This allows the general public  to know that the vaccine is safe"
101587875,47275600,Edward Goh,Jan-08,Hopefully he get very bad side effects amd repprt straight to the underworld and i will be celebrating
101587875,47275600,Tianhong Tianhong,Jan-08,"Got vaccine u volunteer first one to take la.. when this pandemic started, why u dun volunteer to take a pay cut??? Since u are the highest earning government in the WORLD!!! #justsaying"
101587875,47275600,Ivan Goh,Jan-09,Hmmm.... did he take the US vaccine or China's?
101587875,47275600,Kevin Soh,Jan-08,Bravo. PM Lee. I want to be vaccinated with the same mRNA vaccine that PM Lee is getting.
101587875,47275600,Recon Refresh,Jan-09,How about other minister? President? Hmmmmm.... vvip?
101587875,47275600,Nimmakayala Veeraswamy Naidu,Jan-10,Really very good  time  to started  covid 19 vaccine who waiting to Singapore  flyThank you Singapore
101587875,47275600,Riduan Rahim,Jan-09,Is the vaccine proven effective or is it a desperate move to give assurance to the citizens?   The flu 💉 i took when i was a kid didn’t work on me. The chicken pox 💉 when i was a kid didn’t work either so this vaccine will work? 
101587875,47275600,Abd Arazak Niw,Jan-08,How Abt the rest of the ministers?
101587875,47275600,Tay Kim Swee,Jan-10,I hope really got people read and action on it...especially for all the importing cases coming back...are they make know and firmly taught to wear their mask properly and all the necessary steps needed to be in Singapore??? Please do not bring in their thought of democracy during this pandemic situation..they can do it back at their own infected land. Law enforcers should do their rounds to enforce on it...not easy for the safe distance ambassadors at times.
101587875,47275600,Roslindah Ahmad,Jan-08,"Is this vaccine safe for ppl who had medical history e,g , heart lung cancer high blood or other critical medical treatment"
101587875,47275600,Sue Lee,Jan-08,How long will the efficacy of the vaccine?
101587875,47275600,欣婷,Jan-09,Thank you Mr PM Lee Hsien Long for stepping up to take the inject. But.. why the nurse never wear glove when handling injections.....!!!!
101587875,47275600,Sajal Ashfak Aman,Jan-08,when we workers get the covid-19 vaccine sir?
101587875,47275600,Sharingan Ismadi,Jan-08,"Vaccination is a certainty but since people won't be able to choose which vaccine they will get, confirm will have complains from singaporeans who cannot get pfizer especially the parents demographic."
101587875,47275600,Sarjan Has,Jan-09,Hope they DON'T forget Security officers on duty and also the top frontline to make things better and in control😊😊😊. Involved in green to red zone and facing all kinds on challenge from public harrassment.
101587875,47275600,Rodney Wee,Jan-08,No surgical gloves?
101587875,47275600,Doris Lee,Jan-09,Congrats! How about people with allergy ?
101587875,47275600,Faz Aron,Jan-08,Educate me please....is this vaccine an antidote or prevention?  Or is it both?
101587875,47275600,Roxanna Hidalgo De Hamel,Jan-08,PEOPLE WITH CANCER OR ANY OTHER SERIUS SICKNESS ALLOW TO PUT THE VC19?????
101587875,47275600,Paul Wang,Jan-08,The covid 19 vaccination does not protect you from the coronavirus infection ! . The vaccines can only relieves your symptoms.  Chances are your body resistance and the immune system will develop the antibodies to fight the virus ! . However  it is much easier than done !   A rare opportunity  that a person may develop allergic reactions and may die from the virus especially  a woman had died after  2 days being vaccinated with the Pzier  vaccines  ! .
101587875,47275600,Medi Cengfu,Jan-08,Hopefully Singapore will recover back to normal....ganbateeee S'pore
101587875,47275600,Benny Lee Yeow Loong,Jan-08,"can those whom took the vaccine allows to not wear mask? if yes, i rather stay with mask . kekekeke"
101587875,47275600,Parveena Basheer,Jan-08,which vaccine did he take?
101587875,47275600,Trashman Mkhc,Jan-09,Now let's see the after effects on pinkie!
101587875,47275600,Jerald Loo,Jan-10,"anyone share with me whether we got some kind of reporting system like the US vaccine injury reporting system of the Centers for Disease Control and Prevention (CDC) before mass vaccination so that the singapore public  is aware of the risks, if yes where is the site for me to review the progress?"
101587875,47275600,D Devaraj Devaraj,Jan-09,"He’s already on his last leg in life, inject or not, does it even matter? Bollocks."
101587875,47275600,Roger Tong,Jan-08,PM already took the vaccine. Wonder what is the schedule for the ministers to take the vaccine ?
101587875,47275600,Jagannatha Baragur,Jan-08,Which vaccine is being given in Singapore?
101587875,47275600,Dennis Lim,Jan-08,Wonder any of the expert committees get vaccinated before they start to answer queries about the vaccines? 
101587875,47275600,Jake Tan,Jan-09,Did anyone verify the content in the vial? Did it really contain the vaccine or was it just saline? 
101587875,47275600,Shafrudin Ismail,Jan-08,Rest well singapura in safe hand in the army and forces
101587875,47275600,Sean Ng King Kiat,Jan-14,why vaccination no need to wear glove?
101587875,47275600,Elliot Tham,Jan-08,How do we tell jabbed or not yet jab..indicate on NRIC or passport or issue a vaccine certificate?
101587875,47275600,Fitri MamaRehan,Jan-08,How about demostic worker sir ? Can we have the vaccine too🙏
101587875,47275600,Mindy Tay,Jan-09,Why the nurse didn’t wear gloves?
101587875,47275600,Ewan Arkive Pandora,Jan-08,Sure anot they taking or just antibiotics? 🙈
101587875,47275600,Seah Hong Cheau,Jan-08,少了潮州大锣鼓
101587875,47275600,Somkhit Krasae,Jan-09,PM Lee is the best prime minister in the world. 🙏🙏🙏
101587875,47275600,Eng Chin Ong,Jan-08,"There is a dose of vaccine from China! Now, who's going to take that China vaccine? Lol"
101587875,47275600,Ena Jane,Jan-08,Ju Kasman  pandai suro rakyat amek dulu baru kemudian dia.. hahaha
101587875,47275600,Jonathan Lim,Jan-08,"No glove, is it ok to administer with no protective gear?"
101587875,47275600,Koh Hock Seng,Jan-08,Not wearing gloves 🧤???
101587875,47275600,冼郭翰,Jan-08,nurse not need wear hand glove?
101587875,47275600,Jon Xiong,Jan-09,Seriously. Injecting without gloves!! It’s like doing surgery without gloves. 
101587875,47275600,John Quek,Jan-08,"Agree with many, why nurse did not not wear gloves? I thought it's protocol? https://www.straitstimes.com/singapore/health/nurses-follow-strict-hygiene-protocol-no-reason-to-shun-them-when-in-uniform"
101587875,47275600,Safwan Syazwan,Jan-08,Glove  mana glove?
101587875,47275600,Md Sohel Rana,Jan-08,🤩🤩 when is my turn?  Excited to have it.
101587875,47275600,Jimmy Beany,Jan-08,Where is the dengue vaccine??? Plague is for years. And with the rainy season. It will get worse as mosquitoes breed.
101587875,47275600,December Shan,Jan-08,"Please educate us more on any side effect possibilities or any contraindication, please give us more updates on it. Tks u Sir 🙏"
101587875,47275600,Larisa Nagra Singh,Jan-08,What an interesting exemplary statesman - salute his action.  
101587875,47275600,Robin Yap,Jan-08,Power. Here is to safety and good health
101587875,47275600,Badal Biswas,Jan-08,Hi how are you Singapore government first texting give thank you welcome very nice
101587875,47275600,Raymond Toh,Jan-09,"Ministry of Health, Singapore One thing quite puzzle, why the nurse never wear gloves?"
101587875,47275600,Sukumar Musalaboina,Jan-08,Thanks for boosting the confidence of public .. superb work 👍🏼
101587875,47275600,Osthe Mahme,Jan-08,We salute you sir PM LEE
101587875,47275600,迪神,Jan-08,Good to see as leader of Singapore to get this done first
101587875,47275600,Karri Vinaya Kumar,Jan-08,Sir please we will be screened work permit holders
101587875,47275600,Ravi Kumar,Jan-08,Very impressive Sir . Congrats SG . Always be safe and healthy Sir .
101587875,47275600,Sridhar Koushi,Jan-08,All migrants need vaccine I all we get soon thank u SG
101587875,47275600,Paul Lee,Jan-08,The nurse injected him with vitamins and not vaccine.
101587875,47275600,Mohammed Motiur Rahman,Jan-09,We are eagerly waiting for vaccine in Bangladesh
101587875,47275600,Dave Wong,Jan-08,Proud for Singapore minister 😘 😚 😊
101587875,47275600,Lagmay Luzana,Jan-08,Hope that all OCW  like me have to do vaccination too🙏🙏🙏
101587875,47275600,John Davis,Jan-09,Lead by example
101587875,47275600,Hurayrah Catz,Jan-08,Nurse not wearing gloves.
101587875,47275600,Lita Goepel,Jan-08,Are we gonna received Letter to Opt or not to Opt please adv I am Schedule on Feb 2021 Ref news 
101587875,47275600,Shimul Hasan,Jan-09,very.good.singapore.Thank.you....
101587875,47275600,Sharon Chua,Jan-08,"Other than the healthcare sector and frontline services,  for those taking ""  National Examination this year like, A Levels,  O Levels  students,  University students "" will they be consider first also to take the vaccine? Individual ppl react to the vaccine differently,  is good to take as early as possible before their exam so that it wont affect them during that period. Thank you so much!"
101587875,47275600,Koh Chiew Eng,Jan-08,Real vaccine or just a  Vitamin jab?  🤔 Difficult to believe roti prata guy...!
101587875,47275600,Alizah Madon Dikdi,Jan-08,"Appreciate Goodjob.we""re Singaporean."
101587875,47275600,Frencis Foo Sek Juat,Jan-08,Lead by example ! 帅先士卒! 💪😃
101587875,47275600,Ser Siong,Jan-09,Nurse never wear gloves leh
101587875,47275600,Yi Ge,Jan-08,SINGAPOREAN SAY *THANK YOU *   PRIME MINISTER MR LEE
101587875,47275600,Sadeesha Ranawaka,Jan-09,Very good singapore thank you so much 👍👍👍
101587875,47275600,Kyaw Naing,Jan-08,BRAVO and respected!
101587875,47275600,Dennis Poh,Jan-08,Lead by example 👍
101587875,47275600,Richard Williams,Jan-08,Go Singapore!!
