post_id,,username,date_time,comments_raw
101587649,6325600,Chalermchai Huojaithai,"Dec 30, 2020",I hope the cleaners and other support staff are included. They are exposed to Covid too as they go everywhere in the hospital.
101587649,6325600,Raksha Bhatt Joshi,"Dec 30, 2020",All the best ! They truly deserve to go first! And a big THANK YOU to all healthcare workers and others working with Covid patients.
101587649,6325600,Lyz Pe Smith,"Dec 30, 2020","Thank you Pfizer and to all the nurses, doctors and front line workers"
101587649,6325600,Christopher Devadass,"Dec 30, 2020",SALUTE ALL THE DOCTORS AND NURSES FOR THE GREAT SERVICES. OUR GOVERNMENT IS THE BEST OF ALL. WELL DONE.
101587649,6325600,Shirley Pbl,"Dec 30, 2020","Thank you to all the frontline heroes  Our Government is the Best, Well Done.😊"
101587649,6325600,Debbie Lui,"Dec 30, 2020","TQ to all our health care and front line staff.  Stay safe & keep well 🙏 But I wonder why the person executing the vaccination is not wearing gloves, unlike those in other countries?"
101587649,6325600,Fu Ki,"Dec 30, 2020","we all also dun forget the contact tracers team and the safety ambassadors who worked tirelessly and efficiently  limiting the spread early  before it goes out of hand, their effort also allowed us to be safe until now.  We need to be thankful to them too. "
101587649,6325600,Katrina Sindayen,"Dec 30, 2020",God bless and guide us all. I hope this vaccine doesnt have bad side effects to humans
101587649,6325600,Jubbar Hasanjibon,"Dec 30, 2020",Salute all Singaporean nurses and healthcare salute Singapore government thank you for all Singaporean
101587649,6325600,Robert Santos,Jan-01,"Hope Air Crew will be included in the priority list, as they are actually frontliners as well!  Even before hospital staff face infected patients, they have already been with these people, onboard!  Otherwise, there will be community case!  #Vaccinationforaircrew  🙏🏻"
101587649,6325600,Lu Lu,"Dec 30, 2020",Great! Maybe next should priortize the vulnerable and then also the families of these healthcare workers. They have also played an indirect but very important role in supporting our healthcare workers through the difficult times. 
101587649,6325600,Lok Lin Siew,"Dec 30, 2020",Thank you to the frontline heroes
101587649,6325600,Zakaria Zahidul Hasan,"Dec 30, 2020","VACCINE When can get EXPAT/NON RESIDENT person ? Great Singapore, great government. I'm proud,I'm working here in Singapore."
101587649,6325600,Mohika Khosla,"Dec 30, 2020",Best news so far. Well done Singapore. It is wonderful to see how it is priortised with our front line workers first 😃🤗
101587649,6325600,Daria Levashova,"Dec 30, 2020",Please keep ppl updating about their health and feeling after vaccination including any reactions or side effects ! 🙏👍
101587649,6325600,Paul Sam,"Dec 30, 2020",All pics seems like a pose to me...syringe needle are well covered by the health personnel during injection and no gloves...hmmm..
101587649,6325600,Dennis Oh,"Dec 30, 2020",I thought our PM will be the first to take it.
101587649,6325600,Kana Sai,"Dec 30, 2020",Pls do not forget our million paid ministers. We need them most to lead the nation forward.  They are the world best. 
101587649,6325600,Chweeseng Lim,"Dec 30, 2020","All Nurses, Healthcare workers are Heroes of the day. My Salute.  Where are the Papigs.???? Scared to death.???"
101587649,6325600,Raji Lakshmanan,"Dec 30, 2020",Thank you very much to all  who are risking Covid-19 infections and their hard works to keep peoples in Singapore healthy and safe. 🙏
101587649,6325600,John Ng,"Dec 30, 2020",Now then I know glove is no more a protocol to prevent blood borne diseases?...
101587649,6325600,黄加發,"Dec 30, 2020",Salute to those frontier for being the first to be in this vaccination exercise. 
101587649,6325600,Chen Chang,"Dec 30, 2020",Our appreciation to all health care staff from the very juniors to the seniors. We salute you all to take the lead.
101587649,6325600,Eunice Lim,"Dec 30, 2020",why our PM not taking the vaccine yet?
101587649,6325600,Koh Chiew Eng,"Dec 30, 2020","PM LHL and Health Minister Gan should be the first two to take the vaccine. Instead both are ""missing"" !"
101587649,6325600,Sharon Pema Yeshe,"Dec 30, 2020","Beside A Big Thanks to all health care and support team, we salute to you angels who had made immense sacrifices for all of us, keeping us safe. May we wish you healthy and lots of blessings 🙏🙏🙏"
101587649,6325600,Teo Choo Mee,"Dec 31, 2020","Thanks to all healthcare workers. My sister is very well taken care by the SNM Yishun. Thanks to all of the staffs in the SNM Yishun. Thanks to Social Worker Miss Kalaiselvi for being so friendly, caring and helpful. I myself have three children. My two children are still schooling and my third child is serving his NS. Many thanks to our Angels helping hands . Happy New Year to MOH. Happy New Year 2021 to everyone.  I wish Singapore a better tomorrow. Singapore, please stay healthy and be happy. 👍😊😄🥰"
101587649,6325600,Audrey Yeo,"Dec 31, 2020",Why are the injections being administered with bare hands?  Is it not SOP for gloves to be worn and replaced with new ones for every jab given?
101587649,6325600,Roland Seet,"Dec 30, 2020","Salute to all front line staffs, especially the medical staffs. You all are in this pandemics, standing tall in the whole of Singapore."
101587649,6325600,Renu Naveen Agrawal,"Dec 30, 2020",Salute to all front line workers. Special salute who took first batch of vaccine and showed confidence. Hat's off you guys.
101587649,6325600,Christine Issac,"Dec 30, 2020",Hope all are safe & why are the ones giving the vaccine not wearing gloves? Just wondering
101587649,6325600,Bryan TriggerFingers,"Dec 30, 2020",Shouldnt the task force lead by example and be the 1st???? Not these frontliners who have already risked so much???
101587649,6325600,Julian Tasis,"Dec 30, 2020",Kudos to our healthcare workers! kudos to Singapore. Keep safe everyone! 
101587649,6325600,Wayne Tong,"Dec 30, 2020",Have our ministers took the vaccines already as they said they would?
101587649,6325600,Siew Hoon,"Dec 30, 2020",Why the medical personnel that give the injection did not wear glove?
101587649,6325600,William Chan,"Dec 30, 2020",Has our PM taken his jab yet? 
101587649,6325600,Wilson Wang,"Dec 30, 2020",y not the minister of health Mr Gan be the first to inject? Lead by example....
101587649,6325600,Billy Seah,"Dec 30, 2020",Tot cabinet ministers and pm take earlier? Where are they now? Hmmm
101587649,6325600,Chia Cheok Choong,Jan-02,"To my knowledge vaccine can protect oneself but cannot prevent infections and transmissions. After this year 2021 of mass vaccination in the whole world I believe the covid 19 virus will spread like common flu and will be airborne all over the world, those that had not vaccinated will get the sickness and new born too will need to be vaccinated if no antibodies found in them. One unsure thing about the vaccines is what are the consequences after vaccination in the long term future one lives???"
101587649,6325600,Hammie Zul,"Dec 30, 2020","how about us that worked & sacrifice our lifes during spore orange to red alert , lockdown era ..circuit breaker and till now..Are we eligibles for the first batch vaccines operation  process. we are working while others stayed at home..pls look forward for my feedback to whom it may concerns."
101587649,6325600,Velmurugan Mariappan,"Dec 30, 2020",Thanks to all Heath sector personals for standing in first row to defeat COVID 
101587649,6325600,Tony Brough,"Dec 31, 2020",You now have the Oxford vaccine to consider . You seem to have things organized. 
101587649,6325600,Sudir Rohani,"Dec 30, 2020",Congrats and thank you Nurse Sarah to be the first for the vaccination. Blessings to all frontliners.You are important to all.
101587649,6325600,Koh Felix,"Dec 30, 2020",I thought Is mp first?
101587649,6325600,Dave Tung,"Dec 30, 2020",Ministers not taking vaccines ah?
101587649,6325600,Sushila Patel,"Dec 31, 2020","Thank you to all front liners/ health care aiders for taking care with dedications and courage. You must be protected, be safe and healthy. Cheers to all of you."
101587649,6325600,Leslie Joseph,"Dec 30, 2020",Excuse me why so slack . No gloves no apron and no proper handling of the vaccine . MOH standard drop a lot .???
101587649,6325600,Selma Gomez,"Dec 30, 2020",Please wear gloves when doing vaccine.
101587649,6325600,Kumar Sugumaran,"Dec 30, 2020","So are you going to wait until everyone is vaccinated, then u plan to open the borders for Malaysian workers to commute daily?"
101587649,6325600,Lim FH,"Dec 30, 2020",I wish the 30 best of health. Stay strong 
101587649,6325600,Cindy Kok,"Dec 31, 2020",Why isn’t he gloved while giving the vaccine? Is that standard protocol?
101587649,6325600,Dimitry Minnelli,"Dec 30, 2020",Wheres our MILLIONS DOLLAR LEADERS? Aren't they suppose to Lead ?
101587649,6325600,Kiap Kiap,"Dec 30, 2020","Key is, those who are vaccinated,  do they need to be tested for  Covid19 in future? What happens if they are tested positive after being vaccinated?"
101587649,6325600,Robin Rheaume,"Dec 31, 2020",It's worth pointing out in the description that they got the  Pfizer-BioNTech vaccine.
101587649,6325600,Andy Woo,"Dec 30, 2020",I thought pinky say he will take? When will the TV board cast?
101587649,6325600,Shasha Alkaff,"Dec 30, 2020",Lets ask all the PRIME MINISTERS ALL THE POLITICS PEOPLE TO BE VACCINE FIRST..THEY SHOULD BE VACCINE FIRST PRIORITY !!THEN ONLY OTHER CITIZENZ WHO WISH TO BE VACCINE
101587649,6325600,Richard Kong,"Dec 30, 2020",Think should wear gloves 🧤 to administer injection !!! 
101587649,6325600,Jervis Ching,"Dec 30, 2020","Why the person who performed the injection didn't wear gloves?? I rmber the doctor/nurse will always wear gloves when I take the injection, draw blood... Stay safe and healthy everyone"
101587649,6325600,Chua Chwee Tah,"Dec 31, 2020","Don't happy too fast ,u guys will know the outcome after 7days ,good luck"
101587649,6325600,Ron Leo,"Dec 30, 2020",why not the leaders 1st?
101587649,6325600,Tenzin Khoo,Jan-06,"Any frontliners who have fallen seriously ill after taking the jab should not just assume it is just a bad side effect or coincidence. Share your account with the people. They deserve to know the truth. Any related deaths should be reported promptly, as with what is happening in other countries. "
101587649,6325600,Dain Plamparambil,"Dec 30, 2020",Looks like she is having pain while on on the vaccine. 🤔🤔🤔
101587649,6325600,Catherine Teng,"Dec 30, 2020","Before and now, your bravery's priceless."
101587649,6325600,Cristina Roldan,"Dec 30, 2020",Injecting no gloves?
101587649,6325600,Neetu Chopra,"Dec 30, 2020",Thanks to all frontline workers and government who  r taking good care of us . Big salute 🙏🏻
101587649,6325600,Chris Ong,"Dec 31, 2020",Tot giving jab should wear Gloves to Protect?
101587649,6325600,Gary Tan,"Dec 30, 2020",Okay so my turn is around 2021? Hope covid mutated not spreading in sg. If not need take multiple jabs liao
101587649,6325600,Geraldine Straten-Tham,"Dec 30, 2020",How come no gloves on??
101587649,6325600,Lee Charmaine SF,"Dec 30, 2020",Really admire their adventurous spirit 😜 as they have not assessed whether they are suitable or not esp if they are on medications that might inflict conflict of interest or detrimental to their health. Hope it is a vaccinne is suitable for everyone across the board
101587649,6325600,Lum Steven,"Dec 31, 2020",Was it voluntary or through a balloting system?
101587649,6325600,Patulayin David Janet,Jan-17,what brand of vaccine is approved in singapore
101587649,6325600,Kwan Franck,"Dec 31, 2020",Hope there no other side effect after the vaccine n got the covid 19
101587649,6325600,Shasha Alkaff,"Dec 30, 2020",Will they be showing us what happens after the vaccines?just curious to know abt this vaccines..ever heard abt vaccine being done to a human live video..at first she says shes ok..but then she faint..n they end their live videos not known what happen to her..is she alive or anything..
101587649,6325600,Govind Raj,"Dec 31, 2020",வாழ்த்துக்கள் சிங்கப்பூர் Minister ஐயா
101587649,6325600,Christine Lim,"Dec 30, 2020","I Salute , Congratulations Singapore 🇸🇬 All Wishes a very best 2021."
101587649,6325600,Wendy Ong,"Dec 30, 2020","Cannot understand, everything turns sour on fb?"
101587649,6325600,Tony Chua,"Dec 30, 2020",Thank you to all FRONTLINE WORKERS for all the hard work to keep Singapore safe. 
101587649,6325600,AmeShinra Steve Shin,"Dec 30, 2020",Good point how come no wear gloves???
101587649,6325600,Zlata Rege,"Dec 30, 2020",How long the vaccine effect last? What are side effects? 
101587649,6325600,Cathy Foong,"Dec 30, 2020",Thank you for all your hard work and care during this difficult times. Stay safe and Jia you!!
101587649,6325600,Bryan Mic,"Dec 30, 2020",Y never wear glove? 
101587649,6325600,Andrew Toh,Jan-02,Will there be restrictions for those who do not get vaccinated?
101587649,6325600,Nelson Lee,"Dec 30, 2020",Thanks to all frontline staffs. Best wishes 
101587649,6325600,Wilson Yys,"Dec 30, 2020",Is our insurance covered in case of any mishaps? 
101587649,6325600,Chan Yew Tuck,"Dec 31, 2020",Bravo to ALL the Frontline helper & medical staffs for your wonderful contribution & time   🙏😎😊🍮
101587649,6325600,Lester Ng,"Dec 30, 2020",Salute to all doctors nurses and front line workers!!! WISHING EVERYONE A HAPPY NEW YEAR!!!
101587649,6325600,Sagaiyamary David,"Dec 30, 2020",I am happy that all Singaporeans get the vaccination  free. Thank you Singapore.
101587649,6325600,Ang Eng Huat,"Dec 30, 2020",I thought our mp will get first...🤔🤔
101587649,6325600,Agnes Lim,"Dec 30, 2020",Thanks to ALL Frontline healthcare personnel 
101587649,6325600,Joe Power,Jan-05,"I think the govt shd check how many imports from china. If non, might as well open to them correct? Big market tourist. MOH shd work closely with China MOH.😎"
101587649,6325600,Kat Tree,"Dec 30, 2020","It wasn’t mentioned, just wondering, is antibodies test done prior to exclude people who do not need vaccinations? "
101587649,6325600,வெ. கார்த்திகேயன்,"Dec 30, 2020","Thank you Nurse Sarah to be the first person for the Covid vaccination and all the Health care persons, Thanks to NCID...  SINGAPORE IS THE FIRST ASIAN COUNTRY start Vaccination...  Great Singapore   Lot of Love"
101587649,6325600,Woo Woo,"Dec 31, 2020",Did we have a choice to choose to use which country? 
101587649,6325600,Chenito Gayongorsa Becaoco,"Dec 30, 2020","Salute all nurses,doctors and frontliners"
101587649,6325600,Deepti Karki,"Dec 30, 2020",Reading this gave me goosebumps. Salute to all frontline workers.
101587649,6325600,Sally Ming Chin Lee,Jan-08,Is this fake new?
101587649,6325600,John Lee YL,"Dec 31, 2020",Happy that our frontline workers are put at the front of the line to get vaccinated! Stay safe! 
101587649,6325600,Fred Oon Kian Chua,"Dec 30, 2020",Hi which vaccine are we taking ? 
101587649,6325600,Johnson Tan,"Dec 30, 2020",Thank you to our healthcare workers. You guys are the best!!
101587649,6325600,Steven Junior,"Dec 30, 2020",why never wear gloves?
101587649,6325600,Utty Soekamto,"Dec 31, 2020",Deep respect and appreciation for all health care heroes. Please always stay safe ⚘⚘💫💫🙏🏻🙏🏻
101587649,6325600,Joseph Fong,"Dec 30, 2020","A horrible 2020, but without these frontliners, we as a country, won’t be where we are now.  Thank you 🙏 all. Onwards to a better 2021! "
101587649,6325600,Logan Lau,"Dec 31, 2020",Thank you to all Healthcare and front line staffs.  🙏😊
101587649,6325600,Eni Yuliza,"Dec 30, 2020",Happy for pro-active measure our government does to keep Singapore safe. Salute.
101587649,6325600,Kelly Chong,"Dec 30, 2020",Salute to all the frontline heroes👍
101587649,6325600,Philip Tan,"Dec 31, 2020",Best wishes to all the frontliners.  We salute you!!
101587649,6325600,Stanic Ng,"Dec 30, 2020",Not wearing gloves when vaccination?
101587649,6325600,Joshua Alexis,"Dec 30, 2020",Strange ..no gloves on ?? Holding the needle sides  with his fingers while pulling it out? Hmmm
101587649,6325600,Ivan Shim,"Dec 30, 2020",Thank you MOH ! You’ve always made the best decisions. :)
101587649,6325600,Cheapo CK,"Dec 30, 2020",Again! Why nobody wearing gloves when administering the vaccine?
101587649,6325600,Mazz Hassan,"Dec 30, 2020",Any side effect for the baby in the womb if take the vaccines?
101587649,6325600,Catherine Quek,"Dec 30, 2020",Thank you all the front line hero’s for keeping us safe! Stay safe and take care!
101587649,6325600,Zi Kai Long,"Dec 30, 2020",Best wishes and thank you all health care personnel at NCID
101587649,6325600,Kim Thiam Tay,"Dec 31, 2020",Salute and thanks to all the health care heroes
101587649,6325600,Glenda Leong,"Dec 31, 2020",Thank you for your dedication and bravery! Amen!
101587649,6325600,Cynthia Milah Andrew Epit,Jan-01,Hopefully  no side effects of vaccination 🙏🙏🙏
101587649,6325600,Ayleh Kaliska,Jan-01,Smiling without vaccine 
101587649,6325600,Cividn Neo,"Dec 30, 2020",Are they Singaporean?
101587649,6325600,Gurdeep Singh,"Dec 30, 2020",Million salutes to our frontline workers.... 
101587649,6325600,Mag Lye,"Dec 30, 2020",All the best and thank you for being in the frontline.❤️
101587649,6325600,Sam Guo,"Dec 30, 2020","Front line heroes, thank you so much."
101587649,6325600,Kenneth Shaun Chew,"Dec 30, 2020","thank you.  for your bravery, sacrifice, hardwork"
101587649,6325600,Benjie Mangotara,"Dec 30, 2020",Congratulations to all Singapore MOH staff . 
101587649,6325600,Mary Gomez,"Dec 30, 2020",Thought our Ministers will be the first to take 🤔
101587649,6325600,Vincent Tan,"Dec 31, 2020",Your good work will be rewarded. Stay safe and healthy always.
101587649,6325600,Looi Yew Kean,"Dec 31, 2020",Thank You 🙏 You all are the leaders  and heroes...
101587649,6325600,Roy Tang,"Dec 30, 2020",Should also prioritise our political leaders first. 
101587649,6325600,Ethan Buffet,"Dec 30, 2020",Hi Nurse Sarah.... we appreciate for your update 3 days after the vaccine. So all of us can share the outcome. Thanks
101587649,6325600,Tee Dan,"Dec 30, 2020",No need wear gloves to do injection? 
101587649,6325600,Mirazol Apil Labrador,"Dec 30, 2020",Salute to the government for the appreciation to the frontliners.. Godbless
101587649,6325600,Johan Jazzmen,"Dec 30, 2020",The REAL HEROES!
101587649,6325600,Kelvin Chin,"Dec 30, 2020",Salute to all healthcare personal.. 👍👍👍🙏🙏🙏
101587649,6325600,Jeremie Seah,"Dec 30, 2020",Are we shortage of gloves 🧤🧐
101587649,6325600,Dave Kok,"Dec 30, 2020",Thank you nurses at the battle front. Always grateful Low Eve 
101587649,6325600,Swapan Chandra,"Dec 31, 2020",best of luck eveyone..thank you so much Singapore
101587649,6325600,Xm Gaming,"Dec 31, 2020",Health care workers are the most heroic people ever in history
101587649,6325600,Marissa Ubando,"Dec 30, 2020",Thnk u Singapore we are so very happy I hope we can vaccine as also
101587649,6325600,Hoven Tan,"Dec 31, 2020",BONE : Best Of Nurses Existence.  You are everyone Best.
101587649,6325600,Indra Zareen,"Dec 31, 2020",Faces of unsung heroes
101587649,6325600,Dyla MD,"Dec 30, 2020",May they be in the best of health.
101587649,6325600,Aditi Das Chakravorty,"Dec 30, 2020","Lovely, the best piece of information in some time"
101587649,6325600,Mila Zane,"Dec 30, 2020",Haliluyah! Way to go Singapore!!💪
101587649,6325600,Sy Faith,"Dec 30, 2020",Millions Thanks to all front line staff!
101587649,6325600,David Li,"Dec 30, 2020",Saw another Facebook post by Joe Biden on Kamala Harris’ vaccination 💉 
101587649,6325600,Fong Kok Weng,"Dec 30, 2020",Thank you to our HCW!
101587649,6325600,Masud Rana Rana,"Dec 30, 2020",I'm from Bangladesh thanks to you mr lee Sir coz health work's is real hero so much tham fast
101587649,6325600,Nic Quay,"Dec 30, 2020",Salute to all the staff and nurses of NCID 👍👍👍
101587649,6325600,Olivia Dianso,"Dec 30, 2020",I will take vaccine after 5 years.
101587649,6325600,Kerwin Mugar Quinquilleria,"Dec 30, 2020",Don gloves please🤔
101587649,6325600,Victor Neo,"Dec 30, 2020",I thought PM going to be the first to take
101587649,6325600,Tay Jerry,"Dec 30, 2020",The “turn” begins
101587649,6325600,Phoebeta Tauri,"Dec 30, 2020",Give them a big pay raise!
101587649,6325600,David Lee,"Dec 30, 2020",Sarah Lim your face is going to be on the media n it may become the talk of the town as you are the first to get vaccinated.
101587649,6325600,Marilou Estacio Estacio,"Dec 30, 2020",Thank you singapore
101587649,6325600,Mefnh Sagitrrius,"Dec 30, 2020",MIW first laaaaa.... show solidarity in the face of pandemic
101587649,6325600,Mildred Liu,"Dec 31, 2020",I thought the 1st batch suppose to be all the ministers. They shud test out 1st ma hehehehe...
101587649,6325600,Md Roni,"Dec 30, 2020",Well done Singapore MOH
101587649,6325600,Chong Martin,"Dec 30, 2020","Why is it not the hospitals and the top management of the Ministry of Health who take the lead in vaccinating? To make people confident, is it not the leader who takes the lead in demonstrating?"
101587649,6325600,Magnolia Salcedo Zoleta,"Dec 31, 2020","Thank you for ensuring that healthcare professionals and front-liners are prioritized first. Kudos, Singapore! 👍😍👍"
101587649,6325600,Kelvin Tong,"Dec 30, 2020",Thank you front liners.... 
101587649,6325600,Joe Power,"Dec 30, 2020",Can Sg travel once majority vaccinated? Still need quarantine when coming back? Roll out  or completion plan to get all vaccinated? Or target time?😉
101587649,6325600,Ajgar Ali,"Dec 30, 2020",Vaccine can give dormatoy man
101587649,6325600,Muhammad Rajib,"Dec 30, 2020","Please give to dormitory worker ASAP, because every 14 days swab test isn't that simple!"
101587649,6325600,Abu Bakkar,"Dec 30, 2020",Thanks Singapore government.
101587649,6325600,Francis Tan Fan Sei,"Dec 30, 2020",kudos to all who volunteered for this experimental RNA vaccine technology deployed for the first time in human history.   https://www.channelnewsasia.com/news/world/covid-19-vaccine-pfizer-swiss-dies-coronavirus-13866818  pray that this is un-related. 🙏
101587649,6325600,Govin Chettri,Jan-01,Thank you so much mam for the vaccination test. And the healthcare workers NCID.
101587649,6325600,John Pang,"Dec 30, 2020","Singapore, keep is up👏"
101587649,6325600,Siti Fatimah,"Dec 31, 2020",Omg 😆...huhuhu
101587649,6325600,Andrew Ting,"Dec 30, 2020",Vaccination should be rolled out concurrently to all the critical groups instead of one after another. Otherwise it will take years to complete the vaccination if not done this way. 
101587649,6325600,Tina Canonoy Tibon,"Dec 30, 2020",I hope all workers should be vaccinated esp.frontliners and construction workers my husband working in China construction
101587649,6325600,Jimmy Teo,"Dec 30, 2020",Singaporeans will be able to get vaccinated by end 2021.....
101587649,6325600,Eugene Chan,"Dec 30, 2020",Why guy injection for girl ??? Later ganna molested !!! ICE CREAM nv wear gloves someone.. Power La! VIRUS MANY MANY!!!
101587649,6325600,Nestor Apil,"Dec 30, 2020",Yan ang government. Priority dapat ang mga frontliners.
101587649,6325600,JoJo Loh,"Dec 30, 2020",I heard there's side effects
101587649,6325600,Robert Robert,"Dec 31, 2020","We also don't forget the safe distance , safe entry ambassador. "
101587649,6325600,Adrienne Pereira,"Dec 30, 2020",No gloves??
101587649,6325600,William Chuah,"Dec 30, 2020",Pls tell us how u feel after injection so everybody can take cautious.
101587649,6325600,Marilyn Camarillo,"Dec 31, 2020",never used glove
101587649,6325600,Mylene Diaz,"Dec 30, 2020",Thank u lord at my vaccine na dito..sn sa pinas meron na rin
101587649,6325600,Daniel J. Long,"Dec 30, 2020",😱 what??!! Only by the end of 2021???
101587649,6325600,Dung Thaikhac,Jan-06,Khoảng khi mô là đến lượt mình
101587649,6325600,Mrb Razib,"Dec 30, 2020",Alhamdulillah. Thanks a lot Singapore prime minister
101587649,6325600,Xm Gaming,"Dec 31, 2020",In sars and covid
101587649,6325600,Tiên Khang,"Dec 30, 2020",Tiêm cho mũi với Singapore ơi
101587649,6325600,Lucy Chua,"Dec 31, 2020",Great n well done  I tot our ministries should be the first to  vaccine likes others countries
101587649,6325600,Thng Felix,"Dec 30, 2020",My ball shrink
101587649,6325600,Jackie Lim,"Dec 30, 2020",Injunction with no glove?
101587649,6325600,Raquel Machado,Jan-02,Qual delas ?
101587649,6325600,Tony Keng Hong Tan,Jan-05,Real?
101587649,6325600,Gregory Ong,"Dec 30, 2020",No glove use !!!! 🤦‍♂️
101587649,6325600,Teh Garett,"Dec 30, 2020",I have blocked fake news from MOH. Why still receiving?
101587649,6325600,Dan Lin,"Dec 31, 2020",It should be two dosages🤔..
101587649,6325600,Nktv Kosh,"Dec 31, 2020",Corona virus vaccine killed my brother in less than 48 hours. Watch out!
101587649,6325600,Merlie Rubaton,"Dec 30, 2020",Gloves? Cyril Franz Magbanua 
101587649,6325600,黄献固,"Dec 30, 2020",不用放出來让人看的，收回吧？
